precio;sub_descr;href;ubicacion;habitaciones;banios;mt2;planta;otros;latitude;longitude
1.700 €/mes;Piso en Centro;/alquilar/piso-justicia_chueca28004-42522570794_101800/;Justicia-Chueca (Distrito Centro. Madrid Capital);2 habs.;1 baño;106 m²;5ª planta;Engel & völkers les presenta en alquiler este hermoso ático dúplex  de 106 m² en su primera planta, ubicado en el corazón del barr...;40.4214014;-3.6996794
2.800 €/mes;Piso en Castilla;/alquilar/piso-castilla28036-42523633182_500093/;Castilla (Distrito Chamartín. Madrid Capital);4 habs.;3 baños;194 m²;1ª planta;"Ref: 108902

Disponible desde el 01 de abril 2024

Inmueble en alquiler con superficie de 194m², muy luminoso. Planta 1ra, exterio...";40.4703439;-3.6819012
2.400 €/mes;Piso en calle de Juan de Urbieta;/alquilar/piso-nino_jesus28007-42524788899_101800/;Niño Jesús (Distrito Retiro. Madrid Capital);3 habs.;2 baños;128 m²;1ª planta;Engel & völkers presenta esta preciosa propiedad ubicada en el barrio niño jesús del retiro, en una zona tranquila y silenciosa, p...;40.4104176;-3.6729798
1.650 €/mes;Piso en Chamberi;/alquilar/piso-rios_rosas28003-41702757789_101800/;Ríos Rosas (Distrito Chamberí. Madrid Capital);2 habs.;1 baño;68 m²;3ª planta;Engel and völkers presenta este estupendo piso en la calle ponzano en chamberí. La vivienda se encuentra en la tercera planta de u...;40.4407878;-3.6989327
4.300 €/mes;Ático en Arturo Soria-Ciudad Lineal;/alquilar/atico-costillares-41694934416_101800/;Costillares (Distrito Ciudad Lineal. Madrid Capital);5 habs.;4 baños;317 m²;;Engel & völkers presenta este  maravilloso, luminoso y amplio piso ubicado en el barrio arturo soria.  Cuenta con un hall de entra...;40.4741273;-3.6676308
980 €/mes;Piso en Canillejas;/alquilar/piso-san_blas_canillejas28022-41760665791_101800/;Canillejas (Distrito San Blas. Madrid Capital);1 hab.;1 baño;35 m²;Bajo;"Ref: 108361

Disponible desde ya

Piso en alquiler con superficie de 35m², muy luminoso. Planta baja, exterior con orientacion sur...";40.4385662;-3.6107206
2.000 €/mes;Piso en Ríos Rosas;/alquilar/piso-rios_rosas28003-41679793481_100500/;Ríos Rosas (Distrito Chamberí. Madrid Capital);1 hab.;1 baño;62 m²;1ª planta;"La inmobiliaria internacional cpm gestiona este estupendo y luminoso piso amueblado, de 62 m², 1 habitación y 3 balcones; próximo ...";40.4446433;-3.6977399
1.500 €/mes;Ático en San Fermín;/alquilar/atico-san_fermin-42517077409_100500/;San Fermín (Distrito Usera. Madrid Capital);3 habs.;2 baños;142 m²;;La inmobiliaria internacional cpm gestiona este estupendo y luminoso ático totalmente amueblado, de 142 m², 3 habitaciones y terra...;40.368278;-3.6865289
850 €/mes;Piso en Retiro;/alquilar/piso-ibiza28009-42594602634_108900/;Ibiza (Distrito Retiro. Madrid Capital);1 hab.;1 baño;40 m²;;Piso reformado de 40 m² distribuido en 1 dormitorio, cocina amueblada y equipada, salón y 1 baño y sin amueblar. Finca con ascenso...;40.4190187;-3.6763929
1.700 €/mes;Piso en Castilla;/alquilar/piso-castilla28034-42516680755_500093/;Castilla (Distrito Chamartín. Madrid Capital);2 habs.;2 baños;118 m²;5ª planta;"Ref: 109256

Disponible desde el 01 de mayo 2024

Fantastico piso en alquiler con superficie de 118m², muy luminoso. Planta 5ta, e...";40.498097218;-3.709739822
4.400 €/mes;Piso en Sol;/alquilar/piso-tetuan_cuatro_caminos28020-39211689499_102100/;Cuatro Caminos (Distrito Tetuán. Madrid Capital);2 habs.;2 baños;250 m²;;Piso en sol de 250 m², 2 dormitorios, 2 baños, exterior, muy luminoso, 1 plaza de garaje  características:  calefacción: suelo rad...;40.4822186;-3.6836635
4.000 €/mes;Dúplex en Chamartin;/alquilar/duplex-nueva_espana28036-40880042493_101800/;Nueva España (Distrito Chamartín. Madrid Capital);2 habs.;3 baños;95 m²;4ª planta;Engel & völkers presenta este espectacular ático dúplex de diseño, con reforma a estrenar, en zona residencial de nueva españa, ro...;40.4637046;-3.6802072
1.600 €/mes;Dúplex en Valdeacederas;/alquilar/duplex-valdeacederas28039-40035919244_100500/;Valdeacederas (Distrito Tetuán. Madrid Capital);2 habs.;2 baños;80 m²;;"La inmobiliaria internacional cpm gestiona este magnífico y luminoso dúplex amueblado de 80 m², 2 habitaciones y patio; próximo al...";40.4656155;-3.7023052
3.500 €/mes;Piso en Arturo Soria-Ciudad Lineal;/alquilar/piso-concepcion-41751211005_101800/;Concepción (Distrito Ciudad Lineal. Madrid Capital);3 habs.;3 baños;165 m²;1ª planta;Engel & völkers presenta este luminoso piso situado en concepción (un oasis de tranquilidad) en la primera planta de esta finca. L...;40.443888463;-3.641202175
1.250 €/mes;Estudio en Almagro;/alquilar/estudio-chamberi_almagro28010-41748424111_500093/;Almagro (Distrito Chamberí. Madrid Capital);1 hab.;1 baño;40 m²;;"Ref: 108181

Disponible desde ya

Estudio en alquiler con superficie de 40m², muy luminoso., exterior

La vivienda se entrega amue...";40.4338244;-3.6933872
4.900 €/mes;Piso en Centro;/alquilar/piso-sol_barrio28014-38413233372_101800/;Sol (Distrito Centro. Madrid Capital);3 habs.;2 baños;224 m²;;Engel & völkers presenta este precioso apartamento en el madrid de los austrias, un piso elegante de 200 m² en un edificio del sig...;40.4165525;-3.7007931
2.000 €/mes;Ático en Justicia-Chueca;/alquilar/atico-justicia_chueca28004-41742605199_100200/;Justicia-Chueca (Distrito Centro. Madrid Capital);;2 baños;125 m²;;Agencia inmobiliaria de madrid-tecnocasa consulting estudio tribunal, alquila magnifico ático en el corazón de madrid, en la calle...;40.4223454;-3.7007714
1.305 €/mes;Piso en Piovera;/alquilar/piso-piovera28043-40854144759_108900/;Piovera (Distrito Hortaleza. Madrid Capital);1 hab.;;67 m²;4ª planta;¡Alta de suministros gratis! Disfruta de tu hogar desde el primer momento, testa home te ayuda en la gestión del alta de suministr...;40.4590502;-3.6235705
1.900 €/mes;Piso en Lista;/alquilar/piso-lista_barrio28006-41732355342_101800/;Lista (Distrito Salamanca. Madrid Capital);4 habs.;1 baño;99 m²;3ª planta;"Ref: 108365

Disponible desde ya

Piso en alquiler con superficie de 99m². Planta 3ra con orientacion este

La vivienda se entrega...";40.4311106;-3.6780077
1.400 €/mes;Piso en Virgen del Cortijo-Manoteras;/alquilar/piso-virgen_del_cortijo_manoteras28050-42558734850_500093/;Virgen del Cortijo-Manoteras (Distrito Hortaleza. Madrid Capital);2 habs.;2 baños;78 m²;1ª planta;"Ref: 108938

Disponible desde ya

Fantastico piso en alquiler con superficie de 78m². Planta 1ra

La vivienda se entrega amueblada...";40.4888473;-3.6684476
1.300 €/mes;Piso en Universidad-Malasaña;/alquilar/piso-universidad_malasana28015-42567879238_500093/;Universidad-Malasaña (Distrito Centro. Madrid Capital);1 hab.;1 baño;75 m²;1ª planta;"Ref: 109036

Disponible desde ya

Inmueble en alquiler con superficie de 75m². Planta 1ra con orientacion oeste

La vivienda se en...";40.4285314;-3.7080206
3.450 €/mes;Piso en Salamanca;/alquilar/piso-lista_barrio28006-41740532107_101800/;Lista (Distrito Salamanca. Madrid Capital);4 habs.;3 baños;140 m²;;Engel & völkers presenta este exclusivo piso de excelente ubicación situado a 100 metros de la plaza del marqués de salamanca. Est...;40.4311106;-3.6780077
1.400 €/mes;Piso en Avenida de Niceto Alcalá Zamora;/alquilar/piso-sanchinarro28050-40868441346_100500/;Sanchinarro (Distrito Hortaleza. Madrid Capital);2 habs.;2 baños;70 m²;2ª planta;Piso amueblado o vacío con 20 m² de terraza y garaje incluido en el precio en urbanización con piscina, 2 dormitorios (antes 3) y ...;40.489164519;-3.646434781
2.500 €/mes;Piso en Prosperidad;/alquilar/piso-chamartin_prosperidad28002-42583873376_500093/;Prosperidad (Distrito Chamartín. Madrid Capital);2 habs.;2 baños;64 m²;1ª planta;"Ref: 108813

Disponible desde ya

Piso en alquiler con superficie de 64m², muy luminoso. Planta 1ra, exterior con orientacion sur
...";40.4393823;-3.6733612
3.300 €/mes;Piso en Centro;/alquilar/piso-justicia_chueca28004-42583173065_101800/;Justicia-Chueca (Distrito Centro. Madrid Capital);2 habs.;2 baños;167 m²;4ª planta;Engel & völkers presenta este ático dúplex lleno de carácter y espacio en pleno centro de madrid, en el barrio de chueca. Está sit...;40.4211956;-3.7010782
850 €/mes;Apartamento en Centro;/alquilar/apartamento-centro_embajadores_lavapies28012-42593742180_101800/;Embajadores-Lavapiés (Distrito Centro. Madrid Capital);1 hab.;1 baño;34 m²;1ª planta;***disponibilidad abril*** engel & völkers presenta este confortable y luminoso inmueble tipo estudio en el distrito centro de la ...;40.4112333;-3.7001502
1.390 €/mes;Piso en calle de las Magnolias;/alquilar/piso-tetuan_almenara28029-42503308157_100500/;Almenara (Distrito Tetuán. Madrid Capital);2 habs.;2 baños;79 m²;6ª planta;Si buscas un piso en la zona norte de madrid, excelentemente comunicado, con todo tipo de servicios cerca y con unas inmejorables ...;40.4742666;-3.6891561
1.800 €/mes;Piso en calle de la Palma, 31;/alquilar/piso-universidad_malasana28004-41741087008_109800/;Universidad-Malasaña (Distrito Centro. Madrid Capital);1 hab.;1 baño;55 m²;2ª planta;"Vivienda y plaza de garaje en la misma finca.

Preciosa vivienda exterior con salón en esquina y con cuatro balcones a la calle, m...";40.42628;-3.7040684
1.490 €/mes;Piso en Colina;/alquilar/piso-ciudad_lineal_colina28043-42503929469_500093/;Colina (Distrito Ciudad Lineal. Madrid Capital);1 hab.;2 baños;125 m²;3ª planta;"Ref: 109155

Disponible desde el 01 de abril 2024

Piso en alquiler con superficie de 125m², muy luminoso. Planta 3ra, exterior co...";40.4549565;-3.6587188
1.800 €/mes;Piso en Justicia-Chueca;/alquilar/piso-justicia_chueca28004-42557022101_500093/;Justicia-Chueca (Distrito Centro. Madrid Capital);1 hab.;1 baño;75 m²;4ª planta;"Ref: 108965

Disponible desde ya

Duplex en alquiler con superficie de 75m², muy luminoso. Planta 4ta, exterior con orientacion su...";40.4232003;-3.6979738
1.140 €/mes;Piso en calle de Diego Ayllón;/alquilar/piso-san_juan_bautista28043-42517614377_108900/;San Juan Bautista (Distrito Ciudad Lineal. Madrid Capital);1 hab.;;64 m²;1ª planta;"Preciosa vivienda de 1 dormitorio, con excelentes acabados, ¡Lista para entrar a vivir!
 
¡Alta de suministros gratis! Disfruta de...";40.4519935;-3.6506212
680 €/mes;Apartamento en Cuatro Caminos;/alquilar/apartamento-tetuan_cuatro_caminos28020-42599854733_516598/;Cuatro Caminos (Distrito Tetuán. Madrid Capital);1 hab.;1 baño;38 m²;2ª planta;Apartamento para una chica con contrato y nóminas, amueblado y equipado con electrodomésticos, una segunda planta, comunicado con ...;40.4488941;-3.7002928
1.200 €/mes;Piso en Justicia-Chueca;/alquilar/piso-justicia_chueca28004-42532906345_500093/;Justicia-Chueca (Distrito Centro. Madrid Capital);1 hab.;1 baño;65 m²;4ª planta;"Ref: 107993

Disponible desde ya

Piso en alquiler con superficie de 65m². Planta 4ta con orientacion oeste

La vivienda se entre...";40.4229882;-3.7000388
1.900 €/mes;Piso en Peñagrande;/alquilar/piso-penagrande28035-42517278530_100500/;Peñagrande (Distrito Fuencarral-El Pardo. Madrid Capital);3 habs.;2 baños;121 m²;9ª planta;"La inmobiliaria internacional cpm gestiona este estupendo y luminoso piso, sin amueblar, de 121 m² y 3 dormitorios; situado en urb...";40.477077312;-3.738158098
1.800 €/mes;Piso en Moncloa-Aravaca;/alquilar/piso-moncloa_aravaca_arguelles28008-42581523216_108900/;Argüelles (Distrito Moncloa-Aravaca. Madrid Capital);2 habs.;2 baños;90 m²;5ª planta;Magnifica vivienda de 90m² de obra seminueva construida en 2019 con piscina en ático, plaza de garaje y trastero. Dispone de 2 dor...;40.4282137;-3.7179036
5.495 €/mes;Piso en Justicia-Chueca;/alquilar/piso-justicia_chueca28004-42587848777_500093/;Justicia-Chueca (Distrito Centro. Madrid Capital);3 habs.;3 baños;155 m²;Bajo;"Ref: 109060

Disponible desde el 01 de agosto 2024

Fantastico piso en alquiler con superficie de 155m², muy luminoso. Planta 3ra,...";40.427635;-3.6986378
1.700 €/mes;Piso en El Viso;/alquilar/piso-chamartin_el_viso28002-41699807728_500093/;El Viso (Distrito Chamartín. Madrid Capital);2 habs.;2 baños;100 m²;4ª planta;"Ref: 108199

Disponible desde ya

Inmueble en alquiler con superficie de 100m², muy luminoso. Planta 4ta, exterior con orientacion...";40.4421339;-3.681229
2.500 €/mes;Piso en Salamanca;/alquilar/piso-goya28009-41676284601_101800/;Goya (Distrito Salamanca. Madrid Capital);2 habs.;2 baños;124 m²;5ª planta;"Disponible a partir del 20 de abril.
Engel & völkers presenta este estupendo piso ubicado en una de las mejores zonas de madrid, e...";40.42792664;-3.669210181
2.450 €/mes;Piso en Lista;/alquilar/piso-lista_barrio28006-42577775949_500093/;Lista (Distrito Salamanca. Madrid Capital);3 habs.;2 baños;92 m²;1ª planta;"Ref: 108737

Disponible desde ya

Piso en alquiler con superficie de 92m².

La vivienda se entrega no amueblada y en buen estado d...";40.4311807;-3.677781
915 €/mes;Piso en calle de Fuente del Saz;/alquilar/piso-chamartin_hispanoamerica28016-42541590038_108900/;Hispanoamérica (Distrito Chamartín. Madrid Capital);;;38 m²;Bajo;¡Alta de suministros gratis! Disfruta de tu hogar desde el primer momento, testa home te acompaña en la gestión de los suministros...;40.4533158;-3.6802661
2.035 €/mes;Piso en calle de José Rizal;/alquilar/piso-piovera28043-41729408529_108900/;Piovera (Distrito Hortaleza. Madrid Capital);3 habs.;;119 m²;1ª planta;"Estupenda vivienda de 3 dormitorios ¡Con 2 plazas de garaje y trastero incluidos!
 
¡Alta de suministros gratis! Disfruta de tu ho...";40.4600819;-3.635794
3.800 €/mes;Piso en Recoletos;/alquilar/piso-recoletos28001-42596531986_500093/;Recoletos (Distrito Salamanca. Madrid Capital);2 habs.;3 baños;140 m²;3ª planta;"Ref: 109068

Disponible desde ya

Piso en alquiler con superficie de 140m², muy luminoso. Planta 3ra, exterior con orientacion est...";40.4266349;-3.6865277
2.950 €/mes;Piso en Chamberi;/alquilar/piso-sol_barrio28014-38412946656_101800/;Sol (Distrito Centro. Madrid Capital);2 habs.;2 baños;105 m²;;Engel & völkers presenta en exclusiva esta vivienda situada en la séptimaa planta de un edificio de nueva construcción en trafalga...;40.4180119;-3.7021126
1.700 €/mes;Piso en Palacio;/alquilar/piso-centro_palacio28013-41718727040_101800/;Palacio (Distrito Centro. Madrid Capital);2 habs.;1 baño;98 m²;1ª planta;Altura piso , piso superficie total 98 m², nº de planta: 1, nivel energético de emisiones:  g, 999, nivel energético de consumo:  ...;40.4157492;-3.7104993
2.500 €/mes;Piso en Goya;/alquilar/piso-goya28001-41732559406_101800/;Goya (Distrito Salamanca. Madrid Capital);3 habs.;2 baños;120 m²;2ª planta;"Ref: 108602

Disponible desde el 01 de marzo 2024

Piso en alquiler con superficie de 120m², muy luminoso. Planta 2da, exterior co...";40.4273592;-3.6787569
920 €/mes;Piso en Portazgo;/alquilar/piso-puente_de_vallecas_portazgo28038-41757304470_100500/;Portazgo (Distrito Puente de Vallecas. Madrid Capital);2 habs.;1 baño;50 m²;2ª planta;"¡Alta de suministros gratis!

Excelente vivienda de dos dormitorios y un baño. Se encuentra en la 2ª planta de un edificio residen...";40.3907464;-3.6456187
2.000 €/mes;Piso en Gaztambide;/alquilar/piso-gaztambide28015-41739047220_500093/;Gaztambide (Distrito Chamberí. Madrid Capital);4 habs.;3 baños;138 m²;1ª planta;"Ref: 108723

Disponible desde ya

Piso en alquiler con superficie de 138m², muy luminoso. Planta 1ra, exterior con orientacion sur...";40.4332847;-3.7168785
900 €/mes;Piso en calle de Boldano;/alquilar/piso-ciudad_lineal_quintana-40916846568_100500/;Quintana (Distrito Ciudad Lineal. Madrid Capital);2 habs.;1 baño;60 m²;3ª planta;"Se alquila vivienda en ciudad lineal/ arturo soria.
Vivienda ubicada en la calle boldano, 3º planta con ascensor, exterior, amplio...";40.4375408;-3.6406315
1.600 €/mes;Piso en Arapiles;/alquilar/piso-chamberi_arapiles28015-42513008929_500093/;Arapiles (Distrito Chamberí. Madrid Capital);1 hab.;1 baño;50 m²;4ª planta;"Ref: 109131

Disponible desde el 01 de mayo 2024

Fantastico piso en alquiler con superficie de 50m². Planta 4ta con orientacion e...";40.4348662;-3.7067357
1.090 €/mes;Piso en Hortaleza;/alquilar/piso-hortaleza_canillas28043-42500244596_108900/;Canillas (Distrito Hortaleza. Madrid Capital);2 habs.;2 baños;75 m²;3ª planta;Estupenda vivienda de 75 m² distribuidos en 2 habitaciones, amplio salón independiente, cocina amueblada y completamente equipada ...;40.4646175;-3.6498284
7.500 €/mes;Piso en calle de Velázquez;/alquilar/piso-recoletos28001-97525045383_517093/;Recoletos (Distrito Salamanca. Madrid Capital);6 habs.;5 baños;471 m²;6ª planta;"Exclusividad en plena milla de oro. Sexta planta con maravillosas vistas y plaza de garaje en finca.

Piso muy luminosa con fantás...";40.4254848;-3.6838731
3.400 €/mes;Piso en Avenida de Juan Antonio Samaranch;/alquilar/piso-valdebebas_valdefuentes28055-40079305974_101800/;Valdebebas-Valdefuentes (Distrito Hortaleza. Madrid Capital);3 habs.;2 baños;101 m²;;Engel & völkers  presenta en alquiler este espectacular piso totalmente amueblado de diseño en el nuevo y privilegiado barrio de v...;40.493672;-3.6186195
1.500 €/mes;Piso en Aeropuerto;/alquilar/piso-aeropuerto28042-42526577929_500093/;Aeropuerto (Distrito Barajas. Madrid Capital);2 habs.;2 baños;97 m²;1ª planta;"Ref: 109227

Disponible desde el 15 de abril 2024

Piso en alquiler con superficie de 97m², muy luminoso. Planta 1ra, exterior con...";40.4537145;-3.6188846
915 €/mes;Piso en Valdeacederas;/alquilar/piso-valdeacederas28039-40850820383_100500/;Valdeacederas (Distrito Tetuán. Madrid Capital);2 habs.;1 baño;48 m²;2ª planta;"¡Alta de suministros gratis!

Excelente vivienda de dos dormitorios y un baño. Se encuentra en la 2ª planta de un edificio residen...";40.4629513;-3.7021899
3.750 €/mes;Piso en Embajadores-Lavapiés;/alquilar/piso-centro_embajadores_lavapies28012-42559675927_500093/;Embajadores-Lavapiés (Distrito Centro. Madrid Capital);3 habs.;3 baños;169 m²;3ª planta;"Ref: 109099

Disponible desde ya

Piso en alquiler con superficie de 169m², muy luminoso. Planta 3ra, exterior con orientacion nor...";40.4125811;-3.7042294
3.700 €/mes;Piso en El Encinar de los Reyes;/alquilar/piso-valdebebas_valdefuentes28055-42506904324_102100/;Valdebebas-Valdefuentes (Distrito Hortaleza. Madrid Capital);2 habs.;2 baños;150 m²;;Piso en el encinar de los reyes de 150 m², 2 dormitorios, 2 baños, luminoso, orientación sur, 2 plazas de garaje  características:...;40.5031364;-3.6365326
1.300 €/mes;Piso en Peñagrande;/alquilar/piso-penagrande28035-41759760229_101800/;Peñagrande (Distrito Fuencarral-El Pardo. Madrid Capital);2 habs.;1 baño;85 m²;1ª planta;"Ref: 108353

Disponible desde ya

Piso en alquiler con superficie de 85m², muy luminoso., exterior

La vivienda se entrega amuebla...";40.4751804;-3.7294683
2.700 €/mes;Piso en calle Corredera Baja de San Pablo;/alquilar/piso-universidad_malasana28004-38414458809_101800/;Universidad-Malasaña (Distrito Centro. Madrid Capital);1 hab.;1 baño;75 m²;1ª planta;Engel & völkers presenta este piso de lujo en alquiler en un edificio histórico, situado en el corazón de madrid, en el distrito c...;40.423045;-3.7031743
870 €/mes;Piso en Los Rosales;/alquilar/piso-villaverde_los_rosales28041-40017975737_100500/;Los Rosales (Distrito Villaverde. Madrid Capital);2 habs.;1 baño;50 m²;1ª planta;"¡Alta de suministros gratis!

Excelente apartamento de dos dormitorios y un baño. Se encuentra en la 1ª planta de un edificio resi...";40.3562632;-3.6919861
1.200 €/mes;Piso en calle del Ángel;/alquilar/piso-centro_palacio28005-42526991226_100500/;Palacio (Distrito Centro. Madrid Capital);1 hab.;1 baño;42 m²;1ª planta;Tenemos disponible en el centro histórico de madrid, en el aristocrático madrid de los austrias, frente a la gran basílica de sanf...;40.4100889;-3.7125586
3.400 €/mes;Dúplex en Centro;/alquilar/duplex-sol_barrio28012-41749654599_101800/;Sol (Distrito Centro. Madrid Capital);2 habs.;2 baños;90 m²;;Engel & völkers ofrece este espectacular ático dúplex de diseño exclusivo, en pleno barrio de sol. Está situado en una quinta plan...;40.4149453;-3.7042943
6.000 €/mes;Piso en Centro;/alquilar/piso-justicia_chueca28004-42507654330_101800/;Justicia-Chueca (Distrito Centro. Madrid Capital);4 habs.;2 baños;250 m²;1ª planta;Engel & völkers pone a su disposición esta maravillosa y exclusiva propiedad completamente reformada y amueblada de lujo, ubicada ...;40.4220228;-3.6963147
2.300 €/mes;Piso en calle del General Pardiñas;/alquilar/piso-lista_barrio28006-42532310638_108900/;Lista (Distrito Salamanca. Madrid Capital);2 habs.;2 baños;75 m²;;"¡Piso amueblado exterior en lista!

Housingo presenta este excelente piso, recientemente reformado y ubicado en una finca con asce...";40.4348888;-3.6779455
2.800 €/mes;Piso en calle de María de Molina;/alquilar/piso-salamanca_castellana28006-42574702817_108900/;Castellana (Distrito Salamanca. Madrid Capital);2 habs.;2 baños;110 m²;;"Asombroso piso exterior en maria de molina!
Los suministros son a cargo de la parte arrendataria!

Housingo presenta este encantad...";40.4378969;-3.6843612
1.640 €/mes;Piso en Vicálvaro;/alquilar/piso-el_canaveral-38343756517_101800/;El Cañaveral (Distrito Vicálvaro. Madrid Capital);2 habs.;2 baños;125 m²;7ª planta;"*promoción: un mes de alquiler gratis. Sin comisiones de agencia. Admitimos mascotas.

Engel & völkers presenta este ático  de obr...";40.4009954;-3.5466068
4.900 €/mes;Piso en El Viso;/alquilar/piso-chamartin_el_viso28006-42501795351_500093/;El Viso (Distrito Chamartín. Madrid Capital);2 habs.;3 baños;220 m²;3ª planta;"Ref: 108572

Disponible desde ya

Atico en alquiler con superficie de 220m², muy luminoso. Planta 3ra, exterior con orientacion no...";40.4388872;-3.688621
1.150 €/mes;Piso en Salamanca;/alquilar/piso-salamanca_castellana28006-42581888919_108900/;Castellana (Distrito Salamanca. Madrid Capital);1 hab.;1 baño;58 m²;;"Frente al ie businness school. A partir del 1 de abril.
Altor asesores te ofrece la oportunidad de vivir en una de las mejores cal...";40.4374922;-3.6840514
980 €/mes;Piso en San Diego;/alquilar/piso-san_diego28053-41717976870_100500/;San Diego (Distrito Puente de Vallecas. Madrid Capital);2 habs.;1 baño;62 m²;3ª planta;"¡Alta de suministros gratis!

Excelente vivienda de dos dormitorios y un baño. Se encuentra en la 3ª planta de un edificio residen...";40.3939255;-3.6635212
3.030 €/mes;Piso en Embajadores-Lavapiés;/alquilar/piso-centro_embajadores_lavapies28012-41683732673_100500/;Embajadores-Lavapiés (Distrito Centro. Madrid Capital);4 habs.;1 baño;120 m²;4ª planta;"La inmobiliaria internacional cpm gestiona este estupendo piso, reformado y amueblado, de 120 m² 4 habitaciones y 4 balcones; próx...";40.412151;-3.6990223
3.600 €/mes;Piso en Sol;/alquilar/piso-sol_barrio28012-41678443127_101800/;Sol (Distrito Centro. Madrid Capital);4 habs.;2 baños;145 m²;4ª planta;"Ref: 106696

Disponible desde el 01 de marzo 2024

Fantastico piso en alquiler con superficie de 145m², muy luminoso. Planta 4ta, ...";40.4163855;-3.7053248
2.500 €/mes;Piso en Trafalgar;/alquilar/piso-trafalgar28010-42505746809_500093/;Trafalgar (Distrito Chamberí. Madrid Capital);4 habs.;2 baños;122 m²;2ª planta;"Ref: 108812

Disponible desde ya

Piso en alquiler con superficie de 122m², muy luminoso. Planta 2da, exterior con orientacion sur...";40.4333754;-3.7010481
1.300 €/mes;Apartamento en Arganzuela-Madrid Río;/alquilar/apartamento-puerta_del_angel-40060397366_101800/;Puerta del Ángel (Distrito Latina. Madrid Capital);2 habs.;1 baño;79 m²;1ª planta;Engel & völkers presenta para alquiler un piso exterior en una 1ª planta con 2 dormitorios (1 doble, el 2º individual) y 1 baño (c...;40.4108086;-3.7366499
1.100 €/mes;Piso en Fuencarral;/alquilar/piso-penagrande28035-42556504471_108900/;Peñagrande (Distrito Fuencarral-El Pardo. Madrid Capital);1 hab.;1 baño;35 m²;2ª planta;Estupendo apartamento completamente reformado. Se distribuyen en 35 m² construidos con 1 dormitorio independiente con armario empo...;40.4753522;-3.7280173
2.450 €/mes;Ático en calle de Estanislao Pérez Pita;/alquilar/atico-timon28055-41758554964_101800/;Timón (Distrito Barajas. Madrid Capital);3 habs.;2 baños;210 m²;;Engel & völkers presenta este maravilloso ático totalmente amueblado con buen gusto. La vivienda de excelentes acabados e iluminac...;40.4886649;-3.6095808
3.950 €/mes;Piso en Castellana;/alquilar/piso-salamanca_castellana28006-41723756812_101800/;Castellana (Distrito Salamanca. Madrid Capital);4 habs.;4 baños;158 m²;4ª planta;Altura piso , piso superficie total 158 m², nº de planta: 1, nivel energético de emisiones:  d, 24, nivel energético de consumo:  ...;40.4297344;-3.6809927
1.750 €/mes;Estudio en Universidad-Malasaña;/alquilar/estudio-universidad_malasana28004-41691317296_100500/;Universidad-Malasaña (Distrito Centro. Madrid Capital);;1 baño;40 m²;;"La inmobiliaria internacional cpm gestiona este magnífico y luminoso estudio amueblado, de 40 m²; próximo al metro noviciado, que ...";40.4250551;-3.7029908
1.700 €/mes;Piso en Berruguete;/alquilar/piso-berruguete28039-41748974535_100500/;Berruguete (Distrito Tetuán. Madrid Capital);2 habs.;1 baño;53 m²;;La inmobiliaria internacional cpm gestiona este estupendo y luminoso piso totalmente reformado y amueblado, de 53 m² y 2 habitacio...;40.4597654;-3.6995755
