precio;sub_descr;href;ubicacion;habitaciones;banios;mt2;planta;otros;latitude;longitude
1.200 €/mes;Piso en Rejas;/alquilar/piso-rejas28022-42501897843_100200/;Rejas (Distrito San Blas. Madrid Capital);4 habs.;2 baños;100 m²;;"Tecnocasa agencia inmobiliaria de madrid - zona ciudad pegaso - alameda de osuna - rejas - oficina tecnocasa de madrid
Alquila viv...";40.4426667;-3.5769521
770 €/mes;Estudio en Pueblo Nuevo;/alquilar/estudio-ciudad_lineal_pueblo_nuevo28017-19240687566_518978/;Pueblo Nuevo (Distrito Ciudad Lineal. Madrid Capital);;1 baño;28 m²;;"Disponible para entrar en abril 2024

Alquiler temporal a partir de 1 mes.

“home gestión inmobiliaria integral”, necesitas alquil...";40.4338167;-3.6439836
2.800 €/mes;Piso en Argüelles;/alquilar/piso-moncloa_aravaca_arguelles28008-42546602767_108900/;Argüelles (Distrito Moncloa-Aravaca. Madrid Capital);4 habs.;2 baños;120 m²;;"Apartamento muy amplio entre moncloa y parque del oeste.

Se trata de un bonito y amplio apartamento en una de las zonas verdes má...";40.4320845;-3.7228704
1.180 €/mes;Piso en Carabanchel;/alquilar/piso-opanel28019-42598827438_108900/;Opañel (Distrito Carabanchel. Madrid Capital);3 habs.;1 baño;70 m²;2ª planta;Vivienda reformada a estrenar de 70m² muy luminosa con 3 habitaciones, salón independiente, cocina equipada, 1 baño completo con p...;40.392493361;-3.725022393
920 €/mes;Piso en Los Rosales;/alquilar/piso-villaverde_los_rosales28021-26694273766_100500/;Los Rosales (Distrito Villaverde. Madrid Capital);2 habs.;1 baño;45 m²;2ª planta;"¡Alta de suministros gratis!

Excelente vivienda de dos dormitorios y un baño. Se encuentra en la 2ª planta de un edificio residen...";40.3515891;-3.6873474
3.100 €/mes;Piso en Almagro;/alquilar/piso-chamberi_almagro28010-30884377003_100500/;Almagro (Distrito Chamberí. Madrid Capital);1 hab.;2 baños;94 m²;2ª planta;Diza consultores les presenta este piso en almagro, una zona inmejorable, en la que disponemos de un antiguo palacete, reformado í...;40.4364734;-3.6918306
3.800 €/mes;Piso en Castellana;/alquilar/piso-salamanca_castellana28006-41709219894_500093/;Castellana (Distrito Salamanca. Madrid Capital);3 habs.;3 baños;150 m²;3ª planta;"Ref: 108260

Disponible desde ya

Piso en alquiler con superficie de 150m², muy luminoso. Planta 3ra, exterior

La vivienda se ent...";40.4323649;-3.684755
910 €/mes;Piso en Butarque;/alquilar/piso-butarque28021-42507462890_108900/;Butarque (Distrito Villaverde. Madrid Capital);1 hab.;;39 m²;6ª planta;"Espectacular estudio con terraza, ¡Preparado para entrar a vivir!
 
¡Alta de suministros gratis! Disfruta de tu hogar desde el pri...";40.3505685;-3.6793116
2.290 €/mes;Dúplex en Piovera;/alquilar/duplex-piovera-42505093975_500093/;Piovera (Distrito Hortaleza. Madrid Capital);6 habs.;4 baños;260 m²;Principal;"Ref: 109269

Disponible desde ya

Fantastico duplex en alquiler con superficie de 260m², muy luminoso. Planta 1ra, exterior con or...";40.455250857;-3.650750736
2.500 €/mes;Piso en Lista;/alquilar/piso-lista_barrio28006-42533695371_500093/;Lista (Distrito Salamanca. Madrid Capital);2 habs.;2 baños;118 m²;4ª planta;"Ref: 108850

Disponible desde ya

Piso en alquiler con superficie de 118m², muy luminoso. Planta 4ta, exterior con orientacion nor...";40.4309392;-3.6731315
3.650 €/mes;Piso en Castellana-Orense;/alquilar/piso-tetuan_cuatro_caminos28020-42565735421_102100/;Cuatro Caminos (Distrito Tetuán. Madrid Capital);4 habs.;2 baños;160 m²;;Este impresionante piso se encuentra en la exclusiva zona de castellana-orense, al lado del distrito financiero, pero ubicado en u...;40.4588723;-3.6925172
10.000 €/mes;Piso en Salamanca;/alquilar/piso-lista_barrio28001-35080443347_102100/;Lista (Distrito Salamanca. Madrid Capital);3 habs.;5 baños;300 m²;;Piso en salamanca de 300 m², 3 dormitorios, 5 baños, cocina, terraza de 60,00 metros, exterior, muy luminoso, 1 plaza de garaje y ...;40.4201501;-3.6896857
2.500 €/mes;Ático en Fuente del Berro;/alquilar/atico-fuente_del_berro28028-36762279502_500093/;Fuente del Berro (Distrito Salamanca. Madrid Capital);2 habs.;3 baños;90 m²;;"Ref: 106450

Disponible desde el 25 de marzo 2024

Fantastico atico en alquiler con superficie de 90m², muy luminoso. Planta 6ta, ...";40.4283971;-3.6667863
1.200 €/mes;Piso en Embajadores-Lavapiés;/alquilar/piso-centro_embajadores_lavapies28012-41753095139_100200/;Embajadores-Lavapiés (Distrito Centro. Madrid Capital);;1 baño;34 m²;2ª planta;Agencia inmobiliaria de madrid zona lavapies – embajadores – tirso de molina tecnocasa estudio real de lavapies sl alquila piso in...;40.4080887;-3.7032311
1.250 €/mes;Piso en Ciudad Lineal;/alquilar/piso-ciudad_lineal_quintana-41763414500_108900/;Quintana (Distrito Ciudad Lineal. Madrid Capital);3 habs.;2 baños;75 m²;2ª planta;Vivienda de 75 m² en urbanización privada distribuida en 3 habitaciones con armarios empotrados, amplio salón-comedor con acceso a...;40.4374814;-3.6441348
1.950 €/mes;Piso en calle del General Díaz Porlier;/alquilar/piso-goya28001-41698303304_108900/;Goya (Distrito Salamanca. Madrid Capital);1 hab.;1 baño;70 m²;;"Exquisito. Un dormitorio y un gran salon
A estrenar

Disponible desde finales de marzo  2024

Magnífico piso exterior a estrenar e...";40.4281152;-3.6770967
4.700 €/mes;Dúplex en Hispanoamérica;/alquilar/duplex-chamartin_hispanoamerica28016-40065824387_108500/;Hispanoamérica (Distrito Chamartín. Madrid Capital);4 habs.;3 baños;320 m²;;Dúplex-ático muy luminoso con amplia terraza de casi 90 m² en la última planta. A la entrada nos encontramos con un bonito hall qu...;40.4555964;-3.6700332
2.100 €/mes;Piso en Lista;/alquilar/piso-lista_barrio28006-41694712603_101800/;Lista (Distrito Salamanca. Madrid Capital);2 habs.;1 baño;75 m²;5ª planta;"Ref: 107935

Disponible desde ya

Piso en alquiler con superficie de 75m², muy luminoso. Planta 5ta, exterior con orientacion nort...";40.4296484;-3.6740089
920 €/mes;Piso en Campamento;/alquilar/piso-latina_campamento28024-40878274176_100500/;Campamento (Distrito Latina. Madrid Capital);2 habs.;1 baño;53 m²;5ª planta;"¡Alta de suministros gratis!

Excelente vivienda de dos dormitorios y un baño. Se encuentra en la 5ª planta de un edificio residen...";40.3959971;-3.7708495
1.400 €/mes;Apartamento en calle Aguarón;/alquilar/apartamento-valdemarin-40070818343_101800/;Valdemarín (Distrito Moncloa-Aravaca. Madrid Capital);1 hab.;1 baño;50 m²;;Engel & völkers presenta en alquiler este espectacular apartamento, loft con exquisita reforma a estrenar. La vivienda cuenta con ...;40.4655364;-3.7928264
3.500 €/mes;Piso en Lista;/alquilar/piso-lista_barrio28006-41766294730_101800/;Lista (Distrito Salamanca. Madrid Capital);5 habs.;3 baños;200 m²;1ª planta;"Ref: 108404

Disponible desde el 01 de mayo 2024

Piso en alquiler con superficie de 200m², muy luminoso., exterior

La vivienda s...";40.4334101;-3.677804
1.040 €/mes;Piso en Puerta Bonita;/alquilar/piso-puerta_bonita28025-41744056178_100500/;Puerta Bonita (Distrito Carabanchel. Madrid Capital);3 habs.;1 baño;68 m²;3ª planta;"¡Alta de suministros gratis!

Excelente vivienda de tres dormitorios y un baño. Se encuentra en la 3ª planta de un edificio reside...";40.3755367;-3.7414772
3.850 €/mes;Piso en Almagro;/alquilar/piso-chamberi_almagro28010-38422879098_100500/;Almagro (Distrito Chamberí. Madrid Capital);2 habs.;2 baños;129 m²;2ª planta;Diza consultores les presenta este piso en almagro. Zona inmejorable, disponemos de un antiguo palacete, reformado íntegramente co...;40.4364871;-3.6920087
1.200 €/mes;Piso en Chamartin;/alquilar/piso-castilla28046-42598737739_108900/;Castilla (Distrito Chamartín. Madrid Capital);2 habs.;1 baño;60 m²;3ª planta;Estupendo piso reformado de 60 m² frente a las torres del paseo de la castellana. Se compone de 2 dormitorios, uno de ellos con ac...;40.4769889;-3.6856427
2.300 €/mes;Piso en Recoletos;/alquilar/piso-recoletos28001-42527916283_500093/;Recoletos (Distrito Salamanca. Madrid Capital);1 hab.;1 baño;62 m²;4ª planta;"Ref: 109172

Disponible desde ya

Piso en alquiler con superficie de 62m². Planta 4ta

La vivienda se entrega amueblada y en buen...";40.4261715;-3.6825175
1.100 €/mes;Piso en Embajadores-Lavapiés;/alquilar/piso-centro_embajadores_lavapies28012-41766391636_100200/;Embajadores-Lavapiés (Distrito Centro. Madrid Capital);1 hab.;1 baño;45 m²;4ª planta;Agencia inmobiliaria de madrid zona lavapies – embajadores – tirso de molina tecnocasa estudio real de lavapies sl alquila piso ex...;40.4107478;-3.7038168
1.650 €/mes;Piso en Castellana;/alquilar/piso-salamanca_castellana28006-41681085097_101800/;Castellana (Distrito Salamanca. Madrid Capital);1 hab.;2 baños;120 m²;4ª planta;"Ref: 108421

Disponible desde el 15 de marzo 2024

Piso en alquiler con superficie de 120m², muy luminoso. Planta 4ta, exterior co...";40.4361522;-3.6804593
1.350 €/mes;Piso en Castilla;/alquilar/piso-castilla28046-42582830453_500093/;Castilla (Distrito Chamartín. Madrid Capital);2 habs.;1 baño;75 m²;3ª planta;"Ref: 108899

Disponible desde el 01 de abril 2024

Fantastico piso en alquiler con superficie de 75m², muy luminoso. Planta 3ra, e...";40.4795472;-3.6847771
1.370 €/mes;Piso en Paseo de la Alameda de Osuna;/alquilar/piso-alameda_de_osuna_barrio-41680506493_108900/;Alameda de Osuna (Distrito Barajas. Madrid Capital);2 habs.;;94 m²;3ª planta;"Disfruta de tu vivienda en alameda de osuna, ¡Con parking y trastero incluidos en el precio!
 
¡Alta de suministros gratis! Disfru...";40.4602158;-3.5872633
3.800 €/mes;Piso en Lista;/alquilar/piso-lista_barrio28006-42585928582_100500/;Lista (Distrito Salamanca. Madrid Capital);4 habs.;2 baños;140 m²;2ª planta;La inmobiliaria internacional cpm gestiona este amplio y luminoso piso sin amueblar y totalmente reformado de 140 m², 4 habitacion...;40.4331798;-3.6783132
2.300 €/mes;Piso en calle de Guzmán El Bueno, 66;/alquilar/piso-gaztambide28015-42513385047_100500/;Gaztambide (Distrito Chamberí. Madrid Capital);2 habs.;2 baños;100 m²;5ª planta;"Ponemos a su disposición este precioso piso, lleno de luz y recién reformado.

Se distribuye en gran salón comedor con cocina inte...";40.4378;-3.71281
2.235 €/mes;Piso en calle de Vicente Morales;/alquilar/piso-piovera28043-41738964290_108900/;Piovera (Distrito Hortaleza. Madrid Capital);3 habs.;;131 m²;4ª planta;"Estupenda vivienda de 3 dormitorios ¡Con 2 plazas de garaje y trastero incluidos en el precio!
 
¡Alta de suministros gratis! Disf...";40.4620247;-3.6362116
1.500 €/mes;Ático en Rejas;/alquilar/atico-rejas28022-42536876315_500093/;Rejas (Distrito San Blas. Madrid Capital);2 habs.;1 baño;1.500 m²;;"Ref: 109054

Disponible desde ya

Fantastico atico en alquiler con superficie de 120m², muy luminoso. Planta 6ta, exterior

La viv...";40.445196186;-3.588111059
1.205 €/mes;Piso en calle de Diego Ayllón;/alquilar/piso-san_juan_bautista28043-42589278586_108900/;San Juan Bautista (Distrito Ciudad Lineal. Madrid Capital);1 hab.;;67 m²;2ª planta;"Estupenda vivienda de 1 dormitorio. Y además, ¡Con garaje incluido!
 
¡Alta de suministros gratis! Disfruta de tu hogar desde el p...";40.4520072;-3.6509421
1.140 €/mes;Piso en Vista Alegre;/alquilar/piso-carabanchel_vista_alegre28047-41736375604_100500/;Vista Alegre (Distrito Carabanchel. Madrid Capital);3 habs.;1 baño;65 m²;1ª planta;"¡Alta de suministros gratis!

Excelente vivienda de tres dormitorios y un baño. Se encuentra en la 1ª planta de un edificio reside...";40.3857522;-3.7445121
2.300 €/mes;Piso en Adelfas;/alquilar/piso-adelfas28007-42536659930_500093/;Adelfas (Distrito Retiro. Madrid Capital);3 habs.;2 baños;124 m²;2ª planta;"Ref: 108744

Disponible desde ya

Fantastico piso en alquiler con superficie de 124m², muy luminoso. Planta 2da, exterior con orie...";40.405571757;-3.667069065
2.000 €/mes;Piso en Pacífico;/alquilar/piso-retiro_pacifico28007-42523153185_500093/;Pacífico (Distrito Retiro. Madrid Capital);4 habs.;2 baños;120 m²;2ª planta;"Ref: 108734

Disponible desde ya

Piso en alquiler con superficie de 120m², muy luminoso. Planta 2da, exterior

La vivienda se ent...";40.4043425;-3.6784041
850 €/mes;Estudio en calle de Valverde;/alquilar/estudio-universidad_malasana28004-42541270261_100500/;Universidad-Malasaña (Distrito Centro. Madrid Capital);;1 baño;25 m²;;"Corta estancia

Estudio junto a la gran vía.

Primera planta interior.

Una única estancia amueblada con sofá cama, armario y mesa...";40.4215504;-3.7020355
950 €/mes;Piso en Ciudad Lineal;/alquilar/piso-ciudad_lineal_quintana-42567615253_108900/;Quintana (Distrito Ciudad Lineal. Madrid Capital);1 hab.;1 baño;55 m²;2ª planta;Vivienda totalmente reformada de 55 m² distribuida en 1 habitación (antes 2), amplio salón-comedor, 1 baño con plato de ducha y co...;40.4366091;-3.6415142
3.650 €/mes;Piso en Castellana;/alquilar/piso-salamanca_castellana28001-42593075302_500093/;Castellana (Distrito Salamanca. Madrid Capital);3 habs.;3 baños;120 m²;3ª planta;"Ref: 108992

Disponible desde ya

Piso en alquiler con superficie de 120m². Planta 3ra con orientacion oeste

La vivienda se entre...";40.429015786;-3.682497926
2.200 €/mes;Piso en calle de Eloy Gonzalo;/alquilar/piso-trafalgar28010-40845787176_100500/;Trafalgar (Distrito Chamberí. Madrid Capital);1 hab.;2 baños;66 m²;Subsótano;"Alquiler por meses.
Disponible para ingresar en mayo 2024

Piso interior, tipo loft en  planta sótano con entresuelo. Superficie c...";40.4339273;-3.7022434
890 €/mes;Piso en Puerta Bonita;/alquilar/piso-puerta_bonita28025-40836238476_100500/;Puerta Bonita (Distrito Carabanchel. Madrid Capital);2 habs.;1 baño;50 m²;4ª planta;"¡Alta de suministros gratis!

Excelente vivienda de dos dormitorios y un baño. Se encuentra en la 4ª planta de un edificio residen...";40.377742;-3.742814
6.500 €/mes;Ático en calle Gran Vía;/alquilar/atico-sol_barrio28013-39173925839_108900/;Sol (Distrito Centro. Madrid Capital);2 habs.;2 baños;182 m²;;"¡Fantastico y exclusivo ático con 2 terrazas, con unas vistas inmejorables!
Se entrega totalmente amueblado

Housingo presenta est...";40.420087522;-3.703934729
950 €/mes;Piso en Acacias;/alquilar/piso-acacias28012-42534389567_500093/;Acacias (Distrito Arganzuela. Madrid Capital);1 hab.;1 baño;55 m²;Bajo;"Ref: 109242

Disponible desde ya

Fantastico piso en alquiler con superficie de 55m², muy luminoso. Planta baja, exterior con orie...";40.4108675;-3.7039319
1.250 €/mes;Piso en calle de Atocha;/alquilar/piso-centro_embajadores_lavapies28012-40835683680_100500/;Embajadores-Lavapiés (Distrito Centro. Madrid Capital);2 habs.;1 baño;45 m²;5ª planta;"¡Sin comisiones! Mr. House real estate alquila exclusivo piso en pleno atocha, con ascensor, totalmente reformado.

Si cabe destac...";40.4095796;-3.6936917
2.620 €/mes;Piso en calle de José Rizal;/alquilar/piso-piovera28043-39174510856_108900/;Piovera (Distrito Hortaleza. Madrid Capital);3 habs.;;191 m²;4ª planta;¡Alta de suministros gratis! Disfruta de tu hogar desde el primer momento, testa home te acompaña en la gestión de los suministros...;40.4601581;-3.6359431
1.600 €/mes;Piso en El Pardo;/alquilar/piso-fuencarral_el_pardo_el_pardo28049-42519989442_500093/;El Pardo (Distrito Fuencarral-El Pardo. Madrid Capital);2 habs.;2 baños;110 m²;2ª planta;"Ref: 109210

Disponible desde el 25 de marzo 2024

Fantastico piso en alquiler con superficie de 110m², muy luminoso. Planta 2da, ...";40.509638;-3.693049
1.400 €/mes;Piso en Valdezarza;/alquilar/piso-valdezarza28035-42560887276_100200/;Valdezarza (Distrito Moncloa-Aravaca. Madrid Capital);2 habs.;;74 m²;;"'tecnocasa puerta de hierro (registro de agentes profesionales inmobiliarios; rain nº00306/18) 'protección de consumidores y usuar...";40.4645991;-3.7217831
1.495 €/mes;Piso en Legazpi;/alquilar/piso-legazpi_barrio28045-41681463850_101800/;Legazpi (Distrito Arganzuela. Madrid Capital);2 habs.;2 baños;70 m²;1ª planta;"Ref: 108639

Disponible desde ya

Piso en alquiler con superficie de 70m², muy luminoso. Planta 1ra, exterior

La vivienda se entr...";40.3918241;-3.6892966
1.350 €/mes;Piso en Nueva España;/alquilar/piso-nueva_espana28036-42525204347_500093/;Nueva España (Distrito Chamartín. Madrid Capital);1 hab.;1 baño;50 m²;1ª planta;"Ref: 108910

Disponible desde ya

Piso en alquiler con superficie de 50m², muy luminoso. Planta 1ra, exterior

La vivienda se entr...";40.4635469;-3.6840846
1.075 €/mes;Piso en Carabanchel;/alquilar/piso-carabanchel_vista_alegre28025-42551538746_108900/;Vista Alegre (Distrito Carabanchel. Madrid Capital);3 habs.;1 baño;60 m²;1ª planta;Vivienda de 60m² reformada a estrenar con 3 habitaciones, cocina equipada, salón, 1 baño completo con bañera, ventanas de climalit...;40.3892726;-3.7432761
1.100 €/mes;Piso en Palomeras Bajas;/alquilar/piso-palomeras_bajas28018-42527511737_500093/;Palomeras Bajas (Distrito Puente de Vallecas. Madrid Capital);3 habs.;2 baños;107 m²;1ª planta;"Ref: 109050

Disponible desde ya

Fantastico piso en alquiler con superficie de 107m², muy luminoso. Planta 1ra, exterior con orie...";40.3789543;-3.6561258
920 €/mes;Piso en Puerta Bonita;/alquilar/piso-puerta_bonita28025-40862769535_100500/;Puerta Bonita (Distrito Carabanchel. Madrid Capital);2 habs.;1 baño;52 m²;3ª planta;"¡Alta de suministros gratis!

Excelente vivienda de dos dormitorios y un baño. Se encuentra en la 3ª planta de un edificio residen...";40.3852235;-3.7313703
920 €/mes;Piso en Palomeras Bajas;/alquilar/piso-palomeras_bajas28018-40890726229_100500/;Palomeras Bajas (Distrito Puente de Vallecas. Madrid Capital);2 habs.;1 baño;51 m²;3ª planta;"¡Alta de suministros gratis!

Excelente vivienda de dos dormitorios y un baño. Se encuentra en la 3ª planta de un edificio residen...";40.3870747;-3.6542475
940 €/mes;Piso en Palomeras Sureste;/alquilar/piso-palomeras_sureste28018-40898946251_100500/;Palomeras Sureste (Distrito Puente de Vallecas. Madrid Capital);2 habs.;1 baño;57 m²;1ª planta;"¡Alta de suministros gratis!

Excelente vivienda de dos dormitorios y un baño. Se encuentra en la 1ª planta de un edificio residen...";40.4074364;-3.7118127
1.600 €/mes;Piso en Pinar del Rey;/alquilar/piso-pinar_del_rey-42531856826_500093/;Pinar del Rey (Distrito Hortaleza. Madrid Capital);3 habs.;2 baños;100 m²;2ª planta;"Ref: 109266

Disponible desde ya

Fantastico piso en alquiler con superficie de 100m², muy luminoso. Planta 2da, exterior con orie...";40.4748149;-3.653988
1.000 €/mes;Estudio en Valdeacederas;/alquilar/estudio-valdeacederas28029-42598190299_500093/;Valdeacederas (Distrito Tetuán. Madrid Capital);1 hab.;1 baño;90 m²;;"Ref: 108630

Disponible desde ya

Fantastico estudio en alquiler con superficie de 90m², muy luminoso. Planta baja, exterior con ...";40.467739643;-3.699988754
1.800 €/mes;Piso en Pacífico;/alquilar/piso-retiro_pacifico28007-41741279331_101800/;Pacífico (Distrito Retiro. Madrid Capital);3 habs.;1 baño;85 m²;1ª planta;"Ref: 108232

Disponible desde el 15 de febrero 2024

Piso en alquiler con superficie de 85m². Planta 1ra con orientacion sur

La v...";40.4066548;-3.6777522
1.100 €/mes;Piso en calle de Eguilaz;/alquilar/piso-trafalgar28010-41685170759_108900/;Trafalgar (Distrito Chamberí. Madrid Capital);1 hab.;1 baño;42 m²;;Housingo presenta este apartamento, en ubicación con buenas comunicaciones, de 1 dormitorio y 1 cuarto de baño. Se encuentra ubica...;40.4293618;-3.7006824
1.100 €/mes;Apartamento en calle del Molino de Viento;/alquilar/apartamento-universidad_malasana28004-41696581071_100500/;Universidad-Malasaña (Distrito Centro. Madrid Capital);1 hab.;1 baño;44 m²;2ª planta;"Apartamento recién reformado y amueblado con todo lo necesario para entrar a vivir. Se alquila por corta estancia.

Dispone de una...";40.4233764;-3.7037498
1.100 €/mes;Piso en Palos de Moguer;/alquilar/piso-palos_de_moguer28045-42587957531_500093/;Palos de Moguer (Distrito Arganzuela. Madrid Capital);2 habs.;1 baño;73 m²;2ª planta;"Ref: 108757

Disponible desde el 24 de febrero 2027

Piso en alquiler con superficie de 73m², muy luminoso. Planta 2da, exterior

...";40.405587;-3.6936391
870 €/mes;Piso en San Andrés;/alquilar/piso-villaverde_san_andres28021-40894215796_100500/;San Andrés (Distrito Villaverde. Madrid Capital);2 habs.;1 baño;58 m²;1ª planta;"¡Alta de suministros gratis!

Excelente vivienda de dos dormitorios y un baño. Se encuentra en la 1ª planta de un edificio residen...";40.3443225;-3.7080749
1.400 €/mes;Ático en calle de Gabriel Lobo, 33;/alquilar/atico-chamartin_el_viso28002-40894351136_526097/;El Viso (Distrito Chamartín. Madrid Capital);1 hab.;1 baño;60 m²;;"Maravilloso atico en alquiler en una de las mejores zonas de madrid, 60m², 
Recién reformado integral a estrenar, cocina completa ...";40.444087455836005;-3.6793197406967364
1.950 €/mes;Piso en Trafalgar;/alquilar/piso-trafalgar28010-42553895893_500093/;Trafalgar (Distrito Chamberí. Madrid Capital);2 habs.;1 baño;87 m²;3ª planta;"Ref: 109086

Disponible desde el 01 de abril 2024

Piso en alquiler con superficie de 87m², muy luminoso. Planta 3ra, exterior con...";40.4352678;-3.702336
1.750 €/mes;Piso en Adelfas;/alquilar/piso-adelfas28007-42568209846_100500/;Adelfas (Distrito Retiro. Madrid Capital);3 habs.;2 baños;120 m²;7ª planta;La inmobiliaria internacional cpm gestiona este estupendo y luminoso piso totalmente amueblado, de 120 m², 3 dormitorios y terraza...;40.406359212;-3.670106143
890 €/mes;Piso en Pradolongo;/alquilar/piso-usera_pradolongo28026-40072580406_100500/;Pradolongo (Distrito Usera. Madrid Capital);2 habs.;1 baño;44 m²;1ª planta;"""¡Alta de suministros gratis!

 Excelente apartamento de dos dormitorios y un baño. Se encuentra en la 1ª planta de un edificio re...";40.3805955;-3.7066297
2.200 €/mes;Piso en Goya;/alquilar/piso-goya28001-42526553149_500093/;Goya (Distrito Salamanca. Madrid Capital);2 habs.;1 baño;90 m²;6ª planta;"Ref: 108950

Disponible desde ya

Piso en alquiler con superficie de 90m², muy luminoso. Planta 6ta, exterior con orientacion este...";40.4261064;-3.6768888
2.500 €/mes;Ático en Prosperidad;/alquilar/atico-chamartin_prosperidad28002-41693152796_101800/;Prosperidad (Distrito Chamartín. Madrid Capital);2 habs.;1 baño;93 m²;;"Ref: 108600

Disponible desde el 01 de marzo 2024

Fantastico atico en alquiler con superficie de 93m², muy luminoso. Planta 9na, ...";40.4410354;-3.6725957
998 €/mes;Piso en Pilar;/alquilar/piso-pilar28029-41754120221_500093/;Pilar (Distrito Fuencarral-El Pardo. Madrid Capital);1 hab.;2 baños;67 m²;9ª planta;"Ref: 108655

Disponible desde el 04 de marzo 2024

Piso en alquiler con superficie de 67m², muy luminoso. Planta 9na, exterior con...";40.474477518;-3.70398923
1.500 €/mes;Piso en Salamanca;/alquilar/piso-fuente_del_berro28028-42538895964_108900/;Fuente del Berro (Distrito Salamanca. Madrid Capital);3 habs.;2 baños;82 m²;4ª planta;Piso recién pintado de 82m², 3 dormitorios, amplio salón, cocina amueblada y equipada, 2 baños completos con plato de ducha, suelo...;40.4264541;-3.6619686
4.000 €/mes;Piso en El Viso;/alquilar/piso-chamartin_ciudad_jardin28002-42579469638_102100/;Ciudad Jardín (Distrito Chamartín. Madrid Capital);3 habs.;3 baños;251 m²;;Gilmar consulting inmobiliario presenta esta exclusiva oportunidad, te presentamos una espectacular vivienda recién reformada que ...;40.4415852;-3.6703587
950 €/mes;Piso en Abrantes;/alquilar/piso-abrantes28019-42594867703_500093/;Abrantes (Distrito Carabanchel. Madrid Capital);1 hab.;1 baño;60 m²;2ª planta;"Ref: 109075

Disponible desde ya

Fantastico piso en alquiler con superficie de 60m², muy luminoso. Planta 2da, exterior con orien...";40.3854099;-3.7279283
1.200 €/mes;Apartamento en calle del Amparo;/alquilar/apartamento-centro_embajadores_lavapies28012-42558018463_100500/;Embajadores-Lavapiés (Distrito Centro. Madrid Capital);1 hab.;1 baño;55 m²;1ª planta;"Cortas estancias

Vivienda situada en la calle amparo, muy próxima a la la plaza tirso de molina. 

Se trata de una primera planta...";40.4090295;-3.7024833
1.950 €/mes;Piso en Universidad-Malasaña;/alquilar/piso-universidad_malasana28013-41698327880_101800/;Universidad-Malasaña (Distrito Centro. Madrid Capital);1 hab.;1 baño;50 m²;1ª planta;"Ref: 104670

Disponible desde ya

Fantastico piso en alquiler con superficie de 50m², muy luminoso. Planta 1ra, exterior con orien...";40.421016;-3.7074982
4.200 €/mes;Piso en Ríos Rosas;/alquilar/piso-rios_rosas28003-42550670862_500093/;Ríos Rosas (Distrito Chamberí. Madrid Capital);3 habs.;3 baños;176 m²;2ª planta;"Ref: 109085

Disponible desde ya

Piso en alquiler con superficie de 176m², muy luminoso. Planta 2da, exterior

La vivienda se ent...";40.439194;-3.6943382
6.000 €/mes;Piso en Chamartín;/alquilar/piso-fuencarral_el_pardo_valverde28046-41751232237_102100/;Valverde (Distrito Fuencarral-El Pardo. Madrid Capital);4 habs.;5 baños;473 m²;;Vive el lujo y la exclusividad en pleno paseo de la castellana!  Desde gilmar consulting inmobiliario te presentamos esta magnífic...;40.4842607;-3.6852766
1.500 €/mes;Piso en Cortes-Huertas;/alquilar/piso-cortes_huertas28012-41710353991_100500/;Cortes-Huertas (Distrito Centro. Madrid Capital);3 habs.;1 baño;72 m²;4ª planta;"La inmobiliaria internacional cpm gestiona este magnífico y luminoso piso abuhardillado y amueblado, de 72 m² y 3 dormitorios; cer...";40.4151847;-3.7021559
