precio;sub_descr;href;ubicacion;habitaciones;banios;mt2;planta;otros;latitude;longitude;CCAA
2.300 €/mes;;/alquilar/piso-antiga_esquerra_de_eixample08036-45035172872_500025/;L'Antiga Esquerra de l'Eixample (Distrito Eixample. Barcelona Capital);3 habs.;1 baño;98 m²;3ª planta;Piso de alquiler por temporada en eixample esquerra. Muy céntrico: c/ parís junto c/ casanova muy cerca al hospital clínic. Lumino...;41.3920522;2.1513212;barcelona
1.249 €/mes;Apartamento en Carrer de Còrsega, 633;/alquilar/apartamento-la_sagrada_familia08025-43357332777_528144/;La Sagrada Família (Distrito Eixample. Barcelona Capital);1 hab.;1 baño;37 m²;5ª planta;"Magnífico apartamento con suite en la calle córcega
Apartamento con suite, baño, cocina y cocina office. Exterior, con mucha luz n...";41.409706;2.1766987;barcelona
1.600 €/mes;;/alquilar/piso-el_putxet_el_farro08006-45866715606_994552/;El Putxet-El Farró (Distrito Sarrià-Sant Gervasi. Barcelona Capital);3 habs.;2 baños;85 m²;Entresuelo;"Precioso piso en alquiler zona de sarria- sant gervasi, próximo a la plaza lesseps; dispone de comodidad en transporte publico y b...";41.4050791;2.1463162;barcelona
2.200 €/mes;;/alquilar/piso-la_sagrada_familia08013-43417913864_516049/;La Sagrada Família (Distrito Eixample. Barcelona Capital);2 habs.;1 baño;75 m²;4ª planta;¡Bienvenido al encantador apartamento de 2 habitaciones para 4 personas, situado a pocos metros de la sagrada familia, en una ubic...;41.4042319;2.1771246;barcelona
3.300 €/mes;;/alquilar/piso-sant_gervasi_galvany08021-45858313142_100500/;Sant Gervasi-Galvany (Distrito Sarrià-Sant Gervasi. Barcelona Capital);4 habs.;3 baños;168 m²;2ª planta;"Excelente piso de 4 dormitorios, terraza, parking junto a francesc maciá turó park.

Se alquila este estupendo piso reformado en u...";41.3941612;2.1443076;barcelona
2.500 €/mes;;/alquilar/piso-la_nova_esquerra_de_eixample08015-29183648694_100200/;La Nova Esquerra de l'Eixample (Distrito Eixample. Barcelona Capital);3 habs.;2 baños;115 m²;;"Vivienda de 112 m² en finca regia totalmente restaurada en el 2021,
Con ascensor. El inmueble cuenta con doble orientacion a tarra...";41.3842249;2.1537288;barcelona
1.200 €/mes;;/alquilar/piso-els_molins_poble_sec_pins_vens-45026090552_500025/;Els Molins-Poble Sec-Pins Vens (Sitges);2 habs.;1 baño;95 m²;2ª planta;Piso en alquiler en sitges (els molins - observatorio - pins vens): c/ lluis companys junto avinguda josep miró argenter. Con pisc...;41.2398919;1.8161785;barcelona
3.800 €/mes;;/alquilar/piso-la_dreta_de_eixample08007-41668156226_106700/;La Dreta de l'Eixample (Distrito Eixample. Barcelona Capital);3 habs.;3 baños;120 m²;;"Piso en alquiler amueblado y con terraza.

Te presentamos este magnífico piso ubicado en prestigiosa calle, en un encantador edifi...";41.38581879;2.167228266;barcelona
775 €/mes;;/alquilar/piso-remei_montseny_la_guixa08500-45032219229_100500/;Remei-Montseny-La Guixa (Vic);3 habs.;2 baños;82 m²;;Fantàstic pis d'obra nova en lloguer a la plaça de la noguera de vic. El pis està distribuït amb una cuina-office oberta al menjad...;41.919996491;2.250017506;barcelona
2.700 €/mes;;/alquilar/piso-sant_pere_santa_caterina_la_ribera08010-44239232117_109300/;Sant Pere-Santa Caterina-La Ribera (Distrito Ciutat Vella. Barcelona Capital);2 habs.;2 baños;110 m²;;"Apartamento de 2 dormitorios en el eixample - disponoble ahora para alquileres de 32 a 11 meses&nbsp;
Este bonito apartamento de 2...";41.3909867;2.1794126;barcelona
850 €/mes;;/alquilar/piso-nord_el_sucre_universitat-37581858705_513880/;Nord-El Sucre-Universitat (Vic);2 habs.;1 baño;85 m²;1ª planta;"Fantástico piso en alquiler en vic, muy céntrico, frente a estación de tren a pocos metros de la plaza mayor.
Piso con ascensor y...";41.930848689;2.249670792;barcelona
2.500 €/mes;;/alquilar/piso-granollers_centre08402-42566129553_501329/;Centre (Granollers);4 habs.;2 baños;100 m²;1ª planta;Vivienda en piso primero, de 4 habitaciones y 2 despachos que se alquila conjuntamente con el local de la planta baja en el pleno ...;41.6053253;2.289154;barcelona
1.490 €/mes;Piso en Passatge de Marimon, 18;/alquilar/piso-sant_gervasi_galvany08021-45040511014_100500/;Sant Gervasi-Galvany (Distrito Sarrià-Sant Gervasi. Barcelona Capital);2 habs.;1 baño;84 m²;4ª planta;Piso soleado y alto muy bien situado y reformado con mucho gusto. El piso tiene una habitación doble con vestidor y una habitación...;41.3945;2.14777;barcelona
2.950 €/mes;;/alquilar/piso-sant_marti_el_poblenou08019-45045896815_108900/;El Poblenou (Distrito Sant Martí. Barcelona Capital);3 habs.;2 baños;81 m²;1ª planta;Alquiler de temporada¡Bienvenidos a nuestro acogedor apartamento de tres dormitorios cerca de la playa de mar bella! Este encantad...;41.403525827;2.211418928;barcelona
4.500 €/mes;;/alquilar/casa_pareada-eixample_torreblanca08172-45924169709_106700/;L'Eixample-Torreblanca (Sant Cugat del Vallès);4 habs.;3 baños;352 m²;;"Coldwell banker premium te da la bienvenida a la casa de tus sueños en alquiler.
Esta maravillosa casa adosada semi amueblada ofre...";41.4643422;2.0829535;barcelona
2.800 €/mes;;/alquilar/piso-les_botigues_de_sitges-38351956061_153800/;Les Botigues de Sitges (Sitges);3 habs.;2 baños;70 m²;3ª planta;"Espectacular vivienda de alquiler  en la zona de les botigues. 
En finca con ascensor y trastero. Vivienda de 2 habitaciones doble...";41.2584108;1.9225227;barcelona
1.500 €/mes;;/alquilar/piso-el_barri_gotic08002-45073663314_992744/;El Barri Gòtic (Distrito Ciutat Vella. Barcelona Capital);2 habs.;1 baño;45 m²;5ª planta;"Alquiler temporal
¡Descubre este encantador piso de alquiler temporal en el emblemático barrio gótico de barcelona! Con dos habita...";41.3820943;2.1732823;barcelona
3.300 €/mes;Piso en Carrer d'Aribau, 228;/alquilar/piso-sant_gervasi_galvany08006-45064986621_109300/;Sant Gervasi-Galvany (Distrito Sarrià-Sant Gervasi. Barcelona Capital);4 habs.;4 baños;188 m²;;"¡Descubre tu nuevo hogar en el corazón de barcelona! 
Este impresionante piso de 188 m² te ofrece una experiencia de vida iniguala...";41.395247;2.150315;barcelona
1.100 €/mes;;/alquilar/estudio-el_putxet_el_farro08006-45851902047_527929/;El Putxet-El Farró (Distrito Sarrià-Sant Gervasi. Barcelona Capital);1 hab.;1 baño;51 m²;;"Alquiler de temporada: piso tipo loft en planta baja

¡Descubre tu nuevo hogar en el encantador barrio de el putxet i el farró en ...";41.402811;2.1471592;barcelona
850 €/mes;;/alquilar/duplex-vic_centre_historic-45044860380_225000/;Centre Històric (Vic);2 habs.;2 baños;136 m²;3ª planta;Oportunitat!! Es ven àtic/dúplex invertit, situat a 3 minuts de la plaça major, i a tocar d' escoles i serveis. L' habitatge té un...;41.932647209;2.256684478;barcelona
1.300 €/mes;;/alquilar/atico-montcada_centre_la_ribera-45011691166_100500/;Montcada Centre-La Ribera (Montcada i Reixac);5 habs.;2 baños;130 m²;;Ático de 117m² con  espectacular terraza de 50 m² a  piso, 5 habitaciones ,  baño completo con plato de ducha con mampara a medida...;41.4832705;2.1891513;barcelona
1.750 €/mes;Piso en Carrer de Balmes, nº 366;/alquilar/piso-el_putxet_el_farro08006-1719679710_100500/;El Putxet-El Farró (Distrito Sarrià-Sant Gervasi. Barcelona Capital);2 habs.;1 baño;80 m²;2ª planta;"Fantástica oportunidad alquiler de temporada en barcelona!!!!!

Inmejorable ubicación de  piso de alquiler de temporada  en el cor...";41.40423;2.1415;barcelona
1.200 €/mes;;/alquilar/piso-ciutat_vella_la_barceloneta08003-30078016938_100200/;La Barceloneta (Distrito Ciutat Vella. Barcelona Capital);2 habs.;2 baños;45 m²;;"Alquiler temporal de (11 meses) con fines de ocio, vacacionales, laborales y estudios.
Dúplex completamente reformado situado a ni...";41.3802294;2.1910857;barcelona
1.100 €/mes;Piso en Carrer de Berenguer Mallol, 1;/alquilar/piso-ciutat_vella_la_barceloneta08003-45089729800_108900/;La Barceloneta (Distrito Ciutat Vella. Barcelona Capital);1 hab.;1 baño;35 m²;;"Disponible para alquiler temporal  a partir de 01.08.20224

Importante: 
Estancia mínima seis meses
Solicitud documentación como n...";41.3803997;2.1918299;barcelona
1.510 €/mes;;/alquilar/piso-sant_joan_despi_centro_urbano08970-45844292901_108900/;Sant Joan Despí;3 habs.;2 baños;133 m²;;"Exel real estate ofrece este piso alto, exterior y soleado ubicado en la zona eixample de sant joan despi. 
La vivienda está compu...";41.3650459;2.0544783;barcelona
7.000 €/mes;;/alquilar/casa-el_masnou_centro_urbano-27593134038_517277/;El Masnou;6 habs.;6 baños;591 m²;;A tan solo 2 km de la playa y a unos 18 km de barcelona, cerca del pueblo donde tenemos todos los servicios, equipamientos, comerc...;41.489133549;2.308982642;barcelona
3.000 €/mes;Piso en Carrer del Mar;/alquilar/piso-el_barri_gotic08003-34219348094_108900/;El Barri Gòtic (Distrito Ciutat Vella. Barcelona Capital);2 habs.;1 baño;72 m²;2ª planta;"Este apartamento cómodo de buenas dimensiones tiene todo lo que necesita para vivir en el casco antiguo de barcelona. 
El apartame...";41.380845;2.187727;barcelona
5.200 €/mes;;/alquilar/apartamento-sant_gervasi_galvany-45864925858_522145/;Sant Gervasi-Galvany (Distrito Sarrià-Sant Gervasi. Barcelona Capital);3 habs.;2 baños;190 m²;5ª planta;"Disponibilidad: inmediata 
Tipo de alquiler:  temporal hasta 11 meses

Te presentamos este magnífico piso en alquiler, ubicado en ...";41.3919412;2.1429649;barcelona
2.500 €/mes;;/alquilar/piso-el_barri_gotic08002-43398507905_522145/;El Barri Gòtic (Distrito Ciutat Vella. Barcelona Capital);4 habs.;2 baños;100 m²;3ª planta;Este luminoso piso en alquiler se encuentra en el corazón de el barri gòtic, en barcelona capital. Con una superficie total de 100...;41.3840835;2.173477;barcelona
1.790 €/mes;;/alquilar/piso-la_dreta_de_eixample08013-45899754721_100500/;La Dreta de l'Eixample (Distrito Eixample. Barcelona Capital);2 habs.;2 baños;84 m²;2ª planta;"Alquiler de temporada, mínimo: 6 meses, máximo: 11 meses o mientras dure el motivo temporal.

¿Tenemos que renunciar a un hogar si...";41.3979597;2.176169;barcelona
5.900 €/mes;;/alquilar/apartamento-la_dreta_de_eixample08008-43370341962_522145/;La Dreta de l'Eixample (Distrito Eixample. Barcelona Capital);3 habs.;3 baños;256 m²;4ª planta;"Would you like to live in eixample?

Modern barcelona was born in l'eixample, devised by the engineer and urban planner to whom it...";41.3933936;2.1628657;barcelona
5.900 €/mes;;/alquilar/piso-la_dreta_de_eixample08008-45010861385_141200/;La Dreta de l'Eixample (Distrito Eixample. Barcelona Capital);4 habs.;3 baños;256 m²;3ª planta;"Maravilloso piso exterior amueblado de 221 m² útiles en paseo de gràcia en finca regia.
Situado en un entorno privilegiado,  lleno...";41.3932689;2.163900583;barcelona
7.000 €/mes;;/alquilar/casa-centre_urba-25853583073_517277/;Centre Urbà (Sant Andreu de Llavaneres);7 habs.;10 baños;700 m²;;Año construcción: 2009. Estado conservación: muy buena. Habitaciones: 7. Orientación: 4 vientos. Salón (m ): 100.00. Dormitorios: ...;41.577154;2.4862562;barcelona
3.850 €/mes;;/alquilar/piso-sarria_sant_gervasi_sarria08034-35013154270_141200/;Sarrià (Distrito Sarrià-Sant Gervasi. Barcelona Capital);4 habs.;4 baños;180 m²;1ª planta;"Disponible a partir del 1 de agosto 2024:
Piso  alto standing, totalmente reformado y amueblado - exterior -con piscina comunitari...";41.392278728;2.128788475;barcelona
3.700 €/mes;;/alquilar/piso-la_dreta_de_eixample08010-42524257203_522145/;La Dreta de l'Eixample (Distrito Eixample. Barcelona Capital);4 habs.;2 baños;200 m²;3ª planta;"Fecha disponible: 1 de octubre 2023
Tipo de contrato: temporal hasta 11 meses
Cocina: completamente equipada
Dormitorios dobles: 3...";41.394150094;2.174486662;barcelona
3.750 €/mes;Ático en Avinguda Sant Andreu, 7;/alquilar/atico-port_balis_platges-45849057449_108700/;Port Balís-Platges (Sant Andreu de Llavaneres);6 habs.;4 baños;210 m²;;Ático totalmente reformado y amueblado con vistas al mar increíbles en alquiler en sant andreu de llavaneres - maresme, a solo 35 ...;41.5578;2.49863;barcelona
1.750 €/mes;;/alquilar/piso-els_molins_poble_sec_pins_vens-45053808304_108900/;Els Molins-Poble Sec-Pins Vens (Sitges);3 habs.;2 baños;94 m²;;"Disponible para alquiler de larga temporada, apartamento de obra nueva a estrenar.

Se trata de una moderna y luminosa planta baja...";41.244774;1.8107927;barcelona
8.000 €/mes;;/alquilar/duplex-el_putxet_el_farro08006-43372845610_522145/;El Putxet-El Farró (Distrito Sarrià-Sant Gervasi. Barcelona Capital);5 habs.;6 baños;320 m²;8ª planta;"Este increíble triplex con piscina y múltiples terrazas ya está disponible.

En la primera planta, la entrada principal, el dormit...";41.3973871;2.1476813;barcelona
19.000 €/mes;;/alquilar/atico-pedralbes08034-45008321655_522145/;Pedralbes (Distrito Les Corts. Barcelona Capital);5 habs.;6 baños;546 m²;;"¡Bienvenido al lujoso ático que estás buscando en pedralbes, barcelona!

Este exclusivo ático de lujo cuenta con 5 dormitorios dob...";41.3929249;2.1150659;barcelona
2.900 €/mes;;/alquilar/apartamento-les_corts_barrio08029-45907309596_100500/;Les Corts (Distrito Les Corts. Barcelona Capital);2 habs.;2 baños;90 m²;4ª planta;"Disponibilidad a partir del 15 de agosto

Alquiler de temporada  - entre 32 días y 11 meses

Sin gastos de agencia !!

¿ Quieres d...";41.3857484;2.1400938;barcelona
2.173 €/mes;;/alquilar/piso-la_vila_de_gracia08008-45040213794_522145/;La Vila de Gràcia (Distrito Gràcia. Barcelona Capital);1 hab.;1 baño;60 m²;Bajo;"Exclusivo piso de obra nueva en paseo de gracia con piscina y terraza

Descubre el lujo y la comodidad en este impresionante piso ...";41.397974;2.1582048;barcelona
3.700 €/mes;Chalet en Camí de Can Gatxet;/alquilar/chalet-sant_cugat_del_valles_mira_sol08195-43410659950_108900/;Mira-sol (Sant Cugat del Vallès);6 habs.;4 baños;342 m²;;Preciosa casa unifamiliar situada en mirasol, en la zona de can gatxet. Casa de 250m² construidos sobre una parcela de 650m². Plan...;41.468527;2.063762;barcelona
2.800 €/mes;;/alquilar/piso-la_dreta_de_eixample08007-45064902844_522145/;La Dreta de l'Eixample (Distrito Eixample. Barcelona Capital);2 habs.;2 baños;85 m²;2ª planta;"Alquiler temporal

Exclusivo piso disponible recientemente reformado ubicado en el distrito de dreta de l'eixample, donde albergan...";41.3889335;2.163301;barcelona
2.700 €/mes;;/alquilar/piso-antiga_esquerra_de_eixample08011-45871438422_522145/;L'Antiga Esquerra de l'Eixample (Distrito Eixample. Barcelona Capital);2 habs.;1 baño;90 m²;1ª planta;"Alquiler temporal hasta 11 meses

Ubicación:
Este piso se encuentra en el corazón de dreta de l'eixample, una de las zonas más exc...";41.387963;2.1590307;barcelona
3.040 €/mes;;/alquilar/atico-la_sagrada_familia08013-40894250616_100500/;La Sagrada Família (Distrito Eixample. Barcelona Capital);3 habs.;2 baños;110 m²;;"*apartamento con terraza*
*completamente amueblado* 
*alquiler mensual de 1 a 11 meses* 

El diseño de yoko evoca el ambiente tran...";41.4024322;2.180211;barcelona
4.500 €/mes;;/alquilar/piso-el_camp_en_grassot_gracia_nova08025-45034141791_994552/;El Camp d'en Grassot-Gràcia Nova (Distrito Gràcia. Barcelona Capital);4 habs.;3 baños;196 m²;5ª planta;Precioso piso señorial en barcelona, ideal para pasar temporada de estudios o trabajo. Ubicado en zona céntrica, muy cerca de la s...;41.40522829;2.1685653;barcelona
6.500 €/mes;;/alquilar/chalet_unifamiliar-port_balis_platges-41766098409_517277/;Port Balís-Platges (Sant Andreu de Llavaneres);7 habs.;4 baños;578 m²;;¡Bienvenido al hogar de tus sueños en sant andreu de llavaneres, presentado por gpcasa! Esta espectacular casa de diseño en alquil...;41.5591859;2.4965048;barcelona
3.300 €/mes;;/alquilar/piso-sant_gervasi_galvany08006-44264946645_106700/;Sant Gervasi-Galvany (Distrito Sarrià-Sant Gervasi. Barcelona Capital);3 habs.;3 baños;168 m²;;"Alquiler temporal de 1 hasta 11 meses 
Disponible a partir del 1 de agosto 

Señorial apartamento de 168m², 3 habitaciones y 3 bañ...";41.394479;2.150468;barcelona
3.700 €/mes;;/alquilar/piso-la_dreta_de_eixample08007-45079504807_522145/;La Dreta de l'Eixample (Distrito Eixample. Barcelona Capital);1 hab.;1 baño;47 m²;4ª planta;El apartamento cuenta con una cómoda habitación doble y un moderno baño, lo que lo hace perfecto para una pareja o un viajero solt...;41.396032;2.1724595;barcelona
4.175 €/mes;;/alquilar/piso-sant_gervasi_galvany08021-40850517555_100500/;Sant Gervasi-Galvany (Distrito Sarrià-Sant Gervasi. Barcelona Capital);4 habs.;3 baños;182 m²;4ª planta;"*completamente amueblado*
*alquileres mensuales de 1 a 11 meses*

Bienvenido a delfino, un apartamento de 182 metros cuadrados en ...";41.401391765;2.136490935;barcelona
2.000 €/mes;;/alquilar/piso-nou_barris_canyelles08042-37566418983_517277/;Canyelles (Distrito Nou Barris. Barcelona Capital);3 habs.;1 baño;80 m²;5ª planta;En esta ocasión la inmobiliaria gpcasa les ofrece un piso en barcelona de alquiler de temporada, un bonito piso amueblado, decorad...;41.4347129;2.1707388;barcelona
2.070 €/mes;;/alquilar/piso-sant_pere_santa_caterina_la_ribera08003-40904291924_100500/;Sant Pere-Santa Caterina-La Ribera (Distrito Ciutat Vella. Barcelona Capital);2 habs.;2 baños;71 m²;1ª planta;"*completamente amueblado*
*alquileres mensuales de 1 a 11 meses*

Experimente la esencia de la vida barcelonesa en arros, una acog...";41.388906912;2.182647291;barcelona
1.600 €/mes;;/alquilar/apartamento-el_barri_gotic08002-3406089770_100500/;El Barri Gòtic (Distrito Ciutat Vella. Barcelona Capital);1 hab.;1 baño;37 m²;;En el barrio gótico de barcelona. Situado en el distrito de ciutat vella, en el corazón la ciudad, el barrio gótico (barri gòtic) ...;41.3833866;2.1726573;barcelona
4.700 €/mes;;/alquilar/piso-el_fort_pienc08010-37583033751_522145/;El Fort Pienc (Distrito Eixample. Barcelona Capital);5 habs.;3 baños;220 m²;Entresuelo;"Fecha disponible: 4 de septiembre 2023
Tipo de contrato: temporal hasta 11 meses
Cocina: completamente equipada
Dormitorios dobles...";41.400339;2.1753976;barcelona
2.755 €/mes;;/alquilar/piso-sant_pere_santa_caterina_la_ribera08003-40838833073_100500/;Sant Pere-Santa Caterina-La Ribera (Distrito Ciutat Vella. Barcelona Capital);2 habs.;2 baños;76 m²;3ª planta;"*completamente amueblado*
*alquileres mensuales de 1 a 11 meses*

Presentamos fiore, un encantador santuario de 76 metros cuadrado...";41.3856334;2.1809086;barcelona
2.555 €/mes;;/alquilar/atico-la_dreta_de_eixample08010-40840443893_100500/;La Dreta de l'Eixample (Distrito Eixample. Barcelona Capital);1 hab.;1 baño;62 m²;;"*apartamento con terraza*
*completamente amueblado*
*alquileres mensuales de 1 a 11 meses*

Presentamos isola, un elegante apartam...";41.3919556;2.1724806;barcelona
1.950 €/mes;;/alquilar/piso-sant_sebastia_aiguadolc08870-42525479040_108900/;Sant Sebastià-Aiguadolç (Sitges);3 habs.;2 baños;92 m²;1ª planta;"Disponible de septiembre a junio, este apartamento se encuentra en segunda línea de mar en la playa de san sebastián.
El centro de...";41.237188;1.8147807;barcelona
5.000 €/mes;;/alquilar/piso-la_dreta_de_eixample08008-41686978108_106700/;La Dreta de l'Eixample (Distrito Eixample. Barcelona Capital);4 habs.;3 baños;144 m²;;"Alquiler temporal, hasta 11 meses. Ya disponible. 

Amplio y elegante piso de 144m² construidos, de 4 habitaciones, 3 baños y un b...";41.3942019;2.1594223;barcelona
1.790 €/mes;;/alquilar/piso-la_dreta_de_eixample08013-34250547954_100500/;La Dreta de l'Eixample (Distrito Eixample. Barcelona Capital);2 habs.;2 baños;84 m²;2ª planta;"Alquiler de temporada, mínimo: 6 meses, máximo: 11 meses o mientras dure el motivo temporal.

¿Tenemos que renunciar a un hogar si...";41.3982782;2.1757475;barcelona
2.200 €/mes;;/alquilar/casa-cabrils_centro_urbano-45913992538_520227/;Cabrils;4 habs.;4 baños;288 m²;;Esta espectacular casa en alquiler se encuentra en el municipio de cabrils, ubicada a pocos metros del centro del pueblo y zona co...;41.518221463;2.371689199;barcelona
2.905 €/mes;;/alquilar/piso-el_putxet_el_farro08006-40885630146_100500/;El Putxet-El Farró (Distrito Sarrià-Sant Gervasi. Barcelona Capital);3 habs.;2 baños;90 m²;2ª planta;"*completamente amueblado*
*alquileres mensuales de 1 a 11 meses*

Kananga es elegante y brillante, con colores atrevidos y detalle...";41.4026537;2.1513455;barcelona
3.055 €/mes;;/alquilar/piso-antiga_esquerra_de_eixample08011-40926700251_100500/;L'Antiga Esquerra de l'Eixample (Distrito Eixample. Barcelona Capital);2 habs.;2 baños;75 m²;4ª planta;"*completamente amueblado*
*alquileres mensuales de 1 a 11 meses*

Mezclando la modernidad con el clasicismo, esta casa de 75 metro...";41.382981318;2.162082608;barcelona
2.670 €/mes;;/alquilar/piso-el_parc_la_llacuna_del_poblenou08018-40855106247_100500/;El Parc-La Llacuna del Poblenou (Distrito Sant Martí. Barcelona Capital);2 habs.;2 baños;67 m²;4ª planta;"*completamente amueblado*
*alquileres mensuales de 1 a 11 meses*

Bienvenido a gragnano, un encantador apartamento de 2 dormitorio...";41.3995232;2.1966974;barcelona
2.200 €/mes;;/alquilar/apartamento-sant_sebastia_aiguadolc08870-45054391644_101800/;Sant Sebastià-Aiguadolç (Sitges);2 habs.;2 baños;87 m²;;"Alquiler de temporada. Consulta los precios de meses de verano y la disponibilidad. Estancia mínima 1 mes hasta 1 año.
Este acoged...";41.2354821;1.8242056;barcelona
2.950 €/mes;;/alquilar/piso-sitges_centre-45058770103_101800/;Centre (Sitges);3 habs.;2 baños;120 m²;1ª planta;¡Descubra la casa de sus sueños en el corazón de sitges! Este elegante piso totalmente amueblado de tres dormitorios y dos baños o...;41.2361117;1.8118622;barcelona
2.555 €/mes;;/alquilar/piso-sarria_sant_gervasi_sarria08034-40919924096_100500/;Sarrià (Distrito Sarrià-Sant Gervasi. Barcelona Capital);2 habs.;2 baños;69 m²;3ª planta;"*completamente amueblado*
*alquileres mensuales de 1 a 11 meses*

Espectacular piso en la calle manuel de falla con 2 dormitorios ...";41.3932394;2.124399;barcelona
2.560 €/mes;;/alquilar/piso-el_putxet_el_farro08006-40921922757_100500/;El Putxet-El Farró (Distrito Sarrià-Sant Gervasi. Barcelona Capital);2 habs.;1 baño;65 m²;1ª planta;"*apartamento con parking*
*completamente amueblado*
*alquileres mensuales de 1 a 11 meses*

Cortijo es un impresionante apartament...";41.4035135;2.1461343;barcelona
650 €/mes;;/alquilar/casa-sant_quirze_de_besora_centro_urbano-42533424569_501452/;Sant Quirze de Besora;2 habs.;2 baños;94 m²;;"En la planta baja y encontramos el garaje, cuarto de la caldera y la entrada; planta primera con recibidor, cocina, despensa y com...";42.1011118;2.2202924;barcelona
2.100 €/mes;;/alquilar/chalet_unifamiliar-vilassar_de_dalt_centro_urbano-45026162536_517255/;Vilassar de Dalt;4 habs.;3 baños;260 m²;;"Casa adosada en alquiler, 230m² + jardín de 30m²

Casa adosada de 230m² construidos, más aproximadamente 30m² de jardín. La vivien...";41.520172355;2.3524901;barcelona
1.500 €/mes;Piso en Carrer de la Mercè;/alquilar/piso-el_barri_gotic08002-27506947104_108900/;El Barri Gòtic (Distrito Ciutat Vella. Barcelona Capital);1 hab.;1 baño;63 m²;4ª planta;El apartamento está situado en el barrio gótico que realmente es el verdadero corazón de barcelona. Se encuentra en la zona cercan...;41.37884;2.179383;barcelona
3.660 €/mes;;/alquilar/piso-la_dreta_de_eixample08010-40894047784_100500/;La Dreta de l'Eixample (Distrito Eixample. Barcelona Capital);3 habs.;2 baños;116 m²;2ª planta;"*completamente amueblado*
*alquileres mensuales de 1 a 11 meses*

Espectacular piso en carrer de casp, con 3 dormitorios, un despa...";41.391891;2.1742572;barcelona
1.845 €/mes;;/alquilar/piso-el_putxet_el_farro08006-45921015869_998932/;El Putxet-El Farró (Distrito Sarrià-Sant Gervasi. Barcelona Capital);3 habs.;2 baños;148 m²;6ª planta;Disponible a partir del 16 de julio: magnífico piso totalmente reformado de 137 m² en ronda general mitre. Totalmente exterior, co...;41.4057963;2.1456779;barcelona
3.120 €/mes;;/alquilar/piso-sant_gervasi_galvany08021-40854113600_100500/;Sant Gervasi-Galvany (Distrito Sarrià-Sant Gervasi. Barcelona Capital);2 habs.;2 baños;93 m²;3ª planta;"*apartamento con balcón*
*completamente amueblado*
*alquileres mensuales de 1 a 11 meses*

Bienvenido a arienzo, un elegante apart...";41.403263;2.1375714;barcelona
2.655 €/mes;;/alquilar/piso-la_dreta_de_eixample08007-40921859044_100500/;La Dreta de l'Eixample (Distrito Eixample. Barcelona Capital);2 habs.;2 baños;80 m²;4ª planta;"*completamente amueblado*
*alquileres mensuales de 1 a 11 meses*

Esta propiedad única de 80 metros cuadrados muestra la belleza d...";41.3958861;2.1597868;barcelona
3.620 €/mes;;/alquilar/piso-la_dreta_de_eixample08010-40853375167_100500/;La Dreta de l'Eixample (Distrito Eixample. Barcelona Capital);2 habs.;1 baño;79 m²;3ª planta;"*completamente amueblado*
*alquileres mensuales de 1 a 11 meses*

Bienvenido a agerola, un elegante apartamento con temática playe...";41.388063829;2.170200692;barcelona
1.500 €/mes;;/alquilar/apartamento-el_barri_gotic08002-23375918715_100500/;El Barri Gòtic (Distrito Ciutat Vella. Barcelona Capital);;1 baño;41 m²;;En el barrio gótico de barcelona. Situado en el distrito de ciutat vella, en el corazón la ciudad, el barrio gótico (barri gòtic) ...;41.3838139;2.1737963;barcelona
2.900 €/mes;;/alquilar/piso-eixample_sant_antoni08011-40857038699_100500/;Sant Antoni (Distrito Eixample. Barcelona Capital);3 habs.;2 baños;69 m²;4ª planta;"*completamente amueblado*
*alquileres mensuales de 1 a 11 meses*

Bienvenido a aneto, un encantador refugio con temática de montañ...";41.3832598;2.1605046;barcelona
