precio;sub_descr;href;ubicacion;habitaciones;banios;mt2;planta;otros;latitude;longitude;CCAA
209.000 €;Piso en Carrer de Salvador Seguí, 2;/comprar/piso-barceloneta-39197670704_441400/;Barceloneta (Vilafranca del Penedès);3 habs.;2 baños;96 m²;Bajo;Vilomara associats – obra nueva, directa del promotor – ¡Ma ra vi llo sa! La promotora tengil immobles, constructora con dilatada ...;41.35483012951888;1.7033584922889131;barcelona
222.250 €;Piso en Carrer de Salvador Seguí, 2;/comprar/piso-barceloneta-39232059266_441400/;Barceloneta (Vilafranca del Penedès);3 habs.;2 baños;104 m²;Bajo;Vilomara associats – obra nueva, directa del promotor – ¡Ma ra vi llo sa! La promotora tengil immobles, constructora con dilatada ...;41.35483012951888;1.7033584922889131;barcelona
420.000 €;;/comprar/casa-viladecavalls_centro_urbano-41739936941_100500/;Viladecavalls;7 habs.;3 baños;210 m²;;"¡Bienvenido a tu nuevo hogar en viladecavalls! 

Esta impresionante casa de 3 plantas y párquing, te invita a vivir una experienci...";41.5691409;1.9751903;barcelona
975.000 €;;/comprar/casa_adosada-castelldefels_la_pineda-44223550214_101800/;La Pineda (Castelldefels);3 habs.;2 baños;189 m²;;"¡Nueva promoción! Casas adosadas de obra nueva en la pineda de castelldefels

Descubre la exclusividad de esta promoción de casas ...";41.2691948;1.9869946;barcelona
604.000 €;Dúplex en Carrer de Gomis, 42;/comprar/duplex-vallcarca_els_penitents08023-3567666321_109700/;Vallcarca-Els Penitents (Distrito Gràcia. Barcelona Capital);2 habs.;2 baños;87 m²;Bajo;Bxs. 2ª (dúplex). Dúplex en un edificio de obra nueva de 87 m² de superficie construida y ubicado en la zona de barcelona capital,...;41.4131063;2.1401507;barcelona
490.000 €;Casa en Carrer del Doctor Bayés, 22;/comprar/casa-tona_centro_urbano-5899865020_213400/;Tona;5 habs.;4 baños;272 m²;;¡No pierdas la oportunidad de adquirir esta magnífica casa señorial en venta en tona! Esta impresionante propiedad se encuentra en...;41.85553357403279;2.2295376868090813;barcelona
394.900 €;;/comprar/chalet-vallirana_centro_urbano-42591941349_103800/;Vallirana;6 habs.;4 baños;243 m²;;"Somos propietarios. Directamente con la propiedad.  

¿Le gustaría vivir en un chalet único a tan solo 20 minutos de barcelona? No...";41.374280915;1.939118841;barcelona
214.000 €;;/comprar/piso-ripollet_centre-45030053536_501047/;Centre (Ripollet);3 habs.;1 baño;158 m²;Sótano;"Bajos con terraza con una superficie de 158 m².

El piso cuenta con con 3 dormitorios (2 dobles), perfecto para una familia, un am...";41.49951191;2.158433786;barcelona
298.000 €;;/comprar/piso-el_barri_gotic08002-36749858484_100500/;El Barri Gòtic (Distrito Ciutat Vella. Barcelona Capital);2 habs.;1 baño;64 m²;4ª planta;"Grup90 comercializa encantador apartamento del 2003 con parking en la misma finca a 250 metros del gran teatro del liceo. 

La viv...";41.380106846;2.173949416;barcelona
236.000 €;;/comprar/piso-terrassa_centre-40914544749_455500/;Centre (Terrassa);4 habs.;2 baños;153 m²;2ª planta;Amplio piso centro en zona rambla para reformar : vivienda de 153 m²  construidos con un total  de 138 m² útiles. Distribuido en  ...;41.5620732;2.0089738;barcelona
275.000 €;;/comprar/piso-pineda_de_mar_centre-41738044831_996907/;Centre (Pineda de Mar);3 habs.;2 baños;103 m²;2ª planta;"Excepcional piso con vistas al mar con terraza y junto todos los servicios en pineda centro
Gran piso de 103m² 
Comedor con chimen...";41.620820928;2.688175852;barcelona
95.000 €;;/comprar/piso-nou_barris_roquetes08042-41670120885_100200/;Roquetes (Distrito Nou Barris. Barcelona Capital);2 habs.;1 baño;45 m²;;L'immoble està reformat de 55m², està distribuït de la següent manera: rebedor, continuant a una zona diàfana on hi ha la cuina i ...;41.4469317;2.1727249;barcelona
1.033.300 €;Piso en Carrer del Professor Barraquer;/comprar/piso-esplugues_de_llobregat_centro_urbano08950-4204880755_109700/;Esplugues de Llobregat;3 habs.;2 baños;139 m²;;B2-P2-D. Piso en una finca de obra nueva de 139 m2 de superficie construida y emplazado en la zona de Esplugues de Llobregat. Está dispuesto en 3 habitaciones, 2 baños completos, terraza y dispone de certificación energética A. Cuenta como extras ascensor, garaje.;41,3852228;2,0996387;barcelona
244.000 €;Piso en Carrer de Sant Pau, 92;/comprar/piso-centre_covadonga_centre08201-4654161576_109700/;Centre (Distrito Centre-Covadonga. Sabadell);2 habs.;1 baño;68 m²;;C22. Piso en un edificio de obra nueva de 68 m² de superficie construida y ubicado en la zona de sabadell. Está distribuido en 2 h...;41.5406213;2.1086817;barcelona
275.000 €;;/comprar/casa-calella_centro_urbano08370-38342212723_100500/;Calella;4 habs.;2 baños;124 m²;;Casa de pueblo situada en calella con una superfície de 124 m² distribuidos en 4 habitaciones, 2 baños, cocina independiente y com...;41.6173691;2.6605733;barcelona
544.200 €;Piso en Carrer de Joan Miró,  s/n;/comprar/piso-esplugues_de_llobregat_centro_urbano08950-4290613691_109700/;Esplugues de Llobregat;2 habs.;2 baños;100 m²;;T4-1-e. Piso en un edificio de obra nueva de 100 m² de superficie construida, 70 m² útiles y ubicado en la zona de esplugues de ll...;41.3847069;2.0998408;barcelona
650.000 €;;/comprar/piso-antiga_esquerra_de_eixample08011-44169319258_101300/;L'Antiga Esquerra de l'Eixample (Distrito Eixample. Barcelona Capital);4 habs.;2 baños;126 m²;;Ubicado en una de las zonas más emblemáticas de barcelona, este encantador piso en venta ofrece una combinación perfecta de espaci...;41.3867738;2.1620605;barcelona
194.690 €;Piso en Carrer de Sant Ferran, 39;/comprar/piso-distrito_gracia-40075757620_370400/;Gràcia (Sabadell);3 habs.;2 baños;81 m²;Bajo;"Sabadell gràcia  - plaça jocs florals (habitatges acabats)
Planta baixa obra nova protegida amb preu concertat al carrer sant ferr...";41.53760184205194;2.1059384868670765;barcelona
2.450.000 €;;/comprar/piso-la_dreta_de_eixample08008-4183988916_109700/;La Dreta de l'Eixample (Distrito Eixample. Barcelona Capital);3 habs.;3 baños;243 m²;;Piso en una finca de obra nueva de 243 m² de superficie construida y emplazado en la zona de barcelona capital. Está dispuesto en ...;41.392457567;2.158513377;barcelona
695.000 €;;/comprar/piso-eixample_sant_antoni08015-45071191829_101300/;Sant Antoni (Distrito Eixample. Barcelona Capital);3 habs.;4 baños;185 m²;;Espectacular tríplex de 170 m² ubicado en el corazón de barcelona, en el popular barrio de sant antoni.   En la planta principal, ...;41.3762148;2.1617127;barcelona
99.000 €;;/comprar/loft-el_raval08001-45909900733_101800/;El Raval (Distrito Ciutat Vella. Barcelona Capital);1 hab.;1 baño;26 m²;;"¿Te lo vas a perder? ************** producto estrella fincador!

Loft en venta en ciutat vella, en el barrio de el raval de barcel...";41.3806843;2.168528;barcelona
289.475 €;;/comprar/piso-tona_centro_urbano-20050390610_440100/;Tona;3 habs.;2 baños;109 m²;1ª planta;Altura piso 1º, piso superficie total 108,85 m², superficie útil 89,19 m², hab. Individuales: 1, habitaciones dobles: 2, hab. Dobl...;41.8456;2.22184;barcelona
238.000 €;;/comprar/casa-estadi_horta_vermella_santa_anna-45924516856_110700/;Estadi-Horta Vermella-Santa Anna (Vic);3 habs.;3 baños;158 m²;;Esta casa ofrece un confort excepcional con espacios amplios y bien distribuidos. En la planta baja, un gran garaje para dos coche...;41.922479612;2.254154122;barcelona
359.000 €;;/comprar/casa_adosada-hostal_lledoner08402-45875703617_528050/;L'Hostal-Lledoner (Granollers);4 habs.;2 baños;195 m²;;Se trata de una casa adosada unifamiliar de 195m² construidos según catastro, ubicada en buena zona de granollers nord. Cerca del ...;41.614553;2.2946519;barcelona
545.000 €;;/comprar/chalet-llevantina_montgavina_quint_mar_garraf08870-40858350573_108700/;Llevantina-Montgavina-Quint-Mar-Garraf (Sitges);4 habs.;2 baños;207 m²;;Iad presenta esta preciosa casa pareada en el barrio residencial de quintmar en sitges, construida en 2007. Con 207m² de superfici...;41.237175;1.8169663;barcelona
388.500 €;;/comprar/casa-piera_centro_urbano-38337126221_109100/;Piera;4 habs.;2 baños;160 m²;;Can mas presentamos una bonita casa , construida en 2007, con ladrillo macizo, y en una sola planta. Tiene una distribución muy có...;41.509065509;1.725726543;barcelona
180.000 €;;/comprar/duplex-la_geltru_casernes_armanya-35065960348_100500/;La Geltrú-Casernes-L'Armanyà (Vilanova i la Geltrú);3 habs.;1 baño;103 m²;2ª planta;Dúplex de 78 m² en venta, de 3 dormitorios situado en la localidad de vilanova i la geltrù, provincia de barcelona. La vivienda es...;41.227352468;1.726770771;barcelona
220.000 €;;/comprar/duplex-igualada_llevant08700-44207954872_100500/;Llevant (Igualada);3 habs.;2 baños;91 m²;2ª planta;¡Venta de dúplex en igualada, en la zona de la masuca! Este luminoso dúplex de 91m² ofrece una distribución ideal para tu comodida...;41.576614839;1.625218546;barcelona
460.000 €;;/comprar/duplex-sitges_centre-32595148726_134500/;Centre (Sitges);2 habs.;2 baños;109 m²;3ª planta;Espectacular ático dúplex con vistas despejadas en una zona tranquila del centro de sitges y ubicado en un cuidado edificio con as...;41.2370752;1.8059059;barcelona
945.000 €;;/comprar/finca_rustica-olivella_centro_urbano-35875118119_100500/;Olivella;9 habs.;9 baños;654 m²;;En uno de los entornos más únicos del garraf, se encuentra ubicada esta increíble masia totalmente rehabilitada y con unas vistas ...;41.282884622;1.761083361;barcelona
469.000 €;;/comprar/piso-la_sagrada_familia08025-37544727664_106700/;La Sagrada Família (Distrito Eixample. Barcelona Capital);3 habs.;2 baños;121 m²;;Maravilloso piso en finca regia con buena presencia en el corazón del barrio de la sagrada família. Cercano a transporte público, ...;41.4078686;2.1754363;barcelona
310.000 €;;/comprar/casa_unifamiliar-ca_noriol-45043320198_100200/;Ca n'Oriol (Rubí);4 habs.;3 baños;213 m²;;Os presentamos esta casa pareada situada en uno de los mejores barrios de rubí, els nius. La casa consta de 213m² de los cuales 14...;41.5035782;2.0474512;barcelona
280.000 €;;/comprar/casa-olivella_centro_urbano-44188673592_109300/;Olivella;3 habs.;2 baños;129 m²;;Chalet de 130m² construidos en parcela de 900m². Consta de tres habitaciones -1 en suite, 1 doble y otra individual- salón comedor...;41.2911056;1.7617032;barcelona
630.000 €;;/comprar/chalet-els_molins_poble_sec_pins_vens-44210871311_108700/;Els Molins-Poble Sec-Pins Vens (Sitges);4 habs.;2 baños;241 m²;;Bienvenido a esta espléndida casa a tres vientos, ubicada en el codiciado barrio de aiguadolç, que ofrece un entorno de vida excep...;41.2367309;1.8157177;barcelona
750.000 €;;/comprar/chalet-dosrius_centro_urbano-25083507862_108900/;Dosrius;7 habs.;4 baños;299 m²;;Dosrius. Rodeada de naturaleza, en una zona residencial, encontramos esta gran vivienda ubicada en una gran parcela esquinera, con...;41.597266493;2.404028307;barcelona
923.149 €;Piso en Carrer d'Álvarez, 19;/comprar/piso-arxius08173-4554691726_109700/;Arxius (Sant Cugat del Vallès);4 habs.;2 baños;212 m²;;2º1º . Piso en una finca de obra nueva de 212 m² de superficie construida y emplazado en la zona de sant cugat del vallès. Está di...;41.4675611;2.0743999;barcelona
360.587 €;;/comprar/casa_adosada-tona_centro_urbano-37535537453_101000/;Tona;5 habs.;2 baños;221 m²;;Acojedora casa unifamiliar con jardín y terraza en tona, diseñada con acabados de gran calidad. Está muy bien situada en la zona d...;41.845976079;2.222171501;barcelona
590.000 €;;/comprar/casa-vallirana_centro_urbano-42561300156_101800/;Vallirana;4 habs.;3 baños;223 m²;;"Te gustará saber:
· bonita y céntrica casa de 4 habitaciones con piscina, terraza e impresionantes vistas en la avda. Vall del sol...";41.39194338;1.939495783;barcelona
249.000 €;;/comprar/piso-la_creu_de_barbera08204-44215668407_108500/;La Creu de Barberà (Sabadell);3 habs.;2 baños;80 m²;;"Nueva promocion en sabadell. 
Edificio plurifamiliar  de obra nueva en la creu de barbera. 
La promocion cuenta con 14 viviendas y...";41.5271897;2.1247689;barcelona
155.000 €;;/comprar/piso-calella_centro_urbano08370-45066973292_996907/;Calella;2 habs.;1 baño;70 m²;1ª planta;"Excelente ubicación listo para entrar a vivir
Piso con ascensor en el centro de calella, dispone de dos habitaciones dobles, una c...";41.614297396;2.656372194;barcelona
565.000 €;;/comprar/piso-el_fort_pienc08010-43377249038_109300/;El Fort Pienc (Distrito Eixample. Barcelona Capital);4 habs.;2 baños;90 m²;4ª planta;Piso en venta en passeig de sant joan con plaza de parking, se ubica una de las mejores zonas de barcelona para vivir, con todo ti...;41.393431;2.1779057;barcelona
595.000 €;;/comprar/chalet-sant_muc_castellnou_can_mir-39222676225_100500/;Sant Muç-Castellnou-Can Mir (Rubí);4 habs.;2 baños;182 m²;;Casa esquinera con piscina en la perla. Esta exclusiva casa esquinera a cuatro vientos está en una de las mejores zonas residencia...;41.4867696;2.0128919;barcelona
430.000 €;;/comprar/casa_adosada-puigmolto_vinedos_can_macia08810-43426664734_109300/;Puigmoltó-Viñedos-Can Macià (Sant Pere de Ribes);3 habs.;2 baños;164 m²;;Descubre esta exclusiva joya inmobiliaria ubicada en el prestigioso barrio residencial de puigmoltó, en sant pere de ribes. Esta c...;41.248616656;1.770382748;barcelona
426.000 €;Piso en Carrer del Foc, 44;/comprar/piso-la_marina_del_prat_vermell_zona_franca_port08038-32563576941_109700/;La Marina del Prat Vermell-Zona Franca-Port (Distrito Sants-Montjuïc. Barcelona Capital);3 habs.;2 baños;;;"Edificio Oslo forma parte de AQ URBAN FIRA, un proyecto inmobiliario de reducido impacto ecológico situado en La Marina del Prat Vermell.

Dispone de viviendas de 2 y 3 dormitorios, con amplias y luminosas estancias, así como acceso a zonas comunes con todo tipo de servicios y comodidades: piscina, gimnasio, parque infantil, sala polivalente o zonas verdes.
Además, podrás elegir entre diferentes acabados para que puedas personalizar a tu gusto tu nuevo hogar, y dispone de un sistema Smart Home que facilitará tu día a día, con control de climatización o cierre total de luces al salir de casa mediante app o sensor de ventanas abiertas entre otros.

UN HOGAR QUE CUIDA DE TI Y DEL ENTORNO
Se trata de un proyecto de viviendas modernas y sostenibles, en favor de un modelo de urbanización responsable y comprometido con nuestro entorno: cuenta con el certificado Breeam nivel Very Good* método que evalúa y certifica la sostenibilidad en la edificación, además de tener eficiencia energética A y un sistema de aguas regeneradas.
La energía térmica viene de la mano de Ecoenergies, lo que supone numerosas ventajas tanto para tu hogar como para el medio ambiente, con una reducción de las emisiones de CO2  o una mejor calidad del aire.

LOS MEJORES PLANES, A 10 MINUTOS

El complejo se encuentra ubicado dentro del barrio de Sans-Montjuic, en Barcelona, donde tendrás a tu disposición una fantástica oferta cultural, además de las mejores alternativas de ocio al aire libre en la playa o en la montaña.

¿Quieres saber más sobre tu futuro hogar? Visita nuestra oficina de ventas en Carrer del Foc, 30

Características de las viviendas

– Viviendas de 2 y 3 dormitorios
– Plaza de garaje
– Amplias terrazas
– Piscina
– Gimnasio
– Sala polivalente
– Aparcamiento para bicicletas
– Zonas verdes
– Smart Home


*certificados provisionales referentes a la Fase de Diseño

Imágenes no contractuales y meramente ilustrativas sujetas a modificaciones por necesidades técnicas, jurídicas o comerciales de la dirección facultativa o exigencias municipales";41,354893;2,138648;barcelona
325.000 €;;/comprar/atico-barbera_del_valles_centro_urbano-43363163082_100500/;Barberà del Vallès;3 habs.;3 baños;111 m²;;"¡Áticos de obra nueva con terraza!

Ya construidos para entrega inmediata. 

En exclusiva : 
Edificio de pocos vecinos en barberà ...";41.518238079;2.125992531;barcelona
318.000 €;;/comprar/casa_adosada-sant_joan_de_vilatorrada_centro_urbano-44212539728_512449/;Sant Joan de Vilatorrada;4 habs.;2 baños;269 m²;;Superficie total 269 m², casa adosada superficie útil 250 m², hab. Individuales: 1, habitaciones dobles: 3, hab. Dobles son suites...;41.736908637;1.799641703;barcelona
590.000 €;;/comprar/chalet-collbato_centro_urbano-45076917969_100500/;Collbató;3 habs.;2 baños;314 m²;;Situado en un entorno tranquilo con vistas a la montaña de montserrat, con gran jardín y bonita piscina son algunas de las caracte...;41.562836218;1.820029921;barcelona
795.000 €;;/comprar/piso-pedralbes08034-40835721305_101300/;Pedralbes (Distrito Les Corts. Barcelona Capital);3 habs.;1 baño;154 m²;;Precioso piso situado en una des las mejores zonas de barcelona, entre sarrià y pedralbes, en la calle c/ capitán arenas, junto a ...;41.3902355;2.1259845;barcelona
260.000 €;;/comprar/piso-sant_joan_moli_de_vent-41685164913_365700/;Sant Joan-Molí de Vent (Vilanova i la Geltrú);2 habs.;1 baño;82 m²;1ª planta;¿Te gusta la idea de vivir en un espacio renovado con toda la comodidad y la luminosidad que necesitas? Este piso esquinero de 94 ...;41.222337712;1.717047712;barcelona
290.000 €;;/comprar/casa-piera_centro_urbano-41735639605_109100/;Piera;5 habs.;2 baños;206 m²;;Can marti casa muy cómoda y especial, para vivir toda la familia con todo lo que puedes imaginar. Está ubicada en una parcela de ...;41.550484929;1.751025545;barcelona
385.000 €;;/comprar/piso-vic_centre_historic-35088787133_213400/;Centre Històric (Vic);3 habs.;2 baños;110 m²;2ª planta;Descubre esta increíble nueva promoción de viviendas en el corazón de vic. Se ha llevado a cabo una cuidadosa reforma de un edific...;41.930021216;2.259358448;barcelona
281.000 €;Piso en Carrer de Victoria dels Àngels, 2;/comprar/piso-mas_rampinyo_carrerada_mas_pomada-3939227002_109700/;Mas Rampinyo-Carrerada-Mas Pomada (Montcada i Reixac);3 habs.;2 baños;104 m²;1ª planta;Esc. A - 1º 2ª. Piso en un inmueble de obra nueva de 104 m² de superficie construida y situado en la zona de montcada i reixac, ac...;41.498709;2.1822205;barcelona
1.740.930 €;Piso en Carrer Major de Sarrià, 191;/comprar/piso-sarria_sant_gervasi_sarria08017-2523367059_109700/;Sarrià (Distrito Sarrià-Sant Gervasi. Barcelona Capital);2 habs.;2 baños;126 m²;;Piso en un inmueble de obra nueva de 126 m² de superficie construida y situado en la zona de barcelona capital. Está estructurado ...;41.4033453;2.1171703;barcelona
220.000 €;;/comprar/casa-esparreguera_centro_urbano-42542093008_501686/;Esparreguera;5 habs.;2 baños;120 m²;;Casa a cuatro vientos de 120 metros con dos plantas a reformar, con muchas posibilidades en urbanización mas d'en gall. La primera...;41.532672315;1.835706942;barcelona
280.000 €;;/comprar/duplex-pla_de_sant_magi-40008594265_100500/;Pla de Sant Magí (Igualada);2 habs.;1 baño;80 m²;2ª planta;Situat a una de les millors zones de la ciutat, amb orientació sud-nord, amb unes vistes espectaculars. , amb tots els serveis bàs...;41.583884497;1.613384392;barcelona
164.000 €;;/comprar/piso-piera_centro_urbano-38346800807_109100/;Piera;3 habs.;2 baños;92 m²;3ª planta;Piera fantástico piso con ascensor y excelente ubicación, tiene 3 habitaciones completas, baño y aseo , cocina office con salida a...;41.524424405;1.748977646;barcelona
620.000 €;;/comprar/piso-el_barri_gotic08002-43376686258_101300/;El Barri Gòtic (Distrito Ciutat Vella. Barcelona Capital);4 habs.;2 baños;130 m²;;Vivienda a estrenar, equipada y amueblada, muy cerca de plaza sant jaume, ubicada en calle ancha y tranquila, y a la vez muy cerca...;41.381107;2.1781365;barcelona
260.000 €;;/comprar/casa_adosada-odena_centro_urbano-41682862008_100500/;Òdena;4 habs.;2 baños;193 m²;;Situada a òdena, molt a prop d'igualada i de vilanova del camí, amb tots els serveis bàsics a l'abast, supermercats, centres mèdic...;41.577355536;1.643818793;barcelona
328.000 €;;/comprar/casa-collsuspina_centro_urbano-37555685795_440100/;Collsuspina;4 habs.;2 baños;161 m²;;Torre de 161m² aprox  en un entorno único!! Toda en planta baja, rodeada de jardín, dispone de 3 dormitorios dobles  y una individ...;41.8246;2.16376;barcelona
A consultar;Chalet en Carrer de Menorca,  -;/comprar/chalet-serraparrera08290-42505879383_109700/;Serraparrera (Cerdanyola del Vallès);4 habs.;3 baños;257 m²;;. Gran oportunidad en serraparera, cerdanyola del vallès.¡En venta! Esta maravillosa casa unifamiliar adosada en cerdanyola del va...;41.4931;2.13242;barcelona
169.000 €;Piso en Carrer de Salvador Seguí, 2;/comprar/piso-barceloneta-39209383293_441400/;Barceloneta (Vilafranca del Penedès);2 habs.;1 baño;70 m²;1ª planta;Vilomara associats – obra nueva, directa del promotor – ¡Ma ra vi llo sa! La promotora tengil immobles, constructora con dilatada ...;41.35483012951888;1.7033584922889131;barcelona
589.000 €;;/comprar/casa_adosada-hostal_lledoner08401-45016490950_528050/;L'Hostal-Lledoner (Granollers);4 habs.;4 baños;350 m²;;"Masía del siglo xix de 350 m² 
En muy pocas ocasiones tenemos la oportunidad de adquirir una vivienda tan singular como esta masí...";41.6162317;2.2913258;barcelona
299.000 €;;/comprar/casa-sant_boi_de_llobregat_centre-41684743378_101800/;Centre (Sant Boi de Llobregat);4 habs.;3 baños;110 m²;;[ref. A3453] ¡Casa de 4 habitaciones única en la zona con una gran terraza a nivel soleada todo el día! Gran salón comedor de 30 m...;41.3454431;2.0409951;barcelona
995.000 €;;/comprar/chalet-premia_de_dalt_centro_urbano-40915012990_108900/;Premià de Dalt;5 habs.;4 baños;508 m²;;Descubre en exclusiva con setclaus esta residencia ubicada en premià de dalt. Un chalet de tres plantas orientado al sur, que te i...;41.497568799;2.336539748;barcelona
142.000 €;;/comprar/piso-ca_noriol-44171308878_100200/;Ca n'Oriol (Rubí);1 hab.;;38 m²;;Os presentamos este piso de 1 habitación en 33m² útiles más terraza de 17m², en la serreta. Es un inmueble de diseño actual y muy ...;41.5026848;2.0460614;barcelona
230.000 €;;/comprar/piso-el_congres_els_indians08027-39192758606_101300/;El Congrés-Els Indians (Distrito Sant Andreu. Barcelona Capital);5 habs.;1 baño;101 m²;;Oportunidad única en el barrio de el congrés. Amplio piso de 90m , perfecto para adecuar a tu gusto. Consta de 5 habitaciones, sal...;41.4259425;2.1825222;barcelona
640.000 €;;/comprar/piso-el_barri_gotic08002-43373476193_100500/;El Barri Gòtic (Distrito Ciutat Vella. Barcelona Capital);2 habs.;2 baños;114 m²;1ª planta;¡Fantástica oportunidad de adquirir esta vivienda nueva a estrenar en el corazón del barrio gótico en barcelona, completamente amu...;41.3810743;2.176931;barcelona
320.000 €;;/comprar/casa-la_gleva-54901235_440100/;La Gleva (Les Masies de Voltregà);4 habs.;2 baños;500 m²;;Torre a 3 vents de 500 m² !! Disposa de 4 habitacions (3 dobles), estudi de 70m² amb sortida a terrassa, 2 banys, cuina, 2 safarei...;42.007599175;2.241660011;barcelona
247.000 €;;/comprar/piso-la_cogullada08224-44205294461_455500/;La Cogullada (Distrito Segle XX-La Cogullada. Terrassa);3 habs.;2 baños;135 m²;Bajo;Confortable y funcional planta baja en la cogullada: vivienda de 135 m² construidos,  distribuidos en 80 m² útiles de vivienda y 4...;41.5549986;2.0163911;barcelona
650.000 €;;/comprar/piso-la_vila_de_gracia08012-35917041087_100500/;La Vila de Gràcia (Distrito Gràcia. Barcelona Capital);3 habs.;2 baños;130 m²;1ª planta;"Ideal inversores(actualmente se encuentra alquilada).

Amplia vivienda en el corazón del barrio de la vila de gracià. Consta de 13...";41.4015204;2.1556489;barcelona
149.500 €;;/comprar/atico-tordera_nucli_urba-41691758571_527526/;Nucli Urbà (Tordera);3 habs.;2 baños;104 m²;;Bonito piso ático dúplex en tordera, se trata de una vivienda con 104 m² construidos y de superficie útil 92m², en la planta baja ...;41.693903431;2.712598017;barcelona
650.000 €;;/comprar/piso-sitges_centre-40061256070_134500/;Centre (Sitges);3 habs.;2 baños;88 m²;2ª planta;Bonito y amplio piso en preciosa finca de 1920 totalmente rehabilitada en el centro de sitges. Amplia vivienda  con bonito salón c...;41.2371823;1.8086253;barcelona
695.000 €;;/comprar/piso-gracia_la_salut08023-4190624369_109700/;La Salut (Distrito Gràcia. Barcelona Capital);3 habs.;2 baños;98 m²;4ª planta;4º e. Piso en un inmueble de obra nueva de 98 m² de superficie construida y situado en la zona de barcelona capital, acomodado en ...;41.4087208;2.149916;barcelona
339.000 €;;/comprar/piso-la_geltru_casernes_armanya-44173761092_109300/;La Geltrú-Casernes-L'Armanyà (Vilanova i la Geltrú);3 habs.;2 baños;111 m²;;"¡Descubre esta espectacular vivienda en vilanova i la geltrú! 
Con 111 m² construidos, esta amplia y luminosa propiedad ofrece tod...";41.224182536;1.742748477;barcelona
429.000 €;Ático en Carrer de Campfaso, 55;/comprar/atico-la_gavarra-4313143450_109700/;La Gavarra (Cornellà de Llobregat);3 habs.;1 baño;157 m²;;Ático-dúplex de 156,73m² construidos exterior a Calle Campfasso, orientación sur, vivienda distribuida en 3 dormitorios, 1 baño y comedor con cocina americana de 24,23m². Cuenta con una terraza amplia de 20,73m² y un balcón de 8,76m² .;41,361996;2,0781857;barcelona
329.000 €;;/comprar/chalet_unifamiliar-tordera_nucli_urba-41736815587_527526/;Nucli Urbà (Tordera);4 habs.;3 baños;133 m²;;Estupendo chalet unifamiliar de 2 plantas en venta, a pocas calles del comercio y servicios básicos de tordera, vivienda asentada ...;41.69365505;2.72425788;barcelona
