precio;sub_descr;href;ubicacion;habitaciones;banios;mt2;otros;publicado_hace;plataforma;CCAA
750€;Piso en alquiler en Málaga;https://rd.clk.thribee.com/id.15w13t51T1F1k/origin.1/section.232/section_type.2/country.es/vertical.homes/iuid.144909trovit-web-85d48c649-k5jtk669817f72c516/tracking.%7B%22cmp%22%3A%22u%22%7D/what_d.Malaga/type.2/page.24/cookieid.1021157669817f72c1b34.96614932/pos.1/;29591, Málaga, Provincia de Málaga;2 habitaciones;2 baños;100 m²;Se alquila piso en la zona de Pinosol (Camino Nuevo). Consta de tres habitaciones, pero una está cerrada por uso de la propietaria. Distribuido e...;Hace 3 días;Todopisos;Malaga
1.200€;Piso en alquiler en Málaga, Cruz de Humilladero- Paseo de...;https://rd.clk.thribee.com/id.1k1R13Wv91-1Y/origin.1/section.232/section_type.2/country.es/vertical.homes/iuid.144909trovit-web-85d48c649-k5jtk669817f72c516/tracking.%7B%22cmp%22%3A%22u%22%7D/what_d.Malaga/type.2/page.24/cookieid.1021157669817f72c1b34.96614932/pos.2/;29006, Los Tilos, Cruz de Humilladero, Málaga, Provincia de Málaga;3 habitaciones;2 baños;-;¡Bienvenido a tu nuevo hogar compartido en el corazón de la ciudad! ~disponible el mes de agosto. Capacidad para 4/5 personas. Descubre una exper...;Hace 3 días;Todopisos;Malaga
360€;Calle Rebeca H2;https://rd.clk.thribee.com/id.n1P14d1Iw1Xl/origin.1/section.97/section_type.1/country.es/vertical.homes/iuid.144909trovit-web-85d48c649-k5jtk669817f72c516/tracking.%7B%22cmp%22%3A%22u%22%7D/what_d.Malaga/type.2/page.24/cookieid.1021157669817f72c1b34.96614932/pos.2/;29006, Provincia de Málaga;1  habitaciones;2  baños;-;Room in Calle Rebeca Available from: Book now: Min. Stay: 6 Max. Stay: 18 Deposit: 360 Contract opening costs: 360€ [ENG] How does Som work? Som...;Hace 7 días;Rentola;Malaga
850€;2-Bedroom apartment near Parque San Miguel;https://rd.clk.thribee.com/id.JyU831O1pa/origin.1/section.97/section_type.1/country.es/vertical.homes/iuid.144909trovit-web-85d48c649-k5jtk669817f72c516/tracking.%7B%22cmp%22%3A%22u%22%7D/what_d.Malaga/type.2/page.24/cookieid.1021157669817f72c1b34.96614932/pos.3/;29014, Provincia de Málaga;2  habitaciones;1  baños;-;Rental period for this listing is between 3. 24 months...;Hace 7 días;Rentola;Malaga
900€;Very cosy 2-bedroom apartment in El Palo;https://rd.clk.thribee.com/id.1h1SM11mX1SU/origin.1/section.97/section_type.1/country.es/vertical.homes/iuid.144909trovit-web-85d48c649-k5jtk669817f72c516/tracking.%7B%22cmp%22%3A%22u%22%7D/what_d.Malaga/type.2/page.24/cookieid.1021157669817f72c1b34.96614932/pos.4/;29018, Provincia de Málaga;2  habitaciones;1  baños;-;Hi there! We're working to get the description updated as quickly as possible. You'll still be able to get a great idea of what the place is like...;Hace 7 días;Rentola;Malaga
2.200€;Apartamento Planta Media;https://rd.clk.thribee.com/id.Q1H1uisbw1R/origin.1/section.97/section_type.1/country.es/vertical.homes/iuid.144909trovit-web-85d48c649-k5jtk669817f72c516/tracking.%7B%22cmp%22%3A%22u%22%7D/what_d.Malaga/type.2/page.24/cookieid.1021157669817f72c1b34.96614932/pos.5/;29660, Provincia de Málaga;3  habitaciones;2  baños;100  m²;Amplio apartamento en Villa Marina, Puerto Banus. La propiedad ofrece cocina americana, salón/comedor con chimenea, con acceso directo a la terra...;Hace 7 días;Rentola;Malaga
4.860€;Stunning 4-Bedroom Design Haven in Almagro;https://rd.clk.thribee.com/id.1D1K1T151nRIk/origin.1/section.97/section_type.1/country.es/vertical.homes/iuid.144909trovit-web-85d48c649-k5jtk669817f72c516/tracking.%7B%22cmp%22%3A%22u%22%7D/what_d.Malaga/type.2/page.24/cookieid.1021157669817f72c1b34.96614932/pos.6/;28010, Comunidad de Madrid;4  habitaciones;3  baños;-;Rental period for this listing is between 3. 24 months...;Hace 7 días;Rentola;Malaga
5.000€;House in Guadalmina Alta, Costa del Sol;https://rd.clk.thribee.com/id.1l1B111Jl1wd1S/origin.1/section.97/section_type.1/country.es/vertical.homes/iuid.144909trovit-web-85d48c649-k5jtk669817f72c516/tracking.%7B%22cmp%22%3A%22u%22%7D/what_d.Malaga/type.2/page.24/cookieid.1021157669817f72c1b34.96614932/pos.7/;29678, Guadalmina, Marbella, Provincia de Málaga;3  habitaciones;2  baños;256  m²;Discover your new home in an exclusive urbanization and let yourself be captivated by this spectacular 225 m² semi-detached house that offers an...;Hace 7 días;Rentola;Malaga
650€;Homely double bedroom in the Jardín de la Abadía neighbourhood;https://rd.clk.thribee.com/id.1J1_1A1r1b1l61T/origin.1/section.97/section_type.1/country.es/vertical.homes/iuid.144909trovit-web-85d48c649-k5jtk669817f72c516/tracking.%7B%22cmp%22%3A%22u%22%7D/what_d.Malaga/type.2/page.24/cookieid.1021157669817f72c1b34.96614932/pos.8/;29002, Provincia de Málaga;4  habitaciones;2  baños;-;Rental period for this listing is between 3. 24 months...;Hace 7 días;Rentola;Malaga
2.750€;Apartamento Planta Media;https://rd.clk.thribee.com/id.zk1U1eg1gi1Q/origin.1/section.97/section_type.1/country.es/vertical.homes/iuid.144909trovit-web-85d48c649-k5jtk669817f72c516/tracking.%7B%22cmp%22%3A%22u%22%7D/what_d.Malaga/type.2/page.24/cookieid.1021157669817f72c1b34.96614932/pos.9/;29660, Provincia de Málaga;2  habitaciones;2  baños;90  m²;Descubra el encanto de este apartamento recién reformado de dos dormitorios y dos baños ubicado en la vibrante zona de La Campana, Nueva Andalucí...;Hace 7 días;Rentola;Malaga
4.714€;Apartment in Estepona, Costa del Sol;https://rd.clk.thribee.com/id.1E101y12b1I1K1Q/origin.1/section.97/section_type.1/country.es/vertical.homes/iuid.144909trovit-web-85d48c649-k5jtk669817f72c516/tracking.%7B%22cmp%22%3A%22u%22%7D/what_d.Malaga/type.2/page.24/cookieid.1021157669817f72c1b34.96614932/pos.10/;29689, Estepona, Provincia de Málaga;3  habitaciones;2  baños;125  m²;This lovely duplex apartment in estepona centre is a charming property for your holiday. Located within a short walk from the main beach of estep...;Hace 7 días;Rentola;Malaga
6.000€;Piso en alquiler en Estepona, Seghers;https://rd.clk.thribee.com/id.38i1l1ihcg/origin.1/section.97/section_type.1/country.es/vertical.homes/iuid.144909trovit-web-85d48c649-k5jtk669817f72c516/tracking.%7B%22cmp%22%3A%22u%22%7D/what_d.Malaga/type.2/page.24/cookieid.1021157669817f72c1b34.96614932/pos.11/;29680, Estepona, Provincia de Málaga;3  habitaciones;2  baños;180  m²;Se vende y alquila espacioso y muy luminoso apartamento 3 dormitorios con o sin muebles y con impresionantes vistas a la bahía. Todas las habitac...;Hace 7 días;Todopisos;Malaga
9.000€;Chalet en alquiler en Marbella, Nagueles;https://rd.clk.thribee.com/id.1x10ThI1G00/origin.1/section.97/section_type.1/country.es/vertical.homes/iuid.144909trovit-web-85d48c649-k5jtk669817f72c516/tracking.%7B%22cmp%22%3A%22u%22%7D/what_d.Malaga/type.2/page.24/cookieid.1021157669817f72c1b34.96614932/pos.12/;29602, Nagüeles, Marbella, Provincia de Málaga;4  habitaciones;4  baños;410  m²;Una encantadora casa adosada situada en Sierra Blanca, una de las zonas más prestigiosas de Marbella. La casa tiene vistas panorámicas al mar. Es...;Hace 7 días;Todopisos;Malaga
7.500€;Chalet en alquiler en Marbella;https://rd.clk.thribee.com/id.8Hv10Y1v1yl/origin.1/section.97/section_type.1/country.es/vertical.homes/iuid.144909trovit-web-85d48c649-k5jtk669817f72c516/tracking.%7B%22cmp%22%3A%22u%22%7D/what_d.Malaga/type.2/page.24/cookieid.1021157669817f72c1b34.96614932/pos.13/;29604, Marbella, Provincia de Málaga;5  habitaciones;4  baños;270  m²;Villa para alquiler a corto y largo plazo con vistas al mar. Villa de estilo moderno de 5 dormitorios con magníficas vistas al mar en El Rosario...;Hace 7 días;Todopisos;Malaga
15.000€;Chalet en alquiler en Estepona, La Concha - Resina Golf;https://rd.clk.thribee.com/id.1j1yEs_69N/origin.1/section.97/section_type.1/country.es/vertical.homes/iuid.144909trovit-web-85d48c649-k5jtk669817f72c516/tracking.%7B%22cmp%22%3A%22u%22%7D/what_d.Malaga/type.2/page.24/cookieid.1021157669817f72c1b34.96614932/pos.14/;29680, La Concha, San Roque de Riomiera, Provincia de Cantabria;5  habitaciones;6  baños;800  m²;Moderna villa recientemente reformada, en la zona de Estepona Este, un complejo en las colinas de Sierra Bermeja. A unos kms al interior al oeste...;Hace 7 días;Todopisos;Malaga
3.000€;Apartment For Rent in Nueva Andalucía, Marbella;https://rd.clk.thribee.com/id.1yRu5r1MK1C/origin.1/section.97/section_type.1/country.es/vertical.homes/iuid.144909trovit-web-85d48c649-k5jtk669817f72c516/tracking.%7B%22cmp%22%3A%22u%22%7D/what_d.Malaga/type.2/page.24/cookieid.1021157669817f72c1b34.96614932/pos.15/;29660, Marbella, Provincia de Málaga;2  habitaciones;2  baños;200  m²;This a unique and stunning property in the contemporary complex of La Corniche in the heart of the golf valley of Nueva Andalucia. The property w...;Hace 7 días;Rentola;Malaga
4.500€;Ático;https://rd.clk.thribee.com/id.1X91e1w1z191o1h/origin.1/section.97/section_type.1/country.es/vertical.homes/iuid.144909trovit-web-85d48c649-k5jtk669817f72c516/tracking.%7B%22cmp%22%3A%22u%22%7D/what_d.Malaga/type.2/page.24/cookieid.1021157669817f72c1b34.96614932/pos.16/;29688, Provincia de Málaga;4  habitaciones;4  baños;216  m²;Disponible para larga y corta temporada desde 5 de agosto 2024. En el precio están incluidos 2 plazas de garaje y trastero. Ático, Costalita, Cos...;Hace 7 días;Rentola;Malaga
13.500€;Villa - Chalet;https://rd.clk.thribee.com/id.a1d1kvTK181O/origin.1/section.97/section_type.1/country.es/vertical.homes/iuid.144909trovit-web-85d48c649-k5jtk669817f72c516/tracking.%7B%22cmp%22%3A%22u%22%7D/what_d.Malaga/type.2/page.24/cookieid.1021157669817f72c1b34.96614932/pos.17/;29680, Provincia de Málaga;6  habitaciones;6  baños;935  m²;Elegante villa situada a tan solo 200m de la playa en la consolidada Urbanización de Guadalmina Baja. Su perfecta ubicación está considerada un r...;Hace 7 días;Rentola;Malaga
3.000€;Apartamento Planta Media;https://rd.clk.thribee.com/id.I61_Y1jG1dB/origin.1/section.97/section_type.1/country.es/vertical.homes/iuid.144909trovit-web-85d48c649-k5jtk669817f72c516/tracking.%7B%22cmp%22%3A%22u%22%7D/what_d.Malaga/type.2/page.24/cookieid.1021157669817f72c1b34.96614932/pos.18/;29680, Provincia de Málaga;3  habitaciones;2  baños;100  m²;Disponible a partir del 6 de septiembre: Casa de Lujo de 3 Dormitorios Nos complace presentar esta impresionante propiedad nueva, disponible a pa...;Hace 7 días;Rentola;Malaga
6.500€;Apartment For Rent in Nagüeles, Marbella;https://rd.clk.thribee.com/id.91i1UeCQ1012/origin.1/section.97/section_type.1/country.es/vertical.homes/iuid.144909trovit-web-85d48c649-k5jtk669817f72c516/tracking.%7B%22cmp%22%3A%22u%22%7D/what_d.Malaga/type.2/page.24/cookieid.1021157669817f72c1b34.96614932/pos.19/;29602, Marbella, Provincia de Málaga;3  habitaciones;3  baños;272  m²;Renovated 3-bedroom/3-bathroom duplex penthouse in Nagueles-Marbella with partly panoramic sea views and Puerto Banus. Welcome to your luxury oas...;Hace 7 días;Rentola;Malaga
800€;Maison de Village en Cómpeta;https://rd.clk.thribee.com/id.31Z1q1u110dL/origin.1/section.97/section_type.1/country.es/vertical.homes/iuid.144909trovit-web-85d48c649-k5jtk669817f72c516/tracking.%7B%22cmp%22%3A%22u%22%7D/what_d.Malaga/type.2/page.24/cookieid.1021157669817f72c1b34.96614932/pos.20/;Comunidad de Madrid;3  habitaciones;1  baños;120  m²;Casa en Cómpeta, con 3 dormitorios y 1 cuarto de baño. 120 m 2 de superficie útil, ofreciendo un espacio muy amplio para sus necesidades. Este in...;Hace 7 días;Rentola;Malaga
2.200€;Townhouse For Rent in, Alhaurín De la Torre;https://rd.clk.thribee.com/id.WTH1COr1xV/origin.1/section.97/section_type.1/country.es/vertical.homes/iuid.144909trovit-web-85d48c649-k5jtk669817f72c516/tracking.%7B%22cmp%22%3A%22u%22%7D/what_d.Malaga/type.2/page.24/cookieid.1021157669817f72c1b34.96614932/pos.21/;20620,;3  habitaciones;2  baños;154  m²;This modern style townhouse is located only 12 km from the beach and 20 km from Malaga city. On the ground floor, there is a kitchen with...;Hace 7 días;Rentola;Malaga
5.000€;Apartamento Planta Media;https://rd.clk.thribee.com/id.1Un1Rjk1HZH/origin.1/section.97/section_type.1/country.es/vertical.homes/iuid.144909trovit-web-85d48c649-k5jtk669817f72c516/tracking.%7B%22cmp%22%3A%22u%22%7D/what_d.Malaga/type.2/page.24/cookieid.1021157669817f72c1b34.96614932/pos.22/;29660, Provincia de Málaga;3  habitaciones;-;175  m²;Hermoso apartamento espacioso en un nivel, con 3 dormitorios, 2 baños, aseo, amplia cocina con zona de lavandería. La propiedad tiene 3 terrazas...;Hace 7 días;Rentola;Malaga
1.400€;Apartamento Planta Baja;https://rd.clk.thribee.com/id.1_g1ku1P21n/origin.1/section.97/section_type.1/country.es/vertical.homes/iuid.144909trovit-web-85d48c649-k5jtk669817f72c516/tracking.%7B%22cmp%22%3A%22u%22%7D/what_d.Malaga/type.2/page.24/cookieid.1021157669817f72c1b34.96614932/pos.23/;29650, Provincia de Málaga;2  habitaciones;1  baños;75  m²;Apartamento Planta Baja, Riviera del Sol, Costa del Sol. 2 Dormitorios, 1 Baño, Construidos 75 m², Terraza 8 m². Posición: Cerca de Golf, Cerca d...;Hace 7 días;Rentola;Malaga
25.000€;Villa - Chalet;https://rd.clk.thribee.com/id.1p1N81F18g91K/origin.1/section.97/section_type.1/country.es/vertical.homes/iuid.144909trovit-web-85d48c649-k5jtk669817f72c516/tracking.%7B%22cmp%22%3A%22u%22%7D/what_d.Malaga/type.2/page.24/cookieid.1021157669817f72c1b34.96614932/pos.24/;29601, Provincia de Málaga;6  habitaciones;5  baños;567  m²;UNA VILLA SOFISTICADA EN NUEVA ANDALUCIA Descubra una casa totalmente renovada con profesionales Sistemas de seguridad que incluyen cámaras, alar...;Hace 7 días;Rentola;Malaga
1.500€;Apartamento Planta Baja;https://rd.clk.thribee.com/id.710mI1j1O1xd/origin.1/section.97/section_type.1/country.es/vertical.homes/iuid.144909trovit-web-85d48c649-k5jtk669817f72c516/tracking.%7B%22cmp%22%3A%22u%22%7D/what_d.Malaga/type.2/page.24/cookieid.1021157669817f72c1b34.96614932/pos.25/;29780, Provincia de Málaga;2  habitaciones;2  baños;49  m²;¡Bienvenido a este impresionante apartamento en planta baja en Calahonda Playa, Mijas Costa! Este retiro bellamente renovado de 2 dormitorios y 2...;Hace 7 días;Rentola;Malaga
1.200€;Acogedor bajo a escasos metros de la playa en torremolinos;https://rd.clk.thribee.com/id.1f1U1m1_1Sm1NC/origin.1/section.97/section_type.1/country.es/vertical.homes/iuid.247113trovit-web-85d48c649-k5jtk669817f97e403/tracking.%7B%22cmp%22%3A%22u%22%7D/what_d.Malaga/type.2/page.17/cookieid.1020112669817f97df686.62809022/pos.1/;29620, Torremolinos, Provincia de Málaga;2  habitaciones;1  baños;80  m²;ACOGEDOR BAJO A ESCASOS METROS DE LA PLAYA EN TORREMOLINOS Se alquila magnífico piso bajo recientemente reformado, situado a tan solo 300 metros...;Hace 3 días;Vadevender;Malaga
2.500€;2 dormitorio, Torremolinos 1ES79061-;https://rd.clk.thribee.com/id.YUs6VOs8/origin.1/section.232/section_type.2/country.es/vertical.homes/iuid.247113trovit-web-85d48c649-k5jtk669817f97e403/tracking.%7B%22cmp%22%3A%22u%22%7D/what_d.Malaga/type.2/page.17/cookieid.1020112669817f97df686.62809022/pos.1/;Torremolinos, Provincia de Málaga;2 habitaciones;3 baños;-;TRV79061---. Esta casa se encuentra en Torremolinos Torremolinos. Tiene 2 dormitorios, 3 baños. Esta 2 dormitorio apartamentos en Torremolinos To...;Hace 1 día;Listanza;Malaga
2.500€;3 dormitorio, Benalmádena 1ES79042-;https://rd.clk.thribee.com/id.Oj1lfqCl1T/origin.1/section.232/section_type.2/country.es/vertical.homes/iuid.247113trovit-web-85d48c649-k5jtk669817f97e403/tracking.%7B%22cmp%22%3A%22u%22%7D/what_d.Malaga/type.2/page.17/cookieid.1020112669817f97df686.62809022/pos.2/;Benalmádena, Provincia de Málaga;3 habitaciones;2 baños;-;TRV79042---. Esta casa se encuentra en Benalmádena Benalmádena. Tiene 3 dormitorios, 2 baños. Esta 3 dormitorio Casa en Benalmádena Benalmádena e...;Hace 1 día;Listanza;Malaga
800€;Se alquila MEDIA TEMPORADA desde el 15/09/2025-31/05/2026 precioso apartamento a 250 metros de la pl;https://rd.clk.thribee.com/id.T1Q1L1pE-91d/origin.1/section.97/section_type.1/country.es/vertical.homes/iuid.247113trovit-web-85d48c649-k5jtk669817f97e403/tracking.%7B%22cmp%22%3A%22u%22%7D/what_d.Malaga/type.2/page.17/cookieid.1020112669817f97df686.62809022/pos.2/;Benalmádena, Provincia de Málaga;1  habitaciones;1  baños;50  m²;Ref. 1584. Se alquila MEDIA TEMPORADA desde el 15/09/2025-31/05/2026 precioso apartamento a 250 metros de la playa en Benalmádena Tiene 50m2 cons...;Hace 3 días;Vadevender;Malaga
1.800€;Acogedor piso en marbella;https://rd.clk.thribee.com/id.RAL1_91p1dl/origin.1/section.97/section_type.1/country.es/vertical.homes/iuid.247113trovit-web-85d48c649-k5jtk669817f97e403/tracking.%7B%22cmp%22%3A%22u%22%7D/what_d.Malaga/type.2/page.17/cookieid.1020112669817f97df686.62809022/pos.3/;29660, Marbella, Provincia de Málaga;1  habitaciones;1  baños;150  m²;ACOGEDOR PISO EN MARBELLA Este acogedor piso en a cuenta con una habitación y un baño, ideal para una persona o una pareja que busca un hogar cóm...;Hace 3 días;Vadevender;Malaga
2.100€;Piso de 3 dormitorios en rincon de la victoria;https://rd.clk.thribee.com/id._1t1UY1qah1r/origin.1/section.97/section_type.1/country.es/vertical.homes/iuid.247113trovit-web-85d48c649-k5jtk669817f97e403/tracking.%7B%22cmp%22%3A%22u%22%7D/what_d.Malaga/type.2/page.17/cookieid.1020112669817f97df686.62809022/pos.4/;29730, Rincón de la Victoria, Provincia de Málaga;3  habitaciones;1  baños;90  m²;Piso para a de corta temporada en centro rincon de la victoria (malaga). Solo para julio y agosto de 2024. Te presentamos este bonito piso...;Hace 3 días;Vadevender;Malaga
2.500€;Encantador piso en marbella;https://rd.clk.thribee.com/id.1W1MJ12g1TzH/origin.1/section.97/section_type.1/country.es/vertical.homes/iuid.247113trovit-web-85d48c649-k5jtk669817f97e403/tracking.%7B%22cmp%22%3A%22u%22%7D/what_d.Malaga/type.2/page.17/cookieid.1020112669817f97df686.62809022/pos.5/;29660, Marbella, Provincia de Málaga;2  habitaciones;2  baños;140  m²;ENCANTADOR PISO EN MARBELLA Este encantador piso en a cuenta con dos habitaciones y dos baños, ofreciendo un espacio cómodo y funcional para vivi...;Hace 3 días;Vadevender;Malaga
2.000€;Preciosa villa ubicada a pocos minutos de Lauro Golf;https://rd.clk.thribee.com/id.161W1nk1E1a1S1_/origin.1/section.97/section_type.1/country.es/vertical.homes/iuid.247113trovit-web-85d48c649-k5jtk669817f97e403/tracking.%7B%22cmp%22%3A%22u%22%7D/what_d.Malaga/type.2/page.17/cookieid.1020112669817f97df686.62809022/pos.6/;29130, Alhaurín de la Torre, Provincia de Málaga;4  habitaciones;2  baños;150  m²;Acogedera villa de a ubicada a unos minutos de Lauro Golf. La propiedad es de una sola planta, esta totalmente equipada y se distribuye en 4 dorm...;Hace 3 días;Vadevender;Malaga
1.490€;Apartamento a escasos metros del mar y todos los servicios en calahonda - mijas;https://rd.clk.thribee.com/id.3v1F1hHy153/origin.1/section.97/section_type.1/country.es/vertical.homes/iuid.247113trovit-web-85d48c649-k5jtk669817f97e403/tracking.%7B%22cmp%22%3A%22u%22%7D/what_d.Malaga/type.2/page.17/cookieid.1020112669817f97df686.62809022/pos.7/;29649, Mijas, Provincia de Málaga;2  habitaciones;1  baños;80  m²;Apartamento a escasos metros del mar y todos los servicios en calahonda. MIJAS Precioso apartamento de dos dormitorios en la exclusiva urbanizaci...;Hace 3 días;Vadevender;Malaga
900€;Piso de Larga Temporada con Terraza en Estación de Cártama;https://rd.clk.thribee.com/id.1x1fo1zY1PQ1q/origin.1/section.97/section_type.1/country.es/vertical.homes/iuid.247113trovit-web-85d48c649-k5jtk669817f97e403/tracking.%7B%22cmp%22%3A%22u%22%7D/what_d.Malaga/type.2/page.17/cookieid.1020112669817f97df686.62809022/pos.8/;29580, Estación de Cártama, Cártama, Provincia de Málaga;3  habitaciones;1  baños;82  m²;¡Oportunidad inigualable en Estación de Cártama! Descubre este espléndido piso de 82 m², con una orientación oeste que garantiza luminosidad y ca...;Hace 3 días;Vadevender;Malaga
1.400€;Apartamento en alquiler en al reserva de marbella por larga temporada;https://rd.clk.thribee.com/id.w1i1NjL1H41r/origin.1/section.97/section_type.1/country.es/vertical.homes/iuid.247113trovit-web-85d48c649-k5jtk669817f97e403/tracking.%7B%22cmp%22%3A%22u%22%7D/what_d.Malaga/type.2/page.17/cookieid.1020112669817f97df686.62809022/pos.9/;29604, Marbella, Provincia de Málaga;2  habitaciones;2  baños;90  m²;Nur homes, presenta en a para larga temporada esta magnífico apartamento en 2ª plata en la reserva de marbella con terraza de 40 m2 y vistas parc...;Hace 3 días;Vadevender;Malaga
2.500€;Esplendido piso en marbella;https://rd.clk.thribee.com/id.1x1oKtp1b1u1T/origin.1/section.97/section_type.1/country.es/vertical.homes/iuid.247113trovit-web-85d48c649-k5jtk669817f97e403/tracking.%7B%22cmp%22%3A%22u%22%7D/what_d.Malaga/type.2/page.17/cookieid.1020112669817f97df686.62809022/pos.10/;29660, Marbella, Provincia de Málaga;2  habitaciones;2  baños;90  m²;ESPLENDIDO PISO EN MARBELLA Este espléndido piso en a ofrece dos habitaciones y dos baños, proporcionando un espacio cómodo y bien distribuido pa...;Hace 3 días;Vadevender;Malaga
13.000€;Preciosa Villa Independiente;https://rd.clk.thribee.com/id.1Yu1VR19t5h/origin.1/section.97/section_type.1/country.es/vertical.homes/iuid.247113trovit-web-85d48c649-k5jtk669817f97e403/tracking.%7B%22cmp%22%3A%22u%22%7D/what_d.Malaga/type.2/page.17/cookieid.1020112669817f97df686.62809022/pos.11/;29660, Nueva Andalucía, Marbella, Provincia de Málaga;7  habitaciones;6  baños;680  m²;¡Descubre esta impresionante villa independiente situada en la exclusiva zona de Nueva Andalucía! Con un diseño moderno y espacios amplios, esta...;Hace 3 días;Vadevender;Malaga
3.867€;Málaga 1ES77965-;https://rd.clk.thribee.com/id.S1Ue1J1QnoC/origin.1/section.97/section_type.1/country.es/vertical.homes/iuid.247113trovit-web-85d48c649-k5jtk669817f97e403/tracking.%7B%22cmp%22%3A%22u%22%7D/what_d.Malaga/type.2/page.17/cookieid.1020112669817f97df686.62809022/pos.12/;Málaga, Provincia de Málaga;-;1  baños;-;...Esta casa se encuentra en Málaga Málaga. Tiene 0 dormitorio, 1 baño. Esta 0 dormitorio apartamentos en Málaga Málaga es para alquilar por 3867...;Hace 3 días;Listanza;Malaga
3.375€;Málaga 1ES77965-;https://rd.clk.thribee.com/id.1b81X1Y1_1P1610/origin.1/section.97/section_type.1/country.es/vertical.homes/iuid.247113trovit-web-85d48c649-k5jtk669817f97e403/tracking.%7B%22cmp%22%3A%22u%22%7D/what_d.Malaga/type.2/page.17/cookieid.1020112669817f97df686.62809022/pos.13/;Málaga, Provincia de Málaga;-;1  baños;-;...Esta casa se encuentra en Málaga Málaga. Tiene 0 dormitorio, 1 baño. Esta 0 dormitorio apartamentos en Málaga Málaga es para alquilar por 3375...;Hace 3 días;Listanza;Malaga
1.643€;2 dormitorio, Málaga 1ES77942-;https://rd.clk.thribee.com/id.1Hz1o1H1u2Ga/origin.1/section.97/section_type.1/country.es/vertical.homes/iuid.247113trovit-web-85d48c649-k5jtk669817f97e403/tracking.%7B%22cmp%22%3A%22u%22%7D/what_d.Malaga/type.2/page.17/cookieid.1020112669817f97df686.62809022/pos.14/;Málaga, Provincia de Málaga;2  habitaciones;1  baños;-;...Esta casa se encuentra en Málaga Málaga. Tiene 2 dormitorios, 1 baño. Esta 2 dormitorio apartamentos en Málaga Málaga es para alquilar por 1643...;Hace 3 días;Listanza;Malaga
2.848€;1 dormitorio, Málaga 1ES77949-;https://rd.clk.thribee.com/id.1V1u17WE1PQb/origin.1/section.97/section_type.1/country.es/vertical.homes/iuid.247113trovit-web-85d48c649-k5jtk669817f97e403/tracking.%7B%22cmp%22%3A%22u%22%7D/what_d.Malaga/type.2/page.17/cookieid.1020112669817f97df686.62809022/pos.15/;Málaga, Provincia de Málaga;1  habitaciones;1  baños;-;...Esta casa se encuentra en Málaga Málaga. Tiene 1 dormitorio, 1 baño. Esta 1 dormitorio apartamentos en Málaga Málaga es para alquilar por 2848...;Hace 3 días;Listanza;Malaga
3.404€;1 dormitorio, Málaga 1ES77950-;https://rd.clk.thribee.com/id.1DmL1q1K1D4s/origin.1/section.97/section_type.1/country.es/vertical.homes/iuid.247113trovit-web-85d48c649-k5jtk669817f97e403/tracking.%7B%22cmp%22%3A%22u%22%7D/what_d.Malaga/type.2/page.17/cookieid.1020112669817f97df686.62809022/pos.16/;Málaga, Provincia de Málaga;1  habitaciones;1  baños;-;...Esta casa se encuentra en Málaga Málaga. Tiene 1 dormitorio, 1 baño. Esta 1 dormitorio apartamentos en Málaga Málaga es para alquilar por 3404...;Hace 3 días;Listanza;Malaga
2.233€;2 dormitorio, Málaga 1ES77936-;https://rd.clk.thribee.com/id.a18BXv1rgJ/origin.1/section.97/section_type.1/country.es/vertical.homes/iuid.247113trovit-web-85d48c649-k5jtk669817f97e403/tracking.%7B%22cmp%22%3A%22u%22%7D/what_d.Malaga/type.2/page.17/cookieid.1020112669817f97df686.62809022/pos.17/;Málaga, Provincia de Málaga;2  habitaciones;2  baños;-;...casa se encuentra en Málaga Málaga. Tiene 2 dormitorios, 2 baños. Esta 2 dormitorio apartamentos en Málaga Málaga es para alquilar por 2233...;Hace 3 días;Listanza;Malaga
1.645€;2 dormitorio, Málaga 1ES77942-;https://rd.clk.thribee.com/id.KF1qoXj1512/origin.1/section.97/section_type.1/country.es/vertical.homes/iuid.247113trovit-web-85d48c649-k5jtk669817f97e403/tracking.%7B%22cmp%22%3A%22u%22%7D/what_d.Malaga/type.2/page.17/cookieid.1020112669817f97df686.62809022/pos.18/;Málaga, Provincia de Málaga;2  habitaciones;1  baños;-;...Esta casa se encuentra en Málaga Málaga. Tiene 2 dormitorios, 1 baño. Esta 2 dormitorio apartamentos en Málaga Málaga es para alquilar por 1645...;Hace 3 días;Listanza;Malaga
