precio;sub_descr;href;ubicacion;habitaciones;banios;mt2;otros;latitude;longitude;planta;CCAA
3.500.000 竄ｬ;Chalet en Atlanterra;/comprar/chalet-atlanterra-34214219468_998161/;Atlanterra (Tarifa);4 habs.;4 baﾃｱos;573 mﾂｲ;"Villa en venta en la parte alta de la urbanizaciﾃｳn atlanterra con 180ﾂｺ de vistas al mar.
La vivienda se distribuye en tres plantas...";36.017428775;-5.60492077;;cadiz
590.000 竄ｬ;Casa en Plaza Ponponio Mela, 3;/comprar/casa-tarifa_centro_urbano-42506583255_100500/;Tarifa;1 hab.;1 baﾃｱo;106 mﾂｲ;"Una pequeﾃｱa joya mirando a africa en el centro historico de tarifa

La ubicaciﾃｳn de esta casita en la plaza de pomponio mela 3 es ...";36.0124;-5.60038;;cadiz
345.000 竄ｬ;Piso en Bahﾃｭa Blanca;/comprar/piso-playa_de_santa_maria_del_mar_bahia_blanca-32547132966_101000/;Playa de Santa Marﾃｭa del Mar-Bahﾃｭa Blanca (Cﾃ｡diz Capital);3 habs.;2 baﾃｱos;120 mﾂｲ;No cobramos honorarios al comprador por este inmueble. Trato directo con la propiedad, total transparencia. Y si necesitas mejor f...;36.522534275;-6.283593897;;cadiz
285.000 竄ｬ;ﾃ》ico en Avenida del Golf, 10;/comprar/atico-san_roque_nucleo11360-45002331777_528336/;Nﾃｺcleo (San Roque);2 habs.;2 baﾃｱos;150 mﾂｲ;Este magnﾃｭfico ﾃ｡tico en venta se encuentra en urbanizaciﾃｳn del golf. Con una superficie total de 150 mﾂｲ y 2 habitaciones dobles, e...;36.24670771789625;-5.325257920024729;;cadiz
475.000 竄ｬ;Apartamento en calle Mesilla del Diente,  S/N;/comprar/apartamento-san_roque_nucleo11360-4285295717_109700/;Nﾃｺcleo (San Roque);3 habs.;2 baﾃｱos;116 mﾂｲ;B8 - 01 - 6. Apartamento en un edificio de obra nueva de 116 mﾂｲ de superficie construida y ubicado en la zona de sotogrande, encla...;36.233;-5.38134;1ﾂｪ planta;cadiz
180.000 竄ｬ;ﾃ》ico en El Pﾃｳpulo-Santa Marﾃｭa;/comprar/atico-el_populo_santa_maria11005-44253102773_106700/;El Pﾃｳpulo-Santa Marﾃｭa (Cﾃ｡diz Capital);1 hab.;1 baﾃｱo;42 mﾂｲ;"ﾂ｡Descubre este encantador ﾃ｡tico de un dormitorio en pleno corazﾃｳn de cﾃ｡diz!
Situado a solo unos pasos del campo del sur y el ayunt...";36.5290863;-6.2922037;;cadiz
970.000 竄ｬ;Piso en calle A-2100;/comprar/piso-sotogrande_alto11310-30057374394_101800/;Sotogrande Alto (Sotogrande);2 habs.;2 baﾃｱos;216 mﾂｲ;"Obra nueva en sotogrande (cﾃ｡diz), 33 unidades, varios tamaﾃｱos y alturas.

""walking distance"" del sotogrande international school, ...";36.2758574;-5.3332484;1ﾂｪ planta;cadiz
210.000 竄ｬ;Piso en Norte;/comprar/piso-rota_zona_norte11520-43425735222_103800/;Zona Norte (Rota);3 habs.;1 baﾃｱo;130 mﾂｲ;Espectacular y amplio piso situado en una de las principales avenidas de rota, consta de amplio vestﾃｭbulo, 3 dormitorios, salﾃｳn co...;36.624999;-6.3605204;2ﾂｪ planta;cadiz
595.000 竄ｬ;Apartamento en Puerto de Sotogrande-La Marina;/comprar/apartamento-puerto_de_sotogrande_la_marina11310-42507023608_109300/;Puerto de Sotogrande-La Marina (Sotogrande);2 habs.;3 baﾃｱos;111 mﾂｲ;"Fabuloso piso de dos dormitorios y dos baﾃｱos en el puerto de sotogrande con magnﾃｭficas vistas al mar.
Este piso ofrece un amplio s...";36.295686475;-5.278044768;4ﾂｪ planta;cadiz
530.000 竄ｬ;Chalet en Bahﾃｭa de Cﾃ｡diz;/comprar/chalet-nucleo_urbano_urbanizaciones-44183712652_108700/;Nﾃｺcleo Urbano-Urbanizaciones (Chiclana de la Frontera);4 habs.;2 baﾃｱos;192 mﾂｲ;"*honorarios a cargo del vendedor incluidos en el precio*
ﾂ｡Exclusividad iad espaﾃｱa! Chiclana de la frontera hermosa villa urbana en...";36.405386;-6.1307956;;cadiz
155.000 竄ｬ;Casa en calle Guindo;/comprar/casa-este-38387805153_522800/;Este (Jerez de la Frontera);4 habs.;2 baﾃｱos;193 mﾂｲ;"Finca urbana dividida en 2 apartamentos , garaje , 2 trasteros y azotea .
En planta baja cuenta con el garaje con trastero de unos...";36.6800579;-6.113185;;cadiz
122.000 竄ｬ;Piso en Avenida del Guadalquivir;/comprar/piso-centro_calzada-44168061307_104700/;Centro-Calzada (Sanlﾃｺcar de Barrameda);2 habs.;1 baﾃｱo;55 mﾂｲ;Nuevo piso en venta en el centro de sanlﾃｺcar de barrameda, zona inmejorable, rodeado de todo tipo de comercias de alta calidad, un...;36.7828956;-6.3533983;;cadiz
220.000 竄ｬ;Casa en calle Campo de Hockey;/comprar/casa-camposoto_gallineras11100-41758199095_103800/;Camposoto-Gallineras (San Fernando);3 habs.;2 baﾃｱos;106 mﾂｲ;Camposoto, zona campo de hockey. Casa reformada en venta en san fernando de tres dormitorios con armarios empotrados, uno de ellos...;36.4462155;-6.2094117;;cadiz
298.000 竄ｬ;Piso en Palacio Congreso;/comprar/piso-san_jose_varela_la_laguna11008-43382542036_103800/;San Josﾃｩ-Varela-La Laguna (Cﾃ｡diz Capital);4 habs.;1 baﾃｱo;135 mﾂｲ;Se vende luminoso piso en cﾃ｡diz, ubicado junto al palacio de congresos. Este inmueble cuenta con cuatro dormitorios amplios, un ba...;36.5298599;-6.2915887;;cadiz
80.000 竄ｬ;Casa unifamiliar en Arcos de la Frontera;/comprar/casa_unifamiliar-arcos_de_la_frontera_centro_urbano-44186154834_100200/;Arcos de la Frontera;3 habs.;;155 mﾂｲ;Casco antiguo: se vende casa de pueblo junto a el arco matrera, la vivienda consta de 3 dormitorios, salﾃｳn, cocina, baﾃｱo, patio y ...;36.7450835;-5.8000048;;cadiz
395.000 竄ｬ;Apartamento en calle del Pargo;/comprar/apartamento-costa_de_sancti_petri_playa_de_la_barrosa11139-44206334047_528241/;Costa de Sancti Petri-Playa de La Barrosa (Chiclana de la Frontera);3 habs.;2 baﾃｱos;98 mﾂｲ;Espectacular apartamento en planta baja, situado en una privilegiada urbanizaciﾃｳn en la barrosa, en chiclana de la frontera, en 2ﾂｪ...;36.3649611;-6.1766351;Bajo;cadiz
238.000 竄ｬ;Apartamento en calle de Manila;/comprar/apartamento-jerez_de_la_frontera_norte11405-43376627966_103800/;Norte (Jerez de la Frontera);4 habs.;2 baﾃｱos;119 mﾂｲ;Precioso piso en zona altillo, muy amplio, con un total de 119 mﾂｲ construidos. La vivienda se compone de un amplio hall de entrada...;36.7060432;-6.1202221;2ﾂｪ planta;cadiz
510.000 竄ｬ;Finca rﾃｺstica en Benalup-Casas Viejas;/comprar/finca_rustica-benalup_casas_viejas_centro_urbano-41708845859_105600/;Benalup-Casas Viejas;2 habs.;2 baﾃｱos;195 mﾂｲ;"Descripciﾃｳn del objeto:
Preciosa finca de 4,6 ha con casa y 2 naves grandes (ideal para amantes de los caballos)

-	~ 46.000 mﾂｲ te...";36.3498354;-5.8067525;;cadiz
223.500 竄ｬ;Piso en Avenida Josﾃｩ Manuel Caballero Bonald,  s/n;/comprar/piso-noreste11405-3920023363_109700/;Noreste (Jerez de la Frontera);4 habs.;2 baﾃｱos;129 mﾂｲ;Esc. 10, 2ﾂｺ C. Piso en un edificio de obra nueva de 129 m2 de superficie construida y ubicado en la zona de Jerez de la Frontera, enclavado en planta 2. Estﾃ｡ distribuido en 4 habitaciones, 2 baﾃｱos completos y terraza. Incluye extras como ascensor.;36,7002516;-6,1088684;2ﾂｪ planta;cadiz
3.100.000 竄ｬ;Chalet en Avenida Pacifico, nﾂｺ 39;/comprar/chalet-atlanterra-22566183981_998161/;Atlanterra (Tarifa);5 habs.;3 baﾃｱos;410 mﾂｲ;Esta vivienda no sﾃｳlo destaca por sus bellas lﾃｭneas arquitectﾃｳnicas, sus bellas vistas al mar o su funcionalidad sino que, junto c...;36.09517777139197;-5.807939531514422;;cadiz
700.000 竄ｬ;Casa en calle de la Sirena, 1;/comprar/casa-zahara_de_los_atunes-43364229118_515011/;Zahara de los Atunes (Barbate);5 habs.;5 baﾃｱos;220 mﾂｲ;"Excelente casa en pleno centro de zahara de los atunes.

Esta casa se encuentra totalmente reformada, ya que se trata de un inmueb...";36.13651;-5.8458858;;cadiz
155.500 竄ｬ;Piso en Rotonda de Las Manos;/comprar/piso-centro_historico_la_costilla-43336630967_100500/;Centro Histﾃｳrico-La Costilla (Rota);2 habs.;1 baﾃｱo;74 mﾂｲ;Ahora es tu momento de independizarte o de tener un piso en la playa!!! Zona rotonda de las manos, cerquita de la costilla, con to...;36.624315;-6.3589892;1ﾂｪ planta;cadiz
750.000 竄ｬ;Chalet en Campo de Gibraltar;/comprar/chalet-tarifa_centro_urbano-45017006330_108700/;Tarifa;4 habs.;2 baﾃｱos;166 mﾂｲ;Villa de una sola planta en venta en tarifa, en la zona de el cuartﾃｳn, un lugar privilegiado en pleno parque natural de los alcorn...;36.0180653;-5.5984816;;cadiz
273.000 竄ｬ;Piso en La Caleta-La Viﾃｱa;/comprar/piso-la_caleta_la_vina11002-42597659963_100500/;La Caleta-La Viﾃｱa (Cﾃ｡diz Capital);2 habs.;1 baﾃｱo;84 mﾂｲ;"Tiritritrﾃ｡n tran tran

Dulce hogar te ofrece la mejor atenciﾃｳn para la compra de un piso estupendo en pleno centro de cﾃ｡diz, en la...";36.5301181;-6.2999763;1ﾂｪ planta;cadiz
190.000 竄ｬ;Piso en Centro;/comprar/piso-el_puerto_de_santa_maria_centro-40030623091_106000/;Centro (El Puerto de Santa Marﾃｭa);3 habs.;2 baﾃｱos;Mﾃ｡s de 20;"Ref: pp355 -
Piso ﾃ｡tico, muy bonito y en muy buen estado, en venta en pleno centro de el puerto cerca de la plaza del ayuntamiento...";36.5991959;-6.2243149;;cadiz
129.000 竄ｬ;Piso en Campo de Gibraltar;/comprar/piso-tarifa_centro_urbano-45011536132_108700/;Tarifa;1 hab.;1 baﾃｱo;57 mﾂｲ;"ﾂ｡Oportunidad ﾃｺnica en facinas!

Se vende un encantador piso de 57 mﾂｲ, ideal para una pareja o un a persona viviendo sola que busqu...";36.145100263;-5.701069404;;cadiz
1.300.000 竄ｬ;Casa en Vistahermosa;/comprar/casa-el_puerto_de_santa_maria_vistahermosa-45002331571_265000/;Vistahermosa (El Puerto de Santa Marﾃｭa);5 habs.;4 baﾃｱos;500 mﾂｲ;En venta esta espaciosa casa en el puerto de santa marﾃｭa, con una superficie total de 500 mﾂｲ construida sobre un solar de 1000 mﾂｲ....;36.5854414;-6.2623925;;cadiz
2.500.000 竄ｬ;Chalet en calle de Falua;/comprar/chalet-el_puerto_de_santa_maria_vistahermosa-28420351120_103800/;Vistahermosa (El Puerto de Santa Marﾃｭa);6 habs.;6 baﾃｱos;393 mﾂｲ;"Estupendo chalet a 60 metros de la playa, con unas vistas inmejorables sobre la bahﾃｭa de cﾃ｡diz.

Casa de 5 dormitorios mﾃ｡s uno de ...";36.5835985;-6.2673418;;cadiz
179.000 竄ｬ;Piso en calle Fray Pedro Pino, nﾂｺ 25;/comprar/piso-chipiona_la_laguna-43354962908_100500/;La Laguna (Chipiona);2 habs.;1 baﾃｱo;75 mﾂｲ;Esta puede ser su oportunidad, le presentamos este precioso piso reformado completamente de hace dos aﾃｱos, cuenta con amplio salﾃｳn...;36.73;-6.43718;2ﾂｪ planta;cadiz
1.125.000 竄ｬ;Chalet en Sotogrande;/comprar/chalet-sotogrande_alto11310-40010549213_100500/;Sotogrande Alto (Sotogrande);5 habs.;5 baﾃｱos;525 mﾂｲ;"Exclusivo chalet en la prestigiosa urbanizaciﾃｳn de sotogrande

Descubra el epitome del lujo y la comodidad en este magnﾃｭfico chale...";36.2780719;-5.3327445;;cadiz
149.000 竄ｬ;Piso en Playa de Regla;/comprar/piso-chipiona_la_laguna-41704176946_100500/;La Laguna (Chipiona);3 habs.;2 baﾃｱos;100 mﾂｲ;Od1097. ﾂ｡Los sueﾃｱos se cumplen! Magnﾃｭfico piso a 550 metros de la playa de regla. La vivienda dispone de 3 amplios dormitorios don...;36.727977348;-6.434052832;2ﾂｪ planta;cadiz
249.000 竄ｬ;Piso en Costilla - Virgen del Mar;/comprar/piso-zona_playa_virgen_del_mar-42581068493_103800/;Zona Playa Virgen del Mar (Rota);4 habs.;;95 mﾂｲ;Si buscas un piso amplio, para toda la familia, al alcance de todo, a poca distancia de la playa y ademﾃ｡s con plaza de aparcamient...;36.622392563;-6.361546805;4ﾂｪ planta;cadiz
238.000 竄ｬ;Piso en calle San Josﾃｩ;/comprar/piso-cadiz_capital_centro_historico11003-41727050108_516894/;Centro Histﾃｳrico (Cﾃ｡diz Capital);3 habs.;2 baﾃｱos;110 mﾂｲ;Cadizsur servicios inmobiliarios les ofrece ﾃｩsta magnﾃｭfica vivienda completamente reformada junto al oratorio san felipe neri. Con...;36.5329171;-6.300043;4ﾂｪ planta;cadiz
1.399.000 竄ｬ;ﾃ》ico en calle A-2100;/comprar/atico-sotogrande_alto11310-30054597313_101800/;Sotogrande Alto (Sotogrande);2 habs.;3 baﾃｱos;238 mﾂｲ;"ﾃ》ico obra nueva en sotogrande (cﾃ｡diz), 33 unidades, varios tamaﾃｱos y alturas.

""walking distance"" del sotogrande international sc...";36.289251209;-5.34532172;;cadiz
279.000 竄ｬ;Casa adosada en Los Gallos;/comprar/casa_adosada-la_soledad_la_coquina_los_gallos-42587418147_100500/;La Soledad-La Coquina-Los Gallos (Chiclana de la Frontera);4 habs.;2 baﾃｱos;94 mﾂｲ;Este adosado se ubica en una urbanizaciﾃｳn en la zona de los gallos, ofreciendo un estilo de vida cﾃｳmodo y relajado. Desde el momen...;36.3979886;-6.1714615;;cadiz
145.000 竄ｬ;Piso en calle de la Marte;/comprar/piso-centro_zona_noreste-44243428480_528322/;Centro-Zona Noreste (Chipiona);2 habs.;2 baﾃｱos;79 mﾂｲ;"Piso de ﾃｺltima construcciﾃｳn 2007
              Piso nuevo, distribuido en 2 dormitorios con roperos empotrados, cocina independien...";36.732501577;-6.424529729;1ﾂｪ planta;cadiz
220.000 竄ｬ;Piso en Costilla - Virgen del Mar;/comprar/piso-zona_playa_virgen_del_mar-44230405912_103800/;Zona Playa Virgen del Mar (Rota);3 habs.;;85 mﾂｲ;ﾂ｡Descubre tu nuevo hogar a dos pasos de la playa de virgen del mar! Este magnﾃｭfico y amplio piso de 85 mﾂｲ te ofrece todo lo que ne...;36.6226283;-6.3683016;3ﾂｪ planta;cadiz
1.800.000 竄ｬ;Finca rﾃｺstica en Jimena de la Frontera;/comprar/finca_rustica-jimena_de_la_frontera_centro_urbano-25026435816_105600/;Jimena de la Frontera;7 habs.;7 baﾃｱos;700 mﾂｲ;"Descripciﾃｳn del objeto:
Andalusia, provinz cadiz, jimena de la frontera
Finca preciosa con piscina, 2 casas y cuadras para caballo...";36.43928016;-5.455949113;;cadiz
190.000 竄ｬ;Piso en calle Sﾃｩneca, 4;/comprar/piso-jerez_de_la_frontera_norte11407-45059082195_522800/;Norte (Jerez de la Frontera);3 habs.;2 baﾃｱos;90 mﾂｲ;Piso de tres dormitorios de 75 mﾂｲ , salﾃｳn comedor con terraza y vistas a la piscina y zonas comunes , cuarto de baﾃｱo con placa duc...;36.710842;-6.1067834;3ﾂｪ planta;cadiz
200.000 竄ｬ;Apartamento en Costilla - Virgen del Mar;/comprar/apartamento-zona_playa_virgen_del_mar-40907274520_103800/;Zona Playa Virgen del Mar (Rota);1 hab.;;70 mﾂｲ;ﾂｿQuieres un apartamento en el que solo tengas que cruzar la calle para ir a la playa? Pues lo tenemos, ademﾃ｡s en planta baja y a p...;36.620319;-6.3632611;;cadiz
629.000 竄ｬ;Chalet en Valdelagrana;/comprar/chalet-el_puerto_de_santa_maria_valdelagrana-43362882478_103800/;Valdelagrana (El Puerto de Santa Marﾃｭa);6 habs.;6 baﾃｱos;310 mﾂｲ;"Chalet con piscina en zona de valdelagrana. A unos minutos de la playa y de todo tipo de servicios. 
Chalet independiente de una p...";36.5813086;-6.2179099;;cadiz
370.000 竄ｬ;Chalet en calle Juan de Arratia;/comprar/chalet-bonanza_martin_miguel_monteolivete11540-44222852930_520119/;Bonanza-Martﾃｭn Miguel-Monteolivete (Sanlﾃｺcar de Barrameda);6 habs.;6 baﾃｱos;294 mﾂｲ;Behome inmobiliaria te presenta en exclusiva, este precioso chalet independiente ubicado en la prestigiosa urbanizaciﾃｳn sanlﾃｺcar c...;36.7891971;-6.3219199;;cadiz
1.000.000 竄ｬ;Chalet en Urbanizaciﾃｳn Roche;/comprar/chalet-conil_de_la_frontera_centro_urbano-42593596476_103800/;Conil de la Frontera;4 habs.;3 baﾃｱos;300 mﾂｲ;Si deseas vivir junto a la playa, y en una urbanizaciﾃｳn respetuosa. Este chalet es sin duda lo que buscas, a 200 metros de la cala...;36.3116682;-6.1492152;;cadiz
330.000 竄ｬ;Chalet en calle Francisco Zurbarﾃ｡n;/comprar/chalet-acerinox-40083061955_526073/;Acerinox (Los Barrios);2 habs.;2 baﾃｱos;500 mﾂｲ;Esta extraordinaria villa en los barrios es una oportunidad ﾃｺnica en el mercado. Con una superficie total de 500 mﾂｲ, esta espacios...;36.190510267;-5.438710092;;cadiz
115.000 竄ｬ;Piso en San Josﾃｩ Artesano;/comprar/piso-reconquista_san_jose_artesano_el_rosario11205-42572599326_100500/;Reconquista-San Josﾃｩ Artesano-El Rosario (Algeciras);4 habs.;2 baﾃｱos;119 mﾂｲ;Bienvenido a esta oportunidad ﾃｺnica de adquirir un encantador piso en venta en san josﾃｩ artesano, una de las barriadas mﾃ｡s destaca...;36.1485842;-5.4495931;2ﾂｪ planta;cadiz
298.000 竄ｬ;Chalet rﾃｺstico en calle Venus;/comprar/chalet_rustico-victoria_el_juncal-43405337392_516524/;Victoria-El Juncal (El Puerto de Santa Marﾃｭa);3 habs.;3 baﾃｱos;140 mﾂｲ;No hipotecable. Chalet independiente de reciente construcciﾃｳn en una sola planta, con otra construcciﾃｳn aneja a modo de apartament...;36.6208677;-6.2089175;;cadiz
270.000 竄ｬ;Apartamento en 2ﾂｪ Pista de La Barrosa;/comprar/apartamento-costa_de_sancti_petri_playa_de_la_barrosa11139-42523855296_100500/;Costa de Sancti Petri-Playa de La Barrosa (Chiclana de la Frontera);2 habs.;1 baﾃｱo;69 mﾂｲ;La zona es inmejorable porque esta bonita urbanizaciﾃｳn con piscina se encuentra a 650 metros de la esplﾃｩndida playa de la barros...;36.3745643;-6.1781906;Bajo;cadiz
134.000 竄ｬ;Piso en calle General Florencio Montojo;/comprar/piso-la_pastora_zona_de_la_estacion11100-42541474028_100500/;La Pastora-Zona de la Estaciﾃｳn (San Fernando);2 habs.;1 baﾃｱo;92 mﾂｲ;Vivienda situada a un minuto de las calles peatonales de san fernando con todo tipo de comercios alrededor. Situada en una planta ...;36.4707807;-6.192774;3ﾂｪ planta;cadiz
110.000 竄ｬ;Apartamento en Centro;/comprar/apartamento-centro_historico_la_costilla-37505557417_103800/;Centro Histﾃｳrico-La Costilla (Rota);1 hab.;1 baﾃｱo;40 mﾂｲ;ﾂｿBuscas invertir en una zona cﾃｩntrica? Parte de casa que dispone de 2 apartamentos de 40 mﾂｲ cada uno que consta de 1 dormitorio, s...;36.621033;-6.3584575;Bajo;cadiz
775.000 竄ｬ;Dﾃｺplex en calle de la Sierra del Retﾃｭn,  s/n;/comprar/duplex-zahara_de_los_atunes-4561849967_109700/;Zahara de los Atunes (Barbate);3 habs.;3 baﾃｱos;158 mﾂｲ;Dﾃｺplex bajo en un edificio de obra nueva de 158 m2 de superficie construida y ubicado en la zona de Zaragoza Capital, enclavado en planta baja. Estﾃ｡ distribuido en 3 habitaciones, 3 baﾃｱos completos y terraza. Incluye extras como ascensor, garaje y trastero.;36,1354248;-5,8412992;Bajo;cadiz
254.990 竄ｬ;ﾃ》ico en La Laguna;/comprar/atico-chipiona_la_laguna-36751470113_100500/;La Laguna (Chipiona);2 habs.;2 baﾃｱos;136 mﾂｲ;Od622. ﾂｿSueﾃｱas con vivir en un espacio ﾃｺnico, con vistas espectaculares y todas las comodidades del mundo? ﾂ｡Este ﾃ｡tico es tu oport...;36.7200591;-6.4336742;;cadiz
218.724 竄ｬ;Piso en calle de Santa Ana, 5;/comprar/piso-nucleo_urbano_urbanizaciones-3858776509_109700/;Nﾃｺcleo Urbano-Urbanizaciones (Chiclana de la Frontera);2 habs.;2 baﾃｱos;107 mﾂｲ;Tipo 8 (2.2). Piso en una finca de obra nueva de 107 mﾂｲ de superficie construida y emplazado en la zona de chiclana de la frontera...;36.4166266;-6.1488695;1ﾂｪ planta;cadiz
139.990 竄ｬ;Piso en Sanlﾃｺcar de Barrameda;/comprar/piso-centro_calzada-30010140555_100500/;Centro-Calzada (Sanlﾃｺcar de Barrameda);2 habs.;1 baﾃｱo;70 mﾂｲ;Od1012. ﾂ｡Estﾃ｡s a punto de descubrir tu nuevo hogar! Este moderno piso estﾃ｡ ubicado en una zona residencial privada y tranquila en ...;36.7763898;-6.3513248;1ﾂｪ planta;cadiz
157.200 竄ｬ;Piso en Rompidillo;/comprar/piso-rota_chorrillo11520-42516210102_103800/;Chorrillo (Rota);3 habs.;1 baﾃｱo;77 mﾂｲ;Si estﾃ｡s pensando en independizarte o de comprarte un piso en la playa. Este es tu momento!! Amplio piso de 3 dormitorios, salﾃｳn c...;36.627408468;-6.352604193;1ﾂｪ planta;cadiz
98.700 竄ｬ;Piso en Oeste;/comprar/piso-jerez_de_la_frontera_centro11404-43367913558_100500/;Centro (Jerez de la Frontera);3 habs.;2 baﾃｱos;116 mﾂｲ;Magnifico piso de cinco dormitorios reformado en tres, salﾃｳn comedor con terraza, cocina amueblada con electrodomﾃｩsticos y dos baﾃｱ...;36.6925704;-6.1448253;4ﾂｪ planta;cadiz
1.000.000 竄ｬ;Chalet en Altillo;/comprar/chalet-jerez_de_la_frontera_norte11407-45048848312_109300/;Norte (Jerez de la Frontera);6 habs.;4 baﾃｱos;362 mﾂｲ;Exclusivo chalet con parcela de mil doscientos metros ubicado en zona altillo. Ideal para disfrutar de sus amplias estancias y esp...;36.7047899;-6.1195285;;cadiz
2.664.000 竄ｬ;ﾃ》ico en calle A-2100;/comprar/atico-sotogrande_alto11310-30061360705_101800/;Sotogrande Alto (Sotogrande);4 habs.;5 baﾃｱos;383 mﾂｲ;"ﾃ》ico obra nueva en sotogrande (cﾃ｡diz), 33 unidades, varios tamaﾃｱos y alturas.

""walking distance"" del sotogrande international sc...";36.27916;-5.3185192;;cadiz
240.000 竄ｬ;Piso en calle Sanidad Publica;/comprar/piso-san_jose_varela_la_laguna11008-45048710269_100500/;San Josﾃｩ-Varela-La Laguna (Cﾃ｡diz Capital);3 habs.;1 baﾃｱo;69 mﾂｲ;Vivienda tipo piso en edificio con ascensor, situada en zona con fﾃ｡cil salida a la autovﾃｭa y a tan solo 8 minutos a pie de la play...;36.5176423;-6.2798749;3ﾂｪ planta;cadiz
74.000 竄ｬ;Casa en Centro;/comprar/casa-algeciras_centro11201-45007288179_100500/;Centro (Algeciras);3 habs.;2 baﾃｱos;134 mﾂｲ;"Casa en san isidro para reforma integral.

ﾂ｡Oportunidad ﾃｺnica en la barriada de san isidro, en pleno centro de algeciras!

ﾂｿBuscas...";36.1319953;-5.4502171;;cadiz
146.000 竄ｬ;Piso en calle del Langostino;/comprar/piso-chipiona_la_laguna-41723640839_100500/;La Laguna (Chipiona);4 habs.;;105 mﾂｲ;"Referencia: 913

Vivienda situada en la avenida del esturiﾃｳn, a 500 metros de la playa de regla.
Se trata de una primera planta si...";36.7267006;-6.4343242;1ﾂｪ planta;cadiz
150.000 竄ｬ;Piso en Avenida de Tomﾃ｡s Garcﾃｭa Figueras;/comprar/piso-jerez_de_la_frontera_oeste11407-44214171403_103800/;Oeste (Jerez de la Frontera);3 habs.;1 baﾃｱo;83 mﾂｲ;"Piso de 3 dormitorios con garaje incluido en zona norte

El inmueble dispone de hall de entrada, cocina equipada (salvo lavavajill...";36.6984494;-6.1385363;2ﾂｪ planta;cadiz
293.500 竄ｬ;Dﾃｺplex en Bahia Luz - Forestal;/comprar/duplex-bahia_de_la_luz_la_forestal11520-40895469918_103800/;Bahﾃｭa de la Luz-La Forestal (Rota);4 habs.;2 baﾃｱos;99 mﾂｲ;Si buscas una vivienda amplia y con espacio para toda la familia, no lo pienses, vivienda tipo dﾃｺplex, de 4 dormitorios, patio,ter...;36.6291348;-6.3801826;Bajo;cadiz
A consultar;Finca rﾃｺstica en Parque del Estrecho;/comprar/finca_rustica-el_pelayo_parques_naturales11390-44208391186_100500/;El Pelayo-Parques Naturales (Algeciras);6 habs.;7 baﾃｱos;496 mﾂｲ;La ubicaciﾃｳn de este cortijo es absolutamente excepcional. Se encuentra en el parque natural del estrecho, donde la naturaleza y l...;36.0839855;-5.4981016;;cadiz
73.500 竄ｬ;Piso en Avenida Virgen del Carmen, 19;/comprar/piso-algeciras_centro11201-42584591588_100500/;Centro (Algeciras);2 habs.;1 baﾃｱo;70 mﾂｲ;Excelente piso muy luminoso y frente a paseo marﾃｭtimo, donde estﾃ｡ proyectada la mejor zona de paseo y ocio de algeciras, con parqu...;36.1301;-5.44519;5ﾂｪ planta;cadiz
149.900 竄ｬ;Piso en La Paz-Segunda Aguado-Loreto;/comprar/piso-la_paz_segunda_aguado_loreto11012-45027368176_527560/;La Paz-Segunda Aguado-Loreto (Cﾃ｡diz Capital);3 habs.;1 baﾃｱo;58 mﾂｲ;ﾂ｡Oportunidad en zona del mercado la paz! Presentamos este piso a reformar de 66 mﾂｲ construidos, ideal para aquellos que buscan per...;36.5137579;-6.2739268;8ﾂｪ planta;cadiz
169.000 竄ｬ;Dﾃｺplex en Playa de Regla;/comprar/duplex-chipiona_la_laguna-43355017679_100500/;La Laguna (Chipiona);2 habs.;2 baﾃｱos;64 mﾂｲ;Od1112. Vivir a 400 metros de la playa de regla no tiene precio. Tienes un dﾃｺplex a tu disposiciﾃｳn de 2 dormitorios, 2 cuartos de ...;36.7304119;-6.4356023;Bajo;cadiz
380.000 竄ｬ;Casa en Vallealto;/comprar/casa-vallealto-45003022058_265000/;Vallealto (El Puerto de Santa Marﾃｭa);3 habs.;2 baﾃｱos;120 mﾂｲ;"Alonsaga inmobiliaria vende en exclusiva bonita casa independiente en vallealto!!!
Esta encantadora casa en venta se encuentra en ...";36.6270867;-6.2079945;;cadiz
350.000 竄ｬ;Piso en Avenida de Cayetano del Toro;/comprar/piso-san_jose_varela_la_laguna11010-41697655209_516894/;San Josﾃｩ-Varela-La Laguna (Cﾃ｡diz Capital);4 habs.;2 baﾃｱos;114 mﾂｲ;Cadizsur servicios inmobiliarios les ofrece a la venta, piso en cayetano del toro!! Magnﾃｭfica vivienda, edificio de alta categorﾃｭa...;36.5065616;-6.2772532;4ﾂｪ planta;cadiz
119.900 竄ｬ;Chalet en La Soledad;/comprar/chalet-la_soledad_la_coquina_los_gallos-39223515012_100500/;La Soledad-La Coquina-Los Gallos (Chiclana de la Frontera);3 habs.;1 baﾃｱo;110 mﾂｲ;"Chalet en la zona de vipren con parcela segregada en suelo rustico

Chalet con parcela segregada en suelo rustico de 980mﾂｲ y una s...";36.4223691;-6.177438;;cadiz
189.500 竄ｬ;Chalet en Pago del Humo;/comprar/chalet-pago_del_humo_poligono_de_pelagatos-43361818147_100500/;Pago del Humo-Polﾃｭgono de Pelagatos (Chiclana de la Frontera);4 habs.;3 baﾃｱos;165 mﾂｲ;Exclusivo chalet situado en chiclana de la frontera, en la zona privilegiada del pago del humo. Con una superficie construida de 1...;36.3933108;-6.1113693;;cadiz
66.000 竄ｬ;Apartamento en Jimena de la Frontera;/comprar/apartamento-jimena_de_la_frontera_centro_urbano-42566322048_106700/;Jimena de la Frontera;2 habs.;1 baﾃｱo;77 mﾂｲ;"Luminoso apartamento de 2 habitaciones con buenas vistas, baﾃｱo con ducha, salﾃｳn con despensa, comedor y cocina con mucha luz. 
Se ...";36.431383614;-5.446223852;;cadiz
245.000 竄ｬ;Apartamento en Otras;/comprar/apartamento-cadiz_capital_centro_historico11005-43358033835_100500/;Centro Histﾃｳrico (Cﾃ｡diz Capital);2 habs.;1 baﾃｱo;60 mﾂｲ;"Apartamento de dos dormitorios con un baﾃｱo con ducha , nuevo con salﾃｳn y cocina independiente con electrodomﾃｩsticos
En edificio to...";36.5308431;-6.2943247;Bajo;cadiz
