precio;sub_descr;href;ubicacion;habitaciones;banios;mt2;otros;latitude;longitude;planta;CCAA
58.000 竄ｬ;Piso en Oeste;/comprar/piso-jerez_de_la_frontera_oeste11404-43400342529_100200/;Oeste (Jerez de la Frontera);2 habs.;1 baﾃｱo;55 mﾂｲ;"Piso en bda. Coronacion.
ﾂ｡Increﾃｭble oportunidad de compra en la barriada coronaciﾃｳn! Este fabuloso piso en primera planta te ofrec...";36.6952394;-6.1479225;1ﾂｪ planta;cadiz
370.000 竄ｬ;Piso en Playa de La Victoria;/comprar/piso-el_populo_santa_maria11005-44257243095_100500/;El Pﾃｳpulo-Santa Marﾃｭa (Cﾃ｡diz Capital);2 habs.;1 baﾃｱo;92 mﾂｲ;Inmobiliaria vivencadiz os presenta oportunidad de estrenar este increﾃｭble piso de nueva construcciﾃｳn con impresionantes vistas al...;36.5290863;-6.2922037;2ﾂｪ planta;cadiz
134.900 竄ｬ;Piso en calle del Sol, 54;/comprar/piso-centro_san_felipe_huerta_fava-31739536452_106000/;Centro-San Felipe-Huerta Fava (La Lﾃｭnea de la Concepciﾃｳn);2 habs.;1 baﾃｱo;Mﾃ｡s de 20;Obra nueva en el centro de la linea.  Tiene una ubicacion privilegiada. En pleno centro de la linea, a escasos pasos de la plaza d...;36.1626;-5.35152;;cadiz
294.000 竄ｬ;Casa en Las Palmeras-Dehesilla;/comprar/casa-las_palmeras_dehesilla-43363432602_512750/;Las Palmeras-Dehesilla (Sanlﾃｺcar de Barrameda);4 habs.;3 baﾃｱos;155 mﾂｲ;"En exclusiva para ti!

Chalet de una sola planta, muy cﾃｳmodo para vivir.

Gran chalet urbano e independiente con piscina. En el in...";36.7628749;-6.357124;;cadiz
700.000 竄ｬ;Chalet en Valdelagrana;/comprar/chalet-el_puerto_de_santa_maria_valdelagrana-43414172374_100500/;Valdelagrana (El Puerto de Santa Marﾃｭa);4 habs.;3 baﾃｱos;156 mﾂｲ;Les presentamos este magnifico chalet ubicado en un enclave ﾃｺnico junto al parque natural de los toruﾃｱos, en el puerto de santa ma...;36.5711477;-6.2198258;;cadiz
289.900 竄ｬ;Casa en Las Piletas;/comprar/casa-sanlucar_de_barrameda_las_piletas-45013567763_512750/;Las Piletas (Sanlﾃｺcar de Barrameda);5 habs.;3 baﾃｱos;200 mﾂｲ;"En exclusiva ! Casa independiente con patios !

La casa es muy amplia e independiente y ha sido renovada recientemente en su total...";36.7743352;-6.3611643;;cadiz
202.400 竄ｬ;Casa pareada en Este;/comprar/casa_pareada-este11406-44241373316_101800/;Este (Jerez de la Frontera);4 habs.;3 baﾃｱos;150 mﾂｲ;Vivienda pareada de renta libre  con grandes calidades en zona este. El exterior de la vivienda consta de patio delantero con capa...;36.6863742;-6.111147;;cadiz
158.000 竄ｬ;ﾃ》ico en Avenida de las Palmeras, 13;/comprar/atico-la_linea_de_la_concepcion_la_alcaidesa-23340423716_100500/;La Alcaidesa (La Lﾃｭnea de la Concepciﾃｳn);2 habs.;;112 mﾂｲ;Increﾃｭble piso en venta en la urbanizaciﾃｳn mirador de la alcaidesa. Disfruta de una ubicaciﾃｳn privilegiada a tan solo 1 km de la h...;36.24;-5.32019;;cadiz
195.000 竄ｬ;Casa adosada en Huerta Alta;/comprar/casa_adosada-nucleo_urbano_urbanizaciones-38429343317_100500/;Nﾃｺcleo Urbano-Urbanizaciones (Chiclana de la Frontera);3 habs.;2 baﾃｱos;115 mﾂｲ;Amplia vivienda unifamiliar en chiclana de tres plantas en la zona de huerta alta. La planta baja se distribuye en amplio salﾃｳn co...;36.4153972;-6.1521941;;cadiz
180.000 竄ｬ;Piso en calle de la Bolsa;/comprar/piso-el_pino_bajo_de_guia-37591112087_521550/;El Pino-Bajo de Guﾃｭa (Sanlﾃｺcar de Barrameda);3 habs.;2 baﾃｱos;80 mﾂｲ;Gran piso de 3 habitaciones 2 baﾃｱos, salﾃｳn, cocina equipada, garaje y trastero incluido en el precio. Rodeado de todos los servici...;36.785393;-6.3461911;2ﾂｪ planta;cadiz
800.000 竄ｬ;Casa en Getares;/comprar/casa-san_garcia_getares-41686263404_100500/;San Garcﾃｭa-Getares (Algeciras);4 habs.;4 baﾃｱos;630 mﾂｲ;Superficie total 650 mﾂｲ, casa superficie solar 1000 mﾂｲ, superficie ﾃｺtil 620 mﾂｲ, hab. Individuales: 3, habitaciones dobles: 1, 3 ba...;36.108724005;-5.434151744;;cadiz
560.000 竄ｬ;ﾃ》ico en calle de la Sierra del Retﾃｭn,  s/n;/comprar/atico-zahara_de_los_atunes-4468403885_109700/;Zahara de los Atunes (Barbate);3 habs.;3 baﾃｱos;131 mﾂｲ;ﾃ》ico Dﾃｺplex en una finca de obra nueva de 131 m2 de superficie construida y emplazado en la zona de Zaragoza Capital. Estﾃ｡ dispuesto en 3 habitaciones, 3 baﾃｱos completos y terraza. Cuenta como extras ascensor, garaje y trastero.;36,1354248;-5,8412992;;cadiz
265.000 竄ｬ;Casa pareada en Getares;/comprar/casa_pareada-san_garcia_getares-44209038573_100500/;San Garcﾃｭa-Getares (Algeciras);3 habs.;2 baﾃｱos;120 mﾂｲ;ﾂ｡Descubre tu nuevo hogar en la exclusiva zona de getares, algeciras! Este precioso chalet pareado te espera con 120 mﾂｲ construidos...;36.1004191;-5.4477487;;cadiz
700.000 竄ｬ;Chalet en La Barrosa;/comprar/chalet-costa_de_sancti_petri_playa_de_la_barrosa11139-44231996780_100500/;Costa de Sancti Petri-Playa de La Barrosa (Chiclana de la Frontera);4 habs.;2 baﾃｱos;183 mﾂｲ;Chalet en chiclana situado en la zona de playa la barrosa, a 450 metros del mar, distribuido en hall de entrada, 4 dormitorios, 2 ...;36.3755482;-6.1828835;;cadiz
A consultar;ﾃ》ico en Costilla;/comprar/atico-centro_historico_la_costilla-12545855888_501368/;Centro Histﾃｳrico-La Costilla (Rota);1 hab.;1 baﾃｱo;55 mﾂｲ;Atento todos los que tengﾃ｡is un piso en el centro de sevilla o kansas city 28 de unos 2 dormitorios con ascensor, unos 60mﾂｲ y plaz...;36.618821294;-6.360880641;;cadiz
259.000 竄ｬ;Piso en Centro Histﾃｳrico;/comprar/piso-cadiz_capital_centro_historico-40839450303_522680/;Centro Histﾃｳrico (Cﾃ｡diz Capital);3 habs.;2 baﾃｱos;130 mﾂｲ;"** piso en venta en cﾃ｡diz capital / zona centro / plaza espaﾃｱa / san francisco **

Vivienda en venta en cﾃ｡diz capital, en una de l...";36.5336698;-6.2943658;1ﾂｪ planta;cadiz
79.900 竄ｬ;Casa adosada en San Garcﾃｭa-Getares;/comprar/casa_adosada-san_garcia_getares-44178724864_100200/;San Garcﾃｭa-Getares (Algeciras);3 habs.;1 baﾃｱo;121 mﾂｲ;ﾂ｡Novedad! Casa adosada lista para entrar a vivir. La vivienda de 3 plantas consta de salﾃｳn amplio, cocina, cuarto de baﾃｱo completo...;36.1115443;-5.4469636;;cadiz
325.000 竄ｬ;Chalet en Santiscal;/comprar/chalet-arcos_de_la_frontera_centro_urbano-31727695757_103800/;Arcos de la Frontera;4 habs.;5 baﾃｱos;131 mﾂｲ;Os presentamos este chalet en arcos de la frontera, en plena sierra de cﾃ｡diz, ubicaciﾃｳn idﾃｳnea para relajarse y tener las comodida...;36.760790808;-5.784986757;;cadiz
610.000 竄ｬ;Chalet en La Barrosa;/comprar/chalet-costa_de_sancti_petri_playa_de_la_barrosa11139-45045635095_100500/;Costa de Sancti Petri-Playa de La Barrosa (Chiclana de la Frontera);4 habs.;2 baﾃｱos;124 mﾂｲ;Chalet en chiclana situado en la zona de playa la barrosa, a 300 metros del mar, rodeado de comercios y zonas de restauraciﾃｳn, dis...;36.3717894;-6.180112;;cadiz
165.000 竄ｬ;Piso en Chapin;/comprar/piso-jerez_de_la_frontera_norte11407-40067301195_103800/;Norte (Jerez de la Frontera);2 habs.;2 baﾃｱos;85 mﾂｲ;"Maravilloso piso de dos dormitorios en las terrazas de chapﾃｭn. 
Se distribuye en dos dormitorios con armarios empotrados color rob...";36.6923913;-6.1062364;6ﾂｪ planta;cadiz
255.000 竄ｬ;Piso en calle Parra;/comprar/piso-el_puerto_de_santa_maria_centro-44171014537_103800/;Centro (El Puerto de Santa Marﾃｭa);3 habs.;2 baﾃｱos;115 mﾂｲ;Magnifico piso en zona centro-jardﾃｭn de cano, consta de tres amplias habitaciones y dos baﾃｱos completos, terraza , salﾃｳn comedor i...;36.6049157;-6.2224547;3ﾂｪ planta;cadiz
127.000 竄ｬ;Piso en Nﾃｺcleo Urbano-Urbanizaciones;/comprar/piso-nucleo_urbano_urbanizaciones-45091549762_500623/;Nﾃｺcleo Urbano-Urbanizaciones (Chiclana de la Frontera);2 habs.;1 baﾃｱo;60 mﾂｲ;Este luminoso piso en planta baja en venta en chiclana de la frontera puede ser la vivienda que tanto tiempo lleva buscando bien p...;36.4158263;-6.1486218;Bajo;cadiz
260.000 竄ｬ;Piso en Plaza de Madrid;/comprar/piso-san_jose_varela_la_laguna11010-44199159968_525281/;San Josﾃｩ-Varela-La Laguna (Cﾃ｡diz Capital);3 habs.;1 baﾃｱo;70 mﾂｲ;Luxury pm inmobiliaria,  les presenta en exclusividad, magnifico piso en zona la laguna, la vivienda consta de salﾃｳn muy cﾃｳmodo, s...;36.5012172;-6.2738098;2ﾂｪ planta;cadiz
180.000 竄ｬ;Piso en Bajadilla;/comprar/piso-bajadilla-40840144726_100200/;Bajadilla (Algeciras);4 habs.;2 baﾃｱos;144 mﾂｲ;ﾂ｡Bienvenidos a este hermoso piso en venta en una de las zonas mﾃ｡s cotizadas de algeciras! Este piso es nuevo y se encuentra en una...;36.135855153;-5.458851497;;cadiz
145.000 竄ｬ;Casa en Este;/comprar/casa-este11406-45021081378_108900/;Este (Jerez de la Frontera);3 habs.;1 baﾃｱo;120 mﾂｲ;Casa en jerez de la frontera, zona la milagrosa, vivienda de autoconstrucciﾃｳn, la vivienda se encuentra en planta baja con las tre...;36.6837531;-6.1024254;;cadiz
190.000 竄ｬ;Piso en calle Barrie;/comprar/piso-cadiz_capital_centro_historico11001-45031364855_511045/;Centro Histﾃｳrico (Cﾃ｡diz Capital);2 habs.;1 baﾃｱo;90 mﾂｲ;Este piso en venta se encuentra en el municipio de cﾃ｡diz capital junto al mercado de abastos, una zona con encanto y cerca de todo...;36.531593;-6.2973618;1ﾂｪ planta;cadiz
74.900 竄ｬ;Piso en Norte;/comprar/piso-jerez_de_la_frontera_norte11405-45068621339_100200/;Norte (Jerez de la Frontera);2 habs.;;70 mﾂｲ;ﾂ｡Descubre tu nuevo hogar en el corazﾃｳn de la ciudad! Este encantador piso de 70 mﾂｲ, ubicado en la primera planta, es ideal para pa...;36.6777381;-6.1299037;;cadiz
210.000 竄ｬ;Casa adosada en Este;/comprar/casa_adosada-este11406-45065374788_517119/;Este (Jerez de la Frontera);5 habs.;3 baﾃｱos;128 mﾂｲ;Unifamiliar adosada de renta libre, casa adosada de cinco dormitorios, dos baﾃｱos completos, aseo, salﾃｳn comedor, cocina amueblada,...;36.6837193;-6.102076;;cadiz
190.000 竄ｬ;Piso en calle Marﾃｭa Silva Cruz ﾂｴLa Libertariaﾂｴ;/comprar/piso-la_paz_segunda_aguado_loreto11011-45066637707_511045/;La Paz-Segunda Aguado-Loreto (Cﾃ｡diz Capital);4 habs.;2 baﾃｱos;130 mﾂｲ;Este hermoso piso en cﾃ｡diz capital, es ideal para aquellos que buscan un hogar espacioso y acogedor. Con una superficie total de 1...;36.5058617;-6.2694367;Bajo;cadiz
475.000 竄ｬ;Casa adosada en Carretera Nueva de La Barrosa,  S/N;/comprar/casa_adosada-costa_de_sancti_petri_playa_de_la_barrosa-3737297600_109700/;Costa de Sancti Petri-Playa de La Barrosa (Chiclana de la Frontera);3 habs.;3 baﾃｱos;155 mﾂｲ;Casa adosada de obra nueva, de 155 mﾂｲ de superficie construida, y situada en la zona de chiclana de la frontera.  Estﾃ｡ estructurad...;36.3878235;-6.1704722;;cadiz
200.000 竄ｬ;ﾃ》ico en Norte;/comprar/atico-jerez_de_la_frontera_norte11407-41748252151_101800/;Norte (Jerez de la Frontera);3 habs.;2 baﾃｱos;103 mﾂｲ;ﾃ》ico en en urbanizaciﾃｳn privada en zona norte. La vivienda se distribuye en vestﾃｭbulo de entrada, salﾃｳn comedor con acceso a terr...;36.7110989;-6.106683;;cadiz
317.000 竄ｬ;Casa en Las Piletas;/comprar/casa-sanlucar_de_barrameda_las_piletas-43403188099_512750/;Las Piletas (Sanlﾃｺcar de Barrameda);4 habs.;2 baﾃｱos;170 mﾂｲ;"En exclusiva! Vivienda lista para entrar a vivir!

Gran duplex con patios y azotea!

Ubicado en la zona playa - avenida v centenar...";36.7790614;-6.3612481;;cadiz
285.000 竄ｬ;ﾃ》ico en Centro;/comprar/atico-la_caleta_la_vina11002-41699696737_100500/;La Caleta-La Viﾃｱa (Cﾃ｡diz Capital);2 habs.;1 baﾃｱo;56 mﾂｲ;Presentamos esta nueva promociﾃｳn de viviendas en pleno centro de la ciudad a escasos metros del mercado central de abastos y del p...;36.5292014;-6.2994896;;cadiz
195.000 竄ｬ;Piso en Centro;/comprar/piso-jerez_de_la_frontera_centro11401-41702716315_103800/;Centro (Jerez de la Frontera);4 habs.;2 baﾃｱos;120 mﾂｲ;"Piso en centro, con 11o m construidos, 100m utiles, 4 dormitorios, dos baﾃｱos,garaje y trastero.

Si buscas una vivienda amplia lum...";36.6774957;-6.1278316;;cadiz
499.000 竄ｬ;Chalet en El Rinconcillo;/comprar/chalet-rinconcillo-25095084018_100500/;Rinconcillo (Algeciras);4 habs.;3 baﾃｱos;350 mﾂｲ;Superficie total 380 mﾂｲ, casa superficie solar 1000 mﾂｲ, superficie ﾃｺtil 350 mﾂｲ, hab. Individuales: 2, habitaciones dobles: 2, 3 ba...;36.1567016;-5.4521299;;cadiz
152.000 竄ｬ;Piso en calle Pozos Dulces;/comprar/piso-el_puerto_de_santa_maria_centro-44176030994_100500/;Centro (El Puerto de Santa Marﾃｭa);3 habs.;1 baﾃｱo;87 mﾂｲ;"ﾂ｡ﾂ｡ﾂ｡ﾂ｡ Oportunidad ﾂ｡ﾂ｡ﾂ｡ﾂ｡
En una finca tﾃｭpica andaluza en pleno casco histﾃｳrico  y con entrada bajo soportales se encuentra este piso ...";36.6015253;-6.2210287;1ﾂｪ planta;cadiz
135.000 竄ｬ;Piso en El Tejar;/comprar/piso-victoria_el_juncal-45016496151_104700/;Victoria-El Juncal (El Puerto de Santa Marﾃｭa);3 habs.;;80 mﾂｲ;"Puerto playa&nbsp; pone a la venta este precioso y luminoso piso de 3 dormitorios y un&nbsp; baﾃｱo en una buena zona del puerto de ...";36.609814;-6.2153356;;cadiz
207.000 竄ｬ;Piso en calle de la Nao Concepciﾃｳn;/comprar/piso-sanlucar_de_barrameda_las_piletas-44173022993_512750/;Las Piletas (Sanlﾃｺcar de Barrameda);3 habs.;1 baﾃｱo;90 mﾂｲ;"En exclusiva pata ti!

Vivienda con terraza + garaje + trastero + ascensor

ﾂｿ Buscas una vivienda completa con terraza + garaje + ...";36.7786669;-6.3603244;2ﾂｪ planta;cadiz
280.000 竄ｬ;Casa rﾃｺstica en Rural;/comprar/casa_rustica-rural-39198230171_100200/;Rural (Jerez de la Frontera);3 habs.;;2.645 mﾂｲ;"Fantastico chalet, en urbn. El chaparrito.
Parcela de 2.645 metros cuadrados, con escrituras.
Chalet de una sola planta, compuesto...";36.6359309;-5.8581818;;cadiz
290.000 竄ｬ;Casa en Barbate;/comprar/casa-barbate_centro_urbano-39182940222_106700/;Barbate;3 habs.;2 baﾃｱos;125 mﾂｲ;Increﾃｭble casa en barbate, a escasos 100 metros de la playa. Distribuida en dos plantas y con el encanto del casco antiguo de la l...;36.1885112;-5.9171203;;cadiz
235.000 竄ｬ;ﾃ》ico en calle San Nicols;/comprar/atico-el_pino_bajo_de_guia-38406742795_103800/;El Pino-Bajo de Guﾃｭa (Sanlﾃｺcar de Barrameda);3 habs.;;109 mﾂｲ;"Estupendo ﾃ｡tico con ascensor y garaje en sanlﾃｺcar de barrameda.
En este residencial, en la zona de bajo guia, a 5 minutos de la pl...";36.7839455;-6.3498626;;cadiz
190.000 竄ｬ;Piso en Centro-Zona Noreste;/comprar/piso-centro_zona_noreste-35877149185_100200/;Centro-Zona Noreste (Chipiona);3 habs.;2 baﾃｱos;95 mﾂｲ;"Zona centro.
Maravilloso piso en pleno centro de chipiona a 1 minuto de la plaza de abastos.
El piso consta de:
- 3 dormitorios.
-...";36.738450219;-6.433467544;3ﾂｪ planta;cadiz
460.000 竄ｬ;Dﾃｺplex en calle de la Sierra del Retﾃｭn,  s/n;/comprar/duplex-zahara_de_los_atunes-4444989816_109700/;Zahara de los Atunes (Barbate);3 habs.;3 baﾃｱos;145 mﾂｲ;Dﾃｺplex en un edificio de obra nueva de 145 m2 de superficie construida y ubicado en la zona de Zaragoza Capital, enclavado en planta baja. Estﾃ｡ distribuido en 3 habitaciones, 3 baﾃｱos completos y terraza. Incluye extras como ascensor, garaje y trastero.;36,1354248;-5,8412992;Bajo;cadiz
113.000 竄ｬ;Piso en La Pastora;/comprar/piso-la_pastora_zona_de_la_estacion11100-45064435167_100500/;La Pastora-Zona de la Estaciﾃｳn (San Fernando);2 habs.;1 baﾃｱo;63 mﾂｲ;"Estas buscando piso cerca del centro de san fernando? Tenemos lo buscas.

Acogedor piso ubicado en la zona de la plazoleta de las ...";36.4698824;-6.1913326;1ﾂｪ planta;cadiz
675.000 竄ｬ;Chalet en La Barrosa;/comprar/chalet-costa_de_sancti_petri_playa_de_la_barrosa11139-42543046686_100500/;Costa de Sancti Petri-Playa de La Barrosa (Chiclana de la Frontera);4 habs.;3 baﾃｱos;218 mﾂｲ;Chalet en chiclana situado en la zona de la 2ﾂｪ pista de la playa la barrosa, junto a todo tipo de servicios y a sﾃｳlo 300 metros de...;36.3729966;-6.1801063;;cadiz
298.000 竄ｬ;Piso en San Josﾃｩ-Varela-La Laguna;/comprar/piso-san_jose_varela_la_laguna11009-45050503573_100200/;San Josﾃｩ-Varela-La Laguna (Cﾃ｡diz Capital);4 habs.;;108 mﾂｲ;ﾂ｡Descubre tu nuevo hogar en el corazﾃｳn de la ciudad a 2 minutos del hospital puerta del mar de cﾃ｡diz! Este piso de 108 mﾂｲ reciﾃｩn r...;36.510861;-6.2765683;1ﾂｪ planta;cadiz
87.990 竄ｬ;Piso en Centro;/comprar/piso-algeciras_centro11201-45066049051_525987/;Centro (Algeciras);3 habs.;1 baﾃｱo;110 mﾂｲ;"Piso grande, de 100 mﾂｲ, en buenas condiciones. Se encuentra situado en el centro de algeciras, secano, zona muy buena y tranquila
...";36.1283794;-5.4492712;2ﾂｪ planta;cadiz
306.000 竄ｬ;Piso en Norte;/comprar/piso-noreste11405-31765119591_103800/;Noreste (Jerez de la Frontera);4 habs.;2 baﾃｱos;130 mﾂｲ;Desde inmobiliaria carmen te ofrecemos este magnﾃｭfico piso en unas de las zonas mﾃ｡s cotizadas de jerez. Es un residencial privado,...;36.7023819;-6.1101108;2ﾂｪ planta;cadiz
195.000 竄ｬ;Piso en Barbate;/comprar/piso-barbate_centro_urbano-45045945445_100200/;Barbate;3 habs.;2 baﾃｱos;198 mﾂｲ;ﾂ｡Descubre tu nuevo hogar en el corazﾃｳn de la ciudad! Este encantador piso de primera planta, construido en 1985 y en excelente est...;36.189998424;-5.922930794;;cadiz
140.000 竄ｬ;Casa adosada en Rural;/comprar/casa_adosada-rural11591-43340999678_100200/;Rural (Jerez de la Frontera);2 habs.;;101 mﾂｲ;Bienvenido a esta maravillosa casa adosada de dos plantas ubicada en la tranquila localidad de guadalcacﾃｭn, ideal para aquellos qu...;36.7131286;-6.0864151;;cadiz
199.500 竄ｬ;Piso en calle Condesa de Lebrija;/comprar/piso-centro_calzada-44224916752_100200/;Centro-Calzada (Sanlﾃｺcar de Barrameda);;2 baﾃｱos;86 mﾂｲ;"Piso bajo en el centro

Este fin de semana os traemos este magnifico piso bajo en pleno centro, concretamente en calzada de la inf...";36.780031;-6.3587088;;cadiz
239.000 竄ｬ;Casa pareada en San Garcﾃｭa-Getares;/comprar/casa_pareada-san_garcia_getares-43372843437_100200/;San Garcﾃｭa-Getares (Algeciras);4 habs.;2 baﾃｱos;206 mﾂｲ;"ﾂ｡No dejes pasar esta increﾃｭble oportunidad de compra!

Se vende una casa/chalet pareado de 206mﾂｲ, perfecto para toda la familia.

...";36.1135946;-5.4437947;;cadiz
235.000 竄ｬ;Piso en Costa Ballena;/comprar/piso-costa_ballena-45001074359_109300/;Costa Ballena (Rota);2 habs.;2 baﾃｱos;78 mﾂｲ;"ﾂｿEstﾃ｡s buscando algo semi-nuevo?

Aquﾃｭ disponemos de este piso  en  la urbanizaciﾃｳn jardines del lago. 

Primera planta con unas e...";36.623500397;-6.365182332;1ﾂｪ planta;cadiz
174.900 竄ｬ;Piso en Centro;/comprar/piso-el_puerto_de_santa_maria_centro-45036254740_108900/;Centro (El Puerto de Santa Marﾃｭa);2 habs.;1 baﾃｱo;84 mﾂｲ;Piso en urbanizaciﾃｳn cerrada con piscina. Dispone de 2 dormitorios amplios, salﾃｳn comedor, cocina amueblada y baﾃｱo con baﾃｱera. La ...;36.6056693;-6.2229657;;cadiz
214.900 竄ｬ;Piso en El ﾃ“uila-Las Redes-Fuentebravﾃｭa;/comprar/piso-el_aguila_las_redes_fuentebravia-45058221787_108900/;El ﾃ“uila-Las Redes-Fuentebravﾃｭa (El Puerto de Santa Marﾃｭa);2 habs.;1 baﾃｱo;75 mﾂｲ;Os presentamos este magnﾃｭfico piso en la zona de fuentebravﾃｭa con unas maravillosas vistas al mar, compuesto por 2 dormitorios amp...;36.611081;-6.28503;;cadiz
170.000 竄ｬ;Piso en Centro;/comprar/piso-jerez_de_la_frontera_centro11403-40850207866_103800/;Centro (Jerez de la Frontera);3 habs.;2 baﾃｱos;139 mﾂｲ;"Piso en el centro de la ciudad y construido en un antiguo balneario del s.xv
Cada propiedad en este edificio es ﾃｺnico y este es un...";36.6842837;-6.1403058;Bajo;cadiz
175.000 竄ｬ;Apartamento en La Barrosa;/comprar/apartamento-mogarizas_las_rapaces-40917258823_100500/;Mogarizas-Las Rapaces (Chiclana de la Frontera);2 habs.;1 baﾃｱo;48 mﾂｲ;Apartamento en chiclana situado en la barrosa, distribuido en 2 dormitorios, 1 baﾃｱo, salﾃｳn comedor con acceso a la terraza, cocina...;36.3841903;-6.1892797;1ﾂｪ planta;cadiz
119.900 竄ｬ;Casa unifamiliar en Rural;/comprar/casa_unifamiliar-rural11592-36749384631_100200/;Rural (Jerez de la Frontera);4 habs.;2 baﾃｱos;149 mﾂｲ;"ﾂ｡Casa con azotea en nueva jarilla!

En tecnocasa de la universidad tenemos disponible una magnﾃｭfica casa pareada con azotea en nue...";36.7589121;-6.0324118;;cadiz
169.900 竄ｬ;Piso en Barriada - Corte Inglﾃｩs;/comprar/piso-la_paz_segunda_aguado_loreto11012-45064814358_100500/;La Paz-Segunda Aguado-Loreto (Cﾃ｡diz Capital);3 habs.;1 baﾃｱo;60 mﾂｲ;Excelente oportunidad para adquirir un piso muy  luminoso ubicado en buena  zona cerca del corte ingles de cﾃ｡diz. Esta propiedad c...;36.519423;-6.2755636;4ﾂｪ planta;cadiz
79.900 竄ｬ;Piso en Santiago;/comprar/piso-la_linea_de_la_concepcion_santiago-44202289354_100200/;Santiago (La Lﾃｭnea de la Concepciﾃｳn);;1 baﾃｱo;67 mﾂｲ;Piso de 67 mﾂｲ para reformar con vistas al mar en pleno paseo de levante. Consta de 2 habitaciones con salida a una terraza. Cocina...;36.1626397;-5.3391232;3ﾂｪ planta;cadiz
299.990 竄ｬ;Piso en Centro;/comprar/piso-el_mentidero_teatro_falla_alameda11004-43335694542_100500/;El Mentidero-Teatro Falla-Alameda (Cﾃ｡diz Capital);2 habs.;2 baﾃｱos;128 mﾂｲ;Centro histﾃｳrico - en pleno corazﾃｳn de la ciudad, junto al paseo de la alameda, y a pocos minutos de las plazas mﾃ｡s tﾃｭpicas, museo...;36.5353482;-6.2951933;1ﾂｪ planta;cadiz
296.500 竄ｬ;Casa en Punta Candor;/comprar/casa-aguadulce_almadraba_punta_candor11520-43343488810_109300/;Aguadulce-Almadraba-Punta Candor (Rota);2 habs.;1 baﾃｱo;63 mﾂｲ;ﾂ｡Atenciﾃｳn buscadores de paraﾃｭsos terrenales! Este piso en rota es tu boleto directo a la felicidad playera. Una urbanizaciﾃｳn con p...;36.634228961;-6.389656599;;cadiz
105.000 竄ｬ;Casa pareada en Arroyo de la Miel;/comprar/casa_pareada-algeciras_arroyo_de_la_miel11206-44245634420_100200/;Arroyo de la Miel (Algeciras);3 habs.;2 baﾃｱos;94 mﾂｲ;"Dﾃｺplex a la venta en urbanizaciﾃｳn privada en la zona de moncayo.
La vivienda consta de dos plantas.
En la primera planta tenemos e...";36.1195031;-5.454726;;cadiz
165.000 竄ｬ;Casa adosada en Fuente Amarga;/comprar/casa_adosada-nucleo_urbano_urbanizaciones-41718198151_100500/;Nﾃｺcleo Urbano-Urbanizaciones (Chiclana de la Frontera);3 habs.;2 baﾃｱos;92 mﾂｲ;Desde prymorcasa inmobiliaria tenemos el placer de presentarles la salida al mercado de esta estupenda y luminosa casa unifamiliar...;36.410852222;-6.148979376;;cadiz
195.000 竄ｬ;Piso en Barbate;/comprar/piso-barbate_centro_urbano-39191013773_106700/;Barbate;4 habs.;1 baﾃｱo;131 mﾂｲ;"Piso situado en el centro del pueblo, donde encontraras todo tipo de comercio a su alrededor. 
Es una segunda planta con ascensor ...";36.190047016;-5.921414222;;cadiz
325.000 竄ｬ;Piso en Costa Ballena;/comprar/piso-costa_ballena-44184208924_100200/;Costa Ballena (Rota);3 habs.;2 baﾃｱos;93 mﾂｲ;En costa ballena,en el residencial de terrazas del golf, vivienda de 3 dormitorios dobles, 2 baﾃｱos ( uno con ducha y otro con baﾃｱe...;36.687738;-6.4112255;1ﾂｪ planta;cadiz
275.000 竄ｬ;ﾃ》ico en Vejer de La Frontera;/comprar/atico-vejer_de_la_frontera_centro_urbano-43403600159_521333/;Vejer de la Frontera;2 habs.;1 baﾃｱo;110 mﾂｲ;Atico  con terraza solarium. Piso con mucho encanto arabe en pleno centro del casco histﾃｳrico de vejer. 2 amplios dormitorios dobl...;36.2538288;-5.9674258;;cadiz
250.000 竄ｬ;Chalet en La Negra;/comprar/chalet-urbanizaciones_zona_norte-43372221216_104700/;Urbanizaciones Zona Norte (El Puerto de Santa Marﾃｭa);5 habs.;3 baﾃｱos;170 mﾂｲ;Puerto playa  pone a la venta  esta preciosa parcela de 1000mts segregada e hipotecable  y con dos viviendas una de 70mts inscrita...;36.607587;-6.2519009;;cadiz
88.000 竄ｬ;Casa rﾃｺstica en Benaocaz;/comprar/casa_rustica-benaocaz_centro_urbano-44234598916_100200/;Benaocaz;3 habs.;;90 mﾂｲ;ﾂ｡No dejes pasar esta oportunidad de adquirir una hermosa casa adosada en venta! Este inmueble cuenta en la planta baja con un ampl...;36.697502;-5.419316;;cadiz
295.000 竄ｬ;Piso en Centro;/comprar/piso-el_mentidero_teatro_falla_alameda11003-43361324430_100500/;El Mentidero-Teatro Falla-Alameda (Cﾃ｡diz Capital);2 habs.;1 baﾃｱo;78 mﾂｲ;Zona teatro falla - gran ocasiﾃｳn de piso situado en pleno centro de la ciudad, rodeado de actividades culturales, gastronﾃｳmicas y ...;36.5340495;-6.3011923;1ﾂｪ planta;cadiz
169.000 竄ｬ;Piso en La Caleta - La Viﾃｱa;/comprar/piso-el_mentidero_teatro_falla_alameda11003-42568949105_100500/;El Mentidero-Teatro Falla-Alameda (Cﾃ｡diz Capital);1 hab.;1 baﾃｱo;57 mﾂｲ;"ﾂ｡Nueva promociﾃｳn de viviendas de 1 y 2 dormitorios!

Os presentamos esta nueva promociﾃｳn de 12 viviendas rehabilitadas y personali...";36.5338191;-6.2997607;1ﾂｪ planta;cadiz
219.945 竄ｬ;Casa en Centro;/comprar/casa-centro_zona_noreste-35063088892_100500/;Centro-Zona Noreste (Chipiona);3 habs.;2 baﾃｱos;120 mﾂｲ;Situado en zona habitada todo el aﾃｱo, zona tranquila y con todos los servicos y comercios a su alrededor. A tan solo 6 min. De la ...;36.7323672;-6.4303963;;cadiz
