precio;sub_descr;href;ubicacion;habitaciones;banios;mt2;otros;publicado_hace;plataforma;CCAA
135.000€;Piso Venta, Bollullos de la Mitación;https://rd.clk.thribee.com/id.1BX1EB7M1y1n/origin.1/section.1/section_type.2/country.es/vertical.homes/iuid.8367trovit-web-7f7dc96976-89xn666870fb370432/tracking.%7B%22cmp%22%3A%22u%22%7D/what_d.piso%20sevilla%20provincia/type.1/page.61/cookieid.102115366870fb35f2345.12963734/pos.19/;41110, Bollullos de la Mitación, Provincia de Sevilla;2  habitaciones;1  baños;73  m²;Piso en venta, con trastero, terraza, mobiliario: a consultar, ubicado en Bollullos de la Mita, con una superficie de 73 metros, 2...;Hace 13 días;Pisos;Sevilla
77.000€;Piso Venta, La Puebla del Río;https://rd.clk.thribee.com/id.1C1hLXX1W1Zb/origin.1/section.1/section_type.2/country.es/vertical.homes/iuid.8367trovit-web-7f7dc96976-89xn666870fb370432/tracking.%7B%22cmp%22%3A%22u%22%7D/what_d.piso%20sevilla%20provincia/type.1/page.61/cookieid.102115366870fb35f2345.12963734/pos.20/;41130, La Puebla del Río, Provincia de Sevilla;2  habitaciones;1  baños;92  m²;Piso de 92metros construidos, en La puebla del Rio! Se trata de un cuarto sin ascensor completamente reformado con electricidad y saneamientos...;Hace +30 días;Pisos;Sevilla
198.000€;Piso Venta Dos Hermanas, Montequinto-El Colmenar;https://rd.clk.thribee.com/id.1b1Z1R1WH1zJ1c/origin.1/section.1/section_type.2/country.es/vertical.homes/iuid.8367trovit-web-7f7dc96976-89xn666870fb370432/tracking.%7B%22cmp%22%3A%22u%22%7D/what_d.piso%20sevilla%20provincia/type.1/page.61/cookieid.102115366870fb35f2345.12963734/pos.21/;41089, Montequinto, Dos Hermanas, Provincia de Sevilla;3  habitaciones;2  baños;96  m²;Venta de piso, cuarta planta, con jardín, equipado con aire acondicionado, 3 habitaciones, 2 baños, con garaje, tiene ascensor, con trastero...;Hace 20 días;Pisos;Sevilla
95.000€;Piso Venta Guillena;https://rd.clk.thribee.com/id.1e_1R1vVXq1G/origin.1/section.1/section_type.2/country.es/vertical.homes/iuid.8367trovit-web-7f7dc96976-89xn666870fb370432/tracking.%7B%22cmp%22%3A%22u%22%7D/what_d.piso%20sevilla%20provincia/type.1/page.61/cookieid.102115366870fb35f2345.12963734/pos.22/;41210, Guillena, Provincia de Sevilla;4  habitaciones;2  baños;128  m²;Venta de piso, planta baja, equipado con aire acondicionado, 4 habitaciones, 2 baños, dispone de 1 armario empotrado, terraza, mobiliario: a...;Hace +30 días;Pisos;Sevilla
280.750€;Piso Venta Mairena del Aljarafe, Nuevo Bulevar;https://rd.clk.thribee.com/id.1K1p128x1a1K1u/origin.1/section.1/section_type.2/country.es/vertical.homes/iuid.8367trovit-web-7f7dc96976-89xn666870fb370432/tracking.%7B%22cmp%22%3A%22u%22%7D/what_d.piso%20sevilla%20provincia/type.1/page.61/cookieid.102115366870fb35f2345.12963734/pos.23/;41927, Mairena del Aljarafe, Provincia de Sevilla;3  habitaciones;2  baños;110  m²;Piso obra nueva, tercera planta, con trastero, terraza, mobiliario: a consultar, ubicado en Mairena del Aljarafe, en calle nuevo bulevar esq...;Hace +30 días;Pisos;Sevilla
196.500€;Piso Venta La Rinconada, San José de La Rinconada;https://rd.clk.thribee.com/id.1M1Njuc1K3d/origin.1/section.1/section_type.2/country.es/vertical.homes/iuid.8367trovit-web-7f7dc96976-89xn666870fb370432/tracking.%7B%22cmp%22%3A%22u%22%7D/what_d.piso%20sevilla%20provincia/type.1/page.61/cookieid.102115366870fb35f2345.12963734/pos.24/;41300, San José de la Rinconada, La Rinconada, Provincia de Sevilla;-;-;-;Obra nueva, construcción de piso muy comodo, cuarta planta, situado en La Rinconada, en avenida anda jaleo estado: listo para entrar, equipado...;Hace +30 días;Pisos;Sevilla
125.000€;Piso Venta, Mairena del Alcor;https://rd.clk.thribee.com/id.1CyIiF12Ep/origin.1/section.1/section_type.2/country.es/vertical.homes/iuid.8367trovit-web-7f7dc96976-89xn666870fb370432/tracking.%7B%22cmp%22%3A%22u%22%7D/what_d.piso%20sevilla%20provincia/type.1/page.61/cookieid.102115366870fb35f2345.12963734/pos.25/;41510, Mairena del Alcor, Provincia de Sevilla;3  habitaciones;1  baños;115  m²;Venta de piso grande, situado en Mairena del Alcor, en calle c/armenta estado: a reformar, 3 habitaciones, 1 baño, dispone de 1 armario...;Hace +30 días;Pisos;Sevilla
