precio;sub_descr;href;ubicacion;habitaciones;banios;mt2;planta;otros;latitude;longitude;CCAA
115.000 竄ｬ;Casa adosada en Fuentenueva-Salesianos;/comprar/casa_adosada-fuentenueva_salesianos-45842421648_100500/;Fuentenueva-Salesianos (Algeciras);3 habs.;2 baﾃｱos;101 mﾂｲ;;"ﾂ｡Casa en venta en algeciras!

La vivienda se distribuye de la siguiente manera:

Planta baja:
-hall.
-cocina totalmente equipada.
...";36.131361346;-5.454854659;cadiz
135.000 竄ｬ;Piso en Centro;/comprar/piso-jerez_de_la_frontera_centro11401-44261982833_108900/;Centro (Jerez de la Frontera);3 habs.;2 baﾃｱos;103 mﾂｲ;;Precioso piso de 3 habitaciones en primera planta sin ascensor, con cocina amueblada, salﾃｳn comedor, 2 baﾃｱos, plaza de garaje y pe...;36.6781844;-6.1388515;cadiz
260.000 竄ｬ;Piso en Plaza de Madrid;/comprar/piso-san_jose_varela_la_laguna11010-44199159968_525281/;San Josﾃｩ-Varela-La Laguna (Cﾃ｡diz Capital);3 habs.;1 baﾃｱo;70 mﾂｲ;2ﾂｪ planta;Luxury pm inmobiliaria,  les presenta en exclusividad, magnifico piso en zona la laguna, la vivienda consta de salﾃｳn muy cﾃｳmodo, s...;36.5012172;-6.2738098;cadiz
152.990 竄ｬ;Casa en Urbanizaciﾃｳn Las Lomas de San Bernabﾃｩ;/comprar/casa-san_bernabe11204-45839821001_525987/;San Bernabﾃｩ (Algeciras);3 habs.;3 baﾃｱos;110 mﾂｲ;;"Vivienda san bernabﾃｩ 152.990 euros
Casa en buen estado en san bernabﾃｩ, de mas de 100 mﾂｲ, incluido garaje. La planta baja cuenta co...";36.1389368;-5.4650928;cadiz
210.000 竄ｬ;Casa adosada en Rinconcillo;/comprar/casa_adosada-rinconcillo-25014728808_100500/;Rinconcillo (Algeciras);3 habs.;2 baﾃｱos;160 mﾂｲ;;Superficie total 160 mﾂｲ, casa superficie ﾃｺtil 150 mﾂｲ, hab. Individuales: 2, habitaciones dobles: 1, 1 baﾃｱo, 1 aseo, aire acondicio...;36.160564852;-5.443934235;cadiz
140.000 竄ｬ;Piso en - La Granja - La Colina - los Pastores;/comprar/piso-san_bernabe11204-45014542830_100500/;San Bernabﾃｩ (Algeciras);2 habs.;1 baﾃｱo;92 mﾂｲ;7ﾂｪ planta;"ﾃ》ico totalmente amueblado en doﾃｱa casilda.

ﾃ》ico totalmente reformado, con vistas espectaculares. Ubicado en una magnﾃｭfica urban...";36.1419103;-5.4558891;cadiz
265.000 竄ｬ;Casa pareada en Getares;/comprar/casa_pareada-san_garcia_getares-44209038573_100500/;San Garcﾃｭa-Getares (Algeciras);3 habs.;2 baﾃｱos;120 mﾂｲ;;ﾂ｡Descubre tu nuevo hogar en la exclusiva zona de getares, algeciras! Este precioso chalet pareado te espera con 120 mﾂｲ construidos...;36.1004191;-5.4477487;cadiz
220.000 竄ｬ;Piso en Centro;/comprar/piso-el_puerto_de_santa_maria_centro-45879741669_514211/;Centro (El Puerto de Santa Marﾃｭa);3 habs.;2 baﾃｱos;111 mﾂｲ;1ﾂｪ planta;"ﾂ｡Descubre tu nuevo hogar en este espectacular piso de 111 mﾂｲ construidos y 85 mﾂｲ ﾃｺtiles! 

Ubicado en una tranquila y bien comunic...";36.6053904;-6.2230553;cadiz
105.000 竄ｬ;Casa pareada en Arroyo de la Miel;/comprar/casa_pareada-algeciras_arroyo_de_la_miel11206-44245634420_100200/;Arroyo de la Miel (Algeciras);3 habs.;2 baﾃｱos;94 mﾂｲ;;"Dﾃｺplex a la venta en urbanizaciﾃｳn privada en la zona de moncayo.
La vivienda consta de dos plantas.
En la primera planta tenemos e...";36.1195031;-5.454726;cadiz
495.000 竄ｬ;Chalet en calle del ﾃ〕amo, 4;/comprar/chalet-nucleo_urbano_urbanizaciones-43360090371_108700/;Nﾃｺcleo Urbano-Urbanizaciones (Chiclana de la Frontera);10 habs.;2 baﾃｱos;374 mﾂｲ;;"ﾂ｡Exclusiva propiedad en chiclana de la frontera!

Iad espaﾃｱa - marieta ludovica chesches se complace en ofrecer esta magnﾃｭfica pro...";36.4194;-6.14843;cadiz
235.000 竄ｬ;Chalet adosado en calle Campanilleros;/comprar/chalet_adosado-camposoto_gallineras11100-45005202475_527956/;Camposoto-Gallineras (San Fernando);3 habs.;3 baﾃｱos;131 mﾂｲ;;Casa adosada en venta en san fernando, cuenta con una superficie de 131 mﾂｲ construidos (segﾃｺn catastro, faltan los metros de sﾃｳtan...;36.4444547;-6.2106649;cadiz
411.000 竄ｬ;Piso en Centro;/comprar/piso-cadiz_capital_centro_historico11004-35048999143_100500/;Centro Histﾃｳrico (Cﾃ｡diz Capital);8 habs.;2 baﾃｱos;200 mﾂｲ;1ﾂｪ planta;Magnifica vivienda en el corazﾃｳn de cﾃ｡diz, en una finca clﾃ｡sica del centro histﾃｳrico con mucho encanto. Comprende toda la primera ...;36.5338653;-6.296291;cadiz
188.000 竄ｬ;Piso en Playa de Regla;/comprar/piso-centro_zona_playas-42567484421_100500/;Centro-Zona Playas (Chipiona);2 habs.;1 baﾃｱo;60 mﾂｲ;1ﾂｪ planta;"Situado en playa de regla, a solo 50 metros de la playa y con vista al mar.

Consta de dos dormitorios con armarios empotrados, sa...";36.7359865;-6.4402193;cadiz
195.000 竄ｬ;Piso en Barbate;/comprar/piso-barbate_centro_urbano-45045945445_100200/;Barbate;3 habs.;2 baﾃｱos;198 mﾂｲ;;ﾂ｡Descubre tu nuevo hogar en el corazﾃｳn de la ciudad! Este encantador piso de primera planta, construido en 1985 y en excelente est...;36.189998424;-5.922930794;cadiz
296.500 竄ｬ;Casa en Punta Candor;/comprar/casa-aguadulce_almadraba_punta_candor11520-43343488810_109300/;Aguadulce-Almadraba-Punta Candor (Rota);2 habs.;1 baﾃｱo;63 mﾂｲ;;ﾂ｡Atenciﾃｳn buscadores de paraﾃｭsos terrenales! Este piso en rota es tu boleto directo a la felicidad playera. Una urbanizaciﾃｳn con p...;36.634228961;-6.389656599;cadiz
381.000 竄ｬ;Piso en Playa Costilla - Avda Sevilla;/comprar/piso-zona_playa_virgen_del_mar-43335051805_109300/;Zona Playa Virgen del Mar (Rota);1 hab.;1 baﾃｱo;98 mﾂｲ;7ﾂｪ planta;ﾂ｡Atenciﾃｳn amantes del mar y la comodidad! ﾂｿEstﾃ｡s buscando el paraﾃｭso en la tierra? ﾂ｡Lo has encontrado! Presentamos este magnﾃｭfico ...;36.6205693;-6.3637756;cadiz
290.000 竄ｬ;Piso en calle Tolosa Latour;/comprar/piso-playa_de_santa_maria_del_mar_bahia_blanca11007-45850004352_516894/;Playa de Santa Marﾃｭa del Mar-Bahﾃｭa Blanca (Cﾃ｡diz Capital);3 habs.;2 baﾃｱos;108 mﾂｲ;2ﾂｪ planta;"Cadizsur servicios inmobiliarios, les presenta este encantador piso junto a la iglesia san severiano y bahﾃｭa blanca; a pocos minut...";36.5222258;-6.2830021;cadiz
125.000 竄ｬ;Piso en Barbate;/comprar/piso-barbate_centro_urbano-23377406446_106700/;Barbate;3 habs.;1 baﾃｱo;76 mﾂｲ;;La vivienda consta de 76 mﾂｲ ﾃｺtiles, distribuidos en 3 habitaciones, 1 baﾃｱo, cocina y salﾃｳn. Se encuentra situado cerca de supermer...;36.1876541;-5.9248009;cadiz
277.208 竄ｬ;Piso en calle Sopranis, 4;/comprar/piso-el_populo_santa_maria11005-4627073126_109700/;El Pﾃｳpulo-Santa Marﾃｭa (Cﾃ｡diz Capital);2 habs.;1 baﾃｱo;72 mﾂｲ;3ﾂｪ planta;3ﾂｺ B. Piso en una finca de obra nueva de 72 m2 de superficie construida y emplazado en la zona de Cﾃ｡diz Capital, posicionado en planta 3. Estﾃ｡ dispuesto en 2 habitaciones y 1 baﾃｱo completo. Cuenta como extras ascensor.;36,5294347;-6,2922188;cadiz
265.000 竄ｬ;Chalet en Rural;/comprar/chalet-rural11406-45843773379_101800/;Rural (Jerez de la Frontera);3 habs.;2 baﾃｱos;244 mﾂｲ;;"Se vende; maravilloso chalet independiente con parcela de 415 metros rodeado de bienestar y tranquilidad, la vivienda  de 244 metr...";36.654621985;-6.081353671;cadiz
254.000 竄ｬ;Apartamento en Zona Playa Virgen del Mar;/comprar/apartamento-zona_playa_virgen_del_mar-45879795405_108900/;Zona Playa Virgen del Mar (Rota);2 habs.;1 baﾃｱo;105 mﾂｲ;1ﾂｪ planta;Imagina despertarte cada maﾃｱana en este acogedor hogar. En esta zona, conocida por su encanto y tranquilidad, es el escenario per...;36.6236325;-6.3607353;cadiz
210.000 竄ｬ;Piso en Centro-Zona Playas;/comprar/piso-centro_zona_playas-45082004113_100200/;Centro-Zona Playas (Chipiona);3 habs.;2 baﾃｱos;84 mﾂｲ;;"Zona de regla.
Espectacular piso en 1ﾂｺ planta con ascensor, en regla a 200 metros de la playa, que consta de:
- 3 dormitorios.
- 2...";36.7365171;-6.4386967;cadiz
64.000 竄ｬ;Piso en Arcos de la Frontera;/comprar/piso-arcos_de_la_frontera_centro_urbano-45847865227_100200/;Arcos de la Frontera;3 habs.;1 baﾃｱo;99 mﾂｲ;2ﾂｪ planta;Canteras: piso exterior en segunda planta sin ascensor, consta de 2 dormitorios amplios y luminosos, salﾃｳn con balcﾃｳn a la calle y...;36.753666175;-5.813305382;cadiz
300.000 竄ｬ;Chalet rﾃｺstico en La Jara;/comprar/chalet_rustico-la_jara_distrito-43349602329_521550/;La Jara (Sanlﾃｺcar de Barrameda);5 habs.;2 baﾃｱos;214 mﾂｲ;;Este encantador chalet rﾃｺstico de 214 mﾂｲ en venta en sanlﾃｺcar de barrameda, ubicado en la zona de la jara, zona muy tranquila en u...;36.762472072;-6.377337831;cadiz
190.000 竄ｬ;Piso en calle Barrie;/comprar/piso-cadiz_capital_centro_historico11001-45031364855_511045/;Centro Histﾃｳrico (Cﾃ｡diz Capital);2 habs.;1 baﾃｱo;90 mﾂｲ;1ﾂｪ planta;Este piso en venta se encuentra en el municipio de cﾃ｡diz capital junto al mercado de abastos, una zona con encanto y cerca de todo...;36.531593;-6.2973618;cadiz
85.000 竄ｬ;Casa adosada en Los Barrios;/comprar/casa_adosada-los_barrios_centro_urbano-45878869461_100500/;Los Barrios;1 hab.;1 baﾃｱo;70 mﾂｲ;;"ﾂ｡Casa adosada en el centro!

La vivienda se distribuye de la siguiente forma:

Planta baja:

-salﾃｳn luminoso.
-cocina independient...";36.1866131;-5.4894996;cadiz
86.000 竄ｬ;Piso en El Puerto Santa Maria;/comprar/piso-victoria_el_juncal-40917383169_500434/;Victoria-El Juncal (El Puerto de Santa Marﾃｭa);3 habs.;1 baﾃｱo;72 mﾂｲ;3ﾂｪ planta;Excelente piso de tres dormitorios, salon-comedor con terraza acristalada, cocina amueblada con despensa, lavadero y un baﾃｱo. Arma...;36.6077226;-6.2208033;cadiz
300.000 竄ｬ;Casa en Playa Tres Piedras;/comprar/casa-playa_de_las_tres_piedras_costa_ballena-40015671061_100500/;Playa de las Tres Piedras-Costa Ballena (Chipiona);4 habs.;3 baﾃｱos;200 mﾂｲ;;Od1073. Para los amantes de la buena vida tenemos esta vivienda de una planta en la zona de las tres piedras. La casa dispone de c...;36.707839633;-6.424095142;cadiz
75.000 竄ｬ;Casa adosada en San Garcﾃｭa-Getares;/comprar/casa_adosada-san_garcia_getares-44178724864_100200/;San Garcﾃｭa-Getares (Algeciras);3 habs.;1 baﾃｱo;121 mﾂｲ;;ﾂ｡Novedad! Casa adosada lista para entrar a vivir. La vivienda de 3 plantas consta de salﾃｳn amplio, cocina, cuarto de baﾃｱo completo...;36.1115443;-5.4469636;cadiz
125.000 竄ｬ;Piso en Soto del Real-Villamaruja-Cobreros Viejo;/comprar/piso-soto_del_real_villamaruja_cobreros_viejo-45879076789_100200/;Soto del Real-Villamaruja-Cobreros Viejo (San Fernando);3 habs.;1 baﾃｱo;85 mﾂｲ;1ﾂｪ planta;Zona carmen. Piso amplio ubicado en una quinta planta con ascensor y consta de 94 mﾂｲ construidos y se distribuye en tres habitacio...;36.455653087;-6.203216239;cadiz
385.000 竄ｬ;Piso en Corte Inglﾃｩs;/comprar/piso-la_paz_segunda_aguado_loreto11012-43414919702_100500/;La Paz-Segunda Aguado-Loreto (Cﾃ｡diz Capital);3 habs.;2 baﾃｱos;122 mﾂｲ;2ﾂｪ planta;Gran piso en edificio moderno, con ascensor y garaje (incluido en el precio), busca una familia que desee crear una ambiente desah...;36.5236452;-6.2774223;cadiz
1.950.000 竄ｬ;Casa en calle de Calzadilla de Tﾃｩllez, 9001;/comprar/casa-tarifa_centro_urbano-45021391049_100500/;Tarifa;9 habs.;4 baﾃｱos;510 mﾂｲ;;"Casa en el centro histﾃｳrico de tarifa sobre la muralla medieval.

Una propiedad ﾃｺnica, una casa grande haciendo esquina sobre una ...";36.0141;-5.6015;cadiz
154.900 竄ｬ;Piso en Avenida de Oceanﾃｭa;/comprar/piso-san_bernabe11204-45879332210_528489/;San Bernabﾃｩ (Algeciras);3 habs.;1 baﾃｱo;131 mﾂｲ;4ﾂｪ planta;Se vende un amplio piso en el municipio de algeciras. Este inmueble se encuentra en una 4ﾂｪ planta y cuenta con una superficie tota...;36.143215;-5.4699672;cadiz
185.000 竄ｬ;Piso en Centro;/comprar/piso-el_puerto_de_santa_maria_centro-40030623091_106000/;Centro (El Puerto de Santa Marﾃｭa);3 habs.;2 baﾃｱos;115 mﾂｲ;4ﾂｪ planta;"Ref: pp355 -
Piso ﾃ｡tico, muy bonito y en muy buen estado, en venta en pleno centro de el puerto cerca de la plaza del ayuntamiento...";36.5991959;-6.2243149;cadiz
145.000 竄ｬ;Casa en Carretera de Medina;/comprar/casa-la_banda_campo_de_futbol-42587230770_100500/;La Banda-Campo de Fﾃｺtbol (Chiclana de la Frontera);3 habs.;2 baﾃｱos;166 mﾂｲ;;Se vende hermosa casa con un inmenso salﾃｳn con chimenea, perfecto para reuniones y celebraciones familiares. La casa cuenta con 3 ...;36.4144608;-6.1327178;cadiz
290.000 竄ｬ;Piso en calle Columela;/comprar/piso-cadiz_capital_centro_historico11004-45913546029_524139/;Centro Histﾃｳrico (Cﾃ｡diz Capital);2 habs.;2 baﾃｱos;102 mﾂｲ;3ﾂｪ planta;Esta exclusiva vivienda, ubicada en un emblemﾃ｡tico edificio de finales del siglo xix, combina a la perfecciﾃｳn la elegancia histﾃｳri...;36.532589839;-6.295777514;cadiz
640.000 竄ｬ;Apartamento en calle Mesilla del Diente,  S/N;/comprar/apartamento-san_roque_nucleo11360-3503076386_109700/;Nﾃｺcleo (San Roque);3 habs.;2 baﾃｱos;123 mﾂｲ;2ﾂｪ planta;B7 - 02 - 7. Apartamento en una finca de obra nueva de 123 mﾂｲ de superficie construida y emplazado en la zona de sotogrande, posic...;36.2387;-5.3828;cadiz
480.000 竄ｬ;Chalet en Campo de Gibraltar;/comprar/chalet-tarifa_centro_urbano-43414178144_108700/;Tarifa;3 habs.;1 baﾃｱo;90 mﾂｲ;;"Encantadora casa en facinas
Convenientemente ubicada a tan solo 10 minutos de la maravillosa playa de bolonia y a 15 minutos de ta...";36.144334507;-5.700861803;cadiz
199.000 竄ｬ;Piso en Norte;/comprar/piso-rota_zona_norte11520-43425735222_103800/;Zona Norte (Rota);3 habs.;1 baﾃｱo;130 mﾂｲ;2ﾂｪ planta;Espectacular y amplio piso situado en una de las principales avenidas de rota, consta de amplio vestﾃｭbulo, 3 dormitorios, salﾃｳn co...;36.6251748;-6.3604619;cadiz
2.500.000 竄ｬ;Chalet en calle de Falua;/comprar/chalet-el_puerto_de_santa_maria_vistahermosa-28420351120_103800/;Vistahermosa (El Puerto de Santa Marﾃｭa);6 habs.;6 baﾃｱos;393 mﾂｲ;;"Estupendo chalet a 60 metros de la playa, con unas vistas inmejorables sobre la bahﾃｭa de cﾃ｡diz.

Casa de 5 dormitorios mﾃ｡s uno de ...";36.5835985;-6.2673418;cadiz
273.000 竄ｬ;Piso en La Caleta-La Viﾃｱa;/comprar/piso-la_caleta_la_vina11002-42597659963_100500/;La Caleta-La Viﾃｱa (Cﾃ｡diz Capital);2 habs.;1 baﾃｱo;84 mﾂｲ;1ﾂｪ planta;"Tiritritrﾃ｡n tran tran

Dulce hogar te ofrece la mejor atenciﾃｳn para la compra de un piso estupendo en pleno centro de cﾃ｡diz, en la...";36.5301181;-6.2999763;cadiz
204.000 竄ｬ;ﾃ》ico en Avenida de los Prﾃｭncipes de Espaﾃｱa;/comprar/atico-zona_playa_virgen_del_mar-43342418158_100500/;Zona Playa Virgen del Mar (Rota);4 habs.;3 baﾃｱos;103 mﾂｲ;;"ﾂ｡Bienvenido al cielo! 

ﾂｿHas soﾃｱado alguna vez con vivir en una casa que te haga sentir como si estuvieras en el cielo? ﾂ｡Pues estﾃ｡...";36.6242639;-6.3658853;cadiz
390.000 竄ｬ;Apartamento en Puerto de Sotogrande-La Marina;/comprar/apartamento-puerto_de_sotogrande_la_marina-40898006138_526603/;Puerto de Sotogrande-La Marina (Sotogrande);2 habs.;2 baﾃｱos;144 mﾂｲ;Bajo;Bonito apartamento con orientaciﾃｳn  sur ubicado en complejo con piscina, bonitas vistas al canal navegable amplio jardﾃｭn privado d...;36.293949823;-5.277491667;cadiz
629.000 竄ｬ;Chalet en Valdelagrana;/comprar/chalet-el_puerto_de_santa_maria_valdelagrana-43362882478_103800/;Valdelagrana (El Puerto de Santa Marﾃｭa);6 habs.;6 baﾃｱos;310 mﾂｲ;;"Chalet con piscina en zona de valdelagrana. A unos minutos de la playa y de todo tipo de servicios. 
Chalet independiente de una p...";36.5813086;-6.2179099;cadiz
188.900 竄ｬ;Piso en calle de Madrid;/comprar/piso-rota_zona_norte11520-45043139566_100500/;Zona Norte (Rota);5 habs.;1 baﾃｱo;144 mﾂｲ;Bajo;Ademﾃ｡s puedes ganar un coche!!! Prepﾃ｡rate para pasar veranos de recuerdo en este gran piso bajo que te traemos hoy!!  Y porque? Pu...;36.6252006;-6.3618527;cadiz
475.000 竄ｬ;Casa adosada en Carretera Nueva de La Barrosa,  S/N;/comprar/casa_adosada-costa_de_sancti_petri_playa_de_la_barrosa-3737297600_109700/;Costa de Sancti Petri-Playa de La Barrosa (Chiclana de la Frontera);3 habs.;3 baﾃｱos;155 mﾂｲ;;Casa adosada de obra nueva, de 155 mﾂｲ de superficie construida, y situada en la zona de chiclana de la frontera.  Estﾃ｡ estructurad...;36.3878235;-6.1704722;cadiz
133.500 竄ｬ;Casa adosada en Carretera de Medina;/comprar/casa_adosada-la_banda_campo_de_futbol-25024524344_100500/;La Banda-Campo de Fﾃｺtbol (Chiclana de la Frontera);3 habs.;2 baﾃｱos;81 mﾂｲ;;Casa adosada con patio de entrada comunitario, lista para poder disfrutarla. Ademﾃ｡s, la casa cuenta con una cocina totalmente amue...;36.4147828;-6.1333877;cadiz
338.000 竄ｬ;Piso en Avenida del Golf,  s/n;/comprar/piso-san_roque_la_alcaidesa-4331863737_109700/;La Alcaidesa (San Roque);3 habs.;2 baﾃｱos;146 mﾂｲ;;Piso en una finca de obra nueva de 146 mﾂｲ de superficie construida y emplazado en la zona de san roque. Estﾃ｡ dispuesto en 3 habita...;36.246936213;-5.326727537;cadiz
220.000 竄ｬ;Piso en Costilla - Virgen del Mar;/comprar/piso-zona_playa_virgen_del_mar-44230405912_103800/;Zona Playa Virgen del Mar (Rota);3 habs.;;85 mﾂｲ;3ﾂｪ planta;ﾂ｡Descubre tu nuevo hogar a dos pasos de la playa de virgen del mar! Este magnﾃｭfico y amplio piso de 85 mﾂｲ te ofrece todo lo que ne...;36.6226283;-6.3683016;cadiz
475.000 竄ｬ;Casa adosada en Carretera Nueva de La Barrosa,  S/N;/comprar/casa_adosada-costa_de_sancti_petri_playa_de_la_barrosa-3737297600_109700/;Costa de Sancti Petri-Playa de La Barrosa (Chiclana de la Frontera);3 habs.;3 baﾃｱos;155 mﾂｲ;;Casa adosada de obra nueva, de 155 m2 de superficie construida, y situada en la zona de Chiclana de la Frontera.  Estﾃ｡ estructurada en 3 habitaciones, 3 baﾃｱos ( 2 completos, 1 auxiliar) y terraza. Proporciona como acabados carpinterﾃｭa exterior en pvc. La Casa adosada tiene portero automﾃ｡tico. Aporta como extras garaje.;36,3878235;-6,1704722;cadiz
1.185.000 竄ｬ;Chalet en Cﾃ｡diz;/comprar/chalet-sotogrande_costa11310-45867832025_108700/;Sotogrande Costa (Sotogrande);5 habs.;4 baﾃｱos;291 mﾂｲ;;"*gastos de agencia incluidos en el precio, a cargo del vendedor*. 

Exclusividad iad espaﾃｱa en la prestigiosa urbanizaciﾃｳn de soto...";36.2836417;-5.3068718;cadiz
98.000 竄ｬ;Piso en Avenida del Universo;/comprar/piso-centro_zona_noreste-44244506640_100500/;Centro-Zona Noreste (Chipiona);2 habs.;;48 mﾂｲ;1ﾂｪ planta;"Referencia: 959

Piso ubicado junto al polideportivo, a 1200 metros de la playa de regla
Consta de salﾃｳn - comedor con aire acondi...";36.7314714;-6.4278462;cadiz
285.000 竄ｬ;ﾃ》ico en Avenida del Golf, 10;/comprar/atico-san_roque_nucleo11360-45002331777_528336/;Nﾃｺcleo (San Roque);2 habs.;2 baﾃｱos;150 mﾂｲ;;Este magnﾃｭfico ﾃ｡tico en venta se encuentra en urbanizaciﾃｳn del golf. Con una superficie total de 150 mﾂｲ y 2 habitaciones dobles, e...;36.24670771789625;-5.325257920024729;cadiz
145.000 竄ｬ;Piso en Avenida de Tomﾃ｡s Garcﾃｭa Figueras;/comprar/piso-jerez_de_la_frontera_oeste11407-44214171403_103800/;Oeste (Jerez de la Frontera);3 habs.;1 baﾃｱo;83 mﾂｲ;2ﾂｪ planta;"Piso de 3 dormitorios con garaje incluido en zona norte

El inmueble dispone de hall de entrada, cocina equipada (salvo lavavajill...";36.700819379;-6.141446903;cadiz
119.900 竄ｬ;Chalet en La Soledad;/comprar/chalet-la_soledad_la_coquina_los_gallos-39223515012_100500/;La Soledad-La Coquina-Los Gallos (Chiclana de la Frontera);3 habs.;1 baﾃｱo;110 mﾂｲ;;"Chalet en la zona de vipren con parcela segregada en suelo rustico

Chalet con parcela segregada en suelo rustico de 980mﾂｲ y una s...";36.4223691;-6.177438;cadiz
180.000 竄ｬ;ﾃ》ico en El Pﾃｳpulo-Santa Marﾃｭa;/comprar/atico-el_populo_santa_maria11005-44253102773_106700/;El Pﾃｳpulo-Santa Marﾃｭa (Cﾃ｡diz Capital);1 hab.;1 baﾃｱo;42 mﾂｲ;;"ﾂ｡Descubre este encantador ﾃ｡tico de un dormitorio en pleno corazﾃｳn de cﾃ｡diz!
Situado a solo unos pasos del campo del sur y el ayunt...";36.5290863;-6.2922037;cadiz
159.900 竄ｬ;Piso en Centro;/comprar/piso-jerez_de_la_frontera_centro11402-43337862087_100500/;Centro (Jerez de la Frontera);3 habs.;2 baﾃｱos;94 mﾂｲ;2ﾂｪ planta;"Fantﾃ｡stica vivienda con ascensor de 3 dormitorios 
Estupendo piso situado en la zona centro, una zona muy solicitada por la multit...";36.686041;-6.1351661;cadiz
324.000 竄ｬ;Piso en La Alcaidesa;/comprar/piso-san_roque_la_alcaidesa-43402767671_108500/;La Alcaidesa (San Roque);2 habs.;2 baﾃｱos;130 mﾂｲ;;Exclusiva propiedad en al alcaidesa. Destacar que se trata de una vivienda situada en un entorno privilegiado con vistas panorﾃ｡mic...;36.246936213;-5.326727537;cadiz
1.399.000 竄ｬ;ﾃ》ico en calle A-2100;/comprar/atico-sotogrande_alto11310-30054597313_101800/;Sotogrande Alto (Sotogrande);2 habs.;3 baﾃｱos;238 mﾂｲ;;"ﾃ》ico obra nueva en sotogrande (cﾃ｡diz), 33 unidades, varios tamaﾃｱos y alturas.

""walking distance"" del sotogrande international sc...";36.289251209;-5.34532172;cadiz
248.000 竄ｬ;Casa adosada en Delicias;/comprar/casa_adosada-este11406-31721221764_100500/;Este (Jerez de la Frontera);3 habs.;3 baﾃｱos;117 mﾂｲ;;"Adosado muy luminoso de 3 dormitorios en zona este
Fantﾃ｡stico y amplio adosado en las delicias de 3 dormitorios, amplio salﾃｳn muy ...";36.6828989;-6.1124799;cadiz
A consultar;Piso en calle de Maracaibo, 3;/comprar/piso-urbanizaciones_zona_norte-42552192896_109700/;Urbanizaciones Zona Norte (El Puerto de Santa Marﾃｭa);3 habs.;1 baﾃｱo;77 mﾂｲ;;Gastos de notarﾃｭa gratis de hasta 500 竄ｬ para escrituras de compraventa desde el 15/07/2024 hasta el 30/09/2024. Oportunidad de inv...;36.6114;-6.2319;cadiz
128.900 竄ｬ;Dﾃｺplex en Centro;/comprar/duplex-jerez_de_la_frontera_centro11404-40096200703_100500/;Centro (Jerez de la Frontera);2 habs.;2 baﾃｱos;74 mﾂｲ;Bajo;Maravilloso dﾃｺplex  situado en el corazﾃｳn de jerez, rodeado de la zona monumental y cultural de la ciudad. La vivienda se accede p...;36.686872;-6.1457581;cadiz
125.000 竄ｬ;Piso en Centro;/comprar/piso-cadiz_capital_centro_historico11005-45923415675_100500/;Centro Histﾃｳrico (Cﾃ｡diz Capital);2 habs.;1 baﾃｱo;64 mﾂｲ;Bajo;Vivienda situada en planta baja en edificio rehabilitado con pocos vecinos, consta de dos dependencias, una de ellas esta constitu...;36.5314213;-6.294691;cadiz
315.000 竄ｬ;Casa en Este;/comprar/casa-este11406-43416227214_100500/;Este (Jerez de la Frontera);3 habs.;3 baﾃｱos;171 mﾂｲ;;Estupenda casa sobre una parcela urbana de 510 totalmente reformada con patio delantero y amplio jardﾃｭn trasero de mﾃ｡s de 120 metr...;36.6786451;-6.0980126;cadiz
970.000 竄ｬ;Piso en calle A-2100;/comprar/piso-sotogrande_alto11310-30057374394_101800/;Sotogrande Alto (Sotogrande);2 habs.;2 baﾃｱos;216 mﾂｲ;1ﾂｪ planta;"Obra nueva en sotogrande (cﾃ｡diz), 33 unidades, varios tamaﾃｱos y alturas.

""walking distance"" del sotogrande international school, ...";36.2758574;-5.3332484;cadiz
139.900 竄ｬ;Dﾃｺplex en calle Archivero Juan Cﾃ｡rdenas, 1;/comprar/duplex-victoria_el_juncal-45022771598_100500/;Victoria-El Juncal (El Puerto de Santa Marﾃｭa);3 habs.;2 baﾃｱos;83 mﾂｲ;Bajo;Dﾃｺplex de 83 mts en la zona de el pinillo! En la primera planta se encuentra la cocina con lavadero, salﾃｳn independiente con aire ...;36.6102;-6.21816;cadiz
430.000 竄ｬ;Dﾃｺplex en Vistahermosa;/comprar/duplex-el_puerto_de_santa_maria_vistahermosa-42581586724_526077/;Vistahermosa (El Puerto de Santa Marﾃｭa);3 habs.;3 baﾃｱos;130 mﾂｲ;2ﾂｪ planta;"Marina sherry s.l. Vende este fantﾃ｡stico dﾃｺplex de 3 dormitorios en puerto sherry. A 2 minutos andando a la playa de la muralla.

...";36.5806638;-6.2606864;cadiz
219.000 竄ｬ;Piso en Norte;/comprar/piso-jerez_de_la_frontera_norte11407-44171994522_109300/;Norte (Jerez de la Frontera);3 habs.;2 baﾃｱos;109 mﾂｲ;1ﾂｪ planta;Luminoso piso situado en la zona norte de la ciudad. Ideal para personas jﾃｳvenes que buscan un ambiente dinﾃ｡mico y vibrante. El ed...;36.7060585;-6.1136391;cadiz
A consultar;Finca rﾃｺstica en Parque del Estrecho;/comprar/finca_rustica-el_pelayo_parques_naturales11390-44208391186_100500/;El Pelayo-Parques Naturales (Algeciras);6 habs.;7 baﾃｱos;496 mﾂｲ;;La ubicaciﾃｳn de este cortijo es absolutamente excepcional. Se encuentra en el parque natural del estrecho, donde la naturaleza y l...;36.0839855;-5.4981016;cadiz
257.500 竄ｬ;Piso en calle de Santa Ana, 5;/comprar/piso-nucleo_urbano_urbanizaciones-3824425405_109700/;Nﾃｺcleo Urbano-Urbanizaciones (Chiclana de la Frontera);3 habs.;2 baﾃｱos;130 mﾂｲ;Bajo;Tipo 1 (b.1). Piso en un inmueble de obra nueva de 130 mﾂｲ de superficie construida y situado en la zona de chiclana de la frontera...;36.4166266;-6.1488695;cadiz
165.000 竄ｬ;Casa adosada en calle del Nogal;/comprar/casa_adosada-centro_zona_noreste-43340341348_100500/;Centro-Zona Noreste (Chipiona);2 habs.;2 baﾃｱos;68 mﾂｲ;;Preciosa casa totalmente reformada con primeras calidades, en la zona mﾃ｡s comercial de chipiona, junto a la avda. De madrid y a 10...;36.732764604;-6.43165345;cadiz
