precio;sub_descr;href;ubicacion;habitaciones;banios;mt2;planta;otros;latitude;longitude;CCAA
202.400 竄ｬ;;/comprar/casa_pareada-este11406-44241373316_101800/;Este (Jerez de la Frontera);4 habs.;3 baﾃｱos;150 mﾂｲ;;Vivienda pareada de renta libre  con grandes calidades en zona este. El exterior de la vivienda consta de patio delantero con capa...;36.6863742;-6.111147;cadiz
319.000 竄ｬ;;/comprar/piso-playa_de_la_victoria11009-42575095990_100500/;Playa de la Victoria (Cﾃ｡diz Capital);4 habs.;2 baﾃｱos;129 mﾂｲ;3ﾂｪ planta;En plena avenida principal nos encontramos esta estupenda vivienda. Una ubicaciﾃｳn idﾃｭlica ya que a tan sﾃｳlo unos escasos metros no...;36.5101836;-6.2789972;cadiz
680.000 竄ｬ;Casa en calle de la Sirena, 1;/comprar/casa-zahara_de_los_atunes-43364229118_515011/;Zahara de los Atunes (Barbate);5 habs.;5 baﾃｱos;220 mﾂｲ;;"Excelente casa en pleno centro de zahara de los atunes.

Esta casa se encuentra totalmente reformada, ya que se trata de un inmueb...";36.13651;-5.8458858;cadiz
179.990 竄ｬ;;/comprar/piso-el_mentidero_teatro_falla_alameda11003-35925205576_100500/;El Mentidero-Teatro Falla-Alameda (Cﾃ｡diz Capital);2 habs.;1 baﾃｱo;75 mﾂｲ;Bajo;En uno de los mejores barrios de cﾃ｡diz con mﾃ｡s historia (el mentidero) rodeado de diversidad gastronﾃｳmica, cultural, histﾃｳrica. Po...;36.5364262;-6.3001297;cadiz
475.000 竄ｬ;Casa adosada en Carretera Nueva de La Barrosa,  S/N;/comprar/casa_adosada-costa_de_sancti_petri_playa_de_la_barrosa-3737297600_109700/;Costa de Sancti Petri-Playa de La Barrosa (Chiclana de la Frontera);3 habs.;3 baﾃｱos;155 mﾂｲ;;Casa adosada de obra nueva, de 155 m2 de superficie construida, y situada en la zona de Chiclana de la Frontera.  Estﾃ｡ estructurada en 3 habitaciones, 3 baﾃｱos ( 2 completos, 1 auxiliar) y terraza. Proporciona como acabados carpinterﾃｭa exterior en pvc. La Casa adosada tiene portero automﾃ｡tico. Aporta como extras garaje.;36,3878235;-6,1704722;cadiz
89.990 竄ｬ;;/comprar/piso-nucleo_urbano_urbanizaciones-45911801770_100500/;Nﾃｺcleo Urbano-Urbanizaciones (Chiclana de la Frontera);3 habs.;1 baﾃｱo;87 mﾂｲ;3ﾂｪ planta;El piso se encuentra en una zona transitada y con todos los servicios necesarios a su alrededor. La luz natural que entra en las e...;36.4150532;-6.1441054;cadiz
210.000 竄ｬ;;/comprar/piso-centro_zona_playas-45082004113_100200/;Centro-Zona Playas (Chipiona);3 habs.;2 baﾃｱos;84 mﾂｲ;;"Zona de regla.
Espectacular piso en 1ﾂｺ planta con ascensor, en regla a 200 metros de la playa, que consta de:
- 3 dormitorios.
- 2...";36.7365171;-6.4386967;cadiz
300.000 竄ｬ;;/comprar/casa-playa_de_las_tres_piedras_costa_ballena-40015671061_100500/;Playa de las Tres Piedras-Costa Ballena (Chipiona);4 habs.;3 baﾃｱos;200 mﾂｲ;;Od1073. Para los amantes de la buena vida tenemos esta vivienda de una planta en la zona de las tres piedras. La casa dispone de c...;36.707839633;-6.424095142;cadiz
324.000 竄ｬ;;/comprar/piso-san_jose_varela_la_laguna11009-28338477326_100500/;San Josﾃｩ-Varela-La Laguna (Cﾃ｡diz Capital);4 habs.;2 baﾃｱos;115 mﾂｲ;4ﾂｪ planta;"Piso con garaje busca familia xl que ocupe todos los rincones de este maravilloso hogar.

Posibilidades:
-conviﾃｩrtete en. Esta cas...";36.5083096;-6.2757546;cadiz
139.000 竄ｬ;;/comprar/piso-centro_san_felipe_huerta_fava-31676984834_106000/;Centro-San Felipe-Huerta Fava (La Lﾃｭnea de la Concepciﾃｳn);4 habs.;2 baﾃｱos;Mﾃ｡s de 20;;Piso en la linea, zona frontera, la vivienda es muy amplia, a cinco minutos del centro a pie. Bonitas vistas.;36.1621035;-5.3547888;cadiz
184.985 竄ｬ;Piso en calle Calzada de La Infanta,  22;/comprar/piso-centro_calzada-4582752580_109700/;Centro-Calzada (Sanlﾃｺcar de Barrameda);2 habs.;1 baﾃｱo;80 mﾂｲ;Bajo;Vivienda 2. Piso en un inmueble de obra nueva de 80 mﾂｲ de superficie construida y situado en la zona de sanlﾃｺcar de barrameda, aco...;36.7794;-6.35905;cadiz
99.990 竄ｬ;;/comprar/piso-san_bernabe-39231377360_101800/;San Bernabﾃｩ (Algeciras);3 habs.;2 baﾃｱos;85 mﾂｲ;2ﾂｪ planta;"Piso en san bernabﾃｩ
Vivienda en una de las mejores zonas de algeciras, muy buen comunicado, bonitas vistas, cerca de centro comerc...";36.1378887;-5.4708717;cadiz
4.750.000 竄ｬ;;/comprar/chalet-puente_mayorga_campamento11314-15892620590_102100/;Puente Mayorga-Campamento (San Roque);5 habs.;7 baﾃｱos;720 mﾂｲ;;Oportunidad de vivir en un entorno incomparable. Rodeado del parque nacional los alcornocales, los mejores campos de golf del sur ...;36.2042556;-5.4099012;cadiz
440.000 竄ｬ;;/comprar/piso-la_caleta_la_vina11002-42521660456_100500/;La Caleta-La Viﾃｱa (Cﾃ｡diz Capital);4 habs.;1 baﾃｱo;174 mﾂｲ;2ﾂｪ planta;Playa la caleta - amplio piso situado junto a la playa urbana mﾃ｡s famosa de la provincia, a pocos metros del parque genovﾃｩs y del ...;36.531905399;-6.30563356;cadiz
75.000 竄ｬ;;/comprar/casa_adosada-san_garcia_getares-44178724864_100200/;San Garcﾃｭa-Getares (Algeciras);3 habs.;1 baﾃｱo;121 mﾂｲ;;ﾂ｡Novedad! Casa adosada lista para entrar a vivir. La vivienda de 3 plantas consta de salﾃｳn amplio, cocina, cuarto de baﾃｱo completo...;36.1115443;-5.4469636;cadiz
199.000 竄ｬ;;/comprar/piso-cadiz_capital_centro_historico11003-44233674221_100500/;Centro Histﾃｳrico (Cﾃ｡diz Capital);3 habs.;1 baﾃｱo;67 mﾂｲ;1ﾂｪ planta;Plaza san antonio - piso situado en una de las mejores y mﾃ｡s tranquilas zona residenciales del centro de la ciudad, a escasos metr...;36.5340572;-6.2987991;cadiz
93.000 竄ｬ;;/comprar/piso-noreste11405-45039458251_108900/;Noreste (Jerez de la Frontera);3 habs.;1 baﾃｱo;90 mﾂｲ;;"Piso en jerez de la frontera, zona granja, la vivienda se encuentra&nbsp; en planta baja con patio, consta de cocina amueblada abi...";36.6970078;-6.1058448;cadiz
375.000 竄ｬ;;/comprar/casa_adosada-soto_del_real_villamaruja_cobreros_viejo-42532486579_100500/;Soto del Real-Villamaruja-Cobreros Viejo (San Fernando);4 habs.;3 baﾃｱos;191 mﾂｲ;;Situada en la zona de villamaruja se accede al inmueble desde un jardﾃｭn delantero de  54 mﾂｲ con cﾃｩsped artificial y garaje cerrado...;36.4536642;-6.2126158;cadiz
290.000 竄ｬ;Casa en Camino Pista de Montijo, 5;/comprar/casa-centro_zona_noreste-38413699375_990821/;Centro-Zona Noreste (Chipiona);3 habs.;2 baﾃｱos;166 mﾂｲ;;"Si busca una casa,ubicada en una parcela de 1460, dﾃｳnde podrﾃ｡ tener infinidad de opciones, aquﾃｭ tiene una oportunidad.

Amplia cas...";36.75710889672159;-6.404359155073305;cadiz
2.500.000 竄ｬ;;/comprar/chalet-el_puerto_de_santa_maria_vistahermosa-28420351120_103800/;Vistahermosa (El Puerto de Santa Marﾃｭa);6 habs.;6 baﾃｱos;393 mﾂｲ;;"Estupendo chalet a 60 metros de la playa, con unas vistas inmejorables sobre la bahﾃｭa de cﾃ｡diz.

Casa de 5 dormitorios mﾃ｡s uno de ...";36.5835985;-6.2673418;cadiz
115.500 竄ｬ;;/comprar/piso-la_pastora_zona_de_la_estacion11100-45078503648_100200/;La Pastora-Zona de la Estaciﾃｳn (San Fernando);3 habs.;1 baﾃｱo;85 mﾂｲ;;San rafael: amplio piso en la zona de san rafael de 3 dormitorios, cocina, salﾃｳn y baﾃｱo. Cuanta con trastero privado y azotea comu...;36.4714296;-6.1951811;cadiz
155.000 竄ｬ;;/comprar/casa-centro_zona_noreste-35005563082_100500/;Centro-Zona Noreste (Chipiona);4 habs.;2 baﾃｱos;115 mﾂｲ;;ﾂ｡ En exclusiva! Independiente: casa totalmente independiente ubicada en zona residencial comercial, muy prﾃｳxima a centros educativ...;36.7330938;-6.4286187;cadiz
145.000 竄ｬ;;/comprar/piso-jerez_de_la_frontera_oeste11407-44214171403_103800/;Oeste (Jerez de la Frontera);3 habs.;1 baﾃｱo;83 mﾂｲ;2ﾂｪ planta;"Piso de 3 dormitorios con garaje incluido en zona norte

El inmueble dispone de hall de entrada, cocina equipada (salvo lavavajill...";36.700819379;-6.141446903;cadiz
219.000 竄ｬ;;/comprar/piso-jerez_de_la_frontera_norte11407-44171994522_109300/;Norte (Jerez de la Frontera);3 habs.;2 baﾃｱos;109 mﾂｲ;1ﾂｪ planta;Luminoso piso situado en la zona norte de la ciudad. Ideal para personas jﾃｳvenes que buscan un ambiente dinﾃ｡mico y vibrante. El ed...;36.7060585;-6.1136391;cadiz
74.990 竄ｬ;;/comprar/piso-arcos_de_la_frontera_centro_urbano-42574000496_100500/;Arcos de la Frontera;2 habs.;1 baﾃｱo;53 mﾂｲ;Bajo;Excelente piso listo para entrar a vivir, ubicado en una zona cﾃｩntrica (c/ cucarro), y en un edificio de reciente construcciﾃｳn (20...;36.754125565;-5.814463221;cadiz
185.000 竄ｬ;;/comprar/casa_adosada-las_palmeras_dehesilla-45084273984_100500/;Las Palmeras-Dehesilla (Sanlﾃｺcar de Barrameda);4 habs.;2 baﾃｱos;96 mﾂｲ;;Os presentamos este bonito adosado en la zona de la palmeras, junto al parque, ubicado en una calle residencial, parada de autobﾃｺs...;36.7595246;-6.3615999;cadiz
380.000 竄ｬ;Casa adosada en Carretera de La Barrosa. Urbanizaciﾃｳn Apartaclub La Barrosa,  3;/comprar/casa_adosada-la_soledad_la_coquina_los_gallos-4321521160_109700/;La Soledad-La Coquina-Los Gallos (Chiclana de la Frontera);3 habs.;2 baﾃｱos;122 mﾂｲ;;Vivienda 1. Casa pareada de obra nueva, de 122 mﾂｲ de superficie construida en parcela de 350 mﾂｲ, y ubicada en la zona de chiclana ...;36.4006784;-6.1719384;cadiz
255.000 竄ｬ;;/comprar/casa_adosada-caseria_de_ossio_san_carlos11100-45847370754_100500/;Caserﾃｭa de Ossio-San Carlos (San Fernando);3 habs.;2 baﾃｱos;210 mﾂｲ;;Vivienda situada en residencial en la zona de la playa de la caserﾃｭa de san fernando, consta de porche de entrada, salﾃｳn independi...;36.483426841;-6.196830358;cadiz
270.000 竄ｬ;;/comprar/atico-chipiona_la_laguna-30898721916_100500/;La Laguna (Chipiona);2 habs.;1 baﾃｱo;120 mﾂｲ;;A00671 ﾃ｡tico en la zona de la laguna  a 400m de la playa. Dispone de 2 dormitorios amplios, uno de ellos con armario empotrado y e...;36.7200591;-6.4336742;cadiz
315.000 竄ｬ;;/comprar/casa-este11406-43416227214_100500/;Este (Jerez de la Frontera);3 habs.;3 baﾃｱos;171 mﾂｲ;;Estupenda casa sobre una parcela urbana de 510 totalmente reformada con patio delantero y amplio jardﾃｭn trasero de mﾃ｡s de 120 metr...;36.6786451;-6.0980126;cadiz
1.125.000 竄ｬ;;/comprar/chalet-sotogrande_alto11310-40010549213_100500/;Sotogrande Alto (Sotogrande);5 habs.;5 baﾃｱos;525 mﾂｲ;;"Exclusivo chalet en la prestigiosa urbanizaciﾃｳn de sotogrande

Descubra el epitome del lujo y la comodidad en este magnﾃｭfico chale...";36.2780719;-5.3327445;cadiz
186.400 竄ｬ;Casa adosada en calle Cabo de Rocas,  4;/comprar/casa_adosada-rinconcillo-4671235670_109700/;Rinconcillo (Algeciras);3 habs.;;;;V8. Casa adosada de obra nueva, y ubicada en la zona de algeciras.  Estﾃ｡ distribuida en 3 habitaciones y terraza. Incluye extras c...;36.1648;-5.45186;cadiz
152.900 竄ｬ;Piso en calle de Regino Martﾃｭnez, 1;/comprar/piso-algeciras_centro11201-42545475720_512568/;Centro (Algeciras);4 habs.;3 baﾃｱos;132 mﾂｲ;2ﾂｪ planta;Fabuloso piso en el centro de algeciras en una de la calle mﾃ｡s cﾃｩntrica de la ciudad y rodeado de toda clase de servicios , frente...;36.132996;-5.448938;cadiz
450.000 竄ｬ;;/comprar/piso-playa_de_la_victoria11008-40896794326_100500/;Playa de la Victoria (Cﾃ｡diz Capital);4 habs.;2 baﾃｱos;123 mﾂｲ;4ﾂｪ planta;Se vende magnﾃｭfico piso, con garaje y trastero, en pleno paseo marﾃｭtimo de cﾃ｡diz, con vistas frontales al mar. Este luminoso y esp...;36.5143865;-6.2837823;cadiz
175.000 竄ｬ;Chalet en calle Benamurel;/comprar/chalet-pinar_de_los_franceses_el_marquesado11138-35098001360_103800/;Pinar de los Franceses-El Marquesado (Chiclana de la Frontera);3 habs.;2 baﾃｱos;135 mﾂｲ;;Si buscas vivir en la tranquilidad, rodeado de naturaleza, en una casa cﾃｳmoda de una sola planta. Te presento este bonito y acoged...;36.45415649;-6.1280467;cadiz
372.000 竄ｬ;Piso en Avenida del Golf,  s/n;/comprar/piso-san_roque_la_alcaidesa-4261841951_109700/;La Alcaidesa (San Roque);3 habs.;2 baﾃｱos;149 mﾂｲ;;Piso en una finca de obra nueva de 149 m2 de superficie construida y emplazado en la zona de San Roque. Estﾃ｡ dispuesto en 3 habitaciones, 2 baﾃｱos completos y terraza. Cuenta como extras ascensor, 2 garajes.;36,246724687;-5,32610504;cadiz
265.000 竄ｬ;;/comprar/casa_adosada-camposoto_gallineras11100-41723228226_100500/;Camposoto-Gallineras (San Fernando);4 habs.;2 baﾃｱos;133 mﾂｲ;;Vivienda adosada que consta en planta baja de porche de unos 25 metros, salﾃｳn independiente con equipo de aire acondicionado, coci...;36.4509367;-6.2150767;cadiz
105.000 竄ｬ;;/comprar/piso-jerez_de_la_frontera_centro11401-40845937905_100500/;Centro (Jerez de la Frontera);2 habs.;2 baﾃｱos;63 mﾂｲ;Bajo;En el centro, en la plaza de madre de dios, tenemos este bonito piso de dos habitaciones, cocina, salﾃｳn comedor de buenas dimensio...;36.6792888;-6.1293366;cadiz
180.000 竄ｬ;;/comprar/casa-centro_zona_noreste-37509867115_100500/;Centro-Zona Noreste (Chipiona);4 habs.;2 baﾃｱos;162 mﾂｲ;;"Casa gande de esquina, con terraza y cabida para coche, bien ubicada. 
Zona campo de futbol
Tenemos a disposicion del consumidor e...";36.7327549;-6.428667216;cadiz
330.000 竄ｬ;;/comprar/chalet-acerinox-40083061955_526073/;Acerinox (Los Barrios);2 habs.;2 baﾃｱos;500 mﾂｲ;;Esta extraordinaria villa en los barrios es una oportunidad ﾃｺnica en el mercado. Con una superficie total de 500 mﾂｲ, esta espacios...;36.190510267;-5.438710092;cadiz
240.000 竄ｬ;;/comprar/piso-san_jose_varela_la_laguna11008-45048710269_100500/;San Josﾃｩ-Varela-La Laguna (Cﾃ｡diz Capital);3 habs.;1 baﾃｱo;69 mﾂｲ;3ﾂｪ planta;Vivienda tipo piso en edificio con ascensor, situada en zona con fﾃ｡cil salida a la autovﾃｭa y a tan solo 8 minutos a pie de la play...;36.5176423;-6.2798749;cadiz
220.000 竄ｬ;;/comprar/piso-zona_playa_virgen_del_mar-44230405912_103800/;Zona Playa Virgen del Mar (Rota);3 habs.;;85 mﾂｲ;3ﾂｪ planta;ﾂ｡Descubre tu nuevo hogar a dos pasos de la playa de virgen del mar! Este magnﾃｭfico y amplio piso de 85 mﾂｲ te ofrece todo lo que ne...;36.6226283;-6.3683016;cadiz
750.000 竄ｬ;;/comprar/chalet-sancti_petri_playa_de_la_barrosa11139-96700711729_100500/;Costa de Sancti Petri-Playa de La Barrosa (Chiclana de la Frontera);3 habs.;1 baﾃｱo;115 mﾂｲ;;Se vende parcela urbana de 1.172 mﾂｲ aproximadamente en la playa de la barrosa, situada en una zona muy cercana a la principal zona...;36.3703403;-6.1796175;cadiz
87.990 竄ｬ;;/comprar/piso-algeciras_centro11201-45046267682_101800/;Centro (Algeciras);3 habs.;1 baﾃｱo;110 mﾂｲ;;Vendo piso grande, de 110 mﾂｲ, en buenas condiciones. Se encuentra situado en el centro de algeciras, secano, zona muy buena y tran...;36.1291838;-5.450123;cadiz
156.500 竄ｬ;Piso en Avenida Josﾃｩ Manuel Caballero Bonald,  s/n;/comprar/piso-noreste11405-3863236647_109700/;Noreste (Jerez de la Frontera);2 habs.;1 baﾃｱo;93 mﾂｲ;1ﾂｪ planta;Esc. 9, 1ﾂｺ d. Piso en un inmueble de obra nueva de 93 mﾂｲ de superficie construida y situado en la zona de jerez de la frontera, ac...;36.7002516;-6.1088684;cadiz
A consultar;Piso en calle de Santa Ana, 5;/comprar/piso-nucleo_urbano_urbanizaciones-38369645143_100500/;Nﾃｺcleo Urbano-Urbanizaciones (Chiclana de la Frontera);2 habs.;2 baﾃｱos;85 mﾂｲ;Bajo;ﾂ｡Atenciﾃｳn! Tenemos una nueva oferta especial que no te puedes perder. Presentamos nuestro prﾃｳximo edificio plurifamiliar de 8 vivi...;36.4166;-6.14888;cadiz
380.000 竄ｬ;;/comprar/casa-vallealto-45003022058_265000/;Vallealto (El Puerto de Santa Marﾃｭa);3 habs.;2 baﾃｱos;120 mﾂｲ;;"Alonsaga inmobiliaria vende en exclusiva bonita casa independiente en vallealto!!!
Esta encantadora casa en venta se encuentra en ...";36.6270867;-6.2079945;cadiz
390.000 竄ｬ;Casa en Avenida Nuevo Oasis del Sur, nﾂｺ 2;/comprar/casa-costa_ballena-38376418834_990821/;Costa Ballena (Rota);4 habs.;3 baﾃｱos;110 mﾂｲ;;"Casa de 4 dormitorios, ubicada en una urbanizaciﾃｳn en primera lﾃｭnea de playa de costa ballena, en una de sus mejores playas.

En l...";36.67768680286151;-6.406039004654608;cadiz
145.000 竄ｬ;;/comprar/casa-centro_zona_noreste-42561659725_100500/;Centro-Zona Noreste (Chipiona);3 habs.;1 baﾃｱo;98 mﾂｲ;;"Situado en buena zona con servicios a sus alrededor, zona tranquila.

Consta de tres dormitorios , dos de ellos amplios, baﾃｱo comp...";36.728982;-6.4274419;cadiz
145.000 竄ｬ;Casa adosada en Paseo Victoria Eugenia, 16;/comprar/casa_adosada-san_garcia_getares-4625368930_109700/;San Garcﾃｭa-Getares (Algeciras);3 habs.;2 baﾃｱos;72 mﾂｲ;;Tipo b. Casa adosada de obra nueva, de 72 mﾂｲ de superficie construida, y emplazada en la zona de algeciras.  Estﾃ｡ dispuesta en 3 h...;36.1225846;-5.4475162;cadiz
125.000 竄ｬ;;/comprar/piso-este11406-45855601229_108900/;Este (Jerez de la Frontera);3 habs.;1 baﾃｱo;90 mﾂｲ;;Piso en jerez de la frontera, zona de la universidad, en plaza de princijerez, la vivienda consta de 3 habitaciones, 2 baﾃｱos conve...;36.6816115;-6.1166037;cadiz
440.000 竄ｬ;;/comprar/piso-cadiz_capital_centro_historico11005-43379946113_100500/;Centro Histﾃｳrico (Cﾃ｡diz Capital);3 habs.;2 baﾃｱos;131 mﾂｲ;2ﾂｪ planta;Espacioso y reformado inmueble busca familia que desee comenzar una nueva vida entre sus mﾃｺltiples estancias. Se trata de un *bast...;36.53037;-6.2944874;cadiz
289.900 竄ｬ;;/comprar/atico-jerez_de_la_frontera_norte11405-45907395534_100500/;Norte (Jerez de la Frontera);4 habs.;2 baﾃｱos;117 mﾂｲ;;"Magnﾃｭfico ﾃ｡tico dﾃｺplex con amplia terraza en venta en zona hipercor. 

Este piso estﾃ｡ formado por 3 dormitorios, 2 baﾃｱos completos...";36.7069371;-6.1103644;cadiz
120.000 竄ｬ;;/comprar/piso-camposoto_gallineras11100-43409871464_100200/;Camposoto-Gallineras (San Fernando);2 habs.;1 baﾃｱo;50 mﾂｲ;;Zona la noria. Piso reformado y amueblado ubicado en una primera planta con ascensor que se distribuye en dos dormitorios amplios ...;36.4525815;-6.2115787;cadiz
140.000 竄ｬ;;/comprar/casa_unifamiliar-arcos_de_la_frontera_centro_urbano-45036711188_100200/;Arcos de la Frontera;3 habs.;2 baﾃｱos;158 mﾂｲ;;Jedula: se vende estupenda casa independiente de 3 plantas en la mejor zona de jﾃｩdula, la vivienda cuenta con 4 dormitorios amplio...;36.7244155;-5.9289771;cadiz
167.000 竄ｬ;;/comprar/estudio-el_puerto_de_santa_maria_vistahermosa-40836035381_100500/;Vistahermosa (El Puerto de Santa Marﾃｭa);1 hab.;1 baﾃｱo;45 mﾂｲ;;"Fersa inmobiliaria comercializa en exclusiva
 Fantﾃ｡stico local comercial en planta baja adaptado como estudio con terraza privativ...";36.580339518;-6.257691219;cadiz
1.250.000 竄ｬ;;/comprar/chalet-el_puerto_de_santa_maria_vistahermosa-42556459120_100500/;Vistahermosa (El Puerto de Santa Marﾃｭa);5 habs.;5 baﾃｱos;399 mﾂｲ;;"Gran chalet independiente en vistahermosa.

Situado en la parte baja de vistahermosa, prﾃｳximo al club del buzo y del campo de golf...";36.5919304;-6.2637366;cadiz
365.000 竄ｬ;;/comprar/atico-noreste11405-5849271686_101800/;Noreste (Jerez de la Frontera);3 habs.;2 baﾃｱos;105 mﾂｲ;;"ﾂ｡ﾂ｡ﾂ｡ Oportunidad !!! Avd. Jose manuel caballero bonald, norte. Se vende; magnifico y espectacular ﾃ｡tico, en una de las mejores zona...";36.7013334;-6.1087735;cadiz
500.000 竄ｬ;;/comprar/casa_pareada-el_puerto_de_santa_maria_vistahermosa-35885198462_100500/;Vistahermosa (El Puerto de Santa Marﾃｭa);5 habs.;4 baﾃｱos;190 mﾂｲ;;"Fersa inmobiliaria ofrece en exclusiva fantﾃ｡stico pareado en el soto de vistahermosa. 

Pareado muy luminoso. Consta de dos planta...";36.5969308;-6.2501403;cadiz
399.900 竄ｬ;;/comprar/casa-jerez_de_la_frontera_centro11402-42507128741_100500/;Centro (Jerez de la Frontera);2 habs.;2 baﾃｱos;330 mﾂｲ;;"Precioso casco de bodega reformado en el centro.

Magnﾃｭfica vivienda de 330mﾂｲ construidos, completamente reformada en el 2021, div...";36.6872892;-6.1318651;cadiz
123.743 竄ｬ;;/comprar/apartamento-reconquista_san_jose_artesano_el_rosario11205-35016305427_100500/;Reconquista-San Josﾃｩ Artesano-El Rosario (Algeciras);2 habs.;1 baﾃｱo;85 mﾂｲ;Subsﾃｳtano;1. Piso 竊 apartamento en algeciras zona el rinconcillo - san josﾃｩ artesano, 85 m. De superficie, 2 habitaciones dobles,  un baﾃｱo, ...;36.1451973;-5.4504529;cadiz
375.000 竄ｬ;;/comprar/casa_pareada-noreste11405-39247592523_100500/;Noreste (Jerez de la Frontera);5 habs.;3 baﾃｱos;158 mﾂｲ;;"Amplia casa pareada con piscina en hacienda del polo.
Esta casa consta de amplio jardﾃｭn de entrada con piscina, zona para aparcami...";36.690029;-6.1245046;cadiz
254.000 竄ｬ;;/comprar/casa-jerez_de_la_frontera_norte11405-35062452762_103800/;Norte (Jerez de la Frontera);4 habs.;3 baﾃｱos;130 mﾂｲ;;"Plenitud residencial, es un nuevo proyecto de 20 viviendas unifamiliares en avenida de espera, zona norte de jerez. 
Se caracteriz...";36.7091227;-6.1069809;cadiz
160.000 竄ｬ;;/comprar/piso-barbate_centro_urbano-45056917957_106700/;Barbate;3 habs.;1 baﾃｱo;102 mﾂｲ;;"Piso en primera planta , bastante amplio y luminoso . 
 Consta de hall de entrada , 1 baﾃｱo , cocina ,salﾃｳn independiente con aire ...";36.1907937;-5.9175974;cadiz
280.000 竄ｬ;;/comprar/casa-rota_zona_norte11520-45084205308_109300/;Zona Norte (Rota);2 habs.;1 baﾃｱo;385 mﾂｲ;;"Venta de local con vivienda !!
 
Vivienda adosada , con local en la planta baja. Se encuentra muy prﾃｳxima a principales comercios ...";36.62599;-6.3604899;cadiz
139.900 竄ｬ;;/comprar/piso-centro_calzada-43408872043_101800/;Centro-Calzada (Sanlﾃｺcar de Barrameda);3 habs.;1 baﾃｱo;78 mﾂｲ;2ﾂｪ planta;Magnﾃｭfica oportunidad en el centro de sanlﾃｺcar de barrameda. Piso en perfecto estado para entrar a vivir, cuenta con 3 habitacione...;36.7815401;-6.3489498;cadiz
176.800 竄ｬ;Piso en calle Comedia,  S/N;/comprar/piso-el_puerto_de_santa_maria_centro-4639603213_109700/;Centro (El Puerto de Santa Marﾃｭa);2 habs.;2 baﾃｱos;74 mﾂｲ;;Piso en una finca de obra nueva de 74 m2 de superficie construida y emplazado en la zona de El Puerto de Santa Marﾃｭa. Estﾃ｡ dispuesto en 2 habitaciones, 2 baﾃｱos completos y terraza. Cuenta como extras ascensor, garaje.;36,5963774;-6,2278455;cadiz
495.000 竄ｬ;Chalet en calle del ﾃ〕amo, 4;/comprar/chalet-nucleo_urbano_urbanizaciones-43360090371_108700/;Nﾃｺcleo Urbano-Urbanizaciones (Chiclana de la Frontera);10 habs.;2 baﾃｱos;374 mﾂｲ;;"ﾂ｡Exclusiva propiedad en chiclana de la frontera!

Iad espaﾃｱa - marieta ludovica chesches se complace en ofrecer esta magnﾃｭfica pro...";36.4194;-6.14843;cadiz
290.000 竄ｬ;;/comprar/casa-barbate_centro_urbano-39182940222_106700/;Barbate;3 habs.;2 baﾃｱos;125 mﾂｲ;;Increﾃｭble casa en barbate, a escasos 100 metros de la playa. Distribuida en dos plantas y con el encanto del casco antiguo de la l...;36.1885112;-5.9171203;cadiz
119.900 竄ｬ;;/comprar/piso-puerto_real_centro_urbano-45083057895_100200/;Puerto Real;3 habs.;;82 mﾂｲ;;ﾂｿBuscas el hogar perfecto en una ubicaciﾃｳn privilegiada? ﾂ｡Lo has encontrado! Te presentamos esta magnﾃｭfica vivienda de protecciﾃｳn ...;36.5218227;-6.2271934;cadiz
296.500 竄ｬ;;/comprar/casa-aguadulce_almadraba_punta_candor11520-43343488810_109300/;Aguadulce-Almadraba-Punta Candor (Rota);2 habs.;1 baﾃｱo;63 mﾂｲ;;ﾂ｡Atenciﾃｳn buscadores de paraﾃｭsos terrenales! Este piso en rota es tu boleto directo a la felicidad playera. Una urbanizaciﾃｳn con p...;36.634228961;-6.389656599;cadiz
82.000 竄ｬ;;/comprar/piso-barrio_alto-45025354635_512750/;Barrio Alto (Sanlﾃｺcar de Barrameda);3 habs.;1 baﾃｱo;77 mﾂｲ;2ﾂｪ planta;"En exclusiva ! 

Vivienda recientemente reformada en su totalidad, consta en su interior de amplio salﾃｳn - comedor con balcon, coc...";36.7745073;-6.3476981;cadiz
95.000 竄ｬ;;/comprar/casa-bajadilla-41750089794_100500/;Bajadilla (Algeciras);3 habs.;2 baﾃｱos;74 mﾂｲ;;"Bonita casa en barriada fuentenueva de 140 mﾂｲ construﾃｭdos y 97 mﾂｲ ﾃｺtiles.
La vivienda consta de dos plantas distribuﾃｭdas de la sig...";36.1315318;-5.4542725;cadiz
178.000 竄ｬ;;/comprar/piso-bajadilla-40840144726_100200/;Bajadilla (Algeciras);4 habs.;2 baﾃｱos;144 mﾂｲ;;ﾂ｡Bienvenidos a este hermoso piso en venta en una de las zonas mﾃ｡s cotizadas de algeciras! Este piso es nuevo y se encuentra en una...;36.135855153;-5.458851497;cadiz
185.000 竄ｬ;;/comprar/duplex-la_caleta_la_vina11001-25914065041_100500/;La Caleta-La Viﾃｱa (Cﾃ｡diz Capital);1 hab.;;51 mﾂｲ;2ﾂｪ planta;"Apartamento muy apaﾃｱao* en casa burguesa busca comprador disfrutﾃｳn  sin miedo al ﾃｩxito.

Posibilidades:
- sﾃｳlo tendrﾃ｡s que meter t...";36.5322307;-6.30015;cadiz
3.500.000 竄ｬ;;/comprar/casa-puerto_de_sotogrande_la_marina11310-32514705085_105300/;Puerto de Sotogrande-La Marina (Sotogrande);4 habs.;7 baﾃｱos;1.243 mﾂｲ;;"Exclusiva villa en venta en sotogrande alto.

Proyecto exclusivo de villa de lujo en sotogrande alto.
La villa contiene un gran sa...";36.295686475;-5.278044768;cadiz
79.000 竄ｬ;;/comprar/piso-jerez_de_la_frontera_oeste11407-36684780699_100200/;Oeste (Jerez de la Frontera);3 habs.;1 baﾃｱo;76 mﾂｲ;;"Piso en bda. San benito.
ﾂ｡ Ubicado en planta baja !
Estupendo piso compuesto de 3 dormitorios, amplio salﾃｳn-comedor con terraza in...";36.7010769;-6.1372231;cadiz
