precio;sub_descr;href;ubicacion;habitaciones;banios;mt2;planta;otros;latitude;longitude;CCAA
480.000 竄ｬ;Piso en Avenida de Andalucﾃｭa;/comprar/piso-playa_de_santa_maria_del_mar_bahia_blanca11007-43359064454_516894/;Playa de Santa Marﾃｭa del Mar-Bahﾃｭa Blanca (Cﾃ｡diz Capital);6 habs.;3 baﾃｱos;264 mﾂｲ;Entresuelo;"Cadizsur servicios inmobiliarios, les presenta ﾃｩste gran piso en venta en avenida andalucﾃｭa, cﾃ｡diz capital. 

Destaca por su super...";36.5243141;-6.2870008;cadiz
224.000 竄ｬ;Casa adosada en calle La Hijuela, 98;/comprar/casa_adosada-rural11593-36701446347_100500/;Rural (Jerez de la Frontera);4 habs.;2 baﾃｱos;226 mﾂｲ;;"ﾂ｡Tu nuevo hogar frente a la naturaleza!

Desde umbra inmobiliaria, te presentamos en exclusiva esta excepcional unifamiliar en esq...";36.6819;-6.07185;cadiz
375.000 竄ｬ;Casa pareada en Chapin;/comprar/casa_pareada-noreste11405-39247592523_100500/;Noreste (Jerez de la Frontera);5 habs.;3 baﾃｱos;158 mﾂｲ;;"Amplia casa pareada con piscina en hacienda del polo.
Esta casa consta de amplio jardﾃｭn de entrada con piscina, zona para aparcami...";36.690029;-6.1245046;cadiz
218.000 竄ｬ;Piso en La Laguna;/comprar/piso-chipiona_la_laguna-42565444870_100500/;La Laguna (Chipiona);3 habs.;2 baﾃｱos;124 mﾂｲ;2ﾂｪ planta;"Situado en la zona de la laguna, a solo 150 metros de la playa del camaron, vista al mar, a solo 550 metros del santuario.

Consta...";36.7250242;-6.4365902;cadiz
280.000 竄ｬ;Casa en Zona Norte;/comprar/casa-rota_zona_norte11520-45084205308_109300/;Zona Norte (Rota);2 habs.;1 baﾃｱo;385 mﾂｲ;;"Venta de local con vivienda !!
 
Vivienda adosada , con local en la planta baja. Se encuentra muy prﾃｳxima a principales comercios ...";36.62599;-6.3604899;cadiz
319.000 竄ｬ;Chalet en Norte Montealto;/comprar/chalet-jerez_de_la_frontera_norte11407-31702471633_103800/;Norte (Jerez de la Frontera);4 habs.;3 baﾃｱos;267 mﾂｲ;;Vivienda unifamiliar adosada con reformas y mejoras realizadas muy beneficiosas para el inmueble, consta de sﾃｳtano para dos coches...;36.7053277;-6.1247958;cadiz
123.743 竄ｬ;Apartamento en El Rinconcillo - San Josﾃｩ Artesano;/comprar/apartamento-reconquista_san_jose_artesano_el_rosario11205-35016305427_100500/;Reconquista-San Josﾃｩ Artesano-El Rosario (Algeciras);2 habs.;1 baﾃｱo;85 mﾂｲ;Subsﾃｳtano;1. Piso 竊 apartamento en algeciras zona el rinconcillo - san josﾃｩ artesano, 85 m. De superficie, 2 habitaciones dobles,  un baﾃｱo, ...;36.1451973;-5.4504529;cadiz
290.000 竄ｬ;Casa en Barbate;/comprar/casa-barbate_centro_urbano-39182940222_106700/;Barbate;3 habs.;2 baﾃｱos;125 mﾂｲ;;Increﾃｭble casa en barbate, a escasos 100 metros de la playa. Distribuida en dos plantas y con el encanto del casco antiguo de la l...;36.1885112;-5.9171203;cadiz
520.000 竄ｬ;Piso en San Carlos;/comprar/piso-cadiz_capital_centro_historico11004-38421189449_100500/;Centro Histﾃｳrico (Cﾃ｡diz Capital);6 habs.;3 baﾃｱos;180 mﾂｲ;5ﾂｪ planta;"En esta magnﾃｭfica casa, anclada en los 70, podrﾃ｡s sentir que llegas al *paraﾃｭso.

Posibilidades:
- poder redecorar un gran espacio...";36.5359545;-6.2913486;cadiz
125.000 竄ｬ;Piso en Princijerez;/comprar/piso-este11406-45855601229_108900/;Este (Jerez de la Frontera);3 habs.;1 baﾃｱo;90 mﾂｲ;;Piso en jerez de la frontera, zona de la universidad, en plaza de princijerez, la vivienda consta de 3 habitaciones, 2 baﾃｱos conve...;36.6816115;-6.1166037;cadiz
249.000 竄ｬ;Piso en Costilla - Virgen del Mar;/comprar/piso-zona_playa_virgen_del_mar-42581068493_103800/;Zona Playa Virgen del Mar (Rota);4 habs.;;95 mﾂｲ;4ﾂｪ planta;Si buscas un piso amplio, para toda la familia, al alcance de todo, a poca distancia de la playa y ademﾃ｡s con plaza de aparcamient...;36.622392563;-6.361546805;cadiz
2.664.000 竄ｬ;ﾃ》ico en calle A-2100;/comprar/atico-sotogrande_alto11310-30061360705_101800/;Sotogrande Alto (Sotogrande);4 habs.;5 baﾃｱos;383 mﾂｲ;;"ﾃ》ico obra nueva en sotogrande (cﾃ｡diz), 33 unidades, varios tamaﾃｱos y alturas.

""walking distance"" del sotogrande international sc...";36.27916;-5.3185192;cadiz
395.000 竄ｬ;Chalet en Ctra. Playa de La Barrosa;/comprar/chalet-pinar_de_los_franceses_el_marquesado11130-43409323538_100500/;Pinar de los Franceses-El Marquesado (Chiclana de la Frontera);4 habs.;3 baﾃｱos;150 mﾂｲ;;"Magnﾃｭfico chalet en la zona del almendral.    

Le gustarﾃｭa vivir en una maravillosa zona residencial? Encontrﾃｳ lo que buscaba.

C...";36.4095752;-6.160135;cadiz
110.000 竄ｬ;Piso en Centro;/comprar/piso-centro_calzada-45846120136_100500/;Centro-Calzada (Sanlﾃｺcar de Barrameda);2 habs.;1 baﾃｱo;41 mﾂｲ;1ﾂｪ planta;Acogedor piso situado junto al cerro falﾃｳn, en una zona rodeada de todos los servicios necesarios para una cﾃｳmoda estancia. Con un...;36.783509122;-6.353604342;cadiz
66.000 竄ｬ;Apartamento en Jimena de la Frontera;/comprar/apartamento-jimena_de_la_frontera_centro_urbano-42566322048_106700/;Jimena de la Frontera;2 habs.;1 baﾃｱo;77 mﾂｲ;;"Luminoso apartamento de 2 habitaciones con buenas vistas, baﾃｱo con ducha, salﾃｳn con despensa, comedor y cocina con mucha luz. 
Se ...";36.431383614;-5.446223852;cadiz
139.000 竄ｬ;Piso en Alameda;/comprar/piso-san_fernando_centro-41710636889_103800/;Centro (San Fernando);2 habs.;1 baﾃｱo;90 mﾂｲ;1ﾂｪ planta;Estupendo piso en venta  de 90 mﾂｲ, muy cﾃｩntrico en zona alameda.  Vivienda de 2 dormitorios, 1 baﾃｱo, cocina y salﾃｳn comedor. Dispo...;36.466629991;-6.194642188;cadiz
325.000 竄ｬ;Chalet en Santiscal;/comprar/chalet-arcos_de_la_frontera_centro_urbano-31727695757_103800/;Arcos de la Frontera;4 habs.;5 baﾃｱos;131 mﾂｲ;;Os presentamos este chalet en arcos de la frontera, en plena sierra de cﾃ｡diz, ubicaciﾃｳn idﾃｳnea para relajarse y tener las comodida...;36.760790808;-5.784986757;cadiz
490.000 竄ｬ;Casa en El ﾃ“uila-Las Redes-Fuentebravﾃｭa;/comprar/casa-el_aguila_las_redes_fuentebravia-45884169628_265000/;El ﾃ“uila-Las Redes-Fuentebravﾃｭa (El Puerto de Santa Marﾃｭa);4 habs.;3 baﾃｱos;160 mﾂｲ;;"A un paso de la playa!!! Visitala!!!!
Encantadora casa con una superficie total de 160 mﾂｲ, de los cuales 140 mﾂｲ son ﾃｺtiles. Dispon...";36.5979692;-6.273042;cadiz
105.000 竄ｬ;Piso en Barrio Alto;/comprar/piso-barrio_alto-44190864638_101800/;Barrio Alto (Sanlﾃｺcar de Barrameda);2 habs.;1 baﾃｱo;65 mﾂｲ;;"Magnﾃｭfico piso en barrio alto junto a c/ san agustﾃｭn, a un minuto de la puerta de jerez.
Piso en muy buen estado listo para entrar...";36.7734517;-6.3510293;cadiz
420.000 竄ｬ;Casa en Glorieta;/comprar/casa-el_cristo_cayetano_roldan11100-41731169786_103800/;El Cristo-Cayetano Roldﾃ｡n (San Fernando);5 habs.;2 baﾃｱos;522 mﾂｲ;;"Se vende fantasticaa finca de 522 mﾂｲ en e centro de san fernando. Consta de dos viviendas independientes, ambas en panta baja.
La ...";36.4732925;-6.1953789;cadiz
240.000 竄ｬ;Piso en calle Sanidad Publica;/comprar/piso-san_jose_varela_la_laguna11008-45048710269_100500/;San Josﾃｩ-Varela-La Laguna (Cﾃ｡diz Capital);3 habs.;1 baﾃｱo;69 mﾂｲ;3ﾂｪ planta;Vivienda tipo piso en edificio con ascensor, situada en zona con fﾃ｡cil salida a la autovﾃｭa y a tan solo 8 minutos a pie de la play...;36.5176423;-6.2798749;cadiz
122.000 竄ｬ;Piso en Avenida del Guadalquivir;/comprar/piso-centro_calzada-44168061307_104700/;Centro-Calzada (Sanlﾃｺcar de Barrameda);2 habs.;1 baﾃｱo;55 mﾂｲ;;Nuevo piso en venta en el centro de sanlﾃｺcar de barrameda, zona inmejorable, rodeado de todo tipo de comercias de alta calidad, un...;36.7828956;-6.3533983;cadiz
360.000 竄ｬ;Chalet en Fuente Amarga;/comprar/chalet-mogarizas_las_rapaces-26698548730_100500/;Mogarizas-Las Rapaces (Chiclana de la Frontera);4 habs.;3 baﾃｱos;380 mﾂｲ;;"Chalet con casa de invitados,  en parcela segregada de 3.600 metros, con piscina  a 2 km de chiclana 
 Busca un chalet donde vivir...";36.401726337;-6.146563267;cadiz
115.500 竄ｬ;Piso en La Pastora-Zona de la Estaciﾃｳn;/comprar/piso-la_pastora_zona_de_la_estacion11100-45078503648_100200/;La Pastora-Zona de la Estaciﾃｳn (San Fernando);3 habs.;1 baﾃｱo;85 mﾂｲ;;San rafael: amplio piso en la zona de san rafael de 3 dormitorios, cocina, salﾃｳn y baﾃｱo. Cuanta con trastero privado y azotea comu...;36.4714296;-6.1951811;cadiz
195.000 竄ｬ;Dﾃｺplex en Carretra de Rota;/comprar/duplex-centro_zona_noreste-43388211799_100500/;Centro-Zona Noreste (Chipiona);3 habs.;2 baﾃｱos;100 mﾂｲ;Bajo;Dﾃｺplex  muy bien conservado , consta de 4 dormitorios (uno de ellos en planta baja), baﾃｱo y aseo situado en la plata baja, patio t...;36.729104562;-6.427790739;cadiz
690.000 竄ｬ;Chalet en Coto San Josﾃｩ;/comprar/chalet-costa_de_sancti_petri_playa_de_la_barrosa11139-44210999917_100500/;Costa de Sancti Petri-Playa de La Barrosa (Chiclana de la Frontera);3 habs.;3 baﾃｱos;174 mﾂｲ;;Prﾃｳxima construcciﾃｳn de chalet en la zona de la 1ﾂｪ pista de la playa de la barrosa, en el municipio de chiclana de la frontera (cﾃ｡...;36.38102987;-6.191322823;cadiz
179.900 竄ｬ;Piso en calle Alsedo;/comprar/piso-ronda_del_estero-45017128374_100500/;Ronda del Estero (San Fernando);3 habs.;1 baﾃｱo;76 mﾂｲ;1ﾂｪ planta;Descubre esta magnﾃｭfica vivienda ubicada en la codiciada zona del carmen, un hogar con un encanto especial y una ubicaciﾃｳn inmejor...;36.4565284;-6.2001241;cadiz
250.000 竄ｬ;Casa en San Rafael;/comprar/casa-la_pastora_zona_de_la_estacion11100-31765454340_103800/;La Pastora-Zona de la Estaciﾃｳn (San Fernando);4 habs.;1 baﾃｱo;149 mﾂｲ;;Si estas buscando vivir en el centro y en una casa sola esta es tu oportunidad, vivienda cerca de la calle san rafael, consta de  ...;36.4686666;-6.1960727;cadiz
188.000 竄ｬ;Piso en Avenida Josﾃｩ Manuel Caballero Bonald,  s/n;/comprar/piso-noreste11405-4452922713_109700/;Noreste (Jerez de la Frontera);3 habs.;2 baﾃｱos;106 mﾂｲ;2ﾂｪ planta;Esc. 10, 2ﾂｺ B. Piso en un edificio de obra nueva de 106 m2 de superficie construida y ubicado en la zona de Jerez de la Frontera, enclavado en planta 2. Estﾃ｡ distribuido en 3 habitaciones, 2 baﾃｱos completos y terraza. Incluye extras como ascensor.;36,7002516;-6,1088684;cadiz
175.000 竄ｬ;Chalet en calle Benamurel;/comprar/chalet-pinar_de_los_franceses_el_marquesado11138-35098001360_103800/;Pinar de los Franceses-El Marquesado (Chiclana de la Frontera);3 habs.;2 baﾃｱos;135 mﾂｲ;;Si buscas vivir en la tranquilidad, rodeado de naturaleza, en una casa cﾃｳmoda de una sola planta. Te presento este bonito y acoged...;36.45415649;-6.1280467;cadiz
125.000 竄ｬ;Piso en calle de la Gaviota;/comprar/piso-centro_zona_noreste-32535098811_100500/;Centro-Zona Noreste (Chipiona);2 habs.;1 baﾃｱo;53 mﾂｲ;Bajo;"Referencia: 637

Piso en planta baja con garaje y trastero. 

Consta de amplio salﾃｳn- comedor, cocina americana completamente amue...";36.73359422;-6.427112718;cadiz
326.000 竄ｬ;Apartamento en calle Pinar de Don Jesus;/comprar/apartamento-costa_de_sancti_petri_playa_de_la_barrosa11139-44246910350_100500/;Costa de Sancti Petri-Playa de La Barrosa (Chiclana de la Frontera);2 habs.;1 baﾃｱo;65 mﾂｲ;Bajo;Apartamentos en urbanizaciﾃｳn situada en una zona privilegiada, en primera lﾃｭnea de la magnﾃｭficaplaya de la barrosa, con acceso dir...;36.3696594;-6.1815791;cadiz
295.000 竄ｬ;Casa en Gallineras;/comprar/casa-camposoto_gallineras11100-44252618435_100500/;Camposoto-Gallineras (San Fernando);5 habs.;3 baﾃｱos;219 mﾂｲ;;Situada en la zona del campo de hockey  consta de dos viviendas, ambas en planta baja distribuidas en los 219 mﾂｲ que tiene la parc...;36.4439322;-6.2091268;cadiz
105.000 竄ｬ;Piso en Madre de Dios;/comprar/piso-jerez_de_la_frontera_centro11401-40845937905_100500/;Centro (Jerez de la Frontera);2 habs.;2 baﾃｱos;63 mﾂｲ;Bajo;En el centro, en la plaza de madre de dios, tenemos este bonito piso de dos habitaciones, cocina, salﾃｳn comedor de buenas dimensio...;36.6792888;-6.1293366;cadiz
187.000 竄ｬ;Piso en Centro;/comprar/piso-jerez_de_la_frontera_centro11403-34183078829_100500/;Centro (Jerez de la Frontera);3 habs.;2 baﾃｱos;170 mﾂｲ;2ﾂｪ planta;Se vende fantﾃ｡stico piso en pleno centro de jerez de la frontera, piso en segunda planta sin ascensor, aunque hay posibilidad de i...;36.681077;-6.1378673;cadiz
275.000 竄ｬ;Piso en calle Agua, Azucarillos y Aguardiente;/comprar/piso-costa_ballena-45089141172_990821/;Costa Ballena (Rota);3 habs.;2 baﾃｱos;97 mﾂｲ;Principal;"Amplia vivienda de tres dormitorios, todos exteriores y con armario empotrado.

Espacioso salﾃｳn comedor cocina, independiente, con...";36.691043012;-6.414302661;cadiz
250.000 竄ｬ;Casa en Centro;/comprar/casa-centro_zona_noreste-29196087195_100500/;Centro-Zona Noreste (Chipiona);5 habs.;3 baﾃｱos;160 mﾂｲ;;A01246 - disfruta de la comodidad de vivir en pleno centro de chipiona donde tendrﾃ｡s todos los servicios que necesitas  a un paso ...;36.732705429;-6.431805831;cadiz
230.000 竄ｬ;Dﾃｺplex en Avenida de las Piletas;/comprar/duplex-centro_calzada-44242304183_104700/;Centro-Calzada (Sanlﾃｺcar de Barrameda);4 habs.;2 baﾃｱos;83 mﾂｲ;;Vivienda tipo dﾃｺplex en 3ﾂｺ linea de playa, avenida de las piletas, a  dos minutos de la playa y de la plaza cabildo. Esta vivienda...;36.7826465;-6.3595831;cadiz
235.000 竄ｬ;ﾃ》ico en calle San Nicols;/comprar/atico-el_pino_bajo_de_guia-38406742795_103800/;El Pino-Bajo de Guﾃｭa (Sanlﾃｺcar de Barrameda);3 habs.;;109 mﾂｲ;;"Estupendo ﾃ｡tico con ascensor y garaje en sanlﾃｺcar de barrameda.
En este residencial, en la zona de bajo guia, a 5 minutos de la pl...";36.7839455;-6.3498626;cadiz
270.000 竄ｬ;Casa en Parque Atlﾃ｡ntico;/comprar/casa-este11406-40848792264_103800/;Este (Jerez de la Frontera);4 habs.;2 baﾃｱos;165 mﾂｲ;;Se vende precioso chalet cerca de la avda. Juan carlos i en la zona ronda este de jerez. Una de las mejores zonas de jerez por sus...;36.6749217;-6.1110252;cadiz
380.000 竄ｬ;Casa en Cruz del Mar;/comprar/casa-centro_zona_playas-39236614145_100500/;Centro-Zona Playas (Chipiona);3 habs.;2 baﾃｱos;251 mﾂｲ;;"Magnifica casa en zona cruz del mar , con 3 plantas : en la planta baja disponemos de un gran garaje con 2 dependencias
En la prim...";36.740807894;-6.436481993;cadiz
99.990 竄ｬ;Piso en San Bernabﾃｩ;/comprar/piso-san_bernabe-39231377360_101800/;San Bernabﾃｩ (Algeciras);3 habs.;2 baﾃｱos;85 mﾂｲ;2ﾂｪ planta;"Piso en san bernabﾃｩ
Vivienda en una de las mejores zonas de algeciras, muy buen comunicado, bonitas vistas, cerca de centro comerc...";36.1378887;-5.4708717;cadiz
700.000 竄ｬ;Chalet en Avenida del Pinar;/comprar/chalet-jerez_de_la_frontera_norte11407-41748670471_103800/;Norte (Jerez de la Frontera);4 habs.;4 baﾃｱos;657 mﾂｲ;;Chalet en monte alto en venta en avenida del pinar, en parcela de 650 mﾂｲ y 495 mﾂｲ construidos, toda la construcciﾃｳn en planta baja...;36.7028236;-6.1359933;cadiz
299.900 竄ｬ;Chalet en Hozanejo;/comprar/chalet-pago_del_humo_poligono_de_pelagatos-44202569571_100500/;Pago del Humo-Polﾃｭgono de Pelagatos (Chiclana de la Frontera);3 habs.;2 baﾃｱos;137 mﾂｲ;;Chalet en chiclana de la frontera zona hozanejos, 137 m. De superficie, 1030 m. Superficie parcela,  una habitaciﾃｳn doble y 2 habi...;36.3664242;-6.1022273;cadiz
250.000 竄ｬ;Chalet en Camino del Olivar;/comprar/chalet-centro_zona_noreste-44204634881_100500/;Centro-Zona Noreste (Chipiona);5 habs.;4 baﾃｱos;160 mﾂｲ;;Od1116. Imagﾃｭnate vivir en una zona tranquila, donde lo que oigas todos los dﾃｭas sean los cantos de los pﾃ｡jaros en una gran vivien...;36.7285445;-6.422082;cadiz
90.000 竄ｬ;Piso en Victoria-El Juncal;/comprar/piso-victoria_el_juncal-44251243365_100200/;Victoria-El Juncal (El Puerto de Santa Marﾃｭa);3 habs.;1 baﾃｱo;70 mﾂｲ;;Descubre esta increﾃｭble oportunidad en el barrio el tejar. Un piso bajo que te ofrece comodidad y amplitud con sus 3 habitaciones ...;36.6075199;-6.2167876;cadiz
170.000 竄ｬ;Piso en Centro;/comprar/piso-jerez_de_la_frontera_centro11404-45031906597_100500/;Centro (Jerez de la Frontera);3 habs.;2 baﾃｱos;88 mﾂｲ;Bajo;"Nos complace ofrecerles este piso en exclusiva ubicado en una zona emblemﾃ｡tica de nuestra ciudad totalmente reformado.

La viviend...";36.688172;-6.1455092;cadiz
236.000 竄ｬ;Piso en Plaza San Antonio;/comprar/piso-cadiz_capital_centro_historico11001-32542533106_100500/;Centro Histﾃｳrico (Cﾃ｡diz Capital);3 habs.;1 baﾃｱo;94 mﾂｲ;1ﾂｪ planta;"Inmueble con personalidad arrolladora busca con quien crear recuerdos, risas y momentos para la posteridad.

Posibilidades:
-saca ...";36.5336325;-6.2992847;cadiz
74.900 竄ｬ;Piso en Norte;/comprar/piso-jerez_de_la_frontera_norte11405-45068621339_100200/;Norte (Jerez de la Frontera);2 habs.;;70 mﾂｲ;;ﾂ｡Descubre tu nuevo hogar en el corazﾃｳn de la ciudad! Este encantador piso de 70 mﾂｲ, ubicado en la primera planta, es ideal para pa...;36.6777381;-6.1299037;cadiz
210.000 竄ｬ;Piso en calle Valdecarreta;/comprar/piso-zona_playa_virgen_del_mar-43391390135_100500/;Zona Playa Virgen del Mar (Rota);2 habs.;1 baﾃｱo;84 mﾂｲ;1ﾂｪ planta;"ﾂ｡ﾂｿQuieres estrenar piso?! Pues aquﾃｭ te traemos uno espectacular que prﾃ｡cticamente vas a estrenar tﾃｺ!
Se entregﾃｳ como obra nueva el...";36.6268316;-6.3652169;cadiz
135.000 竄ｬ;Piso en Centro;/comprar/piso-centro_zona_noreste-43417669418_100500/;Centro-Zona Noreste (Chipiona);1 hab.;1 baﾃｱo;38 mﾂｲ;Bajo;Od819. ﾂ｡Descubre tu nuevo hogar! Te presentamos este acogedor apartamento en planta baja, ideal para quienes buscan comodidad, acc...;36.7355907;-6.4313129;cadiz
1.250.000 竄ｬ;Chalet en Vistahermosa;/comprar/chalet-el_puerto_de_santa_maria_vistahermosa-42556459120_100500/;Vistahermosa (El Puerto de Santa Marﾃｭa);5 habs.;5 baﾃｱos;399 mﾂｲ;;"Gran chalet independiente en vistahermosa.

Situado en la parte baja de vistahermosa, prﾃｳximo al club del buzo y del campo de golf...";36.5919304;-6.2637366;cadiz
270.000 竄ｬ;ﾃ》ico en Centro;/comprar/atico-el_mentidero_teatro_falla_alameda11003-43352040028_100500/;El Mentidero-Teatro Falla-Alameda (Cﾃ｡diz Capital);2 habs.;1 baﾃｱo;121 mﾂｲ;;"Inmonline cadiz - real estate presenta este fantﾃ｡stico ﾃ｡tico con vistas despejadas a la plaza de san antonio.

Se trata de una cua...";36.5343844;-6.2991001;cadiz
76.000 竄ｬ;Piso en Oeste;/comprar/piso-jerez_de_la_frontera_oeste11407-44243244306_100200/;Oeste (Jerez de la Frontera);3 habs.;1 baﾃｱo;80 mﾂｲ;;"Piso en zona oeste.
Reformado, ﾂ｡ Listo para entrar a vivir !
Estupendo piso ubicado en planta baja, se compone de 3 amplios dormit...";36.6969951;-6.143757;cadiz
329.000 竄ｬ;Casa en Centro;/comprar/casa-jerez_de_la_frontera_centro11402-45839122295_101800/;Centro (Jerez de la Frontera);15 habs.;7 baﾃｱos;480 mﾂｲ;;"Se vende; ﾂ｡ﾂ｡ﾂ｡Atencion inversores!!! Casa del aﾃｱo 1920 en pleno centro de la ciudad junto a plaza de las angustias y calle medina, ...";36.6820011;-6.1327084;cadiz
238.000 竄ｬ;ﾃ》ico en Oratorio San Felipe Neri;/comprar/atico-el_mentidero_teatro_falla_alameda11003-43387060412_100500/;El Mentidero-Teatro Falla-Alameda (Cﾃ｡diz Capital);3 habs.;;90 mﾂｲ;;"Envidiable ﾃ｡tico en pleno corazﾃｳn del centro histﾃｳrico gaditano.  

Destacable:
- terraza cubierta y acondicionada totalmente priv...";36.5326813;-6.3002936;cadiz
4.750.000 竄ｬ;Chalet en Sotogrande Alto;/comprar/chalet-puente_mayorga_campamento11314-15892620590_102100/;Puente Mayorga-Campamento (San Roque);5 habs.;7 baﾃｱos;720 mﾂｲ;;Oportunidad de vivir en un entorno incomparable. Rodeado del parque nacional los alcornocales, los mejores campos de golf del sur ...;36.2042556;-5.4099012;cadiz
243.900 竄ｬ;Chalet en Villanueva Golf;/comprar/chalet-puerto_real_centro_urbano-45086674643_100500/;Puerto Real;4 habs.;3 baﾃｱos;133 mﾂｲ;;"Se vende chalet de 123 mﾂｲ en una parcela de 354 mﾂｲ junto al campo de gofl.
La vivienda se distribuye en hall de entrada, cocina de...";36.504014469;-6.142929716;cadiz
650.000 竄ｬ;Chalet en San Garcﾃｭa-Getares;/comprar/chalet-san_garcia_getares-45009218652_500832/;San Garcﾃｭa-Getares (Algeciras);5 habs.;3 baﾃｱos;386 mﾂｲ;;Se vende chalet en la zona de san garcia (algeciras) de una sola planta con 5 dormitorios, salon-comedor, cocina, 3 baﾃｱos, 2 porch...;36.1052858;-5.4377428;cadiz
270.000 竄ｬ;Piso en calle Real, 232;/comprar/piso-andalucia_la_ardila-4543967454_109700/;Andalucﾃｭa-La Ardila (San Fernando);;;;1ﾂｪ planta;Portal 1, 1ﾂｺ C. Piso en una finca de obra nueva y emplazado en la zona de San Fernando, posicionado en planta 1.. Cuenta como extras ascensor, garaje.;36,4560157;-6,2097137;cadiz
420.000 竄ｬ;Piso en Avenida Cuatro de Diciembre de 1977;/comprar/piso-cadiz_capital_centro_historico11006-40882841329_100500/;Centro Histﾃｳrico (Cﾃ｡diz Capital);4 habs.;2 baﾃｱos;142 mﾂｲ;8ﾂｪ planta;Presentamos en exclusiva, este piso, en el centro de cadiz, con vistas de pajaro, al puerto gaditano desde el salon y varias habit...;36.5323;-6.29322;cadiz
134.900 竄ｬ;Piso en calle del Sol, 54;/comprar/piso-centro_san_felipe_huerta_fava-31739536452_106000/;Centro-San Felipe-Huerta Fava (La Lﾃｭnea de la Concepciﾃｳn);2 habs.;1 baﾃｱo;Mﾃ｡s de 20;;Obra nueva en el centro de la linea.  Tiene una ubicacion privilegiada. En pleno centro de la linea, a escasos pasos de la plaza d...;36.1626;-5.35152;cadiz
180.000 竄ｬ;Casa en Este;/comprar/casa-este11406-5062633349_101800/;Este (Jerez de la Frontera);4 habs.;2 baﾃｱos;180 mﾂｲ;;"Se vende; maravillosa casa de dos plantas, 90m cada planta, junto a la universidad con muchas posibilidades, rodeada de todo tipo ...";36.6832074;-6.1133383;cadiz
87.000 竄ｬ;Piso en Zona Oeste;/comprar/piso-jerez_de_la_frontera_oeste11404-45851599170_108900/;Oeste (Jerez de la Frontera);4 habs.;1 baﾃｱo;87 mﾂｲ;;"Piso en jerez de la frontera, zona oeste, los naranjos, la vivienda&nbsp; consta&nbsp; de 4 habitaciones, 1 cuarto de baﾃｱo, salﾃｳn ...";36.6927068;-6.1471398;cadiz
210.000 竄ｬ;Casa rﾃｺstica en Pinar de los Franceses-El Marquesado;/comprar/casa_rustica-pinar_de_los_franceses_el_marquesado11138-41749883951_100200/;Pinar de los Franceses-El Marquesado (Chiclana de la Frontera);4 habs.;2 baﾃｱos;155 mﾂｲ;;Vivienda tipo chalet situado en urbanizaciﾃｳn baterﾃｭa colorada en la zona del pinar de los franceses, estupenda ubicaciﾃｳn muy cerca...;36.4536104;-6.1388319;cadiz
125.000 竄ｬ;Piso en Crevillet;/comprar/piso-pinar_alto_crevillet_menesteo-45888929443_104700/;Pinar Alto-Crevillet-Menesteo (El Puerto de Santa Marﾃｭa);3 habs.;1 baﾃｱo;75 mﾂｲ;2ﾂｪ planta;Puerto playa pone a la venta en exclusiva este bonito piso de 3 dormitorios todo exterior muy luminoso en una de las zonas mas dem...;36.5961287;-6.2383894;cadiz
165.000 竄ｬ;Piso en Forestal/Punta Candor/Almadraba;/comprar/piso-bahia_de_la_luz_la_forestal11520-44174227676_108900/;Bahﾃｭa de la Luz-La Forestal (Rota);2 habs.;1 baﾃｱo;79 mﾂｲ;1ﾂｪ planta;"ﾂ｡Corre, corre, no la dejes escapar!

Este piso es maravilloso, situado en una zona muy privilegiada,  te imaginas cansado de viaje...";36.633699185;-6.37326787;cadiz
A consultar;Chalet en calle de Canarias, 13;/comprar/chalet-la_atunara_perianez11315-43383981820_109700/;La Atunara-Periﾃ｡ﾃｱez (La Lﾃｭnea de la Concepciﾃｳn);;;35 mﾂｲ;;Gastos de notarﾃｭa gratis de hasta 500 竄ｬ para escrituras de compraventa desde el 15/07/2024 hasta el 30/09/2024. Oportunidad de inv...;36.1746;-5.33765;cadiz
147.000 竄ｬ;Piso en calle Pozos Dulces;/comprar/piso-el_puerto_de_santa_maria_centro-44176030994_100500/;Centro (El Puerto de Santa Marﾃｭa);3 habs.;1 baﾃｱo;87 mﾂｲ;1ﾂｪ planta;"ﾂ｡ﾂ｡ﾂ｡ﾂ｡ Oportunidad ﾂ｡ﾂ｡ﾂ｡ﾂ｡
En una finca tﾃｭpica andaluza en pleno casco histﾃｳrico  y con entrada bajo soportales se encuentra este piso ...";36.6015253;-6.2210287;cadiz
225.000 竄ｬ;Piso en Avenida de Ponce de Leﾃｳn;/comprar/piso-andalucia_la_ardila-45880241970_516894/;Andalucﾃｭa-La Ardila (San Fernando);3 habs.;2 baﾃｱos;134 mﾂｲ;1ﾂｪ planta;Cadizsur servicios inmobiliarios, les ofrece a la venta ﾃｩsta maravillosa vivienda, ubicada en la avenida ponce de leﾃｳn, junto a la...;36.4571528;-6.2100933;cadiz
235.000 竄ｬ;Casa pareada en La Banda-Campo de Fﾃｺtbol;/comprar/casa_pareada-la_banda_campo_de_futbol-41689713864_100200/;La Banda-Campo de Fﾃｺtbol (Chiclana de la Frontera);1 hab.;2 baﾃｱos;94 mﾂｲ;;Estupenda casa pareada situada en la zona de carretera de medina, muy buena ubicaciﾃｳn rodeada de servicios esenciales tales como s...;36.4151594;-6.1325746;cadiz
450.000 竄ｬ;Piso en Avenida Amﾃｭlcar Barca;/comprar/piso-playa_de_la_victoria11008-40896794326_100500/;Playa de la Victoria (Cﾃ｡diz Capital);4 habs.;2 baﾃｱos;123 mﾂｲ;4ﾂｪ planta;Se vende magnﾃｭfico piso, con garaje y trastero, en pleno paseo marﾃｭtimo de cﾃ｡diz, con vistas frontales al mar. Este luminoso y esp...;36.5143865;-6.2837823;cadiz
