precio;sub_descr;href;ubicacion;habitaciones;banios;mt2;otros;publicado_hace;plataforma;CCAA
1.400€;Málaga, Andalusia;https://rd.clk.thribee.com/id.R1mW1_1y1NhR/origin.1/section.97/section_type.1/country.es/vertical.homes/iuid.3874trovit-web-85d48c649-qqxcl6698180bcffe3/tracking.%7B%22cmp%22%3A%22u%22%7D/what_d.Malaga/type.2/page.12/cookieid.1021396698180bcfc936.27189142/pos.3/;Málaga, Provincia de Málaga;2  habitaciones;2  baños;80  m²;...Málaga, Andalusia, Address available on request Apartment. This 2 bedrooms 2 bathrooms Apartment is for rent on realestate. Com.au by CENTURY...;Hace 1 día;Kuhamia;Malaga
5.200€;Marbella, Andalusia;https://rd.clk.thribee.com/id.81L1bo1H6G1Z/origin.1/section.97/section_type.1/country.es/vertical.homes/iuid.3874trovit-web-85d48c649-qqxcl6698180bcffe3/tracking.%7B%22cmp%22%3A%22u%22%7D/what_d.Malaga/type.2/page.12/cookieid.1021396698180bcfc936.27189142/pos.4/;Marbella, Provincia de Málaga;4  habitaciones;4  baños;310  m²;Details: Details: Marbella, Andalusia, Address available on request Apartment. This 4 bedrooms 4 bathrooms Apartment is for rent on realestate. C...;Hace 1 día;Kuhamia;Malaga
2.750€;Comarca de Málaga, Andalusia;https://rd.clk.thribee.com/id.z1X1J1wab181s/origin.1/section.97/section_type.1/country.es/vertical.homes/iuid.3874trovit-web-85d48c649-qqxcl6698180bcffe3/tracking.%7B%22cmp%22%3A%22u%22%7D/what_d.Malaga/type.2/page.12/cookieid.1021396698180bcfc936.27189142/pos.5/;Málaga, Provincia de Málaga;1  habitaciones;1  baños;382  m²;...Málaga, Andalusia, Address available on request Retail. This 1 bathroom Retail is for rent on realestate. Com.au by Nacho Picatoste Consultor...;Hace 1 día;Kuhamia;Malaga
2.900€;Apartment in Marbella, Costa del Sol;https://rd.clk.thribee.com/id.ZaU1hrCx16/origin.1/section.97/section_type.1/country.es/vertical.homes/iuid.3874trovit-web-85d48c649-qqxcl6698180bcffe3/tracking.%7B%22cmp%22%3A%22u%22%7D/what_d.Malaga/type.2/page.12/cookieid.1021396698180bcfc936.27189142/pos.6/;Marbella, Provincia de Málaga;2  habitaciones;3  baños;144  m²;This magnificent apartment is within a complex that has security, it is located in a very quiet residential area with several restaurants very cl...;Hace 1 día;Kuhamia;Malaga
2.362€;Avenida Arias Maldonado, Marbella, Andalusia;https://rd.clk.thribee.com/id.Bd1v1cC161EW/origin.1/section.97/section_type.1/country.es/vertical.homes/iuid.3874trovit-web-85d48c649-qqxcl6698180bcffe3/tracking.%7B%22cmp%22%3A%22u%22%7D/what_d.Malaga/type.2/page.12/cookieid.1021396698180bcfc936.27189142/pos.7/;Marbella, Provincia de Málaga;1  habitaciones;1  baños;35  m²;Details: This studio is fully equipped with everything you need for your stay. It has two single beds, and the living room with a comfortable sof...;Hace 1 día;Kuhamia;Malaga
1.250€;Málaga, Andalusia;https://rd.clk.thribee.com/id.aEwH1c1Knb/origin.1/section.97/section_type.1/country.es/vertical.homes/iuid.3874trovit-web-85d48c649-qqxcl6698180bcffe3/tracking.%7B%22cmp%22%3A%22u%22%7D/what_d.Malaga/type.2/page.12/cookieid.1021396698180bcfc936.27189142/pos.8/;Málaga, Provincia de Málaga;1  habitaciones;1  baños;96  m²;...Málaga, Andalusia, Address available on request Apartment. This 1 bedroom 1 bathroom Apartment is for rent on realestate. Com.au by CENTURY...;Hace 1 día;Kuhamia;Malaga
3.500€;Marbella, Andalusia;https://rd.clk.thribee.com/id.T1bV17mK1R1x/origin.1/section.97/section_type.1/country.es/vertical.homes/iuid.3874trovit-web-85d48c649-qqxcl6698180bcffe3/tracking.%7B%22cmp%22%3A%22u%22%7D/what_d.Malaga/type.2/page.12/cookieid.1021396698180bcfc936.27189142/pos.9/;Marbella, Provincia de Málaga;2  habitaciones;2  baños;124  m²;Details: Beach side apartment in Marbella center for short term rent. This apartment is located in a gated community with an exceptional location...;Hace 1 día;Kuhamia;Malaga
1.286€;Calle Levante, Torre del Mar, Andalusia;https://rd.clk.thribee.com/id.1oc9yIppE/origin.1/section.97/section_type.1/country.es/vertical.homes/iuid.3874trovit-web-85d48c649-qqxcl6698180bcffe3/tracking.%7B%22cmp%22%3A%22u%22%7D/what_d.Malaga/type.2/page.12/cookieid.1021396698180bcfc936.27189142/pos.10/;Torre del Mar, Vélez-Málaga, Provincia de Málaga;2  habitaciones;1  baños;70  m²;Details: This amazing apartment gives you an exceptional location, directly on the beach, so you can soak in the sea breeze and enjoy the spectac...;Hace 2 días;Kuhamia;Malaga
3.900€;Marbella, Andalusia;https://rd.clk.thribee.com/id.z_X1dfn6P/origin.1/section.97/section_type.1/country.es/vertical.homes/iuid.3874trovit-web-85d48c649-qqxcl6698180bcffe3/tracking.%7B%22cmp%22%3A%22u%22%7D/what_d.Malaga/type.2/page.12/cookieid.1021396698180bcfc936.27189142/pos.11/;Marbella, Provincia de Málaga;2  habitaciones;2  baños;125  m²;Details: Newly redecorated luxury apartment in a complex located next to the beach just 50 metres from the Paseo Marítimo. The decoration is exqu...;Hace 2 días;Kuhamia;Malaga
1.500€;Calle Mar Cantabrico, Torre del Mar, Andalusia;https://rd.clk.thribee.com/id.121i1Qf1t1R1g17/origin.1/section.97/section_type.1/country.es/vertical.homes/iuid.3874trovit-web-85d48c649-qqxcl6698180bcffe3/tracking.%7B%22cmp%22%3A%22u%22%7D/what_d.Malaga/type.2/page.12/cookieid.1021396698180bcfc936.27189142/pos.12/;Torre del Mar, Vélez-Málaga, Provincia de Málaga;2  habitaciones;2  baños;70  m²;Details: We offer you an apartment located in the new area of Torre del Mar, in a recently built building. Everything is designed for your comfor...;Hace 2 días;Kuhamia;Malaga
4.500€;Estepona, Andalusia;https://rd.clk.thribee.com/id.glGd1YXT1f/origin.1/section.97/section_type.1/country.es/vertical.homes/iuid.3874trovit-web-85d48c649-qqxcl6698180bcffe3/tracking.%7B%22cmp%22%3A%22u%22%7D/what_d.Malaga/type.2/page.12/cookieid.1021396698180bcfc936.27189142/pos.13/;Estepona, Provincia de Málaga;3  habitaciones;2  baños;111  m²;Details: Apartment Rentals for 6 months available now (including the summer months) Discover this excellent middle floor apartment in Cancelada,...;Hace 2 días;Kuhamia;Malaga
1.615€;Avenida Juan Sebastián Elcano, Málaga, Andalusia;https://rd.clk.thribee.com/id.w1xs121vn-Y/origin.1/section.97/section_type.1/country.es/vertical.homes/iuid.3874trovit-web-85d48c649-qqxcl6698180bcffe3/tracking.%7B%22cmp%22%3A%22u%22%7D/what_d.Malaga/type.2/page.12/cookieid.1021396698180bcfc936.27189142/pos.14/;Málaga, Provincia de Málaga;1  habitaciones;1  baños;-;...Avenida Juan Sebastián Elcano, Málaga, Andalusia Apartment. This 1 bedroom 1 bathroom Apartment is for rent on realestate. Com.au by Homelike...;Hace 2 días;Kuhamia;Malaga
2.700€;Málaga, Andalusia;https://rd.clk.thribee.com/id.A21618P1k1ZN/origin.1/section.97/section_type.1/country.es/vertical.homes/iuid.3874trovit-web-85d48c649-qqxcl6698180bcffe3/tracking.%7B%22cmp%22%3A%22u%22%7D/what_d.Malaga/type.2/page.12/cookieid.1021396698180bcfc936.27189142/pos.15/;Málaga, Provincia de Málaga;3  habitaciones;4  baños;185  m²;...Málaga, Andalusia, Address available on request House. This 3 bedrooms 4 bathrooms House is for rent on realestate. Com.au by century 21 blue...;Hace 2 días;Kuhamia;Malaga
3.000€;Chalet Independiente en alquiler en Málaga Este – Málaga | Gilmar;https://rd.clk.thribee.com/id.z6pOq1w5i/origin.1/section.97/section_type.1/country.es/vertical.homes/iuid.3874trovit-web-85d48c649-qqxcl6698180bcffe3/tracking.%7B%22cmp%22%3A%22u%22%7D/what_d.Malaga/type.2/page.12/cookieid.1021396698180bcfc936.27189142/pos.16/;Este, Málaga, Provincia de Málaga;2  habitaciones;1  baños;100  m²;Gilmar Consulting inmobiliario Málaga presenta en alquiler de temporada de septiembre a junio este chalet ubicado en el exclusivo barrio de...;Hace 2 días;Kuhamia;Malaga
5.100€;Marbella, Andalusia;https://rd.clk.thribee.com/id.1q1QB1vDE1Fo/origin.1/section.97/section_type.1/country.es/vertical.homes/iuid.3874trovit-web-85d48c649-qqxcl6698180bcffe3/tracking.%7B%22cmp%22%3A%22u%22%7D/what_d.Malaga/type.2/page.12/cookieid.1021396698180bcfc936.27189142/pos.17/;Marbella, Provincia de Málaga;2  habitaciones;2  baños;100  m²;Details: Frontline beach apartment in Marina Mariola available for short term rentals in Marbella, located in one of the most luxurious complexes...;Hace 2 días;Kuhamia;Malaga
8.147€;House in Campo Mijas, Costa del Sol;https://rd.clk.thribee.com/id.1y1Ow1p1nev15/origin.1/section.97/section_type.1/country.es/vertical.homes/iuid.3874trovit-web-85d48c649-qqxcl6698180bcffe3/tracking.%7B%22cmp%22%3A%22u%22%7D/what_d.Malaga/type.2/page.12/cookieid.1021396698180bcfc936.27189142/pos.18/;29649, Mijas, Provincia de Málaga;1  habitaciones;1  baños;115  m²;...malaga. This villa offers a unique blend of luxury, privacy, and natural beauty, making it an ideal home for those looking to escape the...;Hace 2 días;Rentola;Malaga
1.500€;Avenida Andasol, Marbella, Andalusia;https://rd.clk.thribee.com/id.1mp1Y17D1kY1R/origin.1/section.97/section_type.1/country.es/vertical.homes/iuid.3874trovit-web-85d48c649-qqxcl6698180bcffe3/tracking.%7B%22cmp%22%3A%22u%22%7D/what_d.Malaga/type.2/page.12/cookieid.1021396698180bcfc936.27189142/pos.19/;Marbella, Provincia de Málaga;2  habitaciones;2  baños;80  m²;Details: The apartment itself is spacious and cozy, with two bedrooms that offer you a perfect resting space. One of the bedrooms has a 135 cm be...;Hace 2 días;Kuhamia;Malaga
2.700€;Malaga, Andalusia;https://rd.clk.thribee.com/id.e51v1F1nI1yn/origin.1/section.97/section_type.1/country.es/vertical.homes/iuid.3874trovit-web-85d48c649-qqxcl6698180bcffe3/tracking.%7B%22cmp%22%3A%22u%22%7D/what_d.Malaga/type.2/page.12/cookieid.1021396698180bcfc936.27189142/pos.20/;Málaga, Provincia de Málaga;2  habitaciones;2  baños;84  m²;Details: Lucas Fox presents AQ Urban Sky, our most innovative and modern option for new build homes in the heart of Malaga, with spectacular...;Hace 2 días;Kuhamia;Malaga
8.000€;Málaga, Andalusia;https://rd.clk.thribee.com/id.1ia8x1t1E1nh/origin.1/section.97/section_type.1/country.es/vertical.homes/iuid.3874trovit-web-85d48c649-qqxcl6698180bcffe3/tracking.%7B%22cmp%22%3A%22u%22%7D/what_d.Malaga/type.2/page.12/cookieid.1021396698180bcfc936.27189142/pos.21/;Málaga, Provincia de Málaga;5  habitaciones;5  baños;420  m²;Details: 5 bedroom villa in Urbanisation Las Chapas, East of Marbella town. The villa is located some 100 meters from the Alicate Beach. Las Chap...;Hace 2 días;Kuhamia;Malaga
2.500€;Francisco Pizarro, Benahavís, Andalusia;https://rd.clk.thribee.com/id.1s1H1H141b1C1G1Y/origin.1/section.97/section_type.1/country.es/vertical.homes/iuid.3874trovit-web-85d48c649-qqxcl6698180bcffe3/tracking.%7B%22cmp%22%3A%22u%22%7D/what_d.Malaga/type.2/page.12/cookieid.1021396698180bcfc936.27189142/pos.22/;Benahavís, Provincia de Málaga;2  habitaciones;2  baños;80  m²;Details: Total surface area 85 m², flat usable floor area 80 m², single bedrooms: 1, double bedrooms: 1, 2 bathrooms, air conditioning (hot and c...;Hace 2 días;Kuhamia;Malaga
900€;Málaga, Andalusia;https://rd.clk.thribee.com/id.m1X1f1l1xF1d1u/origin.1/section.97/section_type.1/country.es/vertical.homes/iuid.3874trovit-web-85d48c649-qqxcl6698180bcffe3/tracking.%7B%22cmp%22%3A%22u%22%7D/what_d.Malaga/type.2/page.12/cookieid.1021396698180bcfc936.27189142/pos.23/;Málaga, Provincia de Málaga;1  habitaciones;1  baños;90  m²;...Málaga, Andalusia, Address available on request Retail. This 1 bathroom Retail is for rent on realestate. Com.au by CENTURY 21 Turquesa...;Hace 2 días;Kuhamia;Malaga
2.500€;Marbella, Andalusia;https://rd.clk.thribee.com/id.Bf1g1x_3hU/origin.1/section.97/section_type.1/country.es/vertical.homes/iuid.3874trovit-web-85d48c649-qqxcl6698180bcffe3/tracking.%7B%22cmp%22%3A%22u%22%7D/what_d.Malaga/type.2/page.12/cookieid.1021396698180bcfc936.27189142/pos.24/;Marbella, Provincia de Málaga;2  habitaciones;2  baños;120  m²;Details: Welcome to this long-term rental apartment, located in one of the most exclusive and sought-after neighborhoods of Puerto Banús/Nueva An...;Hace 2 días;Kuhamia;Malaga
3.200€;Málaga, Andalusia;https://rd.clk.thribee.com/id.1yo1X11nn1bR/origin.1/section.97/section_type.1/country.es/vertical.homes/iuid.3874trovit-web-85d48c649-qqxcl6698180bcffe3/tracking.%7B%22cmp%22%3A%22u%22%7D/what_d.Malaga/type.2/page.12/cookieid.1021396698180bcfc936.27189142/pos.25/;Málaga, Provincia de Málaga;6  habitaciones;4  baños;200  m²;...Málaga, Andalusia, Address available on request House. This 6 bedrooms 4 bathrooms House is for rent on realestate. Com.au by CENTURY 21...;Hace 2 días;Kuhamia;Malaga
2.700€;Apartment For Rent in San Pedro De Alcántara, Marbella;https://rd.clk.thribee.com/id.JOI18b14-1n/origin.1/section.97/section_type.1/country.es/vertical.homes/iuid.211477trovit-web-85d48c649-kfs546698181161ee5/tracking.%7B%22cmp%22%3A%22u%22%7D/what_d.Malaga/type.2/page.20/cookieid.10212046698181161aa32.70920296/pos.1/;29670, Marbella, Provincia de Málaga;3  habitaciones;2  baños;94  m²;Modern beachside 3 bedroom middle for apartment with a private terrace in San Pedro de Alcantara, Marbella. Modern and comfortable, the apartment...;Hace 5 días;Rentola;Malaga
450€;3 dormitorio, Ronda 1ES79033-;https://rd.clk.thribee.com/id.WH1iE1c1x1RY/origin.1/section.232/section_type.2/country.es/vertical.homes/iuid.211477trovit-web-85d48c649-kfs546698181161ee5/tracking.%7B%22cmp%22%3A%22u%22%7D/what_d.Malaga/type.2/page.20/cookieid.10212046698181161aa32.70920296/pos.1/;Ronda, Provincia de Málaga;3 habitaciones;-;-;TRV79033---. Esta casa se encuentra en Ronda Ronda. Tiene 3 dormitorios, 0 baño. Esta 3 dormitorio apartamentos en Ronda Ronda es para alquilar p...;Hace 1 día;Listanza;Malaga
14.000€;5 dormitorio, Marbella 1ES79017-;https://rd.clk.thribee.com/id.s1jJ1h1ay1q_/origin.1/section.232/section_type.2/country.es/vertical.homes/iuid.211477trovit-web-85d48c649-kfs546698181161ee5/tracking.%7B%22cmp%22%3A%22u%22%7D/what_d.Malaga/type.2/page.20/cookieid.10212046698181161aa32.70920296/pos.2/;Marbella, Provincia de Málaga;5 habitaciones;6 baños;-;TRV79017---. Esta casa se encuentra en Marbella Marbella. Tiene 5 dormitorios, 6 baños. Esta 5 dormitorio Villa en Marbella Marbella es para alqu...;Hace 1 día;Listanza;Malaga
2.260€;Avenida de Velázquez, Malaga - Amsterdam Apartments for Rent;https://rd.clk.thribee.com/id.o1m1q1pt1i1G10/origin.1/section.97/section_type.1/country.es/vertical.homes/iuid.211477trovit-web-85d48c649-kfs546698181161ee5/tracking.%7B%22cmp%22%3A%22u%22%7D/what_d.Malaga/type.2/page.20/cookieid.10212046698181161aa32.70920296/pos.2/;29004, Provincia de Málaga;1  habitaciones;1  baños;377  m²;"Globo Málaga studio close to the airport and beach. (Available From: Now) (""License/registration number: VFT/MA/14479"") Welcome to our...";Hace 5 días;Rentola;Malaga
3.648€;Thyssen Boutique Apartment 1C;https://rd.clk.thribee.com/id.c1E1z1t15O61S/origin.1/section.97/section_type.1/country.es/vertical.homes/iuid.211477trovit-web-85d48c649-kfs546698181161ee5/tracking.%7B%22cmp%22%3A%22u%22%7D/what_d.Malaga/type.2/page.20/cookieid.10212046698181161aa32.70920296/pos.3/;29015, Provincia de Málaga;1  habitaciones;1  baños;55  m²;This picturesque building is located in the heart of the city, right in front of one of the main museums in the city: Museo Carmen Thyssen, where...;Hace 5 días;Rentola;Malaga
16.000€;Authentic and spacious villa with incredible sea view for rent in El Madroñal, Benahavis;https://rd.clk.thribee.com/id.181z1Y1O1-M1U8/origin.1/section.97/section_type.1/country.es/vertical.homes/iuid.211477trovit-web-85d48c649-kfs546698181161ee5/tracking.%7B%22cmp%22%3A%22u%22%7D/what_d.Malaga/type.2/page.20/cookieid.10212046698181161aa32.70920296/pos.4/;29660,;7  habitaciones;7  baños;900  m²;Immerse yourself in the epitome of luxury with this magnificent villa nestled in the esteemed El Madroñal area of Benahavis, Malaga. Spread...;Hace 5 días;Rentola;Malaga
3.100€;Apartamento Planta Baja;https://rd.clk.thribee.com/id.Yw1n4o1-81M/origin.1/section.97/section_type.1/country.es/vertical.homes/iuid.211477trovit-web-85d48c649-kfs546698181161ee5/tracking.%7B%22cmp%22%3A%22u%22%7D/what_d.Malaga/type.2/page.20/cookieid.10212046698181161aa32.70920296/pos.5/;29601, Provincia de Málaga;3  habitaciones;3  baños;146  m²;Apartamento Planta Baja, Marbella, Costa del Sol. 3 Dormitorios, 3 Baños, Construidos 146 m², Terraza 30 m². Posición: Cerca de Golf, Cerca del M...;Hace 5 días;Rentola;Malaga
15.000€;Exclusiva Villa / Chalet en alquiler The Golden Mile, Marbella, Andalucía;https://rd.clk.thribee.com/id.Yw1U71Jvk1n/origin.1/section.97/section_type.1/country.es/vertical.homes/iuid.211477trovit-web-85d48c649-kfs546698181161ee5/tracking.%7B%22cmp%22%3A%22u%22%7D/what_d.Malaga/type.2/page.20/cookieid.10212046698181161aa32.70920296/pos.6/;28013,;5  habitaciones;5  baños;578  m²;...villa Las Lomas se encuentra en la prestigiosa zona de Las Lomas del Marbella Club, en la codiciada Milla de Oro de Marbella, Málaga...;Hace 5 días;LuxuryEstate;Malaga
25.000€;Villa / Chalet de lujo en alquiler Marbella, España;https://rd.clk.thribee.com/id.1Z1B1c1T1_1Ttn/origin.1/section.97/section_type.1/country.es/vertical.homes/iuid.211477trovit-web-85d48c649-kfs546698181161ee5/tracking.%7B%22cmp%22%3A%22u%22%7D/what_d.Malaga/type.2/page.20/cookieid.10212046698181161aa32.70920296/pos.7/;Marbella, Provincia de Málaga;5  habitaciones;5  baños;578  m²;...villa Las Lomas se encuentra en la prestigiosa zona de Las Lomas del Marbella Club, en la codiciada Milla de Oro de Marbella, Málaga...;Hace 5 días;LuxuryEstate;Malaga
6.000€;Apartamento Planta Media;https://rd.clk.thribee.com/id.1X1c1WpN4q1D/origin.1/section.97/section_type.1/country.es/vertical.homes/iuid.211477trovit-web-85d48c649-kfs546698181161ee5/tracking.%7B%22cmp%22%3A%22u%22%7D/what_d.Malaga/type.2/page.20/cookieid.10212046698181161aa32.70920296/pos.8/;29680, Provincia de Málaga;3  habitaciones;3  baños;127  m²;Doncella Beach, primera linea del mar uno de los complejos mas exclusivos de la zona de Estepona, a solo unos minutos a pie del puerto deportivo,...;Hace 5 días;Rentola;Malaga
3.000€;Penthouse in San Pedro de Alcántara;https://rd.clk.thribee.com/id.1x1Z1N1ALDIE/origin.1/section.97/section_type.1/country.es/vertical.homes/iuid.211477trovit-web-85d48c649-kfs546698181161ee5/tracking.%7B%22cmp%22%3A%22u%22%7D/what_d.Malaga/type.2/page.20/cookieid.10212046698181161aa32.70920296/pos.9/;29670, Marbella, Provincia de Málaga;3  habitaciones;3  baños;188  m²;Amazing 3 bedroom 3 bath duplex penthouse in an very upscale ara in Marbella walking distance to the seacomes with two large garage spacesand sto...;Hace 5 días;Rentola;Malaga
13.800€;Apartamento Planta Baja;https://rd.clk.thribee.com/id.1ov155A1N1RN/origin.1/section.97/section_type.1/country.es/vertical.homes/iuid.211477trovit-web-85d48c649-kfs546698181161ee5/tracking.%7B%22cmp%22%3A%22u%22%7D/what_d.Malaga/type.2/page.20/cookieid.10212046698181161aa32.70920296/pos.10/;29660, Provincia de Málaga;3  habitaciones;3  baños;260  m²;"Apartamento en Laguna de Banús, Marbella, Costa del Sol. 3 Dormitorios, 3 Baños, Construidos 260м2;, Terraza 50 м2;, Jardín/Terreno 100 m2; casa...";Hace 5 días;Rentola;Malaga
3.000€;Apartamento Planta Media;https://rd.clk.thribee.com/id.1C1AoGS1ioP/origin.1/section.97/section_type.1/country.es/vertical.homes/iuid.211477trovit-web-85d48c649-kfs546698181161ee5/tracking.%7B%22cmp%22%3A%22u%22%7D/what_d.Malaga/type.2/page.20/cookieid.10212046698181161aa32.70920296/pos.11/;29679, Provincia de Málaga;3  habitaciones;2  baños;111  m²;Apartamento Planta Media, Benahavís, Costa del Sol. 3 Dormitorios, 2 Baños, Construidos 111 m², Terraza 30 m². Posición: Cerca de Tiendas, Cerca...;Hace 5 días;Rentola;Malaga
1.200€;Chalet en alquiler en Cútar;https://rd.clk.thribee.com/id.sza1cq1p1JZ/origin.1/section.97/section_type.1/country.es/vertical.homes/iuid.211477trovit-web-85d48c649-kfs546698181161ee5/tracking.%7B%22cmp%22%3A%22u%22%7D/what_d.Malaga/type.2/page.20/cookieid.10212046698181161aa32.70920296/pos.12/;Cútar, Provincia de Málaga;3  habitaciones;1  baños;-;Bienvenido a tu refugio perfecto en plena naturaleza, ubicado en la apacible zona de La Axarquía. Esta encantadora casa rural es el lugar ideal p...;Hace 5 días;Todopisos;Malaga
1.400€;Chalet en alquiler en Cútar;https://rd.clk.thribee.com/id.jIdzf1J1b1X/origin.1/section.97/section_type.1/country.es/vertical.homes/iuid.211477trovit-web-85d48c649-kfs546698181161ee5/tracking.%7B%22cmp%22%3A%22u%22%7D/what_d.Malaga/type.2/page.20/cookieid.10212046698181161aa32.70920296/pos.13/;Cútar, Provincia de Málaga;3  habitaciones;2  baños;-;Descubre la serenidad y el encanto de nuestra casa rural en alquiler para larga temporada, ubicada en la apacible zona de La Axarquía. Esta villa...;Hace 5 días;Todopisos;Malaga
2.433€;Calle Lagunillas, Malaga - Amsterdam Apartments for Rent;https://rd.clk.thribee.com/id.1gf91H1R1Pi1P/origin.1/section.97/section_type.1/country.es/vertical.homes/iuid.211477trovit-web-85d48c649-kfs546698181161ee5/tracking.%7B%22cmp%22%3A%22u%22%7D/what_d.Malaga/type.2/page.20/cookieid.10212046698181161aa32.70920296/pos.14/;29012, Provincia de Málaga;2  habitaciones;1  baños;603  m²;...Malaga, this apartment puts you in the epicenter of urban life, with access to a wide range of services, shops, restaurants and cultural...;Hace 5 días;Rentola;Malaga
1.974€;1 bedroom apartment in Lagunillas;https://rd.clk.thribee.com/id.u1H1s1p1M1ZHM/origin.1/section.97/section_type.1/country.es/vertical.homes/iuid.211477trovit-web-85d48c649-kfs546698181161ee5/tracking.%7B%22cmp%22%3A%22u%22%7D/what_d.Malaga/type.2/page.20/cookieid.10212046698181161aa32.70920296/pos.15/;29012, Provincia de Málaga;3  habitaciones;1  baños;58  m²;...Malaga is within your reach, offering an experience that goes beyond simple accommodation. *After your reservation has been made, you can...;Hace 5 días;Rentola;Malaga
2.433€;2 bedroom apartment in Lagunillas;https://rd.clk.thribee.com/id.U1va1YWHL1o/origin.1/section.97/section_type.1/country.es/vertical.homes/iuid.211477trovit-web-85d48c649-kfs546698181161ee5/tracking.%7B%22cmp%22%3A%22u%22%7D/what_d.Malaga/type.2/page.20/cookieid.10212046698181161aa32.70920296/pos.16/;29012, Provincia de Málaga;4  habitaciones;1  baños;56  m²;...Malaga, this apartment puts you in the epicenter of urban life, with access to a wide range of services, shops, restaurants and cultural...;Hace 5 días;Rentola;Malaga
1.974€;Calle Lagunillas, Malaga - Amsterdam Apartments for Rent;https://rd.clk.thribee.com/id.1Q111Jk1j1H1mm/origin.1/section.97/section_type.1/country.es/vertical.homes/iuid.211477trovit-web-85d48c649-kfs546698181161ee5/tracking.%7B%22cmp%22%3A%22u%22%7D/what_d.Malaga/type.2/page.20/cookieid.10212046698181161aa32.70920296/pos.17/;29012, Provincia de Málaga;1  habitaciones;-;657  m²;...Malaga is within your reach, offering an experience that goes beyond simple accommodation. Hairdryer. Heating. Towels and sheets. Air...;Hace 5 días;Rentola;Malaga
900€;Charming two-bedroom apartment in Burriana;https://rd.clk.thribee.com/id.1qd1n1Qe1u10x/origin.1/section.97/section_type.1/country.es/vertical.homes/iuid.211477trovit-web-85d48c649-kfs546698181161ee5/tracking.%7B%22cmp%22%3A%22u%22%7D/what_d.Malaga/type.2/page.20/cookieid.10212046698181161aa32.70920296/pos.18/;29780, Nerja, Provincia de Málaga;2  habitaciones;1  baños;40  m²;We offer a shuttle service upon request, from the airport to the accommodation, to make your arrival even more comfortable. Please note that due...;Hace 5 días;Rentola;Malaga
13.800€;Apartment in Puerto Banús, Costa del Sol;https://rd.clk.thribee.com/id.101CqT18k1h-/origin.1/section.97/section_type.1/country.es/vertical.homes/iuid.211477trovit-web-85d48c649-kfs546698181161ee5/tracking.%7B%22cmp%22%3A%22u%22%7D/what_d.Malaga/type.2/page.20/cookieid.10212046698181161aa32.70920296/pos.19/;29660,;3  habitaciones;3  baños;260  m²;"Penthouse, puerto banús, costa del sol. 3 bedrooms, 3 bathrooms, built 260 m2;, terrace 50 m2;, garden/plot 100 m2; setting: beachfront, town, co...";Hace 5 días;Rentola;Malaga
2.433€;Calle Lagunillas, Malaga - Amsterdam Apartments for Rent;https://rd.clk.thribee.com/id.13l1g1J1M1Ha1I/origin.1/section.97/section_type.1/country.es/vertical.homes/iuid.211477trovit-web-85d48c649-kfs546698181161ee5/tracking.%7B%22cmp%22%3A%22u%22%7D/what_d.Malaga/type.2/page.20/cookieid.10212046698181161aa32.70920296/pos.20/;29012, Provincia de Málaga;2  habitaciones;1  baños;624  m²;...Malaga, this apartment puts you in the epicenter of urban life, with access to a wide range of services, shops, restaurants and cultural...;Hace 5 días;Rentola;Malaga
4.448€;Malaga - Amsterdam Apartments for Rent;https://rd.clk.thribee.com/id.1Eg1_1wB1J1L5/origin.1/section.97/section_type.1/country.es/vertical.homes/iuid.211477trovit-web-85d48c649-kfs546698181161ee5/tracking.%7B%22cmp%22%3A%22u%22%7D/what_d.Malaga/type.2/page.20/cookieid.10212046698181161aa32.70920296/pos.21/;29001, Provincia de Málaga;2  habitaciones;-;840  m²;Beautiful 2 bedroom apartment (Available From) Why not enjoy the city, walk, taste the local cuisine and get to know the Port of Malaga, in an...;Hace 5 días;Rentola;Malaga
