precio;sub_descr;href;ubicacion;habitaciones;banios;mt2;planta;otros;latitude;longitude;CCAA
260.000 竄ｬ;;/comprar/piso-san_jose_varela_la_laguna11010-44199159968_525281/;San Josﾃｩ-Varela-La Laguna (Cﾃ｡diz Capital);3 habs.;1 baﾃｱo;70 mﾂｲ;2ﾂｪ planta;Luxury pm inmobiliaria,  les presenta en exclusividad, magnifico piso en zona la laguna, la vivienda consta de salﾃｳn muy cﾃｳmodo, s...;36.5012172;-6.2738098;cadiz
147.000 竄ｬ;;/comprar/piso-el_puerto_de_santa_maria_centro-44176030994_100500/;Centro (El Puerto de Santa Marﾃｭa);3 habs.;1 baﾃｱo;87 mﾂｲ;1ﾂｪ planta;"ﾂ｡ﾂ｡ﾂ｡ﾂ｡ Oportunidad ﾂ｡ﾂ｡ﾂ｡ﾂ｡
En una finca tﾃｭpica andaluza en pleno casco histﾃｳrico  y con entrada bajo soportales se encuentra este piso ...";36.6015253;-6.2210287;cadiz
85.000 竄ｬ;;/comprar/casa_adosada-los_barrios_centro_urbano-45878869461_100500/;Los Barrios;1 hab.;1 baﾃｱo;70 mﾂｲ;;"ﾂ｡Casa adosada en el centro!

La vivienda se distribuye de la siguiente forma:

Planta baja:

-salﾃｳn luminoso.
-cocina independient...";36.1866131;-5.4894996;cadiz
295.000 竄ｬ;Piso en calle Real, 232;/comprar/piso-andalucia_la_ardila-4566154165_109700/;Andalucﾃｭa-La Ardila (San Fernando);;;;3ﾂｪ planta;Portal 2, 3ﾂｺ B. Piso en una finca de obra nueva y emplazado en la zona de San Fernando, posicionado en planta 3.. Cuenta como extras ascensor, garaje.;36,4560157;-6,2097137;cadiz
A consultar;;/comprar/atico-centro_historico_la_costilla-12545855888_501368/;Centro Histﾃｳrico-La Costilla (Rota);1 hab.;1 baﾃｱo;55 mﾂｲ;;Atento todos los que tengﾃ｡is un piso en el centro de sevilla o kansas city 28 de unos 2 dormitorios con ascensor, unos 60mﾂｲ y plaz...;36.618821294;-6.360880641;cadiz
152.990 竄ｬ;;/comprar/casa-san_bernabe11204-45839821001_525987/;San Bernabﾃｩ (Algeciras);3 habs.;3 baﾃｱos;110 mﾂｲ;;"Vivienda san bernabﾃｩ 152.990 euros
Casa en buen estado en san bernabﾃｩ, de mas de 100 mﾂｲ, incluido garaje. La planta baja cuenta co...";36.1389368;-5.4650928;cadiz
199.000 竄ｬ;;/comprar/piso-noreste11405-41738014713_517119/;Noreste (Jerez de la Frontera);3 habs.;2 baﾃｱos;109 mﾂｲ;2ﾂｪ planta;Piso en residencial, vivienda de tres dormitorios convertidos en dos, salﾃｳn comedor, terraza, cocina amueblada con electrodomﾃｩstic...;36.691446;-6.1096614;cadiz
325.000 竄ｬ;;/comprar/chalet-arcos_de_la_frontera_centro_urbano-31748574366_103800/;Arcos de la Frontera;2 habs.;1 baﾃｱo;136 mﾂｲ;;Te ofrecemos este chalet en una de las sierras mﾃ｡s bonitas y con mﾃ｡s encanto de la zona de cﾃ｡diz. Se encuentra situada en arcos de...;36.7642869;-5.7753329;cadiz
450.000 竄ｬ;;/comprar/chalet-pinar_de_los_franceses_el_marquesado11138-43400749392_516977/;Pinar de los Franceses-El Marquesado (Chiclana de la Frontera);9 habs.;4 baﾃｱos;;;"Esta impresionante villa en chiclana de la frontera se encuentra en la zona de pinar de los franceses-el marquesado. 
Perfectament...";36.465191;-6.1288771;cadiz
65.000 竄ｬ;;/comprar/apartamento-jerez_de_la_frontera_centro11402-43384336387_106700/;Centro (Jerez de la Frontera);1 hab.;1 baﾃｱo;40 mﾂｲ;;ﾂ｡ﾂ｡ﾂ｡Listo para entrar y bajada precio 65.000竄ｬ!!! Ideal inversores - apartemento calle naranjas centro de jerez a 200 metros rotonda...;36.6850177;-6.1365072;cadiz
87.000 竄ｬ;;/comprar/casa_adosada-bajadilla-45092192764_100200/;Bajadilla (Algeciras);2 habs.;;96 mﾂｲ;;ﾂ｡Descubre tu nuevo hogar en esta encantadora casa pareada de 2 plantas con azotea! Situada en una ubicaciﾃｳn privilegiada, esta viv...;36.1331988;-5.4557384;cadiz
152.000 竄ｬ;;/comprar/piso-barbate_centro_urbano-23415094362_106700/;Barbate;2 habs.;1 baﾃｱo;66 mﾂｲ;;La vivienda consta de 50,11mﾂｲ distribuidos en 2 habitaciones, 1 baﾃｱo, salﾃｳn y cocina. Ubicado a escasos metros de la playa, superm...;36.1882265;-5.9204403;cadiz
224.000 竄ｬ;Casa adosada en calle La Hijuela, 98;/comprar/casa_adosada-rural11593-36701446347_100500/;Rural (Jerez de la Frontera);4 habs.;2 baﾃｱos;226 mﾂｲ;;"ﾂ｡Tu nuevo hogar frente a la naturaleza!

Desde umbra inmobiliaria, te presentamos en exclusiva esta excepcional unifamiliar en esq...";36.6819;-6.07185;cadiz
135.000 竄ｬ;;/comprar/apartamento-barrio_alto-44202602942_100500/;Barrio Alto (Sanlﾃｺcar de Barrameda);2 habs.;;65 mﾂｲ;1ﾂｪ planta;Apartamento luminoso, soleado y en una ubicaciﾃｳn privilegiada del barrio alto. Tiene 75,55 mﾂｲ construidos de los cuales 52,28 mﾂｲ s...;36.7748538;-6.3528487;cadiz
780.000 竄ｬ;;/comprar/chalet-jerez_de_la_frontera_norte11407-44216726840_992777/;Norte (Jerez de la Frontera);4 habs.;4 baﾃｱos;272 mﾂｲ;;Espectacular chalet independiente que  ha sido completamente reformado con acabados de lujo. Su diseﾃｱo moderno consta de una plant...;36.703898819;-6.122226433;cadiz
235.000 竄ｬ;;/comprar/casa_pareada-la_banda_campo_de_futbol-41689713864_100200/;La Banda-Campo de Fﾃｺtbol (Chiclana de la Frontera);1 hab.;2 baﾃｱos;94 mﾂｲ;;Estupenda casa pareada situada en la zona de carretera de medina, muy buena ubicaciﾃｳn rodeada de servicios esenciales tales como s...;36.4151594;-6.1325746;cadiz
154.900 竄ｬ;;/comprar/piso-san_bernabe11204-45879332210_528489/;San Bernabﾃｩ (Algeciras);3 habs.;1 baﾃｱo;131 mﾂｲ;4ﾂｪ planta;Se vende un amplio piso en el municipio de algeciras. Este inmueble se encuentra en una 4ﾂｪ planta y cuenta con una superficie tota...;36.143215;-5.4699672;cadiz
133.500 竄ｬ;;/comprar/casa_adosada-la_banda_campo_de_futbol-25024524344_100500/;La Banda-Campo de Fﾃｺtbol (Chiclana de la Frontera);3 habs.;2 baﾃｱos;81 mﾂｲ;;Casa adosada con patio de entrada comunitario, lista para poder disfrutarla. Ademﾃ｡s, la casa cuenta con una cocina totalmente amue...;36.4147828;-6.1333877;cadiz
145.000 竄ｬ;;/comprar/casa-la_banda_campo_de_futbol-42587230770_100500/;La Banda-Campo de Fﾃｺtbol (Chiclana de la Frontera);3 habs.;2 baﾃｱos;166 mﾂｲ;;Se vende hermosa casa con un inmenso salﾃｳn con chimenea, perfecto para reuniones y celebraciones familiares. La casa cuenta con 3 ...;36.4144608;-6.1327178;cadiz
590.000 竄ｬ;Casa en Plaza Ponponio Mela, 3;/comprar/casa-tarifa_centro_urbano-42506583255_100500/;Tarifa;1 hab.;1 baﾃｱo;106 mﾂｲ;;"Una pequeﾃｱa joya mirando a africa en el centro historico de tarifa

La ubicaciﾃｳn de esta casita en la plaza de pomponio mela 3 es ...";36.0124;-5.60038;cadiz
273.000 竄ｬ;;/comprar/piso-la_caleta_la_vina11002-42597659963_100500/;La Caleta-La Viﾃｱa (Cﾃ｡diz Capital);2 habs.;1 baﾃｱo;84 mﾂｲ;1ﾂｪ planta;"Tiritritrﾃ｡n tran tran

Dulce hogar te ofrece la mejor atenciﾃｳn para la compra de un piso estupendo en pleno centro de cﾃ｡diz, en la...";36.5301181;-6.2999763;cadiz
324.000 竄ｬ;;/comprar/piso-san_roque_la_alcaidesa-43402767671_108500/;La Alcaidesa (San Roque);2 habs.;2 baﾃｱos;130 mﾂｲ;;Exclusiva propiedad en al alcaidesa. Destacar que se trata de una vivienda situada en un entorno privilegiado con vistas panorﾃ｡mic...;36.246936213;-5.326727537;cadiz
205.400 竄ｬ;Piso en calle Comedia,  S/N;/comprar/piso-el_puerto_de_santa_maria_centro-4656676576_109700/;Centro (El Puerto de Santa Marﾃｭa);3 habs.;2 baﾃｱos;96 mﾂｲ;;Piso en una finca de obra nueva de 96 mﾂｲ de superficie construida y emplazado en la zona de el puerto de santa marﾃｭa. Estﾃ｡ dispues...;36.5961788;-6.2368599;cadiz
98.000 竄ｬ;;/comprar/piso-centro_zona_noreste-44244506640_100500/;Centro-Zona Noreste (Chipiona);2 habs.;;48 mﾂｲ;1ﾂｪ planta;"Referencia: 959

Piso ubicado junto al polideportivo, a 1200 metros de la playa de regla
Consta de salﾃｳn - comedor con aire acondi...";36.7314714;-6.4278462;cadiz
139.900 竄ｬ;Dﾃｺplex en calle Archivero Juan Cﾃ｡rdenas, 1;/comprar/duplex-victoria_el_juncal-45022771598_100500/;Victoria-El Juncal (El Puerto de Santa Marﾃｭa);3 habs.;2 baﾃｱos;83 mﾂｲ;Bajo;Dﾃｺplex de 83 mts en la zona de el pinillo! En la primera planta se encuentra la cocina con lavadero, salﾃｳn independiente con aire ...;36.6102;-6.21816;cadiz
119.900 竄ｬ;;/comprar/chalet-la_soledad_la_coquina_los_gallos-39223515012_100500/;La Soledad-La Coquina-Los Gallos (Chiclana de la Frontera);3 habs.;1 baﾃｱo;110 mﾂｲ;;"Chalet en la zona de vipren con parcela segregada en suelo rustico

Chalet con parcela segregada en suelo rustico de 980mﾂｲ y una s...";36.4223691;-6.177438;cadiz
125.000 竄ｬ;;/comprar/piso-centro_zona_noreste-32535098811_100500/;Centro-Zona Noreste (Chipiona);2 habs.;1 baﾃｱo;53 mﾂｲ;Bajo;"Referencia: 637

Piso en planta baja con garaje y trastero. 

Consta de amplio salﾃｳn- comedor, cocina americana completamente amue...";36.73359422;-6.427112718;cadiz
123.500 竄ｬ;;/comprar/casa_adosada-benalup_casas_viejas_centro_urbano-44191940203_528308/;Benalup-Casas Viejas;3 habs.;2 baﾃｱos;177 mﾂｲ;;"**magnﾃｭfico adosado equipado y amueblado en benalup-casas viejas**

ﾂ｡Listo para entrar a vivir! Este espectacular adosado se encue...";36.3443636;-5.8170554;cadiz
372.000 竄ｬ;Piso en Avenida del Golf,  s/n;/comprar/piso-san_roque_la_alcaidesa-4261841951_109700/;La Alcaidesa (San Roque);3 habs.;2 baﾃｱos;149 mﾂｲ;;Piso en una finca de obra nueva de 149 mﾂｲ de superficie construida y emplazado en la zona de san roque. Estﾃ｡ dispuesto en 3 habita...;36.246724687;-5.32610504;cadiz
480.000 竄ｬ;;/comprar/chalet-tarifa_centro_urbano-43414178144_108700/;Tarifa;3 habs.;1 baﾃｱo;90 mﾂｲ;;"Encantadora casa en facinas
Convenientemente ubicada a tan solo 10 minutos de la maravillosa playa de bolonia y a 15 minutos de ta...";36.144334507;-5.700861803;cadiz
185.000 竄ｬ;;/comprar/piso-el_puerto_de_santa_maria_centro-40030623091_106000/;Centro (El Puerto de Santa Marﾃｭa);3 habs.;2 baﾃｱos;115 mﾂｲ;4ﾂｪ planta;"Ref: pp355 -
Piso ﾃ｡tico, muy bonito y en muy buen estado, en venta en pleno centro de el puerto cerca de la plaza del ayuntamiento...";36.5991959;-6.2243149;cadiz
390.000 竄ｬ;;/comprar/apartamento-puerto_de_sotogrande_la_marina-40898006138_526603/;Puerto de Sotogrande-La Marina (Sotogrande);2 habs.;2 baﾃｱos;144 mﾂｲ;Bajo;Bonito apartamento con orientaciﾃｳn  sur ubicado en complejo con piscina, bonitas vistas al canal navegable amplio jardﾃｭn privado d...;36.293949823;-5.277491667;cadiz
145.000 竄ｬ;;/comprar/piso-el_puerto_de_santa_maria_centro-45029024229_100500/;Centro (El Puerto de Santa Marﾃｭa);2 habs.;1 baﾃｱo;83 mﾂｲ;1ﾂｪ planta;"Piso en pleno centro de la ciudad con ascensor. 

Ubicado en pleno centro, rodeado de todo tipo de servicios, colegios, bares, res...";36.597872;-6.2295634;cadiz
225.000 竄ｬ;;/comprar/piso-el_mentidero_teatro_falla_alameda11003-38411704997_101000/;El Mentidero-Teatro Falla-Alameda (Cﾃ｡diz Capital);2 habs.;1 baﾃｱo;80 mﾂｲ;;No cobramos honorarios al comprador por este inmueble. Trato directo con la propiedad, total transparencia. Disfrute de nuestro to...;36.534701;-6.3000237;cadiz
205.400 竄ｬ;Piso en calle Comedia,  S/N;/comprar/piso-el_puerto_de_santa_maria_centro-4656676576_109700/;Centro (El Puerto de Santa Marﾃｭa);3 habs.;2 baﾃｱos;96 mﾂｲ;;Piso en una finca de obra nueva de 96 m2 de superficie construida y emplazado en la zona de El Puerto de Santa Marﾃｭa. Estﾃ｡ dispuesto en 3 habitaciones, 2 baﾃｱos completos y terraza. Cuenta como extras ascensor, garaje.;36,5961788;-6,2368599;cadiz
157.200 竄ｬ;;/comprar/piso-rota_chorrillo11520-42516210102_103800/;Chorrillo (Rota);3 habs.;1 baﾃｱo;77 mﾂｲ;1ﾂｪ planta;Piso  en rompidillo, con 77 mﾂｲ construidos, 3 dormitorios, 1 baﾃｱos, buen estado, planta 1, 1 terraza(s), 7 mﾂｲ de terraza, 1997, ga...;36.627408468;-6.352604193;cadiz
120.000 竄ｬ;;/comprar/piso-san_jose_varela_la_laguna-28370492518_501539/;San Josﾃｩ-Varela-La Laguna (Cﾃ｡diz Capital);1 hab.;1 baﾃｱo;70 mﾂｲ;Entresuelo;Piso para reformar: actualmente es una ﾃｺnica estancia diﾃ｡fana, pues se ha utilizado como salﾃｳn de celebraciones. Por ello, tambiﾃｩn...;36.5154217;-6.2790283;cadiz
290.000 竄ｬ;;/comprar/piso-cadiz_capital_centro_historico11004-45913546029_524139/;Centro Histﾃｳrico (Cﾃ｡diz Capital);2 habs.;2 baﾃｱos;102 mﾂｲ;3ﾂｪ planta;Esta exclusiva vivienda, ubicada en un emblemﾃ｡tico edificio de finales del siglo xix, combina a la perfecciﾃｳn la elegancia histﾃｳri...;36.532589839;-6.295777514;cadiz
185.000 竄ｬ;;/comprar/piso-jerez_de_la_frontera_centro11402-45075990499_100500/;Centro (Jerez de la Frontera);4 habs.;2 baﾃｱos;104 mﾂｲ;3ﾂｪ planta;Piso de 4 dormitorios con amplio salﾃｳn con terraza, 2 baﾃｱos completos, uno de ellos con placa de ducha. Edificio con ascensor.  Po...;36.690376;-6.135262631;cadiz
159.900 竄ｬ;;/comprar/piso-jerez_de_la_frontera_centro11402-43337862087_100500/;Centro (Jerez de la Frontera);3 habs.;2 baﾃｱos;94 mﾂｲ;2ﾂｪ planta;"Fantﾃ｡stica vivienda con ascensor de 3 dormitorios 
Estupendo piso situado en la zona centro, una zona muy solicitada por la multit...";36.686041;-6.1351661;cadiz
139.900 竄ｬ;;/comprar/casa-centro_zona_noreste-43432091699_100500/;Centro-Zona Noreste (Chipiona);3 habs.;2 baﾃｱos;115 mﾂｲ;;ﾂ｡2 x 1! Extraordinarias vivienda en una misma finca con entradas independientes. La casa la cual da fachada a la calle dispone de ...;36.729157;-6.4232319;cadiz
222.000 竄ｬ;;/comprar/piso-jerez_de_la_frontera_centro11403-40858772161_100500/;Centro (Jerez de la Frontera);3 habs.;2 baﾃｱos;160 mﾂｲ;Bajo;"Precioso piso en primera planta completamente reformado con 160 mﾂｲ construidos

Se vende precioso piso en todo el corazﾃｳn de jerez...";36.6826667;-6.1373757;cadiz
285.000 竄ｬ;ﾃ》ico en Avenida del Golf, 10;/comprar/atico-san_roque_nucleo11360-45002331777_528336/;Nﾃｺcleo (San Roque);2 habs.;2 baﾃｱos;150 mﾂｲ;;Este magnﾃｭfico ﾃ｡tico en venta se encuentra en urbanizaciﾃｳn del golf. Con una superficie total de 150 mﾂｲ y 2 habitaciones dobles, e...;36.24670771789625;-5.325257920024729;cadiz
149.000 竄ｬ;;/comprar/piso-chipiona_la_laguna-42547698250_100500/;La Laguna (Chipiona);3 habs.;2 baﾃｱos;100 mﾂｲ;2ﾂｪ planta;"Te presentamos este amplio piso a pocos metros de la playa de regla. 
La vivienda dispone de 3 amplios dormitorios donde tendrﾃ｡s e...";36.7275814;-6.4341132;cadiz
199.000 竄ｬ;;/comprar/piso-rota_zona_norte11520-43425735222_103800/;Zona Norte (Rota);3 habs.;1 baﾃｱo;130 mﾂｲ;2ﾂｪ planta;Espectacular y amplio piso situado en una de las principales avenidas de rota, consta de amplio vestﾃｭbulo, 3 dormitorios, salﾃｳn co...;36.6251748;-6.3604619;cadiz
180.000 竄ｬ;;/comprar/atico-el_populo_santa_maria11005-44253102773_106700/;El Pﾃｳpulo-Santa Marﾃｭa (Cﾃ｡diz Capital);1 hab.;1 baﾃｱo;42 mﾂｲ;;"ﾂ｡Descubre este encantador ﾃ｡tico de un dormitorio en pleno corazﾃｳn de cﾃ｡diz!
Situado a solo unos pasos del campo del sur y el ayunt...";36.5290863;-6.2922037;cadiz
128.900 竄ｬ;;/comprar/duplex-jerez_de_la_frontera_centro11404-40096200703_100500/;Centro (Jerez de la Frontera);2 habs.;2 baﾃｱos;74 mﾂｲ;Bajo;Maravilloso dﾃｺplex  situado en el corazﾃｳn de jerez, rodeado de la zona monumental y cultural de la ciudad. La vivienda se accede p...;36.686872;-6.1457581;cadiz
225.000 竄ｬ;;/comprar/piso-andalucia_la_ardila-45880241970_516894/;Andalucﾃｭa-La Ardila (San Fernando);3 habs.;2 baﾃｱos;134 mﾂｲ;1ﾂｪ planta;Cadizsur servicios inmobiliarios, les ofrece a la venta ﾃｩsta maravillosa vivienda, ubicada en la avenida ponce de leﾃｳn, junto a la...;36.4571528;-6.2100933;cadiz
970.000 竄ｬ;;/comprar/piso-sotogrande_alto11310-30057374394_101800/;Sotogrande Alto (Sotogrande);2 habs.;2 baﾃｱos;216 mﾂｲ;1ﾂｪ planta;"Obra nueva en sotogrande (cﾃ｡diz), 33 unidades, varios tamaﾃｱos y alturas.

""walking distance"" del sotogrande international school, ...";36.2758574;-5.3332484;cadiz
122.000 竄ｬ;;/comprar/piso-centro_calzada-44168061307_104700/;Centro-Calzada (Sanlﾃｺcar de Barrameda);2 habs.;1 baﾃｱo;55 mﾂｲ;;Nuevo piso en venta en el centro de sanlﾃｺcar de barrameda, zona inmejorable, rodeado de todo tipo de comercias de alta calidad, un...;36.7828956;-6.3533983;cadiz
125.000 竄ｬ;;/comprar/piso-san_fernando_el_carmen-40009209643_100200/;El Carmen (San Fernando);4 habs.;1 baﾃｱo;87 mﾂｲ;;San bruno: amplio piso de 3 dormitorios, salﾃｳn con terraza cerrada, cuarto de baﾃｱo, cocina con lavadero. Vivienda en primera plant...;36.460295;-6.1996886;cadiz
1.800.000 竄ｬ;;/comprar/finca_rustica-jimena_de_la_frontera_centro_urbano-25026435816_105600/;Jimena de la Frontera;7 habs.;7 baﾃｱos;700 mﾂｲ;;"Descripciﾃｳn del objeto:
Andalusia, provinz cadiz, jimena de la frontera
Finca preciosa con piscina, 2 casas y cuadras para caballo...";36.43928016;-5.455949113;cadiz
295.000 竄ｬ;;/comprar/chalet-bonanza_martin_miguel_monteolivete11540-33418257833_100500/;Bonanza-Martﾃｭn Miguel-Monteolivete (Sanlﾃｺcar de Barrameda);3 habs.;2 baﾃｱos;198 mﾂｲ;;Casa totalmente independiente en zona del barrio alto junto a la rotonda del tren. Esta vivienda tiene una superficie de casi 200 ...;36.7769409;-6.3419191;cadiz
198.000 竄ｬ;;/comprar/apartamento-costa_ballena-35923379998_990821/;Costa Ballena (Rota);1 hab.;1 baﾃｱo;68 mﾂｲ;2ﾂｪ planta;Coqueta y cﾃｳmoda vivienda ubicada en las dunas, urbanizaciﾃｳn ubicada en muy buena zona de costa ballena, prﾃｳxima a la playa y a la...;36.6903356;-6.4117715;cadiz
2.620.000 竄ｬ;;/comprar/chalet-tarifa_centro_urbano-45860517585_108700/;Tarifa;14 habs.;11 baﾃｱos;424 mﾂｲ;;Exclusividad iad espaﾃｱa! Ubicaciﾃｳn memorable en el corazﾃｳn de la peﾃｱa, en tarifa, esta excepcional propiedad se extiende sobre un ...;36.0213942;-5.6122865;cadiz
375.000 竄ｬ;;/comprar/piso-el_mentidero_teatro_falla_alameda-34201483999_513533/;El Mentidero-Teatro Falla-Alameda (Cﾃ｡diz Capital);3 habs.;2 baﾃｱos;202 mﾂｲ;1ﾂｪ planta;Alquileres cﾃ｡diz les ofrece la oportunidad de adquirir una magnifica vivienda en pleno centro de la ciudad en una de las zonas mﾃ｡s...;36.5347015;-6.2968245;cadiz
270.000 竄ｬ;;/comprar/piso-el_populo_santa_maria11006-43382542036_103800/;El Pﾃｳpulo-Santa Marﾃｭa (Cﾃ｡diz Capital);4 habs.;1 baﾃｱo;135 mﾂｲ;;Piso  en palacio congreso, con 135 mﾂｲ construidos, 130 mﾂｲ ﾃｺtiles, 4 dormitorios, 1 baﾃｱos, estado de origen, exterior, cocina indep...;36.5292848;-6.2907306;cadiz
250.000 竄ｬ;;/comprar/casa-centro_zona_noreste-29196087195_100500/;Centro-Zona Noreste (Chipiona);5 habs.;3 baﾃｱos;160 mﾂｲ;;A01246 - disfruta de la comodidad de vivir en pleno centro de chipiona donde tendrﾃ｡s todos los servicios que necesitas  a un paso ...;36.732705429;-6.431805831;cadiz
220.000 竄ｬ;;/comprar/chalet-mogarizas_las_rapaces-40073968459_100500/;Mogarizas-Las Rapaces (Chiclana de la Frontera);3 habs.;1 baﾃｱo;160 mﾂｲ;;"Chalet con piscina en parcela segregada  de 4.471 metros

Chalet  de 120 mﾂｲ aprox, en parcela segregada de 4471 mﾂｲ aprox, distribu...";36.3832;-6.1398;cadiz
150.000 竄ｬ;;/comprar/piso-san_jose_varela_la_laguna11008-45087179752_100500/;San Josﾃｩ-Varela-La Laguna (Cﾃ｡diz Capital);2 habs.;2 baﾃｱos;71 mﾂｲ;Bajo;Inmonline cadiz - real estate presenta este local tipo dﾃｺplex en una de las zonas mas demandadas de la avenida y a pocos metros de...;36.5168328;-6.2798487;cadiz
119.900 竄ｬ;;/comprar/piso-barrio_alto-43379640071_101800/;Barrio Alto (Sanlﾃｺcar de Barrameda);2 habs.;1 baﾃｱo;54 mﾂｲ;1ﾂｪ planta;Magnﾃｭfico piso en barrio alto junto a c/ san agustﾃｭn, a un minuto de la puerta de jerez. Piso en muy buen estado listo para entrar...;36.7734517;-6.3510293;cadiz
199.000 竄ｬ;;/comprar/piso-conil_de_la_frontera_centro_urbano-28359897271_100500/;Conil de la Frontera;3 habs.;1 baﾃｱo;101 mﾂｲ;1ﾂｪ planta;Nueva generaciﾃｳn 2020 les ofrece un piso en primera planta en una de las zonas mas demandadas de conil de la frontera(canarias) do...;36.279075;-6.0875337;cadiz
249.000 竄ｬ;;/comprar/piso-zona_playa_virgen_del_mar-42581068493_103800/;Zona Playa Virgen del Mar (Rota);4 habs.;;95 mﾂｲ;4ﾂｪ planta;Si buscas un piso amplio, para toda la familia, al alcance de todo, a poca distancia de la playa y ademﾃ｡s con plaza de aparcamient...;36.622392563;-6.361546805;cadiz
285.000 竄ｬ;;/comprar/piso-la_paz_segunda_aguado_loreto11012-43415926800_100500/;La Paz-Segunda Aguado-Loreto (Cﾃ｡diz Capital);5 habs.;2 baﾃｱos;121 mﾂｲ;5ﾂｪ planta;Luz del sur inmobiliaria te presenta en exclusividad  un amplio piso en cﾃ｡diz capital cerca de la playa. Este gran piso de 110 mﾂｲ ...;36.5122208;-6.2754677;cadiz
290.000 竄ｬ;;/comprar/piso-playa_de_santa_maria_del_mar_bahia_blanca11007-45850004352_516894/;Playa de Santa Marﾃｭa del Mar-Bahﾃｭa Blanca (Cﾃ｡diz Capital);3 habs.;2 baﾃｱos;108 mﾂｲ;2ﾂｪ planta;"Cadizsur servicios inmobiliarios, les presenta este encantador piso junto a la iglesia san severiano y bahﾃｭa blanca; a pocos minut...";36.5222258;-6.2830021;cadiz
156.500 竄ｬ;Piso en Avenida Josﾃｩ Manuel Caballero Bonald,  s/n;/comprar/piso-noreste11405-3863236647_109700/;Noreste (Jerez de la Frontera);2 habs.;1 baﾃｱo;93 mﾂｲ;1ﾂｪ planta;Esc. 9, 1ﾂｺ D. Piso en un inmueble de obra nueva de 93 m2 de superficie construida y situado en la zona de Jerez de la Frontera, acomodado en planta 1. Estﾃ｡ estructurado en 2 habitaciones, 1 baﾃｱo completo y terraza. Aporta como extras ascensor.;36,7002516;-6,1088684;cadiz
177.000 竄ｬ;ﾃ》ico en calle de Manuel Rances;/comprar/atico-el_mentidero_teatro_falla_alameda11004-41676804991_100500/;El Mentidero-Teatro Falla-Alameda (Cﾃ｡diz Capital);1 hab.;1 baﾃｱo;60 mﾂｲ;;"Atico en el centro de cadiz, con licencia turistica, y funcionando actualmente como apartamento turﾃｭstico. 

 Este apartamento con...";36.5353;-6.29455;cadiz
248.000 竄ｬ;;/comprar/casa_adosada-este11406-31721221764_100500/;Este (Jerez de la Frontera);3 habs.;3 baﾃｱos;117 mﾂｲ;;"Adosado muy luminoso de 3 dormitorios en zona este
Fantﾃ｡stico y amplio adosado en las delicias de 3 dormitorios, amplio salﾃｳn muy ...";36.6828989;-6.1124799;cadiz
187.000 竄ｬ;;/comprar/piso-jerez_de_la_frontera_centro11403-34183078829_100500/;Centro (Jerez de la Frontera);3 habs.;2 baﾃｱos;170 mﾂｲ;2ﾂｪ planta;Se vende fantﾃ｡stico piso en pleno centro de jerez de la frontera, piso en segunda planta sin ascensor, aunque hay posibilidad de i...;36.681077;-6.1378673;cadiz
74.950 竄ｬ;;/comprar/casa-rinconcillo-43344801266_526100/;Rinconcillo (Algeciras);2 habs.;2 baﾃｱos;84 mﾂｲ;;Oportunidad ﾂ｡ﾂ｡ Casa junto avenida diputaciﾃｳn y comisarﾃｭa de policﾃｭa, vivienda con muchas posibilidades de mejora, consta en planta...;36.1583837;-5.4540467;cadiz
A consultar;Piso en calle de Maracaibo, 3;/comprar/piso-urbanizaciones_zona_norte-42552192896_109700/;Urbanizaciones Zona Norte (El Puerto de Santa Marﾃｭa);3 habs.;1 baﾃｱo;77 mﾂｲ;;Gastos de notarﾃｭa gratis de hasta 500 竄ｬ para escrituras de compraventa desde el 15/07/2024 hasta el 30/09/2024. Oportunidad de inv...;36.6114;-6.2319;cadiz
230.000 竄ｬ;;/comprar/duplex-centro_calzada-44242304183_104700/;Centro-Calzada (Sanlﾃｺcar de Barrameda);4 habs.;2 baﾃｱos;83 mﾂｲ;;Vivienda tipo dﾃｺplex en 3ﾂｺ linea de playa, avenida de las piletas, a  dos minutos de la playa y de la plaza cabildo. Esta vivienda...;36.7826465;-6.3595831;cadiz
319.900 竄ｬ;;/comprar/casa-jerez_de_la_frontera_sur11408-40092831308_100500/;Sur (Jerez de la Frontera);3 habs.;3 baﾃｱos;128 mﾂｲ;;Magnifica pareada en una parcela de 220 mﾂｲ. La vivienda dispone de tres dormitorios con armarios empotrados, salﾃｳn comedor con pre...;36.6612744;-6.1501215;cadiz
360.000 竄ｬ;;/comprar/casa-la_pastora_zona_de_la_estacion11100-41715390389_103800/;La Pastora-Zona de la Estaciﾃｳn (San Fernando);5 habs.;2 baﾃｱos;160 mﾂｲ;;Magnifica casa en el barrio de la pastora, distribuida en 2 plantas y azotea transitable. En la planta baja nos encontramos con un...;36.4702865;-6.1927106;cadiz
435.000 竄ｬ;;/comprar/chalet-la_soledad_la_coquina_los_gallos-44175527116_100500/;La Soledad-La Coquina-Los Gallos (Chiclana de la Frontera);3 habs.;3 baﾃｱos;180 mﾂｲ;;En venta un espectacular chalet prﾃｳximo a la zona de los gallos, en el municipio de chiclana de la frontera (cﾃ｡diz). Se encuentra ...;36.4034432;-6.1671925;cadiz
159.900 竄ｬ;;/comprar/piso-la_pastora_zona_de_la_estacion11100-43394241781_100500/;La Pastora-Zona de la Estaciﾃｳn (San Fernando);3 habs.;1 baﾃｱo;98 mﾂｲ;Bajo;ﾂ｡Atenciﾃｳn amantes del confort y la accesibilidad en san fernando! 沛｡笨ｨ esta joya inmobiliaria acaba de aterrizar en el mercado y ﾂ｡N...;36.4709424;-6.1933637;cadiz
448.000 竄ｬ;;/comprar/piso-playa_de_santa_maria_del_mar_bahia_blanca11007-45018351018_990852/;Playa de Santa Marﾃｭa del Mar-Bahﾃｭa Blanca (Cﾃ｡diz Capital);3 habs.;2 baﾃｱos;104 mﾂｲ;6ﾂｪ planta;Te presentamos esta magnifica vivienda totalmente reformada en una de las mejores zonas de la avenida principal de cﾃ｡diz,  junto a...;36.5230271;-6.2863317;cadiz
