precio;sub_descr;href;ubicacion;habitaciones;banios;mt2;planta;otros;latitude;longitude;CCAA
230.000 竄ｬ;Piso en Barrio La Viﾃｱa-La Caleta;/comprar/piso-la_caleta_la_vina11002-35013502636_100500/;La Caleta-La Viﾃｱa (Cﾃ｡diz Capital);4 habs.;1 baﾃｱo;109 mﾂｲ;8ﾂｪ planta;"Esta fantﾃ｡stica vivienda en finca moderna con ascensor busca familia que quiera construir un hogar entre sus paredes.

Posibilidad...";36.5284202;-6.304654;cadiz
390.000 竄ｬ;Casa en Avenida Nuevo Oasis del Sur, nﾂｺ 2;/comprar/casa-costa_ballena-38376418834_990821/;Costa Ballena (Rota);4 habs.;3 baﾃｱos;110 mﾂｲ;;"Casa de 4 dormitorios, ubicada en una urbanizaciﾃｳn en primera lﾃｭnea de playa de costa ballena, en una de sus mejores playas.

En l...";36.67768680286151;-6.406039004654608;cadiz
230.000 竄ｬ;Piso en calle de Venezuela;/comprar/piso-la_caleta_la_vina11002-42523564326_100500/;La Caleta-La Viﾃｱa (Cﾃ｡diz Capital);4 habs.;1 baﾃｱo;109 mﾂｲ;8ﾂｪ planta;"Inmonline cadiz - real estate presenta esta vivienda situada cerca del campo del sur y a 5 minutos de la playa de la caleta.

Disf...";36.5284371;-6.3044934;cadiz
220.000 竄ｬ;Casa en Centro Histﾃｳrico-La Costilla;/comprar/casa-centro_historico_la_costilla-20846424974_501368/;Centro Histﾃｳrico-La Costilla (Rota);7 habs.;3 baﾃｱos;229 mﾂｲ;;Casa para reformar con mucho potencial y posibilidades  para ese proyecto que tienes en mente . La situaciﾃｳn de la vivienda es  cﾃｩ...;36.620424;-6.3584017;cadiz
89.000 竄ｬ;Piso en Taraguilla;/comprar/piso-taraguilla_estacion_ferrea11369-25049732746_100500/;Taraguilla-Estaciﾃｳn Fﾃｩrrea (San Roque);3 habs.;2 baﾃｱos;98 mﾂｲ;Bajo;Altura piso 2ﾂｺ, piso superficie total 85 mﾂｲ, superficie ﾃｺtil 83 mﾂｲ, hab. Individuales: 2, habitaciones dobles: 1, hab. Dobles son ...;36.2075;-5.42726;cadiz
210.000 竄ｬ;Piso en Centro-Zona Playas;/comprar/piso-centro_zona_playas-44262094442_528322/;Centro-Zona Playas (Chipiona);3 habs.;2 baﾃｱos;85 mﾂｲ;2ﾂｪ planta;Increﾃｭbles vistas las que nos ofrece este piso en primera lﾃｭnea de playa en cruz del mar, es una de la pocas oportunidades de adqu...;36.7452498;-6.4323031;cadiz
87.990 竄ｬ;Piso en calle Benito Pﾃｩrez Galdﾃｳs;/comprar/piso-algeciras_centro11201-45046267682_101800/;Centro (Algeciras);3 habs.;1 baﾃｱo;110 mﾂｲ;;Vendo piso grande, de 110 mﾂｲ, en buenas condiciones. Se encuentra situado en el centro de algeciras, secano, zona muy buena y tran...;36.1291838;-5.450123;cadiz
350.000 竄ｬ;Piso en Playa de La Victoria;/comprar/piso-el_populo_santa_maria11005-44257243095_100500/;El Pﾃｳpulo-Santa Marﾃｭa (Cﾃ｡diz Capital);2 habs.;1 baﾃｱo;92 mﾂｲ;2ﾂｪ planta;Inmobiliaria vivencadiz os presenta oportunidad de estrenar este increﾃｭble piso de nueva construcciﾃｳn con impresionantes vistas al...;36.5290863;-6.2922037;cadiz
140.000 竄ｬ;Casa en Vejer de La Frontera;/comprar/casa-vejer_de_la_frontera_centro_urbano-34176570675_521333/;Vejer de la Frontera;2 habs.;1 baﾃｱo;60 mﾂｲ;;Casa en planta baja en el centro de vejer. 2 dormitorios y 1 baﾃｱo. Completamente amueblada y con mucho gusto.tiene licencia de alq...;36.2539856;-5.9620657;cadiz
150.000 竄ｬ;Piso en Pago de Troya;/comprar/piso-puerto_real_centro_urbano-45908960118_100500/;Puerto Real;3 habs.;1 baﾃｱo;103 mﾂｲ;4ﾂｪ planta;Vivienda cﾃｩntrica  muy luminosa de tres dormitorios , con baﾃｱo completo , cocina equipada, amplio salﾃｳn, y con ascensor. Esta cerc...;36.5312586;-6.1946154;cadiz
74.000 竄ｬ;Casa en Centro;/comprar/casa-algeciras_centro11201-45007288179_100500/;Centro (Algeciras);3 habs.;2 baﾃｱos;134 mﾂｲ;;"Casa en san isidro para reforma integral.

ﾂ｡Oportunidad ﾃｺnica en la barriada de san isidro, en pleno centro de algeciras!

ﾂｿBuscas...";36.1319953;-5.4502171;cadiz
450.000 竄ｬ;Piso en Plaza Mina;/comprar/piso-cadiz_capital_centro_historico11004-37536759037_100500/;Centro Histﾃｳrico (Cﾃ｡diz Capital);4 habs.;2 baﾃｱos;222 mﾂｲ;2ﾂｪ planta;"Casa con mucho flow busca romﾃ｡ntico que se enamore de su estilo.

Posibilidades:
- tiene una carﾃ｡cter especial, solo le necesita a...";36.5355069;-6.2950607;cadiz
449.900 竄ｬ;Chalet en Las Mogarizas;/comprar/chalet-mogarizas_las_rapaces-45897154640_100500/;Mogarizas-Las Rapaces (Chiclana de la Frontera);3 habs.;3 baﾃｱos;201 mﾂｲ;;沛｡ hermoso chalet en chiclana de la frontera, ubicado en una de las mejores zonas de chiclana. Con una superficie de 201mﾂｲ constr...;36.3900987;-6.1741948;cadiz
115.000 竄ｬ;Piso en Centro;/comprar/piso-jerez_de_la_frontera_centro11402-44224324156_100200/;Centro (Jerez de la Frontera);3 habs.;1 baﾃｱo;99 mﾂｲ;;"Estupendo piso en centro de jerez.
Ubicado en calle arcos.
ﾂ｡ Ideal para vivir o invertir !
Piso de 99 metros cuadrados. Compuesto ...";36.6838561;-6.131855;cadiz
139.000 竄ｬ;Piso en Frontera;/comprar/piso-centro_san_felipe_huerta_fava-31676984834_106000/;Centro-San Felipe-Huerta Fava (La Lﾃｭnea de la Concepciﾃｳn);4 habs.;2 baﾃｱos;Mﾃ｡s de 20;;Piso en la linea, zona frontera, la vivienda es muy amplia, a cinco minutos del centro a pie. Bonitas vistas.;36.1621035;-5.3547888;cadiz
474.900 竄ｬ;Chalet en Este;/comprar/chalet-noreste11405-31732597511_103800/;Noreste (Jerez de la Frontera);4 habs.;2 baﾃｱos;200 mﾂｲ;;Chalet pareado en chapﾃｭn, concretamente en  residencial recreo luzelma a escasos 10 minutos del centro dela ciudad, tiene una parc...;36.6883036;-6.1232737;cadiz
319.000 竄ｬ;Piso en Avenida;/comprar/piso-playa_de_la_victoria11009-42575095990_100500/;Playa de la Victoria (Cﾃ｡diz Capital);4 habs.;2 baﾃｱos;129 mﾂｲ;3ﾂｪ planta;En plena avenida principal nos encontramos esta estupenda vivienda. Una ubicaciﾃｳn idﾃｭlica ya que a tan sﾃｳlo unos escasos metros no...;36.5101836;-6.2789972;cadiz
120.000 竄ｬ;Piso en Loreto - Puntales;/comprar/piso-la_paz_segunda_aguado_loreto11011-44173992232_100500/;La Paz-Segunda Aguado-Loreto (Cﾃ｡diz Capital);3 habs.;1 baﾃｱo;48 mﾂｲ;2ﾂｪ planta;"Inmonline cadiz - real estate presenta esta coqueta y luminosa vivienda en exclusiva  en la zona de puntales.

Se trata de una seg...";36.507016829;-6.266322196;cadiz
260.300 竄ｬ;Piso en calle Comedia,  S/N;/comprar/piso-el_puerto_de_santa_maria_centro-4645045173_109700/;Centro (El Puerto de Santa Marﾃｭa);3 habs.;2 baﾃｱos;115 mﾂｲ;;Piso en una finca de obra nueva de 115 m2 de superficie construida y emplazado en la zona de El Puerto de Santa Marﾃｭa. Estﾃ｡ dispuesto en 3 habitaciones, 2 baﾃｱos completos y terraza. Cuenta como extras ascensor, garaje.;36,5961788;-6,2368599;cadiz
145.000 竄ｬ;Casa en Avenida de Rota;/comprar/casa-centro_zona_noreste-42561659725_100500/;Centro-Zona Noreste (Chipiona);3 habs.;1 baﾃｱo;98 mﾂｲ;;"Situado en buena zona con servicios a sus alrededor, zona tranquila.

Consta de tres dormitorios , dos de ellos amplios, baﾃｱo comp...";36.728982;-6.4274419;cadiz
120.000 竄ｬ;Piso en Camposoto-Gallineras;/comprar/piso-camposoto_gallineras11100-43409871464_100200/;Camposoto-Gallineras (San Fernando);2 habs.;1 baﾃｱo;50 mﾂｲ;;Zona la noria. Piso reformado y amueblado ubicado en una primera planta con ascensor que se distribuye en dos dormitorios amplios ...;36.4525815;-6.2115787;cadiz
125.000 竄ｬ;Piso en El Tejar;/comprar/piso-victoria_el_juncal-45016496151_104700/;Victoria-El Juncal (El Puerto de Santa Marﾃｭa);3 habs.;1 baﾃｱo;80 mﾂｲ;;"Puerto playa&nbsp; pone a la venta este precioso y luminoso piso de 3 dormitorios y un&nbsp; baﾃｱo en una buena zona del puerto de ...";36.609814;-6.2153356;cadiz
269.990 竄ｬ;Casa en Arcos Centro;/comprar/casa-arcos_de_la_frontera_centro_urbano-40092278869_100500/;Arcos de la Frontera;3 habs.;5 baﾃｱos;472 mﾂｲ;;"Gran oportunidad de adquirir una casa palacio del s. Xvi con negocio de restauraciﾃｳn y vivienda!

La propiedad se ubica en una de ...";36.7481265;-5.8055324;cadiz
169.000 竄ｬ;Piso en Centro;/comprar/piso-el_mentidero_teatro_falla_alameda11003-42568949105_100500/;El Mentidero-Teatro Falla-Alameda (Cﾃ｡diz Capital);1 hab.;1 baﾃｱo;57 mﾂｲ;1ﾂｪ planta;"ﾂ｡Nueva promociﾃｳn de viviendas de 1 y 2 dormitorios!

Os presentamos esta nueva promociﾃｳn de 12 viviendas rehabilitadas y personali...";36.5338191;-6.2997607;cadiz
180.000 竄ｬ;Casa en Centro;/comprar/casa-puerto_real_centro_urbano-37534040120_100500/;Puerto Real;3 habs.;2 baﾃｱos;140 mﾂｲ;;Casa en el centro en planta baja, con tres dormitorios , salﾃｳn , baﾃｱo completo , cocina equipada y aseo, patio central con montera...;36.527758834;-6.191095945;cadiz
160.000 竄ｬ;Piso en Barbate;/comprar/piso-barbate_centro_urbano-45056917957_106700/;Barbate;3 habs.;1 baﾃｱo;102 mﾂｲ;;"Piso en primera planta , bastante amplio y luminoso . 
 Consta de hall de entrada , 1 baﾃｱo , cocina ,salﾃｳn independiente con aire ...";36.1907937;-5.9175974;cadiz
650.000 竄ｬ;Chalet en Costa de Sancti Petri;/comprar/chalet-costa_de_sancti_petri_playa_de_la_barrosa11139-45028627334_100500/;Costa de Sancti Petri-Playa de La Barrosa (Chiclana de la Frontera);4 habs.;2 baﾃｱos;120 mﾂｲ;;"Chalet en chiclana situado en la zona de costa sancti petri, a 50 metros del mar, distribuido en dos plantas; en planta baja nos e...";36.3814307;-6.2008708;cadiz
179.990 竄ｬ;Piso en La Caleta - La Viﾃｱa;/comprar/piso-el_mentidero_teatro_falla_alameda11003-35925205576_100500/;El Mentidero-Teatro Falla-Alameda (Cﾃ｡diz Capital);2 habs.;1 baﾃｱo;75 mﾂｲ;Bajo;En uno de los mejores barrios de cﾃ｡diz con mﾃ｡s historia (el mentidero) rodeado de diversidad gastronﾃｳmica, cultural, histﾃｳrica. Po...;36.5364262;-6.3001297;cadiz
185.000 竄ｬ;Dﾃｺplex en Oratorio San Felipe Neri;/comprar/duplex-la_caleta_la_vina11001-25914065041_100500/;La Caleta-La Viﾃｱa (Cﾃ｡diz Capital);1 hab.;;51 mﾂｲ;2ﾂｪ planta;"Apartamento muy apaﾃｱao* en casa burguesa busca comprador disfrutﾃｳn  sin miedo al ﾃｩxito.

Posibilidades:
- sﾃｳlo tendrﾃ｡s que meter t...";36.5322307;-6.30015;cadiz
142.900 竄ｬ;Piso en Puerto Real;/comprar/piso-puerto_real_centro_urbano-43366548861_100200/;Puerto Real;3 habs.;2 baﾃｱos;95 mﾂｲ;;ﾂ｡Bienvenido al hogar perfecto en la encantadora barriada del rﾃｭo san pedro! Esta hermosa casa dﾃｺplex de protecciﾃｳn oficial (vpo) o...;36.5311472;-6.1824213;cadiz
500.000 竄ｬ;Piso en Comisarﾃｭa;/comprar/piso-san_jose_varela_la_laguna11007-28389661977_100500/;San Josﾃｩ-Varela-La Laguna (Cﾃ｡diz Capital);5 habs.;3 baﾃｱos;240 mﾂｲ;1ﾂｪ planta;Os presento este amplio piso con una ubicaciﾃｳn muy cﾃｩntrica al estar a escasos metros de puerta de tierra  que te lleva al centro ...;36.5209115;-6.2854482;cadiz
184.500 竄ｬ;Casa adosada en calle Cabo de Rocas,  4;/comprar/casa_adosada-rinconcillo-4611877192_109700/;Rinconcillo (Algeciras);3 habs.;;;;V11. Casa adosada de obra nueva, y ubicada en la zona de algeciras.  Estﾃ｡ distribuida en 3 habitaciones y terraza. Incluye extras ...;36.1582;-5.45605;cadiz
550.000 竄ｬ;Chalet en La Jara;/comprar/chalet-la_jara_distrito-35047476235_100500/;La Jara (Sanlﾃｺcar de Barrameda);4 habs.;5 baﾃｱos;284 mﾂｲ;;Gran chalet independiente situado a 600 metros de la playa de la jara en la localidad de sanlﾃｺcar de barrameda ( cﾃ｡diz) con muy bu...;36.7708086;-6.3715049;cadiz
152.900 竄ｬ;Piso en calle de Regino Martﾃｭnez, 1;/comprar/piso-algeciras_centro11201-42545475720_512568/;Centro (Algeciras);4 habs.;3 baﾃｱos;132 mﾂｲ;2ﾂｪ planta;Fabuloso piso en el centro de algeciras en una de la calle mﾃ｡s cﾃｩntrica de la ciudad y rodeado de toda clase de servicios , frente...;36.132996;-5.448938;cadiz
490.000 竄ｬ;Casa pareada en Las Redes;/comprar/casa_pareada-el_aguila_las_redes_fuentebravia-45080844923_100500/;El ﾃ“uila-Las Redes-Fuentebravﾃｭa (El Puerto de Santa Marﾃｭa);4 habs.;3 baﾃｱos;141 mﾂｲ;;"Magnifica pareada en la zona de las redes con zonas comunes y piscina comunitaria.

Ubicada en una de las mejores zonas de la ciud...";36.600017011;-6.273483413;cadiz
675.000 竄ｬ;Chalet en Las Lomas de Sancti Petri;/comprar/chalet-novo_sancti_petri_loma_de_sancti_petri11139-42505700108_100500/;Novo Sancti Petri-Loma de Sancti Petri (Chiclana de la Frontera);4 habs.;3 baﾃｱos;279 mﾂｲ;;"Chalet en la loma de sancti petri,  con piscina  810 metros de parcela y 258 metros  construidos.
Busca el chalet de sus sueﾃｱos? L...";36.336709043;-6.146830129;cadiz
149.000 竄ｬ;Piso en Playa de Regla;/comprar/piso-chipiona_la_laguna-41704176946_100500/;La Laguna (Chipiona);3 habs.;2 baﾃｱos;100 mﾂｲ;2ﾂｪ planta;Od1097. ﾂ｡Los sueﾃｱos se cumplen! Magnﾃｭfico piso a 550 metros del santuario. La vivienda dispone de 3 amplios dormitorios donde tend...;36.727977348;-6.434052832;cadiz
1.375.000 竄ｬ;Casa en Las Redes;/comprar/casa-el_aguila_las_redes_fuentebravia-35898226752_265000/;El ﾃ“uila-Las Redes-Fuentebravﾃｭa (El Puerto de Santa Marﾃｭa);6 habs.;5 baﾃｱos;350 mﾂｲ;;"No cobramos comisiﾃｳn al comprador en este inmuble!!!
Estupenda casa a pie de playa!! Visitala!!
Casa de  350 mﾂｲ,  solar 700 mﾂｲ,  ﾃｺ...";36.5972209;-6.2725471;cadiz
395.000 竄ｬ;Casa adosada en Camposoto-Gallineras;/comprar/casa_adosada-camposoto_gallineras11100-42588781772_100200/;Camposoto-Gallineras (San Fernando);;;200 mﾂｲ;;"Camposoto: espectacular unifamiliar de 4 plantas con aire centralizado, consta de
Planta sﾃｳtano: garaje (para dos coches)y traster...";36.4451047;-6.2097017;cadiz
125.000 竄ｬ;Piso en El Carmen;/comprar/piso-san_fernando_el_carmen-40009209643_100200/;El Carmen (San Fernando);4 habs.;1 baﾃｱo;87 mﾂｲ;;San bruno: amplio piso de 3 dormitorios, salﾃｳn con terraza cerrada, cuarto de baﾃｱo, cocina con lavadero. Vivienda en primera plant...;36.460295;-6.1996886;cadiz
1.070.000 竄ｬ;Finca rﾃｺstica en Arcos de la Frontera;/comprar/finca_rustica-arcos_de_la_frontera_centro_urbano-35876335625_105600/;Arcos de la Frontera;6 habs.;5 baﾃｱos;479 mﾂｲ;;"Descripciﾃｳn del objeto:
Gepflegtes, tripadviser ausgezeichnetes boutique b&b mit mﾃｶglichkeit der pferdehaltung
Well-maintained bou...";36.7414518;-5.7930231;cadiz
550.000 竄ｬ;Chalet en Novo Sancti Petri-Loma de Sancti Petri;/comprar/chalet-novo_sancti_petri_loma_de_sancti_petri11139-37523059513_108500/;Novo Sancti Petri-Loma de Sancti Petri (Chiclana de la Frontera);4 habs.;3 baﾃｱos;140 mﾂｲ;;Chalet independiente, de cuatro dormitorios en parcela de 700 mﾂｲ, en novo sancti petri (chiclana de la frontera). En planta baja t...;36.360019855;-6.167015975;cadiz
165.000 竄ｬ;Piso en Durango;/comprar/piso-el_puerto_de_santa_maria_centro-35017891475_100500/;Centro (El Puerto de Santa Marﾃｭa);2 habs.;1 baﾃｱo;83 mﾂｲ;2ﾂｪ planta;"Piso para entrar a vivir en la zona de durango. 

Buena ubicaciﾃｳn, a pocos minutos del centro de la ciudad. Rodeado de todo tipo d...";36.60097;-6.2327202;cadiz
700.000 竄ｬ;Chalet en Coto La Campa;/comprar/chalet-costa_de_sancti_petri_playa_de_la_barrosa11139-42569207502_103800/;Costa de Sancti Petri-Playa de La Barrosa (Chiclana de la Frontera);3 habs.;2 baﾃｱos;210 mﾂｲ;;Bonito chalet de nueva construcciﾃｳn de estilo moderno con piscina en la zona del coto la campa. Magnﾃｭfico chalet urbano totalmente...;36.3654517;-6.1725941;cadiz
155.000 竄ｬ;Casa en calle del Faisﾃ｡n;/comprar/casa-centro_zona_noreste-35005563082_100500/;Centro-Zona Noreste (Chipiona);4 habs.;2 baﾃｱos;115 mﾂｲ;;ﾂ｡ En exclusiva! Independiente: casa totalmente independiente ubicada en zona residencial comercial, muy prﾃｳxima a centros educativ...;36.7330938;-6.4286187;cadiz
1.100.000 竄ｬ;Chalet en calle de Isaac Peral;/comprar/chalet-centro_zona_playas-44246121787_100500/;Centro-Zona Playas (Chipiona);5 habs.;5 baﾃｱos;217 mﾂｲ;;"Referencia: 1920

Has tenido un sueﾃｱo?. Hazlo realidad!
Si pensabas que no era posible, aquﾃｭ esta!
Vivienda unifamiliar en pleno c...";36.7410528;-6.4365885;cadiz
148.500 竄ｬ;Casa adosada en San Garcia;/comprar/casa_adosada-san_garcia_getares-44256397764_100500/;San Garcﾃｭa-Getares (Algeciras);3 habs.;2 baﾃｱos;140 mﾂｲ;;ﾂ｡Descubre tu prﾃｳximo hogar en getares! Se vende impresionante casa / chalet adosado de tres plantas, ubicada en una de las zonas m...;36.1075853;-5.4473418;cadiz
257.000 竄ｬ;Piso en Playa de las Tres Piedras-Costa Ballena;/comprar/piso-playa_de_las_tres_piedras_costa_ballena-39259498766_990821/;Playa de las Tres Piedras-Costa Ballena (Chipiona);2 habs.;2 baﾃｱos;85 mﾂｲ;1ﾂｪ planta;Excelente piso en cuanto a calidades se refiere, solerﾃｭa de piedra natural , cocina y baﾃｱos con mﾃ｡rmol y estuco, ventanas de alumi...;36.694761367;-6.41608217;cadiz
130.000 竄ｬ;Piso en Fuente Amarga;/comprar/piso-nucleo_urbano_urbanizaciones-44180644635_100500/;Nﾃｺcleo Urbano-Urbanizaciones (Chiclana de la Frontera);2 habs.;1 baﾃｱo;59 mﾂｲ;2ﾂｪ planta;Amplio piso situado en la zona residencial de fuente amarga, chiclana. Este inmueble se encuentra rodeado de una amplia variedad d...;36.410924948;-6.147906949;cadiz
149.500 竄ｬ;Piso en calle de la Batalla del Ebro,  s/n;/comprar/piso-caseria_de_ossio_san_carlos11100-4567215696_109700/;Caserﾃｭa de Ossio-San Carlos (San Fernando);2 habs.;2 baﾃｱos;70 mﾂｲ;Bajo;P2 Bajo B. Piso en un edificio de obra nueva de 70 m2 de superficie construida y ubicado en la zona de Soto de la Vega, enclavado en planta baja. Estﾃ｡ distribuido en 2 habitaciones, 2 baﾃｱos completos y terraza.;36,47723868;-6,198001734;cadiz
155.000 竄ｬ;Casa en calle Guindo;/comprar/casa-este-38387805153_522800/;Este (Jerez de la Frontera);4 habs.;2 baﾃｱos;193 mﾂｲ;;"Finca urbana dividida en 2 apartamentos , garaje , 2 trasteros y azotea .
En planta baja cuenta con el garaje con trastero de unos...";36.6800579;-6.113185;cadiz
250.000 竄ｬ;Casa en calle Avenida Alcalde Jesﾃｺs Mantara;/comprar/casa-noreste11405-40877611841_103800/;Noreste (Jerez de la Frontera);3 habs.;3 baﾃｱos;100 mﾂｲ;;Presentamos esta preciosa casa adosada en zona chapin. La vivienda se distribuye en tres dormitorios y dos baﾃｱos en planta primera...;36.6866674;-6.1223183;cadiz
450.000 竄ｬ;Casa unifamiliar en calle Carmen Viejo;/comprar/casa_unifamiliar-centro_calzada-45889936115_100200/;Centro-Calzada (Sanlﾃｺcar de Barrameda);;;750 mﾂｲ;;"Casa independiente con garaje en el centro 
Hoy os traemos esta magnifica casa independiente con garaje, en pleno centro, concreta...";36.7782291;-6.3511859;cadiz
750.000 竄ｬ;Chalet en 2ﾂｪ Pista de La Barrosa;/comprar/chalet-sancti_petri_playa_de_la_barrosa11139-96700711729_100500/;Costa de Sancti Petri-Playa de La Barrosa (Chiclana de la Frontera);3 habs.;1 baﾃｱo;115 mﾂｲ;;Se vende parcela urbana de 1.172 mﾂｲ aproximadamente en la playa de la barrosa, situada en una zona muy cercana a la principal zona...;36.3703403;-6.1796175;cadiz
198.000 竄ｬ;Apartamento en Costa Ballena;/comprar/apartamento-costa_ballena-35923379998_990821/;Costa Ballena (Rota);1 hab.;1 baﾃｱo;68 mﾂｲ;2ﾂｪ planta;Coqueta y cﾃｳmoda vivienda ubicada en las dunas, urbanizaciﾃｳn ubicada en muy buena zona de costa ballena, prﾃｳxima a la playa y a la...;36.6903356;-6.4117715;cadiz
1.500.000 竄ｬ;Chalet en Capuchinos;/comprar/chalet-sanlucar_de_barrameda_las_piletas-35035526289_100500/;Las Piletas (Sanlﾃｺcar de Barrameda);5 habs.;2 baﾃｱos;214 mﾂｲ;;Esta es una vivienda ﾃｺnica en la ciudad, se encuentra ubicada en una de las zonas mﾃ｡s exclusivas de la localidad y con una de las ...;36.7740019;-6.3625759;cadiz
210.000 竄ｬ;Casa en calle de Bellavista;/comprar/casa-prado_del_rey_centro_urbano-4234378816_996776/;Prado del Rey;5 habs.;4 baﾃｱos;433 mﾂｲ;;Magnﾃｭfica casa independiente en prado del rey, de 436 mﾂｲ construidos, consta de 5 habitaciones , sﾃｳtano, garaje subterrﾃ｡neo, magnﾃｭ...;36.7913432;-5.5556708;cadiz
85.000 竄ｬ;Casa adosada en Vejer de La Frontera;/comprar/casa_adosada-vejer_de_la_frontera_centro_urbano-44257777715_100500/;Vejer de la Frontera;3 habs.;1 baﾃｱo;66 mﾂｲ;;Del valle inmobiliaria os presenta en exclusiva esta estupenda casa reformada en la pedanﾃｭa de poblado varelo, a tan solo 15 minut...;36.249520032;-5.887491349;cadiz
130.000 竄ｬ;Casa en calle del Tulipﾃ｡n;/comprar/casa-jerez_de_la_frontera_oeste11408-42512812301_996776/;Oeste (Jerez de la Frontera);3 habs.;2 baﾃｱos;120 mﾂｲ;;Casa en venta en picadueﾃｱas alta. A junto a la salida de la circunvalaciﾃｳn de jerez , zona muy tranquila, la casa consta de 3 dorm...;36.6858309;-6.1509767;cadiz
319.900 竄ｬ;Casa en Campo de Golf;/comprar/casa-jerez_de_la_frontera_sur11408-40092831308_100500/;Sur (Jerez de la Frontera);3 habs.;3 baﾃｱos;128 mﾂｲ;;Magnifica pareada en una parcela de 220 mﾂｲ. La vivienda dispone de tres dormitorios con armarios empotrados, salﾃｳn comedor con pre...;36.6612744;-6.1501215;cadiz
357.000 竄ｬ;Piso en Paseo de las Viﾃｱas;/comprar/piso-jerez_de_la_frontera_norte11407-43413869576_103800/;Norte (Jerez de la Frontera);4 habs.;2 baﾃｱos;145 mﾂｲ;4ﾂｪ planta;Presentamos esta magnﾃｭfica vivienda en una de las urbanizaciones mﾃ｡s valoradas y mﾃ｡s deseadas de la zona norte. Esta vivienda ha s...;36.70567425;-6.114182154;cadiz
448.000 竄ｬ;Piso en Avenida de Andalucﾃｭa;/comprar/piso-playa_de_santa_maria_del_mar_bahia_blanca11007-45018351018_990852/;Playa de Santa Marﾃｭa del Mar-Bahﾃｭa Blanca (Cﾃ｡diz Capital);3 habs.;2 baﾃｱos;104 mﾂｲ;6ﾂｪ planta;Te presentamos esta magnifica vivienda totalmente reformada en una de las mejores zonas de la avenida principal de cﾃ｡diz,  junto a...;36.5230271;-6.2863317;cadiz
370.000 竄ｬ;Chalet en Camino Pista de Montijo;/comprar/chalet-centro_zona_noreste-44183948116_104700/;Centro-Zona Noreste (Chipiona);4 habs.;3 baﾃｱos;194 mﾂｲ;;La oportunidad de comprar la vivienda de tus sueﾃｱos, este espectacular chalet se encuentra en valdeconejos - montijo, en una urban...;36.757996456;-6.405688275;cadiz
410.000 竄ｬ;Casa en Chapin;/comprar/casa-noreste11405-35060768173_103800/;Noreste (Jerez de la Frontera);5 habs.;5 baﾃｱos;180 mﾂｲ;;"Gran casa pareada en hacienda el polo, muy prﾃｳximo a estadio de chapﾃｭn. Zona tranquila y cercana al centro de jerez. 
Cuenta con u...";36.6911638;-6.1248926;cadiz
1.300.000 竄ｬ;Casa en Vistahermosa;/comprar/casa-el_puerto_de_santa_maria_vistahermosa-45002331571_265000/;Vistahermosa (El Puerto de Santa Marﾃｭa);5 habs.;4 baﾃｱos;500 mﾂｲ;;En venta esta espaciosa casa en el puerto de santa marﾃｭa, con una superficie total de 500 mﾂｲ construida sobre un solar de 1000 mﾂｲ....;36.5854414;-6.2623925;cadiz
270.000 竄ｬ;Piso en Palacio Congreso;/comprar/piso-el_populo_santa_maria11006-43382542036_103800/;El Pﾃｳpulo-Santa Marﾃｭa (Cﾃ｡diz Capital);4 habs.;1 baﾃｱo;135 mﾂｲ;;Piso  en palacio congreso, con 135 mﾂｲ construidos, 130 mﾂｲ ﾃｺtiles, 4 dormitorios, 1 baﾃｱos, estado de origen, exterior, cocina indep...;36.5292848;-6.2907306;cadiz
222.000 竄ｬ;Piso en Centro;/comprar/piso-jerez_de_la_frontera_centro11403-40858772161_100500/;Centro (Jerez de la Frontera);3 habs.;2 baﾃｱos;160 mﾂｲ;Bajo;"Precioso piso en primera planta completamente reformado con 160 mﾂｲ construidos

Se vende precioso piso en todo el corazﾃｳn de jerez...";36.6826667;-6.1373757;cadiz
179.900 竄ｬ;Piso en Centro;/comprar/piso-jerez_de_la_frontera_centro11402-45075990499_100500/;Centro (Jerez de la Frontera);4 habs.;2 baﾃｱos;104 mﾂｲ;3ﾂｪ planta;Piso de 4 dormitorios con amplio salﾃｳn con terraza, 2 baﾃｱos completos, uno de ellos con placa de ducha. Edificio con ascensor.  Po...;36.690376;-6.135262631;cadiz
698.000 竄ｬ;Casa en Vistahermosa;/comprar/casa-el_puerto_de_santa_maria_vistahermosa-44197475893_265000/;Vistahermosa (El Puerto de Santa Marﾃｭa);4 habs.;3 baﾃｱos;216 mﾂｲ;;Encantadora casa en venta  en la zona de vistahermosa, en el puerto de santa marﾃｭa. Con una superficie total de 216 mﾂｲ y una super...;36.5899722;-6.2539444;cadiz
490.000 竄ｬ;Chalet en La Laguna;/comprar/chalet-chipiona_la_laguna-95018459530_100500/;La Laguna (Chipiona);3 habs.;3 baﾃｱos;231 mﾂｲ;;Precioso chalet en zona de la laguna , tiene 504 mﾂｲ de parcela, 231 mﾂｲ construidos. Se divide en planta sﾃｳtano , planta baja y pri...;36.7174466;-6.4326295;cadiz
310.000 竄ｬ;Chalet en Este;/comprar/chalet-rural11593-45836789077_100500/;Rural (Jerez de la Frontera);4 habs.;2 baﾃｱos;533 mﾂｲ;;"Oportunidad de inversiﾃｳn.
Esta buscando un chalet? , esta es tu oportunidad o si por el contrario quieres una vivienda que te ofre...";36.6765036;-6.0205337;cadiz
75.900 竄ｬ;Piso en calle de los Pescadores;/comprar/piso-san_fernando_el_carmen-42504035806_527956/;El Carmen (San Fernando);4 habs.;1 baﾃｱo;72 mﾂｲ;3ﾂｪ planta;Piso en venta en san fernando, que dispone de una superficie construida de 72 mﾂｲ, superficie ﾃｺtil de 64 mﾂｲ. Se trata de una tercer...;36.4594141;-6.1983146;cadiz
210.000 竄ｬ;Piso en Playa de Regla;/comprar/piso-centro_zona_playas-39188568713_100500/;Centro-Zona Playas (Chipiona);3 habs.;2 baﾃｱos;72 mﾂｲ;1ﾂｪ planta;A01283  piso a 25 metros de playa de regla, residencial con acceso desde el paseo marﾃｭtimo, vivienda de tres dormitorios , origina...;36.7328206;-6.4398121;cadiz
