precio;sub_descr;href;ubicacion;habitaciones;banios;mt2;otros;publicado_hace;plataforma;CCAA
3.000€;Apartamento Planta Media;https://rd.clk.thribee.com/id.1C1AoGS1ioP/origin.1/section.97/section_type.1/country.es/vertical.homes/iuid.219638trovit-web-6f6984d597-q49nr66a3db746d8b7/tracking.%7B%22cmp%22%3A%22u%22%7D/what_d.Malaga/type.2/page.30/cookieid.102011166a3db746d4167.29165662/pos.2/;29679, Provincia de Málaga;3  habitaciones;2  baños;111  m²;Apartamento Planta Media, Benahavís, Costa del Sol. 3 Dormitorios, 2 Baños, Construidos 111 m², Terraza 30 m². Posición: Cerca de Tiendas, Cerca...;Hace 3 días;Rentola;Malaga
1.800€;Ático;https://rd.clk.thribee.com/id.1XMszfH1m1-/origin.1/section.97/section_type.1/country.es/vertical.homes/iuid.219638trovit-web-6f6984d597-q49nr66a3db746d8b7/tracking.%7B%22cmp%22%3A%22u%22%7D/what_d.Malaga/type.2/page.30/cookieid.102011166a3db746d4167.29165662/pos.3/;29601, Provincia de Málaga;3  habitaciones;2  baños;155  m²;Apartamento en Las Chapas: 3 habitaciones, 2 baños, terraza y piscina. A dos minutos andando de la playa. Disponible para larga temporada a parti...;Hace 3 días;Rentola;Malaga
9.000€;Villa - Chalet;https://rd.clk.thribee.com/id.0ufq1Q41Q1o/origin.1/section.97/section_type.1/country.es/vertical.homes/iuid.219638trovit-web-6f6984d597-q49nr66a3db746d8b7/tracking.%7B%22cmp%22%3A%22u%22%7D/what_d.Malaga/type.2/page.30/cookieid.102011166a3db746d4167.29165662/pos.4/;29604, Málaga, Provincia de Málaga;6  habitaciones;4  baños;558  m²;Villa familiar completamente reformada ubicada en Hacienda las Chapas, una de las zonas residenciales más exclusivas de Marbella, cerca de playas...;Hace 3 días;Rentola;Malaga
2.750€;Apartamento Planta Media;https://rd.clk.thribee.com/id.t1N9151ZyY7/origin.1/section.97/section_type.1/country.es/vertical.homes/iuid.219638trovit-web-6f6984d597-q49nr66a3db746d8b7/tracking.%7B%22cmp%22%3A%22u%22%7D/what_d.Malaga/type.2/page.30/cookieid.102011166a3db746d4167.29165662/pos.5/;29660, Provincia de Málaga;2  habitaciones;2  baños;100  m²;Apartamento de 2 dormitorios totalmente reformado en el corazon de Nueva Andalucia. En el nivel de entrada de este apartamento, hay un amplio dor...;Hace 3 días;Rentola;Malaga
6.000€;Apartamento Planta Media;https://rd.clk.thribee.com/id.1X1c1WpN4q1D/origin.1/section.97/section_type.1/country.es/vertical.homes/iuid.219638trovit-web-6f6984d597-q49nr66a3db746d8b7/tracking.%7B%22cmp%22%3A%22u%22%7D/what_d.Malaga/type.2/page.30/cookieid.102011166a3db746d4167.29165662/pos.6/;29680, Provincia de Málaga;3  habitaciones;3  baños;127  m²;Doncella Beach, primera linea del mar uno de los complejos mas exclusivos de la zona de Estepona, a solo unos minutos a pie del puerto deportivo,...;Hace 3 días;Rentola;Malaga
25.000€;Villa - Chalet;https://rd.clk.thribee.com/id.1p1N81F18g91K/origin.1/section.97/section_type.1/country.es/vertical.homes/iuid.219638trovit-web-6f6984d597-q49nr66a3db746d8b7/tracking.%7B%22cmp%22%3A%22u%22%7D/what_d.Malaga/type.2/page.30/cookieid.102011166a3db746d4167.29165662/pos.7/;29601, Provincia de Málaga;6  habitaciones;5  baños;567  m²;UNA VILLA SOFISTICADA EN NUEVA ANDALUCIA Descubra una casa totalmente renovada con profesionales Sistemas de seguridad que incluyen cámaras, alar...;Hace 3 días;Rentola;Malaga
9.000€;Villa - Chalet;https://rd.clk.thribee.com/id.16qfX1g-qU/origin.1/section.97/section_type.1/country.es/vertical.homes/iuid.219638trovit-web-6f6984d597-q49nr66a3db746d8b7/tracking.%7B%22cmp%22%3A%22u%22%7D/what_d.Malaga/type.2/page.30/cookieid.102011166a3db746d4167.29165662/pos.8/;29670, Provincia de Málaga;4  habitaciones;2  baños;245  m²;Alquiler para larga de Septiembre hasta Junio En verano se alquila a corta temporada Villa en alquiler a corta temporada en San Pedro zona las Pe...;Hace 3 días;Rentola;Malaga
4.500€;Apartamento Planta Media;https://rd.clk.thribee.com/id.F1cUTEJ8P/origin.1/section.97/section_type.1/country.es/vertical.homes/iuid.219638trovit-web-6f6984d597-q49nr66a3db746d8b7/tracking.%7B%22cmp%22%3A%22u%22%7D/what_d.Malaga/type.2/page.30/cookieid.102011166a3db746d4167.29165662/pos.9/;29648, Provincia de Málaga;3  habitaciones;2  baños;94  m²;Casa banderas la cala de mijas vida de lujo con padel y gimnasio increíble apartamento de lujo con impresionantes vistas panorámicas. Disponible...;Hace 3 días;Rentola;Malaga
6.900€;Villa - Chalet;https://rd.clk.thribee.com/id.1R1F9lk12nU/origin.1/section.97/section_type.1/country.es/vertical.homes/iuid.219638trovit-web-6f6984d597-q49nr66a3db746d8b7/tracking.%7B%22cmp%22%3A%22u%22%7D/what_d.Malaga/type.2/page.30/cookieid.102011166a3db746d4167.29165662/pos.10/;29688, Provincia de Málaga;4  habitaciones;3  baños;180  m²;Villa. Chalet, El Paraiso, Costa del Sol. 4 Dormitorios, 3 Baños, Construidos 180 m², Terraza 30 m², Jardin/Terreno 962 m². Posición: Lado de la...;Hace 3 días;Rentola;Malaga
3.900€;Apartamento Planta Media;https://rd.clk.thribee.com/id.y1wC1Xj1Tz1e/origin.1/section.97/section_type.1/country.es/vertical.homes/iuid.219638trovit-web-6f6984d597-q49nr66a3db746d8b7/tracking.%7B%22cmp%22%3A%22u%22%7D/what_d.Malaga/type.2/page.30/cookieid.102011166a3db746d4167.29165662/pos.11/;29680, Provincia de Málaga;2  habitaciones;2  baños;100  m²;Atalaya, estepona. En primera linea de golf, apartamento de 2 dormitorios y 2 baños orientado al sur. Contrato de alquiler temporal, renovable si...;Hace 3 días;Rentola;Malaga
3.000€;Apartamento Planta Media;https://rd.clk.thribee.com/id.I61_Y1jG1dB/origin.1/section.97/section_type.1/country.es/vertical.homes/iuid.219638trovit-web-6f6984d597-q49nr66a3db746d8b7/tracking.%7B%22cmp%22%3A%22u%22%7D/what_d.Malaga/type.2/page.30/cookieid.102011166a3db746d4167.29165662/pos.12/;29680, Provincia de Málaga;3  habitaciones;2  baños;100  m²;Disponible a partir del 6 de septiembre: Casa de Lujo de 3 Dormitorios Nos complace presentar esta impresionante propiedad nueva, disponible a pa...;Hace 3 días;Rentola;Malaga
2.300€;Alquiler piso con vistas al mar;https://rd.clk.thribee.com/id.3_f1pw1BY1H/origin.1/section.97/section_type.1/country.es/vertical.homes/iuid.219638trovit-web-6f6984d597-q49nr66a3db746d8b7/tracking.%7B%22cmp%22%3A%22u%22%7D/what_d.Malaga/type.2/page.30/cookieid.102011166a3db746d4167.29165662/pos.13/;29007, Provincia de Málaga;2  habitaciones;2  baños;59  m²;...de un largo día o para activar la mañana. ¡Vive en este exclusivo Oasis Urbano en el corazón de Málaga! ¡No dejes pasar esta oportunidad única!...;Hace 3 días;Rentola;Malaga
1.800€;Apartamento Planta Baja;https://rd.clk.thribee.com/id.1M1_D_1a5t1G/origin.1/section.97/section_type.1/country.es/vertical.homes/iuid.219638trovit-web-6f6984d597-q49nr66a3db746d8b7/tracking.%7B%22cmp%22%3A%22u%22%7D/what_d.Malaga/type.2/page.30/cookieid.102011166a3db746d4167.29165662/pos.14/;29690, Provincia de Málaga;2  habitaciones;2  baños;103  m²;Es un nuevo desarrollo de apartamentos y áticos ubicados dentro de los terrenos de Casares y son los únicos apartamentos existentes con vistas al...;Hace 3 días;Rentola;Malaga
2.700€;Apartamento Planta Baja;https://rd.clk.thribee.com/id.1O1emQk1V1n1W/origin.1/section.97/section_type.1/country.es/vertical.homes/iuid.219638trovit-web-6f6984d597-q49nr66a3db746d8b7/tracking.%7B%22cmp%22%3A%22u%22%7D/what_d.Malaga/type.2/page.30/cookieid.102011166a3db746d4167.29165662/pos.15/;29680, Provincia de Málaga;2  habitaciones;2  baños;117  m²;Disponible para alquiler desde el 15 de julio hasta finales de junio de 2025. Espléndido apartamento nuevo con una gran terraza y jardín privado...;Hace 3 días;Rentola;Malaga
7.500€;Apartamento Planta Baja;https://rd.clk.thribee.com/id.11261nbz1z5/origin.1/section.97/section_type.1/country.es/vertical.homes/iuid.219638trovit-web-6f6984d597-q49nr66a3db746d8b7/tracking.%7B%22cmp%22%3A%22u%22%7D/what_d.Malaga/type.2/page.30/cookieid.102011166a3db746d4167.29165662/pos.16/;29660, Provincia de Málaga;3  habitaciones;2  baños;130  m²;Apartamento Planta Baja, Puerto Banús, Costa del Sol. 3 Dormitorios, 2 Baños, Construidos 130 m², Terraza 40 m². Posición: Primera línea de Playa...;Hace 3 días;Rentola;Malaga
6.500€;Ático Dúplex;https://rd.clk.thribee.com/id.C1V19LQx1-1n/origin.1/section.97/section_type.1/country.es/vertical.homes/iuid.219638trovit-web-6f6984d597-q49nr66a3db746d8b7/tracking.%7B%22cmp%22%3A%22u%22%7D/what_d.Malaga/type.2/page.30/cookieid.102011166a3db746d4167.29165662/pos.17/;29602, Provincia de Málaga;3  habitaciones;3  baños;272  m²;Reformado atico-duplex de 3dormotorios/3 baños in Nagueles-Marbella con vistas panorámicas parciales al mar y Puerto Banus. ¡Bienvenido a tu oasi...;Hace 3 días;Rentola;Malaga
3.000€;853020 - Villa For rent in Mijas Pueblo, Mijas, Málaga, Spain;https://rd.clk.thribee.com/id.GwVC1U151ug/origin.1/section.97/section_type.1/country.es/vertical.homes/iuid.219638trovit-web-6f6984d597-q49nr66a3db746d8b7/tracking.%7B%22cmp%22%3A%22u%22%7D/what_d.Malaga/type.2/page.30/cookieid.102011166a3db746d4167.29165662/pos.18/;29650,;4  habitaciones;5  baños;612  m²;Huge impressive villa in the center of mijas pueblo available for long term let. Entrance hall, large lounge-dining room with fireplace, very lar...;Hace 3 días;Rentola;Malaga
3.900€;Apartamento Planta Baja;https://rd.clk.thribee.com/id.WS181sNJnP/origin.1/section.97/section_type.1/country.es/vertical.homes/iuid.219638trovit-web-6f6984d597-q49nr66a3db746d8b7/tracking.%7B%22cmp%22%3A%22u%22%7D/what_d.Malaga/type.2/page.30/cookieid.102011166a3db746d4167.29165662/pos.19/;29601, Málaga, Provincia de Málaga;3  habitaciones;2  baños;155  m²;Apartamento Planta Media, Marbella, Costa del Sol. 3 Dormitorios, 2 Baños, Construidos 155 m², Terraza 20 m². Posición: Primera línea de Playa, C...;Hace 3 días;Rentola;Malaga
2.200€;Apartamento Planta Media;https://rd.clk.thribee.com/id.QN141yX1j1U1m/origin.1/section.97/section_type.1/country.es/vertical.homes/iuid.219638trovit-web-6f6984d597-q49nr66a3db746d8b7/tracking.%7B%22cmp%22%3A%22u%22%7D/what_d.Malaga/type.2/page.30/cookieid.102011166a3db746d4167.29165662/pos.20/;29678, Provincia de Málaga;2  habitaciones;2  baños;124  m²;Bonito y impecable apartamento SIN MUEBLES en primera planta situado en la reconocida urbanización de Alhambra del Golf fase 3, situado a solo 3...;Hace 3 días;Rentola;Malaga
550€;728938 - Apartment For rent in Calypso, Mijas, Málaga, Spain;https://rd.clk.thribee.com/id.k1Zc1XgEU1P/origin.1/section.97/section_type.1/country.es/vertical.homes/iuid.219638trovit-web-6f6984d597-q49nr66a3db746d8b7/tracking.%7B%22cmp%22%3A%22u%22%7D/what_d.Malaga/type.2/page.30/cookieid.102011166a3db746d4167.29165662/pos.21/;29650,;1  habitaciones;1  baños;-;Apartment, Furnished, Communal Pool, Garden: Community with Pool...;Hace 3 días;Rentola;Malaga
2.300€;Apartamento Planta Media;https://rd.clk.thribee.com/id.1yW01LY18F1H/origin.1/section.97/section_type.1/country.es/vertical.homes/iuid.219638trovit-web-6f6984d597-q49nr66a3db746d8b7/tracking.%7B%22cmp%22%3A%22u%22%7D/what_d.Malaga/type.2/page.30/cookieid.102011166a3db746d4167.29165662/pos.22/;29678, Provincia de Málaga;3  habitaciones;3  baños;205  m²;Solo alquileres de larga duración. NO SE ACEPTAN MASCOTAS Te presentamos un magnífico dúplex penthouse situado en una hermosa urbanización privad...;Hace 3 días;Rentola;Malaga
12.500€;Villa - Chalet;https://rd.clk.thribee.com/id.5Hi18l1R13R/origin.1/section.97/section_type.1/country.es/vertical.homes/iuid.219638trovit-web-6f6984d597-q49nr66a3db746d8b7/tracking.%7B%22cmp%22%3A%22u%22%7D/what_d.Malaga/type.2/page.30/cookieid.102011166a3db746d4167.29165662/pos.23/;29679, Provincia de Málaga;5  habitaciones;6  baños;550  m²;Descubre el epítome de lujo viviendo en esta magnífica villa de cinco dormitorios, situada en la prestigiosa zona de Benahavis, Málaga. Esta...;Hace 3 días;Rentola;Malaga
1.800€;Apartamento Planta Media;https://rd.clk.thribee.com/id.DvW1rfi1j1w/origin.1/section.97/section_type.1/country.es/vertical.homes/iuid.219638trovit-web-6f6984d597-q49nr66a3db746d8b7/tracking.%7B%22cmp%22%3A%22u%22%7D/what_d.Malaga/type.2/page.30/cookieid.102011166a3db746d4167.29165662/pos.24/;29600, Provincia de Málaga;2  habitaciones;2  baños;90  m²;...Málaga. Con el lujo de disponer de una zona exclusiva y residencial, pero con todas las comodidades necesarias a mano: El centro comercial La...;Hace 3 días;Rentola;Malaga
2.200€;Apartamento Planta Baja;https://rd.clk.thribee.com/id.G1i1mE1Y1L_1g/origin.1/section.97/section_type.1/country.es/vertical.homes/iuid.219638trovit-web-6f6984d597-q49nr66a3db746d8b7/tracking.%7B%22cmp%22%3A%22u%22%7D/what_d.Malaga/type.2/page.30/cookieid.102011166a3db746d4167.29165662/pos.25/;29688, Provincia de Málaga;2  habitaciones;2  baños;147  m²;Bonito apartamento en Planta baja en la urbanización Hacienda del Sol, a 300 m2 de la playa. Este apartamento se distribuye en hall de entrada, u...;Hace 3 días;Rentola;Malaga
3.000€;Apartment for rent in Selwo, Estepona;https://rd.clk.thribee.com/id.C191y14rPx9/origin.1/section.97/section_type.1/country.es/vertical.homes/iuid.10722trovit-web-6f6984d597-4jgrz66a3db779f3b4/tracking.%7B%22cmp%22%3A%22u%22%7D/what_d.Malaga/type.2/page.13/cookieid.102011166a3db779f0514.08616610/pos.1/;;3  habitaciones;2  baños;100  m²;Available from September 6th: Luxury 3-Bedroom Apartment We are thrilled to introduce this stunning new property, available from September 6th. O...;Hace 1 día;Kuhamia;Malaga
1.200€;Magnifico piso en centro arroyo de la miel - benalmádena;https://rd.clk.thribee.com/id.21911p1U1sD1/origin.1/section.232/section_type.2/country.es/vertical.homes/iuid.10722trovit-web-6f6984d597-4jgrz66a3db779f3b4/tracking.%7B%22cmp%22%3A%22u%22%7D/what_d.Malaga/type.2/page.13/cookieid.102011166a3db779f0514.08616610/pos.1/;29630, Arroyo de la Miel, Benalmádena, Provincia de Málaga;2 habitaciones;1 baños;75 m²;A a largo plazo*. ¡Descubre tu nuevo hogar en el corazón de Benalmádena, en la vibrante zona de Arroyo de la Miel! Este luminoso y moderno aparta...;Hace 5 días;Vadevender;Malaga
625€;Alquiler piso céntrico;https://rd.clk.thribee.com/id.2Ff1V1Q1E1eS/origin.1/section.232/section_type.2/country.es/vertical.homes/iuid.10722trovit-web-6f6984d597-4jgrz66a3db779f3b4/tracking.%7B%22cmp%22%3A%22u%22%7D/what_d.Malaga/type.2/page.13/cookieid.102011166a3db779f0514.08616610/pos.2/;29200, Antequera, Provincia de Málaga;3 habitaciones;1 baños;85 m²;Se alquila piso en zona centro con 3 habitaciones y un baño, se trata de una segunda planta sin ascensor. Precio de a de 600€ mensuales, luz y ag...;Hace 5 días;Vadevender;Malaga
10.000€;Penthouse in Marbella;https://rd.clk.thribee.com/id.umVe41i1u1c/origin.1/section.97/section_type.1/country.es/vertical.homes/iuid.10722trovit-web-6f6984d597-4jgrz66a3db779f3b4/tracking.%7B%22cmp%22%3A%22u%22%7D/what_d.Malaga/type.2/page.13/cookieid.102011166a3db779f0514.08616610/pos.2/;29601, Marbella, Provincia de Málaga;3  habitaciones;3  baños;181  m²;"Large 3 bedroom penthouse for long term rent in an Exclusive development in the heart of The Golden Mile in Marbella town. The ""Golden Mile"", Mar...";Hace 1 día;Rentola;Malaga
15.000€;Villa For Rent in Milla De Oro - Sierra Blanca, Marbella;https://rd.clk.thribee.com/id.1V1f-171g1I--/origin.1/section.97/section_type.1/country.es/vertical.homes/iuid.10722trovit-web-6f6984d597-4jgrz66a3db779f3b4/tracking.%7B%22cmp%22%3A%22u%22%7D/what_d.Malaga/type.2/page.13/cookieid.102011166a3db779f0514.08616610/pos.3/;29602, Marbella, Provincia de Málaga;6  habitaciones;6  baños;795  m²;...processEquipmentAir conditioningPrivate pool GardenLocationNeighbourhood Sierra BlancaDistrict Nagüeles-Milla de OroDescription Marbella, Málaga...;Hace 1 día;Rentola;Malaga
15.000€;Villa For Rent in Guadalmina Baja, Marbella;https://rd.clk.thribee.com/id.1q1u_1Xh1E101t/origin.1/section.97/section_type.1/country.es/vertical.homes/iuid.10722trovit-web-6f6984d597-4jgrz66a3db779f3b4/tracking.%7B%22cmp%22%3A%22u%22%7D/what_d.Malaga/type.2/page.13/cookieid.102011166a3db779f0514.08616610/pos.4/;29678, Marbella, Provincia de Málaga;5  habitaciones;5  baños;700  m²;Ultra modern villa located in Casasola Guadalmina Baja Urbanization Loma De Casasola fully furnished and modern luxury and high standingThe villa...;Hace 1 día;Rentola;Malaga
1.950€;Apartment For Rent in Puerto Banús, Marbella;https://rd.clk.thribee.com/id.61as1516YCw/origin.1/section.97/section_type.1/country.es/vertical.homes/iuid.10722trovit-web-6f6984d597-4jgrz66a3db779f3b4/tracking.%7B%22cmp%22%3A%22u%22%7D/what_d.Malaga/type.2/page.13/cookieid.102011166a3db779f0514.08616610/pos.5/;29660, Marbella, Provincia de Málaga;2  habitaciones;2  baños;115  m²;"We rent minimum 6 months furnished"". Available from September 2024 to end of June 2025Urbanisation Lorcrimar V near Puerto Banus close to schools...";Hace 1 día;Rentola;Malaga
9.000€;Villa For Rent in Milla De Oro - Sierra Blanca, Marbella;https://rd.clk.thribee.com/id.i1h1k1-1S141-1U/origin.1/section.97/section_type.1/country.es/vertical.homes/iuid.10722trovit-web-6f6984d597-4jgrz66a3db779f3b4/tracking.%7B%22cmp%22%3A%22u%22%7D/what_d.Malaga/type.2/page.13/cookieid.102011166a3db779f0514.08616610/pos.6/;29602, Marbella, Provincia de Málaga;4  habitaciones;4  baños;295  m²;Sometimes architecture becomes a thing of beauty, when no expense is spared by taking care of the smallest details, and every aspect of the const...;Hace 1 día;Rentola;Malaga
1.500€;Piso en alquiler en Centro (Málaga) – | Gilmar Consulting;https://rd.clk.thribee.com/id.kp6r11P1bi/origin.1/section.97/section_type.1/country.es/vertical.homes/iuid.10722trovit-web-6f6984d597-4jgrz66a3db779f3b4/tracking.%7B%22cmp%22%3A%22u%22%7D/what_d.Malaga/type.2/page.13/cookieid.102011166a3db779f0514.08616610/pos.7/;Centro, Málaga, Provincia de Málaga;2  habitaciones;2  baños;85  m²;Gilmar Consulting Inmobiliario Málaga presenta en alquiler este fantástico Inmueble totalmente amueblada y equipado en pleno centro Histórico...;Hace 1 día;Kuhamia;Malaga
3.500€;Ground Floor Apartment · Marbella;https://rd.clk.thribee.com/id.1uu1-E1Xg7T/origin.1/section.97/section_type.1/country.es/vertical.homes/iuid.10722trovit-web-6f6984d597-4jgrz66a3db779f3b4/tracking.%7B%22cmp%22%3A%22u%22%7D/what_d.Malaga/type.2/page.13/cookieid.102011166a3db779f0514.08616610/pos.8/;Marbella, Provincia de Málaga;3  habitaciones;3  baños;146  m²;Introducing a beautiful ground floor apartment in the highly desirable Coto Real complex, ideally located just a 5-minute drive from Puente Roman...;Hace 1 día;Kuhamia;Malaga
2.900€;Duplex in Marbella;https://rd.clk.thribee.com/id.vLkX11A1FZ/origin.1/section.97/section_type.1/country.es/vertical.homes/iuid.10722trovit-web-6f6984d597-4jgrz66a3db779f3b4/tracking.%7B%22cmp%22%3A%22u%22%7D/what_d.Malaga/type.2/page.13/cookieid.102011166a3db779f0514.08616610/pos.9/;Málaga, Provincia de Málaga;3  habitaciones;2  baños;144  m²;This magnificent apartment is within a complex that has security, it is located in a very quiet residential area with several restaurants very cl...;Hace 1 día;Kuhamia;Malaga
14.000€;14.000 Ground floor duplex for rent in Laguna de Banus, Marbella - Puerto Banus | Panorama;https://rd.clk.thribee.com/id.Y1K1m2k1D-/origin.1/section.97/section_type.1/country.es/vertical.homes/iuid.10722trovit-web-6f6984d597-4jgrz66a3db779f3b4/tracking.%7B%22cmp%22%3A%22u%22%7D/what_d.Malaga/type.2/page.13/cookieid.102011166a3db779f0514.08616610/pos.10/;29670, Marbella, Provincia de Málaga;3  habitaciones;3  baños;444  m²;Spacious duplex apartment in a privileged beachfront location within the spectacular community of Laguna de Banus. Located just a short walk from...;Hace 1 día;Rentola;Malaga
2.500€;Middle Floor Apartment in New Golden Mile;https://rd.clk.thribee.com/id._1WHK1jqQ1q/origin.1/section.97/section_type.1/country.es/vertical.homes/iuid.10722trovit-web-6f6984d597-4jgrz66a3db779f3b4/tracking.%7B%22cmp%22%3A%22u%22%7D/what_d.Malaga/type.2/page.13/cookieid.102011166a3db779f0514.08616610/pos.11/;29689,;2  habitaciones;2  baños;120  m²;New golden mile. Estepona. Modern, impeccable apartment with 2 bedrooms and 2 bathrooms located in a gated complex located on the beachfront 5 mi...;Hace 1 día;Rentola;Malaga
3.500€;Penthouse For Rent in Puerto Banús, Marbella;https://rd.clk.thribee.com/id.1Jq1etX1Y31N/origin.1/section.97/section_type.1/country.es/vertical.homes/iuid.10722trovit-web-6f6984d597-4jgrz66a3db779f3b4/tracking.%7B%22cmp%22%3A%22u%22%7D/what_d.Malaga/type.2/page.13/cookieid.102011166a3db779f0514.08616610/pos.12/;29660, Marbella, Provincia de Málaga;3  habitaciones;2  baños;185  m²;Urbanizacion Embrujo Playa near beach and paseo Maritimo, Hotel Guadalpin banus, Mistral Beach, near college beautiful duplex penthouse completel...;Hace 1 día;Rentola;Malaga
1.550€;Apartment For Rent in Puerto Banús, Marbella;https://rd.clk.thribee.com/id.y1ib1v1GHw17/origin.1/section.97/section_type.1/country.es/vertical.homes/iuid.10722trovit-web-6f6984d597-4jgrz66a3db779f3b4/tracking.%7B%22cmp%22%3A%22u%22%7D/what_d.Malaga/type.2/page.13/cookieid.102011166a3db779f0514.08616610/pos.13/;29660, Marbella, Provincia de Málaga;2  habitaciones;2  baños;115  m²;Apartamento en Marbella, con 2 dormitorios y 2 baños. 115 m 2 de superficie útil, ofreciendo un espacio muy amplio para sus necesidades. Este inm...;Hace 1 día;Rentola;Malaga
2.400€;Middle Floor Apartment in Málaga;https://rd.clk.thribee.com/id.1C1N1Pi1We1B1A/origin.1/section.97/section_type.1/country.es/vertical.homes/iuid.10722trovit-web-6f6984d597-4jgrz66a3db779f3b4/tracking.%7B%22cmp%22%3A%22u%22%7D/what_d.Malaga/type.2/page.13/cookieid.102011166a3db779f0514.08616610/pos.14/;29005, Provincia de Málaga;2  habitaciones;2  baños;105  m²;"Exclusive long-term rental apartment; modern and fully equipped. Located in an impressive building that reflects elegance and comfort, this long-...";Hace 1 día;Rentola;Malaga
2.400€;Apartamento Planta Media;https://rd.clk.thribee.com/id.1Cu1Q1LNMmU/origin.1/section.97/section_type.1/country.es/vertical.homes/iuid.10722trovit-web-6f6984d597-4jgrz66a3db779f3b4/tracking.%7B%22cmp%22%3A%22u%22%7D/what_d.Malaga/type.2/page.13/cookieid.102011166a3db779f0514.08616610/pos.15/;29360, Provincia de Málaga;2  habitaciones;2  baños;90  m²;Un complejo nuevo en el corazón de La Campana. Estructuras modernas, fácil acceso a comercios y cerca de servicios y escuelas. Este moderno apart...;Hace 1 día;Rentola;Malaga
11.000€;Villa for rent in Benahavis;https://rd.clk.thribee.com/id.RQZ1417Dp8/origin.1/section.97/section_type.1/country.es/vertical.homes/iuid.10722trovit-web-6f6984d597-4jgrz66a3db779f3b4/tracking.%7B%22cmp%22%3A%22u%22%7D/what_d.Malaga/type.2/page.13/cookieid.102011166a3db779f0514.08616610/pos.16/;Benahavís, Provincia de Málaga;6  habitaciones;6  baños;500  m²;Immerse yourself in the luxury and tranquility of this six-bedroom contemporary villa, nestled within the secure confines of Monte Mayor, a prest...;Hace 1 día;Kuhamia;Malaga
1.600€;Ático Dúplex;https://rd.clk.thribee.com/id.1S1wfs81Y1P1V/origin.1/section.97/section_type.1/country.es/vertical.homes/iuid.10722trovit-web-6f6984d597-4jgrz66a3db779f3b4/tracking.%7B%22cmp%22%3A%22u%22%7D/what_d.Malaga/type.2/page.13/cookieid.102011166a3db779f0514.08616610/pos.17/;29648, Provincia de Málaga;3  habitaciones;2  baños;107  m²;Propiedad para alquiler de larga temporada en Casares Costa This 2-storey property is a Duplex Penthouse and consists of a living room, a kitchen...;Hace 1 día;Rentola;Malaga
6.500€;Villa For Rent in Este - El Rosario, Marbella;https://rd.clk.thribee.com/id.1M61i1g1K1_1T14/origin.1/section.97/section_type.1/country.es/vertical.homes/iuid.10722trovit-web-6f6984d597-4jgrz66a3db779f3b4/tracking.%7B%22cmp%22%3A%22u%22%7D/what_d.Malaga/type.2/page.13/cookieid.102011166a3db779f0514.08616610/pos.18/;29604, Marbella, Provincia de Málaga;5  habitaciones;4  baños;290  m²;El rosario near marbella golf course country club near casanis beach near the shopping centre la cañada Villa for long term rental available from...;Hace 1 día;Rentola;Malaga
12.000€;Villa For Rent in Este - La Alqueria, Marbella;https://rd.clk.thribee.com/id.CJDs1dw71-/origin.1/section.97/section_type.1/country.es/vertical.homes/iuid.10722trovit-web-6f6984d597-4jgrz66a3db779f3b4/tracking.%7B%22cmp%22%3A%22u%22%7D/what_d.Malaga/type.2/page.13/cookieid.102011166a3db779f0514.08616610/pos.19/;29670, Marbella, Provincia de Málaga;5  habitaciones;5  baños;460  m²;Casa en Marbella, con 5 dormitorios y 5 baños. 460 m 2 de superficie útil, ofreciendo un espacio muy amplio para sus necesidades. Este inmueble,...;Hace 1 día;Rentola;Malaga
1.683€;Great 2-bedroom house in Gualdalmina;https://rd.clk.thribee.com/id.u11z1sOv1f8/origin.1/section.97/section_type.1/country.es/vertical.homes/iuid.10722trovit-web-6f6984d597-4jgrz66a3db779f3b4/tracking.%7B%22cmp%22%3A%22u%22%7D/what_d.Malaga/type.2/page.13/cookieid.102011166a3db779f0514.08616610/pos.20/;29678, Marbella, Provincia de Málaga;2  habitaciones;2  baños;-;Te apetece un lugar lleno de lujo y comodidad para estas vacaciones? Nuestra casa de verano está completamente equipada con todas las comodidades...;Hace 1 día;Rentola;Malaga
