precio;sub_descr;href;ubicacion;habitaciones;banios;mt2;planta;otros;latitude;longitude;CCAA
A consultar;Chalet en calle de la Almeja;/alquilar/chalet-costa_de_sancti_petri_playa_de_la_barrosa-40925147915_516977/;Costa de Sancti Petri-Playa de La Barrosa (Chiclana de la Frontera);6 habs.;5 baños;280 m²;;Villa pimienta, chalet de lujo a 100 metros del mar se encuentra en chiclana de la frontera y ofrece alojamiento con aire acondici...;36.3686434;-6.1777034;cadiz
450 €/mes;Ático en calle Padre Juan Sánchez Barragán, 6;/alquilar/atico-centro_calzada-45000685407_101800/;Centro-Calzada (Sanlúcar de Barrameda);2 habs.;1 baño;80 m²;;Alquiler escolar desde septiembre hasta junio. Garaje aparte. Se alquila bonito ático en el centro de sanlúcar, junto a la cuesta ...;36.7809;-6.34789;cadiz
A consultar;Apartamento en calle Asdrúbal;/alquilar/apartamento-novo_sancti_petri_loma_de_sancti_petri-2573331691_516977/;Novo Sancti Petri-Loma de Sancti Petri (Chiclana de la Frontera);2 habs.;1 baño;80 m²;Bajo;Se alquila estupendo bajo en urbanización el atardecer. El piso cuenta con dos dormitorios con armarios empotrados (4 personas), s...;36.351628837;-6.163448962;cadiz
500 €/mes;Ático en calle Padre Juan Sánchez Barragán, 6;/alquilar/atico-centro_calzada-45015159032_101800/;Centro-Calzada (Sanlúcar de Barrameda);2 habs.;1 baño;70 m²;;Alquiler escolar desde septiembre 2024. Se alquila precioso ático en el centro de sanlúcar, con preciosa terraza de 30 metros, mos...;36.7808;-6.34814;cadiz
1.600 €/mes;Ático en Plaza de las Infantas;/alquilar/atico-centro_calzada-45086073324_101800/;Centro-Calzada (Sanlúcar de Barrameda);2 habs.;2 baños;120 m²;;Alquiler verano. Se alquila bonito ático en plaza de las infantas. Posee 2 habitaciones y dos baños con platos de ducha. Salón con...;36.7782633;-6.3575705;cadiz
A consultar;Chalet en callejón Pinar Padre Ramos;/alquilar/chalet-roche-2587633670_516977/;Roche (Conil de la Frontera);3 habs.;1 baño;120 m²;;Fuente del gallo magnífica villa rural buganvilla, en conil a escasos minutos andando de la playa de fuente del gallo y cala del p...;36.2969546;-6.1136332;cadiz
1.100 €/mes;Piso en Centro;/alquilar/piso-el_mentidero_teatro_falla_alameda11003-45084979321_100500/;El Mentidero-Teatro Falla-Alameda (Cádiz Capital);4 habs.;1 baño;95 m²;1ª planta;Piso ideal para estudiantes, en el centro histórico en 1 planta de 100m,4 dormitorios, salón, cocina amueblada y equipada, 1 baño,...;36.537248;-6.3004589;cadiz
A consultar;Apartamento en calle de Maracaibo, 5;/alquilar/apartamento-nucleo_urbano_urbanizaciones-35043153941_526695/;Núcleo Urbano-Urbanizaciones (Chiclana de la Frontera);2 habs.;1 baño;60 m²;1ª planta;Apartamento en chiclana de la frontera. A unos 500m de la playa de la barrosa. Los apartamentos del residencial coto de sancti pet...;36.37976288693314;-6.186718940734864;cadiz
1.600 €/mes;Piso en calle Estropio, 6;/alquilar/piso-centro_calzada-45077279409_101800/;Centro-Calzada (Sanlúcar de Barrameda);3 habs.;2 baños;78 m²;3ª planta;Alquiler verano. Se alquila bonito piso en muy buen estado, a 3 minutos de la playa andando. Posee 3 dormitorios, baño, aseo y coc...;36.7807;-6.35929;cadiz
A consultar;Chalet en Avenida de Andorra;/alquilar/chalet-roche-2573447832_516977/;Roche (Conil de la Frontera);5 habs.;3 baños;400 m²;;Espléndido chalet en residencial roche, una de las mejores zonas de la provincia de cádiz, con piscina privada, jardín con altos p...;36.3150141;-6.1459735;cadiz
1.000 €/mes;Piso en Victoria-El Juncal;/alquilar/piso-victoria_el_juncal-40897629520_106700/;Victoria-El Juncal (El Puerto de Santa María);3 habs.;1 baño;110 m²;;"No se alquila larga temporada, solo alquiler escolar o vacacional

Casa en planta alta luminosa y espaciosa.
La vivienda consta de...";36.6204253;-6.2125998;cadiz
A consultar;Chalet en Camino del Caballo Albino;/alquilar/chalet-la_banda_campo_de_futbol-41750707320_516977/;La Banda-Campo de Fútbol (Chiclana de la Frontera);3 habs.;4 baños;160 m²;;Villa jerez,  es una encantadora residencia que ofrece un ambiente acogedor y cómodo con sus 3 dormitorios, 3 baños (uno en zona j...;36.3543;-6.14374;cadiz
400 €/mes;Estudio en Agustin Balsamo;/alquilar/estudio-fuentenueva_salesianos-18397676505_500832/;Fuentenueva-Salesianos (Algeciras);;1 baño;34 m²;;Se alquila estudio en zona agustín  balsamo. Contacta con mila olmedo 674364924;36.1276004;-5.4527698;cadiz
A consultar;Chalet en Camino de la Cantera;/alquilar/chalet-costa_de_sancti_petri_playa_de_la_barrosa-33429204305_516977/;Costa de Sancti Petri-Playa de La Barrosa (Chiclana de la Frontera);3 habs.;3 baños;165 m²;;La villa los jameos es un encantador chalet diseñado para proporcionar una experiencia familiar inolvidable. Con una piscina priva...;36.3836775;-6.1548735;cadiz
A consultar;Casa adosada en La Jara;/alquilar/casa_adosada-centro_calzada-43424636935_100500/;Centro-Calzada (Sanlúcar de Barrameda);4 habs.;3 baños;150 m²;;"Ref.3748
Se alquila para temporada de verano, gran adosado en la zona de la jara.
Facilidad de aparcamiento en la propia urbanizac...";36.778936;-6.3531428;cadiz
1.300 €/mes;Ático en calle Sargenta;/alquilar/atico-el_pino_bajo_de_guia-45056505287_101800/;El Pino-Bajo de Guía (Sanlúcar de Barrameda);2 habs.;1 baño;90 m²;;Alquiler vacaciones. Se alquila bonito ático en el centro de sanlúcar, junto a calle barrameda y calle santo domingo. Posee una te...;36.7826643;-6.3483899;cadiz
12.000 €/mes;Chalet en Vistahermosa;/alquilar/chalet-el_puerto_de_santa_maria_vistahermosa-43383750503_100500/;Vistahermosa (El Puerto de Santa María);3 habs.;3 baños;140 m²;;Chalet en vistahermosa, en la zona de los veleros, con bajada a playa a 650m por el club med en una de las mejores zonas de cádiz....;36.5912458;-6.2561476;cadiz
1.000 €/mes;Piso en San José-Varela-La Laguna;/alquilar/piso-san_jose_varela_la_laguna11010-40932619144_106700/;San José-Varela-La Laguna (Cádiz Capital);3 habs.;;80 m²;;"Larga temporada . A partir del mes de 30 de junio2024 preguntar precio y disponibilidad
 Se alquila magnifico piso en plena avenid...";36.501811606;-6.273508871;cadiz
18.000 €/mes;Casa pareada en calle Teodosio;/alquilar/casa_pareada-novo_sancti_petri_loma_de_sancti_petri-1755153315_516977/;Novo Sancti Petri-Loma de Sancti Petri (Chiclana de la Frontera);5 habs.;3 baños;250 m²;;Se vende estupendo adosado con vistas al mar y a los campos de golf. Un encanto, la única con piscina privada y jardín. Cuenta con...;36.342382;-6.1517478;cadiz
1.100 €/mes;Casa adosada en callejón de Bayoneta;/alquilar/casa_adosada-el_pino_bajo_de_guia-45022059542_101800/;El Pino-Bajo de Guía (Sanlúcar de Barrameda);4 habs.;2 baños;117 m²;;Alquiler verano. Precio por quincenas. Se alquila preciosa casa de 2 plantas, con 4 habitaciones, en planta baja, zona del pino, b...;36.7869983;-6.3446752;cadiz
650 €/mes;Casa en Casco Antiguo;/alquilar/casa-arcos_de_la_frontera_centro_urbano-32560474429_100500/;Arcos de la Frontera;4 habs.;2 baños;147 m²;;"Casa con impresionantes vistas en el casco antiguo de arcos de la frontera.
 La vivienda cuenta con 147 m. De superficie. La plant...";36.7469382;-5.8027671;cadiz
1.950 €/mes;Casa en La Soledad-La Coquina-Los Gallos;/alquilar/casa-la_soledad_la_coquina_los_gallos-40903715904_106700/;La Soledad-La Coquina-Los Gallos (Chiclana de la Frontera);3 habs.;3 baños;;;"No se alquila larga temporada, solo alquiler escolar o vacacional

Nos superamos!!! Esta es tu casa, chalet con piscina y agua de ...";36.3973528;-6.1751487;cadiz
1.200 €/mes;Piso en Cádiz, Zona de - Ayuntamiento  Catedral;/alquilar/piso-la_caleta_la_vina11005-44223475397_104700/;La Caleta-La Viña (Cádiz Capital);3 habs.;;104 m²;;Ofrecemos este magnifico piso de 3habitaciones para alquiler de estudiantes con suministros incluidos en el precio (luz, agua e in...;36.5296435;-6.2961335;cadiz
A consultar;Apartamento en Barbate;/alquilar/apartamento-barbate_centro_urbano-42509428395_106700/;Barbate;1 hab.;1 baño;56 m²;;¡Disfruta del paraíso en nuestro encantador apartamento vacacional de un dormitorio con sofá cama, ubicado a solo 5 minutos a pie ...;36.1897912;-5.9178912;cadiz
1.500 €/mes;Chalet en Campo de Gibraltar;/alquilar/chalet-tarifa_centro_urbano-45074022676_109300/;Tarifa;4 habs.;2 baños;250 m²;;"¡ Alquila tu hogar ideal en el corazón de facinas!

Descubre esta hermosa casa totalmente renovada de mas o menos 250 m², situada ...";36.144058044;-5.699629198;cadiz
900 €/mes;Piso en Centro;/alquilar/piso-el_puerto_de_santa_maria_centro-36764585927_100500/;Centro (El Puerto de Santa María);2 habs.;1 baño;69 m²;Bajo;"Disponible para larga duración a partir de septiembre - con garaje. 

Alquiler de larga duración , con plaza de garaje incluido en...";36.6020934;-6.2230752;cadiz
650 €/mes;Apartamento en El Mentidero-Teatro Falla-Alameda;/alquilar/apartamento-el_mentidero_teatro_falla_alameda11003-40859961732_106700/;El Mentidero-Teatro Falla-Alameda (Cádiz Capital);1 hab.;1 baño;42 m²;;"No se alquila larga temporada, solo alquiler escolar o vacacional

Disponible del 12 de abril al 30 de junio
 Para meses de verano...";36.5361942;-6.2973141;cadiz
A consultar;Casa pareada en calle Sirenas;/alquilar/casa_pareada-costa_de_sancti_petri_playa_de_la_barrosa-10842519848_516977/;Costa de Sancti Petri-Playa de La Barrosa (Chiclana de la Frontera);4 habs.;2 baños;100 m²;;"Ver disponibilidad 
Descripción de propiedad
Unifamiliar arenas, ubicado en plena playa de la barrosa (a 120 metros), entre la pri...";36.3750759;-6.1865961;cadiz
A consultar;Chalet en calle de los Percebes;/alquilar/chalet-costa_de_sancti_petri_playa_de_la_barrosa-1719221000_516977/;Costa de Sancti Petri-Playa de La Barrosa (Chiclana de la Frontera);4 habs.;2 baños;200 m²;;La villa de colores, es un chalet muy mimado por sus dueños. Ideal para familias que quieran disfrutar de la playa y el hermoso en...;36.3713739;-6.1735258;cadiz
600 €/mes;Casa en Mogarizas-Las Rapaces;/alquilar/casa-mogarizas_las_rapaces-40867179879_106700/;Mogarizas-Las Rapaces (Chiclana de la Frontera);3 habs.;;400 m²;;"No se alquila larga temporada, solo alquiler escolar o vacacional

Precio por semana en invierno

Precioso chalet en chiclana a es...";36.3858861;-6.1534744;cadiz
425 €/mes;Apartamento en Centro;/alquilar/apartamento-centro_calzada-42564133505_103800/;Centro-Calzada (Sanlúcar de Barrameda);2 habs.;1 baño;70 m²;Bajo;Alquiler escolar. ´no´ se alquila para larga temporada. Libre desde septiembre 2024. Piso en todo el centro de sanlucar de barrame...;36.7771024;-6.3513934;cadiz
1.300 €/mes;Casa adosada en calle Siroco;/alquilar/casa_adosada-la_jara_distrito-45005226501_101800/;La Jara (Sanlúcar de Barrameda);2 habs.;1 baño;75 m²;;Alquiler verano. Se alquila preciosa casita adosada en zona del espíritu santo, con terraza delantera de 12 metros. Urbanización c...;36.7732399;-6.3676906;cadiz
1.200 €/mes;Ático en calle Padre Juan Sánchez Barragán;/alquilar/atico-centro_calzada-45057645235_101800/;Centro-Calzada (Sanlúcar de Barrameda);2 habs.;1 baño;80 m²;;Alquiler verano. Se alquila precioso ático en el centro de sanlúcar, junto a calle santo domingo, con plaza de garaje incluida en ...;36.780681;-6.3481915;cadiz
A consultar;Chalet en Camino Charco del Sultán;/alquilar/chalet-barrio_nuevo-1705663872_516977/;Barrio Nuevo (Conil de la Frontera);6 habs.;3 baños;150 m²;;"Bonita villa ""charco del sultán 1"" se encuentra ubicada un poco antes de burger king de la entrada de conil. Es un lugar muy bien ...";36.286899821;-6.080175135;cadiz
960 €/mes;Piso en Cortadura-Zona Franca;/alquilar/piso-cortadura_zona_franca11011-40844351397_106700/;Cortadura-Zona Franca (Cádiz Capital);3 habs.;2 baños;85 m²;;"Se alquila larga temporada, solo alquiler escolar o vacacional

Te presentamos este piso reformado, en plena avenida de cádiz a 5 ...";36.499477;-6.2736446;cadiz
2.240 €/mes;Piso en Bahía Blanca;/alquilar/piso-playa_de_santa_maria_del_mar_bahia_blanca11007-7526080673_100500/;Playa de Santa María del Mar-Bahía Blanca (Cádiz Capital);2 habs.;1 baño;70 m²;Bajo;Vacaciones. Planta baja en cádiz zona bahía blanca, 70.00 m. De superficie,  una habitación doble y  una habitación sencilla,  un ...;36.5237797;-6.2845755;cadiz
A consultar;Chalet en Camino Cepa;/alquilar/chalet-campano_san_andres_golf-1757600228_516977/;Campano-San Andrés Golf (Chiclana de la Frontera);4 habs.;4 baños;300 m²;;Se alquila bonita villa con un gran jardín de 10.000 metros, capacidad para más de 10 coches (aparcamiento al aire libre), piscina...;36.3784965;-6.12682;cadiz
650 €/mes;Apartamento en Costa de Sancti Petri-Playa de La Barrosa;/alquilar/apartamento-costa_de_sancti_petri_playa_de_la_barrosa11139-40901668595_106700/;Costa de Sancti Petri-Playa de La Barrosa (Chiclana de la Frontera);1 hab.;1 baño;55 m²;;"No se alquila larga temporada, solo alquiler escolar o vacacional

¿Quieres disfruta de una vacaciones en unos de los mejores resi...";36.367485204;-6.168784784;cadiz
850 €/mes;Dúplex en Carretera de la Barrosa;/alquilar/duplex-costa_de_sancti_petri_playa_de_la_barrosa11139-40891471181_106700/;Costa de Sancti Petri-Playa de La Barrosa (Chiclana de la Frontera);2 habs.;2 baños;;;"No se alquila larga temporada, solo alquiler escolar o vacacional

Se alquila dúplex con todas las comodidades. Disponible de ener...";36.3758;-6.18595;cadiz
600 €/mes;Piso en calle de Albatros, 1;/alquilar/piso-el_pino_bajo_de_guia-45014375310_101800/;El Pino-Bajo de Guía (Sanlúcar de Barrameda);3 habs.;2 baños;90 m²;;Alquiler escolar desde el 16 de septiembre. Se alquila bonito piso en zona de la capillita, con preciosa piscina comunitaria, pist...;36.7867;-6.35107;cadiz
450 €/mes;Piso en Centro;/alquilar/piso-centro_calzada-43392662599_103800/;Centro-Calzada (Sanlúcar de Barrameda);2 habs.;1 baño;75 m²;Bajo;Alquiler escolar. Desde septiembre 2024 a junio 2025. Magnífico piso bajo en pleno centro de sanlúcar de barrameda. A unos metro d...;36.7785321;-6.3560345;cadiz
3.300 €/mes;Piso en Centro;/alquilar/piso-centro_calzada-42540957766_100500/;Centro-Calzada (Sanlúcar de Barrameda);3 habs.;2 baños;80 m²;Bajo;"Magnífico piso en el corazón del centro de la ciudad.

Esta propiedad tiene una superficie de 80 m², cuenta con 3 dormitorios, 2 b...";36.7776156;-6.3527316;cadiz
1.600 €/mes;Apartamento en Avenida;/alquilar/apartamento-playa_de_la_victoria11011-41684288315_100500/;Playa de la Victoria (Cádiz Capital);2 habs.;2 baños;70 m²;7ª planta;Verano. Apartamento en cádiz zona avenida-cortadura, 70.00 m. De superficie construida, terraza incorporada al salón, muy cerca de...;36.5022698;-6.2747523;cadiz
1.500 €/mes;Apartamento en calle de la Piedra de la Rendona, 18;/alquilar/apartamento-conil_de_la_frontera_centro_urbano-45078194288_101800/;Conil de la Frontera;1 hab.;1 baño;40 m²;;Alquiler verano. Se alquila bonito apartamento en conil, en planta baja, pero con algunos escalones. Aire acondicionado en salón y...;36.2784;-6.09106;cadiz
575 €/mes;Piso en Martin Miguel;/alquilar/piso-bonanza_martin_miguel_monteolivete11540-39244165991_103800/;Bonanza-Martín Miguel-Monteolivete (Sanlúcar de Barrameda);2 habs.;1 baño;80 m²;1ª planta;Alquiler escolar. Solo preriodo escolar septiembre 2023. Precioso piso con terraza de 70 m, totalmente amueblado y equipado, listo...;36.7974202;-6.3197303;cadiz
A consultar;Casa adosada en Avenida del Atlantico;/alquilar/casa_adosada-costa_de_sancti_petri_playa_de_la_barrosa-1740337381_516977/;Costa de Sancti Petri-Playa de La Barrosa (Chiclana de la Frontera);3 habs.;3 baños;120 m²;;Un lujo frente al mar, unos días de capricho, de descanso. Adosado en alquiler urb. El amanecer con sus hermosas vistas hacia el m...;36.3694477;-6.1804944;cadiz
A consultar;Piso en Nueva Zona;/alquilar/piso-vejer_de_la_frontera_centro_urbano-44193397105_106000/;Vejer de la Frontera;2 habs.;1 baño;78 m²;2ª planta;"Piso de dos dormitorios en la zona nueva de vejer, cadiz

Distribuido en dos dormitorios, salón comedor, cocina y cuarto de baño.
...";36.248139352;-5.966268937;cadiz
10.000 €/mes;Casa rústica en Camino del Dalmata;/alquilar/casa_rustica-pinar_de_los_franceses_el_marquesado-1728316223_516977/;Pinar de los Franceses-El Marquesado (Chiclana de la Frontera);8 habs.;2 baños;330 m²;;Chiclana frontera se alquila casa de campo con capacidad para 19 personas. Son 8 dormitorios (planta baja: 2 dormitorios de matrim...;36.422932177;-6.121515605;cadiz
5.500 €/mes;Piso en Vistahermosa;/alquilar/piso-el_puerto_de_santa_maria_vistahermosa-44169990648_100500/;Vistahermosa (El Puerto de Santa María);3 habs.;2 baños;105 m²;10ª planta;"Alquiler vacacional julio

Disfruta de las mejores vistas de la playa y la bahía de cádiz desde este espectacular piso en la décim...";36.592019482;-6.270290755;cadiz
A consultar;Apartamento en Cañada Ancha;/alquilar/apartamento-vejer_de_la_frontera_centro_urbano-42574965009_106000/;Vejer de la Frontera;2 habs.;1 baño;67 m²;;"Apartamento en alquiler con dos dormitorios en vejer de la frontera, cadiz

Consultar precio según fechas, en verano solo se alqui...";36.2570678;-5.9674928;cadiz
A consultar;Chalet en Paseo Marítimo;/alquilar/chalet-sanlucar_de_barrameda_las_piletas-44213028834_100500/;Las Piletas (Sanlúcar de Barrameda);3 habs.;2 baños;100 m²;;"3 dormitorios (uno en planta baja)
2 baños completos con ducha  (uno en planta baja)
Salon-comedor amplio
Cocina amueblada y equip...";36.7800157;-6.3648183;cadiz
550 €/mes;Piso en Centro;/alquilar/piso-centro_calzada-37522228532_103800/;Centro-Calzada (Sanlúcar de Barrameda);2 habs.;2 baños;90 m²;Bajo;Alquiler escolar (de sept. A junio). Piso centrico junto a calzada duquesa isabel. Ubicacion perfecta para moverse andando por tod...;36.7805197;-6.3539552;cadiz
450 €/mes;Apartamento en calle calle Torre del Oro;/alquilar/apartamento-conil_de_la_frontera_centro_urbano-40886401427_106700/;Conil de la Frontera;;1 baño;;;"No se alquila larga temporada, solo alquiler escolar o vacacional

Se alquila loft en conil (cádiz) - zona atalaya, disponible has...";36.2814;-6.09082;cadiz
A consultar;Chalet en calle de la Capilla, 37;/alquilar/chalet-costa_de_sancti_petri_playa_de_la_barrosa-35865854338_526695/;Costa de Sancti Petri-Playa de La Barrosa (Chiclana de la Frontera);3 habs.;3 baños;184 m²;;Chiclana de la frontera, villa con piscina privada - alojamiento de 184 m² amueblado con gusto y de recién construcción, con vista...;36.37512423830116;-6.179927587509155;cadiz
A consultar;Chalet en calle de los Percebes;/alquilar/chalet-costa_de_sancti_petri_playa_de_la_barrosa-1685800927_516977/;Costa de Sancti Petri-Playa de La Barrosa (Chiclana de la Frontera);3 habs.;3 baños;105 m²;;Soñabas con un lugar así, pues se hizo realidad! Un exclusivo chalet  reformado hace unos 3 años (todo cableado nuevo y tuberías),...;36.3710317;-6.1735407;cadiz
A consultar;Casa en Camino del Rebeco;/alquilar/casa-pago_del_humo_poligono_de_pelagatos-30906177997_516977/;Pago del Humo-Polígono de Pelagatos (Chiclana de la Frontera);2 habs.;1 baño;70 m²;;Villa valirium, es una bonita casa de campo con piscina privada, porche, barbacoa para disfrutar en familia. Zona tranquila y fami...;36.3993;-6.13232;cadiz
650 €/mes;Piso en Hornos Púnicos;/alquilar/piso-hornos_punicos-45049882157_106700/;Hornos Púnicos (San Fernando);3 habs.;1 baño;;;"Se alquila solo temporada escolar

Se alquila piso con 3 dormitorios y 1 baño para temporada escolar en perfectas condiciones. Se ...";36.458806;-6.2027173;cadiz
65 €/día;Apartamento en Camino del Pistacho;/alquilar/apartamento-mogarizas_las_rapaces-41706760952_526695/;Mogarizas-Las Rapaces (Chiclana de la Frontera);2 habs.;1 baño;60 m²;1ª planta;Aldea del coto 20156 - chiclana de la frontera -apartamento en alquiler de 2 dormitorios situado en la conocida urbanización aldea...;36.3785253;-6.1708449;cadiz
1.200 €/mes;Chalet en Las Veguetas;/alquilar/chalet-mogarizas_las_rapaces-38422605684_100500/;Mogarizas-Las Rapaces (Chiclana de la Frontera);3 habs.;2 baños;110 m²;;2. Casa/chalet → chalet en chiclana de la frontera zona las veguetas, 110 m. De superficie, 900 m. Superficie parcela, 3 m. De la ...;36.3736;-6.15207;cadiz
920 €/mes;Apartamento en Cortadura;/alquilar/apartamento-cortadura_zona_franca11011-35059323279_100500/;Cortadura-Zona Franca (Cádiz Capital);1 hab.;1 baño;52 m²;7ª planta;Apartamento en cádiz zona cortadura-paseo maritimo, 52.00 m. De superficie construida, 50 m. De la playa,  una habitación doble co...;36.496781573;-6.272475009;cadiz
1.200 €/mes;Piso en calle de Rafael Picardo de O'Leary, 2;/alquilar/piso-la_paz_segunda_aguado_loreto11012-45035076234_109800/;La Paz-Segunda Aguado-Loreto (Cádiz Capital);3 habs.;2 baños;92 m²;7ª planta;"Alquiler larga temporada. Magnifico piso recién reformado con tres dormitorios, baño , aseo, amplio salón, cocina y lavadero.
Cuen...";36.5191;-6.2766275;cadiz
1.200 €/mes;Piso en Centro-Playa;/alquilar/piso-centro_calzada-32564430774_103800/;Centro-Calzada (Sanlúcar de Barrameda);2 habs.;1 baño;70 m²;;Piso recien reformado cerca de la playa (8 minutos) y del centro ( 5 minutos), sin necesidad de cojer coche. Totalmente actualizad...;36.7829328;-6.3549288;cadiz
A consultar;Chalet en Camino Santa Cristina;/alquilar/chalet-la_banda_campo_de_futbol-20099903751_516977/;La Banda-Campo de Fútbol (Chiclana de la Frontera);5 habs.;3 baños;200 m²;;Villa luna lunera, es una casa muy cuidada y mimada por su dueña. Está ubicada en la zona que se llama mogarizas, a un paso de sup...;36.3914887;-6.1763509;cadiz
1.100 €/mes;Piso en Avda Quinto Centenario;/alquilar/piso-sanlucar_de_barrameda_las_piletas-42577055011_103800/;Las Piletas (Sanlúcar de Barrameda);2 habs.;1 baño;65 m²;;Piso de dos dormitorios para alquiler para temporada vacacional en zona avda quinto centenario, a distante tanto a unos 500 m de l...;36.7774348;-6.360013;cadiz
850 €/mes;Piso en Avenida;/alquilar/piso-san_jose_varela_la_laguna11010-97586725334_100500/;San José-Varela-La Laguna (Cádiz Capital);4 habs.;2 baños;114 m²;8ª planta;Temporal. Piso en cádiz zona avenida, muy cerca del hospital, 114 m. De superficie, 6.00 m² de terraza, 200 m. De la playa (metros...;36.5075009;-6.2777851;cadiz
1.000 €/mes;Piso en San Felipe;/alquilar/piso-san_jose_varela_la_laguna11009-25042137920_100500/;San José-Varela-La Laguna (Cádiz Capital);3 habs.;2 baños;107 m²;2ª planta;Alquiler temporal. Piso en cádiz zona san josé, 107.00 m. De superficie construida, 4.00 m² de terraza, situado a 200 m. Aprox de ...;36.5118084;-6.2788399;cadiz
12.650 €/mes;Chalet en Vistahermosa;/alquilar/chalet-el_puerto_de_santa_maria_vistahermosa-43423842059_100500/;Vistahermosa (El Puerto de Santa María);5 habs.;5 baños;199 m²;;¡Descubre la belleza de vistahermosa en el puerto de santa maría! Esta impresionante propiedad de alquiler vacacional cuenta con 5...;36.5958128;-6.2597012;cadiz
575 €/mes;Piso en Centro;/alquilar/piso-el_puerto_de_santa_maria_centro-42546015653_106700/;Centro (El Puerto de Santa María);2 habs.;1 baño;;;"No se alquila larga temporada, solo alquiler escolar o vacacional

Piso de 80m² en alquiler para temporada escolar 24/25 , recién ...";36.6006507;-6.2269751;cadiz
950 €/mes;Piso en Cortadura;/alquilar/piso-cortadura_zona_franca11011-40885854240_100500/;Cortadura-Zona Franca (Cádiz Capital);2 habs.;1 baño;75 m²;5ª planta;Piso en cádiz zona cortadura, 75.00 m. De superficie,  una habitación doble y  una habitación sencilla,  un baño, propiedad para e...;36.497863389;-6.272013419;cadiz
2.000 €/mes;Casa en Avenida de los Mástiles;/alquilar/casa-el_aguila_las_redes_fuentebravia-40852998139_106700/;El Águila-Las Redes-Fuentebravía (El Puerto de Santa María);5 habs.;4 baños;;;"No se alquila larga temporada, solo alquiler escolar o vacacional

Disponible hasta junio. Se alquila chalet individual para perio...";36.6102;-6.28032;cadiz
575 €/mes;Piso en San Nicolas;/alquilar/piso-el_pino_bajo_de_guia-44205924919_103800/;El Pino-Bajo de Guía (Sanlúcar de Barrameda);2 habs.;2 baños;80 m²;;Piso  en san nicolas, con 80 m² construidos, 2 dormitorios, 2 baños, 1 garaje/s, buen estado, exterior, planta entreplanta, 1 arma...;36.7829194;-6.3473883;cadiz
A consultar;Chalet en Avenida Mónaco;/alquilar/chalet-roche-2548245897_516977/;Roche (Conil de la Frontera);4 habs.;3 baños;230 m²;;El chalet tiene 200 m² y 750 m² de parcela, consta de dos plantas, 4 habitaciones dobles, 3 baños, salón-comedor, cocina, jardín, ...;36.3096684;-6.1501308;cadiz
1.300 €/mes;Piso en calle Rosa de los Vientos;/alquilar/piso-el_pino_bajo_de_guia-45025680655_101800/;El Pino-Bajo de Guía (Sanlúcar de Barrameda);2 habs.;1 baño;80 m²;;Alquiler de piso, zona la capillita, con piscina y jardines comunitarios y pistas de pádel. Patio grande de 32 metros y patio en c...;36.7883782;-6.3485489;cadiz
2.200 €/mes;Piso en Centro;/alquilar/piso-el_puerto_de_santa_maria_centro-23410453900_100500/;Centro (El Puerto de Santa María);3 habs.;2 baños;190 m²;2ª planta;Amplio piso ubicado en el centro del puerto de santa maría, cerca de comercios, locales de restauración y lugares emblemáticos com...;36.596339094;-6.226250633;cadiz
A consultar;Apartamento en Casco Antiguo;/alquilar/apartamento-vejer_de_la_frontera_centro_urbano-42541234878_106000/;Vejer de la Frontera;2 habs.;1 baño;65 m²;;"Apartamento de dos dormitorios en alquiler en el casco antiguo de vejer, cadiz

Con patio comun y ubicado en una primera planta, c...";36.2530541;-5.9661339;cadiz
