precio;sub_descr;href;ubicacion;habitaciones;mt2;planta;otros;latitude;longitude;banios;CCAA
2.200 €/mes;Ático en Figares-San Antón;/alquilar/atico-figares18005-25089912679_100500/;Figares-San Antón (Granada Capital);3 habs.;170 m²;;"Quieres vivir en el kilómetro cero de granada? Junto a puerta real, el corte inglés, el teatro isabel la católica.
Este ático dúpl...";37.173344698;-3.599724802;2 baños;granada
145 €/día;Piso en Paseo de Andrés Segovia, 61;/alquilar/piso-la_herradura_distrito18697-43341772581_525717/;La Herradura (Almuñécar);1 hab.;70 m²;4ª planta;Ubicado en el 4º piso, este acogedor piso en almuñécar cuenta con una superficie total de 70 m², distribuidos en 1 habitación dobl...;36.738358;-3.7500262;1 baño;granada
650 €/mes;Piso en Avenida de la Ilustración, 123;/alquilar/piso-campus_de_la_salud_palacio_de_los_deportes18016-45001693226_991073/;Campus de la Salud-Palacio de los Deportes (Distrito Zaidín. Granada Capital);1 hab.;60 m²;6ª planta;Este encantador piso en alquiler se encuentra en la zona de campus de la salud-palacio de los deportes en granada capital. Situado...;37.149673;-3.5989923;1 baño;granada
A consultar;Chalet en calle de Pinotajos, 16;/alquilar/chalet-velilla_distrito-35057223634_106000/;Velilla (Almuñécar);3 habs.;120 m²;;"Disponible para alquiler vacacional, 25 junio al 13 de julio, y septiembre 2024. Por favor consultar disponibilidad y precio
Chale...";36.7314;-3.67712;2 baños;granada
125 €/día;Piso en calle de la Testa;/alquilar/piso-marina_del_este_punta_de_la_mona-43432620753_525717/;Marina del Este-Punta de la Mona (Almuñécar);3 habs.;120 m²;Principal;Precios segun temporada consulte disponibilidad;36.7239924;-3.7300595;2 baños;granada
1.100 €/mes;Piso en Plaza de Toros;/alquilar/piso-pajaritos_plaza_de_toros18012-45060504967_100500/;Pajaritos-Plaza de Toros (Distrito Beiro. Granada Capital);4 habs.;100 m²;4ª planta;Alquiler estudiantes en avenida madrid, junto a plaza de toros y campus de cartuja. Piso con 4 habitaciones, salón con terraza, co...;37.190577651;-3.606663408;1 baño;granada
696 €/mes;Piso en calle Omeya;/alquilar/piso-campus_de_la_salud_palacio_de_los_deportes18006-43429496894_101800/;Campus de la Salud-Palacio de los Deportes (Distrito Zaidín. Granada Capital);2 habs.;90 m²;1ª planta;Piso en alquiler en edificio tirso de molina, con 2 dormitorios, salón-comedor, 2 baños y amplia cocina con lavadero. Incluye plaz...;37.1596553;-3.6072534;2 baños;granada
500 €/sem;Apartamento en calle Hurtado de Mendoza, 42;/alquilar/apartamento-almunecar_casco_urbano-39256428124_527266/;Casco Urbano (Almuñécar);2 habs.;77 m²;2ª planta;Altura piso 2º, apartamento superficie total 77 m², superficie útil 77 m², habitaciones dobles: 2, 1 baño, adaptado a personas con...;36.7327530129052;-3.6839640307156345;1 baño;granada
600 €/mes;Piso en calle de la Virgen de las Nieves;/alquilar/piso-zona_calle_poniente_avenida_cristobal_colon18100-45070782938_101800/;Zona Calle Poniente-Avenida Cristóbal Colón (Armilla);2 habs.;70 m²;1ª planta;Ocasion alquiler en armilla que consta de 2 dormitorios ,salon comedor con terraza ,cocina amueblada y baño.la vivienda se encuent...;37.143346905;-3.630966151;1 baño;granada
1.000 €/mes;Piso en Camino de Ronda;/alquilar/piso-camino_de_ronda18004-44191332381_108900/;Camino de Ronda (Distrito Ronda. Granada Capital);4 habs.;110 m²;;"&iexcl;atenci&oacute;n estudiantes y futuros mir! Presentamos un incre&iacute;ble piso en alquiler que no querr&aacute;s dejar pas...";37.1798524;-3.6140514;1 baño;granada
1.100 €/mes;Piso en Recogidas;/alquilar/piso-figares_san_anton18005-36673002113_100500/;Figares-San Antón (Granada Capital);3 habs.;120 m²;4ª planta;Este espacioso piso en alquiler ofrece una oportunidad excepcional para vivir con comodidad y estilo en pleno centro, junto a call...;37.1708406;-3.6047965;2 baños;granada
800 €/mes;Piso en Avenida del Profesor Domínguez Ortiz;/alquilar/piso-los_periodistas_parque_almunia_albayda18014-44235150636_100500/;Los Periodistas-Parque Almunia-Albayda (Granada Capital);2 habs.;78 m²;Bajo;¡Este precioso piso busca inquilinos para una larga temporada¡. Tan sólo se requiere, además de la habitual solvencia económica, s...;37.1977813;-3.6214864;1 baño;granada
A consultar;Casa en calle del Citalsol;/alquilar/casa-velilla_distrito-35062830345_106000/;Velilla (Almuñécar);3 habs.;130 m²;;Disponible para alquiler vacacional mayo, junio - julio del 1 al 10 y del 24 al 31 - agosto 24 al 31 - septiembre a partir del 12 ...;36.7472;-3.66909;3 baños;granada
721 €/mes;Piso en calle de la Isla de la Gomera, 4;/alquilar/piso-los_periodistas_parque_almunia18014-17557637571_101800/;Los Periodistas-Parque Almunia-Albayda (Granada Capital);3 habs.;98 m²;2ª planta;Confortable vivienda en alquiler en edificio calderón, con 3 dormitorios, armarios empotrados, salón-comedor con cocina independie...;37.1992;-3.61947;2 baños;granada
1.600 €/mes;Piso en Alhamar;/alquilar/piso-figares_san_anton18005-45087838154_100500/;Figares-San Antón (Granada Capital);3 habs.;100 m²;3ª planta;Ponemos a la venta este pisazo en plena calle alhamar. Se trata de un piso amplio de tres dormitorios con tres baños dos de ellos ...;37.1689195;-3.6008343;3 baños;granada
A consultar;Chalet unifamiliar en Camino a Velilla;/alquilar/chalet_unifamiliar-velilla_distrito-45007789190_528288/;Velilla (Almuñécar);4 habs.;1.200 m²;;"Chalet en venta y alquiler vacacional en almuñécar, zona del capricho  -actualmente se esta reformando-

Ubicación: este impresion...";36.741353;-3.6694932;3 baños;granada
747 €/mes;Piso en calle de la Isla de la Gomera, 4;/alquilar/piso-los_periodistas_parque_almunia18014-5091597943_101800/;Los Periodistas-Parque Almunia-Albayda (Granada Capital);3 habs.;99 m²;3ª planta;Piso en alquiler de 99 m² construidos en edificio calderón, con 3 dormitorios, armarios empotrados, 2 baños completos, salón-comed...;37.1992;-3.6195;2 baños;granada
1.100 €/mes;Piso en Centro;/alquilar/piso-figares_san_anton18005-44195593432_100500/;Figares-San Antón (Granada Capital);1 hab.;63 m²;1ª planta;Se alquila este fantástico piso totalmente reformado en el centro de la capital granadina. El piso cuenta con las mejores calidade...;37.1699902;-3.5989038;1 baño;granada
700 €/mes;Piso en Triunfo Jardin;/alquilar/piso-san_ildefonso_hospital_real18012-45033389265_100500/;San Ildefonso Hospital Real (Distrito Beiro. Granada Capital);3 habs.;98 m²;1ª planta;"¿Tienes pensado pasar los meses de julio y agosto en granada pero no sabes dónde?

Ponemos a vuestra disposición este bonito piso ...";37.1852433;-3.6000475;1 baño;granada
800 €/mes;Piso en calle San Marcos;/alquilar/piso-figares_san_anton18005-44187688538_100500/;Figares-San Antón (Granada Capital);2 habs.;87 m²;4ª planta;¡Por fin podrá disfrutar de una vivienda a la altura de sus expectativas¡. Este bonito piso esta situado en una de las mejores zon...;37.1683273;-3.5989029;2 baños;granada
450 €/mes;Estudio en calle Doctor Guirao Gea;/alquilar/estudio-pajaritos_plaza_de_toros18012-45098157276_501309/;Pajaritos-Plaza de Toros (Distrito Beiro. Granada Capital);1 hab.;23 m²;;Muy bien ubicado cercano a la avenida de la constitución y jardines del triunfo junto antigua facultad de medicina muy bien comuni...;37.1876521;-3.6067217;1 baño;granada
1.400 €/mes;Apartamento en Almuñécar;/alquilar/apartamento-la_herradura_distrito18697-44243019250_101800/;La Herradura (Almuñécar);2 habs.;225 m²;;Exclusivo apartamento recientemente renovado y listo para estrenar en la costa tropical, la herradura. Este espacioso e iluminado ...;36.735188;-3.7376126;2 baños;granada
675 €/mes;Piso en Paseo de la Reina Sofía;/alquilar/piso-almunecar_casco_urbano-15884026665_512325/;Casco Urbano (Almuñécar);1 hab.;52 m²;8ª planta;No se alquila todo el año. Piso muy acogedor situado en la urb. Las gondolas 2, dispone de entrada, cocina independiente bien equi...;36.7303586;-3.6801289;1 baño;granada
750 €/mes;Piso en calle de Cádiar, 10;/alquilar/piso-juventud_sanders18003-45029014722_100500/;Juventud-Sanders (Distrito Ronda. Granada Capital);2 habs.;70 m²;4ª planta;"Disponible a partir de septiembre. Sólo para largas estancias
Piso de 2 dormitorios, 1 baño, salón con dos ambientes, cocina compl...";37.1847;-3.61894;1 baño;granada
960 €/mes;Piso en calle Manolé;/alquilar/piso-pajaritos_plaza_de_toros18014-45029232576_109300/;Pajaritos-Plaza de Toros (Distrito Beiro. Granada Capital);4 habs.;94 m²;;"Visitas a partir del 1 julio 2024
Alquiler. De un piso de 4 dormitorios, salón amplio con balcón, cocina con salida a un amplio pa...";37.19551;-3.61;2 baños;granada
560 €/mes;Estudio en calle del Cristo de la Yedra;/alquilar/estudio-san_ildefonso_hospital_real18012-34178893013_100500/;San Ildefonso Hospital Real (Distrito Beiro. Granada Capital);1 hab.;38 m²;;Este amplio y moderno estudio en alquiler, ubicado junto a la plaza san isidro es el lugar perfecto para aquellos que buscan comod...;37.1868247;-3.6020699;1 baño;granada
670 €/mes;Piso en Plaza Arqueología;/alquilar/piso-torrenueva_costa_torrenueva-44225394537_510584/;Torrenueva (Torrenueva Costa);2 habs.;70 m²;2ª planta;Temporada escolar de septiembre a junio. Este encantador piso en alquiler se encuentra en la zona de torrenueva costa. Situado en ...;36.7082998;-3.4908279;2 baños;granada
