precio;sub_descr;href;ubicacion;habitaciones;banios;mt2;otros;latitude;longitude;planta;CCAA
1.200 €/mes;;/alquilar/piso-el_grau46011-45043121828_101800/;El Grau (Distrito Poblats Marítims. València Capital);3 habs.;1 baño;93 m²;Esta vivienda amueblada enclavada en pleno grao de valencia y en un tercer piso sin ascensor consta de tres dormitorios y un baño....;39.4620877;-0.3349672;3ª planta;valencia
A consultar;Apartamento en Carrer Navegant, 17;/alquilar/apartamento-playa_de_gandia-45058736915_528520/;Playa de Gandia (Gandia);2 habs.;1 baño;54 m²;"No están permitidas las fiestas ni cualquier otra actividad que contravenga la normativa de convivencia vecinal.
Consultar disponi...";39.00165137681873;-0.1669733576715089;2ª planta;valencia
4.200 €/mes;;/alquilar/piso-russafa46006-45024265032_109300/;Russafa (Distrito L'Eixample. València Capital);4 habs.;2 baños;108 m²;"Exclusivo apartamento de 4 habitaciones y 2 baños en ruzafa
Te invitamos a descubrir este espectacular apartamento a estrenar, u...";39.4617101;-0.372412;;valencia
850 €/mes;Piso en Plaça de Ramón de la Sota, 2;/alquilar/piso-nou_centre-45889350776_525733/;Nou Centre (Distrito Port de Sagunt. Sagunt - Sagunto);3 habs.;2 baños;95 m²;"Oportunidad
Desde trato hecho gestiones inmobiliarias ofrecemos piso amplio y luminoso en el centro del puerto, la vivienda esta r...";39.6654;-0.23101076;6ª planta;valencia
1.500 €/mes;;/alquilar/apartamento-platja_de_pucol-37540107776_101800/;Platja de Puçol (Puçol);2 habs.;1 baño;80 m²;"Disfruta todo el año de vivienda en alquiler en primera línea de playa.
Tiene gran terraza, amplio salón comedor, cocina, baño y h...";39.610257292;-0.264027043;;valencia
700 €/mes;;/alquilar/piso-platja_del_port_de_sagunt-45884170165_108900/;Platja del Port de Sagunt (Distrito Port de Sagunt. Sagunt - Sagunto);2 habs.;1 baño;80 m²;¡Oportunidad única de alquiler en puerto de sagunto, zona playa!.¿Estás buscando una vivienda cómoda, completamente equipada y a p...;39.660189;-0.2134394;3ª planta;valencia
1.100 €/mes;;/alquilar/casa-massamagrell_centro_urbano-45869996765_100900/;Massamagrell;3 habs.;2 baños;100 m²;Habitale presenta esta preciosa vivienda en alquiler, en primera planta sin ascensor. Muy buenas calidades. Situada cerca de todos...;39.5683421;-0.3322213;;valencia
1.200 €/mes;;/alquilar/apartamento-pobles_del_sud_el_saler-42591643841_100500/;El Saler (Distrito Pobles del Sud. València Capital);3 habs.;2 baños;90 m²;"Alquiler temporal  

Julio/agosto no disponible

Ubicado en el corazón del parque natural de el saler, este encantador apartamento...";39.357382098;-0.320180579;11ª planta;valencia
1.100 €/mes;;/alquilar/piso-arrancapins46008-43365125167_108900/;Arrancapins (Distrito Extramurs. València Capital);3 habs.;2 baños;130 m²;Piso de 130m², 3 habitaciones con armarios empotrados, amplio y luminoso salón exterior, cocina equipada, 2 baños completos (uno c...;39.4682104;-0.3893189;4ª planta;valencia
2.500 €/mes;;/alquilar/piso-sant_francesc46001-37589062849_524786/;Sant Francesc (Distrito Ciutat Vella. València Capital);3 habs.;2 baños;130 m²;Ves cuando te imaginas el piso perfecto, combinando entre las cosas imposible de juntar como el hogar dulce hogar, el rincón de tr...;39.4718174;-0.3792754;7ª planta;valencia
1.750 €/mes;;/alquilar/piso-el_castellar_oliveral46026-32535512292_526046/;El Castellar-L'Oliveral (Distrito Pobles del Sud. València Capital);3 habs.;2 baños;94 m²;"Hogares premium valencia, ofrece esta exclusiva propiedad ""nueva a estrenar"", frente al hospital la fe de valencia y próxima al oc...";39.4301782;-0.3636017;11ª planta;valencia
1.200 €/mes;;/alquilar/chalet-moncada_centro_urbano-43346810160_100500/;Moncada;4 habs.;3 baños;212 m²;"Chalet ceu estudiantes
Disponible: 1 de julio 2024.
Este chalet para estudiantes de uch ceu, se encuentra en carrer xaloc, 46116, ...";39.5606295;-0.3989811;;valencia
1.400 €/mes;;/alquilar/piso-la_petxina46008-43401154056_100500/;La Petxina (Distrito Extramurs. València Capital);5 habs.;2 baños;158 m²;Si buscas algo especial, acogedor, con encanto donde pasar una larga temporada de tu vida, tienes a tu alcance esta magnífica vivi...;39.47632;-0.3907336;2ª planta;valencia
1.400 €/mes;;/alquilar/chalet-moncada_centro_urbano-45037575366_100500/;Moncada;4 habs.;2 baños;148 m²;Descubre este ático único en el corazón de moncada, para estudiantes del ceu. Cuenta con cuatro amplias habitaciones exteriores, c...;39.5453865;-0.3932153;;valencia
2.950 €/mes;;/alquilar/piso-la_xerea46003-45079614896_103800/;La Xerea (Distrito Ciutat Vella. València Capital);3 habs.;;140 m²;Piso  en la xerea, con 140 m² construidos, 126 m² útiles, 3 dormitorios, 2 baños, nuevo, exterior, planta 5, 3 armarios, cocina co...;39.473727424;-0.370001567;5ª planta;valencia
830 €/mes;;/alquilar/piso-aldaia_centro_urbano-45872766445_100500/;Aldaia;3 habs.;1 baño;82 m²;"Alquiler directo serinfo system.
Ref. 19769. Se alquila vivienda reformada en aldaya. El piso está amueblado, tiene tres habitacio...";39.457843691;-0.490180746;4ª planta;valencia
1.100 €/mes;;/alquilar/piso-la_xerea46003-44243033793_108500/;La Xerea (Distrito Ciutat Vella. València Capital);3 habs.;1 baño;155 m²;Descubre tu nuevo hogar en el corazón de la ciudad! Este espacioso piso sin amueblar de 155 m² construidos y 136 m² útiles, ubicad...;39.4742414;-0.3707048;;valencia
900 €/mes;;/alquilar/piso-arrancapins46007-44199936546_527629/;Arrancapins (Distrito Extramurs. València Capital);2 habs.;1 baño;70 m²;"Vivienda en la misma calle cuenca, próxima a gran via y junto a complejo deportivo de abastos.
Se distribuye en 2 dormitorios, uno...";39.4671965;-0.3859454;5ª planta;valencia
1.050 €/mes;;/alquilar/piso-la_malva_rosa46011-45878822020_993822/;La Malva-rosa (Distrito Poblats Marítims. València Capital);2 habs.;1 baño;64 m²;"Piso en alquiler en av. Malvarrosa, junto a la playa y cercana al campus universitario.

Vivienda reformada en tercera planta, en ...";39.4774498;-0.3281101;3ª planta;valencia
1.000 €/mes;;/alquilar/loft-vara_de_quart46014-45911011781_100500/;Vara de Quart (Distrito Patraix. València Capital);;1 baño;84 m²;"Increíble oportunidad de alquilar un fantástico loft en ciudad ros casares.

Se encuentra en una segunda altura con ascensor , ext...";39.459464415;-0.411608063;;valencia
1.600 €/mes;;/alquilar/piso-ciutat_de_les_arts_i_de_les_ciencies46013-45841491994_101800/;Ciutat de les Arts i de les Ciències (Distrito Quatre Carreres. València Capital);3 habs.;2 baños;120 m²;Magnífico piso de 120 m², ubicado en la séptima planta, te ofrece vistas impresionantes a la ciudad de las ciencias. Amplio y lumi...;39.456962423;-0.359358192;7ª planta;valencia
1.100 €/mes;;/alquilar/piso-el_cabanyal_el_canyamelar46011-14255791652_994429/;El Cabanyal-El Canyamelar (Distrito Poblats Marítims. València Capital);3 habs.;1 baño;95 m²;"Piso de alquiler en el cabañal,a dos pasos del tranvia de taronger
Vivienda de tres dormitorios,cocina amplia con office anexo arm...";39.4747151;-0.3296475;3ª planta;valencia
1.800 €/mes;Apartamento en Carrer Clot de la Mota, 19;/alquilar/apartamento-playa_de_gandia-44227288100_100500/;Playa de Gandia (Gandia);1 hab.;1 baño;55 m²;"Alquiler gandia verano 2024

Precioso apartamento acabado de reformar, está ubicado a tan solo 400 metros de primera línea de la p...";38.9977;-0.162069;4ª planta;valencia
3.400 €/mes;Piso en Plaza Rosa de los Vents, 7;/alquilar/piso-playa_de_gandia-21676351835_100500/;Playa de Gandia (Gandia);4 habs.;2 baños;128 m²;"Alquiler gandia verano 2024

Gran apartamento ubicado a 500 metros de primera línea de la playa de gandía. Cuenta con 4 dormitorio...";38.996;-0.162923;Bajo;valencia
800 €/mes;;/alquilar/piso-avinguda_nou_octubre_port_de_sagunt46520-45850469391_108900/;Avinguda Nou d'Octubre-Port de Sagunt (Distrito Port de Sagunt. Sagunt - Sagunto);3 habs.;2 baños;111 m²;Piso en alquiler en zona la forja, puerto de sagunto.descripción del inmueble:.te presentamos una magnífica oportunidad para alqui...;39.6645274;-0.2348194;2ª planta;valencia
15.000 €/mes;;/alquilar/chalet_unifamiliar-torre_en_conill_cumbres_san_antonio-26696841965_995023/;Torre en Conill-Cumbres San Antonio (Bétera);4 habs.;5 baños;508 m²;Excelente vivienda unifamiliar aislada, situada en la exclusiva urbanización de torre en conill, en bétera. Se orienta hacia el ca...;39.5658515;-0.4699843;;valencia
130 €/día;Apartamento en Carrer de La Rioja, 129;/alquilar/apartamento-playa_de_gandia-45068866265_528520/;Playa de Gandia (Gandia);2 habs.;1 baño;54 m²;"Exclusivo familias
No estan permitidas las reservas de grupos de jóvenes ni despedidas

Desde 130€/noche.- mínimo 5 noches en juli...";39.01568668821221;-0.17618594045362101;7ª planta;valencia
1.300 €/mes;;/alquilar/piso-exposicio-15848190039_100500/;Exposició (Distrito El Pla del Real. València Capital);2 habs.;1 baño;76 m²;Vivienda toda reformada, en una de las mejores zonas para vivir en valencia, a unos pasos de la avenida blasco ibañez, los jardine...;39.4759164;-0.3638518;2ª planta;valencia
1.300 €/mes;;/alquilar/duplex-almarda46520-45872906872_100500/;Almardà (Sagunt - Sagunto);3 habs.;2 baños;160 m²;"Vas a poder disfrutar de un verano espectacular en una de las mejores playas de la provincia de valencia.

Alquiler de temporada d...";39.7080524;-0.1996635;1ª planta;valencia
2.000 €/mes;;/alquilar/apartamento-aiora46022-45843795943_109300/;Aiora (Distrito Camins al Grau. València Capital);4 habs.;1 baño;102 m²;"Vivienda en alquiler en ayora

La casa tiene 4 amplios dormitorios, 1 ba&ntilde;o y cocina totalmente equipada y preparada para co...";39.4672451;-0.3474684;1ª planta;valencia
1.100 €/mes;;/alquilar/piso-safranar46014-45930831862_100500/;Safranar (Distrito Patraix. València Capital);3 habs.;2 baños;105 m²;"¡Vivienda en alquiler totalmente exterior con plaza de garaje!
Se halla sujeta a la aprobación de la póliza de impago por la compa...";39.462219388;-0.396838341;4ª planta;valencia
900 €/mes;;/alquilar/piso-aiora46022-45894211204_106000/;Aiora (Distrito Camins al Grau. València Capital);2 habs.;1 baño;56 m²;Mab soluciones inmobiliarias les ofrece en exclusiva . Alquiler para estudiantes (desde septbre. A junio) de vivienda orientada al...;39.4649233;-0.3368441;2ª planta;valencia
1.400 €/mes;Piso en calle José Chabas Bordehore, 3;/alquilar/piso-rascanya_sant_llorenc46019-45877473541_522827/;Sant Llorenç (Distrito Rascanya. València Capital);3 habs.;2 baños;100 m²;"Se alquila magnífico piso en la zona de sant llorenç, en el municipio de valència capital. 
Este piso se encuentra en la 4ª planta...";39.49328;-0.36059275;4ª planta;valencia
1.300 €/mes;;/alquilar/chalet-chiva_centro_urbano-44176429672_100500/;Chiva;4 habs.;3 baños;210 m²;"Se alquila sin muebles 

Chalet en sierra perenchiza, con una parcela de 1145m² dos accesos uno al patio donde poder aparcar vario...";39.437496959;-0.602805695;;valencia
900 €/mes;;/alquilar/piso-santa_rita_alborgi46980-45016254579_100500/;Santa Rita-Alborgí (Paterna);3 habs.;2 baños;159 m²;Leer el anuncio antes: oportunidad alquiler de obra nueva en paterna para a primeros-media quincena de agosto. Piso muy amplio, de...;39.5089888;-0.4427507;1ª planta;valencia
2.600 €/mes;;/alquilar/piso-rascanya_sant_llorenc46019-17594192900_207800/;Sant Llorenç (Distrito Rascanya. València Capital);4 habs.;3 baños;205 m²;Disponible para vivir desde el 1 de julio de 2024. Se alquila impresionante ático dúplex semiamueblado en edificio residencial, 20...;39.4926534;-0.36076314;8ª planta;valencia
2.000 €/mes;;/alquilar/piso-sant_francesc46002-45887043956_100500/;Sant Francesc (Distrito Ciutat Vella. València Capital);4 habs.;2 baños;220 m²;Disponible a partir del 1 de agosto-2024. Impresionante piso de 220 m², edificio antiguo señorial, inmueble moderno con calidades ...;39.4684182;-0.3757756;4ª planta;valencia
980 €/mes;;/alquilar/piso-ciutat_universitaria46010-45073971966_523010/;Ciutat Universitària (Distrito El Pla del Real. València Capital);1 hab.;1 baño;60 m²;Casa creativa inmobiliaria alquila este apartamento completamente amueblado en una de las mejores zonas de valencia, junto a la un...;39.4784473;-0.3568917;7ª planta;valencia
1.000 €/mes;;/alquilar/piso-centre_port-34187989651_108500/;Centre Port (Distrito Port de Sagunt. Sagunt - Sagunto);3 habs.;1 baño;96 m²;Os presentamos esta vivienda que dispone de 3 habitaciones, 1 baño, cocina independiente totalmente equipada con lavadero, salón c...;39.6654406;-0.2258526;;valencia
1.050 €/mes;;/alquilar/piso-centre_la_canaleta-45074565603_100500/;Centre-La Canaleta (Mislata);4 habs.;2 baños;124 m²;Nota: vivienda sometida a un seguro de impagos, abstenerse personas que no esten trabajando con antiguedad minima de un año con co...;39.473920462;-0.415076701;2ª planta;valencia
1.600 €/mes;;/alquilar/apartamento-playa_de_gandia-45841409047_100500/;Playa de Gandia (Gandia);2 habs.;2 baños;67 m²;"""descubre este encantador dúplex en gandia. Con una superficie de 67 m², esta propiedad se encuentra en excelente estado y ofrece ...";39.0053019;-0.1701503;1ª planta;valencia
2.800 €/mes;Piso en Carrer la Rábida, 30;/alquilar/piso-playa_de_gandia-21739361127_100500/;Playa de Gandia (Gandia);2 habs.;2 baños;54 m²;"Alquiler verano 2024 gandia
 
 Piso muy luminoso y ubicado a escasos metros de la playa de gandía y del carrefour market. 
 
 Este...";38.998;-0.163483;5ª planta;valencia
1.600 €/mes;;/alquilar/apartamento-gandia_ciutat_centre_historic46701-45031940910_100500/;Centre Històric (Distrito Gandia Ciutat. Gandia);2 habs.;1 baño;75 m²;"Este encantador apartamento se encuentra en el corazón de la playa de gandía, muy cerca de todos los servicios y de la playa.

La ...";38.9663507;-0.1814975;Bajo;valencia
920 €/mes;;/alquilar/piso-patraix_favara46017-45065786156_527629/;Favara (Distrito Patraix. València Capital);1 hab.;1 baño;46 m²;Vivienda ubicada en consolidado barrio de patraix, sobre la calle gaspar agular. A dos calles del metro y pocos minutos del centro...;39.454292;-0.3919155;2ª planta;valencia
1.950 €/mes;;/alquilar/apartamento-el_cabanyal_el_canyamelar46011-41711744694_109300/;El Cabanyal-El Canyamelar (Distrito Poblats Marítims. València Capital);3 habs.;2 baños;87 m²;Piso para alquiler a medio plazo. Disponible para alquiler desde un mínimo de 30 días hasta un máximo de 180 días. Precio 65 eur p...;39.468007826;-0.324905178;Bajo;valencia
1.600 €/mes;;/alquilar/apartamento-el_cabanyal_el_canyamelar46011-45904035384_109300/;El Cabanyal-El Canyamelar (Distrito Poblats Marítims. València Capital);4 habs.;2 baños;121 m²;"Vivienda en alquiler en pleno cabañal.

La vivienda tiene 4 habitaciones amplias, 2 baños y una cocina totalmente equiapada y prep...";39.4718307;-0.331242;3ª planta;valencia
1.500 €/mes;;/alquilar/piso-sant_francesc46002-45093531776_100500/;Sant Francesc (Distrito Ciutat Vella. València Capital);2 habs.;1 baño;83 m²;Grupoa alain inmobiliaria. Alquila hermoso piso, primera planta, sin ascensor!  De 2 habitaciones, 1 baño. Totalmente equipado y a...;39.4706017;-0.3720762;1ª planta;valencia
900 €/mes;;/alquilar/piso-torrent_poble_nou-15098519455_100500/;Poble Nou (Torrent);2 habs.;2 baños;83 m²;Estupendo piso en torrente  próximo al parque central, con una superficie de 80m² distribuidos en amplio comedor con un balcón ,  ...;39.430115241;-0.467086344;2ª planta;valencia
650 €/mes;;/alquilar/piso-alcudia_de_crespins_centro_urbano-45066222155_108700/;L'Alcúdia de Crespins;4 habs.;2 baños;110 m²;Piso  sin amueblar situado en alcudia de crespins, al sur de la provincia de valencia (60 km) y cercano a la provincia de alicante...;38.967903313;-0.616700342;;valencia
1.100 €/mes;;/alquilar/piso-el_cabanyal_el_canyamelar46011-45915858194_106000/;El Cabanyal-El Canyamelar (Distrito Poblats Marítims. València Capital);3 habs.;1 baño;88 m²;"Mab soluciones inmobiliarias les ofrece en exclusiva!!!. Alquiler de larga duracion de vivienda orientada al este con balcon 

Se ...";39.4654907;-0.33264;4ª planta;valencia
2.900 €/mes;Apartamento en Carrer La Gavina, 1;/alquilar/apartamento-playa_de_gandia-15874601606_100500/;Playa de Gandia (Gandia);2 habs.;1 baño;70 m²;"Alquiler gandia verano 2024

Bonito apartamento ubicado en el residencial sant jordi, en la playa de gandía con unas impresionante...";38.9947;-0.161437;8ª planta;valencia
2.500 €/mes;Piso en Carrer de Llavador, 1;/alquilar/piso-playa_de_gandia-33351778251_100500/;Playa de Gandia (Gandia);3 habs.;2 baños;103 m²;"Alquiler gandia verano 2024

Precioso apartamento en el residencial jardines de sinia de la playa de gandía.
 
La vivienda (totalm...";38.9926;-0.163759;3ª planta;valencia
2.800 €/mes;Apartamento en Passeig Marítim de Neptú, 27;/alquilar/apartamento-playa_de_gandia-15882364102_100500/;Playa de Gandia (Gandia);1 hab.;1 baño;49 m²;"Alquiler gandia verano 2024

Precioso apartamento ubicado en primera línea de la playa de gandía.
 
La vivienda ha sido totalmente...";38.9997;-0.158908;4ª planta;valencia
2.700 €/mes;Apartamento en Carrer de la Devesa, 3;/alquilar/apartamento-playa_de_gandia-45875218492_100500/;Playa de Gandia (Gandia);3 habs.;2 baños;95 m²;"Alquiler gandia verano 2024
Apartamento de 3 dormitorios ubicado a tan solo 350 metros de primera línea de la playa de gandia en l...";39.0073;-0.168953;8ª planta;valencia
1.200 €/mes;;/alquilar/chalet-chiva_centro_urbano-29178118106_100500/;Chiva;1 hab.;1 baño;70 m²;"Alquiler por temporada planta baja de chalet, con entrada independiente. 

Se alquila solo por semanas

Consta de una habitación d...";39.473009205;-0.716740693;;valencia
2.100 €/mes;;/alquilar/piso-el_pla_del_remei46004-45046755921_100500/;El Pla del Remei (Distrito L'Eixample. València Capital);4 habs.;;160 m²;"¡Espectacular vivienda totalmente reformada! .
Esta amplia y luminosa residencia se encuentra en la zona comercial de valencia, pe...";39.4688518;-0.3721662;3ª planta;valencia
1.800 €/mes;;/alquilar/apartamento-algiros_la_carrasca46022-45098244963_109300/;La Carrasca (Distrito Algirós. València Capital);3 habs.;1 baño;90 m²;"Piso en alquiler solo disponible durante julio de 2024!

El inmueble est&aacute; situado en la cuarta planta, sin ascensor.

La vi...";39.4744289;-0.3365804;4ª planta;valencia
2.200 €/mes;;/alquilar/apartamento-la_malva_rosa46011-45070407936_109300/;La Malva-rosa (Distrito Poblats Marítims. València Capital);4 habs.;1 baño;81 m²;"Se alquila piso completo 2200&euro; o por habitaciones 550&euro; para estudiantes del 1 de septiembre al 30 de junio.

La vivienda...";39.4820998;-0.3284692;1ª planta;valencia
1.000 €/mes;;/alquilar/apartamento-el_cabanyal_el_canyamelar46011-45881345689_109300/;El Cabanyal-El Canyamelar (Distrito Poblats Marítims. València Capital);1 hab.;1 baño;34 m²;"Este apartamento tiene 4 dormitorios está a pocos pasos de la playa y del puerto de valencia.

Este barrio es una zona vibrante y ...";39.4691394;-0.3305196;;valencia
2.700 €/mes;;/alquilar/piso-playa_de_gandia-15895932633_100500/;Playa de Gandia (Gandia);3 habs.;2 baños;95 m²;"Alquiler gandia verano 2024

Apartamento ubicado en la playa de gandía, muy cerca de la universidad politécnica.
La vivienda cuent...";38.9964772;-0.162176;4ª planta;valencia
3.500 €/mes;;/alquilar/piso-eixample_gran_via46005-44260625909_100500/;Gran Via (Distrito L'Eixample. València Capital);4 habs.;3 baños;236 m²;Grupo alain inmobiliaria, alquila lujoso piso con espectaculares vistas a los jardines del turia de 230 metros  vistas a jacinto b...;39.4689437;-0.3647933;4ª planta;valencia
675 €/mes;;/alquilar/duplex-oliva_nova-30895791702_108900/;Oliva Nova (Oliva);2 habs.;2 baños;81 m²;"No es alquiler anual. Es temporal durante los meses de septiembre a junio.

En una de las playas mas virgen de la comunidad valenc...";38.9040406;-0.0658901;;valencia
1.200 €/mes;;/alquilar/apartamento-el_cabanyal_el_canyamelar46011-45895905902_109300/;El Cabanyal-El Canyamelar (Distrito Poblats Marítims. València Capital);2 habs.;;69 m²;En el histórico barrio del cabañal de valencia se alquila un encantador apartamento antiguo a precio especial para los meses de ve...;39.4694424;-0.3294808;1ª planta;valencia
650 €/mes;Piso en Carrer Arnau de Vilanova, 4;/alquilar/piso-canet_en_berenguer_centro_urbano-33379074355_525733/;Canet d'en Berenguer;2 habs.;1 baño;71 m²;"¡Imperdible oportunidad para tu temporada de invierno!
Descubre la comodidad y el encanto de nuestros exclusivos apartamentos en l...";39.676856502140204;-0.20889423616915354;2ª planta;valencia
850 €/mes;Piso en calle del Rey Don Jaime;/alquilar/piso-rafelbunyol_centro_urbano-45891553772_100900/;Rafelbunyol;2 habs.;1 baño;80 m²;Vivienda situada cerca de la avenida de españa. Entresuelo con entrada  independiente. Salón comedor, cocina, dos habitaciones  do...;39.5866;-0.335727;Bajo;valencia
1.350 €/mes;;/alquilar/apartamento-playa_de_gandia-44254193542_100500/;Playa de Gandia (Gandia);2 habs.;1 baño;80 m²;Con dos luminosas habitaciones, un baño y acceso fácil para todos, esta propiedad te ofrece el escape perfecto junto al mar. Con a...;39.0128079;-0.1707636;Bajo;valencia
1.600 €/mes;;/alquilar/apartamento-el_cabanyal_el_canyamelar46011-45851302318_109300/;El Cabanyal-El Canyamelar (Distrito Poblats Marítims. València Capital);2 habs.;1 baño;69 m²;"En el hist&oacute;rico barrio del caba&ntilde;al de valencia se alquila un encantador apartamento antiguo a precio especial para l...";39.4694424;-0.3294808;1ª planta;valencia
800 €/mes;;/alquilar/piso-playa_la_pobla_de_farnals-7549297626_100500/;Playa La Pobla de Farnals (La Pobla de Farnals);1 hab.;1 baño;56 m²;"Alquiler disponible para temporada.

Junio (quincena) 600€
Julio y agosto 500€ la semana 
Septiembre (quincena) 600€

Piso de un d...";39.564737813;-0.285869975;3ª planta;valencia
1.175 €/mes;Piso en Avinguda del Retor Emilio Bayarri, 9;/alquilar/piso-los_monasterios_alfinach-41729532481_100900/;Los Monasterios-Alfinach (Puçol);2 habs.;1 baño;105 m²;Habitale presenta apartamento coqueto y acogedor, ubicado en la urbanización alfinach. El complejo solazar es uno de los mejores r...;39.6312;-0.343809;1ª planta;valencia
10.000 €/mes;;/alquilar/casa_unifamiliar-rocafort_centro_urbano-22575655766_997236/;Rocafort;8 habs.;11 baños;1.272 m²;"Espectacular villa de lujo en urbanizacion cerrada
Se encuentra a tan solo 9 km de valencia en una urbanizacion de prestigio con s...";39.54512761;-0.416929961;;valencia
1.900 €/mes;;/alquilar/piso-el_pla_del_real_mestalla46021-44199681963_101800/;Mestalla (Distrito El Pla del Real. València Capital);3 habs.;2 baños;100 m²;¡Descubre tu hogar ideal en la prestigiosa avenida aragón! Te presentamos un precioso piso de 100 m² con todo lo que necesitas par...;39.472841075;-0.356992048;8ª planta;valencia
1.200 €/mes;;/alquilar/piso-la_raiosa_san_vicente_martir-45897992244_100500/;La Raïosa-San Vicente Mártir (Distrito Jesús. València Capital);3 habs.;2 baños;113 m²;"Luminosa propiedad en la calle san vicente.

La vivienda, situada en una séptima planta , con una superficie construida catastral ...";39.4569079;-0.3838417;7ª planta;valencia
1.600 €/mes;;/alquilar/piso-el_botanic46008-45890879992_108500/;El Botànic (Distrito Extramurs. València Capital);2 habs.;1 baño;56 m²;Alquilamos un piso en zona botanico, muy cerca de las torres de quart y a diez de la plaza del ayuntamiento. Ubicado en una finca ...;39.4752796;-0.3847053;;valencia
1.900 €/mes;;/alquilar/piso-la_xerea46003-1726522234_100500/;La Xerea (Distrito Ciutat Vella. València Capital);2 habs.;2 baños;130 m²;Sueñas con vivir en una vivienda diferente?   Inmobiliaria avenida51 le ofrece este inmueble único se trata de un ático de unos 10...;39.4730726;-0.3722246;5ª planta;valencia
2.500 €/mes;;/alquilar/apartamento-port_saplaya-45012703214_109300/;Port Saplaya (Alboraia - Alboraya);3 habs.;2 baños;;This charming vacation rental house is located just steps from the beach, offering its guests the opportunity to enjoy the sea bre...;39.510917397;-0.322299543;;valencia
2.800 €/mes;Apartamento en Carrer del Camp de Morvedre, 23;/alquilar/apartamento-playa_de_gandia-44193288578_100500/;Playa de Gandia (Gandia);2 habs.;1 baño;69 m²;"Alquiler gandia verano 2024

Precioso apartamento de 2 dormitorios en el residencial jardín i, ubicado a tan solo 450 metros de pr...";39.0064;-0.170047;7ª planta;valencia
900 €/mes;;/alquilar/piso-centre_port-45023507633_108900/;Centre Port (Distrito Port de Sagunt. Sagunt - Sagunto);4 habs.;1 baño;106 m²;¡Bienvenidos al hogar de tus sueños en puerto de sagunto!.Ubicado en una de las zonas más codiciadas de puerto de sagunto, este es...;39.6627146;-0.218236;2ª planta;valencia
3.100 €/mes;Apartamento en Carrer del Camp de Morvedre, 23;/alquilar/apartamento-playa_de_gandia-45061601680_100500/;Playa de Gandia (Gandia);3 habs.;2 baños;84 m²;"Alquiler gandia verano 2024

Bonito apartamento de 3 dormitorios en el residencial jardín i, ubicado a tan solo 450 metros de prim...";39.0064;-0.170047;7ª planta;valencia
2.200 €/mes;;/alquilar/apartamento-aiora46022-45060692602_109300/;Aiora (Distrito Camins al Grau. València Capital);4 habs.;1 baño;83 m²;"&iexcl;bienvenido a tu nuevo hogar en valencia! Este reci&eacute;n renovado y totalmente amueblado apartamento de 4 dormitorios es...";39.4654845;-0.3473196;4ª planta;valencia
