precio;sub_descr;href;ubicacion;habitaciones;banios;mt2;otros;publicado_hace;plataforma;CCAA
15.000€;6 room luxury Villa for rent in Marbella, Spain;https://rd.clk.thribee.com/id.1y1x1t1foD1tK/origin.1/section.97/section_type.1/country.es/vertical.homes/iuid.37018trovit-web-6f6984d597-pbqgv66a3db4991eb0/tracking.%7B%22cmp%22%3A%22u%22%7D/what_d.Malaga/type.2/page.24/cookieid.102115766a3db49919146.83249998/pos.14/;Marbella, Provincia de Málaga;6  habitaciones;6  baños;840  m²;Incredible Frontline Golf Villa for Short-term Rent in Los Naranjos Golf, Marbella This incredible luxury villa for sale is located at frontline...;Hace 2 días;Kuhamia;Malaga
8.400€;7 room luxury Villa for rent in Benahavís, Andalusia;https://rd.clk.thribee.com/id.a9131RQ3O1K/origin.1/section.97/section_type.1/country.es/vertical.homes/iuid.37018trovit-web-6f6984d597-pbqgv66a3db4991eb0/tracking.%7B%22cmp%22%3A%22u%22%7D/what_d.Malaga/type.2/page.24/cookieid.102115766a3db49919146.83249998/pos.15/;Benahavís, Provincia de Málaga;7  habitaciones;6  baños;867  m²;Luxury and modern villa for short rent in La Alqueria, Benahavis This villa is a modern villa for holiday rentals in La Alqueria, Benahavis that...;Hace 2 días;Kuhamia;Malaga
1.000€;3-bedroom apartment;https://rd.clk.thribee.com/id.1dL1v1l1lWgt/origin.1/section.97/section_type.1/country.es/vertical.homes/iuid.37018trovit-web-6f6984d597-pbqgv66a3db4991eb0/tracking.%7B%22cmp%22%3A%22u%22%7D/what_d.Malaga/type.2/page.24/cookieid.102115766a3db49919146.83249998/pos.16/;29009, Provincia de Málaga;3  habitaciones;1  baños;-;Rental period for this listing is between 3. 24 months...;Hace 2 días;Rentola;Malaga
2.000€;Charming 3 bedroom apartment with lovely views available for rent;https://rd.clk.thribee.com/id.21CjT1QCwD/origin.1/section.97/section_type.1/country.es/vertical.homes/iuid.37018trovit-web-6f6984d597-pbqgv66a3db4991eb0/tracking.%7B%22cmp%22%3A%22u%22%7D/what_d.Malaga/type.2/page.24/cookieid.102115766a3db49919146.83249998/pos.17/;29679, Provincia de Málaga;3  habitaciones;2  baños;124  m²;Well-presented 3-bedroom first-floor apartment within the prestigious Los Arqueros development in Benahavís, surrounded by nature and a beautiful...;Hace 2 días;Rentola;Malaga
4.700€;Penthouse · The Golden Mile;https://rd.clk.thribee.com/id.171lW1v1-A1Cb/origin.1/section.97/section_type.1/country.es/vertical.homes/iuid.37018trovit-web-6f6984d597-pbqgv66a3db4991eb0/tracking.%7B%22cmp%22%3A%22u%22%7D/what_d.Malaga/type.2/page.24/cookieid.102115766a3db49919146.83249998/pos.18/;;2  habitaciones;2  baños;157  m²;AVAILABLE FROM NOW FR LONG TERM EXCLUSIVE LISTING Conditions of payment 2 months deposit, payment ONLY via bank transfer Considered one of Marbel...;Hace 2 días;Kuhamia;Malaga
5.500€;Penthouse · Benahavís;https://rd.clk.thribee.com/id.1B1w1f1Bc1hN1Y/origin.1/section.97/section_type.1/country.es/vertical.homes/iuid.37018trovit-web-6f6984d597-pbqgv66a3db4991eb0/tracking.%7B%22cmp%22%3A%22u%22%7D/what_d.Malaga/type.2/page.24/cookieid.102115766a3db49919146.83249998/pos.19/;Benahavís, Provincia de Málaga;4  habitaciones;4  baños;414  m²;Offering a terrace with garden and mountain views, an outdoor pool, an indoor pool and a fitness center, El Capanes del Golf is located in Benaha...;Hace 2 días;Kuhamia;Malaga
5.000€;6 room luxury Villa for rent in Marbella, Spain;https://rd.clk.thribee.com/id.1V1QDx1G1pd18/origin.1/section.97/section_type.1/country.es/vertical.homes/iuid.37018trovit-web-6f6984d597-pbqgv66a3db4991eb0/tracking.%7B%22cmp%22%3A%22u%22%7D/what_d.Malaga/type.2/page.24/cookieid.102115766a3db49919146.83249998/pos.20/;Marbella, Provincia de Málaga;6  habitaciones;5  baños;440  m²;Villa Ibiza: Stunning villa in Nueva Andalucia, Marbella Villa Ibiza: Renovated luxury villa for short-term rentals and sale in a prime location,...;Hace 2 días;Kuhamia;Malaga
14.500€;Luxury Villa for rent in Marbella, Spain;https://rd.clk.thribee.com/id.u1GwR51z1T1k/origin.1/section.97/section_type.1/country.es/vertical.homes/iuid.37018trovit-web-6f6984d597-pbqgv66a3db4991eb0/tracking.%7B%22cmp%22%3A%22u%22%7D/what_d.Malaga/type.2/page.24/cookieid.102115766a3db49919146.83249998/pos.21/;Marbella, Provincia de Málaga;8  habitaciones;8  baños;830  m²;Villa with amazing sea views for sale in Los Flamingos, Benahavis Introducing a stunning newly built villa in the prestigious Los Flamingos golf...;Hace 2 días;Kuhamia;Malaga
15.000€;8 room luxury Villa for rent in Marbella, Andalusia;https://rd.clk.thribee.com/id.w1gZ1kr1d13N/origin.1/section.97/section_type.1/country.es/vertical.homes/iuid.37018trovit-web-6f6984d597-pbqgv66a3db4991eb0/tracking.%7B%22cmp%22%3A%22u%22%7D/what_d.Malaga/type.2/page.24/cookieid.102115766a3db49919146.83249998/pos.22/;Marbella, Provincia de Málaga;8  habitaciones;8  baños;550  m²;Villa Ashby: Modern Holiday Rental and Sale Villa in San Pedro Introducing Villa Ashby, a modern gem available for short-term rent and for sale i...;Hace 2 días;Kuhamia;Malaga
21.000€;5 room luxury Villa for rent in Marbella, Spain;https://rd.clk.thribee.com/id.1y81OVKgM0/origin.1/section.97/section_type.1/country.es/vertical.homes/iuid.37018trovit-web-6f6984d597-pbqgv66a3db4991eb0/tracking.%7B%22cmp%22%3A%22u%22%7D/what_d.Malaga/type.2/page.24/cookieid.102115766a3db49919146.83249998/pos.23/;Marbella, Provincia de Málaga;5  habitaciones;4  baños;802  m²;Luxurious Living in Golden Mile: Contemporary Villa for Short-Term Rent Introducing this exquisite villa for rent in the highly sought-after Gold...;Hace 2 días;Kuhamia;Malaga
500€;Lovely double bedroom next to Corte Inglés;https://rd.clk.thribee.com/id.1j1TC111nQ1p1K/origin.1/section.97/section_type.1/country.es/vertical.homes/iuid.37018trovit-web-6f6984d597-pbqgv66a3db4991eb0/tracking.%7B%22cmp%22%3A%22u%22%7D/what_d.Malaga/type.2/page.24/cookieid.102115766a3db49919146.83249998/pos.24/;29006, Provincia de Málaga;4  habitaciones;2  baños;-;Rooms for rent in sunny Málaga! Carrefour and bus stop next to the building. Easy parking in the area. Centre: 30 minute walk, 10 minutes by...;Hace 2 días;Rentola;Malaga
7.500€;Luxury Villa for rent in Benahavís, Spain;https://rd.clk.thribee.com/id.1h1J181T1D1R1t1b/origin.1/section.97/section_type.1/country.es/vertical.homes/iuid.37018trovit-web-6f6984d597-pbqgv66a3db4991eb0/tracking.%7B%22cmp%22%3A%22u%22%7D/what_d.Malaga/type.2/page.24/cookieid.102115766a3db49919146.83249998/pos.25/;Benahavís, Provincia de Málaga;5  habitaciones;5  baños;487  m²;Villa Coty: Luxury Short-Term Rental Villa in La Quinta Golf Country Club, Benahavis Welcome to Villa Coty, an amazing and luxurious property ava...;Hace 2 días;Kuhamia;Malaga
1.709€;Calle Don Juan de Austria, Malaga - Amsterdam Apartments for Rent;https://rd.clk.thribee.com/id.161myq1p1I41c/origin.1/section.97/section_type.1/country.es/vertical.homes/iuid.26541trovit-web-6f6984d597-cn2hw66a3db50da183/tracking.%7B%22cmp%22%3A%22u%22%7D/what_d.Malaga/type.2/page.15/cookieid.102012066a3db50d9b552.18159677/pos.1/;29009, Provincia de Málaga;1  habitaciones;1  baños;323  m²;...Malaga, and just a 5-minute walk from the historic center of the city. It is an area with a lot of commerce and neighborhood shops, very well...;Hace 1 día;Rentola;Malaga
8.500€;Exclusiva Villa en alquiler Urbanización Marbella Este, Espa;https://rd.clk.thribee.com/id.121C1x1e1qf/origin.1/section.232/section_type.2/country.es/vertical.homes/iuid.26541trovit-web-6f6984d597-cn2hw66a3db50da183/tracking.%7B%22cmp%22%3A%22u%22%7D/what_d.Malaga/type.2/page.15/cookieid.102012066a3db50d9b552.18159677/pos.1/;29604, Marbella, Provincia de Málaga;-;3 baños;-;Ubicada en una zona tranquila de Elviria y rodeada de naturaleza, esta villa recientemente renovada ofrece una experiencia de vida cómoda y lujos...;Hace 6 días;LuxuryEstate;Malaga
2.000€;Apartamento en alquiler en San Pedro de Alcántara, Guadalmin;https://rd.clk.thribee.com/id.gg1_1oiHq16/origin.1/section.232/section_type.2/country.es/vertical.homes/iuid.26541trovit-web-6f6984d597-cn2hw66a3db50da183/tracking.%7B%22cmp%22%3A%22u%22%7D/what_d.Malaga/type.2/page.15/cookieid.102012066a3db50d9b552.18159677/pos.2/;San Pedro de Alcántara, Marbella, Provincia de Málaga;2 habitaciones;2 baños;165 m²;Extraordinario Apartamento espacioso, luminoso y exclusivo, disponible ahora para LARGA TEMPORADA. Este maravilloso apartamento, se compone de do...;Hace 6 días;Todopisos;Malaga
2.600€;Apartamento Planta Baja;https://rd.clk.thribee.com/id.1uo61V1z1XA11/origin.1/section.97/section_type.1/country.es/vertical.homes/iuid.26541trovit-web-6f6984d597-cn2hw66a3db50da183/tracking.%7B%22cmp%22%3A%22u%22%7D/what_d.Malaga/type.2/page.15/cookieid.102012066a3db50d9b552.18159677/pos.2/;29600, Provincia de Málaga;3  habitaciones;3  baños;148  m²;Espectacular piso en planta baja elevada en Urbanización Lomas de los Monteros. El piso cuenta con un gran salon, sumamente luminoso y espacioso,...;Hace 1 día;Rentola;Malaga
9.000€;Villa For Rent in Nueva Andalucía, Marbella;https://rd.clk.thribee.com/id.jI1z_31o1Z1V/origin.1/section.97/section_type.1/country.es/vertical.homes/iuid.26541trovit-web-6f6984d597-cn2hw66a3db50da183/tracking.%7B%22cmp%22%3A%22u%22%7D/what_d.Malaga/type.2/page.15/cookieid.102012066a3db50d9b552.18159677/pos.3/;29660, Marbella, Provincia de Málaga;4  habitaciones;5  baños;412  m²;Hermosa contemporary villa and ultra modern esta situado in nueva andaluciaYou will be able to enjoy the sport of golf and play golf in Puerto Ba...;Hace 1 día;Rentola;Malaga
2.000€;Apartment For Rent in Puerto Banús, Marbella;https://rd.clk.thribee.com/id.1QX1F111z51Xw/origin.1/section.97/section_type.1/country.es/vertical.homes/iuid.26541trovit-web-6f6984d597-cn2hw66a3db50da183/tracking.%7B%22cmp%22%3A%22u%22%7D/what_d.Malaga/type.2/page.15/cookieid.102012066a3db50d9b552.18159677/pos.4/;29660, Marbella, Provincia de Málaga;2  habitaciones;2  baños;165  m²;Apartamento en Marbella, con 2 dormitorios y 2 baños. 165 m 2 de superficie útil, ofreciendo un espacio muy amplio para sus necesidades. Este inm...;Hace 1 día;Rentola;Malaga
3.000€;Apartment For Rent in Puerto Banús, Marbella;https://rd.clk.thribee.com/id.-10QYb1I1zN/origin.1/section.97/section_type.1/country.es/vertical.homes/iuid.26541trovit-web-6f6984d597-cn2hw66a3db50da183/tracking.%7B%22cmp%22%3A%22u%22%7D/what_d.Malaga/type.2/page.15/cookieid.102012066a3db50d9b552.18159677/pos.5/;29660, Marbella, Provincia de Málaga;2  habitaciones;2  baños;120  m²;Modern 2 bedroom apartment in luxury complex situated 150 mtrs. From the beach in Puerto Banus. Close to restaurants, beach bars, water sports, s...;Hace 1 día;Rentola;Malaga
2.800€;Apartment For Rent in Puerto Banús, Marbella;https://rd.clk.thribee.com/id.1B1wO1y2cPL/origin.1/section.97/section_type.1/country.es/vertical.homes/iuid.26541trovit-web-6f6984d597-cn2hw66a3db50da183/tracking.%7B%22cmp%22%3A%22u%22%7D/what_d.Malaga/type.2/page.15/cookieid.102012066a3db50d9b552.18159677/pos.6/;29660, Marbella, Provincia de Málaga;2  habitaciones;2  baños;170  m²;"We only rent for long periods"" we don`t rent for short periods. Modern luxury apartment resemant built near Puerto banus of new andalucia Close t...";Hace 1 día;Rentola;Malaga
6.000€;Villa For Rent in Puerto Banús, Marbella;https://rd.clk.thribee.com/id.M1D1l1v1b1vH1t/origin.1/section.97/section_type.1/country.es/vertical.homes/iuid.26541trovit-web-6f6984d597-cn2hw66a3db50da183/tracking.%7B%22cmp%22%3A%22u%22%7D/what_d.Malaga/type.2/page.15/cookieid.102012066a3db50d9b552.18159677/pos.7/;29660, Marbella, Provincia de Málaga;3  habitaciones;3  baños;295  m²;Bungalow. Villa in Bahia de Banus, Marbella. Puerto Banus for long term rental, furnished and modern and short term Luxury Rental K near synagogu...;Hace 1 día;Rentola;Malaga
4.500€;Penthouse for rent in Costalita, Estepona;https://rd.clk.thribee.com/id.am1i1V1t17Mo/origin.1/section.97/section_type.1/country.es/vertical.homes/iuid.26541trovit-web-6f6984d597-cn2hw66a3db50da183/tracking.%7B%22cmp%22%3A%22u%22%7D/what_d.Malaga/type.2/page.15/cookieid.102012066a3db50d9b552.18159677/pos.8/;Costalita, Estepona, Provincia de Málaga;4  habitaciones;4  baños;216  m²;Penthouse, Costalita, Costa del Sol. 4 Bedrooms, 4 Bathrooms, Built 200 m², Terrace 70 m². Setting: Beachfront, Beachside, Close To Sea, Close To...;Hace 1 día;Kuhamia;Malaga
8.200€;Villa For Rent in Milla De Oro - Sierra Blanca, Marbella;https://rd.clk.thribee.com/id.1e1Tff171f31d/origin.1/section.97/section_type.1/country.es/vertical.homes/iuid.26541trovit-web-6f6984d597-cn2hw66a3db50da183/tracking.%7B%22cmp%22%3A%22u%22%7D/what_d.Malaga/type.2/page.15/cookieid.102012066a3db50d9b552.18159677/pos.9/;29602, Marbella, Provincia de Málaga;3  habitaciones;3  baños;435  m²;Villa sierra blanca with private swimming pool urbanizacion capricho brand new. 3 bedrooms and 3 bathrooms en suite plus 1 guest toilet. It has s...;Hace 1 día;Rentola;Malaga
12.000€;Penthouse For Rent in Puerto Banús, Marbella;https://rd.clk.thribee.com/id.1jB1U4BB1l16/origin.1/section.97/section_type.1/country.es/vertical.homes/iuid.26541trovit-web-6f6984d597-cn2hw66a3db50da183/tracking.%7B%22cmp%22%3A%22u%22%7D/what_d.Malaga/type.2/page.15/cookieid.102012066a3db50d9b552.18159677/pos.10/;29660, Marbella, Provincia de Málaga;3  habitaciones;3  baños;360  m²;Magnificent luxury Duplex Penthouse in one of Malibu's best developments on the front line of the beach with 360º panoramic viewsclose to Mistral...;Hace 1 día;Rentola;Malaga
5.500€;Villa For Rent in Puerto Banús, Marbella;https://rd.clk.thribee.com/id.Y1N1E41o1D1k1o/origin.1/section.97/section_type.1/country.es/vertical.homes/iuid.26541trovit-web-6f6984d597-cn2hw66a3db50da183/tracking.%7B%22cmp%22%3A%22u%22%7D/what_d.Malaga/type.2/page.15/cookieid.102012066a3db50d9b552.18159677/pos.11/;29660, Marbella, Provincia de Málaga;5  habitaciones;4  baños;295  m²;Casa en Marbella, con 5 dormitorios y 4 baños. 295 m 2 de superficie útil, ofreciendo un espacio muy amplio para sus necesidades. Este inmueble,...;Hace 1 día;Rentola;Malaga
450€;Country Property in Sedella, Inland Andalucia in the mountains;https://rd.clk.thribee.com/id.1BG1rM1O14Y-/origin.1/section.97/section_type.1/country.es/vertical.homes/iuid.26541trovit-web-6f6984d597-cn2hw66a3db50da183/tracking.%7B%22cmp%22%3A%22u%22%7D/what_d.Malaga/type.2/page.15/cookieid.102012066a3db50d9b552.18159677/pos.12/;Sedella, Provincia de Málaga;1  habitaciones;1  baños;50  m²;This is one of our country properties in Spain located in a breathtaking setting. It is situated in Sedella. From the property there are truly ma...;Hace 1 día;Kuhamia;Malaga
12.000€;Penthouse For Rent in Puerto Banús, Marbella;https://rd.clk.thribee.com/id.11b8vrGI1W/origin.1/section.97/section_type.1/country.es/vertical.homes/iuid.26541trovit-web-6f6984d597-cn2hw66a3db50da183/tracking.%7B%22cmp%22%3A%22u%22%7D/what_d.Malaga/type.2/page.15/cookieid.102012066a3db50d9b552.18159677/pos.13/;29660, Marbella, Provincia de Málaga;3  habitaciones;3  baños;360  m²;Magnificent luxury duplex penthouse in one of the best developments of Malibu in front line beach with 360º panoramic views close to Mistral beac...;Hace 1 día;Rentola;Malaga
15.000€;Villa For Rent in Puerto Banús, Marbella;https://rd.clk.thribee.com/id.H1a1n1HA161l1I/origin.1/section.97/section_type.1/country.es/vertical.homes/iuid.26541trovit-web-6f6984d597-cn2hw66a3db50da183/tracking.%7B%22cmp%22%3A%22u%22%7D/what_d.Malaga/type.2/page.15/cookieid.102012066a3db50d9b552.18159677/pos.14/;29660, Marbella, Provincia de Málaga;6  habitaciones;6  baños;400  m²;Beautiful single-family villa on 3 floors with 6 bedrooms and 6 bathrooms en suite cinema room with billiards, spacious lounge with very good dis...;Hace 1 día;Rentola;Malaga
5.500€;Villa For Rent in Puerto Banús, Marbella;https://rd.clk.thribee.com/id.bm1P1D1V1II1b/origin.1/section.97/section_type.1/country.es/vertical.homes/iuid.26541trovit-web-6f6984d597-cn2hw66a3db50da183/tracking.%7B%22cmp%22%3A%22u%22%7D/what_d.Malaga/type.2/page.15/cookieid.102012066a3db50d9b552.18159677/pos.15/;29660, Marbella, Provincia de Málaga;5  habitaciones;5  baños;350  m²;Puerto banus urbanizacion altalaya rio verde Detached single storey villa with very good distribution without floor all the bedrooms living rooms...;Hace 1 día;Rentola;Malaga
2.000€;Very homely studio in Benalmádena, with a view to the ocean;https://rd.clk.thribee.com/id.0A1w12171c1f1a/origin.1/section.97/section_type.1/country.es/vertical.homes/iuid.26541trovit-web-6f6984d597-cn2hw66a3db50da183/tracking.%7B%22cmp%22%3A%22u%22%7D/what_d.Malaga/type.2/page.15/cookieid.102012066a3db50d9b552.18159677/pos.16/;29630, Provincia de Málaga;1  habitaciones;1  baños;-;Rental period for this listing is between 3. 24 months...;Hace 1 día;Rentola;Malaga
415€;La Trinidad H2;https://rd.clk.thribee.com/id.U1Q14h3eU9/origin.1/section.97/section_type.1/country.es/vertical.homes/iuid.26541trovit-web-6f6984d597-cn2hw66a3db50da183/tracking.%7B%22cmp%22%3A%22u%22%7D/what_d.Malaga/type.2/page.15/cookieid.102012066a3db50d9b552.18159677/pos.17/;29009, Provincia de Málaga;1  habitaciones;1  baños;88  m²;Room in Calle Don Juan de Austria Available from: Book now: Min. Stay: 3 Max. Stay: 18 Deposit: 415 [ENG] How does Som work? Som is an online pla...;Hace 1 día;Rentola;Malaga
8.200€;Villa For Rent in Milla De Oro - Sierra Blanca, Marbella;https://rd.clk.thribee.com/id.1E1yWyo1a1M1P/origin.1/section.97/section_type.1/country.es/vertical.homes/iuid.26541trovit-web-6f6984d597-cn2hw66a3db50da183/tracking.%7B%22cmp%22%3A%22u%22%7D/what_d.Malaga/type.2/page.15/cookieid.102012066a3db50d9b552.18159677/pos.18/;29602, Marbella, Provincia de Málaga;4  habitaciones;4  baños;450  m²;Villa sierra blanca with private swimming pool urbanizacion capricho brand new. 4 bedrooms and 4 bathrooms en suite plus 1 guest toilet. It has s...;Hace 1 día;Rentola;Malaga
16.000€;Detached Villa in Selwo;https://rd.clk.thribee.com/id.1B1u1q1i1S13Q19/origin.1/section.97/section_type.1/country.es/vertical.homes/iuid.26541trovit-web-6f6984d597-cn2hw66a3db50da183/tracking.%7B%22cmp%22%3A%22u%22%7D/what_d.Malaga/type.2/page.15/cookieid.102012066a3db50d9b552.18159677/pos.19/;36517,;5  habitaciones;6  baños;618  m²;Beautiful villa and immaculately presented, located in El Paraiso, a tranquil residential area with a short 10 minute drive Puerto Banus and its...;Hace 1 día;Rentola;Malaga
9.000€;Villa For Rent in Milla De Oro - Sierra Blanca, Marbella;https://rd.clk.thribee.com/id.aL8z1c1B21t/origin.1/section.97/section_type.1/country.es/vertical.homes/iuid.26541trovit-web-6f6984d597-cn2hw66a3db50da183/tracking.%7B%22cmp%22%3A%22u%22%7D/what_d.Malaga/type.2/page.15/cookieid.102012066a3db50d9b552.18159677/pos.20/;29602, Marbella, Provincia de Málaga;5  habitaciones;4  baños;295  m²;Casa en Marbella, con 5 dormitorios y 4 baños. 295 m 2 de superficie útil, ofreciendo un espacio muy amplio para sus necesidades. Este inmueble,...;Hace 1 día;Rentola;Malaga
2.900€;Duplex in Marbella;https://rd.clk.thribee.com/id.1M1q1z1H131R1XY/origin.1/section.97/section_type.1/country.es/vertical.homes/iuid.26541trovit-web-6f6984d597-cn2hw66a3db50da183/tracking.%7B%22cmp%22%3A%22u%22%7D/what_d.Malaga/type.2/page.15/cookieid.102012066a3db50d9b552.18159677/pos.21/;29601, Marbella, Provincia de Málaga;3  habitaciones;2  baños;144  m²;This magnificent apartment is within a complex that has security, it is located in a very quiet residential area with several restaurants very cl...;Hace 1 día;Rentola;Malaga
670€;Miraorquideas Hab 2 Individual/Pareja Cama grande;https://rd.clk.thribee.com/id.a1mC1d1OE1hC/origin.1/section.97/section_type.1/country.es/vertical.homes/iuid.26541trovit-web-6f6984d597-cn2hw66a3db50da183/tracking.%7B%22cmp%22%3A%22u%22%7D/what_d.Malaga/type.2/page.15/cookieid.102012066a3db50d9b552.18159677/pos.22/;29011, Provincia de Málaga;1  habitaciones;2  baños;70  m²;Room in Calle Miraorquideas Available from: Book now: Min. Stay: 6 Max. Stay: 18 Deposit: 670 [ENG] How does Som work? Som is an online platform...;Hace 1 día;Rentola;Malaga
2.812€;Calle Ruiz Blaser, Malaga - Amsterdam Apartments for Rent;https://rd.clk.thribee.com/id.1Fs151P14121x12/origin.1/section.97/section_type.1/country.es/vertical.homes/iuid.26541trovit-web-6f6984d597-cn2hw66a3db50da183/tracking.%7B%22cmp%22%3A%22u%22%7D/what_d.Malaga/type.2/page.15/cookieid.102012066a3db50d9b552.18159677/pos.23/;29016, Provincia de Málaga;1  habitaciones;-;592  m²;"Art Deco chilli (Available From) (""License/registration number: VFT/MA/55896"") It is a fully functional and well-equipped apartment, with all the...";Hace 1 día;Rentola;Malaga
7.250€;Villa For Rent in Puerto Banús, Marbella;https://rd.clk.thribee.com/id.11Jx291n1de/origin.1/section.97/section_type.1/country.es/vertical.homes/iuid.26541trovit-web-6f6984d597-cn2hw66a3db50da183/tracking.%7B%22cmp%22%3A%22u%22%7D/what_d.Malaga/type.2/page.15/cookieid.102012066a3db50d9b552.18159677/pos.24/;29660, Marbella, Provincia de Málaga;4  habitaciones;3  baños;295  m²;Villa in Bahia de Banus, Marbella. Puerto Banus for long term rental, furnished and modern Luxury Rental K Near Synagogues Bet Habad Puerto Banus...;Hace 1 día;Rentola;Malaga
2.500€;Apartment For Rent in Nueva Andalucía, Marbella;https://rd.clk.thribee.com/id.U1C1T41m1v1V1e/origin.1/section.97/section_type.1/country.es/vertical.homes/iuid.26541trovit-web-6f6984d597-cn2hw66a3db50da183/tracking.%7B%22cmp%22%3A%22u%22%7D/what_d.Malaga/type.2/page.15/cookieid.102012066a3db50d9b552.18159677/pos.25/;29660, Marbella, Provincia de Málaga;3  habitaciones;2  baños;145  m²;Spacious first-floor apartment in a secure complex located in a quiet area of NuevaAndalucía, yet close to Puerto Banús and all amenities. Due to...;Hace 1 día;Rentola;Malaga
3.300€;Penthouse · Estepona;https://rd.clk.thribee.com/id.16ux1p1guL1F/origin.1/section.97/section_type.1/country.es/vertical.homes/iuid.24178trovit-web-6f6984d597-tg4sb66a3db5340e76/tracking.%7B%22cmp%22%3A%22u%22%7D/what_d.Malaga/type.2/page.25/cookieid.10200140166a3db53409918.32323816/pos.1/;Estepona, Provincia de Málaga;3  habitaciones;3  baños;228  m²;Available from 1 August for long term rental Impressive duplex penthouse in the prestigious urbanisation of El Real del Campanario. The flat cons...;Hace 2 días;Kuhamia;Malaga
850€;Piso en alquiler en Torre del Mar;https://rd.clk.thribee.com/id.1o71Xh1E131f7/origin.1/section.232/section_type.2/country.es/vertical.homes/iuid.24178trovit-web-6f6984d597-tg4sb66a3db5340e76/tracking.%7B%22cmp%22%3A%22u%22%7D/what_d.Malaga/type.2/page.25/cookieid.10200140166a3db53409918.32323816/pos.1/;Torre del Mar, Vélez-Málaga, Provincia de Málaga;2 habitaciones;2 baños;-;Alquiler desde septiembre hasta finales de abril, no para larga temporada. Te damos la bienvenida a este encantador apartamento en la primera pla...;Hace 7 días;Todopisos;Malaga
750€;Estudio en alquiler en Torremolinos;https://rd.clk.thribee.com/id.161DQ17Y1eoC/origin.1/section.232/section_type.2/country.es/vertical.homes/iuid.24178trovit-web-6f6984d597-tg4sb66a3db5340e76/tracking.%7B%22cmp%22%3A%22u%22%7D/what_d.Malaga/type.2/page.25/cookieid.10200140166a3db53409918.32323816/pos.2/;29620, Torremolinos, Provincia de Málaga;-;1 baños;50 m²;Se alquila ESTUDIO SÓLO POR TEMPORADA, a cinco minutos del centro de Torremolinos. La vivienda tiene 50 metros se encuentra en una urbanización c...;Hace 7 días;Todopisos;Malaga
15.000€;5 room luxury Villa for rent in Marbella, Andalusia;https://rd.clk.thribee.com/id.91x1v1z1xa1Kh/origin.1/section.97/section_type.1/country.es/vertical.homes/iuid.24178trovit-web-6f6984d597-tg4sb66a3db5340e76/tracking.%7B%22cmp%22%3A%22u%22%7D/what_d.Malaga/type.2/page.25/cookieid.10200140166a3db53409918.32323816/pos.2/;Marbella, Provincia de Málaga;5  habitaciones;5  baños;578  m²;...villa Las Lomas is located in the prestigious area of Las Lomas del Marbella Club, on the coveted Marbella Golden Mile in Marbella, Malaga...;Hace 2 días;Kuhamia;Malaga
8.000€;Luxury Villa for rent in Marbella, Spain;https://rd.clk.thribee.com/id.aJo1q1SN1xG/origin.1/section.97/section_type.1/country.es/vertical.homes/iuid.24178trovit-web-6f6984d597-tg4sb66a3db5340e76/tracking.%7B%22cmp%22%3A%22u%22%7D/what_d.Malaga/type.2/page.25/cookieid.10200140166a3db53409918.32323816/pos.3/;Marbella, Provincia de Málaga;6  habitaciones;6  baños;814  m²;Villa Sofia: beautiful villa for short term rental in front line golf in Los Flamingos, Benahavis. Villa Sofia: Incredible villa located on argua...;Hace 2 días;Kuhamia;Malaga
3.200€;Penthouse · New Golden Mile;https://rd.clk.thribee.com/id.t31oIjW1p11/origin.1/section.97/section_type.1/country.es/vertical.homes/iuid.24178trovit-web-6f6984d597-tg4sb66a3db5340e76/tracking.%7B%22cmp%22%3A%22u%22%7D/what_d.Malaga/type.2/page.25/cookieid.10200140166a3db53409918.32323816/pos.4/;;3  habitaciones;2  baños;130  m²;LONG TERM Magnificent Duplex-Penthouse with private pool in a luxury urbanization on the first line with direct access to the beach. Unbeatable v...;Hace 2 días;Kuhamia;Malaga
10.000€;5 room luxury Villa for rent in Marbella, Andalusia;https://rd.clk.thribee.com/id.1Y1C141QmSqS/origin.1/section.97/section_type.1/country.es/vertical.homes/iuid.24178trovit-web-6f6984d597-tg4sb66a3db5340e76/tracking.%7B%22cmp%22%3A%22u%22%7D/what_d.Malaga/type.2/page.25/cookieid.10200140166a3db53409918.32323816/pos.5/;Marbella, Provincia de Málaga;5  habitaciones;6  baños;363  m²;Luxury Villa Close to the Beach in Los Monteros, Marbella for Short-Term Rent This magnificent beachside villa boasts an impressive 936m2 of opul...;Hace 2 días;Kuhamia;Malaga
