precio;sub_descr;href;ubicacion;habitaciones;banios;mt2;otros;publicado_hace;plataforma;CCAA
450.000€;Piso Venta Sevilla Capital, San José-San Carlos-Fontanal;https://rd.clk.thribee.com/id.L1A1f1a171r1x1R/origin.1/section.1/section_type.2/country.es/vertical.homes/iuid.24521trovit-web-7f7dc96976-m8lf666870faf78692/tracking.%7B%22cmp%22%3A%22u%22%7D/what_d.piso%20sevilla%20provincia/type.1/page.39/cookieid.102115366870faf65db49.11157158/pos.1/;41003, Distrito San Pablo-Santa Justa, Sevilla, Provincia de Sevilla;4  habitaciones;2  baños;165  m²;Piso en venta, primera planta, tiene ascensor, con trastero, mobiliario: a consultar, ubicado en Sevilla capital, con una superficie de 165...;Hace +30 días;Pisos;Sevilla
540.000€;Piso Venta Sevilla Capital, Arenal;https://rd.clk.thribee.com/id.Og2Ck1m1Y1M/origin.1/section.1/section_type.2/country.es/vertical.homes/iuid.24521trovit-web-7f7dc96976-m8lf666870faf78692/tracking.%7B%22cmp%22%3A%22u%22%7D/what_d.piso%20sevilla%20provincia/type.1/page.39/cookieid.102115366870faf65db49.11157158/pos.2/;41001, Casco Antiguo, Sevilla, Provincia de Sevilla;3  habitaciones;2  baños;146  m²;Se vende piso en segunda planta, de 3 habitaciones con 2 baños, equipado con aire acondicionado, con garaje, dispone de 1 armario empotrado...;Hace +1 año;Pisos;Sevilla
154.800€;Piso Venta Sevilla Capital, Avenida de las Ciencias-Emilio Lemos;https://rd.clk.thribee.com/id.R131s1-x1H1g1h/origin.1/section.1/section_type.2/country.es/vertical.homes/iuid.24521trovit-web-7f7dc96976-m8lf666870faf78692/tracking.%7B%22cmp%22%3A%22u%22%7D/what_d.piso%20sevilla%20provincia/type.1/page.39/cookieid.102115366870faf65db49.11157158/pos.3/;41020, Distrito Este-Alcosa-Torreblanca, Sevilla, Provincia de Sevilla;2  habitaciones;1  baños;75  m²;Piso obra nueva, planta baja, con trastero, mobiliario: a consultar, ubicado en Sevilla capital, en avenida de las ciencias con una superficie...;Hace +30 días;Pisos;Sevilla
265.000€;Piso Venta Sevilla Capital, Bellavista;https://rd.clk.thribee.com/id.1h81l1e1l1j1PE/origin.1/section.1/section_type.2/country.es/vertical.homes/iuid.24521trovit-web-7f7dc96976-m8lf666870faf78692/tracking.%7B%22cmp%22%3A%22u%22%7D/what_d.piso%20sevilla%20provincia/type.1/page.39/cookieid.102115366870faf65db49.11157158/pos.4/;41012, Distrito Bellavista-La Palmera, Sevilla, Provincia de Sevilla;2  habitaciones;2  baños;150  m²;Inmueble de obra nueva, piso en Sevilla capital en palmas altas con una superficie de 150 metros, mobiliario: a consultar, estado: listo para...;Hace +30 días;Pisos;Sevilla
780.000€;Piso Venta Sevilla Capital, San Vicente;https://rd.clk.thribee.com/id.1kqM1c1Z1LoW/origin.1/section.1/section_type.2/country.es/vertical.homes/iuid.24521trovit-web-7f7dc96976-m8lf666870faf78692/tracking.%7B%22cmp%22%3A%22u%22%7D/what_d.piso%20sevilla%20provincia/type.1/page.39/cookieid.102115366870faf65db49.11157158/pos.5/;41002, San Vicente, Casco Antiguo, Sevilla, Provincia de Sevilla;3  habitaciones;2  baños;420  m²;Se vende piso de 3 habitaciones con 2 baños, equipado con aire acondicionado, con garaje, dispone de 1 armario empotrado, con trastero...;Hace +1 año;Pisos;Sevilla
330.000€;Piso Venta Sevilla Capital, Triana Casco Antiguo;https://rd.clk.thribee.com/id.1ls1k1g1xj1nd/origin.1/section.1/section_type.2/country.es/vertical.homes/iuid.24521trovit-web-7f7dc96976-m8lf666870faf78692/tracking.%7B%22cmp%22%3A%22u%22%7D/what_d.piso%20sevilla%20provincia/type.1/page.39/cookieid.102115366870faf65db49.11157158/pos.6/;41010, Casco Antiguo, Sevilla, Provincia de Sevilla;4  habitaciones;2  baños;130  m²;Venta de piso, segunda planta, equipado con aire acondicionado, 4 habitaciones, 2 baños, con balcón, mobiliario: a consultar, grande, situado...;Hace +30 días;Pisos;Sevilla
399.995€;Piso Venta Sevilla Capital, San Roque-La Calzada;https://rd.clk.thribee.com/id.1c_f1zTkPa/origin.1/section.1/section_type.2/country.es/vertical.homes/iuid.24521trovit-web-7f7dc96976-m8lf666870faf78692/tracking.%7B%22cmp%22%3A%22u%22%7D/what_d.piso%20sevilla%20provincia/type.1/page.39/cookieid.102115366870faf65db49.11157158/pos.7/;41003, San Roque, Nervión, Sevilla, Provincia de Sevilla;5  habitaciones;3  baños;144  m²;Venta de piso, quinta planta, más de 4 habitaciones, más de 2 baños, tiene ascensor, con trastero, mobiliario: a consultar, grande, situado en...;Hace 16 días;Pisos;Sevilla
182.500€;Piso Venta, Sevilla Capital;https://rd.clk.thribee.com/id.LE1g1U1u1f1lD/origin.1/section.1/section_type.2/country.es/vertical.homes/iuid.24521trovit-web-7f7dc96976-m8lf666870faf78692/tracking.%7B%22cmp%22%3A%22u%22%7D/what_d.piso%20sevilla%20provincia/type.1/page.39/cookieid.102115366870faf65db49.11157158/pos.8/;41807, Sevilla, Provincia de Sevilla;2  habitaciones;2  baños;103  m²;Piso obra nueva, planta baja, equipado con aire acondicionado, terraza, mobiliario: a consultar, ubicado en Sevilla capital, en avenida...;Hace 27 días;Pisos;Sevilla
550.000€;Piso Venta Sevilla Capital, La Palmera-Reina Mercedes;https://rd.clk.thribee.com/id.1_141MJ1BZG1_/origin.1/section.1/section_type.2/country.es/vertical.homes/iuid.24521trovit-web-7f7dc96976-m8lf666870faf78692/tracking.%7B%22cmp%22%3A%22u%22%7D/what_d.piso%20sevilla%20provincia/type.1/page.39/cookieid.102115366870faf65db49.11157158/pos.9/;41013, Distrito Bellavista-La Palmera, Sevilla, Provincia de Sevilla;3  habitaciones;-;138  m²;Piso en venta, cuarta planta, equipado con aire acondicionado, con garaje, tiene ascensor, con trastero, terraza, con balcón, mobiliario: a...;Hace +30 días;Pisos;Sevilla
465.000€;Piso Venta Sevilla Capital, Los Remedios;https://rd.clk.thribee.com/id.1ca1wnq1t1Rg/origin.1/section.1/section_type.2/country.es/vertical.homes/iuid.24521trovit-web-7f7dc96976-m8lf666870faf78692/tracking.%7B%22cmp%22%3A%22u%22%7D/what_d.piso%20sevilla%20provincia/type.1/page.39/cookieid.102115366870faf65db49.11157158/pos.10/;41011, Los Remedios, Sevilla, Provincia de Sevilla;3  habitaciones;-;156  m²;Venta de piso, primera planta, equipado con aire acondicionado, 3 habitaciones, gastos de comunidad más de 100 €, tiene ascensor, con trastero...;Hace 20 días;Pisos;Sevilla
163.300€;Piso Venta Sevilla Capital, Avenida de las Ciencias-Emilio Lemos;https://rd.clk.thribee.com/id.1kg1YQb1bJ19/origin.1/section.1/section_type.2/country.es/vertical.homes/iuid.24521trovit-web-7f7dc96976-m8lf666870faf78692/tracking.%7B%22cmp%22%3A%22u%22%7D/what_d.piso%20sevilla%20provincia/type.1/page.39/cookieid.102115366870faf65db49.11157158/pos.11/;41020, Distrito Este-Alcosa-Torreblanca, Sevilla, Provincia de Sevilla;2  habitaciones;2  baños;81  m²;Obra nueva, construcción de piso grande, tercera planta, situado en Sevilla capital, en calle nueva delhi (cercana a la comisaría de emilio...;Hace +30 días;Pisos;Sevilla
250.000€;Piso Venta Sevilla Capital, Tablada;https://rd.clk.thribee.com/id.M5Y1K1X1MxH/origin.1/section.1/section_type.2/country.es/vertical.homes/iuid.24521trovit-web-7f7dc96976-m8lf666870faf78692/tracking.%7B%22cmp%22%3A%22u%22%7D/what_d.piso%20sevilla%20provincia/type.1/page.39/cookieid.102115366870faf65db49.11157158/pos.12/;41011, Los Remedios, Sevilla, Provincia de Sevilla;2  habitaciones;-;117  m²;Se vende piso en Sevilla capital cuarta planta, en calle hispano aviación con una superficie de 117 metros, mobiliario: a consultar, en buen...;Hace 10 días;Pisos;Sevilla
315.000€;Piso Venta Sevilla Capital, Los Remedios;https://rd.clk.thribee.com/id.NO181m1i1WY1R/origin.1/section.1/section_type.2/country.es/vertical.homes/iuid.24521trovit-web-7f7dc96976-m8lf666870faf78692/tracking.%7B%22cmp%22%3A%22u%22%7D/what_d.piso%20sevilla%20provincia/type.1/page.39/cookieid.102115366870faf65db49.11157158/pos.13/;41011, Los Remedios, Sevilla, Provincia de Sevilla;3  habitaciones;-;79  m²;Piso en venta, equipado con aire acondicionado, tiene ascensor, mobiliario: a consultar, ubicado en Sevilla capital, con una superficie de 75...;Hace +30 días;Pisos;Sevilla
238.349€;Piso Venta Sevilla Capital, Zona Ronda de Triana-Cartuja;https://rd.clk.thribee.com/id.S15Iw17w1b1Z/origin.1/section.1/section_type.2/country.es/vertical.homes/iuid.24521trovit-web-7f7dc96976-m8lf666870faf78692/tracking.%7B%22cmp%22%3A%22u%22%7D/what_d.piso%20sevilla%20provincia/type.1/page.39/cookieid.102115366870faf65db49.11157158/pos.14/;41010, Triana, Sevilla, Provincia de Sevilla;4  habitaciones;1  baños;83  m²;Se vende piso en cuarta planta, de 4 habitaciones con 1 baño, equipado con aire acondicionado, mobiliario: a consultar, ubicado en Sevilla...;Hace +30 días;Pisos;Sevilla
210.000€;Piso Venta Sevilla Capital, Avenida de las Ciencias-Emilio Lemos;https://rd.clk.thribee.com/id.kFLRn2g6/origin.1/section.1/section_type.2/country.es/vertical.homes/iuid.24521trovit-web-7f7dc96976-m8lf666870faf78692/tracking.%7B%22cmp%22%3A%22u%22%7D/what_d.piso%20sevilla%20provincia/type.1/page.39/cookieid.102115366870faf65db49.11157158/pos.15/;41020, Distrito Este-Alcosa-Torreblanca, Sevilla, Provincia de Sevilla;3  habitaciones;2  baños;102  m²;Se vende piso en primera planta, de 3 habitaciones con 2 baños, equipado con aire acondicionado, con garaje, mobiliario: a consultar, ubicado...;Hace +30 días;Pisos;Sevilla
190.000€;Piso Venta Sevilla Capital, Avenida de las Ciencias-Emilio Lemos;https://rd.clk.thribee.com/id.l814y151E1x1Z/origin.1/section.1/section_type.2/country.es/vertical.homes/iuid.24521trovit-web-7f7dc96976-m8lf666870faf78692/tracking.%7B%22cmp%22%3A%22u%22%7D/what_d.piso%20sevilla%20provincia/type.1/page.39/cookieid.102115366870faf65db49.11157158/pos.16/;41019, Distrito Este-Alcosa-Torreblanca, Sevilla, Provincia de Sevilla;3  habitaciones;2  baños;90  m²;Venta de piso, quinta planta, equipado con aire acondicionado, 3 habitaciones, 2 baños, con garaje, mobiliario: a consultar, grande, situado...;Hace +30 días;Pisos;Sevilla
558.000€;Piso Venta Sevilla Capital, Nervión;https://rd.clk.thribee.com/id.bK1-1DR1xG1o/origin.1/section.1/section_type.2/country.es/vertical.homes/iuid.24521trovit-web-7f7dc96976-m8lf666870faf78692/tracking.%7B%22cmp%22%3A%22u%22%7D/what_d.piso%20sevilla%20provincia/type.1/page.39/cookieid.102115366870faf65db49.11157158/pos.17/;41005, Nervión, Sevilla, Provincia de Sevilla;4  habitaciones;2  baños;158  m²;Se vende piso de 4 habitaciones con 2 baños, equipado con aire acondicionado, con garaje, dispone de 1 armario empotrado, tiene ascensor...;Hace +30 días;Pisos;Sevilla
375.000€;Piso Venta Sevilla Capital, Nervión;https://rd.clk.thribee.com/id.B1s1-1l1DK1J1w/origin.1/section.1/section_type.2/country.es/vertical.homes/iuid.24521trovit-web-7f7dc96976-m8lf666870faf78692/tracking.%7B%22cmp%22%3A%22u%22%7D/what_d.piso%20sevilla%20provincia/type.1/page.39/cookieid.102115366870faf65db49.11157158/pos.18/;41005, Nervión, Sevilla, Provincia de Sevilla;3  habitaciones;2  baños;121  m²;Se vende piso en séptima planta, de 3 habitaciones con 2 baños, tiene ascensor, terraza, mobiliario: a consultar, ubicado en Sevilla capital...;Hace +30 días;Pisos;Sevilla
444.500€;Piso Venta Sevilla Capital, San Pablo;https://rd.clk.thribee.com/id.F121H1j_1U1q1-/origin.1/section.1/section_type.2/country.es/vertical.homes/iuid.24521trovit-web-7f7dc96976-m8lf666870faf78692/tracking.%7B%22cmp%22%3A%22u%22%7D/what_d.piso%20sevilla%20provincia/type.1/page.39/cookieid.102115366870faf65db49.11157158/pos.19/;41007, Distrito San Pablo-Santa Justa, Sevilla, Provincia de Sevilla;4  habitaciones;3  baños;147  m²;Piso en un inmueble de obra nueva de 148 m2 de superficie construida y situado en la zona de Sevilla Capital, con orientación sur. Está...;Hace +30 días;Pisos;Sevilla
249.900€;Piso Venta Sevilla Capital, Zona Esperanza de Triana;https://rd.clk.thribee.com/id.G1yF1a1ly1M1N/origin.1/section.1/section_type.2/country.es/vertical.homes/iuid.24521trovit-web-7f7dc96976-m8lf666870faf78692/tracking.%7B%22cmp%22%3A%22u%22%7D/what_d.piso%20sevilla%20provincia/type.1/page.39/cookieid.102115366870faf65db49.11157158/pos.20/;41011, Triana, Sevilla, Provincia de Sevilla;3  habitaciones;1  baños;85  m²;Venta de piso grande, situado en Sevilla capital, en Plaza de Cuba. República Argentina en buen estado, 3 habitaciones, 1 baño, mobiliario: a...;Hace +30 días;Pisos;Sevilla
289.500€;Piso Venta Sevilla Capital, San Pablo;https://rd.clk.thribee.com/id.I1j1i1C1LCkG/origin.1/section.1/section_type.2/country.es/vertical.homes/iuid.24521trovit-web-7f7dc96976-m8lf666870faf78692/tracking.%7B%22cmp%22%3A%22u%22%7D/what_d.piso%20sevilla%20provincia/type.1/page.39/cookieid.102115366870faf65db49.11157158/pos.21/;41007, Distrito San Pablo-Santa Justa, Sevilla, Provincia de Sevilla;3  habitaciones;1  baños;82  m²;Venta de piso grande, tercera planta, situado en Sevilla capital, en buen estado, equipado con aire acondicionado, 3 habitaciones, 1 baño...;Hace +30 días;Pisos;Sevilla
156.198€;Piso Venta Sevilla Capital, San Vicente;https://rd.clk.thribee.com/id.71E1w1f1Y121OA/origin.1/section.1/section_type.2/country.es/vertical.homes/iuid.24521trovit-web-7f7dc96976-m8lf666870faf78692/tracking.%7B%22cmp%22%3A%22u%22%7D/what_d.piso%20sevilla%20provincia/type.1/page.39/cookieid.102115366870faf65db49.11157158/pos.22/;41002, San Vicente, Casco Antiguo, Sevilla, Provincia de Sevilla;-;1  baños;37  m²;Venta de piso muy comodo, situado en Sevilla capital, 1 baño, tiene ascensor, mobiliario: a consultar...;Hace +30 días;Pisos;Sevilla
290.000€;Piso Venta Sevilla Capital, Elcano-Los Bermejales;https://rd.clk.thribee.com/id.D16o18-1udf/origin.1/section.1/section_type.2/country.es/vertical.homes/iuid.24521trovit-web-7f7dc96976-m8lf666870faf78692/tracking.%7B%22cmp%22%3A%22u%22%7D/what_d.piso%20sevilla%20provincia/type.1/page.39/cookieid.102115366870faf65db49.11157158/pos.23/;41012, Elcano-Los Bermejales, Distrito Bellavista-La Palmera, Sevilla, Provincia de Sevilla;2  habitaciones;2  baños;104  m²;Se vende piso en Sevilla capital primera planta, en calle finlandia con una superficie de 80 metros, mobiliario: a consultar, equipado con...;Hace +30 días;Pisos;Sevilla
289.000€;Piso Venta Sevilla Capital, San Pablo;https://rd.clk.thribee.com/id.F-1dGiPFZ/origin.1/section.1/section_type.2/country.es/vertical.homes/iuid.24521trovit-web-7f7dc96976-m8lf666870faf78692/tracking.%7B%22cmp%22%3A%22u%22%7D/what_d.piso%20sevilla%20provincia/type.1/page.39/cookieid.102115366870faf65db49.11157158/pos.24/;41007, Distrito San Pablo-Santa Justa, Sevilla, Provincia de Sevilla;3  habitaciones;2  baños;86  m²;Se vende piso en primera planta, de 3 habitaciones con 2 baños, equipado con aire acondicionado, tiene ascensor, terraza, mobiliario: a...;Hace +30 días;Pisos;Sevilla
312.000€;Piso Venta Sevilla Capital, Bellavista;https://rd.clk.thribee.com/id.JB1XQO181YT/origin.1/section.1/section_type.2/country.es/vertical.homes/iuid.24521trovit-web-7f7dc96976-m8lf666870faf78692/tracking.%7B%22cmp%22%3A%22u%22%7D/what_d.piso%20sevilla%20provincia/type.1/page.39/cookieid.102115366870faf65db49.11157158/pos.25/;41012, Distrito Bellavista-La Palmera, Sevilla, Provincia de Sevilla;3  habitaciones;2  baños;156  m²;Obra nueva, piso, 3 habitaciones, 2 baños, con 1 plaza de garaje, con trastero, orientado hacia el sur, mobiliario: a consultar, enorme...;Hace +30 días;Pisos;Sevilla
332.500€;Piso Venta San Juan de Aznalfarache, Barrio Alto;https://rd.clk.thribee.com/id.W16u1k1r1E1gK/origin.1/section.1/section_type.2/country.es/vertical.homes/iuid.8367trovit-web-7f7dc96976-89xn666870fb370432/tracking.%7B%22cmp%22%3A%22u%22%7D/what_d.piso%20sevilla%20provincia/type.1/page.61/cookieid.102115366870fb35f2345.12963734/pos.1/;41920, San Juan de Aznalfarache, Provincia de Sevilla;3  habitaciones;2  baños;158  m²;Venta de piso enorme, planta baja, soleado, situado en San Juan de Aznalfar, con piscina, equipado con aire acondicionado, 3 habitaciones, 2...;Hace +30 días;Pisos;Sevilla
129.500€;Piso Venta, La Algaba;https://rd.clk.thribee.com/id.W1L1zd8X1HO/origin.1/section.1/section_type.2/country.es/vertical.homes/iuid.8367trovit-web-7f7dc96976-89xn666870fb370432/tracking.%7B%22cmp%22%3A%22u%22%7D/what_d.piso%20sevilla%20provincia/type.1/page.61/cookieid.102115366870fb35f2345.12963734/pos.2/;41980, La Algaba, Provincia de Sevilla;2  habitaciones;2  baños;75  m²;Piso planta baja, con superficie total 75 m2, útil 62 m2, 2 habitaciones dobles, 2 baños completos, comedor, superficiecontruida (75), agua...;Hace +30 días;Pisos;Sevilla
;Piso Venta Segovia Capital, El Cerro-Hontoria;https://rd.clk.thribee.com/id.q1yXDv1RK1o/origin.1/section.1/section_type.2/country.es/vertical.homes/iuid.8367trovit-web-7f7dc96976-89xn666870fb370432/tracking.%7B%22cmp%22%3A%22u%22%7D/what_d.piso%20sevilla%20provincia/type.1/page.61/cookieid.102115366870fb35f2345.12963734/pos.3/;40006, Cerro del Águila, Distrito Cerro-Amate, Sevilla, Provincia de Sevilla;2  habitaciones;1  baños;64  m²;Se vende piso en Segovia capital A partir de planta 20, en carretera villacastin con una superficie de 58 metros, amueblado, 2 habitaciones, 1...;Hace +1 año;Pisos;Sevilla
146.000€;Piso Venta Dos Hermanas, Montequinto-El Colmenar;https://rd.clk.thribee.com/id.qk1MQyk1Aj/origin.1/section.1/section_type.2/country.es/vertical.homes/iuid.8367trovit-web-7f7dc96976-89xn666870fb370432/tracking.%7B%22cmp%22%3A%22u%22%7D/what_d.piso%20sevilla%20provincia/type.1/page.61/cookieid.102115366870fb35f2345.12963734/pos.4/;41704, Montequinto, Dos Hermanas, Provincia de Sevilla;2  habitaciones;2  baños;91  m²;Inmueble de obra nueva, piso en Dos Hermanas primera planta, en avenida rafael escuredo rodríguez con una superficie de 91 metros, mobiliario...;Hace +30 días;Pisos;Sevilla
160.900€;Piso Venta Dos Hermanas, Montequinto-El Colmenar;https://rd.clk.thribee.com/id.Zq1G1k1i1wc1d/origin.1/section.1/section_type.2/country.es/vertical.homes/iuid.8367trovit-web-7f7dc96976-89xn666870fb370432/tracking.%7B%22cmp%22%3A%22u%22%7D/what_d.piso%20sevilla%20provincia/type.1/page.61/cookieid.102115366870fb35f2345.12963734/pos.5/;41704, Montequinto, Dos Hermanas, Provincia de Sevilla;2  habitaciones;2  baños;79  m²;Obra nueva, piso en primera planta, de 2 habitaciones con 2 baños, con trastero, terraza, mobiliario: a consultar, ubicado en Dos Hermanas, en...;Hace 20 días;Pisos;Sevilla
135.000€;Piso Venta Alcalá de Guadaíra, Centro;https://rd.clk.thribee.com/id.b1zG1GSt619/origin.1/section.1/section_type.2/country.es/vertical.homes/iuid.8367trovit-web-7f7dc96976-89xn666870fb370432/tracking.%7B%22cmp%22%3A%22u%22%7D/what_d.piso%20sevilla%20provincia/type.1/page.61/cookieid.102115366870fb35f2345.12963734/pos.6/;41500, Alcalá de Guadaíra, Provincia de Sevilla;2  habitaciones;1  baños;79  m²;Piso en venta, segunda planta, tiene ascensor, terraza, mobiliario: a consultar, ubicado en Alcalá de Guadaíra, en Centro con una superficie...;Hace +30 días;Pisos;Sevilla
267.700€;Piso Venta Bormujos, Zona Universitaria;https://rd.clk.thribee.com/id.c1F19a13I1x0/origin.1/section.1/section_type.2/country.es/vertical.homes/iuid.8367trovit-web-7f7dc96976-89xn666870fb370432/tracking.%7B%22cmp%22%3A%22u%22%7D/what_d.piso%20sevilla%20provincia/type.1/page.61/cookieid.102115366870fb35f2345.12963734/pos.7/;41930, Bormujos, Provincia de Sevilla;3  habitaciones;2  baños;119  m²;Obra nueva, piso en planta baja, de 3 habitaciones con 2 baños, con trastero, terraza, mobiliario: a consultar, ubicado en Bormujos, en...;Hace +30 días;Pisos;Sevilla
148.000€;Piso Venta, Coria del Río;https://rd.clk.thribee.com/id.c1L41bO1zu3/origin.1/section.1/section_type.2/country.es/vertical.homes/iuid.8367trovit-web-7f7dc96976-89xn666870fb370432/tracking.%7B%22cmp%22%3A%22u%22%7D/what_d.piso%20sevilla%20provincia/type.1/page.61/cookieid.102115366870fb35f2345.12963734/pos.8/;41100, Coria del Río, Provincia de Sevilla;3  habitaciones;1  baños;118  m²;Se vende piso en Coria del Río en calle amapola 1 con una superficie de 95 metros, mobiliario: a consultar, 3 habitaciones, 1 baño, terraza...;Hace +1 año;Pisos;Sevilla
149.000€;Piso Venta Alcalá de Guadaíra, Centro;https://rd.clk.thribee.com/id.d_23h1aw/origin.1/section.1/section_type.2/country.es/vertical.homes/iuid.8367trovit-web-7f7dc96976-89xn666870fb370432/tracking.%7B%22cmp%22%3A%22u%22%7D/what_d.piso%20sevilla%20provincia/type.1/page.61/cookieid.102115366870fb35f2345.12963734/pos.9/;41500, Alcalá de Guadaíra, Provincia de Sevilla;3  habitaciones;2  baños;130  m²;Piso con superficie total 130 m2, 3 habitaciones dobles, 2 baños completos, superficiecontruida (130), piscina, aire acondicionado...;Hace +30 días;Pisos;Sevilla
128.000€;Piso Venta Utrera;https://rd.clk.thribee.com/id.k141Y1jAlF3/origin.1/section.1/section_type.2/country.es/vertical.homes/iuid.8367trovit-web-7f7dc96976-89xn666870fb370432/tracking.%7B%22cmp%22%3A%22u%22%7D/what_d.piso%20sevilla%20provincia/type.1/page.61/cookieid.102115366870fb35f2345.12963734/pos.10/;41710, Utrera, Provincia de Sevilla;3  habitaciones;2  baños;110  m²;Venta de piso grande, segunda planta, situado en Utrera, en Centro Salesianos equipado con aire acondicionado, 3 habitaciones, 2 baños...;Hace 29 días;Pisos;Sevilla
165.000€;Piso Venta Écija;https://rd.clk.thribee.com/id.NJ1mS01wsP/origin.1/section.1/section_type.2/country.es/vertical.homes/iuid.8367trovit-web-7f7dc96976-89xn666870fb370432/tracking.%7B%22cmp%22%3A%22u%22%7D/what_d.piso%20sevilla%20provincia/type.1/page.61/cookieid.102115366870fb35f2345.12963734/pos.11/;41400, Écija, Provincia de Sevilla;4  habitaciones;2  baños;175  m²;Venta de piso, segunda planta, equipado con aire acondicionado, 4 habitaciones, 2 baños, con trastero, terraza, con balcón, mobiliario: a...;Hace +30 días;Pisos;Sevilla
149.000€;Piso Venta Dos Hermanas, Montequinto-El Colmenar;https://rd.clk.thribee.com/id.T31r1T1sh16P/origin.1/section.1/section_type.2/country.es/vertical.homes/iuid.8367trovit-web-7f7dc96976-89xn666870fb370432/tracking.%7B%22cmp%22%3A%22u%22%7D/what_d.piso%20sevilla%20provincia/type.1/page.61/cookieid.102115366870fb35f2345.12963734/pos.12/;41089, Montequinto, Dos Hermanas, Provincia de Sevilla;2  habitaciones;1  baños;109  m²;Piso en venta, cuarta planta, terraza, mobiliario: a consultar, ubicado en Dos Hermanas, con una superficie de 109 metros, 2 habitaciones, 1...;Hace 16 días;Pisos;Sevilla
206.200€;Piso Venta Dos Hermanas, Montequinto-El Colmenar;https://rd.clk.thribee.com/id.TZ1lzg1Y1RK/origin.1/section.1/section_type.2/country.es/vertical.homes/iuid.8367trovit-web-7f7dc96976-89xn666870fb370432/tracking.%7B%22cmp%22%3A%22u%22%7D/what_d.piso%20sevilla%20provincia/type.1/page.61/cookieid.102115366870fb35f2345.12963734/pos.13/;41704, Montequinto, Dos Hermanas, Provincia de Sevilla;3  habitaciones;2  baños;110  m²;Obra nueva, construcción de piso grande, situado en Dos Hermanas, estado: listo para entrar, 3 habitaciones, 2 baños, mobiliario: a consultar...;Hace +30 días;Pisos;Sevilla
149.000€;Piso Venta, Coria del Río;https://rd.clk.thribee.com/id.ez1_E1Ce1P13/origin.1/section.1/section_type.2/country.es/vertical.homes/iuid.8367trovit-web-7f7dc96976-89xn666870fb370432/tracking.%7B%22cmp%22%3A%22u%22%7D/what_d.piso%20sevilla%20provincia/type.1/page.61/cookieid.102115366870fb35f2345.12963734/pos.14/;41100, Coria del Río, Provincia de Sevilla;3  habitaciones;-;130  m²;Piso en venta, primera planta, mobiliario: a consultar, ubicado en Coria del Río, en centro con una superficie de 100 metros, en buen estado...;Hace +30 días;Pisos;Sevilla
95.000€;Piso Venta, Sanlúcar la Mayor;https://rd.clk.thribee.com/id.15l1U1ONIP1x/origin.1/section.1/section_type.2/country.es/vertical.homes/iuid.8367trovit-web-7f7dc96976-89xn666870fb370432/tracking.%7B%22cmp%22%3A%22u%22%7D/what_d.piso%20sevilla%20provincia/type.1/page.61/cookieid.102115366870fb35f2345.12963734/pos.15/;41800, Sanlúcar la Mayor, Provincia de Sevilla;2  habitaciones;1  baños;85  m²;Se vende piso en primera planta, de 2 habitaciones con 1 baño, equipado con aire acondicionado, mobiliario: a consultar, ubicado en Sanlúcar...;Hace +30 días;Pisos;Sevilla
166.500€;Piso Venta Guillena;https://rd.clk.thribee.com/id.1615OAR1_Op/origin.1/section.1/section_type.2/country.es/vertical.homes/iuid.8367trovit-web-7f7dc96976-89xn666870fb370432/tracking.%7B%22cmp%22%3A%22u%22%7D/what_d.piso%20sevilla%20provincia/type.1/page.61/cookieid.102115366870fb35f2345.12963734/pos.16/;41219, Guillena, Provincia de Sevilla;2  habitaciones;2  baños;100  m²;T2. Esc. 13 Pl. 1 Pt... Piso en un edificio de obra nueva de 101 m2 de superficie construida y ubicado en la zona de Guillena. Está...;Hace +30 días;Pisos;Sevilla
90.000€;Piso Venta Écija;https://rd.clk.thribee.com/id.171xb1ny1912n/origin.1/section.1/section_type.2/country.es/vertical.homes/iuid.8367trovit-web-7f7dc96976-89xn666870fb370432/tracking.%7B%22cmp%22%3A%22u%22%7D/what_d.piso%20sevilla%20provincia/type.1/page.61/cookieid.102115366870fb35f2345.12963734/pos.17/;41400, Écija, Provincia de Sevilla;4  habitaciones;3  baños;149  m²;Piso planta 2, con superficie total 149 m2, útil 125 m2, 4 habitaciones (1 doble 3 individuales), 3 baños completos...;Hace +30 días;Pisos;Sevilla
83.000€;Piso Venta Alcalá de Guadaíra, Centro;https://rd.clk.thribee.com/id.19KY1vKm121Y/origin.1/section.1/section_type.2/country.es/vertical.homes/iuid.8367trovit-web-7f7dc96976-89xn666870fb370432/tracking.%7B%22cmp%22%3A%22u%22%7D/what_d.piso%20sevilla%20provincia/type.1/page.61/cookieid.102115366870fb35f2345.12963734/pos.18/;41500, Alcalá de Guadaíra, Provincia de Sevilla;-;-;94  m²;Piso en venta, mobiliario: a consultar, ubicado en Alcalá de Guadaíra, en Zona Silos con una superficie de 94 metros...;Hace 20 días;Pisos;Sevilla
