precio;sub_descr;href;ubicacion;habitaciones;banios;mt2;planta;otros;latitude;longitude;CCAA
1.300 €/mes;Piso en Mestalla;/alquilar/piso-el_pla_del_real_mestalla46010-45905665547_101800/;Mestalla (Distrito El Pla del Real. València Capital);2 habs.;1 baño;90 m²;3ª planta;"Excelente vivienda en alquiler en la zona de mestalla. 
Se alquila semiamueblada.
Reformada. Con la elegancia de las viviendas ant...";39.4727075;-0.3601562;valencia
2.100 €/mes;Chalet en calle Camí Vall de La Calderona;/alquilar/chalet-sagunt_poble_centre-38358296036_100500/;Centre (Distrito Sagunt Poble. Sagunt - Sagunto);3 habs.;3 baños;210 m²;;"Alquiler de corta estancia a partir de septiembre
Bienvenido a tu nuevo hogar en gilet, donde la comodidad y la modernidad se encu...";39.6580281;-0.3505139;valencia
