precio;sub_descr;href;ubicacion;habitaciones;banios;mt2;planta;otros;latitude;longitude;CCAA
1.985 €/mes;;/alquilar/piso-el_barri_gotic08002-40865516060_100500/;El Barri Gòtic (Distrito Ciutat Vella. Barcelona Capital);2 habs.;2 baños;56 m²;1ª planta;"*completamente amueblado*
*alquileres mensuales de 1 a 11 meses*

Espectacular apartamento en carrer de les jonqueres, con 2 dormi...";41.3884809;2.1738925;barcelona
1.840 €/mes;Piso en Carrer del Consell de Cent, 179;/alquilar/piso-la_nova_esquerra_de_eixample08015-42502077158_100500/;La Nova Esquerra de l'Eixample (Distrito Eixample. Barcelona Capital);1 hab.;1 baño;53 m²;3ª planta;"*completamente amueblado*
*alquileres mensuales de 1 a 11 meses*

Espectacular apartamento en consell de cent, con 1 dormitorio y ...";41.3836;2.15533;barcelona
2.720 €/mes;;/alquilar/piso-eixample_sant_antoni08015-40894466249_100500/;Sant Antoni (Distrito Eixample. Barcelona Capital);2 habs.;1 baño;80 m²;2ª planta;"*completamente amueblado*
*alquileres mensuales de 1 a 11 meses*

Bari es un piso moderno, radiante y de inspiración selvática ubi...";41.3801611;2.1590953;barcelona
2.450 €/mes;;/alquilar/piso-el_fort_pienc08013-40839373946_100500/;El Fort Pienc (Distrito Eixample. Barcelona Capital);2 habs.;1 baño;76 m²;2ª planta;"*completamente amueblado* 
*alquiler mensual de 1 a 11 meses* 

Incandescente, inspirador. Siwa presume de luminosidad y modernida...";41.3976688;2.1769192;barcelona
2.185 €/mes;;/alquilar/piso-la_dreta_de_eixample08010-40852754282_100500/;La Dreta de l'Eixample (Distrito Eixample. Barcelona Capital);2 habs.;2 baños;60 m²;4ª planta;"*completamente amueblado*
*alquileres mensuales de 1 a 11 meses*

Espectacular apartamento en carrer de les jonqueres, con 2 dormi...";41.388906878;2.173721289;barcelona
6.285 €/mes;;/alquilar/atico-la_dreta_de_eixample08007-40870888708_100500/;La Dreta de l'Eixample (Distrito Eixample. Barcelona Capital);2 habs.;2 baños;150 m²;;"*apartamento con terraza*
*completamente amueblado*
*alquileres mensuales de 1 a 11 meses*

Donde el mundo exterior se mezcla con ...";41.3925352;2.1656287;barcelona
