precio;sub_descr;href;ubicacion;habitaciones;banios;mt2;otros;publicado_hace;plataforma;CCAA
3.500€;Apartamento Planta Baja;https://rd.clk.thribee.com/id.181nxg41I1HT/origin.1/section.97/section_type.1/country.es/vertical.homes/iuid.20622trovit-web-85d48c649-xtbf2669817db7396a/tracking.%7B%22cmp%22%3A%22u%22%7D/what_d.Malaga/type.2/page.13/cookieid.1020120669817db736040.87652415/pos.1/;29660, Provincia de Málaga;3  habitaciones;2  baños;177  m²;Apartamento Planta Baja, Puerto Banús, Costa del Sol. 3 Dormitorios, 2 Baños, Construidos 177 m², Terraza 13 m². Posición: Lado de la Playa, Cerc...;Hace 2 días;Rentola;Malaga
1.600€;4 dormitorio, Pizarra 1ES79067-;https://rd.clk.thribee.com/id.-1-9GFL1kF/origin.1/section.232/section_type.2/country.es/vertical.homes/iuid.20622trovit-web-85d48c649-xtbf2669817db7396a/tracking.%7B%22cmp%22%3A%22u%22%7D/what_d.Malaga/type.2/page.13/cookieid.1020120669817db736040.87652415/pos.1/;Pizarra, Provincia de Málaga;4 habitaciones;3 baños;-;TRV79067---. Esta casa se encuentra en Pizarra Pizarra. Tiene 4 dormitorios, 3 baños. Esta 4 dormitorio Fazenda en Pizarra Pizarra es para alquil...;Hace 1 día;Listanza;Malaga
600€;3 dormitorio, Alcaucín 1ES79021-;https://rd.clk.thribee.com/id.1u1Qtg1bT1H1g/origin.1/section.232/section_type.2/country.es/vertical.homes/iuid.20622trovit-web-85d48c649-xtbf2669817db7396a/tracking.%7B%22cmp%22%3A%22u%22%7D/what_d.Malaga/type.2/page.13/cookieid.1020120669817db736040.87652415/pos.2/;Alcaucín, Provincia de Málaga;3 habitaciones;1 baños;-;TRV79021---. Esta casa se encuentra en Alcaucín Alcaucín. Tiene 3 dormitorios, 1 baño. Esta 3 dormitorio Casa en Alcaucín Alcaucín es para alquil...;Hace 1 día;Listanza;Malaga
7.500€;Apartamento Planta Baja;https://rd.clk.thribee.com/id.11261nbz1z5/origin.1/section.97/section_type.1/country.es/vertical.homes/iuid.20622trovit-web-85d48c649-xtbf2669817db7396a/tracking.%7B%22cmp%22%3A%22u%22%7D/what_d.Malaga/type.2/page.13/cookieid.1020120669817db736040.87652415/pos.2/;29660, Provincia de Málaga;3  habitaciones;2  baños;130  m²;Apartamento Planta Baja, Puerto Banús, Costa del Sol. 3 Dormitorios, 2 Baños, Construidos 130 m², Terraza 40 m². Posición: Primera línea de Playa...;Hace 2 días;Rentola;Malaga
8.255€;Apartment in San Pedro de Alcántara, Costa del Sol;https://rd.clk.thribee.com/id.gQl1kc1N1b1e/origin.1/section.97/section_type.1/country.es/vertical.homes/iuid.20622trovit-web-85d48c649-xtbf2669817db7396a/tracking.%7B%22cmp%22%3A%22u%22%7D/what_d.Malaga/type.2/page.13/cookieid.1020120669817db736040.87652415/pos.3/;29670, San Pedro de Alcántara, Marbella, Provincia de Málaga;3  habitaciones;2  baños;157  m²;A fantastic 3 bedroom penthouse with enormous wrap round terrace that sleeps 6 adults and 2 children located close to all amenities with stunning...;Hace 2 días;Rentola;Malaga
1.650€;Apartamento Planta Media;https://rd.clk.thribee.com/id.leb1r18a151z/origin.1/section.97/section_type.1/country.es/vertical.homes/iuid.20622trovit-web-85d48c649-xtbf2669817db7396a/tracking.%7B%22cmp%22%3A%22u%22%7D/what_d.Malaga/type.2/page.13/cookieid.1020120669817db736040.87652415/pos.4/;29689, Provincia de Málaga;2  habitaciones;2  baños;88  m²;Este encantador apartamento de 2 dormitorios y 2 baños se encuentra en Costa Nagüeles 3, en la prestigiosa zona de Marbella conocida como la Mill...;Hace 2 días;Rentola;Malaga
7.500€;Villa - Chalet;https://rd.clk.thribee.com/id.cg1k1t1jH1R/origin.1/section.97/section_type.1/country.es/vertical.homes/iuid.20622trovit-web-85d48c649-xtbf2669817db7396a/tracking.%7B%22cmp%22%3A%22u%22%7D/what_d.Malaga/type.2/page.13/cookieid.1020120669817db736040.87652415/pos.5/;29604, Málaga, Provincia de Málaga;5  habitaciones;4  baños;270  m²;Villa. Chalet, El Rosario, Costa del Sol. 5 Dormitorios, 4 Baños, Construidos 270 m², Terraza 100 m², Jardin/Terreno 1071 m². Posición: Cerca de...;Hace 2 días;Rentola;Malaga
4.200€;Ático;https://rd.clk.thribee.com/id.N81pG1m-1x1G/origin.1/section.97/section_type.1/country.es/vertical.homes/iuid.20622trovit-web-85d48c649-xtbf2669817db7396a/tracking.%7B%22cmp%22%3A%22u%22%7D/what_d.Malaga/type.2/page.13/cookieid.1020120669817db736040.87652415/pos.6/;29400, Provincia de Málaga;3  habitaciones;3  baños;187  m²;Exclusivo Ático Dúplex de Lujo de 3 Plantas en La Quinta Hills. Benahavis Lujosa comunidad residencial: Ubicado en el corazón del distrito de La...;Hace 2 días;Rentola;Malaga
11.949€;Apartment in Puerto Banús, Costa del Sol;https://rd.clk.thribee.com/id.1g1e1jK1C1vV1r/origin.1/section.97/section_type.1/country.es/vertical.homes/iuid.20622trovit-web-85d48c649-xtbf2669817db7396a/tracking.%7B%22cmp%22%3A%22u%22%7D/what_d.Malaga/type.2/page.13/cookieid.1020120669817db736040.87652415/pos.7/;29660,;4  habitaciones;4  baños;200  m²;Ideal location for this 4 bed duplex penthouse property located in the heart of the famous puerto banús, surrounded by shops, bars and restaurant...;Hace 2 días;Rentola;Malaga
1.400€;Casa adosada en Marbella, Nagüeles, alquiler;https://rd.clk.thribee.com/id.LGD1or1t1o13/origin.1/section.97/section_type.1/country.es/vertical.homes/iuid.20622trovit-web-85d48c649-xtbf2669817db7396a/tracking.%7B%22cmp%22%3A%22u%22%7D/what_d.Malaga/type.2/page.13/cookieid.1020120669817db736040.87652415/pos.8/;29601, Marbella, Provincia de Málaga;3  habitaciones;3  baños;160  m²;Adosada en Nagueles muy bien comunicada con autovía y con nacional 340, situada en urbanización cerrada y habitada todo el año, con 4 piscinas y...;Hace 2 días;Rentola;Malaga
5.952€;Apartment in Marbella, Costa del Sol;https://rd.clk.thribee.com/id.191Z1R1zLZ61O/origin.1/section.97/section_type.1/country.es/vertical.homes/iuid.20622trovit-web-85d48c649-xtbf2669817db7396a/tracking.%7B%22cmp%22%3A%22u%22%7D/what_d.Malaga/type.2/page.13/cookieid.1020120669817db736040.87652415/pos.9/;29670, Marbella, Provincia de Málaga;3  habitaciones;2  baños;127  m²;A family friendly apartment perfect for a family of six who want to stay right next to the beach, close to restaurants, and san pedro centre. It...;Hace 2 días;Rentola;Malaga
3.534€;Spacious and bright 1-bedroom apartment in the center of Malaga;https://rd.clk.thribee.com/id.R1M1kzihYz/origin.1/section.97/section_type.1/country.es/vertical.homes/iuid.20622trovit-web-85d48c649-xtbf2669817db7396a/tracking.%7B%22cmp%22%3A%22u%22%7D/what_d.Malaga/type.2/page.13/cookieid.1020120669817db736040.87652415/pos.10/;29008, Provincia de Málaga;2  habitaciones;1  baños;65  m²;...forms the cord that surrounds the historic center of Malaga and the pedestrian area, so the apartment is located in the heart of the city...;Hace 2 días;Rentola;Malaga
2.647€;Málaga 29012 1ES76167-;https://rd.clk.thribee.com/id.51GkHow31J/origin.1/section.97/section_type.1/country.es/vertical.homes/iuid.20622trovit-web-85d48c649-xtbf2669817db7396a/tracking.%7B%22cmp%22%3A%22u%22%7D/what_d.Malaga/type.2/page.13/cookieid.1020120669817db736040.87652415/pos.11/;29012, Málaga, Provincia de Málaga;-;-;-;...Esta casa se encuentra en Málaga Málaga 29012. Tiene 0 dormitorio. Esta 0 dormitorio apartamentos en Málaga Málaga es para alquilar por 2647...;Hace 2 días;Listanza;Malaga
5.757€;Apartment in Estepona, Costa del Sol;https://rd.clk.thribee.com/id.1px1m61bCe_/origin.1/section.97/section_type.1/country.es/vertical.homes/iuid.20622trovit-web-85d48c649-xtbf2669817db7396a/tracking.%7B%22cmp%22%3A%22u%22%7D/what_d.Malaga/type.2/page.13/cookieid.1020120669817db736040.87652415/pos.12/;29689, Estepona, Provincia de Málaga;2  habitaciones;2  baños;120  m²;...malaga with the picasso museum and alcazaba, cordoba with the mosque and colourful center. In short, an ideal base for exploration and...;Hace 3 días;Rentola;Malaga
1.250€;Corredor del Henares, Alcalá de Henares Vivienda 2 Habitaciones Capital Lpa;https://rd.clk.thribee.com/id.R1CqQ1J1DJO/origin.1/section.97/section_type.1/country.es/vertical.homes/iuid.20622trovit-web-85d48c649-xtbf2669817db7396a/tracking.%7B%22cmp%22%3A%22u%22%7D/what_d.Malaga/type.2/page.13/cookieid.1020120669817db736040.87652415/pos.13/;28003, Comunidad de Madrid;2  habitaciones;1  baños;61  m²;...y sus prórrogas, un único pago). Honorarios por gestión y formalización del contrato a cargo del arrendador. Descripción vivienda: calle málaga...;Hace 3 días;Rentola;Malaga
1.800€;Apartment in Costalita, Costa del Sol;https://rd.clk.thribee.com/id.1vU1VB17i181C/origin.1/section.97/section_type.1/country.es/vertical.homes/iuid.20622trovit-web-85d48c649-xtbf2669817db7396a/tracking.%7B%22cmp%22%3A%22u%22%7D/what_d.Malaga/type.2/page.13/cookieid.1020120669817db736040.87652415/pos.14/;29688, Costalita, Estepona, Provincia de Málaga;3  habitaciones;3  baños;135  m²;Middle floor apartment, costalita, costa del sol. 3 bedrooms, 3 bathrooms, built 130 m², terrace 20 m². Setting: beachside, close to golf, close...;Hace 3 días;Rentola;Malaga
1.300€;Middle Floor Apartment in Nueva Andalucía;https://rd.clk.thribee.com/id.1218Uvtp1S9/origin.1/section.97/section_type.1/country.es/vertical.homes/iuid.20622trovit-web-85d48c649-xtbf2669817db7396a/tracking.%7B%22cmp%22%3A%22u%22%7D/what_d.Malaga/type.2/page.13/cookieid.1020120669817db736040.87652415/pos.15/;29660, Marbella, Provincia de Málaga;2  habitaciones;2  baños;125  m²;...and restaurants. The closest beach is 6 min. (3.5 km) from Puerto Banus, 12 min. (9.3 km) from the center of Marbella and 45 min. From Malaga...;Hace 3 días;Rentola;Malaga
8.000€;Exclusiva Villa en alquiler Marbella, España;https://rd.clk.thribee.com/id.1QX1nm1l1R1Y1m/origin.1/section.97/section_type.1/country.es/vertical.homes/iuid.20622trovit-web-85d48c649-xtbf2669817db7396a/tracking.%7B%22cmp%22%3A%22u%22%7D/what_d.Malaga/type.2/page.13/cookieid.1020120669817db736040.87652415/pos.16/;29604, Marbella, Provincia de Málaga;6  habitaciones;6  baños;814  m²;Hermosa villa para alquiler corta temporada en primera linea de golf en Los Flamingos, Benahavis Villa Sofia: Increíble villa ubicada en, se podr...;Hace 3 días;LuxuryEstate;Malaga
1.640€;Calle Camilo José Cela, Marbella - Amsterdam Apartments for Rent;https://rd.clk.thribee.com/id.C1d1P1kA1r1u14/origin.1/section.97/section_type.1/country.es/vertical.homes/iuid.20622trovit-web-85d48c649-xtbf2669817db7396a/tracking.%7B%22cmp%22%3A%22u%22%7D/what_d.Malaga/type.2/page.13/cookieid.1020120669817db736040.87652415/pos.17/;29602, Marbella, Provincia de Málaga;1  habitaciones;-;484  m²;Luxurious beachfront apartment, Marbella (Available From) This modern and renovated apartment is fully furnished for your stay, including a fully...;Hace 3 días;Rentola;Malaga
8.000€;Villa / Chalet de 814 m2 en alquiler en Benahavís, Andalucía;https://rd.clk.thribee.com/id.S1Moc1s91XQ/origin.1/section.97/section_type.1/country.es/vertical.homes/iuid.20622trovit-web-85d48c649-xtbf2669817db7396a/tracking.%7B%22cmp%22%3A%22u%22%7D/what_d.Malaga/type.2/page.13/cookieid.1020120669817db736040.87652415/pos.18/;29660, Benahavís, Provincia de Málaga;6  habitaciones;6  baños;814  m²;Hermosa villa para alquiler corta temporada en primera linea de golf en Los Flamingos, Benahavis Villa Sofia: Increíble villa ubicada en, se podr...;Hace 3 días;LuxuryEstate;Malaga
11.254€;House in The Golden Mile, Costa del Sol;https://rd.clk.thribee.com/id.u2L1Zw3Vn/origin.1/section.97/section_type.1/country.es/vertical.homes/iuid.20622trovit-web-85d48c649-xtbf2669817db7396a/tracking.%7B%22cmp%22%3A%22u%22%7D/what_d.Malaga/type.2/page.13/cookieid.1020120669817db736040.87652415/pos.19/;;4  habitaciones;3  baños;165  m²;Great 4 bedroom townhouse on the golden mile 5 minute walk to the beach, plunge pool on the terrace and two underground parking spaces...;Hace 3 días;Rentola;Malaga
3.700€;3.700 Apartment for rent in La Trinidad, Marbella Golden Mile | Panorama;https://rd.clk.thribee.com/id.d1y1s1I1x1MN1l/origin.1/section.97/section_type.1/country.es/vertical.homes/iuid.20622trovit-web-85d48c649-xtbf2669817db7396a/tracking.%7B%22cmp%22%3A%22u%22%7D/what_d.Malaga/type.2/page.13/cookieid.1020120669817db736040.87652415/pos.20/;29660, Marbella, Provincia de Málaga;2  habitaciones;2  baños;169  m²;A immaculate first floor, southwest facing apartment in this luxurious development on the Golden Mile, and only a short distance to the beach and...;Hace 3 días;Rentola;Malaga
10.428€;Apartment in Marbella, Costa del Sol;https://rd.clk.thribee.com/id.g141S19HK1U15/origin.1/section.97/section_type.1/country.es/vertical.homes/iuid.20622trovit-web-85d48c649-xtbf2669817db7396a/tracking.%7B%22cmp%22%3A%22u%22%7D/what_d.Malaga/type.2/page.13/cookieid.1020120669817db736040.87652415/pos.21/;29670, Marbella, Provincia de Málaga;3  habitaciones;2  baños;155  m²;Frontline beach 3 bedroom 2 bath apartment on the golden mile close to town and steps away from restaurants shops and amenities...;Hace 3 días;Rentola;Malaga
3.000€;Apartamento Planta Media;https://rd.clk.thribee.com/id.1B1dt1T1N1WU0/origin.1/section.97/section_type.1/country.es/vertical.homes/iuid.20622trovit-web-85d48c649-xtbf2669817db7396a/tracking.%7B%22cmp%22%3A%22u%22%7D/what_d.Malaga/type.2/page.13/cookieid.1020120669817db736040.87652415/pos.22/;29660, Provincia de Málaga;2  habitaciones;2  baños;200  m²;Esta es una propiedad única e impresionante en el moderno complejo de La Corniche en el corazón del valle del golf de Nueva Andalucía. La propied...;Hace 3 días;Rentola;Malaga
14.534€;House in Marbella, Costa del Sol;https://rd.clk.thribee.com/id.RnzYJ1n1Q1-/origin.1/section.97/section_type.1/country.es/vertical.homes/iuid.20622trovit-web-85d48c649-xtbf2669817db7396a/tracking.%7B%22cmp%22%3A%22u%22%7D/what_d.Malaga/type.2/page.13/cookieid.1020120669817db736040.87652415/pos.23/;29640, Marbella, Provincia de Málaga;5  habitaciones;4  baños;252  m²;This luxury holiday villa with sea views really does have everything you need for the perfect family holiday. The villa has a private fenced pool...;Hace 3 días;Rentola;Malaga
1.000€;Piso en alquiler en Málaga, El Candado;https://rd.clk.thribee.com/id.151y411mB1J/origin.1/section.97/section_type.1/country.es/vertical.homes/iuid.20622trovit-web-85d48c649-xtbf2669817db7396a/tracking.%7B%22cmp%22%3A%22u%22%7D/what_d.Malaga/type.2/page.13/cookieid.1020120669817db736040.87652415/pos.24/;29018, El Candado, Este, Málaga, Provincia de Málaga;2  habitaciones;2  baños;80  m²;Una de las terrazas esta acristalada. Uno de los dormitorios es pequeño. Vistas despejadas. Hay paking de moto...;Hace 3 días;Todopisos;Malaga
750€;Piso en alquiler en Málaga;https://rd.clk.thribee.com/id.15w13t51T1F1k/origin.1/section.97/section_type.1/country.es/vertical.homes/iuid.20622trovit-web-85d48c649-xtbf2669817db7396a/tracking.%7B%22cmp%22%3A%22u%22%7D/what_d.Malaga/type.2/page.13/cookieid.1020120669817db736040.87652415/pos.25/;29591, Málaga, Provincia de Málaga;2  habitaciones;2  baños;100  m²;Se alquila piso en la zona de Pinosol (Camino Nuevo). Consta de tres habitaciones, pero una está cerrada por uso de la propietaria. Distribuido e...;Hace 3 días;Todopisos;Malaga
950€;Th1215 - Townhouse In Cómpeta;https://rd.clk.thribee.com/id.1g15f41M1P1AK/origin.1/section.97/section_type.1/country.es/vertical.homes/iuid.61798trovit-web-85d48c649-kk2s8669817dedc0f5/tracking.%7B%22cmp%22%3A%22u%22%7D/what_d.Malaga/type.2/page.18/cookieid.1020111669817dedbbb06.20184035/pos.1/;29754,;2  habitaciones;2  baños;110  m²;...Málaga is well worth an excursion and the famous city of Granada is also within an easy drive. The perfect holiday destination in this...;Hace 4 días;Rentola;Malaga
12.000€;4 dormitorio, Marbella 1ES79017-;https://rd.clk.thribee.com/id.QW1q1B1W1Y1X1r/origin.1/section.232/section_type.2/country.es/vertical.homes/iuid.61798trovit-web-85d48c649-kk2s8669817dedc0f5/tracking.%7B%22cmp%22%3A%22u%22%7D/what_d.Malaga/type.2/page.18/cookieid.1020111669817dedbbb06.20184035/pos.1/;Marbella, Provincia de Málaga;4 habitaciones;3 baños;-;TRV79017---. Esta casa se encuentra en Marbella Marbella. Tiene 4 dormitorios, 3 baños. Esta 4 dormitorio Villa en Marbella Marbella es para alqu...;Hace 1 día;Listanza;Malaga
1.400€;Benalmádena 29630 1ES74504-;https://rd.clk.thribee.com/id.W1Cer1VNL13/origin.1/section.232/section_type.2/country.es/vertical.homes/iuid.61798trovit-web-85d48c649-kk2s8669817dedc0f5/tracking.%7B%22cmp%22%3A%22u%22%7D/what_d.Malaga/type.2/page.18/cookieid.1020111669817dedbbb06.20184035/pos.2/;29630, Benalmádena, Provincia de Málaga;-;-;-;TRV74504---. Esta casa se encuentra en Benalmádena Benalmádena 29630. Tiene 0 dormitorio. Esta 0 dormitorio apartamentos en Benalmádena Benalmáde...;Hace 1 día;Listanza;Malaga
1.900€;Middle Floor Apartment in Torre Real;https://rd.clk.thribee.com/id.1K1PV1kB81Sw/origin.1/section.97/section_type.1/country.es/vertical.homes/iuid.61798trovit-web-85d48c649-kk2s8669817dedc0f5/tracking.%7B%22cmp%22%3A%22u%22%7D/what_d.Malaga/type.2/page.18/cookieid.1020111669817dedbbb06.20184035/pos.2/;29600, Marbella, Provincia de Málaga;2  habitaciones;2  baños;110  m²;Available only from sept 1st 2024 to june 2025. Located in a wonderful location just a 5 minutes walk from the sandy Trocadero beach, and surroun...;Hace 4 días;Rentola;Malaga
1.340€;Appealing 3-bedroom apartment in Torrox Costa;https://rd.clk.thribee.com/id.8N1x7dAT11/origin.1/section.97/section_type.1/country.es/vertical.homes/iuid.61798trovit-web-85d48c649-kk2s8669817dedc0f5/tracking.%7B%22cmp%22%3A%22u%22%7D/what_d.Malaga/type.2/page.18/cookieid.1020111669817dedbbb06.20184035/pos.3/;29793, Provincia de Málaga;3  habitaciones;2  baños;-;...Malaga (30 minutes away). Granada (one hour and a quarter) where you can visit the magical Alhambra, an Arab palatine city. More information...;Hace 4 días;Rentola;Malaga
13.000€;Semi-Detached House in The Golden Mile;https://rd.clk.thribee.com/id.1cTPD131H1Rx/origin.1/section.97/section_type.1/country.es/vertical.homes/iuid.61798trovit-web-85d48c649-kk2s8669817dedc0f5/tracking.%7B%22cmp%22%3A%22u%22%7D/what_d.Malaga/type.2/page.18/cookieid.1020111669817dedbbb06.20184035/pos.4/;Comunidad de Madrid;5  habitaciones;5  baños;800  m²;Situated in the prestigious Meisho Hills of Marbella Golden Mile, Marbella, Malaga, this luxury semi-detached house epitomises elegant living...;Hace 4 días;Rentola;Malaga
400€;Bright double bedroom in Torremolinos;https://rd.clk.thribee.com/id.iGI1Z1h1K1Fw/origin.1/section.97/section_type.1/country.es/vertical.homes/iuid.61798trovit-web-85d48c649-kk2s8669817dedc0f5/tracking.%7B%22cmp%22%3A%22u%22%7D/what_d.Malaga/type.2/page.18/cookieid.1020111669817dedbbb06.20184035/pos.5/;29620, Provincia de Málaga;4  habitaciones;1  baños;-;Located in the sunny city of Torremolinos, this stunning apartment is the perfect place to call home. Boasting four spacious bedrooms and one ful...;Hace 4 días;Rentola;Malaga
3.000€;Penthouse For Rent in San Pedro De Alcántara, Marbella;https://rd.clk.thribee.com/id.1K1t131Qy161wQ/origin.1/section.97/section_type.1/country.es/vertical.homes/iuid.61798trovit-web-85d48c649-kk2s8669817dedc0f5/tracking.%7B%22cmp%22%3A%22u%22%7D/what_d.Malaga/type.2/page.18/cookieid.1020111669817dedbbb06.20184035/pos.6/;29601, Marbella, Provincia de Málaga;3  habitaciones;3  baños;188  m²;Amazing 3 bedroom 3 bath duplex penthouse in an very upscale ara in Marbella walking distance to the seacomes with two large garage spacesand sto...;Hace 4 días;Rentola;Malaga
275€;Single bedroom in a 4-bedroom apartment 15' walking from Campus Universitario;https://rd.clk.thribee.com/id.191H1d1Sxuyr/origin.1/section.97/section_type.1/country.es/vertical.homes/iuid.61798trovit-web-85d48c649-kk2s8669817dedc0f5/tracking.%7B%22cmp%22%3A%22u%22%7D/what_d.Malaga/type.2/page.18/cookieid.1020111669817dedbbb06.20184035/pos.7/;29010, Provincia de Málaga;4  habitaciones;1  baños;-;Are you planning to come to Malaga to take your studies, but can't find a place to share with other serious students? If so, take a look at...;Hace 4 días;Rentola;Malaga
1.196€;Nodis Malaga;https://rd.clk.thribee.com/id.1v1R1kl1u1sv2/origin.1/section.97/section_type.1/country.es/vertical.homes/iuid.61798trovit-web-85d48c649-kk2s8669817dedc0f5/tracking.%7B%22cmp%22%3A%22u%22%7D/what_d.Malaga/type.2/page.18/cookieid.1020111669817dedbbb06.20184035/pos.8/;29010, Provincia de Málaga;3  habitaciones;2  baños;-;...en Málaga, con 3 dormitorios y 2 baños. Este inmueble, con un precio de 1194 €, es la opción ideal para alquileres de larga duración en Málaga...;Hace 4 días;Rentola;Malaga
1.400€;Flat - Málaga (Finca El Pato-Torre del Rio), Built Surface 80m;https://rd.clk.thribee.com/id.1Uoa1C1MT1b15/origin.1/section.97/section_type.1/country.es/vertical.homes/iuid.61798trovit-web-85d48c649-kk2s8669817dedc0f5/tracking.%7B%22cmp%22%3A%22u%22%7D/what_d.Malaga/type.2/page.18/cookieid.1020111669817dedbbb06.20184035/pos.9/;29005, Finca El Pato, Carretera de Cádiz, Málaga, Provincia de Málaga;2  habitaciones;1  baños;75  m²;Flat. málaga (finca el pato-torre del rio), built surface 80m 2, terrace size 8m 2, 2 bedrooms, 1 bathrooms, lift, pool...;Hace 4 días;Rentola;Malaga
24.985€;Apartment in Puerto Banús, Costa del Sol;https://rd.clk.thribee.com/id.7-G1SKexc/origin.1/section.97/section_type.1/country.es/vertical.homes/iuid.61798trovit-web-85d48c649-kk2s8669817dedc0f5/tracking.%7B%22cmp%22%3A%22u%22%7D/what_d.Malaga/type.2/page.18/cookieid.1020111669817dedbbb06.20184035/pos.10/;29660,;2  habitaciones;2  baños;190  m²;Unique and rare to the market, magnificent beachfront private apartment enjoying sea views located within the confines of the one of marbella's b...;Hace 4 días;Rentola;Malaga
18.467€;Apartment in Puerto Banús, Costa del Sol;https://rd.clk.thribee.com/id.b1xsa1R101s3/origin.1/section.97/section_type.1/country.es/vertical.homes/iuid.61798trovit-web-85d48c649-kk2s8669817dedc0f5/tracking.%7B%22cmp%22%3A%22u%22%7D/what_d.Malaga/type.2/page.18/cookieid.1020111669817dedbbb06.20184035/pos.11/;29660,;2  habitaciones;2  baños;160  m²;Experience this unparalleled beachfront accommodation in this exquisite 2-bedroom en-suite apartment, located within the luxury beachfront comple...;Hace 4 días;Rentola;Malaga
450€;Beautiful single bedroom in Cortijo Alto;https://rd.clk.thribee.com/id.EO1Wm1-g1Os/origin.1/section.97/section_type.1/country.es/vertical.homes/iuid.61798trovit-web-85d48c649-kk2s8669817dedc0f5/tracking.%7B%22cmp%22%3A%22u%22%7D/what_d.Malaga/type.2/page.18/cookieid.1020111669817dedbbb06.20184035/pos.12/;29006, Provincia de Málaga;4  habitaciones;2  baños;-;Rooms for rent in sunny Málaga! Carrefour and bus stop next to the building. Easy parking in the area. Centre: 30 minute walk, 10 minutes by...;Hace 4 días;Rentola;Malaga
1.800€;Middle Floor Apartment in Río Real;https://rd.clk.thribee.com/id.ml1q1tZ1ui1C/origin.1/section.97/section_type.1/country.es/vertical.homes/iuid.61798trovit-web-85d48c649-kk2s8669817dedc0f5/tracking.%7B%22cmp%22%3A%22u%22%7D/what_d.Malaga/type.2/page.18/cookieid.1020111669817dedbbb06.20184035/pos.13/;29600, Marbella, Provincia de Málaga;2  habitaciones;2  baños;90  m²;...Malaga airport. With the luxury of having an exclusive and residential area, but with all the necessary amenities at hand: La Cañada shopping...;Hace 4 días;Rentola;Malaga
10.428€;House in Estepona, Costa del Sol;https://rd.clk.thribee.com/id.Fw1W1pf1tO1G/origin.1/section.97/section_type.1/country.es/vertical.homes/iuid.61798trovit-web-85d48c649-kk2s8669817dedc0f5/tracking.%7B%22cmp%22%3A%22u%22%7D/what_d.Malaga/type.2/page.18/cookieid.1020111669817dedbbb06.20184035/pos.14/;29689, Estepona, Provincia de Málaga;3  habitaciones;2  baños;121  m²;Villa murray is a captivating holiday retreat nestled between puerto banus and estepona, perfectly positioned to provide an enchanting experience...;Hace 4 días;Rentola;Malaga
425€;Calle Natalia Habitación 3;https://rd.clk.thribee.com/id.1iR1K1K161Z1Tf/origin.1/section.97/section_type.1/country.es/vertical.homes/iuid.61798trovit-web-85d48c649-kk2s8669817dedc0f5/tracking.%7B%22cmp%22%3A%22u%22%7D/what_d.Malaga/type.2/page.18/cookieid.1020111669817dedbbb06.20184035/pos.15/;29009, Provincia de Málaga;1  habitaciones;2  baños;90  m²;Room in Calle Natalia Available from: Book now: Min. Stay: 3 Max. Stay: 18 Deposit: 425 Contract opening costs: 200€ [ENG] How does Som work? Som...;Hace 4 días;Rentola;Malaga
39.107€;House in Benahavís, Costa del Sol;https://rd.clk.thribee.com/id.2M1HG1An1zv/origin.1/section.97/section_type.1/country.es/vertical.homes/iuid.61798trovit-web-85d48c649-kk2s8669817dedc0f5/tracking.%7B%22cmp%22%3A%22u%22%7D/what_d.Malaga/type.2/page.18/cookieid.1020111669817dedbbb06.20184035/pos.16/;29679, Benahavís, Provincia de Málaga;5  habitaciones;8  baños;726  m²;Brand new 5 bedroom luxury holiday rental villa built to the highest specification, nestled in an idyllic private position, surrounded by native...;Hace 4 días;Rentola;Malaga
2.200€;Vivienda exclusiva en alquiler Alhaurín de la Torre, España;https://rd.clk.thribee.com/id.1bG1W1CDRDv/origin.1/section.97/section_type.1/country.es/vertical.homes/iuid.61798trovit-web-85d48c649-kk2s8669817dedc0f5/tracking.%7B%22cmp%22%3A%22u%22%7D/what_d.Malaga/type.2/page.18/cookieid.1020111669817dedbbb06.20184035/pos.17/;29130, Alhaurín de la Torre, Provincia de Málaga;-;2  baños;-;Esta casa adosada de estilo moderno se encuentra a solo 12 km de la playa y a 20 km de Málaga capital. En la planta baja, se encuentra una...;Hace 4 días;LuxuryEstate;Malaga
