precio;sub_descr;href;ubicacion;habitaciones;banios;mt2;otros;latitude;longitude;planta;CCAA
417.000 竄ｬ;Piso en Avenida del Golf,  s/n;/comprar/piso-san_roque_la_alcaidesa-4258859679_109700/;La Alcaidesa (San Roque);3 habs.;2 baﾃｱos;166 mﾂｲ;Piso en una finca de obra nueva de 166 m2 de superficie construida y emplazado en la zona de San Roque. Estﾃ｡ dispuesto en 3 habitaciones, 2 baﾃｱos completos y terraza. Cuenta como extras ascensor, 2 garajes.;36,246936213;-5,326727537;;cadiz
300.000 竄ｬ;Casa en Playa Tres Piedras;/comprar/casa-playa_de_las_tres_piedras_costa_ballena-40015671061_100500/;Playa de las Tres Piedras-Costa Ballena (Chipiona);4 habs.;3 baﾃｱos;200 mﾂｲ;Od1073. Para los amantes de la buena vida tenemos esta vivienda de una planta en la zona de las tres piedras. La casa dispone de c...;36.707839633;-6.424095142;;cadiz
159.640 竄ｬ;Piso en calle Calzada de La Infanta,  22;/comprar/piso-centro_calzada-4598218376_109700/;Centro-Calzada (Sanlﾃｺcar de Barrameda);2 habs.;1 baﾃｱo;75 mﾂｲ;Vivienda 6. Piso en un inmueble de obra nueva de 75 mﾂｲ de superficie construida y situado en la zona de sanlﾃｺcar de barrameda, aco...;36.7794;-6.35905;1ﾂｪ planta;cadiz
260.000 竄ｬ;Casa adosada en calle Antonio Ulloa;/comprar/casa_adosada-hornos_punicos-41676075227_100500/;Hornos Pﾃｺnicos (San Fernando);4 habs.;2 baﾃｱos;180 mﾂｲ;"Ocasion - precio rebajado

Inmonline cadiz - real estate presenta en exclusiva esta espectacular vivienda pareada en una de las me...";36.4644275;-6.2068112;;cadiz
360.000 竄ｬ;Chalet en Fuente Amarga;/comprar/chalet-mogarizas_las_rapaces-26698548730_100500/;Mogarizas-Las Rapaces (Chiclana de la Frontera);4 habs.;3 baﾃｱos;380 mﾂｲ;"Chalet con casa de invitados,  en parcela segregada de 3.600 metros, con piscina  a 2 km de chiclana 
 Busca un chalet donde vivir...";36.401726337;-6.146563267;;cadiz
222.000 竄ｬ;Piso en Centro;/comprar/piso-jerez_de_la_frontera_centro11403-40858772161_100500/;Centro (Jerez de la Frontera);3 habs.;2 baﾃｱos;160 mﾂｲ;"Precioso piso en primera planta completamente reformado con 160 mﾂｲ construidos

Se vende precioso piso en todo el corazﾃｳn de jerez...";36.6826667;-6.1373757;Bajo;cadiz
290.000 竄ｬ;Casa adosada en Centro;/comprar/casa_adosada-algeciras_centro11201-41750348112_100500/;Centro (Algeciras);5 habs.;2 baﾃｱos;260 mﾂｲ;"Casa cﾃｩntrica renovada con estilo inigualable, 

Descubra la elegancia contemporﾃ｡nea en el corazﾃｳn de algeciras, con esta magnﾃｭfic...";36.1301919;-5.4473025;;cadiz
128.900 竄ｬ;Dﾃｺplex en Centro;/comprar/duplex-jerez_de_la_frontera_centro11404-40096200703_100500/;Centro (Jerez de la Frontera);2 habs.;2 baﾃｱos;74 mﾂｲ;Maravilloso dﾃｺplex  situado en el corazﾃｳn de jerez, rodeado de la zona monumental y cultural de la ciudad. La vivienda se accede p...;36.686872;-6.1457581;Bajo;cadiz
187.000 竄ｬ;Piso en Centro;/comprar/piso-jerez_de_la_frontera_centro11403-34183078829_100500/;Centro (Jerez de la Frontera);3 habs.;2 baﾃｱos;170 mﾂｲ;Se vende fantﾃ｡stico piso en pleno centro de jerez de la frontera, piso en segunda planta sin ascensor, aunque hay posibilidad de i...;36.681077;-6.1378673;2ﾂｪ planta;cadiz
123.500 竄ｬ;Casa adosada en calle del Doctor Fleming;/comprar/casa_adosada-benalup_casas_viejas_centro_urbano-44191940203_528308/;Benalup-Casas Viejas;3 habs.;2 baﾃｱos;177 mﾂｲ;"**magnﾃｭfico adosado equipado y amueblado en benalup-casas viejas**

ﾂ｡Listo para entrar a vivir! Este espectacular adosado se encue...";36.3443636;-5.8170554;;cadiz
275.000 竄ｬ;Casa adosada en calle Mar Adriﾃ｡tico, 5;/comprar/casa_adosada-costa_de_sancti_petri_playa_de_la_barrosa11139-42519305028_100500/;Costa de Sancti Petri-Playa de La Barrosa (Chiclana de la Frontera);2 habs.;2 baﾃｱos;60 mﾂｲ;Descubre este hermoso adosado, recientemente renovado, ubicado en la prestigiosa urbanizaciﾃｳn doﾃｱa violeta. Perfecto como segunda ...;36.3787;-6.18308;;cadiz
270.000 竄ｬ;ﾃ》ico en La Laguna;/comprar/atico-chipiona_la_laguna-30898721916_100500/;La Laguna (Chipiona);2 habs.;1 baﾃｱo;120 mﾂｲ;A00671 ﾃ｡tico en la zona de la laguna  a 400m de la playa. Dispone de 2 dormitorios amplios, uno de ellos con armario empotrado y e...;36.7200591;-6.4336742;;cadiz
120.000 竄ｬ;Casa en Barbate;/comprar/casa-barbate_centro_urbano-39255061418_106700/;Barbate;3 habs.;1 baﾃｱo;105 mﾂｲ;"Casa independiente a tan solo 3 minutos de la playa del carmen . 
La planta baja esta formada por cocina , salﾃｳn , baﾃｱo y 2 habita...";36.1892782;-5.9180384;;cadiz
135.000 竄ｬ;Casa en Avenida de Fﾃｩlix Rodrﾃｭguez de la Fuente;/comprar/casa-centro_zona_noreste-43385459952_100500/;Centro-Zona Noreste (Chipiona);2 habs.;;78 mﾂｲ;Independiente! Esplﾃｩndido dﾃｺplex totalmente independiente con muy buenas calidades de construcciﾃｳn asﾃｭ como alicatados, escalera d...;36.7344535;-6.4293128;;cadiz
174.900 竄ｬ;Piso en La Milagrosa;/comprar/piso-este11406-38390327882_100500/;Este (Jerez de la Frontera);2 habs.;1 baﾃｱo;74 mﾂｲ;"Os presentamos una vivienda en la zona este de jerez con un patio increﾃｭble!
Fantﾃ｡stica vivienda de dos dormitorios en una urbaniz...";36.68365;-6.0989768;Bajo;cadiz
270.000 竄ｬ;ﾃ》ico en Centro;/comprar/atico-el_mentidero_teatro_falla_alameda11003-43352040028_100500/;El Mentidero-Teatro Falla-Alameda (Cﾃ｡diz Capital);2 habs.;1 baﾃｱo;121 mﾂｲ;"Inmonline cadiz - real estate presenta este fantﾃ｡stico ﾃ｡tico con vistas despejadas a la plaza de san antonio.

Se trata de una cua...";36.5343844;-6.2991001;;cadiz
775.000 竄ｬ;Dﾃｺplex en calle de la Sierra del Retﾃｭn,  s/n;/comprar/duplex-zahara_de_los_atunes-4561849967_109700/;Zahara de los Atunes (Barbate);3 habs.;3 baﾃｱos;158 mﾂｲ;Dﾃｺplex bajo en un edificio de obra nueva de 158 mﾂｲ de superficie construida y ubicado en la zona de zaragoza capital, enclavado en...;36.1354248;-5.8412992;Bajo;cadiz
165.000 竄ｬ;Casa adosada en calle del Nogal;/comprar/casa_adosada-centro_zona_noreste-43338906329_100500/;Centro-Zona Noreste (Chipiona);2 habs.;2 baﾃｱos;68 mﾂｲ;Precioso adosado totalmente reformada con primeras calidades, en la zona mﾃ｡s comercial de chipiona, junto a la avda. De madrid y a...;36.732884718;-6.431810395;;cadiz
180.000 竄ｬ;Casa en Centro;/comprar/casa-puerto_real_centro_urbano-37534040120_100500/;Puerto Real;3 habs.;2 baﾃｱos;140 mﾂｲ;Casa en el centro en planta baja, con tres dormitorios , salﾃｳn , baﾃｱo completo , cocina equipada y aseo, patio central con montera...;36.527758834;-6.191095945;;cadiz
139.990 竄ｬ;Casa rﾃｺstica en Pago del Humo-Polﾃｭgono de Pelagatos;/comprar/casa_rustica-pago_del_humo_poligono_de_pelagatos-44212877969_100200/;Pago del Humo-Polﾃｭgono de Pelagatos (Chiclana de la Frontera);3 habs.;;110 mﾂｲ;Vivienda tipo chalet situado en la zona del pago del humo (zona venta la raya), con una ubicaciﾃｳn muy cercana a servicios esencial...;36.380370194;-6.074857109;;cadiz
85.000 竄ｬ;Piso en Centro;/comprar/piso-jerez_de_la_frontera_centro11402-35039587275_100500/;Centro (Jerez de la Frontera);1 hab.;1 baﾃｱo;37 mﾂｲ;Se vende precioso apartamento en el centro de jerez, totalmente reformado y amueblado. Ubicados en una elegante casa, no ofrece 37...;36.6852283;-6.1350409;Bajo;cadiz
135.000 竄ｬ;Piso en Centro;/comprar/piso-centro_zona_noreste-43417669418_100500/;Centro-Zona Noreste (Chipiona);1 hab.;1 baﾃｱo;38 mﾂｲ;Od819. ﾂ｡Descubre tu nuevo hogar! Te presentamos este acogedor apartamento en planta baja, ideal para quienes buscan comodidad, acc...;36.7355907;-6.4313129;Bajo;cadiz
242.000 竄ｬ;Piso en Cruz del Mar;/comprar/piso-centro_zona_playas-43352738349_100500/;Centro-Zona Playas (Chipiona);3 habs.;2 baﾃｱos;105 mﾂｲ;Si os gusta el mar y no la arena de la playa , si os gustan las vistas despejadas , si os gustan los atardeceres y las puestas de ...;36.741717854;-6.435752723;2ﾂｪ planta;cadiz
220.000 竄ｬ;Chalet en El Chaparral;/comprar/chalet-mogarizas_las_rapaces-40073968459_100500/;Mogarizas-Las Rapaces (Chiclana de la Frontera);3 habs.;1 baﾃｱo;160 mﾂｲ;"Chalet con piscina en parcela segregada  de 4.471 metros

Chalet  de 120 mﾂｲ aprox, en parcela segregada de 4471 mﾂｲ aprox, distribu...";36.3832;-6.1398;;cadiz
380.000 竄ｬ;Piso en Centro Histﾃｳrico;/comprar/piso-cadiz_capital_centro_historico11001-35048926099_100500/;Centro Histﾃｳrico (Cﾃ｡diz Capital);5 habs.;2 baﾃｱos;210 mﾂｲ;ﾂ｡En el corazﾃｳn del casco histﾃｳrico de cﾃ｡diz, se encuentra este magnﾃｭfico piso en venta! Ocupando toda la primera planta de la finc...;36.5328459;-6.2970397;1ﾂｪ planta;cadiz
159.900 竄ｬ;Piso en calle General Florencio Montojo;/comprar/piso-la_pastora_zona_de_la_estacion11100-43394241781_100500/;La Pastora-Zona de la Estaciﾃｳn (San Fernando);3 habs.;1 baﾃｱo;98 mﾂｲ;ﾂ｡Atenciﾃｳn amantes del confort y la accesibilidad en san fernando! 沛｡笨ｨ esta joya inmobiliaria acaba de aterrizar en el mercado y ﾂ｡N...;36.4709424;-6.1933637;Bajo;cadiz
1.500.000 竄ｬ;Chalet en Capuchinos;/comprar/chalet-sanlucar_de_barrameda_las_piletas-35035526289_100500/;Las Piletas (Sanlﾃｺcar de Barrameda);5 habs.;2 baﾃｱos;214 mﾂｲ;Esta es una vivienda ﾃｺnica en la ciudad, se encuentra ubicada en una de las zonas mﾃ｡s exclusivas de la localidad y con una de las ...;36.7740019;-6.3625759;;cadiz
95.000 竄ｬ;Casa en *Centro;/comprar/casa-medina_sidonia_centro_urbano-43345824242_100500/;Medina Sidonia;2 habs.;2 baﾃｱos;61 mﾂｲ;"Del valle inmobiliaria os ofrece en exclusiva esta oportunidad de negocio en medina sidonia.

Se trata de dos apartamentos totalme...";36.4576962;-5.9293987;;cadiz
290.000 竄ｬ;ﾃ》ico en Centro;/comprar/atico-sanlucar_de_barrameda_las_piletas-35930484170_100500/;Las Piletas (Sanlﾃｺcar de Barrameda);4 habs.;2 baﾃｱos;175 mﾂｲ;"ﾂｿQuieres vivir en un ﾃ｡tico de nueva construcciﾃｳn con unas vista increﾃｭbles en sanlﾃｺcar de barrameda?
Te ofrecemos un ﾃ｡tico-dﾃｺplex ...";36.7728897;-6.3558296;;cadiz
750.000 竄ｬ;Chalet en Jerez de La Frontera;/comprar/chalet-rural11400-10059460092_102100/;Rural (Jerez de la Frontera);4 habs.;3 baﾃｱos;343 mﾂｲ;Gilmar te ofrece este lujoso chalet situado en la prestigiosa urbanizaciﾃｳn de montecastillo (jerez de la frontera). Estﾃ｡ construid...;36.8328511;-5.9181664;;cadiz
199.000 竄ｬ;Piso en Centro;/comprar/piso-cadiz_capital_centro_historico11003-44233674221_100500/;Centro Histﾃｳrico (Cﾃ｡diz Capital);3 habs.;1 baﾃｱo;67 mﾂｲ;Plaza san antonio - piso situado en una de las mejores y mﾃ｡s tranquilas zona residenciales del centro de la ciudad, a escasos metr...;36.5340572;-6.2987991;1ﾂｪ planta;cadiz
268.000 竄ｬ;Piso en Camino de Estepona,  s/n;/comprar/piso-santa_margarita_el_zabal11315-3384753525_109700/;Santa Margarita-El Zabal (La Lﾃｭnea de la Concepciﾃｳn);2 habs.;2 baﾃｱos;168 mﾂｲ;Portal 8, Bajo B. Piso en un inmueble de obra nueva de 168 m2 de superficie construida y situado en la zona de La Lﾃｭnea de la Concepciﾃｳn, acomodado en planta baja. Estﾃ｡ estructurado en 2 habitaciones y jardﾃｭn trasero de 13,95 mﾂｲ. Aporta como extras garaje y trastero.;36,2057735;-5,3310336;Bajo;cadiz
85.000 竄ｬ;Chalet en Los Barrios;/comprar/chalet-los_barrios_centro_urbano-45098534829_100500/;Los Barrios;3 habs.;;76 mﾂｲ;"ﾂ｡Chalet independiente en palmones!

El inmueble consta de 295mﾂｲ de parcela y 76mﾂｲ de vivienda distribuidos en:

-3 dormitorios
-sa...";36.176391969;-5.427919565;;cadiz
439.900 竄ｬ;Casa en calle de Isaac Peral, 39;/comprar/casa-centro_zona_playas-40843418194_100500/;Centro-Zona Playas (Chipiona);7 habs.;;208 mﾂｲ;En exclusiva! Magnﾃｭfica vivienda totalmente independiente dividida en 5 apartamentos de los cuales 3 de ellos estﾃ｡n en planta baja...;36.7393;-6.43553;;cadiz
349.000 竄ｬ;Casa en Este;/comprar/casa-este11406-43355299140_100500/;Este (Jerez de la Frontera);3 habs.;3 baﾃｱos;171 mﾂｲ;"ﾂｿBusca una casa en zona tranquila y todo en una sola planta?, tenemos lo que busca. 
La casa se encuentra totalmente reformada, cu...";36.6786451;-6.0980126;;cadiz
75.900 竄ｬ;Piso en calle de los Pescadores;/comprar/piso-san_fernando_el_carmen-42504035806_527956/;El Carmen (San Fernando);4 habs.;1 baﾃｱo;72 mﾂｲ;Piso en venta en san fernando, que dispone de una superficie construida de 72 mﾂｲ, superficie ﾃｺtil de 64 mﾂｲ. Se trata de una tercer...;36.4594141;-6.1983146;3ﾂｪ planta;cadiz
170.000 竄ｬ;Piso en Cristo;/comprar/piso-el_cristo_cayetano_roldan11100-42584250641_103800/;El Cristo-Cayetano Roldﾃ｡n (San Fernando);4 habs.;1 baﾃｱo;108 mﾂｲ;"Se vende piso amplio, haciendo esquina, exterior, muy luminoso, en pleno centro de la ciudad. Zona el cristo nuevo.
La vivienda co...";36.471737353;-6.198452716;1ﾂｪ planta;cadiz
690.000 竄ｬ;Chalet en Coto San Josﾃｩ;/comprar/chalet-costa_de_sancti_petri_playa_de_la_barrosa11139-44210999917_100500/;Costa de Sancti Petri-Playa de La Barrosa (Chiclana de la Frontera);3 habs.;3 baﾃｱos;174 mﾂｲ;Prﾃｳxima construcciﾃｳn de chalet en la zona de la 1ﾂｪ pista de la playa de la barrosa, en el municipio de chiclana de la frontera (cﾃ｡...;36.38102987;-6.191322823;;cadiz
370.000 竄ｬ;Piso en calle Marquﾃｩs de Crﾃｳpani, nﾂｺ 3;/comprar/piso-playa_de_la_victoria11008-45094165348_100500/;Playa de la Victoria (Cﾃ｡diz Capital);2 habs.;1 baﾃｱo;92 mﾂｲ;Espectacular piso a estrenar, ubicado en la segunda planta de un edificio moderno con ascensor, te ofrece una calidad de vida inig...;36.5124;-6.28106;2ﾂｪ planta;cadiz
270.000 竄ｬ;Casa en Estaciﾃｳn Autobuses;/comprar/casa-centro_zona_noreste-42545771525_100500/;Centro-Zona Noreste (Chipiona);3 habs.;2 baﾃｱos;157 mﾂｲ;Vivienda unifamiliar en una sola planta situada en una zona muy tranquila de la localidad de chipiona, con garaje independiente. S...;36.738016;-6.4263106;;cadiz
69.990 竄ｬ;Casa en Junta de los Rios;/comprar/casa-arcos_de_la_frontera_centro_urbano-43397205555_100500/;Arcos de la Frontera;3 habs.;1 baﾃｱo;152 mﾂｲ;Oportunidad de adquirir dos viviendas y poder disfrutar de la vida de campo en la zona de la junta de los rﾃｭos, ya que ofrece dos ...;36.746349163;-5.825021669;;cadiz
479.900 竄ｬ;Chalet en Los Naveros;/comprar/chalet-vejer_de_la_frontera_centro_urbano-39174034621_100500/;Vejer de la Frontera;5 habs.;2 baﾃｱos;268 mﾂｲ;"Chalet urbano con en los naveros

El chalet cuenta con 720 mﾂｲ aprox de parcela, 268 mﾂｲ construidos aprox y 234 mﾂｲ ﾃｺtiles aprox

Pr...";36.3576097;-5.9755054;;cadiz
380.000 竄ｬ;Casa en Cruz del Mar;/comprar/casa-centro_zona_playas-39236614145_100500/;Centro-Zona Playas (Chipiona);3 habs.;2 baﾃｱos;251 mﾂｲ;"Magnifica casa en zona cruz del mar , con 3 plantas : en la planta baja disponemos de un gran garaje con 2 dependencias
En la prim...";36.740807894;-6.436481993;;cadiz
450.000 竄ｬ;Casa en Centro;/comprar/casa-el_puerto_de_santa_maria_centro-42523822366_100500/;Centro (El Puerto de Santa Marﾃｭa);6 habs.;4 baﾃｱos;343 mﾂｲ;Se vende, edificio entero dividido tres plantas,  dos viviendas independientes, en total tres plantas, planta baja es un local que...;36.6023574;-6.2234663;;cadiz
167.000 竄ｬ;Estudio en Puerto Sherry;/comprar/estudio-el_puerto_de_santa_maria_vistahermosa-40836035381_100500/;Vistahermosa (El Puerto de Santa Marﾃｭa);1 hab.;1 baﾃｱo;45 mﾂｲ;"Fersa inmobiliaria comercializa en exclusiva
 Fantﾃ｡stico local comercial en planta baja adaptado como estudio con terraza privativ...";36.580339518;-6.257691219;;cadiz
119.000 竄ｬ;Piso en Centro;/comprar/piso-jerez_de_la_frontera_centro11402-44224324156_100200/;Centro (Jerez de la Frontera);3 habs.;;99 mﾂｲ;"Estupendo piso en centro de jerez.
Ubicado en calle arcos.
ﾂ｡ Ideal para vivir o invertir !
Piso de 99 metros cuadrados. Compuesto ...";36.6838561;-6.131855;;cadiz
435.000 竄ｬ;Chalet en Carboneros;/comprar/chalet-la_soledad_la_coquina_los_gallos-44175527116_100500/;La Soledad-La Coquina-Los Gallos (Chiclana de la Frontera);3 habs.;3 baﾃｱos;180 mﾂｲ;En venta un espectacular chalet prﾃｳximo a la zona de los gallos, en el municipio de chiclana de la frontera (cﾃ｡diz). Se encuentra ...;36.4034432;-6.1671925;;cadiz
155.000 竄ｬ;Casa en calle del Faisﾃ｡n;/comprar/casa-centro_zona_noreste-35005563082_100500/;Centro-Zona Noreste (Chipiona);4 habs.;;130 mﾂｲ;ﾂ｡ En exclusiva! Independiente: casa totalmente independiente ubicada en zona residencial comercial, muy prﾃｳxima a centros educativ...;36.7330938;-6.4286187;;cadiz
4.750.000 竄ｬ;Chalet en Sotogrande Alto;/comprar/chalet-puente_mayorga_campamento11314-15892620590_102100/;Puente Mayorga-Campamento (San Roque);5 habs.;7 baﾃｱos;720 mﾂｲ;Oportunidad de vivir en un entorno incomparable. Rodeado del parque nacional los alcornocales, los mejores campos de golf del sur ...;36.2042556;-5.4099012;;cadiz
490.000 竄ｬ;Casa pareada en Las Redes;/comprar/casa_pareada-el_aguila_las_redes_fuentebravia-45080844923_100500/;El ﾃ“uila-Las Redes-Fuentebravﾃｭa (El Puerto de Santa Marﾃｭa);3 habs.;3 baﾃｱos;153 mﾂｲ;"Magnifica pareada en la zona de las redes con zonas comunes y piscina comunitaria.

Ubicada en una de las mejores zonas de la ciud...";36.600017011;-6.273483413;;cadiz
325.000 竄ｬ;Casa en calle Ancha;/comprar/casa-la_banda_campo_de_futbol-43365840908_100500/;La Banda-Campo de Fﾃｺtbol (Chiclana de la Frontera);5 habs.;3 baﾃｱos;258 mﾂｲ;ﾂ｡Ven a descubrir esta maravillosa casa situada en el corazﾃｳn de chiclana de la frontera! Con una superficie de 234.00 mﾂｲ, esta pro...;36.4211865;-6.1432271;;cadiz
995.000 竄ｬ;Chalet en Carretera de la Barrosa, 29;/comprar/chalet-costa_de_sancti_petri_playa_de_la_barrosa11139-33431382072_100500/;Costa de Sancti Petri-Playa de La Barrosa (Chiclana de la Frontera);3 habs.;4 baﾃｱos;230 mﾂｲ;Exclusivo chalet a estrenar en la zona del coto de san josﾃｩ, chiclana de la frontera. Zona residencial, a escasos 800 metros de la...;36.3799;-6.19073;;cadiz
120.000 竄ｬ;Piso en calle de la Virgen del Perpetuo Socorro;/comprar/piso-centro_zona_noreste-43416328073_100500/;Centro-Zona Noreste (Chipiona);3 habs.;;75 mﾂｲ;Precioso piso en 4ﾂｺ planta con la instalaciﾃｳn de ascensor aprobada por la comunidad junto a la aceptaciﾃｳn de presupuesto y financi...;36.73925256;-6.42813871;4ﾂｪ planta;cadiz
85.000 竄ｬ;Casa adosada en Vejer de La Frontera;/comprar/casa_adosada-vejer_de_la_frontera_centro_urbano-44257777715_100500/;Vejer de la Frontera;3 habs.;1 baﾃｱo;66 mﾂｲ;Del valle inmobiliaria os presenta en exclusiva esta estupenda casa reformada en la pedanﾃｭa de poblado varelo, a tan solo 15 minut...;36.249520032;-5.887491349;;cadiz
83.000 竄ｬ;Piso en Avenida Capitﾃ｡n Ontaﾃｱﾃｳn;/comprar/piso-reconquista_san_jose_artesano_el_rosario11202-42579192094_511915/;Reconquista-San Josﾃｩ Artesano-El Rosario (Algeciras);3 habs.;1 baﾃｱo;79 mﾂｲ;Altura piso 1ﾂｺ, piso superficie total 79 mﾂｲ, superficie ﾃｺtil 70 mﾂｲ, hab. Individuales: 2, habitaciones dobles: 1, 1 baﾃｱo, balcﾃｳn, ...;36.1377212;-5.4490588;1ﾂｪ planta;cadiz
178.500 竄ｬ;Casa en calle de Sﾃｩneca;/comprar/casa-los_barrios_centro_urbano-43383445058_525987/;Los Barrios;3 habs.;2 baﾃｱos;107 mﾂｲ;"Magnﾃｭfica vivienda zona tranquila de los barrios

La vivienda se encuentra en un enclave muy tranquilo y a la vez bien comunicado ...";36.189378602;-5.495424967;;cadiz
349.000 竄ｬ;Casa en Este;/comprar/casa-este11406-43416227214_100500/;Este (Jerez de la Frontera);3 habs.;3 baﾃｱos;171 mﾂｲ;Estupenda casa sobre una parcela urbana de 510 totalmente reformada con patio delantero y amplio jardﾃｭn trasero de mﾃ｡s de 120 metr...;36.6786451;-6.0980126;;cadiz
125.000 竄ｬ;Piso en Centro-Zona Noreste;/comprar/piso-centro_zona_noreste-40838938877_108900/;Centro-Zona Noreste (Chipiona);2 habs.;1 baﾃｱo;63 mﾂｲ;"Descubre tu oasis junto al mar en el corazﾃｳn de chipiona

Bienvenido a tu refugio costero en chipiona, donde la serenidad del mar ...";36.7301682;-6.425225393;1ﾂｪ planta;cadiz
90.000 竄ｬ;Piso en Salesianos;/comprar/piso-fuentenueva_salesianos-42573832748_100500/;Fuentenueva-Salesianos (Algeciras);2 habs.;2 baﾃｱos;80 mﾂｲ;Altura piso 2ﾂｺ, apartamento superficie total 80 mﾂｲ, superficie ﾃｺtil 75 mﾂｲ, habitaciones dobles: 2, 2 baﾃｱos, armarios empotrados  (...;36.1281335;-5.45228;Bajo;cadiz
120.000 竄ｬ;Piso en Las Canteras;/comprar/piso-puerto_real_centro_urbano-44248560776_100500/;Puerto Real;4 habs.;1 baﾃｱo;94 mﾂｲ;Se vende amplio piso de 94 mﾂｲ construidos distribuidos en hall de entrada, cocina independiente con terraza lavadero acristalada b...;36.5316714;-6.1802823;2ﾂｪ planta;cadiz
249.999 竄ｬ;Piso en calle de la Bolsa;/comprar/piso-centro_calzada-45037744791_100500/;Centro-Calzada (Sanlﾃｺcar de Barrameda);3 habs.;1 baﾃｱo;93 mﾂｲ;Fantﾃ｡stica vivienda en pleno centro de sanlﾃｺcar de barrameda, ubicada en una casa seﾃｱorial de 1900 actualmente reformada conservan...;36.7798124;-6.3535905;2ﾂｪ planta;cadiz
115.500 竄ｬ;Piso en La Pastora-Zona de la Estaciﾃｳn;/comprar/piso-la_pastora_zona_de_la_estacion11100-45078503648_100200/;La Pastora-Zona de la Estaciﾃｳn (San Fernando);3 habs.;;85 mﾂｲ;San rafael: amplio piso en la zona de san rafael de 3 dormitorios, cocina, salﾃｳn y baﾃｱo. Cuanta con trastero privado y azotea comu...;36.4714296;-6.1951811;;cadiz
370.000 竄ｬ;ﾃ》ico en Camino de Estepona,  s/n;/comprar/atico-santa_margarita_el_zabal11315-4348388878_109700/;Santa Margarita-El Zabal (La Lﾃｭnea de la Concepciﾃｳn);3 habs.;3 baﾃｱos;229 mﾂｲ;Portal 1, ﾃ》ico A. Piso en un inmueble de obra nueva de 229 m2 de superficie construida y situado en la zona de La Lﾃｭnea de la Concepciﾃｳn, acomodado en planta ﾃ｡tico. Estﾃ｡ estructurado en 3 habitaciones y terraza. Aporta como extras garaje y trastero.;36,2057735;-5,3310336;;cadiz
120.000 竄ｬ;Piso en Continente;/comprar/piso-jerez_de_la_frontera_sur11408-45088363155_108900/;Sur (Jerez de la Frontera);3 habs.;1 baﾃｱo;80 mﾂｲ;Piso en jerez de la frontera, zona sur, continente, la vivienda se encuentra situada en un residencial privado con zonas comunes&n...;36.6704813;-6.1410029;;cadiz
500.000 竄ｬ;Casa pareada en Vistahermosa;/comprar/casa_pareada-el_puerto_de_santa_maria_vistahermosa-35885198462_100500/;Vistahermosa (El Puerto de Santa Marﾃｭa);5 habs.;4 baﾃｱos;190 mﾂｲ;"Fersa inmobiliaria ofrece en exclusiva fantﾃ｡stico pareado en el soto de vistahermosa. 

Pareado muy luminoso. Consta de dos planta...";36.5969308;-6.2501403;;cadiz
319.900 竄ｬ;Casa en Campo de Golf;/comprar/casa-jerez_de_la_frontera_sur11408-40092831308_100500/;Sur (Jerez de la Frontera);3 habs.;3 baﾃｱos;128 mﾂｲ;Magnifica pareada en una parcela de 220 mﾂｲ. La vivienda dispone de tres dormitorios con armarios empotrados, salﾃｳn comedor con pre...;36.6612744;-6.1501215;;cadiz
640.000 竄ｬ;Chalet en Coto San Josﾃｩ;/comprar/chalet-costa_de_sancti_petri_playa_de_la_barrosa11139-45043469443_100500/;Costa de Sancti Petri-Playa de La Barrosa (Chiclana de la Frontera);4 habs.;3 baﾃｱos;145 mﾂｲ;Promociﾃｳn de 3 chalets de obra nueva en la 1ﾂｪ pista de la playa de la barrosa, en chiclana de la frontera. A tan sﾃｳlo 850 metros d...;36.37947;-6.1907443;;cadiz
320.000 竄ｬ;Casa adosada en Centro;/comprar/casa_adosada-el_puerto_de_santa_maria_centro-27572157566_514211/;Centro (El Puerto de Santa Marﾃｭa);3 habs.;4 baﾃｱos;230 mﾂｲ;"A la venta fantﾃ｡stico adosado en la zona de plaza de toros de el puerto de santa marﾃｭa.

La vivienda consta de 230 mﾂｲ distribuidos...";36.5977394;-6.2346688;;cadiz
179.900 竄ｬ;Casa adosada en Noreste;/comprar/casa_adosada-noreste11405-44171923941_101800/;Noreste (Jerez de la Frontera);4 habs.;2 baﾃｱos;130 mﾂｲ;"Se vende; vpo. Maravillosa unifamiliar adosada en esquina, en una de las mejores zonas para vivir en familia, rodeado de todo tipo...";36.6922872;-6.0971089;;cadiz
285.000 竄ｬ;Piso en Avenida Segunda Aguada;/comprar/piso-la_paz_segunda_aguado_loreto11012-43415926800_100500/;La Paz-Segunda Aguado-Loreto (Cﾃ｡diz Capital);5 habs.;2 baﾃｱos;121 mﾂｲ;Luz del sur inmobiliaria te presenta en exclusividad  un amplio piso en cﾃ｡diz capital cerca de la playa. Este gran piso de 110 mﾂｲ ...;36.5122208;-6.2754677;5ﾂｪ planta;cadiz
148.500 竄ｬ;Casa adosada en San Garcia;/comprar/casa_adosada-san_garcia_getares-44256397764_100500/;San Garcﾃｭa-Getares (Algeciras);3 habs.;2 baﾃｱos;140 mﾂｲ;ﾂ｡Descubre tu prﾃｳximo hogar en getares! Se vende impresionante casa / chalet adosado de tres plantas, ubicada en una de las zonas m...;36.1075853;-5.4473418;;cadiz
257.000 竄ｬ;Piso en Playa de las Tres Piedras-Costa Ballena;/comprar/piso-playa_de_las_tres_piedras_costa_ballena-39259498766_990821/;Playa de las Tres Piedras-Costa Ballena (Chipiona);2 habs.;2 baﾃｱos;85 mﾂｲ;Excelente piso en cuanto a calidades se refiere, solerﾃｭa de piedra natural , cocina y baﾃｱos con mﾃ｡rmol y estuco, ventanas de alumi...;36.694761367;-6.41608217;1ﾂｪ planta;cadiz
