precio;sub_descr;href;ubicacion;habitaciones;banios;mt2;planta;otros;latitude;longitude;CCAA
1.125 €/mes;;/alquilar/piso-barrio_leon_el_tardon_blas_infante41010-45034842535_995624/;Barrio León-El Tardón-Blas Infante (Distrito Triana. Sevilla Capital);3 habs.;1 baño;75 m²;4ª planta;Estudiantes. Buen piso estudiantes. Contrato minimo 5 meses y máximo 11. Amueblado y cerca de todos los servicios necesarios, adem...;37.378744;-6.0082748;sevilla
950 €/mes;Dúplex en calle Puerta del Osario;/alquilar/duplex-casco_antiguo_santa_catalina41003-14247424061_515011/;Santa Catalina (Distrito Casco Antiguo. Sevilla Capital);2 habs.;2 baños;72 m²;Bajo;"Excelente piso a estrenar, exclusividad y altas calidades.
Enclavado en el centro de sevilla, en puerta osario-santa catalina.

Pr...";37.393482720126606;-5.985151344586089;sevilla
1.200 €/mes;;/alquilar/piso-zona_esperanza_de_triana41010-45035275945_104700/;Zona Esperanza de Triana (Distrito Triana. Sevilla Capital);3 habs.;1 baño;69 m²;;"¡Alquiler para estudiantes! Contrato mínimo de 10 meses. 
 Características del inmueble: piso reformado totalmente hace 2 años, de...";37.3793397;-6.0035588;sevilla
977 €/mes;Piso en calle Campamento, 31;/alquilar/piso-la_buhaira_san_bernardo41018-11715805392_101800/;La Buhaira-San Bernardo (Distrito Nervión. Sevilla Capital);1 hab.;1 baño;70 m²;1ª planta;Amplio apartamento de 70 m² construidos en edificio maría josé ii, con 1 dormitorio con armario empotrado, baño completo, salón-co...;37.3803;-5.98057;sevilla
990 €/mes;;/alquilar/piso-zona_ronda_de_triana_cartuja41010-45061340551_100500/;Zona Ronda de Triana-Cartuja (Distrito Triana. Sevilla Capital);2 habs.;1 baño;80 m²;;¡Descubre tu nuevo hogar en el corazón de triana! Este fantástico piso a estrenar te sorprenderá con su luminosidad y sus techos a...;37.3890239;-6.0090644;sevilla
700 €/mes;;/alquilar/piso-feria_alameda41003-45073877532_100500/;Feria-Alameda (Distrito Casco Antiguo. Sevilla Capital);1 hab.;1 baño;57 m²;Bajo;¿Te gustaría vivir en el centro de sevilla en una casa de principios del s xx, totalmente rehabilitada, respetando elementos origi...;37.3977781;-5.9911763;sevilla
1.000 €/mes;;/alquilar/piso-nervion_ciudad_jardin41005-45036743756_527264/;Ciudad Jardín (Distrito Nervión. Sevilla Capital);3 habs.;1 baño;60 m²;Bajo;Piso en alquiler de 70 m² en ciudad jardin solo para estudiantes. La vivienda en planta baja y con salida exterior a la calle, con...;37.3806124;-5.9615435;sevilla
900 €/mes;;/alquilar/duplex-tiro_de_linea-42569693774_100500/;Tiro de Línea (Distrito Sur. Sevilla Capital);4 habs.;;120 m²;;Magnifico piso muy cuidado y recién pintado que consta de 4 dormitorios, 2 cuartos de baño, salón, cocina amueblada y con electrod...;37.3699272;-5.9718763;sevilla
700 €/mes;;/alquilar/piso-pio_xii41008-44179164748_100200/;Pío XII (Distrito Macarena. Sevilla Capital);;1 baño;45 m²;2ª planta;"¡Descubre este magnífico piso en alquiler en la ronda de pío xii!
Sólo para docentes, periodo de septiembre a junio.
Ubicado en un...";37.4066337;-5.9777287;sevilla
1.200 €/mes;;/alquilar/piso-tabladilla_bami41013-44256343595_522814/;Tabladilla-Bami (Distrito Sur. Sevilla Capital);4 habs.;2 baños;97 m²;2ª planta;Piso de cuatro dormitorios en bami, cercano al hospital virgen del rocio, colegios, universidades y a un paso de la avenida de la ...;37.3592563;-5.9761257;sevilla
2.600 €/mes;;/alquilar/piso-prado_de_san_sebastian41004-40858498079_100500/;Prado de San Sebastián (Distrito Sur. Sevilla Capital);5 habs.;;256 m²;6ª planta;No le cobramos nada al inquilino. En la mejor zona de nervión, extraordinario piso de esquina de 254 metros, realmente son 2 pisos...;37.37847;-5.9811728;sevilla
260 €/mes;;/alquilar/piso-cerro_amate_la_plata-45902988271_523770/;La Plata (Distrito Cerro Amate. Sevilla Capital);3 habs.;2 baños;80 m²;4ª planta;"El precio  es por habitación.
Solo se alquila a estudiantes  
Piso en alquiler para estudiantes 
Hay 2 habitaciones disponibles 
4...";37.3688494;-5.9499097;sevilla
1.450 €/mes;;/alquilar/piso-tabladilla_bami41013-42553502224_522814/;Tabladilla-Bami (Distrito Sur. Sevilla Capital);3 habs.;2 baños;94 m²;4ª planta;"¡ Atención personal mir! Disponible para mayo

Piso en alquiler de 94 m² completamente reformado. Con paredes en perlita y suelo p...";37.3590966;-5.9760368;sevilla
1.025 €/mes;;/alquilar/chalet-avenida_de_las_ciencias_emilio_lemos41020-43410618903_108900/;Avenida de las Ciencias-Emilio Lemos (Distrito Este-Alcosa-Torreblanca. Sevilla Capital);5 habs.;3 baños;180 m²;;Fantástica casa adosada de 180 m² de dos plantas. Está reformada, recién pintada y ubicada en una zona muy tranquila. La vivienda ...;37.4034184;-5.9264543;sevilla
950 €/mes;;/alquilar/piso-san_roque_la_calzada41003-36748119362_108900/;San Roque-La Calzada (Distrito Nervión. Sevilla Capital);3 habs.;2 baños;123 m²;;"Es un placer para lucas &amp; viedma servicios inmobiliarios presentarle esta cautivadora oportunidad de vivienda en sevilla. Nues...";37.3915887;-5.9818864;sevilla
800 €/mes;;/alquilar/piso-san_roque_la_calzada41018-45918668678_100500/;San Roque-La Calzada (Distrito Nervión. Sevilla Capital);1 hab.;1 baño;55 m²;1ª planta;"Estupendo apartamento amueblado junto a la avenida de la buhaira, zona de las más cotizadas de sevilla.
La vivienda tiene aproxima...";37.3879592;-5.9769597;sevilla
750 €/mes;;/alquilar/piso-san_pablo_santa_justa_san_pablo41007-45855263440_106000/;San Pablo (Distrito San Pablo-Santa Justa. Sevilla Capital);3 habs.;1 baño;80 m²;;"Piso para estudiantes, se alquila durante el curso académico, periodo comprendido desde septiembre 2024 a junio 2025.
La vivienda ...";37.3945438;-5.9660313;sevilla
1.125 €/mes;;/alquilar/piso-barrio_leon_el_tardon_blas_infante41010-45016728271_995624/;Barrio León-El Tardón-Blas Infante (Distrito Triana. Sevilla Capital);3 habs.;1 baño;78 m²;4ª planta;Estudiantes y trabajadores. Piso para largas o cortas estancias, muy bien situado al tener metro y bus justo al lado, tiene todos ...;37.3788251;-6.008117;sevilla
1.100 €/mes;Piso en calle Pirineos, 7;/alquilar/piso-la_florida_huerta_del_pilar41018-44181686854_510641/;La Florida-Huerta del Pilar (Distrito Nervión. Sevilla Capital);2 habs.;1 baño;80 m²;1ª planta;En nervión, situado junto a avenida la buhaira y eduardo dato. Con terraza propia. Primera planta, alta. Entrada con armario empot...;37.38545639689116;-5.977496449077364;sevilla
900 €/mes;;/alquilar/piso-alfalfa41004-45023877975_100500/;Alfalfa (Distrito Casco Antiguo. Sevilla Capital);1 hab.;;78 m²;1ª planta;¡Descubre tu nuevo hogar en el corazón de sevilla! Este encantador apartamento de 78 m², ubicado en una primera planta con ascenso...;37.389798851;-5.992260827;sevilla
850 €/mes;;/alquilar/piso-casco_antiguo_san_julian41003-45021856561_998743/;San Julián (Distrito Casco Antiguo. Sevilla Capital);2 habs.;1 baño;80 m²;1ª planta;Este encantador piso en alquiler se encuentra ubicado en la zona de san julián, en sevilla capital. Con una superficie total de 65...;37.3966532;-5.9839268;sevilla
900 €/mes;;/alquilar/piso-villegas_los_principes41009-35890809710_100500/;Villegas-Los Príncipes (Distrito Macarena. Sevilla Capital);3 habs.;1 baño;74 m²;1ª planta;"Piso solo para estudiantes

Se alquila solo a estudiantes y por un periodo mínimo de un año piso amueblado en perfecto estado en 1...";37.4098271;-5.9797741;sevilla
1.050 €/mes;;/alquilar/piso-los_remedios_barrio41011-41691576302_100500/;Los Remedios (Distrito Los Remedios. Sevilla Capital);2 habs.;2 baños;102 m²;1ª planta;Luminosa vivienda junto al río guadalquivir y a unos pasos del recinto ferial. Está situada a unos pasos de la zona céntrica y mon...;37.3779427;-5.9975866;sevilla
760 €/mes;;/alquilar/piso-arco_norte_la_alqueria41704-45010053642_997202/;Arco Norte-La Alquería (Distrito Zona Centro. Dos Hermanas);3 habs.;2 baños;90 m²;Principal;Amplio piso de 3 dormitorios en zona inmejorable. Se alquila con 2 plazas de garaje. El piso cuenta con cocina completamente equip...;37.295429254;-5.937231354;sevilla
850 €/mes;;/alquilar/apartamento-alfalfa41004-45021789664_516479/;Alfalfa (Distrito Casco Antiguo. Sevilla Capital);1 hab.;1 baño;75 m²;1ª planta;"Home international pone en alquiler este magnífico apartamento con bonito patio en pleno centro.  

El piso dispone, de aire acond...";37.3913693;-5.992155;sevilla
950 €/mes;;/alquilar/casa_adosada-centro_dona_mercedes41701-42529265089_100500/;Centro-Doña Mercedes (Distrito Zona Centro. Dos Hermanas);3 habs.;3 baños;129 m²;;"Adosado de 129m². Distribuido en dos plantas; cuenta con 3 habitaciones, amplio salón, cocina-comedor amueblada y equipada (frigor...";37.2801202;-5.9282639;sevilla
950 €/mes;Apartamento en calle de Huestes, 3;/alquilar/apartamento-la_buhaira_san_bernardo41018-1737202253_101800/;La Buhaira-San Bernardo (Distrito Nervión. Sevilla Capital);1 hab.;1 baño;80 m²;2ª planta;Apartamento en edificio maría josé i, con 1 dormitorio con baño completo y armario empotrado, salón-comedor con cocina office y te...;37.3808;-5.98048;sevilla
1.100 €/mes;;/alquilar/atico-feria_alameda41003-42556230942_106000/;Feria-Alameda (Distrito Casco Antiguo. Sevilla Capital);2 habs.;1 baño;61 m²;;"Acanto inmobiliaria le ofrece bonito ático dulplex en pleno centro de sevilla  amueblado. !!!!
61 m² que se distribuyen en dos pla...";37.3968965;-5.9921835;sevilla
950 €/mes;;/alquilar/duplex-arco_norte_la_alqueria41704-45932735058_100500/;Arco Norte-La Alquería (Distrito Zona Centro. Dos Hermanas);3 habs.;2 baños;118 m²;Bajo;Dúplex en arco norte, dos hermanas, zona muy bien comunicada con sevilla. Alquiler para un periodo mínimo de un año, renovable. Ub...;37.295161072;-5.937642207;sevilla
1.300 €/mes;;/alquilar/piso-la_buhaira_san_bernardo41004-45834839529_100500/;La Buhaira-San Bernardo (Distrito Nervión. Sevilla Capital);2 habs.;3 baños;70 m²;Bajo;Si estás buscando alquiler /alquiler temporal, estamos convencidos de que habrás visto decenas de pisos que, por un motivo u otro,...;37.380905;-5.9853023;sevilla
1.350 €/mes;;/alquilar/piso-triana_casco_antiguo41010-44174496893_523453/;Triana Casco Antiguo (Distrito Triana. Sevilla Capital);3 habs.;1 baño;94 m²;Bajo;"Kámaraljarafe, la agencia que te acompaña a tu nuevo hogar.

¡Alquila este encantador piso en la vibrante calle rodrigo de triana,...";37.384097;-6.0042652;sevilla
775 €/mes;;/alquilar/piso-san_pablo_santa_justa_san_pablo41007-45093863850_103800/;San Pablo (Distrito San Pablo-Santa Justa. Sevilla Capital);3 habs.;;65 m²;4ª planta;Piso  en san pablo, con 65 m² construidos, 3 dormitorios, 1 baños, semi reformado, exterior, planta 4, 1 armarios, cocina con elec...;37.394371464;-5.966951477;sevilla
550 €/mes;;/alquilar/piso-zona_plazas_el_arenal_la_polvora41701-45928973693_100500/;Zona Plazas El Arenal-La Pólvora (Distrito Zona Centro. Dos Hermanas);3 habs.;1 baño;83 m²;3ª planta;"Piso amueblado para entrar a vivir situado en la zona centro en (dos hermanas).
Se compone de salón-comedor, tres habitaciones cad...";37.2840154;-5.9215249;sevilla
2.400 €/mes;;/alquilar/casa_pareada-zona_ronda_de_triana_cartuja41010-44199560776_100500/;Zona Ronda de Triana-Cartuja (Distrito Triana. Sevilla Capital);4 habs.;;168 m²;;¡Bienvenidos al corazón de triana! En este hermoso chalet pareado de dos plantas, encontrarás el hogar perfecto para tu familia. C...;37.3823668;-6.0061451;sevilla
700 €/mes;;/alquilar/piso-alcala_de_guadaira_centro-45838603856_100500/;Centro (Alcalá de Guadaíra);2 habs.;1 baño;93 m²;3ª planta;**estupendo piso recién reformado ,ubicado en pleno centro de alcalá y rodeado de todo tipo de servicios sin necesidad de coger el...;37.3391945;-5.8393503;sevilla
1.915 €/mes;;/alquilar/piso-feria_alameda41002-24212310118_100500/;Feria-Alameda (Distrito Casco Antiguo. Sevilla Capital);2 habs.;2 baños;170 m²;3ª planta;"Estupendo y singular piso en el casco histórico de sevilla, zona alameda de hércules. Amueblado. 

Impecable, con altos techos de ...";37.3970797;-5.993784;sevilla
675 €/mes;;/alquilar/casa_adosada-mairena_del_alcor_centro_urbano-45931506610_100500/;Mairena del Alcor;3 habs.;2 baños;102 m²;;Magnifico chalet adosado que consta de 3 dormitorios, 2 cuartos de baño, salón, cocina, 2 trasteros, terraza, patio delantero y ja...;37.3814513;-5.7443047;sevilla
3.000 €/mes;;/alquilar/chalet-alcala_de_guadaira_nueva_alcala-25001943293_501484/;Nueva Alcalá (Alcalá de Guadaíra);2 habs.;2 baños;1.000 m²;;"¿Necesitas un descanso? Alquiler de chalet vacacional para mes de julio y agosto.
Precio mes completo: 3.000€.
Precio por quincena...";37.3600916;-5.7914166;sevilla
360 €/mes;Piso en Paseo de Europa, 32;/alquilar/piso-elcano_los_bermejales41012-45007847326_109800/;Elcano-Los Bermejales (Distrito Bellavista-La Palmera. Sevilla Capital);4 habs.;2 baños;90 m²;3ª planta;Piso de 100 m² con 90 m² de superficie útil ubicado en la zona de área de sevilla y ubicado en la 3ª planta. Está dispuesto en 4 h...;37.3439;-5.979465;sevilla
260 €/mes;;/alquilar/piso-cerro_amate_la_plata-45928248645_523770/;La Plata (Distrito Cerro Amate. Sevilla Capital);3 habs.;1 baño;80 m²;4ª planta;"Alquiler para estudiantes sevilla
Solo estudiantes

Precio por habitación 
Solo se alquila a estudiantes 
Piso para estudiantes 
H...";37.3688494;-5.9499097;sevilla
450 €/mes;;/alquilar/piso-pino_montano41015-39176042746_101800/;Pino Montano (Distrito Norte. Sevilla Capital);2 habs.;1 baño;50 m²;;Alquiler subvencionado por la consejería de fomento y vivienda de la junta de andalucia, en régimen de alquiler  (con garaje y tra...;37.4257581;-5.9711338;sevilla
800 €/mes;;/alquilar/piso-barrio_leon_el_tardon_blas_infante41010-45047982347_104700/;Barrio León-El Tardón-Blas Infante (Distrito Triana. Sevilla Capital);2 habs.;;62 m²;;Piso en c/ juan díaz de solís. Tiene 62m², consta de 2 dormitorios, salón con balcón, cocina y baño. Vivienda en perfecto estado (...;37.3780124;-6.0096981;sevilla
600 €/mes;;/alquilar/piso-alcala_del_rio_centro_urbano-45013644597_523453/;Alcalá del Río;2 habs.;1 baño;70 m²;Bajo;"Kámaraljarafe, la agencia que te acompaña a tu nuevo hogar.
Descubre este fantástico piso en alcalá del río, de 68 metros útiles, ...";37.5178606;-5.9791237;sevilla
850 €/mes;;/alquilar/piso-mairena_del_aljarafe_casco_antiguo-45908894016_527869/;Casco Antiguo (Mairena del Aljarafe);3 habs.;2 baños;99 m²;1ª planta;Estupendo piso en hermanas mirabal, mairena del aljarafe, situado en una urbanización privada con piscina, zonas comunes y garaje....;37.3508949;-6.0645813;sevilla
700 €/mes;;/alquilar/chalet-oromana-44245596548_106000/;Oromana (Alcalá de Guadaíra);2 habs.;2 baños;108 m²;;"Alquiler en huerta el cura solo profesores!!!
Se alquila precioso chalet de septiembre a junio solo a profesores!!!
Chalet como nu...";37.282228227;-5.885112933;sevilla
1.200 €/mes;;/alquilar/chalet_unifamiliar-carmona_centro_urbano-44189634083_516479/;Carmona;3 habs.;3 baños;180 m²;;Estupendo chalet independiente en pino grande de una sola planta muy luminosa en urbanización cerrada con vigilancia de 24h y fáci...;37.4348218;-5.8200438;sevilla
1.170 €/mes;;/alquilar/piso-barrio_leon_el_tardon_blas_infante41010-45007509645_104700/;Barrio León-El Tardón-Blas Infante (Distrito Triana. Sevilla Capital);3 habs.;;65 m²;;"Disponible para estudiantes para el curso 2024-2025
 Características del inmueble: piso de 65 m² con 3 dormitorios, salón con sali...";37.3765012;-6.0125496;sevilla
750 €/mes;;/alquilar/piso-mairena_del_aljarafe_simon_verde-45062714643_100500/;Simón Verde (Mairena del Aljarafe);2 habs.;1 baño;63 m²;2ª planta;Mairena del aljarafe.- residencial mar báltico. Piso amueblado, superficie de 63 metros cuadrados aproximadamente, se distribuye e...;37.3465284;-6.0386498;sevilla
1.580 €/mes;;/alquilar/casa_unifamiliar-el_zaudin_club_de_golf-28415152707_519787/;El Zaudín-Club de Golf (Bormujos);3 habs.;4 baños;350 m²;;"Magnifico chalet de diseño en alquiler en obra nueva a estrenar y en la mejor zona del aljarafe.
Este chalet está integrado en una...";37.3660322;-6.0634842;sevilla
800 €/mes;;/alquilar/piso-los_remedios_barrio41011-45052355079_100500/;Los Remedios (Distrito Los Remedios. Sevilla Capital);1 hab.;1 baño;45 m²;2ª planta;Estupendo apartamento totalmente amueblado en los remedios. Ubicado en uno de los lugares con más servicios alrededor: comercios, ...;37.374667319;-5.998008105;sevilla
800 €/mes;;/alquilar/piso-san_pablo_santa_justa_san_pablo41007-45900526783_106000/;San Pablo (Distrito San Pablo-Santa Justa. Sevilla Capital);3 habs.;1 baño;96 m²;3ª planta;¡Atención estudiantes! Presentamos un piso en alquiler ideal para el curso académico, disponible de septiembre a junio. Situado en...;37.3962313;-5.9659947;sevilla
900 €/mes;;/alquilar/piso-nervion_barrio41005-45915651554_100500/;Nervión (Distrito Nervión. Sevilla Capital);1 hab.;1 baño;60 m²;5ª planta;"Se alquila por 11 meses¡ Alquilamos este estupendo apartamento amueblado, exterior y muy amplio, en el barrio de nervión. 
Se encu...";37.3849673;-5.9652376;sevilla
595 €/mes;Piso en Avenida del Primero de Mayo, 163;/alquilar/piso-coria_del_rio_centro_urbano-44219332583_991152/;Coria del Río;3 habs.;2 baños;90 m²;1ª planta;"Se alquila este acogedor piso en el 1º piso, con una superficie total de 90 m² y 80 m² útiles. 

Cuenta con 3 habitaciones individ...";37.296482;-6.051645;sevilla
2.500 €/mes;Piso en calle San Pablo;/alquilar/piso-museo41001-45096394992_100500/;Museo (Distrito Casco Antiguo. Sevilla Capital);3 habs.;;200 m²;2ª planta;"El hogar que buscas en sevilla: un fantástico piso ubicado en plano casco histórico, en calle san pablo.

 Situado en una cuarta p...";37.3902;-5.9983;sevilla
950 €/mes;;/alquilar/piso-bellavista_la_palmera_bellavista41014-45874020544_100500/;Bellavista (Distrito Bellavista-La Palmera. Sevilla Capital);3 habs.;2 baños;115 m²;4ª planta;"Estupendo piso amueblado y en los jardines de hércules, zona residencial con todo tipo de servicios y servicios alrededor.
Es exte...";37.3331945;-5.9681437;sevilla
800 €/mes;;/alquilar/piso-los_remedios_barrio41011-45037217797_106000/;Los Remedios (Distrito Los Remedios. Sevilla Capital);1 hab.;1 baño;45 m²;2ª planta;¡Bienvenidos a su nuevo hogar en el encantador barrio de los remedios! Presentamos un excelente apartamento en alquiler ubicado en...;37.3748173;-5.9963143;sevilla
1.500 €/mes;;/alquilar/piso-los_remedios_barrio41011-45849301178_995624/;Los Remedios (Distrito Los Remedios. Sevilla Capital);4 habs.;2 baños;115 m²;3ª planta;Estudiantes. Estupendo piso entre virgen de lujan y república ärgentina, se entrega completamente amueblado y cocina reformada, di...;37.3772718;-5.9999221;sevilla
595 €/mes;Piso en Avenida Primero de Mayo, 152;/alquilar/piso-coria_del_rio_centro_urbano-44242172190_991152/;Coria del Río;3 habs.;2 baños;90 m²;2ª planta;"Este luminoso piso en alquiler se encuentra en el 2º piso de un edificio en coria del río.
Con una superficie total de 90 m² y 80 ...";37.287582;-6.0526595;sevilla
1.000 €/mes;;/alquilar/piso-encarnacion_regina41002-45051230821_100500/;Encarnación-Regina (Distrito Casco Antiguo. Sevilla Capital);1 hab.;1 baño;60 m²;1ª planta;Entre la basílica del gran poder y la popular alameda de hércules encontramos este fantástico apartamento amueblado, ubicado en un...;37.3940672;-5.9953208;sevilla
1.000 €/mes;Piso en Avenida de las Ciencias, 17;/alquilar/piso-avenida_de_las_ciencias_emilio_lemos41020-45922263263_103800/;Avenida de las Ciencias-Emilio Lemos (Distrito Este-Alcosa-Torreblanca. Sevilla Capital);3 habs.;2 baños;100 m²;3ª planta;Piso  en sevilla este, con 100 m² construidos, 3 dormitorios, 2 baños, nuevo, exterior, planta 3, 5 armarios, ascensor, menos de 5...;37.3937;-5.92118;sevilla
850 €/mes;;/alquilar/piso-santa_aurelia41006-45098373128_525910/;Santa Aurelia (Distrito Cerro Amate. Sevilla Capital);3 habs.;2 baños;120 m²;4ª planta;"Mangano - morisancon grupo inmobiliario asesoria legal.

Solo se alquila a chicas para entrar en septiembre se puede visitar ya.

...";37.383352702;-5.952039219;sevilla
1.200 €/mes;;/alquilar/piso-almensilla_centro_urbano-45052178140_106000/;Almensilla;3 habs.;2 baños;100 m²;4ª planta;"Magnifico piso completamente nuevo a estrenar, 95m² más terraza de 12m² en zona de nuevo bulevar de mairena del aljarafe.
Dispone ...";37.3120893;-6.1170176;sevilla
595 €/mes;Piso en calle Alcalde J Gutierrez Perez, nº 49;/alquilar/piso-coria_del_rio_centro_urbano-12527710581_100500/;Coria del Río;2 habs.;2 baños;65 m²;1ª planta;"Alquiler de piso en coria del rio (sevilla).

¿Buscando piso para alquilar? Te ofrecemos este piso de 2 habitaciones, 2 baños, sin...";37.2963;-6.05201;sevilla
975 €/mes;;/alquilar/piso-nervion_barrio41005-45931359221_519264/;Nervión (Distrito Nervión. Sevilla Capital);3 habs.;1 baño;80 m²;4ª planta;En el barrio de nervión, calle beatriz de suabia, junto a gran plaza y parada de metro, con todos los servicios necesarios a su al...;37.3835743;-5.9669928;sevilla
800 €/mes;Piso en Avenida de Adolfo Suárez, 30;/alquilar/piso-arco_norte_la_alqueria41704-45045813069_997202/;Arco Norte-La Alquería (Distrito Zona Centro. Dos Hermanas);3 habs.;2 baños;90 m²;Entresuelo;Amplio piso de 3 dormitorios en zona inmejorable. Se alquila con varios extras incluidos en el precio: 2 plazas de garaje, interne...;37.29913;-5.929806;sevilla
1.400 €/mes;Piso en calle Jandula;/alquilar/piso-tabladilla_bami41013-4201906020_515011/;Tabladilla-Bami (Distrito Sur. Sevilla Capital);3 habs.;2 baños;135 m²;6ª planta;"Magnífico piso en urbanización exclusiva.

La urbanización pineda parque cuenta con: zonas verdes, pádel, club social, zona infant...";37.35474755368318;-5.975063263945426;sevilla
1.500 €/mes;;/alquilar/piso-museo41001-45833954680_998743/;Museo (Distrito Casco Antiguo. Sevilla Capital);3 habs.;2 baños;120 m²;1ª planta;Este encantador piso en alquiler se encuentra en la zona de museo, en sevilla capital. Con una superficie total de 120 m² y una di...;37.3894594;-6.0011268;sevilla
1.900 €/mes;;/alquilar/chalet_unifamiliar-bormujos_centro-83351853775_516479/;Centro (Bormujos);4 habs.;3 baños;350 m²;;"Disponible a partir del 1 de septiembre. 

Home international pone en alquiler y en venta este magnifico chalet independiente. Ubi...";37.3658389;-6.083441;sevilla
1.500 €/mes;;/alquilar/atico-alfalfa41002-39214413380_525060/;Alfalfa (Distrito Casco Antiguo. Sevilla Capital);3 habs.;3 baños;120 m²;;Altura piso 3º, ático superficie total 120 m², superficie útil 100 m², hab. Individuales: 2, habitaciones dobles: 1, 2 baños, 1 as...;37.3934451;-6.000533;sevilla
1.400 €/mes;;/alquilar/piso-san_pablo_santa_justa_san_pablo41007-45045972742_106000/;San Pablo (Distrito San Pablo-Santa Justa. Sevilla Capital);4 habs.;2 baños;191 m²;6ª planta;El piso que se describe a continuación es  muy amplio y bien equipado, ideal para estudiantes que buscan un lugar cómodo para vivi...;37.394371464;-5.966951477;sevilla
700 €/mes;Ático en calle Jose Maria Olazabal, nº 17;/alquilar/atico-las_pajanosas-44266393991_106000/;Las Pajanosas (Guillena);2 habs.;1 baño;82 m²;;Oportunidad atico exclusivo en urb. Hato verde! Disponible a partir del 1 de julio. Precioso ático en alquiler por 700 euros/mes d...;37.3176;-5.95091;sevilla
1.170 €/mes;;/alquilar/piso-barrio_leon_el_tardon_blas_infante41010-45030985150_104700/;Barrio León-El Tardón-Blas Infante (Distrito Triana. Sevilla Capital);3 habs.;;65 m²;;"Disponible para estudiantes para el curso 2024-2025
 Características del inmueble: piso de 65 m² completamente reformado, con 3 do...";37.3788106;-6.0098678;sevilla
725 €/mes;;/alquilar/apartamento-zona_esperanza_de_triana41010-9253768932_519787/;Zona Esperanza de Triana (Distrito Triana. Sevilla Capital);1 hab.;1 baño;50 m²;4ª planta;Magnifico apartamento a 50 m de pagés del corro, en c/ evangelista 7. Núcleo residencial evangelista. Zona muy tranquila y privati...;37.382148;-6.0038175;sevilla
430 €/mes;;/alquilar/piso-lebrija_centro_urbano-44252070821_995571/;Lebrija;1 hab.;1 baño;60 m²;Bajo;Ponemos en alquiler este magnifico piso de una habitación a estrenar.;36.923974867;-6.078018828;sevilla
800 €/mes;;/alquilar/piso-feria_alameda41003-45080906479_109300/;Feria-Alameda (Distrito Casco Antiguo. Sevilla Capital);1 hab.;1 baño;65 m²;3ª planta;Bonito piso en el centro, cercano a calle feria y alameda de hércules. Tercera planta sin ascensor. Consta de una habitación con c...;37.400404;-5.9903964;sevilla
775 €/mes;;/alquilar/piso-tiro_de_linea-45019561199_519264/;Tiro de Línea (Distrito Sur. Sevilla Capital);3 habs.;1 baño;75 m²;2ª planta;"Tiro de linea. Piso en alquiler para contratos de larga duración( anual renovable)

Se alquila vivienda exterior y luminosa, con s...";37.3670562;-5.9767078;sevilla
850 €/mes;;/alquilar/piso-leon_xiii_cruz_roja41009-40089420954_100500/;León XIII-Cruz Roja (Distrito Macarena. Sevilla Capital);2 habs.;1 baño;66 m²;1ª planta;"Completamente reformado
 
 Ubicación inmejorable, con todos los servicios. A pocos minutos del hospital universitario virgen macar...";37.4063151;-5.9826702;sevilla
700 €/mes;;/alquilar/apartamento-cerro_amate_el_cerro41006-45062679946_106000/;El Cerro (Distrito Cerro Amate. Sevilla Capital);1 hab.;1 baño;65 m²;Bajo;Apartamento de un dormitorio, salón con cocina americana, salón con aire acondicionado, dormitorio con aire acondicionado y salida...;37.3725436;-5.9579939;sevilla
