precio;sub_descr;href;ubicacion;habitaciones;banios;mt2;otros;latitude;longitude;planta;CCAA
590.000 €;;/comprar/chalet-ampuero_centro_urbano-44226217858_100500/;Ampuero;10 habs.;5 baños;805 m²;Inmobiliaria ezker aldea pone en venta imponente casón indiano de principios del siglo xx en el idílico municipio de ampuero, cant...;43.352673473;-3.41785534;;cantabria
600.000 €;;/comprar/duplex-zona_playa-43365312588_515274/;Zona Playa (Laredo);4 habs.;3 baños;140 m²;Superficie total 140 m², dúplex superficie útil 130 m², habitaciones dobles: 4, 3 baños, armarios empotrados, ascensor, balcón, ca...;43.420259549;-3.443108743;6ª planta;cantabria
190.000 €;;/comprar/piso-santona_centro_urbano-39196732313_106000/;Santoña;3 habs.;2 baños;Más de 20;"Si buscas piso en santoña ¡Tienes que visitar este inmueble!

Inmobiliaria mi villa les presenta una vivienda en perfecto estado p...";43.441460779;-3.456293747;;cantabria
555.000 €;;/comprar/casa_adosada-sancibrian_soto_de_la_marina-38386451294_990805/;Sancibrián (Santa Cruz de Bezana);4 habs.;5 baños;360 m²;"¡Ocasión unica!

Increíble chalet adosado en la exclusiva urbanización la roca, ubicada en sancibrián. Esta esquina de lujo cuenta...";43.462534911;-3.874123551;;cantabria
299.000 €;Piso en calle de Menéndez Pelayo, 13;/comprar/piso-laredo_centro39770-3677167481_109700/;Centro (Laredo);2 habs.;2 baños;86 m²;Portal 2, 2º A. Piso en un inmueble de obra nueva de 86 m2 de superficie construida y situado en la zona de Laredo, acomodado en planta 2. Está estructurado en 2 habitaciones, 2 baños completos y terraza de 7,90 m2. Aporta como extras ascensor y trastero, garaje aparte.;43,411759536;-3,41279115;2ª planta;cantabria
164.900 €;;/comprar/casa-ramales-43362270735_106000/;Ramales (Ramales de la Victoria);5 habs.;2 baños;292 m²;"¡Casa en ramales en un entorno de paz y tranquilidad! 

Desde inmobiliaria mi villa les presentamos esta increíble casa ubicada en...";43.265774395;-3.421774581;;cantabria
392.400 €;;/comprar/casa-padierniga-45889008979_515274/;Padiérniga (Voto);6 habs.;4 baños;325 m²;A tan solo unos metros de la ría, con impresionantes vistas y en un lugar tranquilo perfecto para que sea tu hogar perfecto, se en...;43.367734649;-3.459691445;;cantabria
180.000 €;;/comprar/piso-zona_playa-44192492238_106000/;Zona Playa (Laredo);3 habs.;1 baño;78 m²;"¡Increíble piso cerca del mar! 

Desde inmobiliaria mi villa les presentamos este increíble piso de 3 habitaciones a unos pocos me...";43.410000824;-3.436192515;11ª planta;cantabria
79.000 €;;/comprar/apartamento-el_astillero_centro_urbano-44191923576_181900/;El Astillero;1 hab.;1 baño;47 m²;"Apartamento  en guarnizo de 1 habitación. Todo exterior .
Ascensor y calefacción de gas natural.";43.405359068;-3.837738063;3ª planta;cantabria
199.000 €;;/comprar/piso-laredo_centro39770-43368130751_106000/;Centro (Laredo);3 habs.;2 baños;105 m²;"¡Vivienda en exclusiva con una decoración exquisita, lista para entrar a vivir y en el centro de la villa!

Inmobiliaria mi villa ...";43.4121274;-3.4088114;1ª planta;cantabria
209.000 €;;/comprar/piso-laredo_centro39770-43336842628_106000/;Centro (Laredo);3 habs.;2 baños;;"¡Amplio y luminoso piso en el centro de laredo!

Desde inmobiliaria mi villa les presentamos este maravilloso piso de 115m² en el ...";43.413148955;-3.415600326;2ª planta;cantabria
225.000 €;;/comprar/piso-laredo_centro39770-41677354713_515274/;Centro (Laredo);3 habs.;2 baños;106 m²;Desde pisos laredo tenemos el placer de presentarles esta vivienda en el centro de laredo, a tan solo unos pasos de la increíble...;43.409910578;-3.415572999;1ª planta;cantabria
259.000 €;;/comprar/piso-suances_centro_urbano-37527938462_997994/;Suances;2 habs.;1 baño;76 m²;¡No pierdas la oportunidad de vivir cerca de la playa en este maravilloso piso en venta! Ubicado en una finca cerrada con todas la...;43.433044758;-4.045380479;1ª planta;cantabria
358.000 €;;/comprar/casa_pareada-rioseco_de_guriezo-44190758842_100500/;Rioseco de Guriezo (Guriezo);4 habs.;4 baños;200 m²;Guriezo, un encantador municipio ubicado en la bella región de cantabria, es conocido por sus impresionantes paisajes naturales y ...;43.353834766;-3.326035588;;cantabria
150.000 €;;/comprar/duplex-el_astillero_centro_urbano-37517838619_100500/;El Astillero;2 habs.;2 baños;97 m²;"Astillero- ideal para primera vivienda de parejas jovenes, . Aprovechate de las ventajas fiscales!
Estupendo duplex de 2 dormitori...";43.39565401;-3.819771335;2ª planta;cantabria
114.000 €;;/comprar/casa_adosada-ogarrio-39255916164_106000/;Ogarrio (Ruesga);4 habs.;3 baños;156 m²;"Adosado en ramales ¡Tenemos la vivienda perfecta para ti!

Inmobiliaria mi villa les presenta este bonito adosado en una localidad...";43.2890747;-3.5403956;;cantabria
395.000 €;;/comprar/casa-oruna_de_pielagos-34202956756_511103/;Oruña de Piélagos (Piélagos);4 habs.;2 baños;350 m²;"Santanderhouse. Vende chalet independiente en oruña de pielagos.
Estupenda casa de 350m² construidos en dos alturas, la casa se di...";43.355268701;-3.955148643;;cantabria
