precio;sub_descr;href;ubicacion;habitaciones;banios;mt2;otros;publicado_hace;plataforma;CCAA
635€;Very cool double bedroom in Victoria Eugenia;https://rd.clk.thribee.com/id.-81H1rcrcM/origin.1/section.97/section_type.1/country.es/vertical.homes/iuid.23417trovit-web-6f6984d597-z9klm66a3d8e15b8d8/tracking.%7B%22cmp%22%3A%22u%22%7D/what_d.Malaga/type.2/page.18/cookieid.10200125166a3d8e15b46c9.67953975/pos.22/;29011, Provincia de Málaga;3  habitaciones;1  baños;-;Please note the photos are representative and the layout of the bedrooms may vary. Correct photos of the common areas will be updated as soon as...;Hace 2 días;Rentola;Malaga
20.183€;House in San Pedro de Alcántara, Costa del Sol;https://rd.clk.thribee.com/id.1Z1N1ru1R1C1015/origin.1/section.97/section_type.1/country.es/vertical.homes/iuid.23417trovit-web-6f6984d597-z9klm66a3d8e15b8d8/tracking.%7B%22cmp%22%3A%22u%22%7D/what_d.Malaga/type.2/page.18/cookieid.10200125166a3d8e15b46c9.67953975/pos.23/;29670, San Pedro de Alcántara, Marbella, Provincia de Málaga;4  habitaciones;3  baños;389  m²;...malaga, a 50 km drive, passing more than 15 golfcourses all 18 holes. San pedro de alcantara is a great choice for travellers interested as a...;Hace 2 días;Rentola;Malaga
23.572€;House in Benahavís, Costa del Sol;https://rd.clk.thribee.com/id.21I1dELYo1a/origin.1/section.97/section_type.1/country.es/vertical.homes/iuid.23417trovit-web-6f6984d597-z9klm66a3d8e15b8d8/tracking.%7B%22cmp%22%3A%22u%22%7D/what_d.Malaga/type.2/page.18/cookieid.10200125166a3d8e15b46c9.67953975/pos.24/;29689, Benahavís, Provincia de Málaga;5  habitaciones;6  baños;1.068  m²;Welcome to the highest villa in el paraiso, where you can relax with your family and friends while enjoying panoramic views of the mediterranean...;Hace 2 días;Rentola;Malaga
8.690€;Apartment in San Pedro de Alcántara, Costa del Sol;https://rd.clk.thribee.com/id.3E1Y7a212G/origin.1/section.97/section_type.1/country.es/vertical.homes/iuid.23417trovit-web-6f6984d597-z9klm66a3d8e15b8d8/tracking.%7B%22cmp%22%3A%22u%22%7D/what_d.Malaga/type.2/page.18/cookieid.10200125166a3d8e15b46c9.67953975/pos.25/;29670, San Pedro de Alcántara, Marbella, Provincia de Málaga;3  habitaciones;2  baños;112  m²;...malaga or gibraltar airport, it occupies a fantastic location in the middle everything yet quiet and relaxed. The central point of the town...;Hace 2 días;Rentola;Malaga
15.425€;House in Calahonda, Costa del Sol;https://rd.clk.thribee.com/id.1c17xdB1Rr1R/origin.1/section.97/section_type.1/country.es/vertical.homes/iuid.5188trovit-web-6f6984d597-w4x4566a3d8e53d2d2/tracking.%7B%22cmp%22%3A%22u%22%7D/what_d.Malaga/type.2/page.47/cookieid.102012066a3d8e53cfc40.38165560/pos.1/;Calahonda, Motril, Provincia de Granada;4  habitaciones;3  baños;349  m²;...walk away, or a three minute drive. Malaga airport is just over half an hour away by car. Both marbella and fuengirola are also in easy reach...;Hace 7 días;Rentola;Malaga
2.300€;Middle Floor Apartment in Guadalmina Alta;https://rd.clk.thribee.com/id.1hD1VH1WZ1-f/origin.1/section.97/section_type.1/country.es/vertical.homes/iuid.5188trovit-web-6f6984d597-w4x4566a3d8e53d2d2/tracking.%7B%22cmp%22%3A%22u%22%7D/what_d.Malaga/type.2/page.47/cookieid.102012066a3d8e53cfc40.38165560/pos.2/;29678, Marbella, Provincia de Málaga;3  habitaciones;3  baños;205  m²;Only long term. NO ANIMALS ACCEPTEDWe present to you a magnificent duplex penthouse located in a beautiful private community next to the golf cou...;Hace 7 días;Rentola;Malaga
16.425€;Villa familiar en marbella;https://rd.clk.thribee.com/id.51t1416vY1HG/origin.1/section.97/section_type.1/country.es/vertical.homes/iuid.5188trovit-web-6f6984d597-w4x4566a3d8e53d2d2/tracking.%7B%22cmp%22%3A%22u%22%7D/what_d.Malaga/type.2/page.47/cookieid.102012066a3d8e53cfc40.38165560/pos.3/;29601, Marbella, Provincia de Málaga;5  habitaciones;6  baños;1.450  m²;Capacidad hasta 12 personas. La villa se sitúa en una área residencial de villas. Se encuentra a 2 km de la playa, con despejadas vistas. Parcela...;Hace 7 días;Rentola;Malaga
10.428€;400m del mar en marbella;https://rd.clk.thribee.com/id.1G1v1mp1Z1_1Sz/origin.1/section.97/section_type.1/country.es/vertical.homes/iuid.5188trovit-web-6f6984d597-w4x4566a3d8e53d2d2/tracking.%7B%22cmp%22%3A%22u%22%7D/what_d.Malaga/type.2/page.47/cookieid.102012066a3d8e53cfc40.38165560/pos.4/;29604, Marbella, Provincia de Málaga;3  habitaciones;3  baños;650  m²;Capacidad hasta 6 personas. El chalet se sitúa en una área residencial de villas. Se encuentra a 400m de la playa, con despejadas vistas. Parcela...;Hace 7 días;Rentola;Malaga
19.314€;En marbella a 400m del mar;https://rd.clk.thribee.com/id.Lry9jBNl/origin.1/section.97/section_type.1/country.es/vertical.homes/iuid.5188trovit-web-6f6984d597-w4x4566a3d8e53d2d2/tracking.%7B%22cmp%22%3A%22u%22%7D/what_d.Malaga/type.2/page.47/cookieid.102012066a3d8e53cfc40.38165560/pos.5/;29601, Marbella, Provincia de Málaga;6  habitaciones;6  baños;1.000  m²;Capacidad hasta 14 personas. El chalet se sitúa en una área residencial de villas. Se encuentra a 400 m de la playa, con vistas al mar y al paisa...;Hace 7 días;Rentola;Malaga
;Villa en marbella vistas al mar;https://rd.clk.thribee.com/id.C1aywb1oMO/origin.1/section.97/section_type.1/country.es/vertical.homes/iuid.5188trovit-web-6f6984d597-w4x4566a3d8e53d2d2/tracking.%7B%22cmp%22%3A%22u%22%7D/what_d.Malaga/type.2/page.47/cookieid.102012066a3d8e53cfc40.38165560/pos.6/;29601, Marbella, Provincia de Málaga;4  habitaciones;3  baños;1.800  m²;Capacidad hasta 8 personas. El chalet se sitúa en una área residencial de villas. Se encuentra a 6.5 km de la playa, con vistas al mar y al paisa...;Hace 7 días;Rentola;Malaga
35.652€;En marbella a 50m del mar;https://rd.clk.thribee.com/id.1E6W1N1P3aq/origin.1/section.97/section_type.1/country.es/vertical.homes/iuid.5188trovit-web-6f6984d597-w4x4566a3d8e53d2d2/tracking.%7B%22cmp%22%3A%22u%22%7D/what_d.Malaga/type.2/page.47/cookieid.102012066a3d8e53cfc40.38165560/pos.7/;29601, Marbella, Provincia de Málaga;6  habitaciones;5  baños;890  m²;Capacidad hasta 12 personas. El chalet se sitúa en una área residencial de villas. Se encuentra a 50 m de la playa, con vistas al mar y al paisaj...;Hace 7 días;Rentola;Malaga
20.000€;Superb new contemporary Altos de Los Monteros villa with epic views;https://rd.clk.thribee.com/id.g1_rf1QfI1U/origin.1/section.97/section_type.1/country.es/vertical.homes/iuid.5188trovit-web-6f6984d597-w4x4566a3d8e53d2d2/tracking.%7B%22cmp%22%3A%22u%22%7D/what_d.Malaga/type.2/page.47/cookieid.102012066a3d8e53cfc40.38165560/pos.8/;29604, Marbella, Provincia de Málaga;5  habitaciones;5  baños;1.240  m²;Location: Los Altos de los Monteros, Marbella Este, Marbella, Spain Superb contemporary 5 bedroom villa with spectacular views in Altos de Los Mo...;Hace 7 días;Rentola;Malaga
11.992€;Bella villa en marbella;https://rd.clk.thribee.com/id.J1iX14199B1w/origin.1/section.97/section_type.1/country.es/vertical.homes/iuid.5188trovit-web-6f6984d597-w4x4566a3d8e53d2d2/tracking.%7B%22cmp%22%3A%22u%22%7D/what_d.Malaga/type.2/page.47/cookieid.102012066a3d8e53cfc40.38165560/pos.9/;29604, Marbella, Provincia de Málaga;4  habitaciones;5  baños;260  m²;Capacidad hasta 11 personas. La espaciosa villa tiene 4 dormitorios y 3 baños + 1 ducha abierta + lavabo en el cuarto dormitorio. Piscina privada...;Hace 7 días;Rentola;Malaga
2.200€;Penthouse Duplex in Guadalmina Alta;https://rd.clk.thribee.com/id.0y1E1reE1JK/origin.1/section.97/section_type.1/country.es/vertical.homes/iuid.5188trovit-web-6f6984d597-w4x4566a3d8e53d2d2/tracking.%7B%22cmp%22%3A%22u%22%7D/what_d.Malaga/type.2/page.47/cookieid.102012066a3d8e53cfc40.38165560/pos.10/;29678, Guadalmina, Marbella, Provincia de Málaga;3  habitaciones;3  baños;200  m²;Penthouse Duplex, Guadalmina Alta, Costa del Sol. 3 Bedrooms, 3 Bathrooms, Built 200 m², Terrace 30 m². Setting: Frontline Golf, Close To Shops,...;Hace 7 días;Rentola;Malaga
9.342€;En marbella acogedora villa;https://rd.clk.thribee.com/id.1EY6mNu1N14/origin.1/section.97/section_type.1/country.es/vertical.homes/iuid.5188trovit-web-6f6984d597-w4x4566a3d8e53d2d2/tracking.%7B%22cmp%22%3A%22u%22%7D/what_d.Malaga/type.2/page.47/cookieid.102012066a3d8e53cfc40.38165560/pos.11/;29604, Marbella, Provincia de Málaga;3  habitaciones;3  baños;1.300  m²;Capacidad hasta 7 personas. El chalet se sitúa en una área residencial de villas. Se encuentra a 1.6 km de la playa, con despejadas vistas. Parce...;Hace 7 días;Rentola;Malaga
9.776€;Apartment in Estepona, Costa del Sol;https://rd.clk.thribee.com/id.a91Rz1s9rW/origin.1/section.97/section_type.1/country.es/vertical.homes/iuid.5188trovit-web-6f6984d597-w4x4566a3d8e53d2d2/tracking.%7B%22cmp%22%3A%22u%22%7D/what_d.Malaga/type.2/page.47/cookieid.102012066a3d8e53cfc40.38165560/pos.12/;41702, Estepona, Provincia de Málaga;3  habitaciones;2  baños;127  m²;Available for short term rentals. Welcome to your dream coastal retreat! This spacious, bright, and modern duplex penthouse offers an unparallele...;Hace 7 días;Rentola;Malaga
8.342€;Villa cerca de puerto banús;https://rd.clk.thribee.com/id.181cDDWk165/origin.1/section.97/section_type.1/country.es/vertical.homes/iuid.5188trovit-web-6f6984d597-w4x4566a3d8e53d2d2/tracking.%7B%22cmp%22%3A%22u%22%7D/what_d.Malaga/type.2/page.47/cookieid.102012066a3d8e53cfc40.38165560/pos.13/;29660, Marbella, Provincia de Málaga;4  habitaciones;2  baños;783  m²;Capacidad hasta 8 personas. Villa en Marbella de 2 plantas y con piscina privada. Panorámicas vistas al mar y a la bahía. Con mobiliario funciona...;Hace 7 días;Rentola;Malaga
34.761€;House in Marbella, Costa del Sol;https://rd.clk.thribee.com/id.-1V1v1g1Pwnm/origin.1/section.97/section_type.1/country.es/vertical.homes/iuid.5188trovit-web-6f6984d597-w4x4566a3d8e53d2d2/tracking.%7B%22cmp%22%3A%22u%22%7D/what_d.Malaga/type.2/page.47/cookieid.102012066a3d8e53cfc40.38165560/pos.14/;41702, Marbella, Provincia de Málaga;10  habitaciones;7  baños;470  m²;Live your best life in marbella's golden mile just 100 meters from the world-famous marbella club hotel and 400 meters from the beach, this indep...;Hace 7 días;Rentola;Malaga
13.861€;Villa en marbella cerca del mar;https://rd.clk.thribee.com/id.17GWQ14q1sL/origin.1/section.97/section_type.1/country.es/vertical.homes/iuid.5188trovit-web-6f6984d597-w4x4566a3d8e53d2d2/tracking.%7B%22cmp%22%3A%22u%22%7D/what_d.Malaga/type.2/page.47/cookieid.102012066a3d8e53cfc40.38165560/pos.15/;29601, Marbella, Provincia de Málaga;5  habitaciones;4  baños;600  m²;Capacidad hasta 10 personas. El chalet se sitúa en una área residencial de villas. Se encuentra a 400m de la playa, con despejadas vistas al pais...;Hace 7 días;Rentola;Malaga
6.039€;Cómodo apartamento marbella;https://rd.clk.thribee.com/id.1Xi151p1Gfn1O/origin.1/section.97/section_type.1/country.es/vertical.homes/iuid.5188trovit-web-6f6984d597-w4x4566a3d8e53d2d2/tracking.%7B%22cmp%22%3A%22u%22%7D/what_d.Malaga/type.2/page.47/cookieid.102012066a3d8e53cfc40.38165560/pos.16/;29660, Marbella, Provincia de Málaga;2  habitaciones;2  baños;90  m²;Capacidad hasta 4 personas. El apartamento se sitúa en una urbanización privada. Se encuentra a 2.6 km de playa de Puerto Banús. Se stúa en la pl...;Hace 7 días;Rentola;Malaga
12.166€;Tranquila villa en marbella;https://rd.clk.thribee.com/id.O1a1mJ1T1v1Ll/origin.1/section.97/section_type.1/country.es/vertical.homes/iuid.5188trovit-web-6f6984d597-w4x4566a3d8e53d2d2/tracking.%7B%22cmp%22%3A%22u%22%7D/what_d.Malaga/type.2/page.47/cookieid.102012066a3d8e53cfc40.38165560/pos.17/;29604, Marbella, Provincia de Málaga;4  habitaciones;6  baños;800  m²;Capacidad hasta 8 personas. El chalet se sitúa en una área residencial de villas. Se encuentra a 2.4 km de la playa, con despejadas vistas. Parce...;Hace 7 días;Rentola;Malaga
8.169€;Casa adosada en marbella;https://rd.clk.thribee.com/id.1-F1H1Z1z_Qg/origin.1/section.97/section_type.1/country.es/vertical.homes/iuid.5188trovit-web-6f6984d597-w4x4566a3d8e53d2d2/tracking.%7B%22cmp%22%3A%22u%22%7D/what_d.Malaga/type.2/page.47/cookieid.102012066a3d8e53cfc40.38165560/pos.18/;29660, Marbella, Provincia de Málaga;3  habitaciones;2  baños;200  m²;Capacidad hasta 6 personas. La casa se sitúa en una urbanización privada. Se encuentra a 3 km de Puerto Banús, con despejadas vistas al paisaje....;Hace 7 días;Rentola;Malaga
4.000€;Penthouse Duplex in Benahavís;https://rd.clk.thribee.com/id.D1rHO1A1y4r/origin.1/section.97/section_type.1/country.es/vertical.homes/iuid.5188trovit-web-6f6984d597-w4x4566a3d8e53d2d2/tracking.%7B%22cmp%22%3A%22u%22%7D/what_d.Malaga/type.2/page.47/cookieid.102012066a3d8e53cfc40.38165560/pos.19/;29679, Benahavís, Provincia de Málaga;3  habitaciones;2  baños;155  m²;Stunning Duplex Penthouse in Capanes del Golf. Your Dream Home Awaits! Property Overview: Welcome to your perfect oasis in Capanes del Golf, a lu...;Hace 7 días;Rentola;Malaga
2.804€;Calle Victoria, Malaga - Amsterdam Apartments for Rent;https://rd.clk.thribee.com/id.k1zyaIR1e1y/origin.1/section.97/section_type.1/country.es/vertical.homes/iuid.5188trovit-web-6f6984d597-w4x4566a3d8e53d2d2/tracking.%7B%22cmp%22%3A%22u%22%7D/what_d.Malaga/type.2/page.47/cookieid.102012066a3d8e53cfc40.38165560/pos.20/;29012, Provincia de Málaga;2  habitaciones;1  baños;646  m²;...Malaga. Flatscreen TV. Hairdryer. Towels and sheets. Air conditioning. Iron. Washing machine. Cooking utensils. Toaster. Microwave...;Hace 7 días;Rentola;Malaga
2.000€;Cozy Stay Malaga;https://rd.clk.thribee.com/id.Z1Wj1A1M1YJk/origin.1/section.97/section_type.1/country.es/vertical.homes/iuid.5188trovit-web-6f6984d597-w4x4566a3d8e53d2d2/tracking.%7B%22cmp%22%3A%22u%22%7D/what_d.Malaga/type.2/page.47/cookieid.102012066a3d8e53cfc40.38165560/pos.21/;29007, Provincia de Málaga;4  habitaciones;-;132  m²;Apartment in Calle Peso de la Harina Available from: Book now: Min. Stay: 1 Max. Stay: 12 Deposit: 500 Contract closing costs: Cleaning fee: 90€...;Hace 7 días;Rentola;Malaga
9.776€;Acogedor chalet en marbella;https://rd.clk.thribee.com/id.91t16DqLPd/origin.1/section.97/section_type.1/country.es/vertical.homes/iuid.5188trovit-web-6f6984d597-w4x4566a3d8e53d2d2/tracking.%7B%22cmp%22%3A%22u%22%7D/what_d.Malaga/type.2/page.47/cookieid.102012066a3d8e53cfc40.38165560/pos.22/;29601, Marbella, Provincia de Málaga;5  habitaciones;5  baños;600  m²;Capacidad hasta 10 personas. El chalet se sitúa en una área residencial de villas. Se encuentra a 2.5 km de la playa, con despejadas vistas. Parc...;Hace 7 días;Rentola;Malaga
3.000€;2 dormitorio, Málaga 29013 1ES78126-;https://rd.clk.thribee.com/id.1-K8uZ1121Z/origin.1/section.97/section_type.1/country.es/vertical.homes/iuid.5188trovit-web-6f6984d597-w4x4566a3d8e53d2d2/tracking.%7B%22cmp%22%3A%22u%22%7D/what_d.Malaga/type.2/page.47/cookieid.102012066a3d8e53cfc40.38165560/pos.23/;29013, Málaga, Provincia de Málaga;2  habitaciones;-;-;...Esta casa se encuentra en Málaga Málaga 29013. Tiene 2 dormitorios. Esta 2 dormitorio apartamentos en Málaga Málaga es para alquilar por 3000...;Hace 7 días;Listanza;Malaga
390€;1 dormitorio, Málaga 29010 1ES78678-;https://rd.clk.thribee.com/id.74ES551v1v/origin.1/section.97/section_type.1/country.es/vertical.homes/iuid.5188trovit-web-6f6984d597-w4x4566a3d8e53d2d2/tracking.%7B%22cmp%22%3A%22u%22%7D/what_d.Malaga/type.2/page.47/cookieid.102012066a3d8e53cfc40.38165560/pos.24/;29010, Málaga, Provincia de Málaga;1  habitaciones;1  baños;-;...casa se encuentra en Málaga Málaga 29010. Tiene 1 dormitorio, 1 baño. Esta 1 dormitorio apartamentos en Málaga Málaga es para alquilar por 390...;Hace 7 días;Listanza;Malaga
2.800€;Málaga 29012 1ES78668-;https://rd.clk.thribee.com/id.11zM191OE1UA/origin.1/section.97/section_type.1/country.es/vertical.homes/iuid.5188trovit-web-6f6984d597-w4x4566a3d8e53d2d2/tracking.%7B%22cmp%22%3A%22u%22%7D/what_d.Malaga/type.2/page.47/cookieid.102012066a3d8e53cfc40.38165560/pos.25/;29012, Málaga, Provincia de Málaga;-;-;-;...Esta casa se encuentra en Málaga Málaga 29012. Tiene 0 dormitorio. Esta 0 dormitorio apartamentos en Málaga Málaga es para alquilar por 2800...;Hace 7 días;Listanza;Malaga
2.500€;Penthouse Duplex in San Pedro de Alcántara;https://rd.clk.thribee.com/id.1rM-1K1Z1f2s/origin.1/section.97/section_type.1/country.es/vertical.homes/iuid.32243trovit-web-6f6984d597-527lq66a3d8e9c2ca5/tracking.%7B%22cmp%22%3A%22u%22%7D/what_d.Malaga/type.2/page.14/cookieid.102012066a3d8e9c256d5.85194804/pos.1/;29670, San Pedro de Alcántara, Marbella, Provincia de Málaga;3  habitaciones;2  baños;112  m²;...Malaga or Gibraltar airport, it occupies a fantastic location in the middle everything yet quiet and relaxed. The central point of the town...;Hace 1 día;Rentola;Malaga
1.500€;Espectacular Ático en Alquiler en el Encantador Pueblo de Be;https://rd.clk.thribee.com/id.C1_1R14851a9/origin.1/section.232/section_type.2/country.es/vertical.homes/iuid.32243trovit-web-6f6984d597-527lq66a3d8e9c2ca5/tracking.%7B%22cmp%22%3A%22u%22%7D/what_d.Malaga/type.2/page.14/cookieid.102012066a3d8e9c256d5.85194804/pos.1/;29679, Costa del Sol, Dos Hermanas, Provincia de Sevilla;3 habitaciones;2 baños;239 m²;Disponible para corta temporada jul-agos. Larga temporada disponible a partir de septiembre. Este espacioso apartamento de tres habitaciones ofre...;Hace 5 días;Vadevender;Malaga
6.000€;Villa / Chalet de lujo 414 m2 en alquiler, Marbella, España;https://rd.clk.thribee.com/id.N1wU1b1M1q1F1z/origin.1/section.232/section_type.2/country.es/vertical.homes/iuid.32243trovit-web-6f6984d597-527lq66a3d8e9c2ca5/tracking.%7B%22cmp%22%3A%22u%22%7D/what_d.Malaga/type.2/page.14/cookieid.102012066a3d8e9c256d5.85194804/pos.2/;29660, Marbella, Provincia de Málaga;-;5 baños;414 m²;Villa en segunda línea de playa a poca distancia de Puerto Banús, la Milla de Oro Villa contemporánea junto a la playa en venta en una ubicación...;Hace 6 días;LuxuryEstate;Malaga
450€;Maison de Campagne en Sedella;https://rd.clk.thribee.com/id.n1hH1Sz1PUw/origin.1/section.97/section_type.1/country.es/vertical.homes/iuid.32243trovit-web-6f6984d597-527lq66a3d8e9c2ca5/tracking.%7B%22cmp%22%3A%22u%22%7D/what_d.Malaga/type.2/page.14/cookieid.102012066a3d8e9c256d5.85194804/pos.2/;29715, Sedella, Provincia de Málaga;1  habitaciones;1  baños;50  m²;Casa en Sedella, con 1 dormitorio y 1 cuarto de baño. 50 m 2 de superficie útil, ofreciendo un espacio muy amplio para sus necesidades. Este inmu...;Hace 1 día;Rentola;Malaga
5.900€;Apartamento Planta Media;https://rd.clk.thribee.com/id.VJ1h1Tpg1fp/origin.1/section.97/section_type.1/country.es/vertical.homes/iuid.32243trovit-web-6f6984d597-527lq66a3d8e9c2ca5/tracking.%7B%22cmp%22%3A%22u%22%7D/what_d.Malaga/type.2/page.14/cookieid.102012066a3d8e9c256d5.85194804/pos.3/;29601, Provincia de Málaga;3  habitaciones;2  baños;264  m²;Este impresionante apartamento de lujo se encuentra en la exclusiva Playa de la Fontanilla en Marbella, Málaga. Con una superficie total de...;Hace 1 día;Rentola;Malaga
2.200€;Penthouse in Benahavís;https://rd.clk.thribee.com/id.1cGucN1e1e1/origin.1/section.97/section_type.1/country.es/vertical.homes/iuid.32243trovit-web-6f6984d597-527lq66a3d8e9c2ca5/tracking.%7B%22cmp%22%3A%22u%22%7D/what_d.Malaga/type.2/page.14/cookieid.102012066a3d8e9c256d5.85194804/pos.4/;29679, Benahavís, Provincia de Málaga;3  habitaciones;2  baños;242  m²;Amazing 3 bedroom duplex-penthouse decorated with a Scandinavian style, panoramic views to the sea and the mountain. *Available from 1 of Novembe...;Hace 1 día;Rentola;Malaga
1.900€;Alquiler ático en benalmádena;https://rd.clk.thribee.com/id.1V9KGx1C1f1D/origin.1/section.97/section_type.1/country.es/vertical.homes/iuid.32243trovit-web-6f6984d597-527lq66a3d8e9c2ca5/tracking.%7B%22cmp%22%3A%22u%22%7D/what_d.Malaga/type.2/page.14/cookieid.102012066a3d8e9c256d5.85194804/pos.5/;29639,;2  habitaciones;2  baños;101  m²;...comunicado en transporte público como privado, lo que permite una excelente conexión con Málaga capital y con las localidades del entorno...;Hace 1 día;Rentola;Malaga
1.100€;Apartamento en Torrox Costa, Zona Duna Beach, alquiler;https://rd.clk.thribee.com/id.1t1D1P1X111N1P1b/origin.1/section.97/section_type.1/country.es/vertical.homes/iuid.32243trovit-web-6f6984d597-527lq66a3d8e9c2ca5/tracking.%7B%22cmp%22%3A%22u%22%7D/what_d.Malaga/type.2/page.14/cookieid.102012066a3d8e9c256d5.85194804/pos.6/;Málaga, Provincia de Málaga;1  habitaciones;1  baños;45  m²;Quieres vivir en primera línea de la playa? Magnifico apartamento muy luminoso de nueva construcción en Torrox-Costa. Alquiler de larga temporada...;Hace 1 día;Kuhamia;Malaga
3.000€;Middle Floor Apartment in San Pedro de Alcántara;https://rd.clk.thribee.com/id.U1t7Nlk121q/origin.1/section.97/section_type.1/country.es/vertical.homes/iuid.32243trovit-web-6f6984d597-527lq66a3d8e9c2ca5/tracking.%7B%22cmp%22%3A%22u%22%7D/what_d.Malaga/type.2/page.14/cookieid.102012066a3d8e9c256d5.85194804/pos.7/;29670, San Pedro de Alcántara, Marbella, Provincia de Málaga;3  habitaciones;3  baños;150  m²;AVAILABLE FROM SEPTEMBER UNTIL THE END OF JUNE 2025Nice decorated first floor apartment located in a gated complex first line of San Pedro de Alc...;Hace 1 día;Rentola;Malaga
1.500€;Apartment For Rent in Puerto Banús, Marbella;https://rd.clk.thribee.com/id.1a61ps1lzlE/origin.1/section.97/section_type.1/country.es/vertical.homes/iuid.32243trovit-web-6f6984d597-527lq66a3d8e9c2ca5/tracking.%7B%22cmp%22%3A%22u%22%7D/what_d.Malaga/type.2/page.14/cookieid.102012066a3d8e9c256d5.85194804/pos.8/;29660, Marbella, Provincia de Málaga;2  habitaciones;2  baños;145  m²;Magnificent flat in the Jardines de Aldaba residential development a luxury flat with a very pleasant layout, fully furnished the urbanization in...;Hace 1 día;Rentola;Malaga
3.250€;Penthouse For Rent in Puerto Banús, Marbella;https://rd.clk.thribee.com/id.1t1li1F161N_N/origin.1/section.97/section_type.1/country.es/vertical.homes/iuid.32243trovit-web-6f6984d597-527lq66a3d8e9c2ca5/tracking.%7B%22cmp%22%3A%22u%22%7D/what_d.Malaga/type.2/page.14/cookieid.102012066a3d8e9c256d5.85194804/pos.9/;29660, Marbella, Provincia de Málaga;4  habitaciones;3  baños;235  m²;Magnificent Penthouse Duplex available with or without furniture urbanization Embrujo Playa near paseo maritimo, Mitoyen to the shopping centre o...;Hace 1 día;Rentola;Malaga
1.000€;Gran casa con Piscina, garajes y salida a tres calles a 10 min de Ronda;https://rd.clk.thribee.com/id.1h-5w141v1Rm/origin.1/section.97/section_type.1/country.es/vertical.homes/iuid.32243trovit-web-6f6984d597-527lq66a3d8e9c2ca5/tracking.%7B%22cmp%22%3A%22u%22%7D/what_d.Malaga/type.2/page.14/cookieid.102012066a3d8e9c256d5.85194804/pos.10/;29350,;3  habitaciones;5  baños;500  m²;...Málaga y Sevilla. Para más información sobre casas amplias con piscina cerca de Ronda consultar Domus gestión inmobiliaria y le atenderemos...;Hace 1 día;Rentola;Malaga
3.900€;Penthouse For Rent in Puerto Banús, Marbella;https://rd.clk.thribee.com/id.f1o1OvD1s1Y6/origin.1/section.97/section_type.1/country.es/vertical.homes/iuid.32243trovit-web-6f6984d597-527lq66a3d8e9c2ca5/tracking.%7B%22cmp%22%3A%22u%22%7D/what_d.Malaga/type.2/page.14/cookieid.102012066a3d8e9c256d5.85194804/pos.11/;29660, Marbella, Provincia de Málaga;4  habitaciones;3  baños;290  m²;Fantastic four bedroom duplex penthouse near the sea in a guard gated luxury complexthe property has been immaculatly furnished to the highest st...;Hace 1 día;Rentola;Malaga
6.500€;Villa For Rent in Puerto Banús, Marbella;https://rd.clk.thribee.com/id.1o11va1m1Uq1a/origin.1/section.97/section_type.1/country.es/vertical.homes/iuid.32243trovit-web-6f6984d597-527lq66a3d8e9c2ca5/tracking.%7B%22cmp%22%3A%22u%22%7D/what_d.Malaga/type.2/page.14/cookieid.102012066a3d8e9c256d5.85194804/pos.12/;29660, Marbella, Provincia de Málaga;5  habitaciones;5  baños;380  m²;Magnificent renovated villa with furniture in Altalaya Rio Verde urbanization Close to Aloha Nueva Andalucia and Puerto Banus close to all amenit...;Hace 1 día;Rentola;Malaga
9.000€;Villa For Rent in Este - El Rosario, Marbella;https://rd.clk.thribee.com/id.11u191y6-iV/origin.1/section.97/section_type.1/country.es/vertical.homes/iuid.32243trovit-web-6f6984d597-527lq66a3d8e9c2ca5/tracking.%7B%22cmp%22%3A%22u%22%7D/what_d.Malaga/type.2/page.14/cookieid.102012066a3d8e9c256d5.85194804/pos.13/;29604, Marbella, Provincia de Málaga;5  habitaciones;4  baños;350  m²;"WE DON'T RENT FOR SHORT PERIODS""""WE ONLY RENT FOR LONG PERIODS OF TIME"" Availability from September magnificent ultra-modern villa with all ameni...";Hace 1 día;Rentola;Malaga
2.650€;Flat For Rent in Puerto Banús, Marbella;https://rd.clk.thribee.com/id.yC141z1814111U/origin.1/section.97/section_type.1/country.es/vertical.homes/iuid.32243trovit-web-6f6984d597-527lq66a3d8e9c2ca5/tracking.%7B%22cmp%22%3A%22u%22%7D/what_d.Malaga/type.2/page.14/cookieid.102012066a3d8e9c256d5.85194804/pos.14/;29660, Marbella, Provincia de Málaga;2  habitaciones;2  baños;190  m²;Urbanization Ventura del Mar Gardens Long Term Furnished Season Fully Furnished Luxury and Modern2 Bedrooms (one of them en suite) 2 full and ful...;Hace 1 día;Rentola;Malaga
