precio;sub_descr;href;ubicacion;habitaciones;banios;mt2;planta;otros;latitude;longitude;CCAA
510.000 竄ｬ;Finca rﾃｺstica en Benalup-Casas Viejas;/comprar/finca_rustica-benalup_casas_viejas_centro_urbano-41708845859_105600/;Benalup-Casas Viejas;2 habs.;2 baﾃｱos;195 mﾂｲ;;"Descripciﾃｳn del objeto:
Preciosa finca de 4,6 ha con casa y 2 naves grandes (ideal para amantes de los caballos)

-	~ 46.000 mﾂｲ te...";36.3498354;-5.8067525;cadiz
305.000 竄ｬ;Casa unifamiliar en calle Viento del Sur;/comprar/casa_unifamiliar-la_jara_distrito-44222879996_100200/;La Jara (Sanlﾃｺcar de Barrameda);;2 baﾃｱos;150 mﾂｲ;;"Casa con jardin en la jara.
Os traemos esta magnifica casa con jardin, situada en la c/viento del sur, la zona mas conocida como l...";36.7693282;-6.3697595;cadiz
199.000 竄ｬ;Piso en Canarias;/comprar/piso-conil_de_la_frontera_centro_urbano-28359897271_100500/;Conil de la Frontera;3 habs.;1 baﾃｱo;101 mﾂｲ;1ﾂｪ planta;Nueva generaciﾃｳn 2020 les ofrece un piso en primera planta en una de las zonas mas demandadas de conil de la frontera(canarias) do...;36.279075;-6.0875337;cadiz
800.000 竄ｬ;Chalet en Pedanias;/comprar/chalet-rural11570-33421110907_100500/;Rural (Jerez de la Frontera);6 habs.;5 baﾃｱos;542 mﾂｲ;;Preciosa finca de 12500mt2 en la barca de la florida, pedanﾃｭa de jerez de la frontera. A tan sﾃｳlo 10 minutos de jerez, esta bonita...;36.6522672;-5.9573006;cadiz
139.900 竄ｬ;Casa en Avenida de Cristﾃｳbal Colﾃｳn;/comprar/casa-centro_zona_noreste-43432091699_100500/;Centro-Zona Noreste (Chipiona);3 habs.;2 baﾃｱos;115 mﾂｲ;;ﾂ｡2 x 1! Extraordinarias vivienda en una misma finca con entradas independientes. La casa la cual da fachada a la calle dispone de ...;36.729157;-6.4232319;cadiz
800.000 竄ｬ;Chalet en Montealto;/comprar/chalet-jerez_de_la_frontera_norte11407-17511767993_103800/;Norte (Jerez de la Frontera);7 habs.;4 baﾃｱos;300 mﾂｲ;;Bonito chalet en una de las zonas mﾃ｡s exclusivas de montealto. Un entorno idﾃｭlico, tranquilo, cﾃｩntrico. Comodidad y ambiente relaj...;36.7055838;-6.1295789;cadiz
A consultar;Piso en calle de Santa Ana, 5;/comprar/piso-nucleo_urbano_urbanizaciones-38369645143_100500/;Nﾃｺcleo Urbano-Urbanizaciones (Chiclana de la Frontera);2 habs.;2 baﾃｱos;85 mﾂｲ;Bajo;ﾂ｡Atenciﾃｳn! Tenemos una nueva oferta especial que no te puedes perder. Presentamos nuestro prﾃｳximo edificio plurifamiliar de 8 vivi...;36.4166;-6.14888;cadiz
184.500 竄ｬ;Casa adosada en calle Cabo de Rocas,  4;/comprar/casa_adosada-rinconcillo-4611877192_109700/;Rinconcillo (Algeciras);3 habs.;;;;V11. Casa adosada de obra nueva, y ubicada en la zona de Algeciras.  Estﾃ｡ distribuida en 3 habitaciones y terraza. Incluye extras como garaje y trastero.;36,1582;-5,45605;cadiz
330.000 竄ｬ;Casa adosada en calle de Cristo de la Sentencia;/comprar/casa_adosada-chipiona_la_laguna-45039063226_992948/;La Laguna (Chipiona);4 habs.;2 baﾃｱos;94 mﾂｲ;;Magnﾃｭfica casa adosada junto al santuario y a 50 metros de la playa de regla. Consta de tres plantas que se distribuyen en planta ...;36.728241005;-6.437641736;cadiz
280.000 竄ｬ;Casa en Este;/comprar/casa-este11406-45899495018_100500/;Este (Jerez de la Frontera);3 habs.;3 baﾃｱos;258 mﾂｲ;;"Casa en muy buena zona que cuenta con planta baja totalmente diﾃ｡fana con dos baﾃｱos y patio donde poder montar su negocio.
La vivie...";36.687839;-6.109663;cadiz
1.800.000 竄ｬ;Finca rﾃｺstica en Jimena de la Frontera;/comprar/finca_rustica-jimena_de_la_frontera_centro_urbano-25026435816_105600/;Jimena de la Frontera;7 habs.;7 baﾃｱos;700 mﾂｲ;;"Descripciﾃｳn del objeto:
Andalusia, provinz cadiz, jimena de la frontera
Finca preciosa con piscina, 2 casas y cuadras para caballo...";36.43928016;-5.455949113;cadiz
290.000 竄ｬ;Casa en Camino Pista de Montijo, 5;/comprar/casa-centro_zona_noreste-38413699375_990821/;Centro-Zona Noreste (Chipiona);3 habs.;2 baﾃｱos;166 mﾂｲ;;"Si busca una casa,ubicada en una parcela de 1460, dﾃｳnde podrﾃ｡ tener infinidad de opciones, aquﾃｭ tiene una oportunidad.

Amplia cas...";36.75710889672159;-6.404359155073305;cadiz
450.000 竄ｬ;Chalet en Sanlﾃｺcar de Barrameda;/comprar/chalet-la_jara_distrito-40899031790_100500/;La Jara (Sanlﾃｺcar de Barrameda);6 habs.;4 baﾃｱos;306 mﾂｲ;;"Fantﾃ｡stica vivienda en una de las mejores y mﾃ｡s demandadas zonas de sanlﾃｺcar de barrameda. 
Vivienda lista para entrar a vivir, se...";36.7721528;-6.3679262;cadiz
275.000 竄ｬ;Casa adosada en calle Mar Adriﾃ｡tico, 5;/comprar/casa_adosada-costa_de_sancti_petri_playa_de_la_barrosa11139-42519305028_100500/;Costa de Sancti Petri-Playa de La Barrosa (Chiclana de la Frontera);2 habs.;2 baﾃｱos;60 mﾂｲ;;Descubre este hermoso adosado, recientemente renovado, ubicado en la prestigiosa urbanizaciﾃｳn doﾃｱa violeta. Perfecto como segunda ...;36.3787;-6.18308;cadiz
255.000 竄ｬ;Casa adosada en Caseria;/comprar/casa_adosada-caseria_de_ossio_san_carlos11100-45847370754_100500/;Caserﾃｭa de Ossio-San Carlos (San Fernando);3 habs.;2 baﾃｱos;210 mﾂｲ;;Vivienda situada en residencial en la zona de la playa de la caserﾃｭa de san fernando, consta de porche de entrada, salﾃｳn independi...;36.483426841;-6.196830358;cadiz
159.900 竄ｬ;Piso en calle General Florencio Montojo;/comprar/piso-la_pastora_zona_de_la_estacion11100-43394241781_100500/;La Pastora-Zona de la Estaciﾃｳn (San Fernando);3 habs.;1 baﾃｱo;98 mﾂｲ;Bajo;ﾂ｡Atenciﾃｳn amantes del confort y la accesibilidad en san fernando! 沛｡笨ｨ esta joya inmobiliaria acaba de aterrizar en el mercado y ﾂ｡N...;36.4709424;-6.1933637;cadiz
270.000 竄ｬ;Piso en El Parque;/comprar/piso-el_cristo_cayetano_roldan11100-43403857903_103800/;El Cristo-Cayetano Roldﾃ｡n (San Fernando);4 habs.;2 baﾃｱos;129 mﾂｲ;4ﾂｪ planta;No pierda esta magnﾃｭfica oportunidad. Cﾃｩntrico piso muy soleado!!! Con inmejorable ubicaciﾃｳn, situada en una de las mejores zonas ...;36.4663475;-6.2000394;cadiz
325.000 竄ｬ;Chalet en Arcos de La Frontera;/comprar/chalet-arcos_de_la_frontera_centro_urbano-31748574366_103800/;Arcos de la Frontera;2 habs.;1 baﾃｱo;136 mﾂｲ;;Te ofrecemos este chalet en una de las sierras mﾃ｡s bonitas y con mﾃ｡s encanto de la zona de cﾃ｡diz. Se encuentra situada en arcos de...;36.7642869;-5.7753329;cadiz
450.000 竄ｬ;Casa en Centro;/comprar/casa-el_puerto_de_santa_maria_centro-42523822366_100500/;Centro (El Puerto de Santa Marﾃｭa);6 habs.;4 baﾃｱos;343 mﾂｲ;;Se vende, edificio entero dividido tres plantas,  dos viviendas independientes, en total tres plantas, planta baja es un local que...;36.6023574;-6.2234663;cadiz
159.640 竄ｬ;Piso en calle Calzada de La Infanta,  22;/comprar/piso-centro_calzada-4598218376_109700/;Centro-Calzada (Sanlﾃｺcar de Barrameda);2 habs.;1 baﾃｱo;75 mﾂｲ;1ﾂｪ planta;Vivienda 6. Piso en un inmueble de obra nueva de 75 mﾂｲ de superficie construida y situado en la zona de sanlﾃｺcar de barrameda, aco...;36.7794;-6.35905;cadiz
680.000 竄ｬ;Casa en calle de la Sirena, 1;/comprar/casa-zahara_de_los_atunes-43364229118_515011/;Zahara de los Atunes (Barbate);5 habs.;5 baﾃｱos;220 mﾂｲ;;"Excelente casa en pleno centro de zahara de los atunes.

Esta casa se encuentra totalmente reformada, ya que se trata de un inmueb...";36.13651;-5.8458858;cadiz
149.500 竄ｬ;Piso en calle de la Batalla del Ebro,  s/n;/comprar/piso-caseria_de_ossio_san_carlos11100-4567215696_109700/;Caserﾃｭa de Ossio-San Carlos (San Fernando);2 habs.;2 baﾃｱos;70 mﾂｲ;Bajo;P2 bajo b. Piso en un edificio de obra nueva de 70 mﾂｲ de superficie construida y ubicado en la zona de soto de la vega, enclavado ...;36.47723868;-6.198001734;cadiz
460.000 竄ｬ;Dﾃｺplex en calle de la Sierra del Retﾃｭn,  s/n;/comprar/duplex-zahara_de_los_atunes-4444989816_109700/;Zahara de los Atunes (Barbate);3 habs.;3 baﾃｱos;145 mﾂｲ;Bajo;Dﾃｺplex en un edificio de obra nueva de 145 mﾂｲ de superficie construida y ubicado en la zona de zaragoza capital, enclavado en plan...;36.1354248;-5.8412992;cadiz
177.000 竄ｬ;ﾃ》ico en calle de Manuel Rances;/comprar/atico-el_mentidero_teatro_falla_alameda11004-41676804991_100500/;El Mentidero-Teatro Falla-Alameda (Cﾃ｡diz Capital);1 hab.;1 baﾃｱo;60 mﾂｲ;;"Atico en el centro de cadiz, con licencia turistica, y funcionando actualmente como apartamento turﾃｭstico. 

 Este apartamento con...";36.5353;-6.29455;cadiz
95.000 竄ｬ;Casa en *Centro;/comprar/casa-medina_sidonia_centro_urbano-43345824242_100500/;Medina Sidonia;2 habs.;2 baﾃｱos;61 mﾂｲ;;"Del valle inmobiliaria os ofrece en exclusiva esta oportunidad de negocio en medina sidonia.

Se trata de dos apartamentos totalme...";36.4576962;-5.9293987;cadiz
120.000 竄ｬ;Piso en calle de la Virgen del Perpetuo Socorro;/comprar/piso-centro_zona_noreste-43416328073_100500/;Centro-Zona Noreste (Chipiona);3 habs.;1 baﾃｱo;75 mﾂｲ;4ﾂｪ planta;Precioso piso en 4ﾂｺ planta con la instalaciﾃｳn de ascensor aprobada por la comunidad junto a la aceptaciﾃｳn de presupuesto y financi...;36.73925256;-6.42813871;cadiz
330.000 竄ｬ;Piso en Playa de Santa Marﾃｭa del Mar-Bahﾃｭa Blanca;/comprar/piso-playa_de_santa_maria_del_mar_bahia_blanca-40933221423_501539/;Playa de Santa Marﾃｭa del Mar-Bahﾃｭa Blanca (Cﾃ｡diz Capital);3 habs.;1 baﾃｱo;102 mﾂｲ;3ﾂｪ planta;Piso muy alegre, luminoso y soleado, totalmente exterior. Situado en una de las mejores zonas, cerca de los colegios mas solicitad...;36.517364133;-6.283285883;cadiz
249.000 竄ｬ;Casa adosada en Rural;/comprar/casa_adosada-rural11406-40926823656_101800/;Rural (Jerez de la Frontera);3 habs.;2 baﾃｱos;185 mﾂｲ;;Adosado zona cartuja. Primeras calidades, patio delantero de unos 17 mﾂｲ, distribuciﾃｳn en planta baja con amplio salﾃｳn comedor con ...;36.6638113;-6.1161712;cadiz
870.000 竄ｬ;Casa en Regla;/comprar/casa-centro_zona_playas-42592893833_100500/;Centro-Zona Playas (Chipiona);9 habs.;6 baﾃｱos;386 mﾂｲ;;"Casa chalet independiente

Parcela de 788mﾂｲ con casa edificada de 386mﾂｲ, consta de recibidor, patio interior, 3 cocinas totalmente...";36.737439036;-6.441924185;cadiz
139.990 竄ｬ;Piso en Casco Histﾃｳrico;/comprar/piso-centro_calzada-30010140555_100500/;Centro-Calzada (Sanlﾃｺcar de Barrameda);2 habs.;1 baﾃｱo;70 mﾂｲ;1ﾂｪ planta;Od1012. ﾂ｡Estﾃ｡s a punto de descubrir tu nuevo hogar! Este moderno piso estﾃ｡ ubicado en una zona residencial privada y tranquila en ...;36.7763898;-6.3513248;cadiz
479.900 竄ｬ;Chalet en Los Naveros;/comprar/chalet-vejer_de_la_frontera_centro_urbano-39174034621_100500/;Vejer de la Frontera;5 habs.;2 baﾃｱos;268 mﾂｲ;;"Chalet urbano con en los naveros

El chalet cuenta con 720 mﾂｲ aprox de parcela, 268 mﾂｲ construidos aprox y 234 mﾂｲ ﾃｺtiles aprox

Pr...";36.3576097;-5.9755054;cadiz
245.000 竄ｬ;Chalet en Pelagatos - Pago del Humo;/comprar/chalet-pago_del_humo_poligono_de_pelagatos-42533335039_100500/;Pago del Humo-Polﾃｭgono de Pelagatos (Chiclana de la Frontera);4 habs.;3 baﾃｱos;120 mﾂｲ;;"Chiclana de la frontera 
Zona caﾃｱada de la asomada
Pago del humo.
Si quiere disfrutar de la naturaleza con todas las comodidades d...";36.4551113;-6.1418158;cadiz
250.000 竄ｬ;ﾃ》ico en Centro;/comprar/atico-el_mentidero_teatro_falla_alameda11003-42525936749_100500/;El Mentidero-Teatro Falla-Alameda (Cﾃ｡diz Capital);2 habs.;2 baﾃｱos;80 mﾂｲ;;Inmobiliaria vivencadiz os presenta este espectacular ﾃ｡tico, ubicado en una de las mejores zonas del centro, te ofrece un estilo d...;36.5353575;-6.2982215;cadiz
254.990 竄ｬ;ﾃ》ico en La Laguna;/comprar/atico-chipiona_la_laguna-36751470113_100500/;La Laguna (Chipiona);2 habs.;2 baﾃｱos;136 mﾂｲ;;Od622. ﾂｿSueﾃｱas con vivir en un espacio ﾃｺnico, con vistas espectaculares y todas las comodidades del mundo? ﾂ｡Este ﾃ｡tico es tu oport...;36.7200591;-6.4336742;cadiz
79.000 竄ｬ;Piso en Oeste;/comprar/piso-jerez_de_la_frontera_oeste11407-36684780699_100200/;Oeste (Jerez de la Frontera);3 habs.;1 baﾃｱo;76 mﾂｲ;;"Piso en bda. San benito.
ﾂ｡ Ubicado en planta baja !
Estupendo piso compuesto de 3 dormitorios, amplio salﾃｳn-comedor con terraza in...";36.7010769;-6.1372231;cadiz
330.000 竄ｬ;Chalet en Carboneros;/comprar/chalet-nucleo_urbano_urbanizaciones-45853133787_100500/;Nﾃｺcleo Urbano-Urbanizaciones (Chiclana de la Frontera);3 habs.;1 baﾃｱo;206 mﾂｲ;;Chalet en chiclana situado en la zona del almendral, a 1,5 km del centro de la ciudad y a 5 km de la playa la barrosa, cercano a s...;36.4087777;-6.1652036;cadiz
330.000 竄ｬ;Piso en Segunda Aguada;/comprar/piso-la_paz_segunda_aguado_loreto11012-43346016124_100500/;La Paz-Segunda Aguado-Loreto (Cﾃ｡diz Capital);5 habs.;2 baﾃｱos;120 mﾂｲ;1ﾂｪ planta;Vivencadiz le ofrece ﾃｩste fantﾃ｡stico piso en venta en cﾃ｡diz en la zona de segunda aguada. Una de las mejores zonas de la capital, ...;36.5122208;-6.2754677;cadiz
100.800 竄ｬ;Piso en El Carmen;/comprar/piso-san_fernando_el_carmen-45068721049_100200/;El Carmen (San Fernando);3 habs.;1 baﾃｱo;70 mﾂｲ;;Zona falla. Piso en perfecto estado ubicado en una segunda planta que consta de 70 mﾂｲ construidos y se distribuye en tres dormitor...;36.4594758;-6.1987741;cadiz
460.000 竄ｬ;Dﾃｺplex en calle de la Sierra del Retﾃｭn,  s/n;/comprar/duplex-zahara_de_los_atunes-4444989816_109700/;Zahara de los Atunes (Barbate);3 habs.;3 baﾃｱos;145 mﾂｲ;Bajo;Dﾃｺplex en un edificio de obra nueva de 145 m2 de superficie construida y ubicado en la zona de Zaragoza Capital, enclavado en planta baja. Estﾃ｡ distribuido en 3 habitaciones, 3 baﾃｱos completos y terraza. Incluye extras como ascensor, garaje y trastero.;36,1354248;-5,8412992;cadiz
200.000 竄ｬ;ﾃ》ico en Norte;/comprar/atico-jerez_de_la_frontera_norte11407-41748252151_101800/;Norte (Jerez de la Frontera);3 habs.;2 baﾃｱos;103 mﾂｲ;;ﾃ》ico en en urbanizaciﾃｳn privada en zona norte. La vivienda se distribuye en vestﾃｭbulo de entrada, salﾃｳn comedor con acceso a terr...;36.7110989;-6.106683;cadiz
439.900 竄ｬ;Casa en calle de Isaac Peral, 39;/comprar/casa-centro_zona_playas-40843418194_100500/;Centro-Zona Playas (Chipiona);7 habs.;5 baﾃｱos;209 mﾂｲ;;En exclusiva! Magnﾃｭfica vivienda totalmente independiente dividida en 5 apartamentos de los cuales 3 de ellos estﾃ｡n en planta baja...;36.7393;-6.43553;cadiz
265.000 竄ｬ;Piso en Avenida de las Piletas, 109;/comprar/piso-sanlucar_de_barrameda_las_piletas-40902173590_990821/;Las Piletas (Sanlﾃｺcar de Barrameda);3 habs.;2 baﾃｱos;98 mﾂｲ;Principal;ﾂ｡Increﾃｭble oportunidad en primera lﾃｭnea de playa! Este encantador piso de 84 metros ﾃｺtiles se encuentra ubicado en la playa de las...;36.777027353672736;-6.369477572590943;cadiz
260.300 竄ｬ;Piso en calle Comedia,  S/N;/comprar/piso-el_puerto_de_santa_maria_centro-4645045173_109700/;Centro (El Puerto de Santa Marﾃｭa);3 habs.;2 baﾃｱos;115 mﾂｲ;;Piso en una finca de obra nueva de 115 mﾂｲ de superficie construida y emplazado en la zona de el puerto de santa marﾃｭa. Estﾃ｡ dispue...;36.5961788;-6.2368599;cadiz
189.000 竄ｬ;Piso en Centro;/comprar/piso-jerez_de_la_frontera_centro11403-43418221055_101800/;Centro (Jerez de la Frontera);3 habs.;2 baﾃｱos;106 mﾂｲ;1ﾂｪ planta;Sin comision al comprador. Piso ubicado en el centro de jerez, barrio san miguel a un minuto de la plaza del arenal, totalmente am...;36.6784412;-6.1369615;cadiz
185.000 竄ｬ;Piso en Avenida de San Joaquﾃｭn;/comprar/piso-jerez_de_la_frontera_norte11407-45088170404_526975/;Norte (Jerez de la Frontera);4 habs.;2 baﾃｱos;90 mﾂｲ;1ﾂｪ planta;Se vende un acogedor piso en la zona norte de jerez de la frontera, en el 1ﾂｺ piso de un edificio con ascensor. Con una superficie ...;36.7002293;-6.1246979;cadiz
74.950 竄ｬ;Casa en Rinconcillo;/comprar/casa-rinconcillo-43344801266_526100/;Rinconcillo (Algeciras);2 habs.;2 baﾃｱos;84 mﾂｲ;;Oportunidad ﾂ｡ﾂ｡ Casa junto avenida diputaciﾃｳn y comisarﾃｭa de policﾃｭa, vivienda con muchas posibilidades de mejora, consta en planta...;36.1583837;-5.4540467;cadiz
189.500 竄ｬ;Chalet en Pago del Humo;/comprar/chalet-pago_del_humo_poligono_de_pelagatos-43361818147_100500/;Pago del Humo-Polﾃｭgono de Pelagatos (Chiclana de la Frontera);4 habs.;3 baﾃｱos;165 mﾂｲ;;Exclusivo chalet situado en chiclana de la frontera, en la zona privilegiada del pago del humo. Con una superficie construida de 1...;36.3933108;-6.1113693;cadiz
85.000 竄ｬ;Piso en Carboneros;/comprar/piso-la_soledad_la_coquina_los_gallos-36692774186_100500/;La Soledad-La Coquina-Los Gallos (Chiclana de la Frontera);2 habs.;1 baﾃｱo;45 mﾂｲ;1ﾂｪ planta;"沽 ﾂ｡No pierdas la oportunidad de este piso totalmente reformado y listo para entrar a vivir o como inversiﾃｳn!

Ubicado en una exce...";36.4119433;-6.1662192;cadiz
235.000 竄ｬ;Piso en Costa Ballena;/comprar/piso-rota_zona_norte11520-45001074359_109300/;Zona Norte (Rota);2 habs.;2 baﾃｱos;78 mﾂｲ;1ﾂｪ planta;"ﾂｿEstﾃ｡s buscando algo semi-nuevo?

Aquﾃｭ disponemos de este piso  en  la urbanizaciﾃｳn jardines del lago.  Costa ballena.

Primera pl...";36.690970565;-6.414564017;cadiz
270.000 竄ｬ;Piso en calle Real, 232;/comprar/piso-andalucia_la_ardila-4543967454_109700/;Andalucﾃｭa-La Ardila (San Fernando);;;;1ﾂｪ planta;Portal 1, 1ﾂｺ c. Piso en una finca de obra nueva y emplazado en la zona de san fernando, posicionado en planta 1. Cuenta como extra...;36.4560157;-6.2097137;cadiz
280.000 竄ｬ;Casa en Las Torres;/comprar/casa-este11406-44225629031_100500/;Este (Jerez de la Frontera);3 habs.;3 baﾃｱos;258 mﾂｲ;;Nos complace ofrecerles en exclusiva esta amplia casa en muy buena zona que cuenta con planta baja totalmente diﾃ｡fana con dos baﾃｱo...;36.687445;-6.1084079;cadiz
187.000 竄ｬ;Piso en calle Sﾃｩneca, 4;/comprar/piso-jerez_de_la_frontera_norte11407-45059082195_522800/;Norte (Jerez de la Frontera);3 habs.;2 baﾃｱos;90 mﾂｲ;3ﾂｪ planta;Piso de tres dormitorios de 75 mﾂｲ , salﾃｳn comedor con terraza y vistas a la piscina y zonas comunes , cuarto de baﾃｱo con placa duc...;36.710842;-6.1067834;cadiz
500.000 竄ｬ;Casa pareada en Vistahermosa;/comprar/casa_pareada-el_puerto_de_santa_maria_vistahermosa-35885198462_100500/;Vistahermosa (El Puerto de Santa Marﾃｭa);5 habs.;4 baﾃｱos;190 mﾂｲ;;"Fersa inmobiliaria ofrece en exclusiva fantﾃ｡stico pareado en el soto de vistahermosa. 

Pareado muy luminoso. Consta de dos planta...";36.5969308;-6.2501403;cadiz
104.999 竄ｬ;Piso en Centro;/comprar/piso-jerez_de_la_frontera_centro11403-43389611311_106700/;Centro (Jerez de la Frontera);2 habs.;1 baﾃｱo;86 mﾂｲ;;ﾂ｡ﾂ｡ Inmejorable zona , ubicado en plaza monti a escasos metros de la plaza del arenal en pleno centro de jerez !! Local comercial c...;36.6802469;-6.138746;cadiz
750.000 竄ｬ;Chalet en Norte;/comprar/chalet-jerez_de_la_frontera_norte11407-45912612903_992777/;Norte (Jerez de la Frontera);5 habs.;3 baﾃｱos;200 mﾂｲ;;Tenemos el gusto de presentarles este impresionante chalet independiente, de una sola planta para mﾃ｡xima comodidad, ha sido comple...;36.7044476;-6.1355045;cadiz
50.000 竄ｬ;Piso en Oeste;/comprar/piso-jerez_de_la_frontera_oeste11404-45094628515_100200/;Oeste (Jerez de la Frontera);3 habs.;1 baﾃｱo;62 mﾂｲ;2ﾂｪ planta;"Barriada sagrada familia.
Ubicado en una zona estratﾃｩgica con fﾃ｡cil acceso a la nacional iv y a pocos minutos del centro comercial...";36.6961872;-6.1474399;cadiz
265.000 竄ｬ;Piso en Costa Ballena;/comprar/piso-costa_ballena-45055808288_100200/;Costa Ballena (Rota);2 habs.;2 baﾃｱos;97 mﾂｲ;3ﾂｪ planta;En costa ballena, en el residencial de las dunas, piso en planta ﾃ｡tico completamente exterior y con 2 terrazas. La vivienda se enc...;36.6903356;-6.4117715;cadiz
174.995 竄ｬ;Piso en Este Delicias;/comprar/piso-este11406-45069074736_103800/;Este (Jerez de la Frontera);4 habs.;;119 mﾂｲ;2ﾂｪ planta;Piso  en este delicias, con 119 mﾂｲ construidos, 92 mﾂｲ ﾃｺtiles, 4 dormitorios, 2 baﾃｱos, buen estado, exterior, planta 2, 3 armarios,...;36.683048;-6.1124623;cadiz
148.200 竄ｬ;Piso en Centro Histﾃｳrico-La Costilla;/comprar/piso-centro_historico_la_costilla-42576323114_109300/;Centro Histﾃｳrico-La Costilla (Rota);1 hab.;1 baﾃｱo;50 mﾂｲ;1ﾂｪ planta;ﾂｿEstﾃ｡s cansado de hacer contorsiones dignas del cirque du soleil solo para llegar a la playa? ﾂ｡Dﾃｩjate de dramas! Aquﾃｭ tienes el p...;36.620494454;-6.357369262;cadiz
169.000 竄ｬ;Dﾃｺplex en Playa de Regla;/comprar/duplex-chipiona_la_laguna-43355017679_100500/;La Laguna (Chipiona);2 habs.;2 baﾃｱos;64 mﾂｲ;Bajo;Od1112. Vivir a 400 metros de la playa de regla no tiene precio. Tienes un dﾃｺplex a tu disposiciﾃｳn de 2 dormitorios, 2 cuartos de ...;36.7304119;-6.4356023;cadiz
202.400 竄ｬ;Casa pareada en Este;/comprar/casa_pareada-este11406-44241373316_101800/;Este (Jerez de la Frontera);4 habs.;3 baﾃｱos;150 mﾂｲ;;Vivienda pareada de renta libre  con grandes calidades en zona este. El exterior de la vivienda consta de patio delantero con capa...;36.6863742;-6.111147;cadiz
167.000 竄ｬ;Estudio en Puerto Sherry;/comprar/estudio-el_puerto_de_santa_maria_vistahermosa-40836035381_100500/;Vistahermosa (El Puerto de Santa Marﾃｭa);1 hab.;1 baﾃｱo;45 mﾂｲ;;"Fersa inmobiliaria comercializa en exclusiva
 Fantﾃ｡stico local comercial en planta baja adaptado como estudio con terraza privativ...";36.580339518;-6.257691219;cadiz
143.000 竄ｬ;Piso en calle Sierra del Pinar;/comprar/piso-jerez_de_la_frontera_norte-35895916087_996776/;Norte (Jerez de la Frontera);1 hab.;1 baﾃｱo;63 mﾂｲ;2ﾂｪ planta;Piso en venta en urb. Pie de rey, en zona norte, consta de un dormitorio, salﾃｳn cocina y baﾃｱo. Terraza privada de 25 mﾂｲ orientaciﾃｳ...;36.7064111;-6.1253418;cadiz
184.000 竄ｬ;Piso en Cﾃ｡diz;/comprar/piso-la_caleta_la_vina11002-41727254766_100500/;La Caleta-La Viﾃｱa (Cﾃ｡diz Capital);1 hab.;1 baﾃｱo;57 mﾂｲ;Bajo;Estimado comprador: el futuro es aquﾃｭ y ahora. Nueva promociﾃｳn de viviendas en el centro de cﾃ｡diz de prﾃｳxima construcciﾃｳn. Compra ...;36.5283735;-6.3037516;cadiz
164.990 竄ｬ;Chalet en Pago del Humo;/comprar/chalet-pago_del_humo_poligono_de_pelagatos-44185607209_100500/;Pago del Humo-Polﾃｭgono de Pelagatos (Chiclana de la Frontera);4 habs.;1 baﾃｱo;100 mﾂｲ;;"ﾂ｡Encanto rﾃｺstico en pago del humo!

Te presentamos un magnﾃｭfico chalet rﾃｺstico situado en la apacible zona de pago del humo. Esta ...";36.4011461;-6.1106126;cadiz
85.000 竄ｬ;Apartamento en calle Salesianos;/comprar/apartamento-fuentenueva_salesianos-44245144137_511915/;Fuentenueva-Salesianos (Algeciras);1 hab.;1 baﾃｱo;65 mﾂｲ;1ﾂｪ planta;Este encantador apartamento en venta en algeciras se encuentra en la zona de fuentenueva-salesianos. Con una superficie total de 6...;36.1306002;-5.4525737;cadiz
128.000 竄ｬ;ﾃ》ico en Arcos de la Frontera;/comprar/atico-arcos_de_la_frontera_centro_urbano-44188567574_100200/;Arcos de la Frontera;3 habs.;;200 mﾂｲ;;Se vender precios atico en zona mercadona nuevo, la viivenda consta de tres dormitorios, salﾃｳn-comedor, cocina, 2 baﾃｱos, azotea y ...;36.751853775;-5.822098137;cadiz
76.000 竄ｬ;Piso en San Josﾃｩ-San Bernardo;/comprar/piso-san_jose_san_bernardo-44264609696_100200/;San Josﾃｩ-San Bernardo (La Lﾃｭnea de la Concepciﾃｳn);2 habs.;1 baﾃｱo;55 mﾂｲ;;Acogedor piso 55 mﾂｲ de planta baja en zona tranquila. Consta de 2 habitaciones, baﾃｱo completo con plato de ducha, cocina equipada,...;36.1710681;-5.3458418;cadiz
73.000 竄ｬ;Piso en Fuentenueva-Salesianos;/comprar/piso-fuentenueva_salesianos-45873682885_100200/;Fuentenueva-Salesianos (Algeciras);3 habs.;1 baﾃｱo;79 mﾂｲ;1ﾂｪ planta;ﾂ｡Oportunidad ﾃｺnica en algeciras! Este encantador piso exterior de 79 mﾂｲ construidos y 63 mﾂｲ ﾃｺtiles se encuentra en una de las zona...;36.1315724;-5.4529605;cadiz
472.100 竄ｬ;ﾃ》ico en calle Viento de Levante,  2 y 4;/comprar/atico-tarifa_centro_urbano-4282484992_109700/;Tarifa;2 habs.;1 baﾃｱo;106 mﾂｲ;;Bloque B, ﾃ》ico 12. ﾃ》ico en una finca de obra nueva de 106 m2 de superficie construida y emplazado en la zona de Tarifa. Estﾃ｡ dispuesto en 2 habitaciones, 1 baﾃｱo completo y terraza. Cuenta como extras ascensor, garaje y trastero.;36,0557;-5,60054;cadiz
93.000 竄ｬ;Piso en Noreste;/comprar/piso-noreste11405-45039458251_108900/;Noreste (Jerez de la Frontera);3 habs.;1 baﾃｱo;90 mﾂｲ;;"Piso en jerez de la frontera, zona granja, la vivienda se encuentra&nbsp; en planta baja con patio, consta de cocina amueblada abi...";36.6970078;-6.1058448;cadiz
220.000 竄ｬ;Piso en La Paz-Segunda Aguado-Loreto;/comprar/piso-la_paz_segunda_aguado_loreto11012-44237918311_527560/;La Paz-Segunda Aguado-Loreto (Cﾃ｡diz Capital);3 habs.;1 baﾃｱo;97 mﾂｲ;3ﾂｪ planta;Amplio piso en zona barriada de la paz. Consta de 93 metros ﾃｺtiles aprox. Distribuido en recibidor, cocina independiente con despe...;36.5138878;-6.273489;cadiz
