precio;sub_descr;href;ubicacion;habitaciones;banios;mt2;planta;otros;latitude;longitude;CCAA
490.000 竄ｬ;;/comprar/casa-el_aguila_las_redes_fuentebravia-45884169628_265000/;El ﾃ“uila-Las Redes-Fuentebravﾃｭa (El Puerto de Santa Marﾃｭa);4 habs.;3 baﾃｱos;160 mﾂｲ;;"A un paso de la playa!!! Visitala!!!!
Encantadora casa con una superficie total de 160 mﾂｲ, de los cuales 140 mﾂｲ son ﾃｺtiles. Dispon...";36.5979692;-6.273042;cadiz
439.900 竄ｬ;Casa en calle de Isaac Peral, 39;/comprar/casa-centro_zona_playas-40843418194_100500/;Centro-Zona Playas (Chipiona);7 habs.;5 baﾃｱos;209 mﾂｲ;;En exclusiva! Magnﾃｭfica vivienda totalmente independiente dividida en 5 apartamentos de los cuales 3 de ellos estﾃ｡n en planta baja...;36.7393;-6.43553;cadiz
105.000 竄ｬ;;/comprar/piso-barrio_alto-44190864638_101800/;Barrio Alto (Sanlﾃｺcar de Barrameda);2 habs.;1 baﾃｱo;65 mﾂｲ;;"Magnﾃｭfico piso en barrio alto junto a c/ san agustﾃｭn, a un minuto de la puerta de jerez.
Piso en muy buen estado listo para entrar...";36.7734517;-6.3510293;cadiz
357.000 竄ｬ;;/comprar/piso-jerez_de_la_frontera_norte11407-43413869576_103800/;Norte (Jerez de la Frontera);4 habs.;2 baﾃｱos;145 mﾂｲ;4ﾂｪ planta;Presentamos esta magnﾃｭfica vivienda en una de las urbanizaciones mﾃ｡s valoradas y mﾃ｡s deseadas de la zona norte. Esta vivienda ha s...;36.70567425;-6.114182154;cadiz
88.000 竄ｬ;;/comprar/piso-este11406-45877870770_100500/;Este (Jerez de la Frontera);3 habs.;1 baﾃｱo;83 mﾂｲ;3ﾂｪ planta;"Nos complace ofrecerle en exclusiva luminoso piso  en la universidad!! Oportunidad para inversores.
Zona muy consolidada con tiend...";36.6870905;-6.1137755;cadiz
139.000 竄ｬ;;/comprar/piso-san_fernando_centro-41710636889_103800/;Centro (San Fernando);2 habs.;1 baﾃｱo;90 mﾂｲ;1ﾂｪ planta;Estupendo piso en venta  de 90 mﾂｲ, muy cﾃｩntrico en zona alameda.  Vivienda de 2 dormitorios, 1 baﾃｱo, cocina y salﾃｳn comedor. Dispo...;36.466629991;-6.194642188;cadiz
1.500.000 竄ｬ;;/comprar/chalet-sanlucar_de_barrameda_las_piletas-35035526289_100500/;Las Piletas (Sanlﾃｺcar de Barrameda);5 habs.;2 baﾃｱos;214 mﾂｲ;;Esta es una vivienda ﾃｺnica en la ciudad, se encuentra ubicada en una de las zonas mﾃ｡s exclusivas de la localidad y con una de las ...;36.7740019;-6.3625759;cadiz
130.000 竄ｬ;;/comprar/casa-jerez_de_la_frontera_oeste11408-42512812301_996776/;Oeste (Jerez de la Frontera);3 habs.;2 baﾃｱos;120 mﾂｲ;;Casa en venta en picadueﾃｱas alta. A junto a la salida de la circunvalaciﾃｳn de jerez , zona muy tranquila, la casa consta de 3 dorm...;36.6858309;-6.1509767;cadiz
199.999 竄ｬ;;/comprar/piso-jerez_de_la_frontera_norte11407-39172109929_100500/;Norte (Jerez de la Frontera);4 habs.;3 baﾃｱos;130 mﾂｲ;4ﾂｪ planta;"Magnﾃｭfico dﾃｺplex de cuatro dormitorios con terraza en zona norte. La distribuciﾃｳn es la siguiente:
Parte de abajo: salﾃｳn comedor c...";36.70201;-6.1170502;cadiz
490.000 竄ｬ;;/comprar/casa_pareada-el_aguila_las_redes_fuentebravia-45080844923_100500/;El ﾃ“uila-Las Redes-Fuentebravﾃｭa (El Puerto de Santa Marﾃｭa);4 habs.;3 baﾃｱos;141 mﾂｲ;;"Magnifica pareada en la zona de las redes con zonas comunes y piscina comunitaria.

Ubicada en una de las mejores zonas de la ciud...";36.600017011;-6.273483413;cadiz
179.900 竄ｬ;;/comprar/piso-ronda_del_estero-45017128374_100500/;Ronda del Estero (San Fernando);3 habs.;1 baﾃｱo;76 mﾂｲ;1ﾂｪ planta;Descubre esta magnﾃｭfica vivienda ubicada en la codiciada zona del carmen, un hogar con un encanto especial y una ubicaciﾃｳn inmejor...;36.4565284;-6.2001241;cadiz
270.000 竄ｬ;;/comprar/piso-el_cristo_cayetano_roldan11100-43403857903_103800/;El Cristo-Cayetano Roldﾃ｡n (San Fernando);4 habs.;2 baﾃｱos;129 mﾂｲ;4ﾂｪ planta;No pierda esta magnﾃｭfica oportunidad. Cﾃｩntrico piso muy soleado!!! Con inmejorable ubicaciﾃｳn, situada en una de las mejores zonas ...;36.4663475;-6.2000394;cadiz
319.000 竄ｬ;;/comprar/chalet-jerez_de_la_frontera_norte11407-31702471633_103800/;Norte (Jerez de la Frontera);4 habs.;3 baﾃｱos;267 mﾂｲ;;Vivienda unifamiliar adosada con reformas y mejoras realizadas muy beneficiosas para el inmueble, consta de sﾃｳtano para dos coches...;36.7053277;-6.1247958;cadiz
430.000 竄ｬ;;/comprar/duplex-el_puerto_de_santa_maria_vistahermosa-42581586724_526077/;Vistahermosa (El Puerto de Santa Marﾃｭa);3 habs.;3 baﾃｱos;130 mﾂｲ;2ﾂｪ planta;"Marina sherry s.l. Vende este fantﾃ｡stico dﾃｺplex de 3 dormitorios en puerto sherry. A 2 minutos andando a la playa de la muralla.

...";36.5806638;-6.2606864;cadiz
220.000 竄ｬ;;/comprar/piso-la_paz_segunda_aguado_loreto11012-44237918311_527560/;La Paz-Segunda Aguado-Loreto (Cﾃ｡diz Capital);3 habs.;1 baﾃｱo;97 mﾂｲ;3ﾂｪ planta;Amplio piso en zona barriada de la paz. Consta de 93 metros ﾃｺtiles aprox. Distribuido en recibidor, cocina independiente con despe...;36.5138878;-6.273489;cadiz
475.000 竄ｬ;Casa adosada en Carretera Nueva de La Barrosa,  S/N;/comprar/casa_adosada-costa_de_sancti_petri_playa_de_la_barrosa-3737297600_109700/;Costa de Sancti Petri-Playa de La Barrosa (Chiclana de la Frontera);3 habs.;3 baﾃｱos;155 mﾂｲ;;Casa adosada de obra nueva, de 155 mﾂｲ de superficie construida, y situada en la zona de chiclana de la frontera.  Estﾃ｡ estructurad...;36.3878235;-6.1704722;cadiz
295.000 竄ｬ;Piso en calle Real, 232;/comprar/piso-andalucia_la_ardila-4566154165_109700/;Andalucﾃｭa-La Ardila (San Fernando);;;;3ﾂｪ planta;Portal 2, 3ﾂｺ b. Piso en una finca de obra nueva y emplazado en la zona de san fernando, posicionado en planta 3. Cuenta como extra...;36.4560157;-6.2097137;cadiz
800.000 竄ｬ;;/comprar/chalet-rural11570-33421110907_100500/;Rural (Jerez de la Frontera);6 habs.;5 baﾃｱos;542 mﾂｲ;;Preciosa finca de 12500mt2 en la barca de la florida, pedanﾃｭa de jerez de la frontera. A tan sﾃｳlo 10 minutos de jerez, esta bonita...;36.6522672;-5.9573006;cadiz
74.000 竄ｬ;;/comprar/casa-algeciras_centro11201-45007288179_100500/;Centro (Algeciras);3 habs.;2 baﾃｱos;134 mﾂｲ;;"Casa en san isidro para reforma integral.

ﾂ｡Oportunidad ﾃｺnica en la barriada de san isidro, en pleno centro de algeciras!

ﾂｿBuscas...";36.1319953;-5.4502171;cadiz
169.500 竄ｬ;Piso en calle de la Batalla del Ebro,  s/n;/comprar/piso-caseria_de_ossio_san_carlos11100-4599783447_109700/;Caserﾃｭa de Ossio-San Carlos (San Fernando);3 habs.;2 baﾃｱos;112 mﾂｲ;Bajo;P1 Bajo B. Piso en un edificio de obra nueva de 112 m2 de superficie construida y ubicado en la zona de Soto de la Vega, enclavado en planta baja. Estﾃ｡ distribuido en 3 habitaciones, 2 baﾃｱos completos y terraza.;36,477569489;-6,196986162;cadiz
195.000 竄ｬ;;/comprar/piso-jerez_de_la_frontera_centro11401-41702716315_103800/;Centro (Jerez de la Frontera);4 habs.;2 baﾃｱos;120 mﾂｲ;;"Piso en centro, con 11o m construidos, 100m utiles, 4 dormitorios, dos baﾃｱos,garaje y trastero.

Si buscas una vivienda amplia lum...";36.6774957;-6.1278316;cadiz
440.000 竄ｬ;;/comprar/casa-nucleo_urbano_urbanizaciones-44240202748_100500/;Nﾃｺcleo Urbano-Urbanizaciones (Chiclana de la Frontera);9 habs.;3 baﾃｱos;335 mﾂｲ;;Viaja al pasado y descubre esta finca ﾃｺnica, construida en 1920 y cuidadosamente reformada en 1998. Con tres casas independientes,...;36.4192682;-6.1483158;cadiz
250.000 竄ｬ;;/comprar/casa-noreste11405-40877611841_103800/;Noreste (Jerez de la Frontera);3 habs.;3 baﾃｱos;100 mﾂｲ;;Presentamos esta preciosa casa adosada en zona chapin. La vivienda se distribuye en tres dormitorios y dos baﾃｱos en planta primera...;36.6866674;-6.1223183;cadiz
224.900 竄ｬ;;/comprar/casa-nucleo_urbano_urbanizaciones-33339345972_100500/;Nﾃｺcleo Urbano-Urbanizaciones (Chiclana de la Frontera);3 habs.;2 baﾃｱos;231 mﾂｲ;;"Casa seﾃｱorial en primera planta en pleno centro de chiclana.

Quiere vivir en la mejor zona de chiclana? Ahora puedes hacerlo!.

L...";36.4206683;-6.1500296;cadiz
1.399.000 竄ｬ;;/comprar/atico-sotogrande_alto11310-30054597313_101800/;Sotogrande Alto (Sotogrande);2 habs.;3 baﾃｱos;238 mﾂｲ;;"ﾃ》ico obra nueva en sotogrande (cﾃ｡diz), 33 unidades, varios tamaﾃｱos y alturas.

""walking distance"" del sotogrande international sc...";36.289251209;-5.34532172;cadiz
420.000 竄ｬ;Piso en Avenida Cuatro de Diciembre de 1977;/comprar/piso-cadiz_capital_centro_historico11006-40882841329_100500/;Centro Histﾃｳrico (Cﾃ｡diz Capital);4 habs.;2 baﾃｱos;142 mﾂｲ;8ﾂｪ planta;Presentamos en exclusiva, este piso, en el centro de cadiz, con vistas de pajaro, al puerto gaditano desde el salon y varias habit...;36.5323;-6.29322;cadiz
350.000 竄ｬ;;/comprar/piso-el_populo_santa_maria11005-44257243095_100500/;El Pﾃｳpulo-Santa Marﾃｭa (Cﾃ｡diz Capital);2 habs.;1 baﾃｱo;92 mﾂｲ;2ﾂｪ planta;Inmobiliaria vivencadiz os presenta oportunidad de estrenar este increﾃｭble piso de nueva construcciﾃｳn con impresionantes vistas al...;36.5290863;-6.2922037;cadiz
210.000 竄ｬ;;/comprar/casa-prado_del_rey_centro_urbano-4234378816_996776/;Prado del Rey;5 habs.;4 baﾃｱos;433 mﾂｲ;;Magnﾃｭfica casa independiente en prado del rey, de 436 mﾂｲ construidos, consta de 5 habitaciones , sﾃｳtano, garaje subterrﾃ｡neo, magnﾃｭ...;36.7913432;-5.5556708;cadiz
152.990 竄ｬ;;/comprar/casa_adosada-la_granja_los_pastores11204-45039959064_101800/;La Granja-Los Pastores (Algeciras);3 habs.;2 baﾃｱos;100 mﾂｲ;;Casa en buen estado en san bernabﾃｩ, de mas de 100 mﾂｲ. La planta baja cuenta con patio delantero, cuartillo debajo de las escaleras...;36.1384273;-5.4710649;cadiz
570.000 竄ｬ;;/comprar/casa-iglesia_mayor-41741955012_103800/;Iglesia Mayor (San Fernando);3 habs.;5 baﾃｱos;290 mﾂｲ;;Espectacular casa para entrar a  vivir!!! Moderna vivienda de nueva construcciﾃｳn con 290 mﾂｲ  distribuidos en 2 plantas y sﾃｳtano.  ...;36.4653945;-6.1951729;cadiz
330.000 竄ｬ;;/comprar/casa_adosada-chipiona_la_laguna-45039063226_992948/;La Laguna (Chipiona);4 habs.;2 baﾃｱos;94 mﾂｲ;;Magnﾃｭfica casa adosada junto al santuario y a 50 metros de la playa de regla. Consta de tres plantas que se distribuyen en planta ...;36.728241005;-6.437641736;cadiz
169.995 竄ｬ;;/comprar/piso-jerez_de_la_frontera_centro11402-45018840710_103800/;Centro (Jerez de la Frontera);5 habs.;;117 mﾂｲ;2ﾂｪ planta;Piso  en centro, con 117 mﾂｲ construidos, 5 dormitorios, 2 baﾃｱos, buen estado, planta 2, trastero, ascensor, orientaciﾃｳn sur, 4 pla...;36.681694141;-6.136624693;cadiz
1.100.000 竄ｬ;;/comprar/chalet-centro_zona_playas-44246121787_100500/;Centro-Zona Playas (Chipiona);5 habs.;5 baﾃｱos;217 mﾂｲ;;"Referencia: 1920

Has tenido un sueﾃｱo?. Hazlo realidad!
Si pensabas que no era posible, aquﾃｭ esta!
Vivienda unifamiliar en pleno c...";36.7410528;-6.4365885;cadiz
235.000 竄ｬ;;/comprar/atico-el_pino_bajo_de_guia-38406742795_103800/;El Pino-Bajo de Guﾃｭa (Sanlﾃｺcar de Barrameda);3 habs.;;109 mﾂｲ;;"Estupendo ﾃ｡tico con ascensor y garaje en sanlﾃｺcar de barrameda.
En este residencial, en la zona de bajo guia, a 5 minutos de la pl...";36.7839455;-6.3498626;cadiz
66.000 竄ｬ;;/comprar/apartamento-jimena_de_la_frontera_centro_urbano-42566322048_106700/;Jimena de la Frontera;2 habs.;1 baﾃｱo;77 mﾂｲ;;"Luminoso apartamento de 2 habitaciones con buenas vistas, baﾃｱo con ducha, salﾃｳn con despensa, comedor y cocina con mucha luz. 
Se ...";36.431383614;-5.446223852;cadiz
169.500 竄ｬ;Piso en calle de la Batalla del Ebro,  s/n;/comprar/piso-caseria_de_ossio_san_carlos11100-4599783447_109700/;Caserﾃｭa de Ossio-San Carlos (San Fernando);3 habs.;2 baﾃｱos;112 mﾂｲ;Bajo;P1 bajo b. Piso en un edificio de obra nueva de 112 mﾂｲ de superficie construida y ubicado en la zona de soto de la vega, enclavado...;36.477569489;-6.196986162;cadiz
700.000 竄ｬ;;/comprar/chalet-costa_de_sancti_petri_playa_de_la_barrosa11139-42569207502_103800/;Costa de Sancti Petri-Playa de La Barrosa (Chiclana de la Frontera);3 habs.;2 baﾃｱos;210 mﾂｲ;;Bonito chalet de nueva construcciﾃｳn de estilo moderno con piscina en la zona del coto la campa. Magnﾃｭfico chalet urbano totalmente...;36.3654517;-6.1725941;cadiz
450.000 竄ｬ;;/comprar/chalet-la_jara_distrito-40899031790_100500/;La Jara (Sanlﾃｺcar de Barrameda);6 habs.;4 baﾃｱos;306 mﾂｲ;;"Fantﾃ｡stica vivienda en una de las mejores y mﾃ｡s demandadas zonas de sanlﾃｺcar de barrameda. 
Vivienda lista para entrar a vivir, se...";36.7721528;-6.3679262;cadiz
188.000 竄ｬ;;/comprar/duplex-centro_zona_noreste-40871681590_100500/;Centro-Zona Noreste (Chipiona);4 habs.;2 baﾃｱos;110 mﾂｲ;Bajo;A01286 duplex de 4 dormitorios dobles , tres con armarios empotrados, amplio salon , cocina con patio, dos baﾃｱos , ambos con baﾃｱer...;36.737676444;-6.432103506;cadiz
159.900 竄ｬ;;/comprar/piso-jerez_de_la_frontera_centro11402-42577065610_100500/;Centro (Jerez de la Frontera);3 habs.;2 baﾃｱos;94 mﾂｲ;2ﾂｪ planta;"ﾂ｡ﾂ｡Oportunidad de inversiﾃｳn!!
Fantﾃ｡stica vivienda con ascensor de 3 dormitorios en pleno centro
Estupendo piso situado en la zona c...";36.6859337;-6.1352122;cadiz
260.000 竄ｬ;;/comprar/atico-centro_calzada-44232836696_104700/;Centro-Calzada (Sanlﾃｺcar de Barrameda);3 habs.;1 baﾃｱo;106 mﾂｲ;;Espectacular ﾃ｡tico con una espectacular terraza de 50 metros en venta, calle juan xxiii, cerca de la calzada, plaza cinema. La zon...;36.7828001;-6.3555924;cadiz
550.000 竄ｬ;Dﾃｺplex en calle de la Sierra del Retﾃｭn,  s/n;/comprar/duplex-zahara_de_los_atunes-4585082602_109700/;Zahara de los Atunes (Barbate);3 habs.;3 baﾃｱos;130 mﾂｲ;Bajo;Dﾃｺplex en un edificio de obra nueva de 130 mﾂｲ de superficie construida y ubicado en la zona de zaragoza capital, enclavado en plan...;36.1354248;-5.8412992;cadiz
550.000 竄ｬ;;/comprar/chalet-novo_sancti_petri_loma_de_sancti_petri11139-37523059513_108500/;Novo Sancti Petri-Loma de Sancti Petri (Chiclana de la Frontera);4 habs.;3 baﾃｱos;140 mﾂｲ;;Chalet independiente, de cuatro dormitorios en parcela de 700 mﾂｲ, en novo sancti petri (chiclana de la frontera). En planta baja t...;36.360019855;-6.167015975;cadiz
295.000 竄ｬ;;/comprar/casa-camposoto_gallineras11100-44252618435_100500/;Camposoto-Gallineras (San Fernando);5 habs.;3 baﾃｱos;219 mﾂｲ;;Situada en la zona del campo de hockey  consta de dos viviendas, ambas en planta baja distribuidas en los 219 mﾂｲ que tiene la parc...;36.4439322;-6.2091268;cadiz
202.000 竄ｬ;;/comprar/casa_adosada-centro_zona_noreste-43412544915_100500/;Centro-Zona Noreste (Chipiona);3 habs.;2 baﾃｱos;104 mﾂｲ;;En esta vivienda puedes cumplir el sueﾃｱo de vivir en chipiona durante todo el aﾃｱo, esporﾃ｡dicamente o como mejor te venga, sin perd...;36.7376533;-6.424584149;cadiz
375.000 竄ｬ;;/comprar/casa_pareada-noreste11405-43431061573_100500/;Noreste (Jerez de la Frontera);5 habs.;3 baﾃｱos;158 mﾂｲ;;"Vivienda de 5 dormitorios en una zona privilegiada. 
La vivienda consta de amplio jardﾃｭn de entrada con piscina privada, zona para...";36.6899683;-6.1245707;cadiz
629.000 竄ｬ;;/comprar/chalet-el_puerto_de_santa_maria_valdelagrana-43362882478_103800/;Valdelagrana (El Puerto de Santa Marﾃｭa);6 habs.;6 baﾃｱos;310 mﾂｲ;;"Chalet con piscina en zona de valdelagrana. A unos minutos de la playa y de todo tipo de servicios. 
Chalet independiente de una p...";36.5813086;-6.2179099;cadiz
75.900 竄ｬ;;/comprar/piso-san_fernando_el_carmen-42504035806_527956/;El Carmen (San Fernando);4 habs.;1 baﾃｱo;72 mﾂｲ;3ﾂｪ planta;Piso en venta en san fernando, que dispone de una superficie construida de 72 mﾂｲ, superficie ﾃｺtil de 64 mﾂｲ. Se trata de una tercer...;36.4594141;-6.1983146;cadiz
149.000 竄ｬ;;/comprar/piso-chipiona_la_laguna-41704176946_100500/;La Laguna (Chipiona);3 habs.;2 baﾃｱos;100 mﾂｲ;2ﾂｪ planta;Od1097. ﾂ｡Los sueﾃｱos se cumplen! Magnﾃｭfico piso a 550 metros del santuario. La vivienda dispone de 3 amplios dormitorios donde tend...;36.727977348;-6.434052832;cadiz
275.000 竄ｬ;;/comprar/piso-costa_ballena-45089141172_990821/;Costa Ballena (Rota);3 habs.;2 baﾃｱos;97 mﾂｲ;Principal;"Amplia vivienda de tres dormitorios, todos exteriores y con armario empotrado.

Espacioso salﾃｳn comedor cocina, independiente, con...";36.691043012;-6.414302661;cadiz
186.400 竄ｬ;Casa adosada en calle Cabo de Rocas,  4;/comprar/casa_adosada-rinconcillo-4671235670_109700/;Rinconcillo (Algeciras);3 habs.;;;;V8. Casa adosada de obra nueva, y ubicada en la zona de Algeciras.  Estﾃ｡ distribuida en 3 habitaciones y terraza. Incluye extras como garaje y trastero.;36,1648;-5,45186;cadiz
120.000 竄ｬ;;/comprar/piso-centro_zona_noreste-43416328073_100500/;Centro-Zona Noreste (Chipiona);3 habs.;1 baﾃｱo;75 mﾂｲ;4ﾂｪ planta;Precioso piso en 4ﾂｺ planta con la instalaciﾃｳn de ascensor aprobada por la comunidad junto a la aceptaciﾃｳn de presupuesto y financi...;36.73925256;-6.42813871;cadiz
74.000 竄ｬ;;/comprar/piso-jerez_de_la_frontera_sur11408-45038104352_100500/;Sur (Jerez de la Frontera);3 habs.;1 baﾃｱo;85 mﾂｲ;2ﾂｪ planta;Inmueble sin comisiﾃｳn de agencia inmobiliaria, financiaciﾃｳn con condiciones preferentes! Piso en segunda planta con ascensor dispo...;36.670428;-6.1297908;cadiz
700.000 竄ｬ;;/comprar/chalet-jerez_de_la_frontera_norte11407-41748670471_103800/;Norte (Jerez de la Frontera);4 habs.;4 baﾃｱos;657 mﾂｲ;;Chalet en monte alto en venta en avenida del pinar, en parcela de 650 mﾂｲ y 495 mﾂｲ construidos, toda la construcciﾃｳn en planta baja...;36.7028236;-6.1359933;cadiz
189.500 竄ｬ;;/comprar/chalet-pago_del_humo_poligono_de_pelagatos-43361818147_100500/;Pago del Humo-Polﾃｭgono de Pelagatos (Chiclana de la Frontera);4 habs.;3 baﾃｱos;165 mﾂｲ;;Exclusivo chalet situado en chiclana de la frontera, en la zona privilegiada del pago del humo. Con una superficie construida de 1...;36.3933108;-6.1113693;cadiz
395.000 竄ｬ;;/comprar/chalet-pinar_de_los_franceses_el_marquesado11130-43409323538_100500/;Pinar de los Franceses-El Marquesado (Chiclana de la Frontera);4 habs.;3 baﾃｱos;150 mﾂｲ;;"Magnﾃｭfico chalet en la zona del almendral.    

Le gustarﾃｭa vivir en una maravillosa zona residencial? Encontrﾃｳ lo que buscaba.

C...";36.4095752;-6.160135;cadiz
95.000 竄ｬ;;/comprar/casa-medina_sidonia_centro_urbano-43345824242_100500/;Medina Sidonia;2 habs.;2 baﾃｱos;61 mﾂｲ;;"Del valle inmobiliaria os ofrece en exclusiva esta oportunidad de negocio en medina sidonia.

Se trata de dos apartamentos totalme...";36.4576962;-5.9293987;cadiz
A consultar;;/comprar/finca_rustica-el_pelayo_parques_naturales11390-44208391186_100500/;El Pelayo-Parques Naturales (Algeciras);6 habs.;7 baﾃｱos;496 mﾂｲ;;La ubicaciﾃｳn de este cortijo es absolutamente excepcional. Se encuentra en el parque natural del estrecho, donde la naturaleza y l...;36.0839855;-5.4981016;cadiz
139.990 竄ｬ;;/comprar/piso-centro_calzada-30010140555_100500/;Centro-Calzada (Sanlﾃｺcar de Barrameda);2 habs.;1 baﾃｱo;70 mﾂｲ;1ﾂｪ planta;Od1012. ﾂ｡Estﾃ｡s a punto de descubrir tu nuevo hogar! Este moderno piso estﾃ｡ ubicado en una zona residencial privada y tranquila en ...;36.7763898;-6.3513248;cadiz
2.664.000 竄ｬ;;/comprar/atico-sotogrande_alto11310-30061360705_101800/;Sotogrande Alto (Sotogrande);4 habs.;5 baﾃｱos;383 mﾂｲ;;"ﾃ》ico obra nueva en sotogrande (cﾃ｡diz), 33 unidades, varios tamaﾃｱos y alturas.

""walking distance"" del sotogrande international sc...";36.27916;-5.3185192;cadiz
174.900 竄ｬ;;/comprar/piso-este11406-38390327882_100500/;Este (Jerez de la Frontera);2 habs.;1 baﾃｱo;74 mﾂｲ;Bajo;"Os presentamos una vivienda en la zona este de jerez con un patio increﾃｭble!
Fantﾃ｡stica vivienda de dos dormitorios en una urbaniz...";36.68365;-6.0989768;cadiz
265.000 竄ｬ;Piso en Avenida de las Piletas, 109;/comprar/piso-sanlucar_de_barrameda_las_piletas-40902173590_990821/;Las Piletas (Sanlﾃｺcar de Barrameda);3 habs.;2 baﾃｱos;98 mﾂｲ;Principal;ﾂ｡Increﾃｭble oportunidad en primera lﾃｭnea de playa! Este encantador piso de 84 metros ﾃｺtiles se encuentra ubicado en la playa de las...;36.777027353672736;-6.369477572590943;cadiz
178.563 竄ｬ;Piso en calle Sopranis, 4;/comprar/piso-el_populo_santa_maria11005-4602944495_109700/;El Pﾃｳpulo-Santa Marﾃｭa (Cﾃ｡diz Capital);1 hab.;1 baﾃｱo;54 mﾂｲ;Bajo;Bajo b. Piso en un edificio de obra nueva de 54 mﾂｲ de superficie construida y ubicado en la zona de cﾃ｡diz capital, enclavado en pl...;36.5294347;-6.2922188;cadiz
479.900 竄ｬ;;/comprar/chalet-vejer_de_la_frontera_centro_urbano-39174034621_100500/;Vejer de la Frontera;5 habs.;2 baﾃｱos;268 mﾂｲ;;"Chalet urbano con en los naveros

El chalet cuenta con 720 mﾂｲ aprox de parcela, 268 mﾂｲ construidos aprox y 234 mﾂｲ ﾃｺtiles aprox

Pr...";36.3576097;-5.9755054;cadiz
148.200 竄ｬ;;/comprar/piso-centro_historico_la_costilla-42576323114_109300/;Centro Histﾃｳrico-La Costilla (Rota);1 hab.;1 baﾃｱo;50 mﾂｲ;1ﾂｪ planta;ﾂｿEstﾃ｡s cansado de hacer contorsiones dignas del cirque du soleil solo para llegar a la playa? ﾂ｡Dﾃｩjate de dramas! Aquﾃｭ tienes el p...;36.620494454;-6.357369262;cadiz
200.000 竄ｬ;;/comprar/atico-jerez_de_la_frontera_norte11407-41748252151_101800/;Norte (Jerez de la Frontera);3 habs.;2 baﾃｱos;103 mﾂｲ;;ﾃ》ico en en urbanizaciﾃｳn privada en zona norte. La vivienda se distribuye en vestﾃｭbulo de entrada, salﾃｳn comedor con acceso a terr...;36.7110989;-6.106683;cadiz
210.000 竄ｬ;;/comprar/piso-centro_zona_playas-44262094442_528322/;Centro-Zona Playas (Chipiona);3 habs.;2 baﾃｱos;85 mﾂｲ;2ﾂｪ planta;Increﾃｭbles vistas las que nos ofrece este piso en primera lﾃｭnea de playa en cruz del mar, es una de la pocas oportunidades de adqu...;36.7452498;-6.4323031;cadiz
525.000 竄ｬ;;/comprar/piso-playa_de_santa_maria_del_mar_bahia_blanca11007-41732633369_100500/;Playa de Santa Marﾃｭa del Mar-Bahﾃｭa Blanca (Cﾃ｡diz Capital);5 habs.;3 baﾃｱos;193 mﾂｲ;3ﾂｪ planta;ﾂ｡Increﾃｭble oportunidad en bahﾃｭa blanca, cﾃ｡diz! Este luminoso piso de cinco dormitorios te ofrece comodidad y amplitud en una de la...;36.5248083;-6.2839271;cadiz
381.000 竄ｬ;;/comprar/piso-zona_playa_virgen_del_mar-43335051805_109300/;Zona Playa Virgen del Mar (Rota);1 hab.;1 baﾃｱo;98 mﾂｲ;7ﾂｪ planta;ﾂ｡Atenciﾃｳn amantes del mar y la comodidad! ﾂｿEstﾃ｡s buscando el paraﾃｭso en la tierra? ﾂ｡Lo has encontrado! Presentamos este magnﾃｭfico ...;36.6205693;-6.3637756;cadiz
270.000 竄ｬ;;/comprar/atico-el_mentidero_teatro_falla_alameda11003-43352040028_100500/;El Mentidero-Teatro Falla-Alameda (Cﾃ｡diz Capital);2 habs.;1 baﾃｱo;121 mﾂｲ;;"Inmonline cadiz - real estate presenta este fantﾃ｡stico ﾃ｡tico con vistas despejadas a la plaza de san antonio.

Se trata de una cua...";36.5343844;-6.2991001;cadiz
135.000 竄ｬ;;/comprar/piso-jerez_de_la_frontera_centro11401-44261982833_108900/;Centro (Jerez de la Frontera);3 habs.;2 baﾃｱos;103 mﾂｲ;;Precioso piso de 3 habitaciones en primera planta sin ascensor, con cocina amueblada, salﾃｳn comedor, 2 baﾃｱos, plaza de garaje y pe...;36.6781844;-6.1388515;cadiz
210.000 竄ｬ;;/comprar/casa_rustica-pinar_de_los_franceses_el_marquesado11138-41749883951_100200/;Pinar de los Franceses-El Marquesado (Chiclana de la Frontera);4 habs.;2 baﾃｱos;155 mﾂｲ;;Vivienda tipo chalet situado en urbanizaciﾃｳn baterﾃｭa colorada en la zona del pinar de los franceses, estupenda ubicaciﾃｳn muy cerca...;36.4536104;-6.1388319;cadiz
250.000 竄ｬ;;/comprar/casa_adosada-iglesia_mayor-43410773323_100500/;Iglesia Mayor (San Fernando);3 habs.;2 baﾃｱos;110 mﾂｲ;;Inmobiliaria vivencadiz os presenta esta joya en el corazﾃｳn de san fernando! Esta moderna vivienda unifamiliar, en impecable estad...;36.4638977;-6.1966691;cadiz
650.000 竄ｬ;;/comprar/chalet-costa_de_sancti_petri_playa_de_la_barrosa11139-45028627334_100500/;Costa de Sancti Petri-Playa de La Barrosa (Chiclana de la Frontera);4 habs.;2 baﾃｱos;124 mﾂｲ;;"Chalet en chiclana situado en la zona de costa sancti petri, a 50 metros del mar, distribuido en dos plantas; en planta baja nos e...";36.3814307;-6.2008708;cadiz
411.000 竄ｬ;;/comprar/piso-cadiz_capital_centro_historico11004-35048999143_100500/;Centro Histﾃｳrico (Cﾃ｡diz Capital);8 habs.;2 baﾃｱos;200 mﾂｲ;1ﾂｪ planta;Magnifica vivienda en el corazﾃｳn de cﾃ｡diz, en una finca clﾃ｡sica del centro histﾃｳrico con mucho encanto. Comprende toda la primera ...;36.5338653;-6.296291;cadiz
265.000 竄ｬ;;/comprar/casa_pareada-san_garcia_getares-44209038573_100500/;San Garcﾃｭa-Getares (Algeciras);3 habs.;2 baﾃｱos;120 mﾂｲ;;ﾂ｡Descubre tu nuevo hogar en la exclusiva zona de getares, algeciras! Este precioso chalet pareado te espera con 120 mﾂｲ construidos...;36.1004191;-5.4477487;cadiz
90.000 竄ｬ;;/comprar/piso-puerto_real_centro_urbano-45901946052_100500/;Puerto Real;3 habs.;1 baﾃｱo;80 mﾂｲ;1ﾂｪ planta;Vivienda en primera planta con amplio trastero, consta de tres dormitorios amplios , cocina amueblada, baﾃｱo con baﾃｱera y salﾃｳn muy...;36.5318374;-6.1964663;cadiz
