precio;sub_descr;href;ubicacion;habitaciones;banios;mt2;otros;publicado_hace;plataforma;CCAA
1.300€;Parque doña sofia, alquiler temporada;https://rd.clk.thribee.com/id.Ryc1c1O1T1m1r/origin.1/section.97/section_type.1/country.es/vertical.homes/iuid.43035trovit-web-6f6984d597-7ht4x66a3d8c4ef37e/tracking.%7B%22cmp%22%3A%22u%22%7D/what_d.Malaga/type.2/page.27/cookieid.102115766a3d8c4eeeb50.45254571/pos.1/;29640, Fuengirola, Provincia de Málaga;3  habitaciones;2  baños;130  m²;Consultar condiciones y precios para temporada. De agosto y septiembre PREGUNTAR POR FECHAS DISPONIBLES WIFI INCLUIDO La propiedad dispone de 3 a...;Hace 2 días;Vadevender;Malaga
2.500€;Preciosa casa para alquilar en riviera del sol;https://rd.clk.thribee.com/id.1Q1w1m1c1EKlG/origin.1/section.97/section_type.1/country.es/vertical.homes/iuid.43035trovit-web-6f6984d597-7ht4x66a3d8c4ef37e/tracking.%7B%22cmp%22%3A%22u%22%7D/what_d.Malaga/type.2/page.27/cookieid.102115766a3d8c4eeeb50.45254571/pos.2/;29650, Mijas, Provincia de Málaga;3  habitaciones;2  baños;177  m²;Encantadora Casa Adosada en Riviera del Sol en a Esta hermosa casa adosada, ubicada en la pintoresca Riviera del Sol, te ofrece la vida de lujo q...;Hace 2 días;Vadevender;Malaga
2.700€;Maravillosa villa independiente con piscina privada y a pocos metros de la playa en real panorama -;https://rd.clk.thribee.com/id.1M1n1m1W1X1-R1K/origin.1/section.97/section_type.1/country.es/vertical.homes/iuid.43035trovit-web-6f6984d597-7ht4x66a3d8c4ef37e/tracking.%7B%22cmp%22%3A%22u%22%7D/what_d.Malaga/type.2/page.27/cookieid.102115766a3d8c4eeeb50.45254571/pos.3/;29603, Bello Horizonte, La Nucia, Provincia de Alicante;3  habitaciones;3  baños;208  m²;Maravillosa villa independiente con piscina privada y a pocos metros de la playa en real panorama. MARBELLA Esta estupenda villa de dos plantas r...;Hace 2 días;Vadevender;Malaga
2.100€;Impresionante apartamento de 3 habitaciones en Elviria con vistas al mar - Disponible de septiembre;https://rd.clk.thribee.com/id.A14121h1s1m32/origin.1/section.97/section_type.1/country.es/vertical.homes/iuid.43035trovit-web-6f6984d597-7ht4x66a3d8c4ef37e/tracking.%7B%22cmp%22%3A%22u%22%7D/what_d.Malaga/type.2/page.27/cookieid.102115766a3d8c4eeeb50.45254571/pos.4/;29604, Marbella, Provincia de Málaga;3  habitaciones;2  baños;140  m²;¡Bienvenido a su refugio costero soñado en la playa de Elviria! Este impresionante y luminoso apartamento de 3 dormitorios y 2 baños ofrece un am...;Hace 2 días;Vadevender;Malaga
10.000€;Detached Villa in Marbella;https://rd.clk.thribee.com/id.1B1Fl1t1eD1pc/origin.1/section.97/section_type.1/country.es/vertical.homes/iuid.43035trovit-web-6f6984d597-7ht4x66a3d8c4ef37e/tracking.%7B%22cmp%22%3A%22u%22%7D/what_d.Malaga/type.2/page.27/cookieid.102115766a3d8c4eeeb50.45254571/pos.5/;Málaga, Provincia de Málaga;4  habitaciones;3  baños;315  m²;"Available up from August 2024. This beautiful property is located in the exclusive gated urbanization ""Marbella Hill Club"", one of the most old-e...";Hace 3 días;Kuhamia;Malaga
3.000€;Middle Floor Apartment in Benahavís;https://rd.clk.thribee.com/id.D51K15s1m1jp/origin.1/section.97/section_type.1/country.es/vertical.homes/iuid.43035trovit-web-6f6984d597-7ht4x66a3d8c4ef37e/tracking.%7B%22cmp%22%3A%22u%22%7D/what_d.Malaga/type.2/page.27/cookieid.102115766a3d8c4eeeb50.45254571/pos.6/;Málaga, Provincia de Málaga;3  habitaciones;2  baños;111  m²;Modern apartment located in a gated complex near Benahavis town, located on the 1st floor facing the swimming pool and communal gardens. The apar...;Hace 3 días;Kuhamia;Malaga
3.500€;Middle Floor Apartment in Marbella;https://rd.clk.thribee.com/id.1UG15dSonW/origin.1/section.97/section_type.1/country.es/vertical.homes/iuid.43035trovit-web-6f6984d597-7ht4x66a3d8c4ef37e/tracking.%7B%22cmp%22%3A%22u%22%7D/what_d.Malaga/type.2/page.27/cookieid.102115766a3d8c4eeeb50.45254571/pos.7/;Málaga, Provincia de Málaga;2  habitaciones;2  baños;120  m²;PALO ALTO-LONG TERM RENTAL: AVAILABLE FROM IMMEDIATELY Embark on an extraordinary retreat in the recently unveiled secured enclave of Palo Alto....;Hace 3 días;Kuhamia;Malaga
990€;Half season. For rent from 1.9.24-30.6.25 magnificent apartment with side sea views on the 1st line of the beach in los boliches (fuengirola);https://rd.clk.thribee.com/id.ju1km1wc1n1y/origin.1/section.97/section_type.1/country.es/vertical.homes/iuid.43035trovit-web-6f6984d597-7ht4x66a3d8c4ef37e/tracking.%7B%22cmp%22%3A%22u%22%7D/what_d.Malaga/type.2/page.27/cookieid.102115766a3d8c4eeeb50.45254571/pos.8/;Fuengirola, Provincia de Málaga;1  habitaciones;1  baños;68  m²;REF. 2442 half season. For rent from 1.9.24-30.6.25 magnificent apartment with side sea views on the 1st line of the beach in los boliches (fueng...;Hace 3 días;Kuhamia;Malaga
1.650€;Middle Floor Apartment in The Golden Mile;https://rd.clk.thribee.com/id.o191KP1LD-B/origin.1/section.97/section_type.1/country.es/vertical.homes/iuid.43035trovit-web-6f6984d597-7ht4x66a3d8c4ef37e/tracking.%7B%22cmp%22%3A%22u%22%7D/what_d.Malaga/type.2/page.27/cookieid.102115766a3d8c4eeeb50.45254571/pos.9/;Málaga, Provincia de Málaga;2  habitaciones;2  baños;88  m²;This charming 2-bedroom, 2-bathroom apartment is located in Costa Nagüeles 3, in the prestigious area of Marbella known as the Golden Mile wilt p...;Hace 3 días;Kuhamia;Malaga
4.500€;Penthouse in Costalita;https://rd.clk.thribee.com/id.1U1d19juh1I16/origin.1/section.97/section_type.1/country.es/vertical.homes/iuid.43035trovit-web-6f6984d597-7ht4x66a3d8c4ef37e/tracking.%7B%22cmp%22%3A%22u%22%7D/what_d.Malaga/type.2/page.27/cookieid.102115766a3d8c4eeeb50.45254571/pos.10/;Málaga, Provincia de Málaga;4  habitaciones;4  baños;216  m²;Penthouse, Costalita, Costa del Sol. 4 Bedrooms, 4 Bathrooms, Built 200 m², Terrace 70 m². Setting: Beachfront, Beachside, Close To Sea, Close To...;Hace 3 días;Kuhamia;Malaga
1.100€;Half season. Renting from 1.5.25 -30.6.25 and from 1.9.25-30.6.26 magnificent apartment with sea views in los boliches (fuengirola);https://rd.clk.thribee.com/id.oz14RRa193/origin.1/section.97/section_type.1/country.es/vertical.homes/iuid.43035trovit-web-6f6984d597-7ht4x66a3d8c4ef37e/tracking.%7B%22cmp%22%3A%22u%22%7D/what_d.Malaga/type.2/page.27/cookieid.102115766a3d8c4eeeb50.45254571/pos.11/;Fuengirola, Provincia de Málaga;1  habitaciones;1  baños;68  m²;REF. 2443 half season. For rent from 1.5.25.30.6.25 and from 1.9.25-30.6.26 magnificent apartment with sea views in los boliches (fuengirola) has...;Hace 3 días;Kuhamia;Malaga
3.000€;Middle Floor Apartment in Benahavís;https://rd.clk.thribee.com/id.U1eI1T1I1D412/origin.1/section.97/section_type.1/country.es/vertical.homes/iuid.43035trovit-web-6f6984d597-7ht4x66a3d8c4ef37e/tracking.%7B%22cmp%22%3A%22u%22%7D/what_d.Malaga/type.2/page.27/cookieid.102115766a3d8c4eeeb50.45254571/pos.12/;Málaga, Provincia de Málaga;3  habitaciones;3  baños;170  m²;Lovely 3 bedroom apartment with great views for sale in Capanes del Golf. Located in one of the best blocks in the development. Perfect for long...;Hace 3 días;Kuhamia;Malaga
3.500€;Ground Floor Apartment in Puerto Banús;https://rd.clk.thribee.com/id.1G1B1ViY1M1rL/origin.1/section.97/section_type.1/country.es/vertical.homes/iuid.43035trovit-web-6f6984d597-7ht4x66a3d8c4ef37e/tracking.%7B%22cmp%22%3A%22u%22%7D/what_d.Malaga/type.2/page.27/cookieid.102115766a3d8c4eeeb50.45254571/pos.13/;Málaga, Provincia de Málaga;3  habitaciones;2  baños;177  m²;Elegant 3-Bedroom Apartment in Las Mimosas, Puerto Banús Price: €925,000 Rental: €3,500 per month (long-term) Experience luxurious living in this...;Hace 3 días;Kuhamia;Malaga
1.500€;Ground Floor Apartment in Calahonda;https://rd.clk.thribee.com/id.a1IgvET911/origin.1/section.97/section_type.1/country.es/vertical.homes/iuid.43035trovit-web-6f6984d597-7ht4x66a3d8c4ef37e/tracking.%7B%22cmp%22%3A%22u%22%7D/what_d.Malaga/type.2/page.27/cookieid.102115766a3d8c4eeeb50.45254571/pos.14/;Málaga, Provincia de Málaga;2  habitaciones;2  baños;49  m²;Welcome to this stunning ground floor apartment in Calahonda Playa, Mijas Costa! This beautifully renovated 2-bedroom, 2-bathroom retreat offers...;Hace 3 días;Kuhamia;Malaga
25.000€;Detached Villa in Marbella;https://rd.clk.thribee.com/id.1cTzu1UEi0/origin.1/section.97/section_type.1/country.es/vertical.homes/iuid.43035trovit-web-6f6984d597-7ht4x66a3d8c4ef37e/tracking.%7B%22cmp%22%3A%22u%22%7D/what_d.Malaga/type.2/page.27/cookieid.102115766a3d8c4eeeb50.45254571/pos.15/;Málaga, Provincia de Málaga;6  habitaciones;5  baños;567  m²;A SOPHISTICATED VILLA IN NUEVA ANDALUCIA Discover this fully renovated house with professional security systems including cameras, alarms, and UP...;Hace 3 días;Kuhamia;Malaga
1.750€;Middle Floor Apartment in La Cala Golf;https://rd.clk.thribee.com/id.zX1rS51-o1p/origin.1/section.97/section_type.1/country.es/vertical.homes/iuid.43035trovit-web-6f6984d597-7ht4x66a3d8c4ef37e/tracking.%7B%22cmp%22%3A%22u%22%7D/what_d.Malaga/type.2/page.27/cookieid.102115766a3d8c4eeeb50.45254571/pos.16/;Málaga, Provincia de Málaga;2  habitaciones;2  baños;110  m²;Quality apartment offering panoramic mountain, sea and golf views located within La Cala Golf Resort with three 18 hole championship golf courses...;Hace 3 días;Kuhamia;Malaga
1.800€;Middle Floor Apartment in Costalita;https://rd.clk.thribee.com/id.1Md1aSF1xe1v/origin.1/section.97/section_type.1/country.es/vertical.homes/iuid.43035trovit-web-6f6984d597-7ht4x66a3d8c4ef37e/tracking.%7B%22cmp%22%3A%22u%22%7D/what_d.Malaga/type.2/page.27/cookieid.102115766a3d8c4eeeb50.45254571/pos.17/;Málaga, Provincia de Málaga;3  habitaciones;3  baños;135  m²;Middle Floor Apartment, Costalita, Costa del Sol. 3 Bedrooms, 3 Bathrooms, Built 130 m², Terrace 20 m². Setting: Beachside, Close To Golf, Close...;Hace 3 días;Kuhamia;Malaga
2.500€;Detached Villa in Artola;https://rd.clk.thribee.com/id.1eb1my1YV1f1x/origin.1/section.97/section_type.1/country.es/vertical.homes/iuid.43035trovit-web-6f6984d597-7ht4x66a3d8c4ef37e/tracking.%7B%22cmp%22%3A%22u%22%7D/what_d.Malaga/type.2/page.27/cookieid.102115766a3d8c4eeeb50.45254571/pos.18/;Málaga, Provincia de Málaga;4  habitaciones;3  baños;250  m²;...the beach, shops and restaurants. The villa is ideally located within easy access of the A7 where Marbella is only a 10 minute drive and Malaga...;Hace 3 días;Kuhamia;Malaga
995€;Piso en alquiler, C/ Caridad, M173603;https://rd.clk.thribee.com/id.4SbN1Y_31B/origin.1/section.97/section_type.1/country.es/vertical.homes/iuid.43035trovit-web-6f6984d597-7ht4x66a3d8c4ef37e/tracking.%7B%22cmp%22%3A%22u%22%7D/what_d.Malaga/type.2/page.27/cookieid.102115766a3d8c4eeeb50.45254571/pos.19/;;2  habitaciones;1  baños;66  m²;...antes del 31 de julio. Y además, ¡sin comisiones de agencia! Piso en alquiler de 2 dormitorios en la localidad de Estepona, provincia de Málaga...;Hace 3 días;Kuhamia;Malaga
5.500€;Middle Floor Apartment in Puerto Banús;https://rd.clk.thribee.com/id.v1oio161SaV/origin.1/section.97/section_type.1/country.es/vertical.homes/iuid.43035trovit-web-6f6984d597-7ht4x66a3d8c4ef37e/tracking.%7B%22cmp%22%3A%22u%22%7D/what_d.Malaga/type.2/page.27/cookieid.102115766a3d8c4eeeb50.45254571/pos.20/;Málaga, Provincia de Málaga;3  habitaciones;2  baños;175  m²;...Malaga building with panoramic views of the city and mountains for long-term rent. Decorated in classic Italian style, these apartments will...;Hace 3 días;Kuhamia;Malaga
1.130€;Piso en alquiler, C/ Leander - Urb Rivera del Sol -, M147928;https://rd.clk.thribee.com/id.X1P1di4U51c/origin.1/section.97/section_type.1/country.es/vertical.homes/iuid.43035trovit-web-6f6984d597-7ht4x66a3d8c4ef37e/tracking.%7B%22cmp%22%3A%22u%22%7D/what_d.Malaga/type.2/page.27/cookieid.102115766a3d8c4eeeb50.45254571/pos.21/;;2  habitaciones;2  baños;66  m²;...del 31 de julio. Y además, ¡sin comisiones de agencia! Piso de 66 m² en alquiler de 2 dormitorios, ubicado en la provincia de Mijas, Málaga...;Hace 3 días;Kuhamia;Malaga
2.500€;Middle Floor Apartment in The Golden Mile;https://rd.clk.thribee.com/id.1Q1EU1hb1Mu1F/origin.1/section.97/section_type.1/country.es/vertical.homes/iuid.43035trovit-web-6f6984d597-7ht4x66a3d8c4ef37e/tracking.%7B%22cmp%22%3A%22u%22%7D/what_d.Malaga/type.2/page.27/cookieid.102115766a3d8c4eeeb50.45254571/pos.22/;Málaga, Provincia de Málaga;3  habitaciones;2  baños;180  m²;Available rental from september-end of june 2025! This bright and spacious first-floor apartment in Marbella Real (Marbella Golden Mile) offers a...;Hace 3 días;Kuhamia;Malaga
1.600€;Piso con preciosas vistas al mar en centro de Marbella;https://rd.clk.thribee.com/id.z1K1F1Z1G13h1C/origin.1/section.97/section_type.1/country.es/vertical.homes/iuid.43035trovit-web-6f6984d597-7ht4x66a3d8c4ef37e/tracking.%7B%22cmp%22%3A%22u%22%7D/what_d.Malaga/type.2/page.27/cookieid.102115766a3d8c4eeeb50.45254571/pos.23/;Marbella, Provincia de Málaga;2  habitaciones;2  baños;90  m²;Disponible a partir del 1 de Octubre del 2024 hasta el 31 de Junio de 2024. Este bonito piso está situado en Marbella centro, a un paso de la pla...;Hace 3 días;Kuhamia;Malaga
1.650€;Middle Floor Apartment in Nueva Andalucía;https://rd.clk.thribee.com/id.1wt1y1Q1evZM/origin.1/section.97/section_type.1/country.es/vertical.homes/iuid.43035trovit-web-6f6984d597-7ht4x66a3d8c4ef37e/tracking.%7B%22cmp%22%3A%22u%22%7D/what_d.Malaga/type.2/page.27/cookieid.102115766a3d8c4eeeb50.45254571/pos.24/;Málaga, Provincia de Málaga;2  habitaciones;2  baños;84  m²;Property next to puerto banus. AVAILABLE JULY AND AUGUST 2024 AND THEN FROM SEPTEMBER UNTIL JUNE 2025 Cozy first floor apartment located in the r...;Hace 3 días;Kuhamia;Malaga
995€;Piso C/ Caridad Estepona Málaga 29051;https://rd.clk.thribee.com/id.1W1t1qzniCX/origin.1/section.97/section_type.1/country.es/vertical.homes/iuid.43035trovit-web-6f6984d597-7ht4x66a3d8c4ef37e/tracking.%7B%22cmp%22%3A%22u%22%7D/what_d.Malaga/type.2/page.27/cookieid.102115766a3d8c4eeeb50.45254571/pos.25/;29051, Provincia de Málaga;2  habitaciones;1  baños;66  m²;...antes del 31 de julio. Y además, ¡sin comisiones de agencia! Piso en alquiler de 2 dormitorios en la localidad de Estepona, provincia de Málaga...;Hace 3 días;Rentola;Malaga
4.200€;Ático Dúplex;https://rd.clk.thribee.com/id.UUj11oxZ1j/origin.1/section.97/section_type.1/country.es/vertical.homes/iuid.178656trovit-web-6f6984d597-pbqgv66a3d8c982da1/tracking.%7B%22cmp%22%3A%22u%22%7D/what_d.Malaga/type.2/page.32/cookieid.102115666a3d8c98284b1.64394723/pos.1/;29678, Provincia de Málaga;3  habitaciones;3  baños;156  m²;Ático triplex totalmente renovado y amueblado en la atractiva La Quinta Hills, a poca distancia en coche de San Pedro de Alcántara, Puerto Banús...;Hace 3 días;Rentola;Malaga
24.000€;Apartamento Planta Baja;https://rd.clk.thribee.com/id.A191vUuc1CR/origin.1/section.97/section_type.1/country.es/vertical.homes/iuid.178656trovit-web-6f6984d597-pbqgv66a3d8c982da1/tracking.%7B%22cmp%22%3A%22u%22%7D/what_d.Malaga/type.2/page.32/cookieid.102115666a3d8c98284b1.64394723/pos.2/;29005, Provincia de Málaga;4  habitaciones;5  baños;474  m²;Nos complace presentar este lujoso apartamento dúplex en planta baja con impresionantes vistas al mar y a la montaña en el prestigioso complejo E...;Hace 3 días;Rentola;Malaga
11.000€;Villa - Chalet;https://rd.clk.thribee.com/id.1W31H1Bli10D/origin.1/section.97/section_type.1/country.es/vertical.homes/iuid.178656trovit-web-6f6984d597-pbqgv66a3d8c982da1/tracking.%7B%22cmp%22%3A%22u%22%7D/what_d.Malaga/type.2/page.32/cookieid.102115666a3d8c98284b1.64394723/pos.3/;29678, Provincia de Málaga;4  habitaciones;5  baños;350  m²;Villa. Chalet, Guadalmina Baja, Costa del Sol. 4 Dormitorios, 5 Baños, Construidos 350 m², Terraza 100 m², Jardin/Terreno 950 m². Posición: Prime...;Hace 3 días;Rentola;Malaga
3.500€;Apartamento Planta Baja;https://rd.clk.thribee.com/id.181nxg41I1HT/origin.1/section.97/section_type.1/country.es/vertical.homes/iuid.178656trovit-web-6f6984d597-pbqgv66a3d8c982da1/tracking.%7B%22cmp%22%3A%22u%22%7D/what_d.Malaga/type.2/page.32/cookieid.102115666a3d8c98284b1.64394723/pos.4/;29660, Provincia de Málaga;3  habitaciones;2  baños;177  m²;Apartamento Planta Baja, Puerto Banús, Costa del Sol. 3 Dormitorios, 2 Baños, Construidos 177 m², Terraza 13 m². Posición: Lado de la Playa, Cerc...;Hace 3 días;Rentola;Malaga
2.500€;Alquiler Larga temporada EN MARBELLA URB. Panorama;https://rd.clk.thribee.com/id.esCP12esJ/origin.1/section.97/section_type.1/country.es/vertical.homes/iuid.178656trovit-web-6f6984d597-pbqgv66a3d8c982da1/tracking.%7B%22cmp%22%3A%22u%22%7D/what_d.Malaga/type.2/page.32/cookieid.102115666a3d8c98284b1.64394723/pos.5/;29600, Marbella, Provincia de Málaga;3  habitaciones;2  baños;172  m²;REFERENCIA ¡Descubre esta increíble finca rústica en alquiler ubicada en la prestigiosa urbanización Panorama, en Marbella! Con vistas espectacul...;Hace 3 días;Rentola;Malaga
1.600€;Piso en alquiler huelin - malaga;https://rd.clk.thribee.com/id.w8690sqX/origin.1/section.97/section_type.1/country.es/vertical.homes/iuid.178656trovit-web-6f6984d597-pbqgv66a3d8c982da1/tracking.%7B%22cmp%22%3A%22u%22%7D/what_d.Malaga/type.2/page.32/cookieid.102115666a3d8c98284b1.64394723/pos.6/;29002, Provincia de Málaga;3  habitaciones;1  baños;85  m²;Referencia: ma03081 disponible de junio a septiembre ¡descubre tu nuevo hogar en la hermosa costa del sol! Este encantador piso, situado en un re...;Hace 3 días;Rentola;Malaga
1.500€;Apartamento Planta Baja;https://rd.clk.thribee.com/id.710mI1j1O1xd/origin.1/section.97/section_type.1/country.es/vertical.homes/iuid.178656trovit-web-6f6984d597-pbqgv66a3d8c982da1/tracking.%7B%22cmp%22%3A%22u%22%7D/what_d.Malaga/type.2/page.32/cookieid.102115666a3d8c98284b1.64394723/pos.7/;29780, Provincia de Málaga;2  habitaciones;2  baños;49  m²;¡Bienvenido a este impresionante apartamento en planta baja en Calahonda Playa, Mijas Costa! Este retiro bellamente renovado de 2 dormitorios y 2...;Hace 3 días;Rentola;Malaga
3.500€;Apartamento Planta Baja;https://rd.clk.thribee.com/id.Yw1n4o1-81M/origin.1/section.97/section_type.1/country.es/vertical.homes/iuid.178656trovit-web-6f6984d597-pbqgv66a3d8c982da1/tracking.%7B%22cmp%22%3A%22u%22%7D/what_d.Malaga/type.2/page.32/cookieid.102115666a3d8c98284b1.64394723/pos.8/;29601, Provincia de Málaga;3  habitaciones;3  baños;146  m²;Apartamento Planta Baja, Marbella, Costa del Sol. 3 Dormitorios, 3 Baños, Construidos 146 m², Terraza 30 m². Posición: Cerca de Golf, Cerca del M...;Hace 3 días;Rentola;Malaga
6.000€;Apartamento Planta Baja;https://rd.clk.thribee.com/id.1v101TKxb1qv/origin.1/section.97/section_type.1/country.es/vertical.homes/iuid.178656trovit-web-6f6984d597-pbqgv66a3d8c982da1/tracking.%7B%22cmp%22%3A%22u%22%7D/what_d.Malaga/type.2/page.32/cookieid.102115666a3d8c98284b1.64394723/pos.9/;29680, Provincia de Málaga;3  habitaciones;3  baños;231  m²;Excelente apartamento. Al lado de la playa, con vistas al mar, con una estupenda terraza cubierta de unos 25m2. La propiedad ofrece excelentes ca...;Hace 3 días;Rentola;Malaga
2.500€;856245 - Garden Apartment For rent in Calahonda, Mijas, Málaga, Spain;https://rd.clk.thribee.com/id.pG1O1Vx178g/origin.1/section.97/section_type.1/country.es/vertical.homes/iuid.178656trovit-web-6f6984d597-pbqgv66a3d8c982da1/tracking.%7B%22cmp%22%3A%22u%22%7D/what_d.Malaga/type.2/page.32/cookieid.102115666a3d8c98284b1.64394723/pos.10/;29650,;2  habitaciones;2  baños;88  m²;Front line beach! Beautiful apartment front line beach available for long term rental with it''''s on private garden, in Urbanization Mi Capricho...;Hace 3 días;Rentola;Malaga
2.500€;Estupendo Ático luminoso en la parte baja de Cristo de la Epidemia;https://rd.clk.thribee.com/id.j1M1pB127eX/origin.1/section.97/section_type.1/country.es/vertical.homes/iuid.178656trovit-web-6f6984d597-pbqgv66a3d8c982da1/tracking.%7B%22cmp%22%3A%22u%22%7D/what_d.Malaga/type.2/page.32/cookieid.102115666a3d8c98284b1.64394723/pos.11/;29012, Provincia de Málaga;2  habitaciones;1  baños;100  m²;REFERENCIA: MA00548 Piso en Málaga zona El Ejido-La Merced-La Victoria, 110 m. De superficie, 2 habitaciones, un baño, propiedad en buen...;Hace 3 días;Rentola;Malaga
5.500€;Apartamento Planta Media;https://rd.clk.thribee.com/id.1K14O1H1U1YVB/origin.1/section.97/section_type.1/country.es/vertical.homes/iuid.178656trovit-web-6f6984d597-pbqgv66a3d8c982da1/tracking.%7B%22cmp%22%3A%22u%22%7D/what_d.Malaga/type.2/page.32/cookieid.102115666a3d8c98284b1.64394723/pos.12/;29660, Provincia de Málaga;3  habitaciones;2  baños;175  m²;...Málaga con vistas panorámicas a la ciudad y montaña en alquiler de larga temporada. Decorado estilo clásico italiano, ¡estos apartamentos no...;Hace 3 días;Rentola;Malaga
2.700€;Apartamento Planta Media;https://rd.clk.thribee.com/id.1Z1v1N121C19O1v/origin.1/section.97/section_type.1/country.es/vertical.homes/iuid.178656trovit-web-6f6984d597-pbqgv66a3d8c982da1/tracking.%7B%22cmp%22%3A%22u%22%7D/what_d.Malaga/type.2/page.32/cookieid.102115666a3d8c98284b1.64394723/pos.13/;29670, Provincia de Málaga;3  habitaciones;2  baños;94  m²;Este precioso apartamento de planta media se encuentra en Los Arqueros, San Pedro de Alcántara. Consta de 3 dormitorios dobles y 2 baños, una coc...;Hace 3 días;Rentola;Malaga
4.750€;Apartamento Planta Baja;https://rd.clk.thribee.com/id.c1761m101HO/origin.1/section.97/section_type.1/country.es/vertical.homes/iuid.178656trovit-web-6f6984d597-pbqgv66a3d8c982da1/tracking.%7B%22cmp%22%3A%22u%22%7D/what_d.Malaga/type.2/page.32/cookieid.102115666a3d8c98284b1.64394723/pos.14/;29660, Provincia de Málaga;3  habitaciones;3  baños;178  m²;Apartamento Planta Baja, Puerto Banús, Costa del Sol. 3 Dormitorios, 3 Baños, Construidos 178 m², Terraza 25 m². Posición: Lado de la Playa, Cerc...;Hace 3 días;Rentola;Malaga
3.500€;Apartamento Planta Media;https://rd.clk.thribee.com/id.v14R1UDT1K1S/origin.1/section.97/section_type.1/country.es/vertical.homes/iuid.178656trovit-web-6f6984d597-pbqgv66a3d8c982da1/tracking.%7B%22cmp%22%3A%22u%22%7D/what_d.Malaga/type.2/page.32/cookieid.102115666a3d8c98284b1.64394723/pos.15/;29601, Provincia de Málaga;2  habitaciones;2  baños;120  m²;Embárcate en un retiro extraordinario en el recientemente revelado enclave seguro de Palo Alto. Sumérgete en la variedad de ofertas presentadas p...;Hace 3 días;Rentola;Malaga
3.000€;Ático;https://rd.clk.thribee.com/id.-14191p1l1dBQ/origin.1/section.97/section_type.1/country.es/vertical.homes/iuid.178656trovit-web-6f6984d597-pbqgv66a3d8c982da1/tracking.%7B%22cmp%22%3A%22u%22%7D/what_d.Malaga/type.2/page.32/cookieid.102115666a3d8c98284b1.64394723/pos.16/;29660, Provincia de Málaga;3  habitaciones;2  baños;200  m²;Increíble ático en Nueva Andalucía de 3 dormitorios con una impresionante terraza con vistas a la montaña y al golf de los Los Naranjos. La vivie...;Hace 3 días;Rentola;Malaga
3.250€;Ático;https://rd.clk.thribee.com/id.1F1P1V173161W1t/origin.1/section.97/section_type.1/country.es/vertical.homes/iuid.178656trovit-web-6f6984d597-pbqgv66a3d8c982da1/tracking.%7B%22cmp%22%3A%22u%22%7D/what_d.Malaga/type.2/page.32/cookieid.102115666a3d8c98284b1.64394723/pos.17/;29005, Provincia de Málaga;2  habitaciones;2  baños;128  m²;Experimente una vida de lujo en este impresionante ático dúplex de dos dormitorios, con una terraza solárium en la azotea. Recientemente reformad...;Hace 3 días;Rentola;Malaga
1.900€;Ático en Urb. Ribera del Corvo, La Marina de Sotogrande;https://rd.clk.thribee.com/id.B1nJf1pk1G1-/origin.1/section.97/section_type.1/country.es/vertical.homes/iuid.178656trovit-web-6f6984d597-pbqgv66a3d8c982da1/tracking.%7B%22cmp%22%3A%22u%22%7D/what_d.Malaga/type.2/page.32/cookieid.102115666a3d8c98284b1.64394723/pos.18/;11311,;3  habitaciones;3  baños;115  m²;...lugar a una vida social muy selecta y animada. Se encuentra a 15 minutos del aeropuerto de Gibraltar y a 75 minutos del aeropuerto de Málaga...;Hace 3 días;Rentola;Malaga
1.650€;Apartamento Planta Media;https://rd.clk.thribee.com/id.leb1r18a151z/origin.1/section.97/section_type.1/country.es/vertical.homes/iuid.178656trovit-web-6f6984d597-pbqgv66a3d8c982da1/tracking.%7B%22cmp%22%3A%22u%22%7D/what_d.Malaga/type.2/page.32/cookieid.102115666a3d8c98284b1.64394723/pos.19/;29689, Provincia de Málaga;2  habitaciones;2  baños;88  m²;Este encantador apartamento de 2 dormitorios y 2 baños se encuentra en Costa Nagüeles 3, en la prestigiosa zona de Marbella conocida como la Mill...;Hace 3 días;Rentola;Malaga
3.300€;Ático Dúplex;https://rd.clk.thribee.com/id.1T1w1R1B1sBE1Y/origin.1/section.97/section_type.1/country.es/vertical.homes/iuid.178656trovit-web-6f6984d597-pbqgv66a3d8c982da1/tracking.%7B%22cmp%22%3A%22u%22%7D/what_d.Malaga/type.2/page.32/cookieid.102115666a3d8c98284b1.64394723/pos.20/;29688, Provincia de Málaga;3  habitaciones;3  baños;203  m²;Bonito duplex, reformado de 3 domitorios, 2 banos, cerca del campo de golf atalaya y colegio atalaya a tan solo 10 minutos en coche Puerto Banus...;Hace 3 días;Rentola;Malaga
4.000€;Alquiler de Estudio en Guadalmina Beach;https://rd.clk.thribee.com/id.1E1e1M1F1Uc1dm/origin.1/section.97/section_type.1/country.es/vertical.homes/iuid.178656trovit-web-6f6984d597-pbqgv66a3d8c982da1/tracking.%7B%22cmp%22%3A%22u%22%7D/what_d.Malaga/type.2/page.32/cookieid.102115666a3d8c98284b1.64394723/pos.21/;29678, Marbella, Provincia de Málaga;2  habitaciones;2  baños;58  m²;REFERENCIA MA00670 Se alquila apartamento a estrenar y totalmente equipado dentro de la exclusiva Urbanizacion Guadalmina Beach. A solo 30 metros...;Hace 3 días;Rentola;Malaga
