precio;sub_descr;href;ubicacion;habitaciones;banios;mt2;otros;latitude;longitude;planta;CCAA
305.000 竄ｬ;ﾃ》ico en San Roque;/comprar/atico-san_roque_la_alcaidesa-44217199485_100500/;La Alcaidesa (San Roque);2 habs.;2 baﾃｱos;172 mﾂｲ;"ﾃ》ico de lujo dentro del resort de golf  la alcaidesa, a tan sﾃｳlo un paseo de la playa .

Este exclusivo ﾃ｡tico ,dentro de una ubic...";36.245467;-5.3216787;;cadiz
430.000 竄ｬ;Dﾃｺplex en Vistahermosa;/comprar/duplex-el_puerto_de_santa_maria_vistahermosa-42581586724_526077/;Vistahermosa (El Puerto de Santa Marﾃｭa);3 habs.;3 baﾃｱos;130 mﾂｲ;"Marina sherry s.l. Vende este fantﾃ｡stico dﾃｺplex de 3 dormitorios en puerto sherry. A 2 minutos andando a la playa de la muralla.

...";36.5806638;-6.2606864;2ﾂｪ planta;cadiz
135.000 竄ｬ;Piso en Centro;/comprar/piso-centro_zona_noreste-45007848482_100500/;Centro-Zona Noreste (Chipiona);2 habs.;2 baﾃｱos;53 mﾂｲ;"Piso en el centro de chipiona, quedando a unos 10 minutos a pie de playa de regla
La vivienda es 1ﾂｪ planta, quedando ubicada al fo...";36.7345293;-6.4321848;1ﾂｪ planta;cadiz
85.000 竄ｬ;Piso en Carboneros;/comprar/piso-la_soledad_la_coquina_los_gallos-36692774186_100500/;La Soledad-La Coquina-Los Gallos (Chiclana de la Frontera);2 habs.;1 baﾃｱo;45 mﾂｲ;"沽 ﾂ｡No pierdas la oportunidad de este piso totalmente reformado y listo para entrar a vivir o como inversiﾃｳn!

Ubicado en una exce...";36.4119433;-6.1662192;1ﾂｪ planta;cadiz
120.000 竄ｬ;Casa en calle de Nuestra Seﾃｱora de la Paz;/comprar/casa-medina_sidonia_centro_urbano-42535272783_100500/;Medina Sidonia;12 habs.;9 baﾃｱos;500 mﾂｲ;Oportunidad!!!!!! Finca completa con un sin fin de posibilidades, con una superficie de parcela de 261 metros cuadrados podrﾃｭa ser...;36.459472;-5.926385;;cadiz
98.000 竄ｬ;Piso en Avenida del Universo;/comprar/piso-centro_zona_noreste-44244506640_100500/;Centro-Zona Noreste (Chipiona);2 habs.;;48 mﾂｲ;"Referencia: 959

Piso ubicado junto al polideportivo, a 1200 metros de la playa de regla
Consta de salﾃｳn - comedor con aire acondi...";36.7314714;-6.4278462;1ﾂｪ planta;cadiz
119.900 竄ｬ;Piso en Centro;/comprar/piso-jerez_de_la_frontera_centro11403-21703185415_100500/;Centro (Jerez de la Frontera);3 habs.;1 baﾃｱo;82 mﾂｲ;"Piso de 3 dormitorios en planta baja en pleno corazﾃｳn de la ciudad.
Vivienda en urbanizaciﾃｳn cerrada junto a la muralla en pleno c...";36.6872893;-6.1427716;Bajo;cadiz
370.000 竄ｬ;Chalet en Camino Pista de Montijo;/comprar/chalet-centro_zona_noreste-44183948116_104700/;Centro-Zona Noreste (Chipiona);4 habs.;3 baﾃｱos;194 mﾂｲ;La oportunidad de comprar la vivienda de tus sueﾃｱos, este espectacular chalet se encuentra en valdeconejos - montijo, en una urban...;36.757996456;-6.405688275;;cadiz
475.000 竄ｬ;Casa adosada en Carretera Nueva de La Barrosa,  S/N;/comprar/casa_adosada-costa_de_sancti_petri_playa_de_la_barrosa-3737297600_109700/;Costa de Sancti Petri-Playa de La Barrosa (Chiclana de la Frontera);3 habs.;3 baﾃｱos;155 mﾂｲ;Casa adosada de obra nueva, de 155 m2 de superficie construida, y situada en la zona de Chiclana de la Frontera.  Estﾃ｡ estructurada en 3 habitaciones, 3 baﾃｱos ( 2 completos, 1 auxiliar) y terraza. Proporciona como acabados carpinterﾃｭa exterior en pvc. La Casa adosada tiene portero automﾃ｡tico. Aporta como extras garaje.;36,3878235;-6,1704722;;cadiz
199.999 竄ｬ;Piso en Montealto;/comprar/piso-jerez_de_la_frontera_norte11407-39172109929_100500/;Norte (Jerez de la Frontera);4 habs.;3 baﾃｱos;130 mﾂｲ;"Magnﾃｭfico dﾃｺplex de cuatro dormitorios con terraza en zona norte. La distribuciﾃｳn es la siguiente:
Parte de abajo: salﾃｳn comedor c...";36.70201;-6.1170502;4ﾂｪ planta;cadiz
74.000 竄ｬ;Piso en Madre de Dios;/comprar/piso-jerez_de_la_frontera_sur11408-45038104352_100500/;Sur (Jerez de la Frontera);3 habs.;1 baﾃｱo;85 mﾂｲ;Inmueble sin comisiﾃｳn de agencia inmobiliaria, financiaciﾃｳn con condiciones preferentes! Piso en segunda planta con ascensor dispo...;36.670428;-6.1297908;2ﾂｪ planta;cadiz
230.000 竄ｬ;Dﾃｺplex en Avenida de las Piletas;/comprar/duplex-centro_calzada-44242304183_104700/;Centro-Calzada (Sanlﾃｺcar de Barrameda);4 habs.;2 baﾃｱos;83 mﾂｲ;Vivienda tipo dﾃｺplex en 3ﾂｺ linea de playa, avenida de las piletas, a  dos minutos de la playa y de la plaza cabildo. Esta vivienda...;36.7826465;-6.3595831;;cadiz
260.000 竄ｬ;ﾃ》ico en calle de Juan XXIII;/comprar/atico-centro_calzada-44232836696_104700/;Centro-Calzada (Sanlﾃｺcar de Barrameda);3 habs.;1 baﾃｱo;106 mﾂｲ;Espectacular ﾃ｡tico con una espectacular terraza de 50 metros en venta, calle juan xxiii, cerca de la calzada, plaza cinema. La zon...;36.7828001;-6.3555924;;cadiz
202.000 竄ｬ;Casa adosada en calle de la Gﾃｳndola;/comprar/casa_adosada-centro_zona_noreste-43412544915_100500/;Centro-Zona Noreste (Chipiona);3 habs.;2 baﾃｱos;104 mﾂｲ;En esta vivienda puedes cumplir el sueﾃｱo de vivir en chipiona durante todo el aﾃｱo, esporﾃ｡dicamente o como mejor te venga, sin perd...;36.7376533;-6.424584149;;cadiz
139.900 竄ｬ;Piso en calle Fariﾃｱas;/comprar/piso-centro_calzada-43395676587_101800/;Centro-Calzada (Sanlﾃｺcar de Barrameda);3 habs.;1 baﾃｱo;78 mﾂｲ;"Magnﾃｭfica oportunidad en el centro de sanlﾃｺcar de barrameda. 
Piso en perfecto estado para entrar a vivir, cuenta con 3 habitacion...";36.7806818;-6.3487737;2ﾂｪ planta;cadiz
320.000 竄ｬ;Casa en Laguna del Moral;/comprar/casa-aguadulce_almadraba_punta_candor11520-40883676126_103800/;Aguadulce-Almadraba-Punta Candor (Rota);3 habs.;3 baﾃｱos;196 mﾂｲ;Si buscas algo como inversiﾃｳn, ﾃｩsta puede ser tu oportunidad para sacarle rendimiento ya que se encuentra alquilada!!! Espectacula...;36.631275;-6.378533;;cadiz
125.000 竄ｬ;Piso en calle de la Gaviota;/comprar/piso-centro_zona_noreste-32535098811_100500/;Centro-Zona Noreste (Chipiona);2 habs.;1 baﾃｱo;53 mﾂｲ;"Referencia: 637

Piso en planta baja con garaje y trastero. 

Consta de amplio salﾃｳn- comedor, cocina americana completamente amue...";36.73359422;-6.427112718;Bajo;cadiz
141.000 竄ｬ;Casa adosada en Paseo Victoria Eugenia, 16;/comprar/casa_adosada-san_garcia_getares-3538890421_109700/;San Garcﾃｭa-Getares (Algeciras);3 habs.;2 baﾃｱos;85 mﾂｲ;Tipo a2. Casa adosada de obra nueva, de 85 mﾂｲ de superficie construida, y situada en la zona de algeciras.  Estﾃ｡ estructurada en 3...;36.1223894;-5.4473063;;cadiz
98.000 竄ｬ;Piso en calle Benjumeda;/comprar/piso-cadiz_capital_centro_historico11001-45015707757_100500/;Centro Histﾃｳrico (Cﾃ｡diz Capital);2 habs.;1 baﾃｱo;60 mﾂｲ;ﾂｿBuscas una oportunidad ﾃｺnica para invertir en inmuebles? Luz del sur inmobiliaria tiene la respuesta: un apartamento con un poten...;36.5331416;-6.2988901;Bajo;cadiz
1.890.000 竄ｬ;Chalet en Novo Sancti Petri;/comprar/chalet-novo_sancti_petri_loma_de_sancti_petri11139-19175265123_100500/;Novo Sancti Petri-Loma de Sancti Petri (Chiclana de la Frontera);7 habs.;5 baﾃｱos;533 mﾂｲ;"Presenta tu oferta
No busques mﾃ｡s, este magnﾃｭfico chalet de lujo en la exclusiva urbanizaciﾃｳn novo sancti-petri, tiene todo lo que...";36.3442624;-6.1515455;;cadiz
320.000 竄ｬ;Piso en Paseo Marﾃｭtimo;/comprar/piso-san_jose_varela_la_laguna11009-42504188898_100500/;San Josﾃｩ-Varela-La Laguna (Cﾃ｡diz Capital);3 habs.;1 baﾃｱo;110 mﾂｲ;"ﾂｿSueﾃｱas con vivir cerca del mar y rodeado de comodidades? ﾂ｡Este piso es la oportunidad que estabas esperando!

Inmobiliaria vivenc...";36.5102905;-6.2777008;4ﾂｪ planta;cadiz
375.000 竄ｬ;Casa adosada en Villamaruja-Soto del Real;/comprar/casa_adosada-soto_del_real_villamaruja_cobreros_viejo-42532486579_100500/;Soto del Real-Villamaruja-Cobreros Viejo (San Fernando);4 habs.;3 baﾃｱos;191 mﾂｲ;Situada en la zona de villamaruja se accede al inmueble desde un jardﾃｭn delantero de  54 mﾂｲ con cﾃｩsped artificial y garaje cerrado...;36.4536642;-6.2126158;;cadiz
1.070.000 竄ｬ;Finca rﾃｺstica en Arcos de la Frontera;/comprar/finca_rustica-arcos_de_la_frontera_centro_urbano-35876335625_105600/;Arcos de la Frontera;6 habs.;5 baﾃｱos;479 mﾂｲ;"Descripciﾃｳn del objeto:
Gepflegtes, tripadviser ausgezeichnetes boutique b&b mit mﾃｶglichkeit der pferdehaltung
Well-maintained bou...";36.7414518;-5.7930231;;cadiz
250.000 竄ｬ;Chalet en Camino del Olivar;/comprar/chalet-centro_zona_noreste-44204634881_100500/;Centro-Zona Noreste (Chipiona);5 habs.;4 baﾃｱos;160 mﾂｲ;Od1116. Imagﾃｭnate vivir en una zona tranquila, donde lo que oigas todos los dﾃｭas sean los cantos de los pﾃ｡jaros en una gran vivien...;36.7285445;-6.422082;;cadiz
A consultar;Chalet en calle de Canarias, 13;/comprar/chalet-la_atunara_perianez11315-43383981820_109700/;La Atunara-Periﾃ｡ﾃｱez (La Lﾃｭnea de la Concepciﾃｳn);;;35 mﾂｲ;. Oportunidad de inversiﾃｳn: pendiente de posesiﾃｳn. Oportunidad de inversiﾃｳn: pendiente de lpo o cfo. Oportunidad de inversiﾃｳn: pen...;36.1746;-5.33765;;cadiz
A consultar;Piso en calle de Santa Ana, 5;/comprar/piso-nucleo_urbano_urbanizaciones-38369645143_100500/;Nﾃｺcleo Urbano-Urbanizaciones (Chiclana de la Frontera);2 habs.;2 baﾃｱos;85 mﾂｲ;ﾂ｡Atenciﾃｳn! Tenemos una nueva oferta especial que no te puedes perder. Presentamos nuestro prﾃｳximo edificio plurifamiliar de 8 vivi...;36.4166;-6.14888;Bajo;cadiz
700.000 竄ｬ;Chalet en Avenida del Pinar;/comprar/chalet-jerez_de_la_frontera_norte11407-41748670471_103800/;Norte (Jerez de la Frontera);4 habs.;4 baﾃｱos;657 mﾂｲ;Chalet en monte alto en venta en avenida del pinar, en parcela de 650 mﾂｲ y 495 mﾂｲ construidos, toda la construcciﾃｳn en planta baja...;36.7028236;-6.1359933;;cadiz
128.000 竄ｬ;Piso en Loreto - Puntales;/comprar/piso-la_paz_segunda_aguado_loreto11011-44173992232_100500/;La Paz-Segunda Aguado-Loreto (Cﾃ｡diz Capital);3 habs.;1 baﾃｱo;48 mﾂｲ;"Inmonline cadiz - real estate presenta esta coqueta y luminosa vivienda en exclusiva  en la zona de puntales.

Se trata de una seg...";36.507016829;-6.266322196;2ﾂｪ planta;cadiz
320.000 竄ｬ;Apartamento en La Alcaidesa;/comprar/apartamento-la_linea_de_la_concepcion_la_alcaidesa-41734197483_100500/;La Alcaidesa (La Lﾃｭnea de la Concepciﾃｳn);3 habs.;2 baﾃｱos;125 mﾂｲ;"Apartamento de lujo dentro de resort de golf  la alcaidesa.

A pasos de la playa, este apartamento estﾃ｡ listo para mudarte y disfr...";36.1688928;-5.3503107;Bajo;cadiz
205.900 竄ｬ;Piso en Delicias;/comprar/piso-este11406-43345416178_100500/;Este (Jerez de la Frontera);3 habs.;2 baﾃｱos;97 mﾂｲ;Magnifico piso de renta libre en zona este, tres olivo fase i. Consta de tres dormitorios, dos baﾃｱos completos, uno de ellos con p...;36.6838764;-6.0993592;3ﾂｪ planta;cadiz
380.000 竄ｬ;Casa pareada en calle Apartaclub La Barrosa;/comprar/casa_pareada-la_soledad_la_coquina_los_gallos-26709503192_100500/;La Soledad-La Coquina-Los Gallos (Chiclana de la Frontera);3 habs.;2 baﾃｱos;122 mﾂｲ;Construcciﾃｳn en proceso de 4 magnﾃｭficas viviendas pareadas en los gallos, dentro de la urbanizaciﾃｳn apartaclub la barrosa, zona mu...;36.395276796;-6.176005541;;cadiz
290.000 竄ｬ;Piso en Paseo Luis Arenal Plat;/comprar/piso-la_paz_segunda_aguado_loreto11012-44183199240_501539/;La Paz-Segunda Aguado-Loreto (Cﾃ｡diz Capital);3 habs.;2 baﾃｱos;115 mﾂｲ;Piso luminoso y soleado, totalmente exterior. Situado en una buena zona,  rodeado de todos los servicios (bus, trenes, centro come...;36.5228246;-6.2779172;1ﾂｪ planta;cadiz
375.000 竄ｬ;Casa pareada en Chapin;/comprar/casa_pareada-noreste11405-43431061573_100500/;Noreste (Jerez de la Frontera);5 habs.;3 baﾃｱos;158 mﾂｲ;"Vivienda de 5 dormitorios en una zona privilegiada. 
La vivienda consta de amplio jardﾃｭn de entrada con piscina privada, zona para...";36.6899683;-6.1245707;;cadiz
238.000 竄ｬ;Piso en La Paz-Segunda Aguado-Loreto;/comprar/piso-la_paz_segunda_aguado_loreto-39219994132_516894/;La Paz-Segunda Aguado-Loreto (Cﾃ｡diz Capital);3 habs.;2 baﾃｱos;93 mﾂｲ;Cadizsur servicios inmobiliarios les ofrece a la venta ﾃｩsta vivienda en la zona de el corte inglﾃｩs, paseo de la bahﾃｭa, rodeado de ...;36.519927;-6.2773166;10ﾂｪ planta;cadiz
130.000 竄ｬ;Casa en calle del Tulipﾃ｡n;/comprar/casa-jerez_de_la_frontera_oeste11408-42512812301_996776/;Oeste (Jerez de la Frontera);3 habs.;2 baﾃｱos;120 mﾂｲ;Casa en venta en picadueﾃｱas alta. A junto a la salida de la circunvalaciﾃｳn de jerez , zona muy tranquila, la casa consta de 3 dorm...;36.6858309;-6.1509767;;cadiz
399.000 竄ｬ;Casa en Centro Urbano;/comprar/casa-nucleo_urbano_urbanizaciones-35930197925_100500/;Nﾃｺcleo Urbano-Urbanizaciones (Chiclana de la Frontera);4 habs.;3 baﾃｱos;226 mﾂｲ;"Estﾃ｡s buscando una casa en pleno centro de chiclana? Esta es perfecta para ti!

Casa seﾃｱorial en centro urbano con 276 mﾂｲ construi...";36.4194723;-6.1502653;;cadiz
180.000 竄ｬ;Piso en Hornos Punicos;/comprar/piso-hornos_punicos-45016792766_100500/;Hornos Pﾃｺnicos (San Fernando);2 habs.;1 baﾃｱo;60 mﾂｲ;Nueva generaciﾃｳn 2020 les ofrece un precioso piso amueblado, situado en una de las zonas mas demandadas de san fernando (hornos pﾃｺ...;36.4620131;-6.2033189;1ﾂｪ planta;cadiz
380.000 竄ｬ;Casa adosada en Carretera de La Barrosa. Urbanizaciﾃｳn Apartaclub La Barrosa,  3;/comprar/casa_adosada-la_soledad_la_coquina_los_gallos-4288281803_109700/;La Soledad-La Coquina-Los Gallos (Chiclana de la Frontera);3 habs.;2 baﾃｱos;123 mﾂｲ;Vivienda 2. Casa pareada de obra nueva, de 123 mﾂｲ de superficie construida en parcela de 350 mﾂｲ, y ubicada en la zona de chiclana ...;36.3979862;-6.1717174;;cadiz
270.000 竄ｬ;Piso en El Parque;/comprar/piso-el_cristo_cayetano_roldan11100-43403857903_103800/;El Cristo-Cayetano Roldﾃ｡n (San Fernando);4 habs.;2 baﾃｱos;129 mﾂｲ;No pierda esta magnﾃｭfica oportunidad. Cﾃｩntrico piso muy soleado!!! Con inmejorable ubicaciﾃｳn, situada en una de las mejores zonas ...;36.4663475;-6.2000394;4ﾂｪ planta;cadiz
484.704 竄ｬ;ﾃ》ico en calle Viento de Levante,  2 y 4;/comprar/atico-tarifa_centro_urbano-4341888359_109700/;Tarifa;2 habs.;1 baﾃｱo;110 mﾂｲ;ﾃ》ico A20. ﾃ》ico en un inmueble de obra nueva de 110 m2 de superficie construida y situado en la zona de Tarifa. Estﾃ｡ estructurado en 2 habitaciones, 1 baﾃｱo completo y terraza. Aporta como extras ascensor, garaje y trastero.;36,0597;-5,60918;;cadiz
230.000 竄ｬ;Piso en Otras;/comprar/piso-cadiz_capital_centro_historico11005-44189676419_100500/;Centro Histﾃｳrico (Cﾃ｡diz Capital);2 habs.;1 baﾃｱo;76 mﾂｲ;Vivienda de construcciﾃｳn reciente, que tiene dos dormitorios un baﾃｱo con baﾃｱera , cocina amueblada con electrodomﾃｩsticos, salﾃｳn y ...;36.5316301;-6.2936182;3ﾂｪ planta;cadiz
86.000 竄ｬ;Piso en Centro;/comprar/piso-jerez_de_la_frontera_centro11403-31668553585_100500/;Centro (Jerez de la Frontera);2 habs.;1 baﾃｱo;60 mﾂｲ;Inmueble sin comisiﾃｳn de agencia inmobiliaria, financiaciﾃｳn con condiciones preferentes! Piso de vpo en segunda planta dispone de ...;36.6881829;-6.1407708;2ﾂｪ planta;cadiz
152.900 竄ｬ;Piso en calle de Regino Martﾃｭnez, 1;/comprar/piso-algeciras_centro11201-42545475720_512568/;Centro (Algeciras);4 habs.;3 baﾃｱos;132 mﾂｲ;Fabuloso piso en el centro de algeciras en una de la calle mﾃ｡s cﾃｩntrica de la ciudad y rodeado de toda clase de servicios , frente...;36.132996;-5.448938;2ﾂｪ planta;cadiz
122.000 竄ｬ;Piso en calle Santiago de Compostela;/comprar/piso-sotogrande_costa11310-44218561862_519631/;Sotogrande Costa (Sotogrande);1 hab.;1 baﾃｱo;58 mﾂｲ;"Magnﾃｭfico apartamento en sotogrande.

En la prestigiosa urbanizaciﾃｳn royal golf

A estrenar tras reforma integral.

Muy cerca de m...";36.2915817;-5.2974743;Bajo;cadiz
149.900 竄ｬ;Apartamento en Centro;/comprar/apartamento-jerez_de_la_frontera_centro11403-44248337431_100500/;Centro (Jerez de la Frontera);1 hab.;1 baﾃｱo;54 mﾂｲ;Estupendo apartamento, muy bonito,  diﾃ｡fano, se distribuye  en  dormitorio, baﾃｱo con placa de ducha, salﾃｳn y cocina,  se vende per...;36.682862;-6.1393315;Bajo;cadiz
177.000 竄ｬ;ﾃ》ico en calle de Manuel Rances;/comprar/atico-el_mentidero_teatro_falla_alameda11004-41676804991_100500/;El Mentidero-Teatro Falla-Alameda (Cﾃ｡diz Capital);1 hab.;1 baﾃｱo;60 mﾂｲ;"Atico en el centro de cadiz, con licencia turistica, y funcionando actualmente como apartamento turﾃｭstico. 

 Este apartamento con...";36.5353;-6.29455;;cadiz
99.900 竄ｬ;Casa adosada en Arcos de la Frontera;/comprar/casa_adosada-arcos_de_la_frontera_centro_urbano-45098262406_100200/;Arcos de la Frontera;2 habs.;;90 mﾂｲ;Portichuelo: se vende casa en planta baja, esta vivienda ha sido recientemente reformada y se encuentra en perfecto estado. Dispon...;36.723345463;-5.935196032;;cadiz
420.000 竄ｬ;Piso en Avenida Cuatro de Diciembre de 1977;/comprar/piso-cadiz_capital_centro_historico11006-40882841329_100500/;Centro Histﾃｳrico (Cﾃ｡diz Capital);4 habs.;;142 mﾂｲ;Presentamos en exclusiva, este piso, en el centro de cadiz, con vistas de pajaro, al puerto gaditano desde el salon y varias habit...;36.5323;-6.29322;8ﾂｪ planta;cadiz
223.500 竄ｬ;Piso en Avenida Josﾃｩ Manuel Caballero Bonald,  s/n;/comprar/piso-noreste11405-3920023363_109700/;Noreste (Jerez de la Frontera);4 habs.;2 baﾃｱos;129 mﾂｲ;Esc. 10, 2ﾂｺ c. Piso en un edificio de obra nueva de 129 mﾂｲ de superficie construida y ubicado en la zona de jerez de la frontera, ...;36.7002516;-6.1088684;2ﾂｪ planta;cadiz
750.000 竄ｬ;Chalet en 2ﾂｪ Pista de La Barrosa;/comprar/chalet-sancti_petri_playa_de_la_barrosa11139-96700711729_100500/;Costa de Sancti Petri-Playa de La Barrosa (Chiclana de la Frontera);3 habs.;1 baﾃｱo;115 mﾂｲ;Se vende parcela urbana de 1.172 mﾂｲ aproximadamente en la playa de la barrosa, situada en una zona muy cercana a la principal zona...;36.3703403;-6.1796175;;cadiz
199.000 竄ｬ;Piso en Cobreros Viejo;/comprar/piso-soto_del_real_villamaruja_cobreros_viejo-45090697648_100500/;Soto del Real-Villamaruja-Cobreros Viejo (San Fernando);3 habs.;2 baﾃｱos;87 mﾂｲ;Piso de renta libre en edificio con ascensor que consta de salﾃｳn independiente, cocina completamente amueblada con electrodomﾃｩstic...;36.4557694;-6.2070342;3ﾂｪ planta;cadiz
105.000 竄ｬ;Piso en Madre de Dios;/comprar/piso-jerez_de_la_frontera_centro11401-40845937905_100500/;Centro (Jerez de la Frontera);2 habs.;2 baﾃｱos;63 mﾂｲ;En el centro, en la plaza de madre de dios, tenemos este bonito piso de dos habitaciones, cocina, salﾃｳn comedor de buenas dimensio...;36.6792888;-6.1293366;Bajo;cadiz
448.000 竄ｬ;Piso en Avenida de Andalucﾃｭa;/comprar/piso-playa_de_santa_maria_del_mar_bahia_blanca11007-45018351018_990852/;Playa de Santa Marﾃｭa del Mar-Bahﾃｭa Blanca (Cﾃ｡diz Capital);3 habs.;2 baﾃｱos;104 mﾂｲ;Te presentamos esta magnifica vivienda totalmente reformada en una de las mejores zonas de la avenida principal de cﾃ｡diz,  junto a...;36.5230271;-6.2863317;6ﾂｪ planta;cadiz
165.000 竄ｬ;Casa adosada en calle del Nogal;/comprar/casa_adosada-centro_zona_playas-43427786808_992948/;Centro-Zona Playas (Chipiona);2 habs.;2 baﾃｱos;68 mﾂｲ;Preciosa casa totalmente reformada con primeras calidades, en la zona mﾃ｡s comercial de chipiona, junto a la avda. De madrid y a 10...;36.732764604;-6.43165345;;cadiz
A consultar;Piso en calle Guadalquivir, 4;/comprar/piso-algeciras_arroyo_de_la_miel11206-44171935673_109700/;Arroyo de la Miel (Algeciras);3 habs.;2 baﾃｱos;78 mﾂｲ;. Oportunidad de inversiﾃｳn: pendiente de posesiﾃｳn. Oportunidad de inversiﾃｳn: pendiente de inscripciﾃｳn. Oportunidad de inversiﾃｳn: i...;36.122;-5.45239;;cadiz
170.000 竄ｬ;Piso en Este;/comprar/piso-rural11406-41687029145_100500/;Rural (Jerez de la Frontera);2 habs.;2 baﾃｱos;76 mﾂｲ;Se vende, piso en exclusiva, en terrazas de la ronda que consta de dos dormitorios, salﾃｳn comedor con terraza, cocina amueblada, l...;36.6461902;-5.9373153;1ﾂｪ planta;cadiz
215.000 竄ｬ;Piso en calle Santo Domingo;/comprar/piso-el_populo_santa_maria11006-44180530272_516894/;El Pﾃｳpulo-Santa Marﾃｭa (Cﾃ｡diz Capital);2 habs.;1 baﾃｱo;92 mﾂｲ;Cadizsur servicios inmobiliarios les anuncia la venta de este acogedor piso en cﾃ｡diz capital, ubicado en la zona de santa marﾃｭa-pa...;36.528374958;-6.29001271;1ﾂｪ planta;cadiz
220.000 竄ｬ;Piso en La Caleta - La Viﾃｱa;/comprar/piso-la_caleta_la_vina11005-40877722321_100500/;La Caleta-La Viﾃｱa (Cﾃ｡diz Capital);3 habs.;1 baﾃｱo;103 mﾂｲ;Luz del sur inmobiliaria te invita a descubrir el piso de tus sueﾃｱos en el corazﾃｳn de cﾃ｡diz. Un espacio ﾃｺnico de 100mﾂｲ, junto a la...;36.5294448;-6.2964298;1ﾂｪ planta;cadiz
330.000 竄ｬ;Piso en Paseo Marﾃｭtimo;/comprar/piso-san_jose_varela_la_laguna11010-43349826440_100500/;San Josﾃｩ-Varela-La Laguna (Cﾃ｡diz Capital);4 habs.;2 baﾃｱos;115 mﾂｲ;En venta piso de 115mﾂｲ construidos en cﾃ｡diz, junto al estadio nuevo mirandilla (antiguo ramﾃｳn de carranza) en una sﾃｩptima planta c...;36.503689517;-6.274666171;7ﾂｪ planta;cadiz
525.000 竄ｬ;Chalet en calle del ﾃ〕amo, 4;/comprar/chalet-nucleo_urbano_urbanizaciones-43360090371_108700/;Nﾃｺcleo Urbano-Urbanizaciones (Chiclana de la Frontera);10 habs.;2 baﾃｱos;374 mﾂｲ;"ﾂ｡Exclusiva propiedad en chiclana de la frontera!

Iad espaﾃｱa - marieta ludovica chesches se complace en ofrecer esta magnﾃｭfica pro...";36.4194;-6.14843;;cadiz
139.900 竄ｬ;Casa en Avenida de Cristﾃｳbal Colﾃｳn;/comprar/casa-centro_zona_noreste-43432091699_100500/;Centro-Zona Noreste (Chipiona);3 habs.;;127 mﾂｲ;ﾂ｡2 x 1! Extraordinarias vivienda en una misma finca con entradas independientes. La casa la cual da fachada a la calle dispone de ...;36.729157;-6.4232319;;cadiz
145.000 竄ｬ;Piso en Centro;/comprar/piso-el_puerto_de_santa_maria_centro-45029024229_100500/;Centro (El Puerto de Santa Marﾃｭa);2 habs.;1 baﾃｱo;83 mﾂｲ;"Piso en pleno centro de la ciudad con ascensor. 

Ubicado en pleno centro, rodeado de todo tipo de servicios, colegios, bares, res...";36.597872;-6.2295634;1ﾂｪ planta;cadiz
169.900 竄ｬ;Piso en Jerez;/comprar/piso-jerez_de_la_frontera_oeste11408-43402642284_100500/;Oeste (Jerez de la Frontera);2 habs.;2 baﾃｱos;93 mﾂｲ;"Vivienda practicamente nueva con solo dos aﾃｱos de antiguedad muy luminosa en zona ermita de guﾃｭa con buenas calidades!
El piso con...";36.678477049;-6.145995253;4ﾂｪ planta;cadiz
295.000 竄ｬ;Casa en Gallineras;/comprar/casa-camposoto_gallineras11100-44252618435_100500/;Camposoto-Gallineras (San Fernando);5 habs.;3 baﾃｱos;219 mﾂｲ;Situada en la zona del campo de hockey  consta de dos viviendas, ambas en planta baja distribuidas en los 219 mﾂｲ que tiene la parc...;36.4439322;-6.2091268;;cadiz
210.000 竄ｬ;Piso en Centro-Zona Playas;/comprar/piso-centro_zona_playas-44262094442_528322/;Centro-Zona Playas (Chipiona);3 habs.;2 baﾃｱos;85 mﾂｲ;Increﾃｭbles vistas las que nos ofrece este piso en primera lﾃｭnea de playa en cruz del mar, es una de la pocas oportunidades de adqu...;36.7452498;-6.4323031;2ﾂｪ planta;cadiz
139.000 竄ｬ;Piso en Alameda;/comprar/piso-san_fernando_centro-41710636889_103800/;Centro (San Fernando);2 habs.;1 baﾃｱo;90 mﾂｲ;Estupendo piso en venta  de 90 mﾂｲ, muy cﾃｩntrico en zona alameda.  Vivienda de 2 dormitorios, 1 baﾃｱo, cocina y salﾃｳn comedor. Dispo...;36.466629991;-6.194642188;1ﾂｪ planta;cadiz
420.000 竄ｬ;Casa en Glorieta;/comprar/casa-el_cristo_cayetano_roldan11100-41731169786_103800/;El Cristo-Cayetano Roldﾃ｡n (San Fernando);5 habs.;2 baﾃｱos;522 mﾂｲ;"Se vende fantasticaa finca de 522 mﾂｲ en e centro de san fernando. Consta de dos viviendas independientes, ambas en panta baja.
La ...";36.4732925;-6.1953789;;cadiz
550.000 竄ｬ;Chalet en Novo Sancti Petri-Loma de Sancti Petri;/comprar/chalet-novo_sancti_petri_loma_de_sancti_petri11139-37523059513_108500/;Novo Sancti Petri-Loma de Sancti Petri (Chiclana de la Frontera);4 habs.;3 baﾃｱos;140 mﾂｲ;Chalet independiente, de cuatro dormitorios en parcela de 700 mﾂｲ, en novo sancti petri (chiclana de la frontera). En planta baja t...;36.3587044;-6.1625787;;cadiz
450.000 竄ｬ;Chalet en Sanlﾃｺcar de Barrameda;/comprar/chalet-la_jara_distrito-40899031790_100500/;La Jara (Sanlﾃｺcar de Barrameda);6 habs.;4 baﾃｱos;306 mﾂｲ;"Fantﾃ｡stica vivienda en una de las mejores y mﾃ｡s demandadas zonas de sanlﾃｺcar de barrameda. 
Vivienda lista para entrar a vivir, se...";36.7721528;-6.3679262;;cadiz
143.000 竄ｬ;Piso en calle Sierra del Pinar;/comprar/piso-jerez_de_la_frontera_norte-35895916087_996776/;Norte (Jerez de la Frontera);1 hab.;1 baﾃｱo;63 mﾂｲ;Piso en venta en urb. Pie de rey, en zona norte, consta de un dormitorio, salﾃｳn cocina y baﾃｱo. Terraza privada de 25 mﾂｲ orientaciﾃｳ...;36.7064111;-6.1253418;2ﾂｪ planta;cadiz
