precio;sub_descr;href;ubicacion;habitaciones;banios;mt2;otros;publicado_hace;plataforma;CCAA
1.958€;Welcoming studio near La Trinidad, Málaga;https://rd.clk.thribee.com/id.1y1a1n1u1E1J04/origin.1/section.97/section_type.1/country.es/vertical.homes/iuid.232266trovit-web-85d48c649-c2jgv66981a8fca46e/tracking.%7B%22cmp%22%3A%22u%22%7D/what_d.Malaga/type.2/page.2/cookieid.102011166981a8fc9f948.54393907/pos.9/;29009, Provincia de Málaga;1  habitaciones;1  baños;-;Rental period for this listing is between 3. 24 months...;Hace 13 h 30 minutos;Rentola;Malaga
600€;Beautiful double bedroom in Miraflores;https://rd.clk.thribee.com/id.U741y1ZA1mQ/origin.1/section.97/section_type.1/country.es/vertical.homes/iuid.232266trovit-web-85d48c649-c2jgv66981a8fca46e/tracking.%7B%22cmp%22%3A%22u%22%7D/what_d.Malaga/type.2/page.2/cookieid.102011166981a8fc9f948.54393907/pos.10/;29011, Provincia de Málaga;3  habitaciones;1  baños;-;Rental period for this listing is between 3. 24 months...;Hace 13 h 30 minutos;Rentola;Malaga
360€;Pleasant single bedroom in Malaga close to La Union metro station;https://rd.clk.thribee.com/id.51R1Px1sz1P1I/origin.1/section.97/section_type.1/country.es/vertical.homes/iuid.232266trovit-web-85d48c649-c2jgv66981a8fca46e/tracking.%7B%22cmp%22%3A%22u%22%7D/what_d.Malaga/type.2/page.2/cookieid.102011166981a8fc9f948.54393907/pos.11/;29006, Provincia de Málaga;4  habitaciones;2  baños;-;Rental period for this listing is between 3. 24 months...;Hace 13 h 31 minutos;Rentola;Malaga
2.614€;Pleasant studio near La Trinidad;https://rd.clk.thribee.com/id.1Rvruw1LGj/origin.1/section.97/section_type.1/country.es/vertical.homes/iuid.232266trovit-web-85d48c649-c2jgv66981a8fca46e/tracking.%7B%22cmp%22%3A%22u%22%7D/what_d.Malaga/type.2/page.2/cookieid.102011166981a8fc9f948.54393907/pos.12/;29009, Provincia de Málaga;1  habitaciones;1  baños;-;Rental period for this listing is between 3. 24 months...;Hace 13 h 32 minutos;Rentola;Malaga
5.627€;Apartment in Estepona, Costa del Sol;https://rd.clk.thribee.com/id.1L19121h1D1m191J/origin.1/section.97/section_type.1/country.es/vertical.homes/iuid.232266trovit-web-85d48c649-c2jgv66981a8fca46e/tracking.%7B%22cmp%22%3A%22u%22%7D/what_d.Malaga/type.2/page.2/cookieid.102011166981a8fc9f948.54393907/pos.13/;29689, Estepona, Provincia de Málaga;4  habitaciones;2  baños;135  m²;A lovely beachfront apartment with a central air-conditioning system with amazing sea and beach views. It offers four bedrooms, a bright and spac...;Hace 13 h 33 minutos;Rentola;Malaga
275€;Single bedroom in a 4-bedroom apartment 15' walking from Campus Universitario;https://rd.clk.thribee.com/id.101R1m6f111S/origin.1/section.97/section_type.1/country.es/vertical.homes/iuid.232266trovit-web-85d48c649-c2jgv66981a8fca46e/tracking.%7B%22cmp%22%3A%22u%22%7D/what_d.Malaga/type.2/page.2/cookieid.102011166981a8fc9f948.54393907/pos.14/;29010, Provincia de Málaga;4  habitaciones;1  baños;-;Rental period for this listing is between 3. 24 months...;Hace 13 h 33 minutos;Rentola;Malaga
550€;Bright single bedroom not far from Manuel Navarrete Park;https://rd.clk.thribee.com/id.1O1n1G13P10WL/origin.1/section.97/section_type.1/country.es/vertical.homes/iuid.232266trovit-web-85d48c649-c2jgv66981a8fca46e/tracking.%7B%22cmp%22%3A%22u%22%7D/what_d.Malaga/type.2/page.2/cookieid.102011166981a8fc9f948.54393907/pos.15/;29014, Provincia de Málaga;5  habitaciones;3  baños;-;Rental period for this listing is between 3. 24 months...;Hace 13 h 34 minutos;Rentola;Malaga
1.683€;Great 2-bedroom house in Gualdalmina;https://rd.clk.thribee.com/id.1c41Uk1f1u1h1n/origin.1/section.97/section_type.1/country.es/vertical.homes/iuid.232266trovit-web-85d48c649-c2jgv66981a8fca46e/tracking.%7B%22cmp%22%3A%22u%22%7D/what_d.Malaga/type.2/page.2/cookieid.102011166981a8fc9f948.54393907/pos.16/;29678, Marbella, Provincia de Málaga;2  habitaciones;2  baños;-;Rental period for this listing is between 3. 24 months...;Hace 13 h 35 minutos;Rentola;Malaga
800€;Apartamento en alquiler en Benalmádena, Costa;https://rd.clk.thribee.com/id.1Kna0xdtO/origin.1/section.97/section_type.1/country.es/vertical.homes/iuid.232266trovit-web-85d48c649-c2jgv66981a8fca46e/tracking.%7B%22cmp%22%3A%22u%22%7D/what_d.Malaga/type.2/page.2/cookieid.102011166981a8fc9f948.54393907/pos.17/;29630, Benalmádena, Provincia de Málaga;2  habitaciones;1  baños;70  m²;Se alquila Apartamento con vistas al mar, a partir de septiembre a julio 2025, ubicado en la zona baja de Carvajal a tan solo 300 metros de la pl...;Hace 16 h 55 minutos;Todopisos;Malaga
2.200€;Atico Duplex en alquiler en Marbella, Costa del Sol;https://rd.clk.thribee.com/id.E0l1YL1J1rc/origin.1/section.97/section_type.1/country.es/vertical.homes/iuid.232266trovit-web-85d48c649-c2jgv66981a8fca46e/tracking.%7B%22cmp%22%3A%22u%22%7D/what_d.Malaga/type.2/page.2/cookieid.102011166981a8fc9f948.54393907/pos.18/;29601, Costa del Sol, Dos Hermanas, Provincia de Sevilla;3  habitaciones;3  baños;200  m²;Ático Dúplex, Guadalmina Alta, Costa del Sol. 3 Dormitorios, 3 Baños, Construidos 200 m², Terraza 30 m². Posición: Primera línea de Golf, Cerca d...;Hace 16 h 55 minutos;Todopisos;Malaga
4.750€;Ground Floor Apartment in Puerto Banús;https://rd.clk.thribee.com/id.1TN4z1LrV1Y/origin.1/section.97/section_type.1/country.es/vertical.homes/iuid.232266trovit-web-85d48c649-c2jgv66981a8fca46e/tracking.%7B%22cmp%22%3A%22u%22%7D/what_d.Malaga/type.2/page.2/cookieid.102011166981a8fc9f948.54393907/pos.19/;Banús, Cerdanyola del Vallès, Provincia de Barcelona;3  habitaciones;3  baños;178  m²;NOW FURNISHED Completely refurbished 3 bed 3 bath ground floor apartment beachside Puerto Banus. This property is totally new and comes with unde...;Hace 21 h 12 minutos;Kuhamia;Malaga
2.200€;Apartment in Guadalmina Baja, Costa del Sol;https://rd.clk.thribee.com/id.rx1A1w51B1w1Z/origin.1/section.97/section_type.1/country.es/vertical.homes/iuid.232266trovit-web-85d48c649-c2jgv66981a8fca46e/tracking.%7B%22cmp%22%3A%22u%22%7D/what_d.Malaga/type.2/page.2/cookieid.102011166981a8fc9f948.54393907/pos.20/;Marbella, Provincia de Málaga;2  habitaciones;2  baños;124  m²;Nice unfurnished first floor apartment located in the well known development of Alhambra del Golf in Guadalmina-Casasola, just 3 minutes from San...;Hace 21 h 12 minutos;Kuhamia;Malaga
2.000€;Apartment for rent in Estepona;https://rd.clk.thribee.com/id.1h1H1AgiK_E/origin.1/section.97/section_type.1/country.es/vertical.homes/iuid.232266trovit-web-85d48c649-c2jgv66981a8fca46e/tracking.%7B%22cmp%22%3A%22u%22%7D/what_d.Malaga/type.2/page.2/cookieid.102011166981a8fc9f948.54393907/pos.21/;Estepona, Provincia de Málaga;2  habitaciones;2  baños;100  m²;Very nice 2 Bedroom, 2 Bathroom south facing apartment. Front line golf views This is a temporary rental contract, renewable if both parties agre...;Hace 21 h 13 minutos;Kuhamia;Malaga
6.000€;Apartment for rent in Estepona;https://rd.clk.thribee.com/id.1wBJ131w1j1Z1x/origin.1/section.97/section_type.1/country.es/vertical.homes/iuid.232266trovit-web-85d48c649-c2jgv66981a8fca46e/tracking.%7B%22cmp%22%3A%22u%22%7D/what_d.Malaga/type.2/page.2/cookieid.102011166981a8fc9f948.54393907/pos.22/;Estepona, Provincia de Málaga;3  habitaciones;3  baños;127  m²;Doncella Beach, first line of the sea one of the most exclusive complexes in the Estepona area, just a few minutes walk from the marina, restaura...;Hace 21 h 13 minutos;Kuhamia;Malaga
425€;Appealing single bedroom in La Trinidad;https://rd.clk.thribee.com/id.QZ51Agnsa/origin.1/section.97/section_type.1/country.es/vertical.homes/iuid.232266trovit-web-85d48c649-c2jgv66981a8fca46e/tracking.%7B%22cmp%22%3A%22u%22%7D/what_d.Malaga/type.2/page.2/cookieid.102011166981a8fc9f948.54393907/pos.23/;29007, Provincia de Málaga;3  habitaciones;1  baños;-;Cama de 90 cm, escritorio y gran armario. Requisitos: Tener entre 18 y 30 años. Acreditar que estás estudiando o trabajando durante el período de...;Hace 21 h 13 minutos;Rentola;Malaga
400€;Very nice single bedroom in La Trinidad;https://rd.clk.thribee.com/id.4C1D1gB_1zR/origin.1/section.97/section_type.1/country.es/vertical.homes/iuid.232266trovit-web-85d48c649-c2jgv66981a8fca46e/tracking.%7B%22cmp%22%3A%22u%22%7D/what_d.Malaga/type.2/page.2/cookieid.102011166981a8fc9f948.54393907/pos.24/;29007, Provincia de Málaga;3  habitaciones;1  baños;-;Cama de 90 cm, escritorio y gran armario. Requisitos: Tener entre 18 y 30 años. Acreditar que estás estudiando o trabajando durante el período de...;Hace 21 h 13 minutos;Rentola;Malaga
1.600€;Piso de alquiler en La Unión - Cruz de Humilladero - Los Tilos;https://rd.clk.thribee.com/id.EZ1k1NA1qSN/origin.1/section.97/section_type.1/country.es/vertical.homes/iuid.232266trovit-web-85d48c649-c2jgv66981a8fca46e/tracking.%7B%22cmp%22%3A%22u%22%7D/what_d.Malaga/type.2/page.2/cookieid.102011166981a8fc9f948.54393907/pos.25/;29006, Provincia de Málaga;4  habitaciones;4  baños;110  m²;Ref. MA00525 Piso en Málaga zona Cruz de Humilladero. Paseo de los Tilos, 120 m. De superficie, 4 habitaciones, 4 baños, propiedad en buen...;Hace 21 h 13 minutos;Rentola;Malaga
2.100€;Apartamento Planta Baja;https://rd.clk.thribee.com/id.XO1d1p1u4l1y/origin.1/section.97/section_type.1/country.es/vertical.homes/iuid.59066trovit-web-85d48c649-kk2s866981a933bb69/tracking.%7B%22cmp%22%3A%22u%22%7D/what_d.Malaga/type.2/page.5/cookieid.102120566981a933b6812.04187864/pos.1/;29680, Provincia de Málaga;1  habitaciones;2  baños;114  m²;Apartamento de lujo en primera linea de playa. Planta baja. Amplio dormitorio con baño en suite. Amplio salon comedor con terraza y piscina priva...;Hace 21 h 24 minutos;Rentola;Malaga
2.500€;1 dormitorio, Málaga 29009 1ES78381-;https://rd.clk.thribee.com/id.T181Yrpl1t/origin.1/section.232/section_type.2/country.es/vertical.homes/iuid.59066trovit-web-85d48c649-kk2s866981a933bb69/tracking.%7B%22cmp%22%3A%22u%22%7D/what_d.Malaga/type.2/page.5/cookieid.102120566981a933b6812.04187864/pos.1/;29009, Málaga, Provincia de Málaga;1 habitaciones;-;-;...Esta casa se encuentra en Málaga Málaga 29009. Tiene 1 dormitorio. Esta 1 dormitorio apartamentos en Málaga Málaga es para alquilar por 2500...;Hace 1 día;Listanza;Malaga
20.000€;7 dormitorio, Málaga Andalusia 1ES79008-;https://rd.clk.thribee.com/id.16dk1t1a1u14K/origin.1/section.232/section_type.2/country.es/vertical.homes/iuid.59066trovit-web-85d48c649-kk2s866981a933bb69/tracking.%7B%22cmp%22%3A%22u%22%7D/what_d.Malaga/type.2/page.5/cookieid.102120566981a933b6812.04187864/pos.2/;Provincia de Málaga;7 habitaciones;7 baños;-;TRV79008---. Â¡No se pierda esta increÃ­ble oportunidad de poseer una magnÃ­fica villa de 7 dormitorios que rezuma belleza y amplitud tanto por d...;Hace 1 día;Listanza;Malaga
600€;Beautiful double bedroom in Miraflores;https://rd.clk.thribee.com/id.15-1fb1kD1Wf/origin.1/section.97/section_type.1/country.es/vertical.homes/iuid.59066trovit-web-85d48c649-kk2s866981a933bb69/tracking.%7B%22cmp%22%3A%22u%22%7D/what_d.Malaga/type.2/page.5/cookieid.102120566981a933b6812.04187864/pos.2/;29011, Provincia de Málaga;3  habitaciones;1  baños;-;...para el verano pueden ser de 1 mes pero a partir de septiembre las reservas tiene que ser mínimo de 6 meses. Apartamento renovado en Malaga...;Hace 21 h 25 minutos;Rentola;Malaga
1.500€;Apartamento en Mijas, Sitio de Calahonda, alquiler;https://rd.clk.thribee.com/id.151U1miYh14q/origin.1/section.97/section_type.1/country.es/vertical.homes/iuid.59066trovit-web-85d48c649-kk2s866981a933bb69/tracking.%7B%22cmp%22%3A%22u%22%7D/what_d.Malaga/type.2/page.5/cookieid.102120566981a933b6812.04187864/pos.3/;Mijas, Provincia de Málaga;2  habitaciones;1  baños;57  m²;Bienvenido a este impresionante apartamento en planta baja en Calahonda Playa, Mijas Costa. Este retiro bellamente renovado de 2 habitaciones y 2...;Hace 21 h 25 minutos;Kuhamia;Malaga
650€;Apartamento Renovado en Malaga, excelente ubicacion;https://rd.clk.thribee.com/id.Wid157141lX/origin.1/section.97/section_type.1/country.es/vertical.homes/iuid.59066trovit-web-85d48c649-kk2s866981a933bb69/tracking.%7B%22cmp%22%3A%22u%22%7D/what_d.Malaga/type.2/page.5/cookieid.102120566981a933b6812.04187864/pos.4/;29014, Provincia de Málaga;4  habitaciones;2  baños;-;...ser de 1 mes, pero las reservas a partir de septiembre serán aceptadas solo si son de 6 meses mínimo. Hermoso apartamento, renovado en Malaga...;Hace 21 h 25 minutos;Rentola;Malaga
6.500€;Ático Dúplex;https://rd.clk.thribee.com/id.19VqS1C4cT/origin.1/section.97/section_type.1/country.es/vertical.homes/iuid.59066trovit-web-85d48c649-kk2s866981a933bb69/tracking.%7B%22cmp%22%3A%22u%22%7D/what_d.Malaga/type.2/page.5/cookieid.102120566981a933b6812.04187864/pos.5/;29611, Provincia de Málaga;3  habitaciones;3  baños;282  m²;Hermoso ático dúplex ubicado en Sierra Blanca, una de las zonas más exclusivas de Marbella, en la prestigiosa urbanización Retiro de Nagüeles, a...;Hace 21 h 25 minutos;Rentola;Malaga
1.000€;Piso C/ Benalauria - Res Calanova Sea Golf - Mijas Málaga 29070;https://rd.clk.thribee.com/id.1J1VHJ15BG10/origin.1/section.97/section_type.1/country.es/vertical.homes/iuid.59066trovit-web-85d48c649-kk2s866981a933bb69/tracking.%7B%22cmp%22%3A%22u%22%7D/what_d.Malaga/type.2/page.5/cookieid.102120566981a933b6812.04187864/pos.6/;29469,;2  habitaciones;2  baños;81  m²;Promoción: ¡alta de suministros gratis si reservas antes del 31 de julio. Y además, ¡sin comisiones de agencia! Piso en alquiler situado en la Ur...;Hace 21 h 25 minutos;Rentola;Malaga
680€;Spacious double bedroom in Málaga close to Hospital Civil de Málaga;https://rd.clk.thribee.com/id.111z1qy1gZ1o1n/origin.1/section.97/section_type.1/country.es/vertical.homes/iuid.59066trovit-web-85d48c649-kk2s866981a933bb69/tracking.%7B%22cmp%22%3A%22u%22%7D/what_d.Malaga/type.2/page.5/cookieid.102120566981a933b6812.04187864/pos.7/;29011, Provincia de Málaga;4  habitaciones;1  baños;-;NOTA: las reservas para el verano puede ser de 1 mes, pero las reservas que inician en septiembre solo se aceptarán si son de 6 meses mínimo. Es...;Hace 21 h 25 minutos;Rentola;Malaga
2.400€;Middle Floor Apartment in La Campana;https://rd.clk.thribee.com/id.s141-1Ki1F18Y/origin.1/section.97/section_type.1/country.es/vertical.homes/iuid.59066trovit-web-85d48c649-kk2s866981a933bb69/tracking.%7B%22cmp%22%3A%22u%22%7D/what_d.Malaga/type.2/page.5/cookieid.102120566981a933b6812.04187864/pos.8/;Málaga, Provincia de Málaga;2  habitaciones;2  baños;90  m²;A brand new complex in the heart of La Campana. Modern structures, easy access to shops and close to amenities and schools. This 2 bedroom and 2...;Hace 21 h 25 minutos;Kuhamia;Malaga
2.000€;Apartamento Planta Media;https://rd.clk.thribee.com/id.1L1T1a1EZ-6B/origin.1/section.97/section_type.1/country.es/vertical.homes/iuid.59066trovit-web-85d48c649-kk2s866981a933bb69/tracking.%7B%22cmp%22%3A%22u%22%7D/what_d.Malaga/type.2/page.5/cookieid.102120566981a933b6812.04187864/pos.9/;29601, Provincia de Málaga;2  habitaciones;2  baños;91  m²;Estupendas vistas abiertas con una gran terraza de 89 metros de gran privacidad en este apartamento de 2 dormitorios y 2 baños, además de salón-c...;Hace 21 h 25 minutos;Rentola;Malaga
3.000€;Seaside Elegance: A Timeless Duplex Penthouse;https://rd.clk.thribee.com/id.f1a1iFfe1jR/origin.1/section.97/section_type.1/country.es/vertical.homes/iuid.59066trovit-web-85d48c649-kk2s866981a933bb69/tracking.%7B%22cmp%22%3A%22u%22%7D/what_d.Malaga/type.2/page.5/cookieid.102120566981a933b6812.04187864/pos.10/;Marbella, Provincia de Málaga;3  habitaciones;4  baños;410  m²;The Penthouse boasts 560 m2 over two floors, 410 m2 inside and terraces totalling 150 m2 in idyllic surroundings that stretch to the sea. Consist...;Hace 21 h 25 minutos;Kuhamia;Malaga
2.270€;Cosy studio next to La Trinidad;https://rd.clk.thribee.com/id.x1MzF1Clw1M/origin.1/section.97/section_type.1/country.es/vertical.homes/iuid.59066trovit-web-85d48c649-kk2s866981a933bb69/tracking.%7B%22cmp%22%3A%22u%22%7D/what_d.Malaga/type.2/page.5/cookieid.102120566981a933b6812.04187864/pos.11/;29009, Provincia de Málaga;1  habitaciones;1  baños;-;Rental period for this listing is between 3. 24 months...;Hace 21 h 26 minutos;Rentola;Malaga
3.000€;Apartment for rent in Benahavis;https://rd.clk.thribee.com/id.1RspG1y1s1Z1M/origin.1/section.97/section_type.1/country.es/vertical.homes/iuid.59066trovit-web-85d48c649-kk2s866981a933bb69/tracking.%7B%22cmp%22%3A%22u%22%7D/what_d.Malaga/type.2/page.5/cookieid.102120566981a933b6812.04187864/pos.12/;Benahavís, Provincia de Málaga;3  habitaciones;2  baños;111  m²;Modern apartment located in a gated complex near Benahavis town, located on the 1st floor facing the swimming pool and communal gardens. The apar...;Hace 21 h 26 minutos;Kuhamia;Malaga
5.500€;Apartment for rent in Marbella Golden Mile;https://rd.clk.thribee.com/id.d1N1vYo1vRY/origin.1/section.97/section_type.1/country.es/vertical.homes/iuid.59066trovit-web-85d48c649-kk2s866981a933bb69/tracking.%7B%22cmp%22%3A%22u%22%7D/what_d.Malaga/type.2/page.5/cookieid.102120566981a933b6812.04187864/pos.13/;Marbella, Provincia de Málaga;3  habitaciones;3  baños;283  m²;Apartmentin Lomas del Rey, Marbella with 3 bedrooms, 3 bathrooms, 3 en suite bathrooms and with orientation south/east, with communal swimming po...;Hace 21 h 26 minutos;Kuhamia;Malaga
700€;Inviting double bedroom in Bailén-Miraflores;https://rd.clk.thribee.com/id.1M1r521EQ1I13/origin.1/section.97/section_type.1/country.es/vertical.homes/iuid.59066trovit-web-85d48c649-kk2s866981a933bb69/tracking.%7B%22cmp%22%3A%22u%22%7D/what_d.Malaga/type.2/page.5/cookieid.102120566981a933b6812.04187864/pos.14/;29011, Provincia de Málaga;3  habitaciones;1  baños;-;...para el verano pueden ser de 1 mes pero a partir de septiembre las reservas tiene que ser mínimo de 6 meses. Apartamento renovado en Malaga...;Hace 21 h 26 minutos;Rentola;Malaga
3.700€;Ground Floor Apartment for rent in Estepona;https://rd.clk.thribee.com/id.1a1bT101e1HmZ/origin.1/section.97/section_type.1/country.es/vertical.homes/iuid.59066trovit-web-85d48c649-kk2s866981a933bb69/tracking.%7B%22cmp%22%3A%22u%22%7D/what_d.Malaga/type.2/page.5/cookieid.102120566981a933b6812.04187864/pos.15/;Estepona, Provincia de Málaga;3  habitaciones;3  baños;185  m²;...within 15 minutes of walking and an “Aldi” in less than 10 minutes by car. The airport in Málaga is less than an hour away from the apartment...;Hace 21 h 26 minutos;Kuhamia;Malaga
8.500€;Villa for Rent in Nueva Andalucia within Walking Distance to Amenities;https://rd.clk.thribee.com/id.Y6v1X-A41s/origin.1/section.97/section_type.1/country.es/vertical.homes/iuid.59066trovit-web-85d48c649-kk2s866981a933bb69/tracking.%7B%22cmp%22%3A%22u%22%7D/what_d.Malaga/type.2/page.5/cookieid.102120566981a933b6812.04187864/pos.16/;Marbella, Provincia de Málaga;4  habitaciones;3  baños;580  m²;This spacious and unique villa with Andalucian style, offers privacy in a quiet residential area in Nueva Andalucia. The main floor consists of t...;Hace 21 h 27 minutos;Kuhamia;Malaga
2.840€;2-bedroom apartment near Centro Histórico in Málaga;https://rd.clk.thribee.com/id.CbP1x16DN1s/origin.1/section.97/section_type.1/country.es/vertical.homes/iuid.59066trovit-web-85d48c649-kk2s866981a933bb69/tracking.%7B%22cmp%22%3A%22u%22%7D/what_d.Malaga/type.2/page.5/cookieid.102120566981a933b6812.04187864/pos.17/;29009, Provincia de Málaga;2  habitaciones;1  baños;-;Rental period for this listing is between 3. 24 months...;Hace 21 h 27 minutos;Rentola;Malaga
3.000€;Apartment for rent in Selwo, Estepona;https://rd.clk.thribee.com/id.C191y14rPx9/origin.1/section.97/section_type.1/country.es/vertical.homes/iuid.59066trovit-web-85d48c649-kk2s866981a933bb69/tracking.%7B%22cmp%22%3A%22u%22%7D/what_d.Malaga/type.2/page.5/cookieid.102120566981a933b6812.04187864/pos.18/;;3  habitaciones;2  baños;100  m²;Available from September 6th: Luxury 3-Bedroom Apartment We are thrilled to introduce this stunning new property, available from September 6th. O...;Hace 21 h 27 minutos;Kuhamia;Malaga
450€;Room - Málaga (Perchel Norte - Trinidad);https://rd.clk.thribee.com/id.d1LZ1F1i15v1O/origin.1/section.97/section_type.1/country.es/vertical.homes/iuid.59066trovit-web-85d48c649-kk2s866981a933bb69/tracking.%7B%22cmp%22%3A%22u%22%7D/what_d.Malaga/type.2/page.5/cookieid.102120566981a933b6812.04187864/pos.19/;Málaga, Provincia de Málaga;1  habitaciones;-;-;Room. Málaga (Perchel Norte. Trinidad), Built Surface 60m2, 3 Bedrooms...;Hace 21 h 27 minutos;Kuhamia;Malaga
2.850€;One Bedroom apartment;https://rd.clk.thribee.com/id.1t1KMk1Y1M1_16/origin.1/section.97/section_type.1/country.es/vertical.homes/iuid.59066trovit-web-85d48c649-kk2s866981a933bb69/tracking.%7B%22cmp%22%3A%22u%22%7D/what_d.Malaga/type.2/page.5/cookieid.102120566981a933b6812.04187864/pos.20/;29002, Provincia de Málaga;2  habitaciones;1  baños;50  m²;Málaga, Andalucía, SpainDiscover your new home in the picturesque La Princesa neighborhood, where a wide range of services and entertainment...;Hace 21 h 27 minutos;Rentola;Malaga
1.200€;Apartamento en alquiler en La Goleta - San Felipe Neri;https://rd.clk.thribee.com/id.1HI1U1g2151vQ/origin.1/section.97/section_type.1/country.es/vertical.homes/iuid.59066trovit-web-85d48c649-kk2s866981a933bb69/tracking.%7B%22cmp%22%3A%22u%22%7D/what_d.Malaga/type.2/page.5/cookieid.102120566981a933b6812.04187864/pos.21/;29012, Provincia de Málaga;1  habitaciones;1  baños;50  m²;Piso en Málaga zona La Goleta-San Felipe Neri, 55 m. De superficie, una habitación, un baño, propiedad en buen estado. Extras: aire...;Hace 21 h 28 minutos;Rentola;Malaga
12.000€;12.000 Ground floor duplex for rent in Laguna de Banus, Marbella - Puerto Banus | Panorama;https://rd.clk.thribee.com/id.Y1K1m2k1D-/origin.1/section.97/section_type.1/country.es/vertical.homes/iuid.59066trovit-web-85d48c649-kk2s866981a933bb69/tracking.%7B%22cmp%22%3A%22u%22%7D/what_d.Malaga/type.2/page.5/cookieid.102120566981a933b6812.04187864/pos.22/;29670, Marbella, Provincia de Málaga;3  habitaciones;3  baños;444  m²;Spacious duplex apartment in a privileged beachfront location within the spectacular community of Laguna de Banus. Located just a short walk from...;Hace 21 h 28 minutos;Rentola;Malaga
3.250€;Ático;https://rd.clk.thribee.com/id.1F1P1V173161W1t/origin.1/section.97/section_type.1/country.es/vertical.homes/iuid.59066trovit-web-85d48c649-kk2s866981a933bb69/tracking.%7B%22cmp%22%3A%22u%22%7D/what_d.Malaga/type.2/page.5/cookieid.102120566981a933b6812.04187864/pos.23/;29005, Provincia de Málaga;2  habitaciones;2  baños;128  m²;Experimente una vida de lujo en este impresionante ático dúplex de dos dormitorios, con una terraza solárium en la azotea. Recientemente reformad...;Hace 21 h 28 minutos;Rentola;Malaga
960€;Apartamento con amplios jardines, en la Costa del Sol;https://rd.clk.thribee.com/id.1oyRq1bXG19/origin.1/section.97/section_type.1/country.es/vertical.homes/iuid.59066trovit-web-85d48c649-kk2s866981a933bb69/tracking.%7B%22cmp%22%3A%22u%22%7D/what_d.Malaga/type.2/page.5/cookieid.102120566981a933b6812.04187864/pos.24/;29720, Provincia de Málaga;2  habitaciones;1  baños;-;Apartamento a 700 metros de la playa, a 12 km. Del centro de Málaga, buena combinación de autobús a Málaga, tiene piscina una época del año...;Hace 21 h 28 minutos;Rentola;Malaga
1.683€;Great 2-bedroom house in Gualdalmina;https://rd.clk.thribee.com/id.u11z1sOv1f8/origin.1/section.97/section_type.1/country.es/vertical.homes/iuid.59066trovit-web-85d48c649-kk2s866981a933bb69/tracking.%7B%22cmp%22%3A%22u%22%7D/what_d.Malaga/type.2/page.5/cookieid.102120566981a933b6812.04187864/pos.25/;29678, Marbella, Provincia de Málaga;2  habitaciones;2  baños;-;Te apetece un lugar lleno de lujo y comodidad para estas vacaciones? Nuestra casa de verano está completamente equipada con todas las comodidades...;Hace 21 h 28 minutos;Rentola;Malaga
;Piso en alquiler en Ronda, Padre Jesús;https://rd.clk.thribee.com/id.1G171x1dT1T1a1n/origin.1/section.97/section_type.1/country.es/vertical.homes/iuid.16841trovit-web-85d48c649-5ls6d66981a9a16314/tracking.%7B%22cmp%22%3A%22u%22%7D/what_d.Malaga/type.2/page.16/cookieid.102011266981a9a15f724.60100444/pos.1/;29400, Ronda, Provincia de Málaga;3  habitaciones;1  baños;64  m²;Se vende piso en zona de padre jesus reformado. La vivienda consta de 3 dormitorios, salon-comedor, cocina independiente y cuarto de baño con pla...;Hace 3 días;Todopisos;Malaga
1.300€;2 dormitorio, Torremolinos 1ES79021-;https://rd.clk.thribee.com/id.7Sj1i1t1qxx/origin.1/section.232/section_type.2/country.es/vertical.homes/iuid.16841trovit-web-85d48c649-5ls6d66981a9a16314/tracking.%7B%22cmp%22%3A%22u%22%7D/what_d.Malaga/type.2/page.16/cookieid.102011266981a9a15f724.60100444/pos.1/;Torremolinos, Provincia de Málaga;2 habitaciones;1 baños;-;TRV79021---. Esta casa se encuentra en Torremolinos Torremolinos. Tiene 2 dormitorios, 1 baño. Esta 2 dormitorio apartamentos en Torremolinos Tor...;Hace 1 día;Listanza;Malaga
1.250€;1 dormitorio, Mijas 29649 1ES79068-;https://rd.clk.thribee.com/id.GeOG1KaX13/origin.1/section.232/section_type.2/country.es/vertical.homes/iuid.16841trovit-web-85d48c649-5ls6d66981a9a16314/tracking.%7B%22cmp%22%3A%22u%22%7D/what_d.Malaga/type.2/page.16/cookieid.102011266981a9a15f724.60100444/pos.2/;29649, Mijas, Provincia de Málaga;1 habitaciones;2 baños;-;TRV79068---. Esta casa se encuentra en Mijas Mijas 29649. Tiene 1 dormitorio, 2 baños. Esta 1 dormitorio apartamentos en Mijas Mijas es para alqu...;Hace 1 día;Listanza;Malaga
