precio;sub_descr;href;ubicacion;habitaciones;banios;mt2;planta;otros;latitude;longitude;CCAA
2.000 €/mes;Casa en Mogarizas-Las Rapaces;/alquilar/casa-mogarizas_las_rapaces-45060311945_106700/;Mogarizas-Las Rapaces (Chiclana de la Frontera);3 habs.;;400 m²;;"No se alquila larga temporada, solo alquiler escolar o vacacional

Precio por semana en verano

Precioso chalet en chiclana a estr...";36.3855397;-6.1542442;cadiz
A consultar;Chalet en Camino Hispano Arabe;/alquilar/chalet-novo_sancti_petri_loma_de_sancti_petri11139-44244823101_516977/;Novo Sancti Petri-Loma de Sancti Petri (Chiclana de la Frontera);4 habs.;3 baños;160 m²;;Villa valhalla es una lujosa residencia diseñada con las más altas calidades, donde el confort y la elegancia se combinan en un en...;36.339338;-6.1449105;cadiz
A consultar;Chalet rústico en calle Majadales de Roche;/alquilar/chalet_rustico-el_colorado-2514607297_516977/;El Colorado (Conil de la Frontera);3 habs.;3 baños;120 m²;;Casa de campo mis dos girasoles, es una casa rústica en pleno conil. La casa es de dos plantas. Planta baja: salón-comedor con coc...;36.2969546;-6.1136332;cadiz
4.000 €/mes;Piso en Paseo del Mar;/alquilar/piso-sotogrande_guadiaro-625920662_385100/;Sotogrande Alto (Sotogrande);3 habs.;3 baños;90 m²;Bajo;Superf. 90 m²,  3 habitaciones (3 dobles),  3 baños, cocina, comedor, terraza (saliendo del salon), armarios, muebles, exterior, e...;36.288339802;-5.274269544;cadiz
2.000 €/mes;Piso en calle de Velázquez;/alquilar/piso-san_jose_varela_la_laguna11010-40921453337_106700/;San José-Varela-La Laguna (Cádiz Capital);3 habs.;1 baño;80 m²;;"No se alquila larga temporada, solo alquiler escolar o vacacional

Quieres disfrutar de en una de las mejores zonas de cádiz?
Pues...";36.5047;-6.27437;cadiz
A consultar;Chalet en Camino Santa Raquel;/alquilar/chalet-costa_de_sancti_petri_playa_de_la_barrosa-1680611428_516977/;Costa de Sancti Petri-Playa de La Barrosa (Chiclana de la Frontera);4 habs.;3 baños;160 m²;;Villa venus es una propiedad con mucho estilo y única, para disfrutarla en familia. El jardín es un entorno muy cuidado con una gr...;36.3900729;-6.1739645;cadiz
A consultar;Chalet en calle Abetos;/alquilar/chalet-roche-1704741787_516977/;Roche (Conil de la Frontera);3 habs.;2 baños;135 m²;;Se alquila bonito chalet reformado a un paso de las hermosas playa de roche, la casa tiene una parcela cuidada de 500 metros, porc...;36.32099087;-6.147474311;cadiz
A consultar;Chalet en calle Carril del Velito;/alquilar/chalet-la_fontanilla-1692891839_516977/;La Fontanilla (Conil de la Frontera);4 habs.;2 baños;145 m²;;Casa 506 de campo ubicada a 1.5 km del pueblo de conil, es una zona muy tranquila, en la dehesa de la villa. Ideal para descansar,...;36.2887073;-6.1025898;cadiz
850 €/mes;Piso en calle Larga;/alquilar/piso-jerez_de_la_frontera_centro11402-40834130708_106700/;Centro (Jerez de la Frontera);2 habs.;1 baño;;;Oportunidad. Alquiler de piso en jerez, cerca de todo tipo de servicios, piso céntrico. Cuenta con dos dormitorios, un baño totalm...;36.6844;-6.13654;cadiz
800 €/mes;Casa adosada en Algeciras - El Rinconcillo;/alquilar/casa_adosada-rinconcillo-35889726413_100500/;Rinconcillo (Algeciras);3 habs.;2 baños;102 m²;;"Solo disponible de septiembre a junio

Vivienda tipo adosado, muy amplio y luminoso. Con una ubicación inmejorable, en primera li...";36.1528645;-5.4460517;cadiz
A consultar;Ático en calle Asdrúbal;/alquilar/atico-novo_sancti_petri_loma_de_sancti_petri-2523917263_516977/;Novo Sancti Petri-Loma de Sancti Petri (Chiclana de la Frontera);3 habs.;2 baños;100 m²;;Urbanización el atardecer bonito ático con vistas al mar en una de las mejores urbanizaciones del novo sancti petri el atardecer ,...;36.351628837;-6.163448962;cadiz
7.000 €/mes;Piso en Paseo Marítimo;/alquilar/piso-playa_de_la_victoria11010-24255074948_100500/;Playa de la Victoria (Cádiz Capital);3 habs.;2 baños;139 m²;6ª planta;Temporal. Piso en cadiz zona paseo marítimo, 139.32 m. De superficie, 3 habitaciones dobles, 2 baños, propiedad para entrar a vivi...;36.503903814;-6.276981722;cadiz
1.200 €/mes;Apartamento en Espiritu Santo;/alquilar/apartamento-sanlucar_de_barrameda_las_piletas-42563814778_103800/;Las Piletas (Sanlúcar de Barrameda);2 habs.;1 baño;60 m²;1ª planta;Disponible a partir del 1 de julio!!!!!!. Apartamento en la zona de la jara, zona muy tranquila, soleado y con vistas al mar. Gran...;36.778587;-6.3636977;cadiz
A consultar;Chalet pareado en Camino de Guerrero;/alquilar/chalet_pareado-vejer_de_la_frontera_el_palmar-1671471350_516977/;El Palmar (Vejer de la Frontera);3 habs.;2 baños;120 m²;;Palmar 1. Se alquila estupendo chalet en el palmar, a tan solo 700 metros del paseo marítimo y playa. La casa cuenta con jardín co...;36.239707431;-6.057088433;cadiz
A consultar;Apartamento en Avenida La Libertad;/alquilar/apartamento-la_banda_campo_de_futbol-45009131511_100500/;La Banda-Campo de Fútbol (Chiclana de la Frontera);1 hab.;1 baño;60 m²;Bajo;"🏡 apartamento con ambiente familiar cerca del casco urbano de chiclana de la frontera, cádiz.

Se distribuye en:
Salón-comedor, c...";36.4207924;-6.1401538;cadiz
500 €/mes;Piso en Calzada Duquesa Isabel;/alquilar/piso-centro_calzada-41729659130_103800/;Centro-Calzada (Sanlúcar de Barrameda);2 habs.;1 baño;69 m²;Bajo;Alquiler para temporada escolar. Piso en planta baja zona calzada duquesa isabel. Cocina tipo americana. Uno de los dos dormitorio...;36.7825171;-6.3563608;cadiz
A consultar;Casa adosada en calle Emperador Nerva;/alquilar/casa_adosada-costa_de_sancti_petri_playa_de_la_barrosa-1671780869_516977/;Costa de Sancti Petri-Playa de La Barrosa (Chiclana de la Frontera);3 habs.;3 baños;100 m²;;Magnifico adosado en una de las urbanizaciones más buscadas en novo sancti petri, hoyo 4 (entre hoyos), por su cercanía al mar, a ...;36.3434258;-6.1575643;cadiz
990 €/mes;Piso en calle del Ganado, 14;/alquilar/piso-centro_calzada-45037040895_101800/;Centro-Calzada (Sanlúcar de Barrameda);2 habs.;1 baño;70 m²;;Alquiler verano. Se alquila bonito piso en el centro de sanlúcar, con ascensor, garaje en sótano y azotea. Posee cocina independie...;36.7758;-6.35622;cadiz
550 €/mes;Casa en Portichuelo;/alquilar/casa-arcos_de_la_frontera_centro_urbano-30890184136_100500/;Arcos de la Frontera;3 habs.;2 baños;140 m²;;Se alquila esta preciosa casa de estilo rústico en arcos de la frontera, zona portichuelo. Consta de 140 m. De superficie distribu...;36.751320776;-5.812040914;cadiz
2.420 €/mes;Ático en Avenida de La Libertad;/alquilar/atico-pinar_alto_crevillet_menesteo-43396782115_100500/;Pinar Alto-Crevillet-Menesteo (El Puerto de Santa María);3 habs.;2 baños;137 m²;;Alquiler vacacional ático en la avenida de la libertad , urbanización con zonas comunes y piscina  ubicado en uno de los corazones...;36.5981733;-6.238822;cadiz
450 €/mes;Piso en Centro;/alquilar/piso-centro_calzada-44245397618_103800/;Centro-Calzada (Sanlúcar de Barrameda);2 habs.;1 baño;65 m²;1ª planta;Alquiler en periodo escolar a partir de septiembre 2024 hasta junio de 2025. Bonito piso centrico de 2 dormitorios ubicado tras la...;36.7797824;-6.3500165;cadiz
12.100 €/mes;Chalet en Las Redes;/alquilar/chalet-el_aguila_las_redes_fuentebravia-44199262641_100500/;El Águila-Las Redes-Fuentebravía (El Puerto de Santa María);4 habs.;3 baños;211 m²;;La casa se encuentra en una calle muy tranquila, solo transitada por los residentes por no tener salida, a 5’ a pie de la playa y ...;36.5969893;-6.2717038;cadiz
A consultar;Chalet en La Soledad-La Coquina-Los Gallos;/alquilar/chalet-la_soledad_la_coquina_los_gallos-10079553573_516977/;La Soledad-La Coquina-Los Gallos (Chiclana de la Frontera);3 habs.;3 baños;212 m²;;Villa artemisa es una casa totalmente cuidada y mimada por sus propietarios. Cuenta con piscina privada, porches, aparcamiento, ba...;36.3968551;-6.1776554;cadiz
950 €/mes;Ático en calle Mirador de Castilnovo;/alquilar/atico-conil_de_la_frontera_centro_urbano-40843584993_106700/;Conil de la Frontera;3 habs.;2 baños;;;Temporada escolar. Ático muy luminoso. 3 dormitorios con armarios empotrados, dos cuartos de baño, salón con sofá cama, cocina. Do...;36.2743;-6.08334;cadiz
A consultar;Casa rústica en Urbanización del Ugaldenea;/alquilar/casa_rustica-costa_de_sancti_petri_playa_de_la_barrosa-3364056715_516977/;Costa de Sancti Petri-Playa de La Barrosa (Chiclana de la Frontera);3 habs.;2 baños;145 m²;;Villa alalba, es una hermosa propiedad, a tan solo 200 metros de las hermosas playas de la barrosa.  Casa con amplio jardín espect...;36.3721126;-6.1797538;cadiz
A consultar;Chalet en Novo Sancti Petri;/alquilar/chalet-novo_sancti_petri_loma_de_sancti_petri11130-45016482821_100500/;Novo Sancti Petri-Loma de Sancti Petri (Chiclana de la Frontera);3 habs.;2 baños;90 m²;;"🏡 precioso chalet para pasar unas vacaciones en familia disfrutando de la playa de la barrosa.

Su capacidad es de 6 personas y c...";36.364754373;-6.162018817;cadiz
1.400 €/mes;Apartamento en Espiritu Santo;/alquilar/apartamento-sanlucar_de_barrameda_las_piletas-41676276097_103800/;Las Piletas (Sanlúcar de Barrameda);2 habs.;1 baño;60 m²;1ª planta;Disponible a partir del 1 de julio!!!!!!. Apartamento en la zona de la jara, zona muy tranquila, soleado y con vistas al mar. Gran...;36.778038;-6.3624659;cadiz
2.300 €/mes;Piso en Avenida de La Marina, nº 2;/alquilar/piso-puerto_de_sotogrande_la_marina11310-35092225590_100500/;Puerto de Sotogrande-La Marina (Sotogrande);3 habs.;;180 m²;2ª planta;Bonito y amplio apartamento en primera linea de la marina de sotogrande. Ideal para descansar en un entorno tranquilo. Los deporte...;36.2882;-5.27871;cadiz
A consultar;Chalet en Barrio Nuevo;/alquilar/chalet-barrio_nuevo-1723379662_516977/;Barrio Nuevo (Conil de la Frontera);4 habs.;2 baños;145 m²;;Casa canarias 2 es una villa al estilo minimalista, con espacios amplios, situada entre la rotonda de mercadona y burger king, un ...;36.2887073;-6.1025898;cadiz
A consultar;Chalet en calle Martiniano;/alquilar/chalet-novo_sancti_petri_loma_de_sancti_petri-1666891493_516977/;Novo Sancti Petri-Loma de Sancti Petri (Chiclana de la Frontera);4 habs.;3 baños;220 m²;;Bonita villa a tan solo 900 metros de la playa de la barrosa, zona novo sancti petri. Cuenta con jardín de 700 metros dando al cam...;36.339338;-6.1449105;cadiz
1.700 €/mes;Piso en Avenida de la Manzanilla;/alquilar/piso-el_pino_bajo_de_guia-45018562575_101800/;El Pino-Bajo de Guía (Sanlúcar de Barrameda);3 habs.;2 baños;87 m²;;Alquiler verano. Se alquila precioso piso a estrenar, con piscina, pistas de pádel, columpio infantil y terraza propia de 15 metro...;36.7883018;-6.3472876;cadiz
900 €/mes;Piso en calle Bendición de Dios, 19;/alquilar/piso-el_mentidero_teatro_falla_alameda11003-45005796744_109800/;El Mentidero-Teatro Falla-Alameda (Cádiz Capital);3 habs.;1 baño;160 m²;Bajo;Alquiler de piso para estudiante en el centro de cadiz , tres dormitorio , mesas de estudios etc;36.536938;-6.2996693;cadiz
1.000 €/mes;Piso en Valdelagrana;/alquilar/piso-el_puerto_de_santa_maria_centro-40919455495_106700/;Centro (El Puerto de Santa María);3 habs.;2 baños;;;"No se alquila larga temporada, solo alquiler escolar o vacacional

Piso en alquiler de 80m² distribuidos en 3 dormitorios, 2 baños...";36.6008881;-6.2265065;cadiz
3.300 €/mes;Casa adosada en El Aguila;/alquilar/casa_adosada-el_aguila_las_redes_fuentebravia-44199445334_100500/;El Águila-Las Redes-Fuentebravía (El Puerto de Santa María);4 habs.;3 baños;96 m²;;Adosado en el aguila , próximo al centro comercial de vistahermosa, a menos de 15 minutos andando de la playa totalmente reformada...;36.5969666;-6.2608264;cadiz
7.000 €/mes;Chalet en Vistahermosa;/alquilar/chalet-el_puerto_de_santa_maria_vistahermosa-44236830412_100500/;Vistahermosa (El Puerto de Santa María);3 habs.;4 baños;414 m²;;"Alquiler disponible julio y agosto 2024

Por meses completos o quincenas. Consultar precios.

Descubre la excelencia en esta impre...";36.584780586;-6.255220852;cadiz
675 €/mes;Piso en Avda Quinto Centenario;/alquilar/piso-sanlucar_de_barrameda_las_piletas-39207554082_103800/;Las Piletas (Sanlúcar de Barrameda);2 habs.;1 baño;65 m²;1ª planta;Alquiler para periodos cortos, entre 1 a 3 meses máximo. Piso situado en la avda quinto centenario, muy céntrico.consta de salón c...;36.7773147;-6.3602591;cadiz
1.300 €/mes;Piso en Aguadulce-Almadraba-Punta Candor;/alquilar/piso-aguadulce_almadraba_punta_candor11520-43425087616_108900/;Aguadulce-Almadraba-Punta Candor (Rota);1 hab.;1 baño;35 m²;;Alquiler en  una de las mejores zona de rota, a pesar de tener una habitación tiene capacidad para 6 personas utilizando el sofá c...;36.632580001;-6.385413686;cadiz
1.300 €/mes;Casa en calle Pago Valdeconejos;/alquilar/casa-centro_zona_noreste-45049871949_101800/;Centro-Zona Noreste (Chipiona);2 habs.;1 baño;60 m²;;Alquiler de verano. Casa móvil con piscina portátil y6 espacio para aparcamiento. Se encuentra a 50 metros de la playa y con fácil...;36.757996456;-6.405688275;cadiz
A consultar;Apartamento en La Barrosa;/alquilar/apartamento-costa_de_sancti_petri_playa_de_la_barrosa11139-45082073592_100500/;Costa de Sancti Petri-Playa de La Barrosa (Chiclana de la Frontera);1 hab.;1 baño;59 m²;Bajo;"🏡 apartamento familiar situado en un residencial de chiclana de la frontera, cádiz.

Se distribuye en:
Salón-comedor, cocina, cua...";36.369559;-6.179681;cadiz
A consultar;Apartamento en 2ª Pista de La Barrosa;/alquilar/apartamento-costa_de_sancti_petri_playa_de_la_barrosa11139-32534056394_100500/;Costa de Sancti Petri-Playa de La Barrosa (Chiclana de la Frontera);2 habs.;1 baño;60 m²;Bajo;"🕶🏖apartamento en la urbanización la almadraba 🌊🍦

Se alquila en temporada escolar 🏫 desde septiembre a junio.
Se alquila vaca...";36.37293106;-6.177215904;cadiz
1.500 €/mes;Ático en calle de la Bolsa;/alquilar/atico-centro_calzada-45015276402_101800/;Centro-Calzada (Sanlúcar de Barrameda);2 habs.;2 baños;95 m²;;Alquiler verano de ático en el centro de sanlúcar, con pedazo de terraza de 35 metros maravillosa. Capacidad para 6 personas.;36.7800942;-6.3532506;cadiz
3.000 €/mes;Chalet en Conil de La Frontera;/alquilar/chalet-conil_de_la_frontera_centro_urbano-85086069018_103000/;Conil de la Frontera;4 habs.;2 baños;140 m²;;Chalet individual de 140 m² con parcela de 1.100 m², 4 habitaciones, 2 baños, salón , cocina totalmente equipada y porche. A 5 mi...;36.308501502;-6.150158118;cadiz
A consultar;Chalet en Costa de Sancti Petri-Playa de La Barrosa;/alquilar/chalet-costa_de_sancti_petri_playa_de_la_barrosa-30847959642_516977/;Costa de Sancti Petri-Playa de La Barrosa (Chiclana de la Frontera);3 habs.;2 baños;120 m²;;Villa la comarca, es una hermosa propiedad para disfrutar en familia, a tan solo 1.5 km de la segunda pista a la barrosa. Muy bien...;36.382680081;-6.170913962;cadiz
A consultar;Chalet en Avenida de Inglaterra;/alquilar/chalet-conil_de_la_frontera_centro_urbano-6699918966_516977/;Conil de la Frontera;6 habs.;3 baños;265 m²;;Villa atlántida, es un chalet en pleno corazón de urbanización roche, cuenta con un enorme jardín, piscina privada, entrada para v...;36.3139624;-6.1444843;cadiz
480 €/mes;Casa en Centro - San Isidro;/alquilar/casa-algeciras_centro11201-20063586116_100500/;Centro (Algeciras);1 hab.;1 baño;59 m²;;"Disponible a partir del 15 de abril de 2024

Casa en casco antiguo de algeciras, barrio de san isidro con azotea privativa y ubica...";36.1313484;-5.4505668;cadiz
A consultar;Apartamento en La Barrosa;/alquilar/apartamento-costa_de_sancti_petri_playa_de_la_barrosa11139-45026960064_100500/;Costa de Sancti Petri-Playa de La Barrosa (Chiclana de la Frontera);2 habs.;1 baño;69 m²;Bajo;🏠 apartamento en primera planta distribuido en amplio salón-comedor, cocina equipada, dos dormitorios (1 doble y 1 con sofá-cama ...;36.3773593;-6.1899135;cadiz
A consultar;Chalet rústico en Camino Sheriff;/alquilar/chalet_rustico-el_colorado-2536163569_516977/;El Colorado (Conil de la Frontera);4 habs.;3 baños;185 m²;;"El alojamiento

Casa familiar en el campo de 170 m², con 4 dormitorios grandes, 2 baños, salón con chimenea, barbacoa, piscina pri...";36.2969546;-6.1136332;cadiz
A consultar;Chalet en calle Pago del Lio;/alquilar/chalet-pago_del_humo_poligono_de_pelagatos-1685962840_516977/;Pago del Humo-Polígono de Pelagatos (Chiclana de la Frontera);3 habs.;2 baños;125 m²;;Villa el sauce. Se alquila bonito chalet en la zona de hozanejo - pago del lío, a tan solo 15 minutos en coche de las hermosas pla...;36.3759744;-6.1109684;cadiz
A consultar;Chalet en Novo Sancti Petri-Loma de Sancti Petri;/alquilar/chalet-novo_sancti_petri_loma_de_sancti_petri-1690956671_516977/;Novo Sancti Petri-Loma de Sancti Petri (Chiclana de la Frontera);3 habs.;2 baños;100 m²;;"Villa franjomar - chiclana de la frontera. 
Se alquila bonita villa de campo muy cerca de la costa de cádiz, chiclana de la fronte...";36.339338;-6.1449105;cadiz
1.750 €/mes;Chalet en Pago del Humo-Polígono de Pelagatos;/alquilar/chalet-pago_del_humo_poligono_de_pelagatos-43375513360_108900/;Pago del Humo-Polígono de Pelagatos (Chiclana de la Frontera);3 habs.;3 baños;120 m²;;"Alquiler, esta vez en chiclana de la frontera!!!!

Un chalet independiente cerca de todos los servicios esenciales, gasolinera, co...";36.4021982;-6.1283401;cadiz
440 €/mes;Piso en Centro;/alquilar/piso-sanlucar_de_barrameda_las_piletas-45026999596_103800/;Las Piletas (Sanlúcar de Barrameda);2 habs.;1 baño;70 m²;;Alquiler escolar desde septiembre, solo profesores. Piso centrico, a tan solo tres minutos del centro andando. Muy luminoso y tran...;36.7759504;-6.3564533;cadiz
A consultar;Chalet rústico en calle Carril de La Ermita;/alquilar/chalet_rustico-el_colorado-2546393137_516977/;El Colorado (Conil de la Frontera);4 habs.;2 baños;145 m²;;Casa 843. Se alquila bonito chalet de campo con 4 dormitorios (capacidad para 10 personas), armarios empotrados, dos cuartos de ba...;36.2910226;-6.1040097;cadiz
1.000 €/mes;Piso en Playa de la Victoria;/alquilar/piso-playa_de_la_victoria11010-40835675167_106700/;Playa de la Victoria (Cádiz Capital);2 habs.;2 baños;98 m²;;"No se alquila larga temporada, solo alquiler escolar o vacacional

Disponibilida verano 2024. Preguntar precio.
Precioso piso en p...";36.508036;-6.2781433;cadiz
A consultar;Casa adosada en calle del Caracolillo;/alquilar/casa_adosada-costa_de_sancti_petri_playa_de_la_barrosa-1677784749_516977/;Costa de Sancti Petri-Playa de La Barrosa (Chiclana de la Frontera);2 habs.;2 baños;75 m²;;Se alquila estupendo adosado en urbanización almadraba, cuenta con patio delantero con toldo, dos dormitorios (1 de matrimonio y o...;36.370223;-6.176904;cadiz
750 €/mes;Apartamento en Costa Oeste;/alquilar/apartamento-el_aguila_las_redes_fuentebravia-45080396754_103800/;El Águila-Las Redes-Fuentebravía (El Puerto de Santa María);2 habs.;;60 m²;4ª planta;Alquiler de temporada escolar, disponible de septiembre a junio. Precioso apartamento reformado en calle ancora, cerca de la playa...;36.6044457;-6.2727215;cadiz
A consultar;Chalet en calle Golf La Estancia;/alquilar/chalet-campano_san_andres_golf-10902591362_516977/;Campano-San Andrés Golf (Chiclana de la Frontera);3 habs.;1 baño;85 m²;;Villa los rodriguez, es una casa muy acogedora, dispone de 3 dormitorios, uno de ellos con cama de matrimonio y otras dos con lite...;36.3527203;-6.1172981;cadiz
1.100 €/mes;Casa en La Soledad-La Coquina-Los Gallos;/alquilar/casa-la_soledad_la_coquina_los_gallos-40913945438_106700/;La Soledad-La Coquina-Los Gallos (Chiclana de la Frontera);3 habs.;;120 m²;;"No se alquila larga temporada, solo alquiler escolar o vacacional

Temporada escolar (1 octubre 2023 a 1 junio 2024) 1100€ mes tem...";36.3974582;-6.1763369;cadiz
A consultar;Chalet en Marquesado;/alquilar/chalet-pinar_de_los_franceses_el_marquesado11138-32531931535_100500/;Pinar de los Franceses-El Marquesado (Chiclana de la Frontera);3 habs.;2 baños;110 m²;;"Chalet de diseño con 1100 m de parcela te está esperando para pasar unas vacaciones ideales.
Se distribuye en:
- exterior: amplia ...";36.465191;-6.1288771;cadiz
1.500 €/mes;Piso en Las Redes;/alquilar/piso-el_aguila_las_redes_fuentebravia-45034822975_100500/;El Águila-Las Redes-Fuentebravía (El Puerto de Santa María);3 habs.;2 baños;110 m²;3ª planta;Se alquila piso en alquiler anual larga duración en la mejor zona del puerto de santa maría. Con zonas comunes y muy cerca de la p...;36.60394;-6.270532;cadiz
800 €/mes;Apartamento en calle Santa Ana;/alquilar/apartamento-centro_calzada-45098560232_101800/;Centro-Calzada (Sanlúcar de Barrameda);1 hab.;1 baño;25 m²;;Alquiler apartamento en el centro de sanlúcar. Alquiler días sueltos solamente o meses sueltos. Se alquila pequeño apartamento par...;36.7802417;-6.3521771;cadiz
A consultar;Chalet pareado en calle Llano de San Vicente;/alquilar/chalet_pareado-pinar_de_los_franceses_el_marquesado-30847245603_516977/;Pinar de los Franceses-El Marquesado (Chiclana de la Frontera);4 habs.;3 baños;170 m²;;Villa rivendell, es una hermosa casa de campo muy buen cuidada, cuenta parking techado para dos coches, piscina vallada para segur...;36.4277477;-6.1238591;cadiz
900 €/mes;Piso en Centro Ciudad;/alquilar/piso-el_puerto_de_santa_maria_centro-45045338523_103800/;Centro (El Puerto de Santa María);2 habs.;;69 m²;;"Disponible a partir del 1 de septiembre

Jiménez ruiz (api) les presenta este maravilloso piso en alquiler de larga temporada en p...";36.6013025;-6.2237255;cadiz
A consultar;Chalet en Camino del Montejo;/alquilar/chalet-pago_del_humo_poligono_de_pelagatos-22561081691_516977/;Pago del Humo-Polígono de Pelagatos (Chiclana de la Frontera);2 habs.;1 baño;90 m²;;Villa abril, es un chalet rústico con mucho encanto con capacidad para 6 personas. La casa cuenta con porche con barbacoa, piscina...;36.4007;-6.13681;cadiz
A consultar;Casa en El Campito;/alquilar/casa-nucleo_urbano_urbanizaciones-45057115579_100500/;Núcleo Urbano-Urbanizaciones (Chiclana de la Frontera);2 habs.;1 baño;;;"🏡 chalet idoneo para disfrutar en familia.

Su capacidad es de 4 personas y cuenta con 200 metros de terreno para poder disfrutar...";36.416637166;-6.158285383;cadiz
550 €/mes;Piso en Espiritu Santo;/alquilar/piso-la_jara_distrito-40018779006_103800/;La Jara (Sanlúcar de Barrameda);2 habs.;1 baño;80 m²;Bajo;No se alquila para larga temporada  o anual !!!!!! Vivienda en alquiler escolar, solo para personal docente y jubilados o pensioni...;36.7737732;-6.3704355;cadiz
2.000 €/mes;Casa en La Soledad-La Coquina-Los Gallos;/alquilar/casa-la_soledad_la_coquina_los_gallos-40854026513_106700/;La Soledad-La Coquina-Los Gallos (Chiclana de la Frontera);2 habs.;;120 m²;;"No se alquila larga temporada, solo alquiler escolar o vacacional

Está villa situada en chiclana de la frontera, a 2 km de la pla...";36.396751;-6.1733313;cadiz
A consultar;Apartamento en Centro;/alquilar/apartamento-centro_calzada-42592260847_103800/;Centro-Calzada (Sanlúcar de Barrameda);2 habs.;1 baño;74 m²;;Alquiler vacacional. Alquiler minimo una semana a partir de julio excelente piso con parking en sótano, situado junto a la antigua...;36.7829826;-6.3503135;cadiz
1.750 €/mes;Apartamento en Paseo Marítimo;/alquilar/apartamento-cortadura_zona_franca11011-32518644367_100500/;Cortadura-Zona Franca (Cádiz Capital);2 habs.;2 baños;88 m²;10ª planta;Solo verano por quincenas o meses. Apartamento en cádiz zona paseo marítimo, 71.00 m. De superficie, 50 m. De la playa, 2 habitaci...;36.499477;-6.2736446;cadiz
A consultar;Piso en El Ancla;/alquilar/piso-el_aguila_las_redes_fuentebravia-43388929833_100500/;El Águila-Las Redes-Fuentebravía (El Puerto de Santa María);2 habs.;2 baños;98 m²;Bajo;"Alquiler para julio quiencenas 2024 y  segunda quincena agosto 2024

Consultar precios !!

Disponible para anual a partir de septi...";36.6047664;-6.2751849;cadiz
650 €/mes;Apartamento en calle de Azorín;/alquilar/apartamento-conil_de_la_frontera_centro_urbano-40890728499_106700/;Conil de la Frontera;1 hab.;1 baño;;;"Temporada escolar se alquila apartamento, 2º piso sin ascensor.
Con 50 m² distribuidos en 1 habitación, 1 baño, salón, cocina equi...";36.2738;-6.08659;cadiz
A consultar;Chalet en Camino Cacahuete;/alquilar/chalet-costa_de_sancti_petri_playa_de_la_barrosa-2555543510_516977/;Costa de Sancti Petri-Playa de La Barrosa (Chiclana de la Frontera);5 habs.;3 baños;230 m²;;"El alojamiento

Casa de campo rustica, con todas las comodidades, que permite a los huéspedes disfrutar de una estancia en la que ...";36.3773;-6.16905;cadiz
950 €/mes;Apartamento en Paseo Marítimo;/alquilar/apartamento-playa_de_la_victoria11009-45098601654_100500/;Playa de la Victoria (Cádiz Capital);1 hab.;1 baño;70 m²;3ª planta;Apartamento en cádiz zona paseo marítimo, 70.00 m. De superficie,  una habitación doble,  un baño, propiedad para entrar a vivir, ...;36.5097513;-6.2808408;cadiz
145 €/día;Apartamento en Quinto Centenario;/alquilar/apartamento-sanlucar_de_barrameda_las_piletas-43362738979_103800/;Las Piletas (Sanlúcar de Barrameda);2 habs.;1 baño;60 m²;1ª planta;Alquiler vacacional. Estupendo apartamento proximo centro de sanlucar de barramenda y avda quinto centenario, seminuevo, a diez mi...;36.7765523;-6.3601408;cadiz
A consultar;Chalet en Pinar de los Franceses-El Marquesado;/alquilar/chalet-pinar_de_los_franceses_el_marquesado-30046769403_516977/;Pinar de los Franceses-El Marquesado (Chiclana de la Frontera);3 habs.;2 baños;120 m²;;Villa el bosque, es un chalet muy bonito situado en la zona de pinar de los franceses, zona muy tranquila para disfrutar en famili...;36.5275777;-6.1845794;cadiz
