precio;sub_descr;href;ubicacion;habitaciones;banios;mt2;planta;otros;latitude;longitude;CCAA
1.200 €/mes;;/alquilar/piso-centre_la_canaleta-41706215016_100500/;Centre-La Canaleta (Mislata);3 habs.;2 baños;117 m²;4ª planta;Se alquila amplio piso en mislata, con una superficie de 117 m². Este acogedor inmueble cuenta con una habitación doble y dos habi...;39.4761089;-0.4214411;valencia
1.400 €/mes;;/alquilar/piso-el_carme46003-44249929713_520944/;El Carme (Distrito Ciutat Vella. València Capital);2 habs.;1 baño;60 m²;4ª planta;¡No pierdas la oportunidad de estrenar esta preciosa vivienda en el carmen! Con una superficie de 52m útiles, este piso es totalme...;39.4790189;-0.3821686;valencia
15.000 €/mes;;/alquilar/chalet_unifamiliar-torre_en_conill_cumbres_san_antonio-26696841965_995023/;Torre en Conill-Cumbres San Antonio (Bétera);4 habs.;5 baños;508 m²;;Excelente vivienda unifamiliar aislada, situada en la exclusiva urbanización de torre en conill, en bétera. Se orienta hacia el ca...;39.5658515;-0.4699843;valencia
2.100 €/mes;;/alquilar/chalet-sagunt_poble_centre-38358296036_100500/;Centre (Distrito Sagunt Poble. Sagunt - Sagunto);3 habs.;3 baños;210 m²;;Bienvenido a tu nuevo hogar en gilet, donde la comodidad y la modernidad se encuentran en perfecta armonía. Esta encantadora casa ...;39.6580281;-0.3505139;valencia
2.500 €/mes;Piso en calle de Baldoví, 3;/alquilar/piso-sant_francesc46001-45912896308_109300/;Sant Francesc (Distrito Ciutat Vella. València Capital);2 habs.;2 baños;82 m²;2ª planta;"Espectacular vivienda de 82 m² junto al ayuntamiento de valencia.
La finca es de ladrillo caravista con dos ascensores, servicio d...";39.47000388;-0.37961216;valencia
1.700 €/mes;;/alquilar/piso-betero46022-45861245167_994429/;Beteró (Distrito Poblats Marítims. València Capital);4 habs.;2 baños;103 m²;3ª planta;Piso en alquiler para estudiantes en avda. Blasco ibañez. Vivienda en perfecto estado con una superficie de 103m²,  distribuida en...;39.470660264;-0.337834585;valencia
1.900 €/mes;Piso en Avenida de las Cortes Valencianas, 47;/alquilar/piso-sant_pau46015-40890184764_513231/;Sant Pau (Distrito Campanar. València Capital);2 habs.;2 baños;100 m²;10ª planta;Alquiler en el residencial ikon dos dormitorios, dos baños, cocina equipada y comedor-salón. Dispone de calefacción por suelo radi...;39.493486778702135;-0.402139820088945;valencia
1.400 €/mes;;/alquilar/piso-el_pla_del_real_mestalla46010-45905665547_101800/;Mestalla (Distrito El Pla del Real. València Capital);2 habs.;1 baño;90 m²;3ª planta;"Excelente vivienda en alquiler en la zona de mestalla. 
Se alquila semiamueblada.
Reformada. Con la elegancia de las viviendas ant...";39.4727075;-0.3601562;valencia
1.500 €/mes;;/alquilar/chalet_adosado-el_far_el_dossel46408-43368958771_515121/;El Far-El Dossel (Cullera);3 habs.;3 baños;337 m²;;Este chalet adosado en cullera es ideal para tus vacaciones. Con una superficie total de 337 m² y 212 m² útiles, cuenta con 3 habi...;39.1859661;-0.2266879;valencia
1.400 €/mes;;/alquilar/apartamento-playa_de_gandia-43409497495_100500/;Playa de Gandia (Gandia);2 habs.;1 baño;84 m²;1ª planta;Fantástico apartamento en la  playa de gandia, incluyen 2 acogedoras habitaciones dobles. Esta propiedad se encuentra en buen esta...;38.9996464;-0.1632387;valencia
1.950 €/mes;;/alquilar/apartamento-el_cabanyal_el_canyamelar46011-41711744694_109300/;El Cabanyal-El Canyamelar (Distrito Poblats Marítims. València Capital);3 habs.;2 baños;87 m²;Bajo;Piso para alquiler a medio plazo. Disponible para alquiler desde un mínimo de 30 días hasta un máximo de 180 días. Precio 65 eur p...;39.468007826;-0.324905178;valencia
2.500 €/mes;Piso en Carrer de Llavador, 1;/alquilar/piso-playa_de_gandia-33351778251_100500/;Playa de Gandia (Gandia);3 habs.;2 baños;103 m²;3ª planta;"Alquiler gandia verano 2024

Precioso apartamento en el residencial jardines de sinia de la playa de gandía.
 
La vivienda (totalm...";38.9926;-0.163759;valencia
2.000 €/mes;;/alquilar/apartamento-la_malva_rosa46011-45047418241_109300/;La Malva-rosa (Distrito Poblats Marítims. València Capital);4 habs.;2 baños;84 m²;2ª planta;"¡Bienvenido a tu nuevo hogar en valencia!

Este apartamento de 4 dormitorios recientemente renovado y completamente amueblado cerc...";39.4815796;-0.3287453;valencia
2.700 €/mes;;/alquilar/piso-playa_de_gandia-15895932633_100500/;Playa de Gandia (Gandia);3 habs.;2 baños;95 m²;4ª planta;"Alquiler gandia verano 2024

Apartamento ubicado en la playa de gandía, muy cerca de la universidad politécnica.
La vivienda cuent...";38.9964772;-0.162176;valencia
2.700 €/mes;Apartamento en Passeig de la Universitat, 8;/alquilar/apartamento-playa_de_gandia-35056813017_100500/;Playa de Gandia (Gandia);3 habs.;2 baños;80 m²;Bajo;"Alquiler gandia verano 2024

Precioso piso ubicado a en la playa de gandia, en el residencial llometes.

El inmueble cuenta con 3 ...";38.9943;-0.165203;valencia
2.800 €/mes;;/alquilar/apartamento-platja_de_pucol-45840207159_100500/;Platja de Puçol (Puçol);1 hab.;1 baño;58 m²;2ª planta;"At home ofrece en alquiler para agosto de 2024 este precioso apartamento situado en el residencial azul, en la playa de puzol. 

L...";39.6058798;-0.2688068;valencia
800 €/mes;Piso en Passeig de les Palmeres, 13;/alquilar/piso-museros_centro_urbano-45933109850_100900/;Museros;2 habs.;2 baños;74 m²;Bajo;Habitale presenta esta vivienda en segunda planta con ascensor, situada en zona residencial y tranquila, muy luminosa, consta de s...;39.5646;-0.347236;valencia
1.100 €/mes;;/alquilar/piso-el_cabanyal_el_canyamelar46011-14255791652_994429/;El Cabanyal-El Canyamelar (Distrito Poblats Marítims. València Capital);3 habs.;1 baño;95 m²;3ª planta;"Piso de alquiler en el cabañal,a dos pasos del tranvia de taronger
Vivienda de tres dormitorios,cocina amplia con office anexo arm...";39.4747151;-0.3296475;valencia
2.100 €/mes;;/alquilar/piso-el_pla_del_remei46004-45046755921_100500/;El Pla del Remei (Distrito L'Eixample. València Capital);4 habs.;2 baños;160 m²;3ª planta;"¡Espectacular vivienda totalmente reformada! .
Esta amplia y luminosa residencia se encuentra en la zona comercial de valencia, pe...";39.4688518;-0.3721662;valencia
900 €/mes;;/alquilar/piso-rocafort_centro_urbano46111-45062137107_108500/;Rocafort;2 habs.;1 baño;79 m²;;Vivienda de 79m² de 2 habitaciones y 1 baño. Tercera planta de un edificio con ascensor construido en 1998. Se alquila con los mue...;39.529652572;-0.409764612;valencia
1.540 €/sem;Apartamento en Passeig Marítim de Neptú, 95;/alquilar/apartamento-playa_de_gandia-45027509051_528520/;Playa de Gandia (Gandia);4 habs.;2 baños;130 m²;3ª planta;"Alojamiento exclusivo familias
No se admiten grupos de jóvenes ni despedidas

Este encantador apartamento en alquiler vacacional s...";39.01344636291566;-0.1698528204515526;valencia
2.000 €/mes;;/alquilar/chalet-albalat_dels_tarongers_centro_urbano-34243306529_109300/;Albalat dels Tarongers;4 habs.;2 baños;110 m²;;"El chalet solo se alquila en junio-julio-agosto-septiembre, el resto del ano solo fines de semana y puentes.

117m² de vivienda, d...";39.7025455;-0.3356386;valencia
3.200 €/mes;;/alquilar/piso-sant_francesc46002-22538192741_100500/;Sant Francesc (Distrito Ciutat Vella. València Capital);1 hab.;1 baño;160 m²;1ª planta;"Piso de 156 metros cuadrados totalmente diáfano.
 Se encuentra ubicado en una de las mejores zona de toda valencia, muy céntrico.
...";39.47043666;-0.376044426;valencia
1.200 €/mes;;/alquilar/apartamento-playa_de_gandia-34265990566_100500/;Playa de Gandia (Gandia);4 habs.;2 baños;240 m²;5ª planta;"Fantástico apartamento en la mejor urbanización de la playa de gandía: casa del mar.
Se alquila hasta el mes de junio. 

La vivien...";39.0043804;-0.1628184;valencia
1.650 €/mes;;/alquilar/apartamento-la_malva_rosa46011-45021161243_109300/;La Malva-rosa (Distrito Poblats Marítims. València Capital);3 habs.;1 baño;76 m²;2ª planta;"&iexcl;bienvenido a tu nuevo hogar en valencia!

Este apartamento de 3 dormitorios recientemente renovado y completamente amueblad...";39.4809187;-0.3292831;valencia
2.800 €/mes;Apartamento en Carrer del Camp de Morvedre, 23;/alquilar/apartamento-playa_de_gandia-44193288578_100500/;Playa de Gandia (Gandia);2 habs.;1 baño;69 m²;7ª planta;"Alquiler gandia verano 2024

Precioso apartamento de 2 dormitorios en el residencial jardín i, ubicado a tan solo 450 metros de pr...";39.0064;-0.170047;valencia
1.300 €/mes;;/alquilar/piso-betero46022-14221476371_994429/;Beteró (Distrito Poblats Marítims. València Capital);3 habs.;2 baños;121 m²;1ª planta;Espectacular vivienda  en alquiler para larga duracion. Vivienda no amueblada con una amplia terraza  junto a pedro de valencia y ...;39.469855427;-0.336941193;valencia
3.500 €/mes;;/alquilar/piso-eixample_gran_via46005-44260625909_100500/;Gran Via (Distrito L'Eixample. València Capital);4 habs.;3 baños;236 m²;4ª planta;Grupo alain inmobiliaria, alquila lujoso piso con espectaculares vistas a los jardines del turia de 230 metros  vistas a jacinto b...;39.4689437;-0.3647933;valencia
900 €/mes;;/alquilar/piso-centre_port-45023507633_108900/;Centre Port (Distrito Port de Sagunt. Sagunt - Sagunto);4 habs.;1 baño;106 m²;2ª planta;¡Bienvenidos al hogar de tus sueños en puerto de sagunto!.Ubicado en una de las zonas más codiciadas de puerto de sagunto, este es...;39.6627146;-0.218236;valencia
2.800 €/mes;Apartamento en calle Era de Bou, nº 5;/alquilar/apartamento-playa_de_gandia-36743409598_100500/;Playa de Gandia (Gandia);2 habs.;2 baños;72 m²;2ª planta;"Alquiler gandia verano 2024

Precioso piso de 2 habitaciones ubicado en el paseo rosa de los vientos en la playa de gandia, a tan ...";38.9966;-0.163699;valencia
A consultar;;/alquilar/piso-playa_de_gandia-39236661972_520637/;Playa de Gandia (Gandia);4 habs.;2 baños;140 m²;15ª planta;"Apartamento frente a la playa con 4 dormitorios y totalmente reformado.
 

           2   dormitorios  con cama de matrimonio.

  ...";39.0057786;-0.1639474;valencia
A consultar;Apartamento en Avinguda de la Mediterránea, 11;/alquilar/apartamento-daimus_centro_urbano-44243045129_992623/;Daimús;2 habs.;2 baños;85 m²;2ª planta;Altura piso 2º, apartamento superficie total 85 m², superficie útil 80 m², habitaciones dobles: 2, 2 baños, armarios empotrados, c...;38.97131;-0.1405055;valencia
1.600 €/mes;;/alquilar/apartamento-el_cabanyal_el_canyamelar46011-45851302318_109300/;El Cabanyal-El Canyamelar (Distrito Poblats Marítims. València Capital);2 habs.;1 baño;69 m²;1ª planta;"En el hist&oacute;rico barrio del caba&ntilde;al de valencia se alquila un encantador apartamento antiguo a precio especial para l...";39.4694424;-0.3294808;valencia
2.800 €/mes;;/alquilar/apartamento-playa_de_gandia-35863473106_100500/;Playa de Gandia (Gandia);2 habs.;1 baño;35 m²;1ª planta;"Alquiler gandia verano 2024

Precioso apartamento ubicado en primera línea de la playa de gandía.
La vivienda ha sido totalmente r...";39.0057786;-0.1639474;valencia
2.000 €/mes;;/alquilar/piso-sant_francesc46002-45887043956_100500/;Sant Francesc (Distrito Ciutat Vella. València Capital);4 habs.;2 baños;220 m²;4ª planta;Disponible a partir del 1 de agosto-2024. Impresionante piso de 220 m², edificio antiguo señorial, inmueble moderno con calidades ...;39.4684182;-0.3757756;valencia
3.000 €/mes;;/alquilar/piso-sant_francesc46004-45051452039_100500/;Sant Francesc (Distrito Ciutat Vella. València Capital);5 habs.;4 baños;260 m²;3ª planta;Grupo alain alquila exclusiva vivienda de lujo, en finca singular de lujo, de 260 metros, distribuida en 5 dormitorios dobles, 3 b...;39.468875;-0.372501;valencia
A consultar;Apartamento en Passeig Marítim de Neptú, 87;/alquilar/apartamento-playa_de_gandia-45093359827_528520/;Playa de Gandia (Gandia);3 habs.;2 baños;84 m²;3ª planta;"Alojamiento exclusivo familias
No se admiten grupos de jóvenes ni despedidas

En el municipio de gandia, se encuentra este encanta...";39.010199890442465;-0.16819413040042264;valencia
2.800 €/mes;;/alquilar/atico-sant_francesc46002-45034627573_100500/;Sant Francesc (Distrito Ciutat Vella. València Capital);2 habs.;2 baños;80 m²;;Grupo alain alquila atico de lujo junto plaza ayuntamiento con una superficie de 84 m² mas 40 m² de terraza, con un amplio salón c...;39.4688345;-0.3744688;valencia
1.400 €/mes;;/alquilar/apartamento-playa_de_gandia-33406854141_100500/;Playa de Gandia (Gandia);2 habs.;2 baños;80 m²;Bajo;"Este apartamento se encuentra en una de las zonas más solicitadas de la playa de gandía.

La vivienda está compuesta por dos dormi...";39.0015052;-0.1659166;valencia
1.850 €/mes;;/alquilar/apartamento-el_cabanyal_el_canyamelar46011-45080039036_109300/;El Cabanyal-El Canyamelar (Distrito Poblats Marítims. València Capital);3 habs.;2 baños;101 m²;1ª planta;"Se alquila amplio y luminoso piso en calle de la reina. En alquiler por mes, y alquiler m&aacute;ximo por 11 meses.

El piso est&a...";39.465258;-0.3292462;valencia
575 €/mes;;/alquilar/piso-alcudia_de_crespins_centro_urbano-45066222155_108700/;L'Alcúdia de Crespins;4 habs.;2 baños;110 m²;;Piso  sin amueblar situado en alcudia de crespins, al sur de la provincia de valencia (60 km) y cercano a la provincia de alicante...;38.967903313;-0.616700342;valencia
1.300 €/mes;;/alquilar/piso-russafa46004-45024484553_109300/;Russafa (Distrito L'Eixample. València Capital);2 habs.;1 baño;61 m²;;"Cm properties presenta esta vivienda en ruzafa en alquiler.
Disponible en septiembre de 2024.
Cuenta con una habitación con cama d...";39.46541;-0.377152;valencia
97 €/día;Apartamento en Paseo de La Universidad , nº 8;/alquilar/apartamento-playa_de_gandia-881774588_511366/;Playa de Gandia (Gandia);2 habs.;1 baño;75 m²;8ª planta;Alquiler turistico para julio y agosto apartamento en playa de gandia , con piscina y cochera, consta de dos habitaciones y un bañ...;38.99812649774703;-0.17258433238504248;valencia
1.000 €/mes;;/alquilar/apartamento-el_cabanyal_el_canyamelar46011-45881345689_109300/;El Cabanyal-El Canyamelar (Distrito Poblats Marítims. València Capital);1 hab.;1 baño;34 m²;;"Este apartamento tiene 1 dormitorio y est&aacute; a pocos pasos de la playa y del puerto de valencia.

Este barrio es una zona vib...";39.4691394;-0.3305196;valencia
1.700 €/mes;;/alquilar/piso-eixample_gran_via46005-45902430277_100500/;Gran Via (Distrito L'Eixample. València Capital);2 habs.;1 baño;79 m²;4ª planta;Grupo alain alquila estupenda y luminosa vivienda exterior de lujo totalmente reformada de 80 metros cuadrados con salón y habitac...;39.4655746;-0.368125;valencia
1.300 €/mes;;/alquilar/apartamento-playa_de_gandia-31680152203_100500/;Playa de Gandia (Gandia);1 hab.;1 baño;41 m²;12ª planta;"Este bonito apartamento se encuentra en una de las mejores zonas de la playa de gandía, a 10 metros de la arena.
 La vivienda cuen...";39.0061056;-0.1644058;valencia
850 €/mes;;/alquilar/casa-platja_oliva-33374911011_108900/;Platja d'Oliva (Oliva);2 habs.;3 baños;130 m²;;"No es alquiler anual. Leer hasta el final. 

Disponible desde septiembre hasta junio.

Se alquila adosado en un pequeño y familiar...";38.921907487;-0.091668484;valencia
950 €/mes;;/alquilar/piso-la_raiosa_san_vicente_martir-34256864102_100500/;La Raïosa-San Vicente Mártir (Distrito Jesús. València Capital);2 habs.;1 baño;94 m²;4ª planta;Piso en 4ª altura en la calle jesús, entre pérez galdós y callosa de ensarriá, amueblado, con 2 dormitorios dobles, cuarto de baño...;39.462545991;-0.386543225;valencia
1.350 €/mes;;/alquilar/apartamento-playa_de_gandia-44254193542_100500/;Playa de Gandia (Gandia);2 habs.;1 baño;80 m²;Bajo;Con dos luminosas habitaciones, un baño y acceso fácil para todos, esta propiedad te ofrece el escape perfecto junto al mar. Con a...;39.0128079;-0.1707636;valencia
1.800 €/mes;;/alquilar/apartamento-el_cabanyal_el_canyamelar46011-45029222958_109300/;El Cabanyal-El Canyamelar (Distrito Poblats Marítims. València Capital);3 habs.;1 baño;85 m²;1ª planta;"Cabanyal estate ofrece en alquiler un piso en plaza del canyamelar, valencia.

La vivienda tiene una superficie de 85 metros cuadr...";39.4790074;-0.3517751;valencia
1.400 €/mes;;/alquilar/piso-aiora46022-14193704838_100100/;Aiora (Distrito Camins al Grau. València Capital);3 habs.;;76 m²;7ª planta;Disponible en septiembre. Increíble vivienda reformada junto a la parada de metro 'ayora', ideal para estudiantes, 76 m², 3 dormit...;39.4671706;-0.3455204;valencia
700 €/mes;;/alquilar/apartamento-playa_de_gandia-45931608221_108500/;Playa de Gandia (Gandia);2 habs.;1 baño;65 m²;;Alquiler, se requiere justificar documentalmente, ingresos conjuntos superiores a 2000 euros mensuales). Inicio estancia/contrato-...;38.9957071;-0.1577224;valencia
1.600 €/mes;;/alquilar/casa_adosada-playa_la_pobla_de_farnals-45861697320_997738/;Playa La Pobla de Farnals (La Pobla de Farnals);3 habs.;3 baños;128 m²;;"Bonito chalet adosado en alquiler en playa pobla de farnals

Adosado de lujo con estilo de villa mediterránea con decoración minim...";39.566829867;-0.291447623;valencia
1.800 €/mes;;/alquilar/atico-bulevar_del_xuquer_el_maranyet46400-37560415654_101800/;Bulevar del Xúquer-El Maranyet (Cullera);3 habs.;2 baños;180 m²;;Fantástico ático a unos metros de la playa, en contacto con la naturaleza, en una excelente urbanización con zonas comunes y pisci...;39.172866892;-0.261533041;valencia
1.800 €/mes;;/alquilar/apartamento-alboraia_alboraya_centro_urbano-37519696107_101800/;Alboraia - Alboraya;4 habs.;3 baños;180 m²;;La propiedad goza de unas preciosas vistas al embarcadero de port saplaya, siendo muy luminoso y amplio ya que son dos propiedades...;39.508913945;-0.333635132;valencia
2.000 €/mes;;/alquilar/apartamento-el_cabanyal_el_canyamelar46011-44219424018_100500/;El Cabanyal-El Canyamelar (Distrito Poblats Marítims. València Capital);2 habs.;2 baños;65 m²;1ª planta;"Valencia capital- cerca de la playa 

La vivienda dispone de  2  habitaciones 2 baños, amueblado y totalmente equipado, reformada;...";39.4658517;-0.3268708;valencia
3.500 €/mes;;/alquilar/casa_pareada-el_far_el_dossel46408-37525583593_101800/;El Far-El Dossel (Cullera);4 habs.;3 baños;400 m²;;"Alquiler para temporada baja (1 de octubre a 30 de marzo)
Esta gran propiedad se alquila en corta estancia. Totalmente equipada. U...";39.1853718;-0.2251119;valencia
A consultar;;/alquilar/piso-playa_de_gandia-39211474119_520637/;Playa de Gandia (Gandia);2 habs.;2 baños;85 m²;Bajo;Este apartamento se alquila para estudiantes universitarios durante el curso y para turistas durante el verano - ( no se alquila p...;39.0009111;-0.1642501;valencia
1.800 €/mes;;/alquilar/piso-la_creu_del_grau46023-45011356733_109300/;La Creu del Grau (Distrito Camins al Grau. València Capital);3 habs.;2 baños;119 m²;;Vivienda ubicada en la calle rodrigo de pertegaz, ideal para estudiantes, que ofrece una combinación perfecta de comodidad y funci...;39.4619236;-0.3449403;valencia
A consultar;;/alquilar/piso-canet_en_berenguer_centro_urbano-45053349191_108900/;Canet d'en Berenguer;1 hab.;1 baño;50 m²;2ª planta;Hogares del puerto te presenta esta vivienda en alquiler turístico. ref: at-4028. oportunidad 1 quincena de julio: 1000 eur. ¡Tu p...;39.673409483;-0.206938406;valencia
800 €/mes;;/alquilar/apartamento-el_puig_de_santa_maria_centro_urbano-45037126159_997738/;El Puig de Santa Maria;2 habs.;2 baños;119 m²;2ª planta;"Apartamento en alquiler temporal de septiembre a mayo, en primera linea de la playa de el puig

Se trata de un amplio apartamento ...";39.58370009;-0.273863748;valencia
750 €/mes;;/alquilar/piso-platja_del_port_de_sagunt-45873193752_100500/;Platja del Port de Sagunt (Distrito Port de Sagunt. Sagunt - Sagunto);4 habs.;1 baño;118 m²;1ª planta;"*primera planta en alquiler*

Primera planta sin ascensor de 118m² distribuidos en amplio salón/comedor, cocina en perfecto estado...";39.65924;-0.2153487;valencia
2.400 €/mes;;/alquilar/piso-centre_la_canaleta-44182799562_101800/;Centre-La Canaleta (Mislata);3 habs.;2 baños;120 m²;7ª planta;El ático es una joya moderna que ofrece 80 metros cuadrados de vivienda perfectamente distribuidos, complementados por una amplia ...;39.4733068;-0.4089697;valencia
2.300 €/mes;;/alquilar/apartamento-sant_francesc46002-45060528813_100500/;Sant Francesc (Distrito Ciutat Vella. València Capital);2 habs.;3 baños;123 m²;4ª planta;"Alquiler temporal de julio a 30 de septiembre 

Este encantador apartamento es perfecto para   disfrutes en el verano en valencia....";39.471604;-0.3749439;valencia
650 €/mes;;/alquilar/duplex-oliva_nova-40845533390_108900/;Oliva Nova (Oliva);3 habs.;2 baños;113 m²;1ª planta;"No es alquiler anual.

Alquiler meses invierno o fechas concreta en verano. Ver mas abajo en la descripcion.

Playa&nbsp;rabdells,...";38.9050349;-0.0682137;valencia
150 €/día;Apartamento en Carrer la Rábida, 1;/alquilar/apartamento-playa_de_gandia-5099143055_511366/;Playa de Gandia (Gandia);4 habs.;2 baños;110 m²;2ª planta;Ubicado en la zona de playa de gandia, este encantador apartamento en alquiler vacacional destaca por su superficie total de 110 m...;38.996843688208585;-0.16544272587629227;valencia
2.250 €/mes;Piso en Carrer de San Vicente Mártir, 128;/alquilar/piso-arrancapins46007-45858932439_100500/;Arrancapins (Distrito Extramurs. València Capital);3 habs.;3 baños;156 m²;3ª planta;Presentamos en exclusiva un gran piso junto a plaza de españa. Con reforma de diseño, ofrece una ubicación privilegiada cercana al...;39.4641;-0.382044;valencia
2.000 €/mes;;/alquilar/apartamento-alboraia_alboraya_centro_urbano-45930476323_101800/;Alboraia - Alboraya;2 habs.;2 baños;96 m²;4ª planta;"Consultar precio en función de la estancia.
Engel&völkers les presenta este maravilloso piso con unas vistas privilegiadas, que co...";39.514450366;-0.320680375;valencia
1.800 €/mes;;/alquilar/apartamento-arrancapins46007-45023127208_101800/;Arrancapins (Distrito Extramurs. València Capital);2 habs.;2 baños;83 m²;2ª planta;Corta estancia - se alquila con internet y gastos de agua incluidos.  Esta encantadora vivienda recién reformada - a estrenar - co...;39.464638796;-0.385053046;valencia
1.800 €/mes;Apartamento en Carrer Clot de la Mota, 27;/alquilar/apartamento-playa_de_gandia-20900605932_100500/;Playa de Gandia (Gandia);1 hab.;1 baño;54 m²;6ª planta;"Alquiler gandia verano 2024
 
Apartamento ubicado en la playa de gandía. La vivienda consta de 1 dormitorio con armarios empotrado...";39.0;-0.163562;valencia
1.600 €/mes;;/alquilar/piso-el_botanic46008-45890879992_108500/;El Botànic (Distrito Extramurs. València Capital);2 habs.;1 baño;56 m²;;Alquilamos un piso en zona botanico, muy cerca de las torres de quart y a diez de la plaza del ayuntamiento. Ubicado en una finca ...;39.4752796;-0.3847053;valencia
2.400 €/mes;;/alquilar/piso-playa_de_gandia-20871596664_100500/;Playa de Gandia (Gandia);3 habs.;2 baños;80 m²;5ª planta;"Alquiler gandia verano 2024
 
 Precioso apartamento en el residencial athenea de la playa de gandía.
 
 La vivienda (totalmente nu...";38.9932;-0.166246;valencia
1.150 €/mes;;/alquilar/apartamento-guardamar_de_la_safor_centro_urbano-42547168882_100500/;Guardamar de La Safor;2 habs.;2 baños;79 m²;5ª planta;"Alquiler vacacional
Encantador apartamento en la zona de playa de guardamar de la safor. Con 79m²

Este luminoso y bonito apartame...";38.9689377;-0.1359126;valencia
3.300 €/mes;;/alquilar/apartamento-playa_de_gandia-42547155095_100500/;Playa de Gandia (Gandia);3 habs.;2 baños;110 m²;15ª planta;Impresionante apartamento en la zona de playa de gandía, con 110.00 m² de superficie. Esta propiedad reformada cuenta con 3 habita...;39.0085987;-0.1662435;valencia
2.700 €/mes;Piso en calle Oltra, 13;/alquilar/piso-playa_de_gandia-26739852207_100500/;Playa de Gandia (Gandia);3 habs.;2 baños;106 m²;3ª planta;"Alquiler gandia verano 2024

Precioso piso de 3 habitaciones ubicado en el residencial vesta. 
Este inmueble, el cual está complet...";38.9943;-0.163191;valencia
2.000 €/mes;;/alquilar/piso-eixample_gran_via46005-44231514992_100500/;Gran Via (Distrito L'Eixample. València Capital);5 habs.;3 baños;183 m²;4ª planta;"Luminosa propiedad en la gran vía marqués del turia.

La vivienda, situada en una cuarta planta , con una superficie construida ca...";39.465153506;-0.373692924;valencia
3.400 €/mes;Piso en Plaza Rosa de los Vents, 7;/alquilar/piso-playa_de_gandia-21676351835_100500/;Playa de Gandia (Gandia);4 habs.;2 baños;128 m²;Bajo;"Alquiler gandia verano 2024

Gran apartamento ubicado a 500 metros de primera línea de la playa de gandía. Cuenta con 4 dormitorio...";38.996;-0.162923;valencia
A consultar;Apartamento en Carrer Illes Balears, 23;/alquilar/apartamento-playa_de_gandia-45090932591_528520/;Playa de Gandia (Gandia);3 habs.;2 baños;68 m²;8ª planta;"Alojamiento exclusivo familias
No se admiten grupos de jóvenes ni despedidas

Desde 125 € la noche. Consulte disponibilidad y prec...";38.99906512586659;-0.16354690627298396;valencia
2.900 €/mes;Apartamento en Carrer Serpis, 1;/alquilar/apartamento-playa_de_gandia-30924152546_100500/;Playa de Gandia (Gandia);2 habs.;2 baños;80 m²;8ª planta;"Alquiler gandia verano 2024
 
Precioso apartamento ubicado en el residencial los iris, a tan solo 500 metros de primera línea de l...";39.0125;-0.175279;valencia
1.550 €/mes;;/alquilar/piso-la_seu46003-45016120990_108900/;La Seu (Distrito Ciutat Vella. València Capital);2 habs.;1 baño;74 m²;;"Vivienda en&nbsp;edificio de finales del siglo xix rehabilitado, ubicado en la calle de la paz, distrito de la seo, en pleno centr...";39.4733018;-0.3733436;valencia
