precio;sub_descr;href;ubicacion;habitaciones;mt2;otros;latitude;longitude;banios;planta;CCAA
189.700 €;;/comprar/piso-manilva_san_luis_de_sabinillas-8337493082_101800/;San Luis de Sabinillas (Manilva);2 habs.;85 m²;"Ahora su nuevo hogar en coto real golf (garaje y trastero incluidos)  desde 189.700 €.

 Amplias viviendas con excelentes calidade...";36.361343684;-5.231437872;2 baños;1ª planta;malaga
2.250.000 €;;/comprar/atico-puerto_marina29630-39251468328_501330/;Puerto Marina (Distrito Benalmádena Costa. Benalmádena);3 habs.;195 m²;Bienvenido a un mundo de lujo y elegancia, donde cada momento está lleno de comodidad y sofisticación. Te presentamos un impresion...;36.5965998;-4.5150932;3 baños;;malaga
395.000 €;;/comprar/chalet-pinos_de_alhaurin-43427325957_108500/;Pinos de Alhaurín (Alhaurín de la Torre);3 habs.;114 m²;Clarosan real estate group vende fabulosos chalet adosados a estrenar de 114 m² en alhaurín de la torre, málaga. La vivienda se di...;36.663973356;-4.586929282;3 baños;;malaga
189.000 €;Piso en calle calle Severiano Ballesteros, nº 6;/comprar/piso-urbanizacion_calahonda_golf_riviera_del_sol_mirafl-44234373904_101800/;Urbanización Calahonda-Golf-Riviera del Sol-Miraflores (Distrito Mijas Costa. Mijas);2 habs.;70 m²;Riviera del sol 2 dormitorios con gran terraza + garaje + piscina, 70 m²  construidos, 2 habitaciones, 1 baño, 2 amplias terrazas,...;36.501;-4.69805;1 baño;1ª planta;malaga
299.000 €;;/comprar/apartamento-puerto_deportivo-43340704622_100500/;Puerto Deportivo (Fuengirola);1 hab.;70 m²;Si estabas buscando el capricho de tu vida, aqui lo tienes!!! Vivienda situada en planta cuarta de un edificio hecho a capricho pa...;36.5401741;-4.6242091;1 baño;4ª planta;malaga
286.000 €;;/comprar/chalet_adosado-cartama_centro_urbano-45026940524_520119/;Cártama;4 habs.;271 m²;Superficie total 271 m², chalet adosado superficie solar 78 m², superficie útil 154 m², hab. Individuales: 2, habitaciones dobles:...;36.7099342;-4.6377091;3 baños;;malaga
272.500 €;Piso en calle Pacheco, 7;/comprar/piso-camino_de_suarez29011-24170182969_106000/;Camino de Suárez (Distrito Bailén-Miraflores. Málaga Capital);3 habs.;101 m²;"¡¡ Oportunidad¡¡ Solo quedan 4 viviendas¡¡ Edificio nueva construción. Entrega para finales de año 2024. 

A 300 metros del hospit...";36.7302;-4.43665;2 baños;3ª planta;malaga
214.999 €;Piso en Urbanización Fuente de La Duquesa, nº 1;/comprar/piso-urbanizacion_el_hacho_la_duquesa_golf-44197641076_527738/;Urbanización El Hacho-La Duquesa Golf (Manilva);2 habs.;140 m²;"Exclusivo apartamento en la prestigiosa urbanización de manilva

Descubra este encantador apartamento situado en una exclusiva ur...";36.35641;-5.2386513;2 baños;2ª planta;malaga
235.000 €;;/comprar/piso-boquetillo-43350427138_100200/;Boquetillo (Fuengirola);3 habs.;126 m²;"¡Vivienda en fuengirola!
126m². Segunda planta con ascensor, 3 habitaciones, 1 baño, terraza, salón comedor, cocina independiente...";36.5456884;-4.6308038;1 baño;;malaga
330.000 €;;/comprar/casa-pizarra_centro_urbano-31755655203_106000/;Pizarra;3 habs.;240 m²;"¡¡Impresionante casa señorial¡¡. Oportunidad en la zona¡

Centro de pizarra, se ubica esta maravilla de vivienda, además con un gr...";36.7633859;-4.7056141;2 baños;;malaga
305.000 €;Piso en Avenida de Octavio Paz,  s/n;/comprar/piso-el_atabal_el_chaparral_los_morales29010-4145090298_109700/;El Atabal-El Chaparral-Los Morales (Distrito Puerto de la Torre. Málaga Capital);2 habs.;;Portal 1, bajo c. Piso en un inmueble de obra nueva y situado en la zona de málaga capital, acomodado en planta baja. Está estruct...;36.7292647;-4.4621666;2 baños;Bajo;malaga
264.900 €;Chalet rústico en Urbanización Nuevo Almayate, 125;/comprar/chalet_rustico-almayate29749-45025280823_528492/;Almayate (Vélez-Málaga);2 habs.;140 m²;Acogedora vivienda de dos dormitorios, baño, cocina independiente y amplio porche. Ideal para disfrutar de la tranquilidad y el en...;36.73386;-4.127804;1 baño;;malaga
550.000 €;Casa en Avenida del Valle del Golf;/comprar/casa-nueva_andalucia_centro29660-32529107545_518427/;Nueva Andalucía-Centro (Distrito Nueva Andalucía. Marbella);2 habs.;172 m²;"Vivienda completamente amueblada y equipada.
Moderna y recién reformada propiedad en nueva andalucía, en la demandada urbanización...";36.50880503134343;-4.9624373599216955;4 baños;;malaga
285.000 €;;/comprar/piso-almayate29749-43422850584_520119/;Almayate (Vélez-Málaga);3 habs.;203 m²;Grupo behome te presenta en exclusiva este espectacular piso en valle niza, con vistas al mar y una gran terraza donde disfrutarás...;36.724192595;-4.159086003;2 baños;1ª planta;malaga
640.000 €;Casa pareada en calle Jazmín, 1;/comprar/casa_pareada-benahavis_nucleo-43349759303_101800/;Núcleo (Benahavís);4 habs.;260 m²;Se vende este precioso adosado en excelente estado en benahavis pueblo, se encuentra a escasos metros de todo tipo de servicios (r...;36.5217;-5.04435;4 baños;;malaga
175.000 €;Ático en calle de San Fermín, 15;/comprar/atico-mijas_las_lagunas29651-44212059593_101800/;Las Lagunas (Mijas);1 hab.;62 m²;Ático con gran solarium de obra njueva en las lagunas,  62 m² construidos, cocina americana,  salón-comedor, 1 dormitorio, 1 baño,...;36.5432;-4.63404;1 baño;;malaga
399.000 €;;/comprar/atico-las_gaviotas_carvajal-37587415726_109300/;Las Gaviotas-Carvajal (Fuengirola);2 habs.;87 m²;Fantástico ático ubicado en una bonita urbanización con maravillosas vistas al mar. Este amplio y luminoso ático consta de dos hab...;36.5639342;-4.6041174;2 baños;;malaga
525.000 €;;/comprar/chalet-rincon_de_la_victoria_torre_de_benagalbon-41724376934_500898/;Torre de Benagalbón (Rincón de la Victoria);3 habs.;232 m²;"Magnifico chalet individual con preciosas vistas al mar desde cualquier punto de la vivienda.

Aquí le presentamos éste magnifico ...";36.7251492;-4.2419144;3 baños;;malaga
227.000 €;Dúplex en Urbanización Brisas II,  s/n;/comprar/duplex-urbanizacion_el_hacho_la_duquesa_golf-4529558639_109700/;Urbanización El Hacho-La Duquesa Golf (Manilva);3 habs.;130 m²;Bloque 4. Vivienda 3.1. 421. Dúplex en un inmueble de obra nueva de 144 m² de superficie construida y situado en la zona de sotogr...;36.3592607;-5.2344914;2 baños;3ª planta;malaga
189.000 €;;/comprar/piso-torrox_el_morche29793-44246826069_109300/;El Morche (Torrox);2 habs.;93 m²;¡Descubra su oasis en torrox, específicamente en la encantadora zona de el morche! Este es un piso que realmente combina comodidad...;36.738398821;-3.990211488;2 baños;1ª planta;malaga
490.000 €;Piso en calle de Frank Capra, 10;/comprar/piso-teatinos_universidad_ciudad_universitaria29010-14174401941_992766/;Ciudad Universitaria (Distrito Teatinos-Universidad. Málaga Capital);3 habs.;140 m²;Amplia y luminosa vivienda en la zona de teatinos, directo de la propiedad, amplias vistas a la ciudad, altas calidades, aire acon...;36.71908601369422;-4.459991655207965;2 baños;5ª planta;malaga
189.000 €;;/comprar/piso-la_chullera-45862381487_515126/;La Chullera (Manilva);3 habs.;87 m²;¿Estás en busca del hogar ideal para ti? ¡Comprar piso en manilva puede ser una de las mejores decisiones de tu vida! Este moderno...;36.3389116;-5.2520828;2 baños;1ª planta;malaga
1.950.000 €;Chalet en calle Hortensia, 43;/comprar/chalet-el_paraiso_atalaya_benamara-43382965329_100500/;El Paraíso-Atalaya-Benamara (Estepona);4 habs.;800 m²;"Estepona, gran villa clásica en el paraiso.
Escrituras gratis al comprar con marbanus estates
A dos minutos del club de golf el pa...";36.4723;-5.03279;;;malaga
220.000 €;;/comprar/atico-el_paraiso_atalaya_benamara-45066835107_100500/;El Paraíso-Atalaya-Benamara (Estepona);2 habs.;131 m²;¡Oportunidad! Ático en urb. El pilar, en el paraíso, estepona. Disponible este magnífico apartamento ático con varias terrazas en ...;36.466691;-5.0273125;2 baños;;malaga
410.000 €;;/comprar/piso-la_victoria_conde_urena29012-45839392610_104700/;La Victoria-Conde Ureña (Distrito Centro. Málaga Capital);3 habs.;91 m²;Redpiso te presenta en exclusiva este maravilloso piso en venta, ubicado en la emblemática calle victoria, en el pleno centro hist...;36.7251553;-4.4148019;2 baños;;malaga
1.550.000 €;;/comprar/chalet-torremuelle29630-43341543497_100500/;Torremuelle (Distrito Benalmádena Costa. Benalmádena);5 habs.;642 m²;Última villa a la venta del proyecto de 3 villas de lujo situadas  a un paso de la playa de benalmádena. La villa se encuentra en ...;36.577692048;-4.571343701;5 baños;;malaga
1.790.000 €;;/comprar/casa-valdeolletas_las_cancelas_xarblanca-45076078470_106700/;Valdeolletas-Las Cancelas-Xarblanca (Distrito Centro. Marbella);4 habs.;342 m²;Bienvenido a villa jazmines, un conjunto de 8 villas de lujo con las mejores calidades, vistas al mar y al club de golf monte para...;36.518996057;-4.902211851;6 baños;;malaga
125.000 €;;/comprar/apartamento-mangas_verdes_las_flores_parque_del_sur29014-44233147876_500563/;Mangas Verdes-Las Flores-Parque del Sur (Distrito Ciudad Jardín. Málaga Capital);1 hab.;60 m²;Prósima vende piso-apartamento en muy buen estado en una planta baja con una superficie de 40 m²  junto un local/ almacén de 20m² ...;36.7400812;-4.4189921;1 baño;Bajo;malaga
259.500 €;;/comprar/piso-costa_natura29693-35884222065_108900/;Costa Natura (Estepona);1 hab.;113 m²;Las viviendas cuentan con carpintería exterior y vidrios con gran capacidad de aislamiento térmico y por supuesto, sonoro. Materia...;36.402289538;-5.191355044;1 baño;;malaga
518.000 €;Ático en calle de Sierra Nevada,  S/N;/comprar/atico-torremuelle29639-3266671901_109700/;Torremuelle (Distrito Benalmádena Costa. Benalmádena);2 habs.;125 m²;Ático en un edificio de obra nueva de 125 m2 de superficie construida y ubicado en la zona de Benalmádena, con orientación al mar. Está distribuido en 2 habitaciones, 2 baños completos y terraza. Incluye extras como ascensor, 2 garajes y trastero.;36,5881056;-4,5638349;2 baños;;malaga
440.000 €;Piso en Urbanización Altos de los Monteros,  S/N;/comprar/piso-los_monteros_bahia_de_marbella29603-2852225959_109700/;Los Monteros-Bahía de Marbella (Distrito Las Chapas. Marbella);2 habs.;122 m²;21b. Piso en un inmueble de obra nueva de 122 m² de superficie construida y situado en la zona de marbella, acomodado en planta 1....;36.5241806;-4.8438718;2 baños;1ª planta;malaga
319.000 €;;/comprar/piso-torrox_torrox_costa-38363287716_998550/;Torrox Costa (Torrox);2 habs.;102 m²;Estupendo piso de 102m²,  muy luminoso ,  con vistas frontales al mar y a la piscina en una de las urbanizaciones mas cotizadas de...;36.7311628;-3.9677966;2 baños;2ª planta;malaga
363.000 €;Piso en calle de Santa Matilde, 2;/comprar/piso-huelin_la_princesa_jardin_de_la_abadia29003-4637640971_109700/;Huelin-La Princesa-Jardín de la Abadía (Distrito Carretera de Cádiz. Málaga Capital);2 habs.;98 m²;Vi-2-p01-b. Piso en un edificio de obra nueva de 98 m² de superficie construida y ubicado en la zona de málaga capital, enclavado ...;36.7051154;-4.4410681;2 baños;1ª planta;malaga
380.000 €;Piso en calle Estrella de Mar, 4;/comprar/piso-el_candado_camino_de_olias_camino_de_los_montes290-4171354463_109700/;El Candado-Camino de Olías-Camino de los Montes (Distrito Este. Málaga Capital);3 habs.;117 m²;1º a. Piso en un edificio de obra nueva de 117 m² de superficie construida y ubicado en la zona de málaga capital, enclavado en pl...;36.7230504;-4.3330091;2 baños;1ª planta;malaga
990.000 €;;/comprar/apartamento-playa_de_la_fontanilla29601-41691466497_108400/;Playa de la Fontanilla (Distrito Centro. Marbella);4 habs.;Más de 20;Piso recién reformado en el centro de la ciudad con orientación noreste y haciendo esquina, totalmente amueblado, con amplias esta...;36.510459146;-4.895670849;3 baños;;malaga
312.000 €;Casa adosada en calle Gea, 14;/comprar/casa_adosada-cruz_de_humilladero_los_prados29006-44222170535_501323/;Los Prados (Distrito Cruz de Humilladero. Málaga Capital);3 habs.;118 m²;¿Estás buscando una casa familiar práctica y llena de luz en una tranquila zona de málaga? ¡No busques más! Esta encantadora y rec...;36.698074;-4.472514;2 baños;;malaga
255.500 €;;/comprar/piso-la_aurora_la_alameda29007-45017515107_100500/;La Aurora-La Alameda (Distrito Cruz de Humilladero. Málaga Capital);3 habs.;70 m²;Presentamos este espectacular piso recientemente reformado, situado en una ubicación privilegiada de málaga. Con una superficie bi...;36.7206069;-4.4334764;1 baño;3ª planta;malaga
524.500 €;Piso en Pasaje Perú,  s/n;/comprar/piso-altos_de_estepona29693-4522838835_109700/;Altos de Estepona (Estepona);4 habs.;152 m²;Vi-6-11-2-a. Piso en un edificio de obra nueva de 152 m² de superficie construida y ubicado en la zona de estepona, enclavado en p...;36.7228979;-4.3729931;2 baños;2ª planta;malaga
385.000 €;;/comprar/chalet-pinos_de_alhaurin-43431073823_108500/;Pinos de Alhaurín (Alhaurín de la Torre);3 habs.;116 m²;Clarosan real estate group vende fabuloso chalet adosado a estrenar de 116 m² en alhaurín de la torre, málaga. La vivienda se dist...;36.663490618;-4.586389152;3 baños;;malaga
280.000 €;Casa adosada en calle de la Parra, 12;/comprar/casa_adosada-alora_centro_urbano-43418186588_100500/;Álora;7 habs.;394 m²;Fantástica casa señorial en alora, bien conservada, con techos altos, bodega, bonitas vistas desde sus terrazas, ubicado en una de...;36.8223;-4.70705;2 baños;;malaga
370.000 €;;/comprar/piso-capuchinos_la_goleta_el_molinillo_segalerva29014-42512106871_100200/;Capuchinos-La Goleta-El Molinillo-Segalerva (Distrito Centro. Málaga Capital);4 habs.;113 m²;"Zona alameda de capuchinos

Piso en reformas totalmente! Se entrega amueblado y equipado.
Distribuido en 4 dormitorios, 2 baños, s...";36.7310476;-4.4181748;2 baños;1ª planta;malaga
255.000 €;;/comprar/chalet-velez_malaga_nucleo_urbano29700-45059246936_108500/;Núcleo Urbano (Vélez-Málaga);5 habs.;398 m²;Casa construida en 1859, en buen estado estructural y de cubierta. Fue casa de familia y desde 1.970 a 2.000, aproximadamente fue ...;36.7850309;-4.1051359;1 baño;;malaga
380.000 €;;/comprar/chalet-velez_malaga_nucleo_urbano29700-90848359877_108500/;Núcleo Urbano (Vélez-Málaga);5 habs.;387 m²;Amplia y estupenda casa situada en el centro histórico de vélez málaga, a escasos metros de la iglesia de san juan. Desde la terra...;36.782514261;-4.103215787;2 baños;;malaga
1.650.000 €;;/comprar/chalet-puerto_marina29630-42597959142_108900/;Puerto Marina (Distrito Benalmádena Costa. Benalmádena);4 habs.;902 m²;Las perlas de benalmádena es una magnífica  promoción de 5 villas contemporánea y absolutamente única, situada a 200 m de la playa...;36.5942917;-4.5219291;4 baños;;malaga
289.000 €;;/comprar/casa_adosada-coin_las_huertas-45085956767_100500/;Las Huertas (Coín);4 habs.;172 m²;Ahora puedes tomar la mejor decisión de tu vida: mudarte a un adosado de 172 m² en coín. Desde el momento en el que abras la puert...;40.4533483;-3.6094126;4 baños;;malaga
250.000 €;;/comprar/duplex-fuengirola_centro-40926281820_100500/;Centro (Fuengirola);3 habs.;116 m²;Amplio dúplex a 5 minutos a pie al centro de fuengirola, os presentamos un piso amplio, de esos que ya no quedan, ubicado en un pe...;36.5413335;-4.6283576;2 baños;2ª planta;malaga
683.000 €;Apartamento en Supermanzana Jkl Sn - Nueva Andalucía,  Sn;/comprar/apartamento-los_naranjos_las_brisas29660-35050156365_109700/;Los Naranjos-Las Brisas (Distrito Nueva Andalucía. Marbella);3 habs.;146 m²;Obra nueva rehabilitada. Be aloha, exclusivo residencial situado en el ambiente selecto de nueva andalucía. Consta de 10 bloques c...;36.5137;-4.97101;2 baños;;malaga
220.000 €;;/comprar/apartamento-benalmadena_pueblo_centro-45031747601_106700/;Centro (Distrito Benalmádena Pueblo. Benalmádena);2 habs.;90 m²;"Ubicación inmejorable 
Este encantador piso está situado en pleno corazón de benalmádena pueblo, frente al ayuntamiento. La ubicac...";36.595794475;-4.572560271;2 baños;;malaga
220.000 €;;/comprar/chalet-arenas_de_velez-35093749147_100500/;Arenas de Vélez (Arenas);2 habs.;80 m²;Casa de campo compuesta de 2 plantas: arriba salon y habitación como despacho, abajo pequeño salón- cocina y un dormitorio. Dispon...;36.815117953;-4.043871768;2 baños;;malaga
240.000 €;;/comprar/piso-centro_huerta_nueva-44193560352_100500/;Huerta Nueva (Distrito Centro. Estepona);3 habs.;93 m²;Nueva vivienda de 3 dormitorios a la venta en la mejor zona de estepona, el área de huerta nueva. Es la zona más demandada de la c...;36.4236093;-5.152656;2 baños;4ª planta;malaga
281.000 €;;/comprar/apartamento-parque_central-43365472478_100500/;Parque Central (Distrito Centro. Estepona);2 habs.;110 m²;Bonito apartamento situado en la avd. Juan carlos i, junto a todos los servicios y comodidades necesarias para la vida cotidiana, ...;36.4267385;-5.1545511;2 baños;4ª planta;malaga
280.000 €;Piso en calle Ronda de Andalucia, 8;/comprar/piso-caleta_de_velez_lagos-25899098414_516822/;Caleta de Vélez-Lagos (Vélez-Málaga);2 habs.;86 m²;Apartamento-piso en una de las mejores zonas de caleta de vélez en primera linea de playa, junto al paseo marítimo y puerto deport...;36.77384768885076;-4.098204157681669;1 baño;2ª planta;malaga
169.000 €;;/comprar/piso-rincon_de_la_victoria_la_cala_del_moral29720-45025238631_101800/;La Cala del Moral (Rincón de la Victoria);1 hab.;53 m²;Oportunidad.  A pocos metros de la playa en la cala del moral le ofrecemos en exclusiva piso con 1 dormitorio, baño completo, saló...;36.7185815;-4.3018135;1 baño;1ª planta;malaga
336.900 €;Piso en Avenida del Sol,  s/n;/comprar/piso-velez_malaga_torre_del_mar29740-4426699220_109700/;Torre del Mar (Vélez-Málaga);3 habs.;125 m²;Portal 1, 1º a. Piso en un inmueble de obra nueva de 125 m² de superficie construida y situado en la zona de vélez-málaga, acomoda...;36.75049;-4.0891153;2 baños;1ª planta;malaga
995.000 €;Ático en Urbanización Nueva Andalucía J,  9;/comprar/atico-los_naranjos_las_brisas29660-3146219116_109700/;Los Naranjos-Las Brisas (Distrito Nueva Andalucía. Marbella);3 habs.;122 m²;B11-at-6. Ático en una finca de obra nueva de 122 m² de superficie construida y emplazado en la zona de marbella. Está dispuesto e...;36.505452;-4.9732447;2 baños;;malaga
649.000 €;;/comprar/atico-casares_costa29690-25040837765_109300/;Casares Costa (Casares);2 habs.;91 m²;Este impresionante ático se encuentra en casares playa, casares, málaga. Con una superficie construida de 91.42m² y una superficie...;36.375062437;-5.227205855;2 baños;;malaga
235.000 €;;/comprar/piso-torreblanca_del_sol-43361877115_100500/;Torreblanca del Sol (Fuengirola);2 habs.;70 m²;Se vende estupendo piso en la zona de los pacos,  los boliches, fuengirola, en una urbanización tranquila con maravillosas zonas c...;36.5664345;-4.6117285;2 baños;1ª planta;malaga
445.000 €;;/comprar/piso-la_aurora_la_alameda29006-44262572896_524961/;La Aurora-La Alameda (Distrito Cruz de Humilladero. Málaga Capital);4 habs.;167 m²;¡Redpiso te presenta una increíble oportunidad de vivienda en el vibrante vecindario de cruz de humilladero, con trastero y plaza ...;36.7144474;-4.4346885;2 baños;4ª planta;malaga
149.900 €;;/comprar/piso-platero_el_limon-45017846460_100200/;Platero-El Limón (Alhaurín de la Torre);1 hab.;37 m²;"¡Última vivienda disponible de la nueva promoción en la zona del limón!
Tecnocasa presenta este estudio de obra nueva con ascensor...";36.659979677;-4.566716622;1 baño;1ª planta;malaga
259.900 €;;/comprar/piso-cruz_de_humilladero_carranque29007-45857413503_100200/;Carranque (Distrito Cruz de Humilladero. Málaga Capital);3 habs.;106 m²;Piso en inmejorable zona que consta de: 3 dormitorios amplios, 2 baños (uno completo y otro actualmente como aseo), amplio salón l...;36.7205028;-4.4332261;;;malaga
447.000 €;Piso en calle Joaquín Turina,  s/n;/comprar/piso-el_consul_el_romeral_la_colonia_santa_ines29010-4301898885_109700/;El Cónsul-El Romeral-La Colonia Santa Inés (Distrito Teatinos-Universidad. Málaga Capital);3 habs.;117 m²;Portal 5, 1ª A. Piso en una finca de obra nueva de 117 m2 de superficie construida y emplazado en la zona de Málaga Capital, posicionado en planta 1. Está dispuesto en 3 habitaciones, 2 baños completos, terraza y dispone de certificación energética B. Cuenta como extras garaje y trastero.;36,724932;-4,4641854;2 baños;1ª planta;malaga
197.000 €;Ático en calle Algatocín,  s/n;/comprar/atico-mijas_las_lagunas29651-4495923713_109700/;Las Lagunas (Mijas);;;Ático a. Ático en un inmueble de obra nueva y situado en la zona de mijas, acomodado en planta ático. Está estructurado en terraza...;36.535688975;-4.638194905;;;malaga
680.000 €;;/comprar/chalet-playa_bahia_dorada-45050830526_525341/;Playa Bahía Dorada (Estepona);3 habs.;162 m²;Os presentamos este chalet ubicado en buenas noches a unos minutos en coche de estepona y sabinillas. Con abundante luz natural de...;36.3959563;-5.2079158;2 baños;;malaga
149.000 €;;/comprar/piso-carlos_haya29010-44215722752_101800/;Carlos Haya (Distrito Bailén-Miraflores. Málaga Capital);3 habs.;56 m²;¡Bienvenido a tu próximo capítulo de vida! Este encantador piso no es solo una vivienda, es un hogar lleno de luz y calidez, listo...;36.7237231;-4.4503951;1 baño;1ª planta;malaga
220.000 €;;/comprar/piso-centro_casco_antiguo-17565645848_514629/;Casco Antiguo (Distrito Centro. Estepona);2 habs.;78 m²;!!!!!!! Magnífico piso con orientación sur con amplias vistas y en el centro casco antiguo de estepona y bastante amplio y luminos...;36.4283094;-5.1437464;1 baño;3ª planta;malaga
430.250 €;;/comprar/apartamento-casares_costa29690-39170780024_109300/;Casares Costa (Casares);2 habs.;116 m²;Este apartamento en planta baja se encuentra en una ubicación privilegiada en casares playa, casares, málaga. Consta de 2 dormitor...;36.375032202;-5.22712418;3 baños;Bajo;malaga
100.000 €;;/comprar/piso-mijas_las_lagunas29651-44187245166_100200/;Las Lagunas (Mijas);1 hab.;32 m²;"¡Bajo en venta en las flores!
Piso en planta baja de 32 m²; 1 dormitorios; salon; cocina americana y 1 baño.
Zona rodeada de todo ...";36.541434292;-4.637197173;1 baño;;malaga
195.000 €;;/comprar/casa_adosada-manilva_nucleo29691-43333426733_100200/;Núcleo (Manilva);3 habs.;116 m²;Esta encantadora casa de tres plantas se encuentra en el pintoresco pueblo de manilva, en la hermosa región de andalucía. Con su e...;36.37792222;-5.254695254;3 baños;;malaga
218.000 €;Piso en El Peñoncillo;/comprar/piso-el_penoncillo-3189129608_109700/;El Peñoncillo (Torrox);2 habs.;103 m²;Vi-p1-1-a. Piso en una finca de obra nueva de 103 m² de superficie construida y emplazado en la zona de torrox, posicionado en pla...;36.7311626;-3.9494802;2 baños;1ª planta;malaga
386.000 €;Ático en calle Casarabonela, 1;/comprar/atico-el_paraiso_atalaya_benamara-41725027005_100500/;El Paraíso-Atalaya-Benamara (Estepona);3 habs.;193 m²;"Espectacular atico duplex en esquina, urbanización cortijo del mar resort

Distribución: planta entrada: hall de entrada con acces...";36.4716;-5.02342;3 baños;;malaga
238.000 €;Chalet en Carretera Periana Mondron;/comprar/chalet-periana_centro_urbano-43369388758_100500/;Periana;7 habs.;289 m²;Esta vivienda independiente tiene una parcela de 1.437 m² con árboles frutales, olivos, espacio para huerto, corral de unos 10 m² ...;36.9392;-4.22853;;;malaga
345.000 €;;/comprar/apartamento-centro_casco_antiguo-41757166478_100500/;Casco Antiguo (Distrito Centro. Estepona);2 habs.;63 m²;Ubicado en el corazón de estepona, este encantador apartamento de 2 habitaciones y 1 baño. Con una superficie de 62 m² y completam...;36.4262936;-5.1426724;1 baño;3ª planta;malaga
269.000 €;;/comprar/piso-camino_de_suarez29009-43392263278_106000/;Camino de Suárez (Distrito Bailén-Miraflores. Málaga Capital);3 habs.;139 m²;"Amplia vivienda con opción a garaje, en la zona de eugenio gross.

La vivienda consta de 3 maravillosos dormitorios y dos cuarto d...";36.7240341;-4.4356397;2 baños;10ª planta;malaga
220.000 €;;/comprar/piso-velez_malaga_torre_del_mar29740-44248568116_100500/;Torre del Mar (Vélez-Málaga);2 habs.;85 m²;"2v-341 piso 2 dormitorios terraza y parking.

Posibilidad de adquirir 2º plaza de aparcamiento y trastero precio 260.000 €.

Acoge...";36.7450935;-4.0966668;2 baños;1ª planta;malaga
1.175.000 €;;/comprar/atico-cabopino_reserva_de_marbella-30865506986_100500/;Cabopino-Reserva de Marbella (Distrito Las Chapas. Marbella);4 habs.;353 m²;¡Propidad única! Ático tríplex con vistas al mar ubicado en artola baja, cerca de la costa y con una impresionante terraza descubi...;36.4892132;-4.7524141;4 baños;;malaga
985.000 €;;/comprar/casa_adosada-parque_clavero29016-34205785045_106000/;Parque Clavero (Distrito Este. Málaga Capital);5 habs.;245 m²;Magnifico chalet adosado en la zona mas tranquila de parque clavero con cinco dormitorios, tres baños, un aseo, salón comedor, coc...;36.7255682;-4.3915857;4 baños;;malaga
1.100.000 €;;/comprar/piso-mijas_costa_la_cala_de_mijas-43407255251_100500/;La Cala de Mijas (Distrito Mijas Costa. Mijas);2 habs.;120 m²;"Apartamentos y áticos de 1 a 3 dormitorios con magníficas vistas al mar.

Royal palms mijas ofrece impresionantes apartamentos y á...";36.503395009;-4.687633731;2 baños;Bajo;malaga
399.000 €;;/comprar/piso-playamar_benyamina-42566318999_108900/;Playamar-Benyamina (Torremolinos);1 hab.;105 m²;"Situado en torremolinos, zona playamar ofrecemos este espectacular apartamento a tan sólo 3 minutos andando de la playa.

Cuenta c...";36.6275847;-4.4936129;1 baño;;malaga
