precio;sub_descr;href;ubicacion;habitaciones;banios;mt2;planta;otros;latitude;longitude;CCAA
120.000 竄ｬ;;/comprar/piso-la_paz_segunda_aguado_loreto11011-44173992232_100500/;La Paz-Segunda Aguado-Loreto (Cﾃ｡diz Capital);3 habs.;1 baﾃｱo;48 mﾂｲ;2ﾂｪ planta;"Inmonline cadiz - real estate presenta esta coqueta y luminosa vivienda en exclusiva  en la zona de puntales.

Se trata de una seg...";36.507016829;-6.266322196;cadiz
360.000 竄ｬ;;/comprar/chalet-mogarizas_las_rapaces-26698548730_100500/;Mogarizas-Las Rapaces (Chiclana de la Frontera);4 habs.;3 baﾃｱos;380 mﾂｲ;;"Chalet con casa de invitados,  en parcela segregada de 3.600 metros, con piscina  a 2 km de chiclana 
 Busca un chalet donde vivir...";36.401726337;-6.146563267;cadiz
380.000 竄ｬ;;/comprar/casa-centro_zona_playas-39236614145_100500/;Centro-Zona Playas (Chipiona);3 habs.;2 baﾃｱos;251 mﾂｲ;;"Magnifica casa en zona cruz del mar , con 3 plantas : en la planta baja disponemos de un gran garaje con 2 dependencias
En la prim...";36.740807894;-6.436481993;cadiz
254.990 竄ｬ;;/comprar/atico-chipiona_la_laguna-36751470113_100500/;La Laguna (Chipiona);2 habs.;2 baﾃｱos;136 mﾂｲ;;Od622. ﾂｿSueﾃｱas con vivir en un espacio ﾃｺnico, con vistas espectaculares y todas las comodidades del mundo? ﾂ｡Este ﾃ｡tico es tu oport...;36.7200591;-6.4336742;cadiz
280.000 竄ｬ;;/comprar/casa-este11406-45899495018_100500/;Este (Jerez de la Frontera);3 habs.;3 baﾃｱos;258 mﾂｲ;;"Casa en muy buena zona que cuenta con planta baja totalmente diﾃ｡fana con dos baﾃｱos y patio donde poder montar su negocio.
La vivie...";36.687839;-6.109663;cadiz
85.000 竄ｬ;;/comprar/casa_adosada-vejer_de_la_frontera_centro_urbano-44257777715_100500/;Vejer de la Frontera;3 habs.;1 baﾃｱo;66 mﾂｲ;;Del valle inmobiliaria os presenta en exclusiva esta estupenda casa reformada en la pedanﾃｭa de poblado varelo, a tan solo 15 minut...;36.249520032;-5.887491349;cadiz
350.000 竄ｬ;;/comprar/casa-centro_zona_noreste-36714167839_100500/;Centro-Zona Noreste (Chipiona);3 habs.;2 baﾃｱos;350 mﾂｲ;;A01267 quieres montar un negocio en chipiona y te gustarﾃｭa tener juntos la casa y el trabajo ?ﾂｿ?  O prefieres tener bajo casa una ...;36.7281851;-6.4252178;cadiz
169.000 竄ｬ;;/comprar/piso-el_mentidero_teatro_falla_alameda11003-42568949105_100500/;El Mentidero-Teatro Falla-Alameda (Cﾃ｡diz Capital);1 hab.;1 baﾃｱo;57 mﾂｲ;1ﾂｪ planta;"ﾂ｡Nueva promociﾃｳn de viviendas de 1 y 2 dormitorios!

Os presentamos esta nueva promociﾃｳn de 12 viviendas rehabilitadas y personali...";36.5338191;-6.2997607;cadiz
395.000 竄ｬ;;/comprar/casa_adosada-camposoto_gallineras11100-42588781772_100200/;Camposoto-Gallineras (San Fernando);;;200 mﾂｲ;;"Camposoto: espectacular unifamiliar de 4 plantas con aire centralizado, consta de
Planta sﾃｳtano: garaje (para dos coches)y traster...";36.4451047;-6.2097017;cadiz
92.900 竄ｬ;;/comprar/piso-la_banda_campo_de_futbol-43417348705_100500/;La Banda-Campo de Fﾃｺtbol (Chiclana de la Frontera);2 habs.;1 baﾃｱo;68 mﾂｲ;1ﾂｪ planta;Tenemos el placer de presentarles este maravilloso piso en venta ubicado en la zona de huerta rosario, en chiclana de la frontera....;36.4168524;-6.1374007;cadiz
257.000 竄ｬ;;/comprar/piso-playa_de_las_tres_piedras_costa_ballena-39259498766_990821/;Playa de las Tres Piedras-Costa Ballena (Chipiona);2 habs.;2 baﾃｱos;85 mﾂｲ;1ﾂｪ planta;Excelente piso en cuanto a calidades se refiere, solerﾃｭa de piedra natural , cocina y baﾃｱos con mﾃ｡rmol y estuco, ventanas de alumi...;36.694761367;-6.41608217;cadiz
399.000 竄ｬ;;/comprar/casa-nucleo_urbano_urbanizaciones-35930197925_100500/;Nﾃｺcleo Urbano-Urbanizaciones (Chiclana de la Frontera);4 habs.;3 baﾃｱos;226 mﾂｲ;;"Estﾃ｡s buscando una casa en pleno centro de chiclana? Esta es perfecta para ti!

Casa seﾃｱorial en centro urbano con 276 mﾂｲ construi...";36.4194723;-6.1502653;cadiz
250.000 竄ｬ;;/comprar/chalet-centro_zona_noreste-44204634881_100500/;Centro-Zona Noreste (Chipiona);5 habs.;4 baﾃｱos;160 mﾂｲ;;Od1116. Imagﾃｭnate vivir en una zona tranquila, donde lo que oigas todos los dﾃｭas sean los cantos de los pﾃ｡jaros en una gran vivien...;36.7285445;-6.422082;cadiz
150.000 竄ｬ;;/comprar/piso-puerto_real_centro_urbano-45908960118_100500/;Puerto Real;3 habs.;1 baﾃｱo;103 mﾂｲ;4ﾂｪ planta;Vivienda cﾃｩntrica  muy luminosa de tres dormitorios , con baﾃｱo completo , cocina equipada, amplio salﾃｳn, y con ascensor. Esta cerc...;36.5312586;-6.1946154;cadiz
140.000 竄ｬ;;/comprar/casa-vejer_de_la_frontera_centro_urbano-34176570675_521333/;Vejer de la Frontera;2 habs.;1 baﾃｱo;60 mﾂｲ;;Casa en planta baja en el centro de vejer. 2 dormitorios y 1 baﾃｱo. Completamente amueblada y con mucho gusto.tiene licencia de alq...;36.2539856;-5.9620657;cadiz
61.500 竄ｬ;;/comprar/casa_adosada-benalup_casas_viejas_centro_urbano-42537823615_100200/;Benalup-Casas Viejas;3 habs.;;97 mﾂｲ;;Vivienda tipo unifamiliar situada en san josﾃｩ de malcocinado, medina sidonia, estupenda ubicaciﾃｳn muy cercana a servicios esencia...;36.343220947;-5.817619155;cadiz
99.000 竄ｬ;;/comprar/piso-jerez_de_la_frontera_oeste11407-45922400086_108900/;Oeste (Jerez de la Frontera);3 habs.;2 baﾃｱos;90 mﾂｲ;;Piso en jerez de la frontera, zona hospital, la vivienda se encuentra distribuida en 3 habitaciones, 2 cuartos de baﾃｱo, salﾃｳn come...;36.698632485;-6.141149022;cadiz
370.000 竄ｬ;;/comprar/chalet-centro_zona_noreste-44183948116_104700/;Centro-Zona Noreste (Chipiona);4 habs.;3 baﾃｱos;194 mﾂｲ;;La oportunidad de comprar la vivienda de tus sueﾃｱos, este espectacular chalet se encuentra en valdeconejos - montijo, en una urban...;36.757996456;-6.405688275;cadiz
550.000 竄ｬ;Dﾃｺplex en calle de la Sierra del Retﾃｭn,  s/n;/comprar/duplex-zahara_de_los_atunes-4585082602_109700/;Zahara de los Atunes (Barbate);3 habs.;3 baﾃｱos;130 mﾂｲ;Bajo;Dﾃｺplex en un edificio de obra nueva de 130 m2 de superficie construida y ubicado en la zona de Zaragoza Capital, enclavado en planta baja. Estﾃ｡ distribuido en 3 habitaciones, 3 baﾃｱos completos y terraza. Incluye extras como ascensor, garaje y trastero.;36,1354248;-5,8412992;cadiz
230.283 竄ｬ;Piso en calle de Santa Ana, 5;/comprar/piso-nucleo_urbano_urbanizaciones-3882200378_109700/;Nﾃｺcleo Urbano-Urbanizaciones (Chiclana de la Frontera);3 habs.;2 baﾃｱos;115 mﾂｲ;Bajo;Tipo 5 (1.3). Piso en un inmueble de obra nueva de 115 mﾂｲ de superficie construida y situado en la zona de chiclana de la frontera...;36.4166266;-6.1488695;cadiz
1.300.000 竄ｬ;;/comprar/casa-el_puerto_de_santa_maria_vistahermosa-45002331571_265000/;Vistahermosa (El Puerto de Santa Marﾃｭa);5 habs.;4 baﾃｱos;500 mﾂｲ;;En venta esta espaciosa casa en el puerto de santa marﾃｭa, con una superficie total de 500 mﾂｲ construida sobre un solar de 1000 mﾂｲ....;36.5854414;-6.2623925;cadiz
995.000 竄ｬ;Chalet en Carretera de la Barrosa, 29;/comprar/chalet-costa_de_sancti_petri_playa_de_la_barrosa11139-33431382072_100500/;Costa de Sancti Petri-Playa de La Barrosa (Chiclana de la Frontera);3 habs.;4 baﾃｱos;230 mﾂｲ;;Exclusivo chalet a estrenar en la zona del coto de san josﾃｩ, chiclana de la frontera. Zona residencial, a escasos 800 metros de la...;36.3799;-6.19073;cadiz
510.000 竄ｬ;;/comprar/finca_rustica-benalup_casas_viejas_centro_urbano-41708845859_105600/;Benalup-Casas Viejas;2 habs.;2 baﾃｱos;195 mﾂｲ;;"Descripciﾃｳn del objeto:
Preciosa finca de 4,6 ha con casa y 2 naves grandes (ideal para amantes de los caballos)

-	~ 46.000 mﾂｲ te...";36.3498354;-5.8067525;cadiz
296.300 竄ｬ;;/comprar/chalet_adosado-jerez_de_la_frontera_centro11407-45071066586_521333/;Centro (Jerez de la Frontera);4 habs.;4 baﾃｱos;215 mﾂｲ;;"Adosado 4 dormitorios- zona el altillo colegio ingles. -
Magnifico adosado muy amplio de 4 dormitorios. En la planta de entrada te...";36.7049436;-6.1243091;cadiz
250.000 竄ｬ;;/comprar/atico-el_mentidero_teatro_falla_alameda11003-42525936749_100500/;El Mentidero-Teatro Falla-Alameda (Cﾃ｡diz Capital);2 habs.;2 baﾃｱos;80 mﾂｲ;;Inmobiliaria vivencadiz os presenta este espectacular ﾃ｡tico, ubicado en una de las mejores zonas del centro, te ofrece un estilo d...;36.5353575;-6.2982215;cadiz
415.000 竄ｬ;;/comprar/chalet-nucleo_urbano_urbanizaciones-41763028668_100500/;Nﾃｺcleo Urbano-Urbanizaciones (Chiclana de la Frontera);4 habs.;4 baﾃｱos;225 mﾂｲ;;"Espectacular chalet a menos de 10 min de la playa de la barrosa y a 5 min del centro de chiclana.

Mas de 200 mﾂｲ construidos en un...";36.407174;-6.1617039;cadiz
299.900 竄ｬ;;/comprar/chalet-pago_del_humo_poligono_de_pelagatos-44202569571_100500/;Pago del Humo-Polﾃｭgono de Pelagatos (Chiclana de la Frontera);3 habs.;2 baﾃｱos;137 mﾂｲ;;Chalet en chiclana de la frontera zona hozanejos, 137 m. De superficie, 1030 m. Superficie parcela,  una habitaciﾃｳn doble y 2 habi...;36.3664242;-6.1022273;cadiz
325.000 竄ｬ;;/comprar/casa_unifamiliar-la_jara_distrito-44222879996_100200/;La Jara (Sanlﾃｺcar de Barrameda);;2 baﾃｱos;150 mﾂｲ;;"Casa con jardin en la jara.
Os traemos esta magnifica casa con jardin, situada en la c/viento del sur, la zona mas conocida como l...";36.7693282;-6.3697595;cadiz
698.000 竄ｬ;;/comprar/casa-el_puerto_de_santa_maria_vistahermosa-44197475893_265000/;Vistahermosa (El Puerto de Santa Marﾃｭa);4 habs.;3 baﾃｱos;216 mﾂｲ;;Encantadora casa en venta  en la zona de vistahermosa, en el puerto de santa marﾃｭa. Con una superficie total de 216 mﾂｲ y una super...;36.5899722;-6.2539444;cadiz
125.000 竄ｬ;;/comprar/piso-victoria_el_juncal-45016496151_104700/;Victoria-El Juncal (El Puerto de Santa Marﾃｭa);3 habs.;1 baﾃｱo;80 mﾂｲ;;"Puerto playa&nbsp; pone a la venta este precioso y luminoso piso de 3 dormitorios y un&nbsp; baﾃｱo en una buena zona del puerto de ...";36.609814;-6.2153356;cadiz
450.000 竄ｬ;;/comprar/casa-el_puerto_de_santa_maria_centro-42523822366_100500/;Centro (El Puerto de Santa Marﾃｭa);6 habs.;4 baﾃｱos;343 mﾂｲ;;Se vende, edificio entero dividido tres plantas,  dos viviendas independientes, en total tres plantas, planta baja es un local que...;36.6023574;-6.2234663;cadiz
87.000 竄ｬ;;/comprar/piso-jerez_de_la_frontera_oeste11404-45851599170_108900/;Oeste (Jerez de la Frontera);4 habs.;1 baﾃｱo;87 mﾂｲ;;"Piso en jerez de la frontera, zona oeste, los naranjos, la vivienda&nbsp; consta&nbsp; de 4 habitaciones, 1 cuarto de baﾃｱo, salﾃｳn ...";36.6927068;-6.1471398;cadiz
249.000 竄ｬ;;/comprar/casa_adosada-rural11406-40926823656_101800/;Rural (Jerez de la Frontera);3 habs.;2 baﾃｱos;185 mﾂｲ;;Adosado zona cartuja. Primeras calidades, patio delantero de unos 17 mﾂｲ, distribuciﾃｳn en planta baja con amplio salﾃｳn comedor con ...;36.6638113;-6.1161712;cadiz
240.000 竄ｬ;;/comprar/piso-la_caleta_la_vina11002-42523564326_100500/;La Caleta-La Viﾃｱa (Cﾃ｡diz Capital);4 habs.;1 baﾃｱo;109 mﾂｲ;8ﾂｪ planta;"Inmonline cadiz - real estate presenta esta vivienda situada cerca del campo del sur y a 5 minutos de la playa de la caleta.

Disf...";36.5284371;-6.3044934;cadiz
130.000 竄ｬ;;/comprar/piso-nucleo_urbano_urbanizaciones-44180644635_100500/;Nﾃｺcleo Urbano-Urbanizaciones (Chiclana de la Frontera);2 habs.;1 baﾃｱo;59 mﾂｲ;2ﾂｪ planta;Amplio piso situado en la zona residencial de fuente amarga, chiclana. Este inmueble se encuentra rodeado de una amplia variedad d...;36.410924948;-6.147906949;cadiz
235.000 竄ｬ;;/comprar/piso-rota_zona_norte11520-45001074359_109300/;Zona Norte (Rota);2 habs.;2 baﾃｱos;78 mﾂｲ;1ﾂｪ planta;"ﾂｿEstﾃ｡s buscando algo semi-nuevo?

Aquﾃｭ disponemos de este piso  en  la urbanizaciﾃｳn jardines del lago.  Costa ballena.

Primera pl...";36.690970565;-6.414564017;cadiz
275.000 竄ｬ;Casa adosada en calle Mar Adriﾃ｡tico, 5;/comprar/casa_adosada-costa_de_sancti_petri_playa_de_la_barrosa11139-42519305028_100500/;Costa de Sancti Petri-Playa de La Barrosa (Chiclana de la Frontera);2 habs.;2 baﾃｱos;60 mﾂｲ;;Descubre este hermoso adosado, recientemente renovado, ubicado en la prestigiosa urbanizaciﾃｳn doﾃｱa violeta. Perfecto como segunda ...;36.3787;-6.18308;cadiz
155.500 竄ｬ;;/comprar/piso-centro_historico_la_costilla-43336630967_100500/;Centro Histﾃｳrico-La Costilla (Rota);2 habs.;1 baﾃｱo;74 mﾂｲ;1ﾂｪ planta;Ahora es tu momento de independizarte o de tener un piso en la playa!!! Zona rotonda de las manos, cerquita de la costilla, con to...;36.624315;-6.3589892;cadiz
239.990 竄ｬ;;/comprar/casa-nucleo_urbano_urbanizaciones-37592186885_100500/;Nﾃｺcleo Urbano-Urbanizaciones (Chiclana de la Frontera);4 habs.;2 baﾃｱos;146 mﾂｲ;;ﾂｿBuscas una vivienda donde desconectar del dﾃｭa a dﾃｭa? Su gran terraza te permite disfrutar de la tranquilidad que brinda la zona, ...;36.4151105;-6.1527398;cadiz
235.000 竄ｬ;;/comprar/chalet_adosado-camposoto_gallineras11100-45005202475_527956/;Camposoto-Gallineras (San Fernando);3 habs.;3 baﾃｱos;131 mﾂｲ;;Casa adosada en venta en san fernando, cuenta con una superficie de 131 mﾂｲ construidos (segﾃｺn catastro, faltan los metros de sﾃｳtan...;36.4444547;-6.2106649;cadiz
155.000 竄ｬ;;/comprar/casa-este-38387805153_522800/;Este (Jerez de la Frontera);4 habs.;2 baﾃｱos;193 mﾂｲ;;"Finca urbana dividida en 2 apartamentos , garaje , 2 trasteros y azotea .
En planta baja cuenta con el garaje con trastero de unos...";36.6800579;-6.113185;cadiz
110.000 竄ｬ;;/comprar/duplex-jerez_de_la_frontera_centro11404-42514027662_103800/;Centro (Jerez de la Frontera);2 habs.;1 baﾃｱo;65 mﾂｲ;1ﾂｪ planta;Estupendo dﾃｺplex de dos dormitorio salﾃｳn con cocina y un baﾃｱﾃｳ, un dormitorio en la planta baja y otro en la parte de arriba, en el...;36.6889625;-6.141911;cadiz
187.000 竄ｬ;Piso en calle Sﾃｩneca, 4;/comprar/piso-jerez_de_la_frontera_norte11407-45059082195_522800/;Norte (Jerez de la Frontera);3 habs.;2 baﾃｱos;90 mﾂｲ;3ﾂｪ planta;Piso de tres dormitorios de 75 mﾂｲ , salﾃｳn comedor con terraza y vistas a la piscina y zonas comunes , cuarto de baﾃｱo con placa duc...;36.710842;-6.1067834;cadiz
185.000 竄ｬ;;/comprar/piso-jerez_de_la_frontera_norte11407-45088170404_526975/;Norte (Jerez de la Frontera);4 habs.;2 baﾃｱos;90 mﾂｲ;1ﾂｪ planta;Se vende un acogedor piso en la zona norte de jerez de la frontera, en el 1ﾂｺ piso de un edificio con ascensor. Con una superficie ...;36.7002293;-6.1246979;cadiz
474.900 竄ｬ;;/comprar/chalet-noreste11405-31732597511_103800/;Noreste (Jerez de la Frontera);4 habs.;2 baﾃｱos;200 mﾂｲ;;Chalet pareado en chapﾃｭn, concretamente en  residencial recreo luzelma a escasos 10 minutos del centro dela ciudad, tiene una parc...;36.6883036;-6.1232737;cadiz
450.000 竄ｬ;;/comprar/casa_unifamiliar-centro_calzada-45889936115_100200/;Centro-Calzada (Sanlﾃｺcar de Barrameda);;;750 mﾂｲ;;"Casa independiente con garaje en el centro 
Hoy os traemos esta magnifica casa independiente con garaje, en pleno centro, concreta...";36.7782291;-6.3511859;cadiz
180.000 竄ｬ;;/comprar/casa-puerto_real_centro_urbano-37534040120_100500/;Puerto Real;3 habs.;2 baﾃｱos;140 mﾂｲ;;Casa en el centro en planta baja, con tres dormitorios , salﾃｳn , baﾃｱo completo , cocina equipada y aseo, patio central con montera...;36.527758834;-6.191095945;cadiz
148.500 竄ｬ;;/comprar/casa_adosada-san_garcia_getares-44256397764_100500/;San Garcﾃｭa-Getares (Algeciras);3 habs.;2 baﾃｱos;140 mﾂｲ;;ﾂ｡Descubre tu prﾃｳximo hogar en getares! Se vende impresionante casa / chalet adosado de tres plantas, ubicada en una de las zonas m...;36.1075853;-5.4473418;cadiz
460.000 竄ｬ;Piso en calle Cﾃ｡novas del Castillo, 24;/comprar/piso-cadiz_capital_centro_historico11001-43367189167_511045/;Centro Histﾃｳrico (Cﾃ｡diz Capital);2 habs.;2 baﾃｱos;89 mﾂｲ;2ﾂｪ planta;Este encantador piso en venta se encuentra en el centro histﾃｳrico de cﾃ｡diz capital, en una segunda planta. Cuenta con una superfic...;36.533855;-6.2970824;cadiz
178.563 竄ｬ;Piso en calle Sopranis, 4;/comprar/piso-el_populo_santa_maria11005-4602944495_109700/;El Pﾃｳpulo-Santa Marﾃｭa (Cﾃ｡diz Capital);1 hab.;1 baﾃｱo;54 mﾂｲ;Bajo;Bajo B. Piso en un edificio de obra nueva de 54 m2 de superficie construida y ubicado en la zona de Cﾃ｡diz Capital, enclavado en planta baja. Estﾃ｡ distribuido en 1 habitaciﾃｳn y 1 baﾃｱo completo. Incluye extras como ascensor.;36,5294347;-6,2922188;cadiz
440.000 竄ｬ;;/comprar/duplex-san_jose_varela_la_laguna11008-45002087541_516894/;San Josﾃｩ-Varela-La Laguna (Cﾃ｡diz Capital);3 habs.;2 baﾃｱos;135 mﾂｲ;Bajo;Cadizsur servicios inmobiliarios, les presenta ﾃｩste magnﾃｭfico dﾃｺplex a estrenar, con reforma a todo lujo de detalles, ubicado en l...;36.516386;-6.2808968;cadiz
143.000 竄ｬ;;/comprar/piso-jerez_de_la_frontera_norte-35895916087_996776/;Norte (Jerez de la Frontera);1 hab.;1 baﾃｱo;63 mﾂｲ;2ﾂｪ planta;Piso en venta en urb. Pie de rey, en zona norte, consta de un dormitorio, salﾃｳn cocina y baﾃｱo. Terraza privada de 25 mﾂｲ orientaciﾃｳ...;36.7064111;-6.1253418;cadiz
170.000 竄ｬ;;/comprar/piso-jerez_de_la_frontera_centro11404-45031906597_100500/;Centro (Jerez de la Frontera);3 habs.;2 baﾃｱos;88 mﾂｲ;Bajo;"Nos complace ofrecerles este piso en exclusiva ubicado en una zona emblemﾃ｡tica de nuestra ciudad totalmente reformado.

La viviend...";36.688172;-6.1455092;cadiz
129.000 竄ｬ;;/comprar/piso-pinar_alto_crevillet_menesteo-45888929443_104700/;Pinar Alto-Crevillet-Menesteo (El Puerto de Santa Marﾃｭa);3 habs.;1 baﾃｱo;75 mﾂｲ;2ﾂｪ planta;Puerto playa pone a la venta en exclusiva este bonito piso de 3 dormitorios todo exterior muy luminoso en una de las zonas mas dem...;36.5961287;-6.2383894;cadiz
80.000 竄ｬ;;/comprar/piso-barbate_centro_urbano-6747330414_106700/;Barbate;2 habs.;1 baﾃｱo;52 mﾂｲ;;"Piso situado en el centro del pueblo

Se vende este piso cerca de supermercados , parques , colegios y a tan solo 5minutos de nues...";36.190574813;-5.927641209;cadiz
1.070.000 竄ｬ;;/comprar/finca_rustica-arcos_de_la_frontera_centro_urbano-35876335625_105600/;Arcos de la Frontera;6 habs.;5 baﾃｱos;479 mﾂｲ;;"Descripciﾃｳn del objeto:
Gepflegtes, tripadviser ausgezeichnetes boutique b&b mit mﾃｶglichkeit der pferdehaltung
Well-maintained bou...";36.7414518;-5.7930231;cadiz
A consultar;Piso en calle Juan de Acurio, 501;/comprar/piso-bonanza_martin_miguel_monteolivete11540-44168181088_109700/;Bonanza-Martﾃｭn Miguel-Monteolivete (Sanlﾃｺcar de Barrameda);;;169 mﾂｲ;;. Oportunidad de inversiﾃｳn: pendiente de posesiﾃｳn. Oportunidad de inversiﾃｳn: pendiente de inscripciﾃｳn. Oportunidad de inversiﾃｳn: i...;36.7977;-6.31963;cadiz
250.000 竄ｬ;;/comprar/piso-la_paz_segunda_aguado_loreto11012-45086254376_100500/;La Paz-Segunda Aguado-Loreto (Cﾃ｡diz Capital);3 habs.;1 baﾃｱo;75 mﾂｲ;2ﾂｪ planta;Te presentamos este magnﾃｭfico piso reciﾃｩn reformado en la cﾃｩntrica y conveniente ubicaciﾃｳn de segunda aguada, nﾃｺmero 2. Este espac...;36.5105259;-6.2751049;cadiz
480.000 竄ｬ;;/comprar/piso-playa_de_santa_maria_del_mar_bahia_blanca11007-43359064454_516894/;Playa de Santa Marﾃｭa del Mar-Bahﾃｭa Blanca (Cﾃ｡diz Capital);6 habs.;3 baﾃｱos;264 mﾂｲ;Entresuelo;"Cadizsur servicios inmobiliarios, les presenta ﾃｩste gran piso en venta en avenida andalucﾃｭa, cﾃ｡diz capital. 

Destaca por su super...";36.5243141;-6.2870008;cadiz
189.000 竄ｬ;;/comprar/piso-jerez_de_la_frontera_centro11403-43418221055_101800/;Centro (Jerez de la Frontera);3 habs.;2 baﾃｱos;106 mﾂｲ;1ﾂｪ planta;Sin comision al comprador. Piso ubicado en el centro de jerez, barrio san miguel a un minuto de la plaza del arenal, totalmente am...;36.6784412;-6.1369615;cadiz
169.000 竄ｬ;;/comprar/duplex-chipiona_la_laguna-43355017679_100500/;La Laguna (Chipiona);2 habs.;2 baﾃｱos;64 mﾂｲ;Bajo;Od1112. Vivir a 400 metros de la playa de regla no tiene precio. Tienes un dﾃｺplex a tu disposiciﾃｳn de 2 dormitorios, 2 cuartos de ...;36.7304119;-6.4356023;cadiz
253.000 竄ｬ;;/comprar/piso-jerez_de_la_frontera_norte11407-43400975966_103800/;Norte (Jerez de la Frontera);3 habs.;2 baﾃｱos;115 mﾂｲ;Bajo;Inmobiliaria carmen pozoalbero, les ofrece estupendo piso en zona norte rodeado de todo tipo de servicios colegios, supermercados ...;36.705233;-6.1203272;cadiz
280.000 竄ｬ;;/comprar/piso-el_pino_bajo_de_guia-45010941407_100500/;El Pino-Bajo de Guﾃｭa (Sanlﾃｺcar de Barrameda);3 habs.;;97 mﾂｲ;Bajo;Opotunidad ﾃｺnica . Piso en perfecto estado de conservaciﾃｳn, de construcciﾃｳn reciente, en la zona de bajo de guia, con un patio pri...;36.7865312;-6.3485324;cadiz
74.900 竄ｬ;;/comprar/piso-jerez_de_la_frontera_norte11405-45068621339_100200/;Norte (Jerez de la Frontera);2 habs.;;70 mﾂｲ;;ﾂ｡Descubre tu nuevo hogar en el corazﾃｳn de la ciudad! Este encantador piso de 70 mﾂｲ, ubicado en la primera planta, es ideal para pa...;36.6777381;-6.1299037;cadiz
135.000 竄ｬ;;/comprar/piso-centro_zona_noreste-43417669418_100500/;Centro-Zona Noreste (Chipiona);1 hab.;1 baﾃｱo;38 mﾂｲ;Bajo;Od819. ﾂ｡Descubre tu nuevo hogar! Te presentamos este acogedor apartamento en planta baja, ideal para quienes buscan comodidad, acc...;36.7355907;-6.4313129;cadiz
140.000 竄ｬ;;/comprar/piso-san_bernabe11204-45014542830_100500/;San Bernabﾃｩ (Algeciras);2 habs.;1 baﾃｱo;92 mﾂｲ;7ﾂｪ planta;"ﾃ》ico totalmente amueblado en doﾃｱa casilda.

ﾃ》ico totalmente reformado, con vistas espectaculares. Ubicado en una magnﾃｭfica urban...";36.1419103;-5.4558891;cadiz
115.000 竄ｬ;;/comprar/piso-centro_zona_noreste-45077730151_100200/;Centro-Zona Noreste (Chipiona);2 habs.;1 baﾃｱo;60 mﾂｲ;;"Zona avenida de rota.
Piso en planta baja que consta de:
- 2 amplios patios, uno de ellos con salida desde el dormitorio principal...";36.7306677;-6.4278988;cadiz
190.000 竄ｬ;;/comprar/piso-jerez_de_la_frontera_norte11405-43394199479_103800/;Norte (Jerez de la Frontera);3 habs.;2 baﾃｱos;95 mﾂｲ;;Piso  en hipercor, con 95 mﾂｲ construidos, 80 mﾂｲ ﾃｺtiles, 3 dormitorios, 2 baﾃｱos, 1 garaje/s, buen estado, exterior, planta baja, 3 ...;36.7067582;-6.110608;cadiz
750.000 竄ｬ;;/comprar/chalet-jerez_de_la_frontera_norte11407-45912612903_992777/;Norte (Jerez de la Frontera);5 habs.;3 baﾃｱos;200 mﾂｲ;;Tenemos el gusto de presentarles este impresionante chalet independiente, de una sola planta para mﾃ｡xima comodidad, ha sido comple...;36.7044476;-6.1355045;cadiz
179.900 竄ｬ;;/comprar/casa_adosada-noreste11405-44171923941_101800/;Noreste (Jerez de la Frontera);4 habs.;2 baﾃｱos;130 mﾂｲ;;"Se vende; vpo. Maravillosa unifamiliar adosada en esquina, en una de las mejores zonas para vivir en familia, rodeado de todo tipo...";36.6922872;-6.0971089;cadiz
220.000 竄ｬ;;/comprar/piso-el_puerto_de_santa_maria_centro-45879741669_514211/;Centro (El Puerto de Santa Marﾃｭa);3 habs.;2 baﾃｱos;111 mﾂｲ;1ﾂｪ planta;"ﾂ｡Descubre tu nuevo hogar en este espectacular piso de 111 mﾂｲ construidos y 85 mﾂｲ ﾃｺtiles! 

Ubicado en una tranquila y bien comunic...";36.6053904;-6.2230553;cadiz
A consultar;Chalet en calle de Canarias, 13;/comprar/chalet-la_atunara_perianez11315-43383981820_109700/;La Atunara-Periﾃ｡ﾃｱez (La Lﾃｭnea de la Concepciﾃｳn);;;35 mﾂｲ;;Gastos de notarﾃｭa gratis de hasta 500 竄ｬ para escrituras de compraventa desde el 15/07/2024 hasta el 30/09/2024. Oportunidad de inv...;36.1746;-5.33765;cadiz
139.900 竄ｬ;;/comprar/casa-noreste11405-43377024212_108900/;Noreste (Jerez de la Frontera);2 habs.;1 baﾃｱo;89 mﾂｲ;;Bonita casa de autoconstrucciﾃｳn en barriada san josﾃｩ obrero, compuesta de 2 habitaciones en planta baja, con salﾃｳn comedor corrido...;36.7044617;-6.1058249;cadiz
550.000 竄ｬ;;/comprar/piso-distrito_centro11004-5036837357_100500/;Centro Histﾃｳrico (Cﾃ｡diz Capital);5 habs.;2 baﾃｱos;188 mﾂｲ;6ﾂｪ planta;"Vivienda anclada a los aﾃｱos 90 te busca, necesita un nuevo resurgir.

Destacable:
-ventanas de climalit con aislamiento tﾃｩrmico y ...";36.5335644;-6.2947878;cadiz
186.300 竄ｬ;;/comprar/apartamento-centro_calzada-43336669000_100500/;Centro-Calzada (Sanlﾃｺcar de Barrameda);2 habs.;2 baﾃｱos;76 mﾂｲ;1ﾂｪ planta;Piso reciﾃｩn reformado ubicado en pleno centro de sanlﾃｺcar, con todas las comodidades urbanas alrededor: comercios, bancos, superme...;36.778248;-6.3527202;cadiz
650.000 竄ｬ;;/comprar/chalet-san_garcia_getares-45009218652_500832/;San Garcﾃｭa-Getares (Algeciras);5 habs.;3 baﾃｱos;386 mﾂｲ;;Se vende chalet en la zona de san garcia (algeciras) de una sola planta con 5 dormitorios, salon-comedor, cocina, 3 baﾃｱos, 2 porch...;36.1052858;-5.4377428;cadiz
275.000 竄ｬ;;/comprar/piso-cadiz_capital_centro_historico11005-43378283913_100500/;Centro Histﾃｳrico (Cﾃ｡diz Capital);2 habs.;2 baﾃｱos;119 mﾂｲ;2ﾂｪ planta;"Inmueble con carﾃ｡cter busca familia que quiera disfrutar de los encantos del centro.

Destacable:
-inmueble en muy buen estado de ...";36.5306672;-6.2951039;cadiz
